leg,site,hole,core,section,top interval depth (cm),bottom interval depth (cm),top of core depth(m),top of layer depth (m),bottom of layer depth (m), describer,lithology,color,structures,deformations due to drilling,unusual occurrences,minerals,paleontology,other observations,hardness or induration,z-coding,eodp_id
25,241,,1,1,0.0,150.0,0.00,0.00,1.50,, DIATOM BEARING FORAM RICH NANNO OOZE, 5GY6/1-GREE NISH GREY,," SOUPY,HIGHLY DISTURBED",, CARBONATE AT 75 CM,,, SOUPY BUTTERY CONSTITUENCY, 00000000,ed765455c26bc6f905a4eb1604f42bef
25,241,,1,2,0.0,150.0,0.00,1.50,3.00,, NANNO OOZE," 5GY6/1-GREENISH GREY,N7-LIGHT GREY TO N5-MEDIUM GREY", VERTICAL STREAKS SUGGEST PRESENCE O F HORIZONTAL BEDDING DEFINED BY COLORS LIGHT GREY AN O MEDIUM GREY, SOUPY TO 80 CM SOFT TO VERY SOFT FRO M 80 TO 150 CM,, PYRITE,, NO BEDDING VISSIBLE APPARE NTLY HOMOGENIZED, SOUPY TO 80 CM SOFT TO VERY SOFT FROM 80 TO 150 CM, 00000000,3d9be9b530aa412d99e953c31ce1c7b1
25,241,,1,3,0.0,150.0,0.00,3.00,4.50,, NANNO OOZE," N7-LIGHT GREY,N5-MED GREY,5GY6/1-GREE NISH GREY", STREAKED WITH PATCHES OF N7 AND N5 DOWN TO 45 50 CM,,,,, 5GY6/1 45 50 CM TO 150 CM APPARENTLY C OMPLETELY MIXED UP PROBABLY HAD BEDDING BEFORE DRILL ING,, 00000000,b5b501b2b68646cb9a65406590094046
25,241,,1,4,0.0,140.0,0.00,4.50,5.90,, NANNO OOZE, 5GY6/1-GREENISH GREY,," SOUPY,WISPY DR ILLING BETWEEN 15 AND 63 CM",,,,, CORE SOFT, 00000000,de73da6516ea6685fb7086a6eccc864f
25,241,,1,5,0.0,150.0,0.00,6.00,7.50,,," 5GY6/1-GREENISH GREY,N7-LT GREY", STREAK OF LT GRE Y FROM 35 TO 50 CM, SOUPY,,,,, CORE SOFT ICE CREAM CON STITUENCY, 00000000,756a8c2e03204c428bf8b8576d0ea003
25,241,,1,6,0.0,148.0,0.00,7.50,8.98,," FORAM RICH NANNO OOZE,NANNO OOZE"," 5GY4/1-DARK GRE ENISH GREY,5GY6/1-GREENISH GREY,N7-LIGHT GREY",, SOUP Y," BLOB OF LIGHT GREY FROM 40 TO 45 CM,SEVERAL IRRE GULAR BLOBS OF 5GY4/1 SURROUNDED BY 5GY6/1 FROM 76 T O 143 CM",,,, SOUPY, 00000000,75351c140ee346b670e42d586dbe3062
25,241,,2,1,10.0,150.0,9.00,9.10,10.50,, NANNO OOZE," 5GY6/1-GREENISH GREY,5GY4/1-DARK GREE NISH GREY", SEVERAL STREAKS OF 5GY4/1 FROM 35 TO 58 CM, SOUPY," STREAKS OF SAND RICH FORAM BEARING NANN O OOZE THROUGHOUT  CORE,SEVERAL BLOBS OF 5GY4/1 FROM 35 TO 58 CM", CARBONATE AT 107 CM,, SEVERAL LAYERS NOT WELL DESCRIBED CORE IS VOID FROM 0 TO 15 CM, SOFT SOUPY, 00000000,d2919dc92a1b0bc5f0d412bc24ddbd92
25,241,,2,2,0.0,150.0,9.00,10.50,12.00,, DIATOM RICH BEARING NANNO OOZE," 5GY6/1-GREENISH G REY,N7-LT GREY",, SOFT,,,, WIDE VERTICAL BANDS OF N7 TO 5GY6/1 FROM 65 CM TO 140 CM, SOFT, 00000000,f018af5ebef30b7ccbe7df7ca927d43e
25,241,,2,3,0.0,150.0,9.00,12.00,13.50,, SILICEOUS BEARING NANNO OOZE, 5GY6/1-GREENISH GRE Y,, GREATLY DEFORMED,,,,, VERY SOFT, 11111210.2000,6681954d2549c671152cd4aac7dce933
25,241,,2,4,0.0,150.0,9.00,13.50,15.00,, SILICOUS RICH NANNO OOZE," 5GY6/1-GREENISH GRAY,5G Y4/1-DK GREENISH GREY",,,,,," CORE IS VOID FROM 73 TO 115 CM,COLOR TRANSITIONED 5GY6/1 TO 5GY4/1 FROM 26 TO 73 CM", SOFT, 00000000,7b9cb900df26cc233ea73a903f46285a
25,241,,2,5,10.0,150.0,9.00,15.10,16.50,, SILICEOUS BEARING NANNO OOZE," 5GY6/1-GREENISH GRA Y,N5-MEDIUM GRAY,5GY4/1-DARK GREENISH GRAY",," CORE IS GREATLY DEFORMED,SOUPY,WATERY",,,," SOFT FROM 10 TO 33C M,SOUPY FROM 33 TO 91 CM,WATERY FROM 91 TO 120 CM,SO FT FROM 120 TO 150 CM,CORE IS VOID FROM 0 TO 10 CM", VERY SOFT, 00000000,254e623648194bcf478c753c699648a8
25,241,,2,6,0.0,150.0,9.00,16.50,18.00,, SILICEOUS BEARING NANNO OOZE, 5GY6/1-GREEN GRAY,, CORE IS COMPLETELY DEFORMED MOSTLY SOUPY,,,,, SOUPY, 00000000,799d80f53d70a2120890f5c51aae342d
25,241,,3,1,0.0,150.0,47.00,47.20,48.70,, SILICOUS FOSSIL RICH NANNO OOZE," 5GY6/1,5GY5/1,5G Y4/1", STREAKYNESS INDUCED BY CORING DEFORMATION FRO M 30 TO 148 CM,,,,,, SOFT, 00000000,81501de30afb89034f3738f3ada6e88e
25,241,,3,2,0.0,150.0,47.00,48.70,50.20,, SILT RICH NANNO OOZE," 5GY6/1-GREENISH GRAY,5GY4/1 -DARK GREENISH GRAY,5GY5/1-GREENISH GREY,5Y4/1-OLIVE GRAY", STREAKS OF GREENISH GRAY,,,,, OLIVE GRAY SILTS,, 00000000,5f7f30324c3b179089aaeaf8a5e7d2a7
25,241,,3,3,0.0,150.0,47.00,50.20,51.70,, DIATOM RAD BEARING NANNO OOZE," 5GY7/1-MEDIUM DARK GREENISH GRAY,5GY4/1-DARK GREENISH GRAY"," SMEAR OF DARK STREAK PYRITIZED FROM 16 TO 25 CM,PYRITIZED WOR M TUBE FROM 36 TO 43 CM,5GY7/1 WITH STREAKS OF MEDIU M DARK GREY,BED OF VERY FINE SAND 5GY4/1 FROM 95 TO 105 CM,5GY7/1 BLOB POSSIBLE BURROW FROM 127 TO 135 C M",,, PYRITE,,, SOFT, 00000000,f59070011c6bf423af880d8e6f18a299
25,241,,3,4,0.0,150.0,47.00,51.70,53.20,, DETRITAL SAND RICH PYRITE RICH NANNO OOZE, 5GY5/1 -GREENISH GRAY," FINE TO VERY FINE SAND BED 5Y4/1 WI TH TURBIDITES FROM 35 TO 45 CM,STREAKS OF VERY FINE SAND 5GY5/1 FROM 105 TO 120 CM",,,,,, SOFT TO STIFF, 00000000,5ec1be3bd0441ed68bbe3415862ec144
25,241,,3,5,0.0,150.0,47.00,53.20,54.70,, FORAM BEARING NANNO OOZE," 5GY5/1-GREENISH GRAY,5G Y6/1,N3-DARK GRAY"," GREENISH GRAY WITH MOTTLING OF 5 GY5/1,BED OF N3 FINE SAND TO COARSE SILT FROM 64 TO 71 CM"," SOUPY ZONE FROM 64 TO 71 CM,5GY6/1 DUE TO DI STURBANCE,MODERATE TO INTENSE DISTURBANCE THROUGHOUT",,,,," STIFF,SOUPY", 00000000,6b779220175ea8a52597c9d8d59ba2a1
25,241,,3,6,0.0,150.0,47.00,54.70,56.20,, FORAM BEARING NANNO OOZE, 5GY6/1-GREENISH GRAY,, MODERATE TO INTENSELY DISTURBED THROUGHOUT,,,,, STIFF, 00000000,2183a78ead65de190be97776643dfa45
25,241,,4,1,0.0,85.0,56.00,56.00,56.85,,   SAND FINE TO MEDIUM,,,,,,,, SOFT, 33214000,143b19b53ac18575deccafefbdaa026d
25,241,,4,1,85.0,150.0,56.00,56.85,57.50,, FORAM BEARING NANNO OOZE, 5GY6/1-GREENISH GRAY,, MODERATE TO INTENSELY DISTURBED,,,,, SOFT, 11111210.1221,be8ff2fdab26da49532010a734d55b9c
25,241,,4,2,0.0,150.0,56.00,57.50,59.00,, FORAM BEARING NANNO OOZE, 5GY6/1-GREENISH GRAY, VERTICAL STREAKING THROUGHOUT, INTENSELY DISTURBED THROUGHOUT PRODUCING MARBLE STRUCTURE,,,,, SOFT TO SLIG HTLY STIFF, 00000000,f02274be21da92368ee335d6a54be16d
25,241,,4,3,0.0,150.0,56.00,59.00,60.50,, DIATOM RAD BEARING NANNO OOZE," 5GY6/1-GREENISH GR AY,5GY7/1-GREENISH GRAY,5GY5/1-DARK GREENISH GRAY"," DOMINATLY 5GY6/1 WITH STREAKS OF 5GY7/1 NEAR 40 CM,B LOBS OF SAND 5GY5/1 MAY REPRESENT BURROWED OR DEFORM ED TURBIDITE SAND BED FROM 66 TO 92 CM,STREAKS WITHI N DOMINANT LITHOLOGY FROM 105 TO 130 CM", WHOLE CORE MARBLIZED APPARENTLY BY DRILLING DEFORMATION,,,,, SOFT TO STIFF, 00000000,758b11a19aaa787c0de6f07727356502
25,241,,4,4,0.0,150.0,56.00,60.50,62.00,, FORAM BEARING NANNO OOZE," 5GY6/1-GREENISH GRAY,5G Y5/1", 5GY6/1 WITH MOTTLING OF 5GY5/1 DUE TO DISTURB ANCE, INTENSE DISTURBANCE THROUGHOUT,,,, DARKER FROM 110 TO 150 CM, STIFF TO SLIGHTLY SOFT (AT TOP ONLY ), 00000000,5596ae63203ccc76a8b6cf4e007fbb10
25,241,,4,5,5.0,150.0,56.00,62.05,63.50,, SILT RICH DETRITAL FORAM RICH NANNO SAND," 5GY4/1- DARK GREENISH GRAY,5GY5/1-GREENISH GRAY"," SEVERAL ST REAKS AND BLOBS OF FINE SAND 5GY4/1 FROM 19 TO 31 CM ,40 TO 48 CM,AND 80 TO 90 CM"," SOUPY,ALL SHOWS DEFOR MATION",,,," DOMINANTLY 5GY5/1,VOID FROM 54 TO 56 CM AND FROM 119 TO 126 CM", SOFT TO SOUPY, 00000000,78b51f1f808d89242a0273243a59c8e1
25,241,,5,1,35.0,150.0,65.00,65.35,66.50,, NANNO OOZE," 5GY5/1-GREENISH GRAY,5GY7/1", 5GY5/1 MOTTLED BY DISTURBED ZONES OF 5GY7/1, INTENSELY DIS TURBED THOUGHOUT,,,, LIGHTER FROM 90 TO 115 CM, SOFT TO SLIGHTLY STIFF, 00000000,f66f925f435d6ea559a20e24f64f442a
25,241,,5,2,0.0,150.0,65.00,66.50,68.00,, NANNO OOZE," 5GY5/1-GREENISH GRAY,5GY6/1",," SEVERAL DISTURBED ZONES WHICH ARE LIGHTER (5GY6/1) FROM 10 TO 20 CM AND FROM 105 TO 112 CM,INTENSELY DISTURBED THOUGHOUT",,,,, SOFT, 00000000,f1917bdaea23e4af94cae2299b5a070a
25,241,,5,3,0.0,150.0,65.00,68.00,69.50,, NANNO OOZE," 5GY5/1-GREENISH GRAY,5GY6/1"," SEVERAL SAND BLEBS (BURROWS OR DUE TO DEFORMATION OF CORING ) FROM 90 TO 93 CM,112 TO 114 CM,119 CM,AND 127 CM"," SEVERAL DISTURBED ZONES WHICH ARE LIGHTER (5GY6/1) FROM 26 TO 36 CM AND FROM 80 TO 90 CM,DISTURBED THRO UGHOUT",,,,, SOFT TO SLIGHTLY STIFF, 00000000,c0970fcbff28c505cf46e3ca16b9106f
25,241,,5,4,0.0,150.0,65.00,69.50,71.00,, NANNO OOZE, 5GY6/1-GREENISH GRAY," SEVERAL VERY S MALL STREAKS OF BLACK PYRITE FROM 65 TO 120 CM,VERTI CAL PYRITE BEARING STREAKS", INTENSELY DISTURBED THR OUGHOUT,,,, THIS CORE SECTION ALMOST FEATURELESS EXCEP T AS INDICATED ON GRAPHIC LOG, SLIGHTLY STIFF, 00000000,ffdfd695b7ead057cbeccc79f4742d73
25,241,,5,5,0.0,150.0,65.00,71.00,72.50,, NANNO OOZE, 5GY5/1-GREENISH GRAY," 5GY5/1 WITH BL ACK STEAKS RICH IN PYRITE SCATERED FROM 60 TO 125 CM ,PYRITE FILLED BURROW (?) AT 75CM", INTENSELY DISTUR BED THOUGHOUT,, BLACK STREAKS RICH IN PYRITE,, LIGHT ER COLOR FROM 138 TO 150 CM, STIFF, 00000000,1246b3aa9b7728627c5e6b64734272e9
25,241,,6,1,0.0,150.0,104.00,104.00,105.50,, NANNO OOZE," 5GY6/1-GREEN GRAY,5GY4/1-DARK GREENIS H GRAY", SEVERAL SCATERED 5GY4/1 PYRITIC STREAKS FRO M 25 TO 114 CM, DISTURBED THROUGHOUT,, PYRITE,,, SOF T TO STIFF, 00000000,c3aaae8a3a600ea98bdad2acee803dec
25,241,,6,2,0.0,150.0,104.00,105.50,107.00,, FORAM BEARING NANNO OOZE, 5GY6/1-GREENISH GRAY, 5GY6/1 WITH SMALL STREAKS OF BLACK (PYRITE RICH ZONE S) FROM 10 TO 125 CM, INTENSELY DISTURBED THROUGHOU T,, PYRITE,, TWO SLIGHTLY DARKER LAYERS FROM 55 TO 6 0 CM AND FROM 130 TO 135 CM, SOFT, 00000000,d27883878a101fc1b73cf4007c597bba
25,241,,6,3,0.0,150.0,104.00,107.00,108.50,, NANNO OOZE, 5GY6/1-GREENISH GRAY, 5GY6/1 WITH ST REAKS OF BLACK PYRITE ZONES SCATERED FROM 11 TO 85 C M," INTENSELY DISTURBED THROUGHOUT,TWO SOUPY ZONES F ROM 3 TO 19 CM AND FROM 50 TO 60 CM",, PYRITE,,," SOUPY ,SOFT", 00000000,4688951438a2d5b48be60d377c102c8b
25,241,,6,4,0.0,150.0,104.00,108.50,110.00,, FORAM BEARING NANNO OOZE," 5GY6/1-GREENISH GRAY, 5 GY5/1-GREENISH GRAY", SEVERAL DARKER BLEBS (5GY5/1) SCATERED FROM 79 TO 114 CM, INTENSELY DISTURBED THR OUGHOUT,, FAINT PYRITE,, DOMINANT COLOR 5GY6/1, SOF T, 00000000,1105f4016f6fc74b4364315182ec3d4b
25,241,,6,5,0.0,150.0,104.00,110.00,111.50,, FORAM BEARING NANNO OOZE," 5GY6/1-GREENISH GRAY, 5 GY5/1",," 5GY6/1 AND 5GY5/1 MOTTLED DUE TO DRILLING DI STURBANCE CREATING A BRECCIA LIKE APPEARANCE, 50 TO 130 CM PREDOMINANTLY DRILLING BRECCIA, SOUPY TO SOFT , MODERATELY DISTURBED THOUGHOUT",,,,," SOFT, VERY SOFT", 00000000,17b5c2d44bab95f5a158f041d046568f
25,241,,6,6,0.0,150.0,104.00,111.50,113.00,, FORAM BEARING NANNO OOZE," 5GY6/1-GREENISH GRAY, 5 GY5/1,5GY4/1-DARK GREENISH GRAY", GRADATIONAL CONTAC T AT 110 CM," DISTURBED THROUGHOUT, 0 TO 110 CM LARG ELY A DRILLING BREECCIA",,,, 5GY4/1 FROM 126 TO 139 CM," SOFT,STIFF FROM 109 TO 140 CM", 00000000,9df3f2a4896ef1302c3c460077d7555b
25,241,,7,1,54.0,150.0,142.00,142.54,143.50,, SILT BEARING NANNO OOZE, 5GY4/1-DARK GREENISH GRA Y,, BROKEN INTO CHUNKS BUT NOT BRECCIA,,,," DARK LAYER FROM 54 TO 85 CM,TRANSITIONAL COLOR CHANGE AT 85 CM, 5GY4/1 WITH SOME SLIGHT VARIATION", FIRM TO SOFT, 00000000,6c49363aa4ae8d05562779bac9888fb6
25,241,,7,2,0.0,150.0,142.00,143.50,145.00,, CLAY RICH NANNO OOZE," 5GY4/1-DARK GREENISH GRAY,5 GY7/1-GREENISH GRAY,5G4/1", 5GY7/1 BLEB AT 120 CM," 5G4/1 CHUNKS IN 5GY4/1 MATRIX SCATERED FROM 5 TO 150 CM,DRILLING BRECCIA,CHUNKS STIFF MATRIX,SOFT TO SOU PY",,,,, SOFT TO SOUPY, 00000000,cb94ba8eeab039db10c0a45540571bb8
25,241,,7,3,0.0,150.0,142.00,145.00,146.50,, CLAY RICH NANNO OOZE,,," DRILLING BRECCIA,CHUNKS STI FF MATRIX",,,,,, 00000000,dec33153af51b724419a6b62da2a8019
25,241,,7,4,0.0,150.0,142.00,146.50,148.00,," CLAY BEARING NANNO OOZE,SILT BEARING NANNO OOZE"," 5G4/1-DARK GREENISH GRAY,5GY4/1-DARK GREENISH GRAY,5 G2/1-GREENISH BLACK"," GREENISH BLACK STREAK CONTAINI NG SILT BEARING NANNO OOZE AT 93.5 CM,IRREGULAR STRE AKING APPARENTLY REPRESENTING DISTURBED BEDDING AROU ND 85 CM,CORE CUTTING STREAKS OUT BLACK PYRITE BEARI NG ZONES", FIRM BUT WITH SOUPY PATCHES FROM DRILLING DISTURBANCES,, BLACK PYRITE,," DOMINANT COLOR 5G4/1, MINOR COLORS 5G2/1,5GY4/1", FIRM WITH SOUPY PATCHES, 00000000,6ddec6a8cc522addaba8a2b7051ae8fd
25,241,,7,5,0.0,150.0,142.00,148.00,149.50,, CLAY BEARING CARBONATE RICH NANNO OOZE," 5G4/1-DAR K GREENISH GRAY,5GY5/1-GREENISH GRAY",, MODERATELY DI STURBED,,,," DOMINANT COLOR 5G4/1,TRANSITIONAL COLOR BO UNDARY AT 134 CM", FIRM, 00000000,fd2f13a725bacf9ff4d248934362726d
25,241,,8,1,70.0,150.0,180.00,180.70,181.50,, CLAY SILT BEARING NANNO OOZE," 5GY4/1-DARK GREENIS H GRAY,5GY6/1-GREENISH GRAY",, MODERATELY DISTURBED,,,," DOMINANT COLOR 5GY4/1,TRANSITIONAL COLOR CHANGE 5GY 6/1 FROM 82 TO 85 CM", FIRM, 00000000,f89556aec1f837ac617fff2167ef88d7
25,241,,8,2,0.0,35.0,180.00,181.50,181.85,, SILT NANNO OOZE," 5GY4/1-DARK GREENISH GRAY,5G4/1"," 5GY4/1 NANNO OOZE WITH BLEBS OF 5G4/1 AT 9,13,AND 20 CM"," DEFORMED SAND BED,INTENSELY DISTURBED THROUG HOUT",,,, SILT VERY FINE SAND, FIRM, 00000000,82abf316590f50f20f8f51390e89a1f7
25,241,,8,3,0.0,150.0,180.00,183.00,184.50,, CLAYEY NANNO OOZE," 5G4/1-DARK GREENISH GRAY,5G5/1 -GREENISH GRAY"," 5G4/1 INTERBEDDED WITH BLEBS OF 5GK /1 AT 30 TO 35,75 TO 80,110 TO 120,AND 144 TO 148 CM", INTENSELY DISTURBED THROUGHOUT,,,,, FIRM, 00000000,20d98f456b337e053e3ef86c6c812995
25,241,,8,4,0.0,150.0,180.00,184.50,186.00,, SILT BEARING NANNO OOZE," 5G4/1-DARK GREENISH GRAY ,5G5/1-GREENISH GRAY", 5G4/1 INTERBEDDED WITH 5G5/1 SCATERED FROM 26 TO 120 CM, INTENSE TO MODERATELY D ISTURBED,,,,, FIRM, 00000000,bba0be62393c48dab8a6e9208e372801
25,241,,9,1,125.0,150.0,209.00,210.25,210.50,, SILT BEARING NANNO OOZE," 5GY5/1-GREENISH GRAY,5GY 4/1-DARK GREENISH GRAY",, MODERATELY DISTURBED,,,,, FIRM, 00000000,20fb5b5b4f3c532ea098723d6d366842
25,241,,9,2,10.0,150.0,209.00,210.60,212.00,, SILT BEARING NANNO OOZE," 5GY4/1-DARK GREENISH GRA Y,5GY5/1-GREENISH GRAY", 5GY4/1 WITH SOME INTERBEDS OF 5GY5/1 SCATTERED FROM 40 TO 130 CM, MODERATELY D ISTURBED,,,,, FIRM, 00000000,c0dad54f6432e13ca5c636c3f65b1888
25,241,,10,1,120.0,150.0,218.00,219.20,219.50,, CLAY RICH NANNO OOZE," 5GY4/1-DARK GREENISH GRAY,5 G4/1-DARK GREENISH GRAY",," VERY DEFORMED,DRILLING BRA CCIA,SOUPY IN SPOTS",,,,, SOFT TO STIFF, 00000000,67b04db0682d44f51ebb03a32e411faf
25,241,,10,2,0.0,150.0,218.00,219.50,221.00,, CLAY RICH NANNO OOZE," 5GY4/1-DARK GREENISH GRAY,5 G4/1-DARK GREENISH GRAY,N5-MEDIUM GRAY", VERTICAL BL ACK STREAKS FROM 133 TO 150 CM," DRILLING BRACCIA FR OM 0 TO 133 CM,SOUPY",,,," FROM 0 TO 43 CM SOUPY,FROM 43 TO 65 CM VERY SOUPY,FROM 65 TO 90 CM SOFT TO SOUPY, FROM 90 TO 115 CM SOFT TO SOUPY,FROM 115 TO 133 CM T ENDS TO STIFF,FROM 133 TO 150 CM STIFF,AT 120 CM,N5 AS BLOBS OR BRECCIA,FIRM FROM 133 TO 150 CM"," SOFT,S OUPY,STIFF,FIRM", 00000000,4af948dd3c70009093224d8faa157dee
25,241,,10,3,0.0,150.0,218.00,221.00,222.50,, SILTY NANNO OOZE," 5GY4/1,5GY5/1-GREENISH GRAY,5G2 /1-GREENISH BLACK", FROM 75 TO 78 CM GRADED BED TO S HARP BOTTOM GRADATIONAL TOP, MODERATE TO SLIGHT DEF ORMATION,,,," INTERBEDDED 5GY4/1 AND 5GY5/1,COLOR GRADA TION 5G2/1 UPWARD TO 5GY5/1,VERY FINE TO FINE SAND G IVING UPWARD TO VERY FINE SAND TO SILT", FIRM, 00000000,1d77afbc873db8f7e7365daffea2f48c
25,241,,10,4,0.0,148.0,218.00,222.50,223.98,, NANNO OOZE," 5GY4/1-DARK GREENISH GRAY,5GY6/1-GREE NISH GRAY"," DOMINANT LITH INTERBEDDED WITH 5GY4/1 AN D 5GY6/1,GRADED BED FINE TO VERY FINE SAND FROM 75 T O 95 CM",,,,," COLOR FROM 5GY4/1 TO 5GY6/1,COLOR BANDING AT 95 CM BED,LOWER 10 CM MORE MSU THAN UPPER 5 POSSI BLY BOUMA A INTERVAL LOWER 10 UPPER FINE BOUMA B CHE CK SORTING ETC,GRADING ALSO SHOWS ON GRAPE DENSITY READOUT,TOP OF GRADED BED APPARENTLY LOST IN CUTTING AT 148 CM",, 00000000,f7e619c18c78231485f8529e02b0a32e
25,241,,11,1,110.0,150.0,256.00,257.10,257.50,, SILTY NANNO OOZE," 5GY6/1-GREENISH GRAY,5G4/1-DARK GREENISH GRAY", INTERBEDDED 5G4/1 AND 5GY6/1 AT 110,,,,," 5GY6/1 SILTY NANNO OOZE,BROKEN BUT NOT OBVIOUSLY DISPLACED BLOCKS OF CLAY WITH FINE SAND WASHED INTO INTERSTITIAL REGIONS POSSIBLY FROM WASHOUT OF VOID 1 10 TO 150 CM",, 00000000,9878394510a0cdc1e3cc780987be473d
25,241,,11,2,0.0,150.0,256.00,257.50,259.00,, CLAY RICH NANNO OOZE," 5GY5/1-GREENISH GRAY,5G4/1- DARK GREENISH GRAY,5GY6/1-GREENISH GRAY"," GRADED BED 16 TO 23 CM UPPER LIMIT VAGUE,GRADED BED 64? TO 68 CM,GRADED BED 113? TO 121.5 CM", SLIGHT DEFORMED,,,," 1 6 TO 21 CM CLAY 5GY5/1,21 TO 23 CM CLAY SILTY VERY F INE SILTY SAND 5G4/1,64 TO 67 CM CLAY UNSURE,67 TO 6 8 CM VERY FINE SAND AND SILT,113 TO 120 CM SAND 1.5/ 7,120 TO 121.5 FINE TO VERY FINE SAND", VERY STIFF, 00000000,cd923e1abf713fc60443482b59f8e65c
25,241,,11,3,0.0,150.0,256.00,259.00,260.50,, CLAY RICH NANNO OOZE," 5G4/1-DARK GREENISH GRAY,5G Y5/1-GREENISH GRAY", GRADED BED FROM 65 TO 78 CM,,,,," D OMINANT LITH 5G4/1 TO 5GY5/1,71 TO 78 CM FINE SAND T O CLAYEY SILT,AVERAGE SAND/SH 4 PRECEEDING BEDS EQUA LS .43,GEOCHEM SAMPLE FROM 140 TO 150 CM",, 00000000,30b9d0ae9d51d47da73baad1dce15a7f
25,241,,11,4,0.0,150.0,256.00,260.50,262.00,, NANNO OOZE," N3-DARK GRAY,5GY6/1-GREENISH GRAY", G RADED BED FROM 28 TO 40 CM N3 PROBABLE TURBIDITE, M ODERATE DEFORMED,,,," DOMINANT LITH ABOVE AND BELOW GRA DED BED,40 TO 150 CM VERY SIMILAR TO UPPER 0 TO 28 C M,GRADED BED SOFT TO SLIGHT STIFF"," STIFF,SOFT", 00000000,58c8ea440ee5b206ec32a609d2adedbe
25,241,,12,1,110.0,150.0,294.00,295.10,295.50,, SAND BEARING CLAY RICH NANNO OOZE," 5GY6/1-GREENIS H GRAY,5G4/1-DARK GREENISH GRAY",," FROM 110 TO 116 CM BADLY DISTURBED,FROM 116 TO 150 CM MODERATE DISTURB ED",,,," 5GY6/1 FROM 110 TO 116 CM,FROM 116 TO 150 5G4/1"," STIFF FROM 110 TO 116 CM,VERY STIFF FROM 116 TO 1 50 CM", 00000000,544d82ad35e09bbb64ec226085715a0b
25,241,,12,2,0.0,150.0,294.00,295.50,297.00,, NANNO CLAY," 5G4/1-DARK GREENISH GRAY,5G2/1", RUDE BEDDING INDICATED BY BLACKISH STREAKS, SLIGHT TO M ODERATE DEFORMATION,,,," DOMINANT COLOR 5G4/1,LOCALLY 5 G2/1", VERY STIFF THROUGHOUT, 00000000,50c4cced4ba70e11cc84943c13ac87a9
25,241,,13,1,7.0,150.0,322.00,322.07,323.50,, CLAY, 5G4/1-DARK GREENISH GRAY,, MODERATE DEFORME D THROUGHOUT,,,,, VERY STIFF THROUGHOUT, 00000000,ad56ae49aa7c3e2d1a22a39cbb02bc94
25,241,,13,2,0.0,87.0,322.00,323.50,324.37,, CLAY," 5G4/1-DARK GREENISH GRAY,5Y4/1-OLIVE GRAY,5 Y2/1-BLACK"," BLACK STREAK VAGUE NOT SHARP AT 50 CM,G RAY BLACK STREAK AT 83 CM", MODERATE TO SLIGHT DEFOR MED,,,," FROM 0 TO 50 CM 5G4/1,FROM 50 TO 87 CM 5Y4/1 A ND 5Y2/1", VERY STIFF, 33211000,f0c629122a325becf023fb50b3aa8eab
25,241,,13,2,87.0,150.0,322.00,324.37,325.00,," CLAYEY NANNO OOZE,NANNO OOZE"," 10Y4/2-GRAYISH OLIV E,-LITE GRAY,5G4/1-DARK GREEN GRAY,-OLIVE BROWN", IN TERBEDDED CLAYEY NANNO OOZE AND NANNO OOZE AL HIGHLY BURROWED, MODERATE DEFORMED FROM 87 TO 114 CM,,,," 10 Y4/2 WITH LITE GRAY FROM 87 TO 105 CM,5G4/1 AND STIF F FROM 105 TO 114 CM,VARIGATES OF 87 TO 114 CM INDIC ATIONS OF MODERATE DEFORMATION,FROM 114 TO 150 CM VE RY STIFF WITH SOME MODERATE OLIVE BROWN"," STIFF,VERY STIFF", 00000000,2bc549eb5e670db56f2c4a3db740d7c3
25,241,,13,3,0.0,150.0,322.00,325.00,326.50,, CLAYEY NANNO OOZE," 5GY6/1-GREENISH GRAY,5GY4/1-DA RK GREENISH GRAY"," ABUNDANT BURROWING THROUGH WHOLE SECTION,BASE OF GRADED BED VERY FINE SAND TO SILT IN APPOXIMATELY 1CM AT LEAST AS MUCH SHALE ABOVE TOP A T 61 CM OR HIGHER BASE AT 63 CM"," SOME DRILLING BREC CIA IN UPPER 20 CM,MODERATE DEFORMED",,,," VARIGATED COL ORS DARK VERY STIFF FROM 0 TO 50 CM,VARIGATED COLORS LIGHTER FROM 50 TO 140 CM,INTERSTITIAL WATER SAMPLE FROM 140 TO 150 CM", VERY STIFF, 00000000,a7a14e0957a9713ccac65d4951abef7c
25,241,,13,4,0.0,150.0,322.00,326.50,328.00,," CLAYEY NANNO OOZE,NANNO OOZE",, GRADED BED FROM 86 TO 91 CM COLOR PICKED TOP SHALE FROM 86 TO 89 CM 89 CM TOP OF OBVIOUS GRADING, MODERATE DEFORMATION,,,," D ARKNESS TO BASE,ENTIRE CORE FROM SECTION 2 85 CM TO END OF SECTION 4 SHOWS RYTHYMIC INTERLAYERING OF LIT E AND DARK WITH FEW TURBIDITES THIS CALCAREOUS RICH SECTION MAY BE ALL TURBIDITES BUT ONLY TOW POSTIVELY IDENTIFIED", STIFF, 00000000,f7ee9adee1d84566be4aeca5676b9725
25,241,,14,1,95.0,150.0,379.00,379.95,380.50,, NANNO OOZE BEARING SILTY CLAY," 5G4/1-DARK GREEN G RAY,5YR3/4-MODERATE BROWN,N7-LITE GRAY,5Y4/1-OLIVE G RAY,5GY4/1-DARK GREENISH GRAY"," BEDDING WITH 5GY/1 5 YR3/4 WITH GRAY STREAKS INBETWEEN 95 AND 116 CM,BLAC KISH VERTICAL STREAKS INBETWEEN 116 AND 127 CM"," MOD ERATE DEFORMED,BRECCIATED FROM 127 TO 150 CM",,,," LITE GREY NO SHARP BEDDING FROM 116 TO 127 CM,FROM 127 TO 150 CM OLIVE GRAY AND DARK GREEN GRAY WITH MODERATE BROWN", VERY STIFF, 00000000,7632f2b66fcd47443aba280783115070
25,241,,14,2,0.0,150.0,379.00,380.50,382.00,, NANNO OOZE BEARING SILTY CLAY," 5Y4/1-OLIVE GRAY,5 GY4/1-DARK GREEN GRAY,10YR2/2-DUSKY YELLOW BROWN",, M ODERATE DEFORMATION SOME BRECCIATION,,,," FROM 0 TO 68 CM OLIVE GRAY AND DARK GREEN GRAY WITH DUSKY YELLOW BROWN TOWARD TOP TO 20 CM,FROM 68 TO 150 CM DARK GRE ENISH GRAY AND BLUISH TINGE", STIFF, 00000000,abd05b2711cc7152031f6e04b5d84e9b
25,241,,15,1,42.0,150.0,398.00,398.42,399.50,, SILTY CLAY," 5GY4/1-DARK GREENISH GRAY,5G4/1-DARK GREENISH GRAY,5Y4/1-OLIVE GRAY,N7-LITE GRAY,5GY6/1-G REENISH GRAY", BED GRADES FROM MEDIUM TO VERY FINE S AND AT 147 CM TO CLAYEY SILT AT 136 CM FAINT LAMINAT IONS THROUGHOUT," MODERATE DEFORMATION,DRILLING BREC CIA INBETWEEN 60 AND 85 CM",,,," BED GRADE POSSIBLE TOP AT 130 CM,FROM 42 TO 136 CM DARK GREENISH GRAY AND O LIVE GRAY,FROM 136 TO 147 CM LITE GRAY AND GREENISH GRAY,FROM 147 TO 150 CM DARK GREENISH GRAY", VERY ST IFF, 00000000,12dff2a67c19c1bbc6116a32ea753a1e
25,241,,15,2,0.0,150.0,398.00,399.50,401.00,, CLAY BEARING NANNO OOZE," 10YR4/2-DARK YELLOW BROW N,5GY4/1-DARK GREENISH GRAY,10YR5/2-YELLOWISH BROWN, 5GY6/1-GREENISH GRAY"," INTERBEDDED  DARK YELLOW BROW N DARK GREENISH GRAY AND YELLOWISH BROWN,146 TO 136 CM GRADED BED GREENISH GRAY 136 CM CLAY TOP 140 CM C LAYEY SILT 146 CM FINE SAND NO GOOD LAMINATIONS", MO DERATE TO SLIGHT DEFORMATION,,,, DOMINANT COLOR 5GY4/1, STIFF, 00000000,36ef1c9c4876a253f57862dfed201429
25,241,,15,3,0.0,150.0,398.00,401.00,402.50,, CLAYEY NANNO OOZE," 10YR5/2-YELLOWISH BROWN,10YR4/ 2-DARK YELLOWISH BROWN,5GY6/1-GREENISH GRAY"," INTERB EDED YELLOWISH BROWN DARK YELLOWISH BROWN WITH SUBSI DURY GREENISH GRAY,50.5 CM GRADED BED CLAYEY SILT TO P 47 CM (?) 49 CM CLEAR TOP 50.5 CM FINE SAND", MODE RATE TO SLIGHT DEFORMATION,,,," COLOR TRANSITION AT 20 CM,DOMINANT COLORS 10YR5/2 AND 10YR4/2,GEO CHEM SAMP LE FROM 140 CM TO 150 CM", STIFF, 00000000,ba7fad7d431a10d1371215bb1731149d
25,241,,15,4,0.0,150.0,398.00,402.50,404.00,, CLAYEY NANNO OOZE," 10YR4/2-DARK YELLOW BROWN,5GY4 /1-DARK GREENISH GRAY,5G8/1-LITE GREENISH GRAY", 81 TO 86 CM GRADED BED (5G8/1) 80 OR 81 CM TOP 82 CM SI LT (CLAYEY) 86 CM FINE SAND 80 TO 82 CM SHALE, DRIL LING BRECCIA 95 CM TO 150 CM,,,," COLOR TRANSITION AT 4 5 CM,DOMINANT COLOR 5GY4/1",, 00000000,e6258ff389116e1a10616dafe02ba24f
25,241,,16,1,115.0,150.0,455.00,456.15,456.50,, NANNO OOZE, 10YR5/4-MODERATE YELLOWISH BROWN, RU DE THIN IRREGULAR BEDDING IN INDIVIDUAL SEGMENTS, C ORE BADLY BROKEN UP,,,,, VERY STIFF, 00000000,b1ace1879f3c7d2fb3821c8e30caa38c
25,241,,16,2,0.0,150.0,455.00,456.50,458.00,," NANNO CLAYS AND OOZES,FORAM NANNO CHALK"," 5Y6/1-LI TE OLIVE GRAY,5GY8/1-LITE GREENISH GRAY,5GY6/1-GREEN ISH GRAY,5GY4/1-DARK GREENISH GRAY,5YR4/4-MODERATE B ROWN"," 5GY8/1 SEMI CONSOLIDATED MODERATE LAMINATIONS FROM 29 CM TO 68 CM,FROM 32 CM TO 68 CM POSSIBLE GR ADED BED FINE SAND CLAY GRAIN SIZE BASED ON FORAMS T OP OF BED SEVERAL GREEN CLASTS MORE OR LESS CONTINUO US GRADING WITH SOME FAINT LAYERS,FROM 85 CM TO 68 C M ANOTHER POSSIBLE GRADED BED VERY FINE SAND TO SILT ,85 CM TO 86 CM 5GY6/1 AND 5GY4/1 MOTTLED,PROBABLE B URROWS FILLED WITH GRAYISH AND RED TAKEN FROM 90 CM SMEAR SLIDE,NANNO CLAYS AND OOZES INTERBEDDED WITH F ORAM NANNO CHALK"," SLIGHTLY DISTURBED FROM 0 CM TO 2 9 CM,UNDISTURBED FROM 29 CM TO 94 CM,BADLY DISTURBED FROM 103 CM TO 150 CM",,,," 5Y6/1 AND STIFF FROM 0 CM T O 29 CM,5GY8/1 FROM 29 CM TO 85 CM,FROM 93 TO 104 CM 5G6/1,5Y6/1 MIXED WITH 5G6/1 AND STIFF FROM 115 TO 150 CM,MODERATE BROWN AT BASE", STIFF, 00000000,bdc5791267187cddf53706127e078be3
25,241,,17,1,122.0,150.0,483.00,484.22,484.50,, RED SILTY CLAY," 5Y5/2-LITE OLIVE GRAY,5YR4/4-MODE RATE BROWN,10G6/2-PALE GREEN",, DRILLING BRECCIA,,,, VE RY BADLY MIXED DUE TO CORING DISTURBANCE CONTAINS MI XTURE OF FINE SAND 5Y5/2 WITH 5YR4/4 AND 10G6/2 SILT Y CLAY, SOFT, 33213000,ebfee5f33610aff1a7fce203ac8f7db6
25,241,,18,1,95.0,150.0,492.00,492.95,493.50,, CLAY, 5Y4/4-MODERATE BROWN, CLASTS OF 5Y4/4 SURR OUNDED BY SOFT MATRIX (VARICOLORED AND NOT REPRESENT ATIVE), DRILLING BRECCIA,,,,, SOFT, 00000000,dc42f1d20007764104ec8cb4720edaef
25,241,,19,1,12.0,150.0,530.00,530.12,531.50,, BROWN CLAY," 5YR4/4-MODERATE BROWN,5G4/1-GREENISH GRAY",, SLIGHTLY DEFORMED,,,," MOSTLY MODERATE BROWN WIT H LOCAL VERY THIN LAYERS OF 5G4/1,5G4/1 FROM 105 CM TO 107 CM AND FROM 115 CM TO 120 CM", VERY STIFF TO SEMI LITHIFIED, 00000000,438ce1d878ccf14ef790083cc0097a67
25,241,,19,2,0.0,150.0,530.00,531.50,533.00,, MODERATE BROWN SILT BEARING CLAY," 5YR3/4-MODERATE BROWN,5Y4/1-OLIVE GRAY"," GRADED BEDS,FROM 10 TO 11. 5 CM OBVIOUSLY GRADED VERY FINE SAND TO SILT WITH SO ME LAMINATIONS IN LOWER POSITION OLIVE GRAY CLAY IN BED,FROM 8.5 TO 9.5 VERY THIN GRADED BED,FROM 16.5 T O 19CM CLAY VERY FINE SAND TO SILT ENDS OF THIS GRAD ED BED SQUEEZED OUT DURING DRILLING,FROM 32.5 TO 37 CM GRADED BED CLAY WISPS OF VERY FINE SAND TO SILT W ASHED OUT SAND LAYER (?),FROM 39.5 TO 40.5 CM GRADED CLAY VERY FINE SAND,GRADED BED FROM 56.5 TO 64 CM CL AY BETWEEN 56.5 AND 59 CM SILT AT 59 CM VERY FINE SA ND AT 64 CM,GRADED BED FROM 64 TO 80 CM ESSENTIALY A LL CLAY HAZY BOUNDARY WITH BROWN CLAY AT 64 AND 80 C M WISPY ZONE 78 CM SQUEEZED OUT SAND,GRADED BED FROM 86 TO 87.5 CM FINE TO VERY FINE FORAM SAND GRADING T O SILT OBVIOUSLY SOME SAND SQUEEZED OUT DURING DRILL ING BROWN CLAY ON BORDERS GREEN CLAY IN MIDDLE", MOD ERATELY DISTURBED,,,, 5YR3/4 <15% BANDED WITH 5Y4/1 <1 0 CM THICK, SEMI LITHIFIED, 33211000,7cfb0c17cdd3762d4ea0fc71f350c6b7
25,241,,20,1,0.0,68.0,539.00,539.00,539.68,, SILT BEARING CLAY, 5YR3/4-MODERATE BROWN," 22 TO 26CM GRADED BED,29.5 TO 30.5CM ASH BED,43.5 TO 44.5C M ASH BED,51CM WISPY TURBIDITE,56 TO 56.5 ASH BED,56 .5 TO 59CM BURROWING TOP OF GRADED BED,59 TO 61.5CM GRADED BED", MODERATE DEFORMED,,,, BROKEN UP FROM 0 TO 22 CM, SEMI LITHIFIED, 00000000,f60fd33d75b1abf0a2a62bb196a8cc4e
