58,442,A,19,2,0.0,110.0,171.00,172.50,173.60,SM, CLAY, 10YR5/4, CONTINUATION OF DARKER ZONES UNTI L 42 CM, MODERATE DEFORMATION,,,, 110-150 CM IS VOID- -TAKEN FOR O.C. SAMPLE, HARD FIRM*,
58,442,A,19,3,0.0,150.0,171.00,174.00,175.50,H, PELAGIC CLAYEY MUD, 10YR5/4-YELLOWISH BROWN,, SLI GHTLY DEFORMED,,,,, FIRM-HARD*,
58,442,A,19,CC,0.0,22.0,171.00,175.60,175.72,H, PELAGIC CLAYEY MUD, 10YR5/4-YELLOWISH BROWN,, SLI GHTLY DEFORMED,,,,, FIRM-HARD*,
58,442,A,20,1,0.0,12.0,180.50,180.50,180.62,H, CLAY," 10YR5/2-GREYISH BROWN,10YR4/2-DK.GREYISH BR OWN,5B4/1-DK.BLUISH GREY", 10YR5/2 TO 4/2 CLAY, SLI GHTLY TO MODERATELY," 5B4/1 CLAY PELLETS AND PUMICE ""NODULES"" AT TOP OF CORE",,,, SOFT TO FIRM*,
58,442,A,20,1,12.0,25.0,180.50,180.62,180.75,H, CLAY, 10YR4/2-DK.GREYISH BROWN, MORE SILTY THAN 0-12 CM, SLIGHT TO MODERATE,,,,, SOFT TO FIRM*,
58,442,A,20,1,25.0,28.0,180.50,180.75,180.78,H, CLAY (ASH?)," 10YR7/3-V.PALE BROWN,10YR6/3-PALE BR OWN",, SLIGHT TO MODERATE,,,,, SOFT TO FIRM*,
58,442,A,20,1,28.0,150.0,180.50,180.78,182.00,H, CLAY," 10YR5/2-GREYISH BROWN,10YR4/2-DK.GREYISH BR OWN,10YR3/2-V.DK.GREYISH BROWN,10YR5/3-BROWN,-BLACK"," 10YR5/2 TO 4/2 TO 3/2 CLAY WITH SILTY TO V.SILTY C ONTENT,68-70 CM IS 10YR5/2 TO 5/3 CLAY LAYER WITH SI LTY CONTENT,75-82 CM IS MOTTLED WITH BLACK MOTTLING", SLIGHT TO MODERATE,,,,, SOFT TO FIRM*,
58,442,A,20,CC,0.0,20.0,180.50,182.10,182.20,DM, CLAY," 10YR5/2-GREYISH BROWN,10YR4/2-DK.GREYISH BR OWN", 10YR5/2 TO 4/2 CLAY,,,,,, SOFT*,
58,442,A,21,1,0.0,120.0,190.00,190.00,191.20,DM, CLAY," 10YR5/3-BROWN,10YR4/3-DK.BROWN"," NO EVIDENC E OF SED. STRUCT.,10YR5/3 TO 4/3 CLAY"," SLIGHTLY TO MODERATELY DEFORMED,""SOUPY"" BRECCIATED ZONES AT 28-3 0 AND 67-70 CM",,,,, SOFT TO FIRM*,
58,442,A,21,1,120.0,150.0,190.00,191.20,191.50,DM, SILTY CLAY WITH HARD BRECCIATED CLAY FRAGMENTS," 1 0YR4/2-DK.GRAYISH BROWN,10YR3/2-V.DK.GREYISH BROWN", 10YR4/2 TO 10YR3/2 SILTY CLAY WITH BRECCIATED FRAGM ENTS," BRECCIA,SLIGHT TO MODERATE",,,,, SOFT TO FIRM*,
58,442,A,21,2,0.0,68.0,190.00,191.50,192.18,DM, CLAY WITH FRAGMENTS," 10YR5/2-GREYISH BROWN,10YR5/ 3-BROWN", 10YR5/2 TO 5/3 SLIGHTLY SILTY CLAY WITH BR ECCIATED CLAY FRAGS., MODERATELY DEFORMED,,,,," FIRM,FR AGS. ARE HARD*",
58,442,A,21,2,68.0,150.0,190.00,192.18,193.00,DM, CLAY WITH SMALL AMOUNT OF SILT, 10YR5/4-YELLOWISH BROWN TO 10YR4/3-BROWN,, MOD. DEFORMED,,,,, FIRM*,
58,442,A,21,3,0.0,84.0,190.00,193.00,193.84,DM, CLAY, 10YR4/3-BROWN TO 10YR5/4-YELLOWISH BROWN, NO EVIDENCE SED. STRUCT., SLIGHTLY DEFORMED, PUMIC E LAPILLI: 10YR4/3 SILTY (ASHY)? CLAY," PUMICE,ASH?",, LAPILLI AT 55-56 CM, FIRM*,
58,442,A,21,3,84.0,88.0,190.00,193.84,193.88,DM, CLAY WITH PUMICE FRAGMENTS, 10YR4/1-DK.GREY TO 10 YR3/2-V.DK.GREYISH BROWN," V.FINE 10YR4/1 TO 10YR3/2 SILTY CLAY 84-87 CM,PUMICE FRAGMENTS 87-88 CM NO EVIDENCE OF SED. STRUCT.", SLI GHTLY DEFORMED,, PUMIC E,,, FIRM*,
58,442,A,21,3,88.0,96.0,190.00,193.88,193.96,DM, CLAY (SILTY? ASHY?), 10YR5/2-GREYISH BROWN TO 10Y R4/2-DK.GREYISH BROWN, NO EVIDENCE SED. STRUCT., S LIGHTLY DEFORMED,, ASH?,,, FIRM, 33113000.3450
58,442,A,21,3,96.0,150.0,190.00,193.96,194.50,DM, CLAY, 10YR4/3-BROWN TO -DK.BROWN, NO EVIDENCE SE D STRUCT, SLIGHTLY DEFORMED,,,,, FIRM, 33213000
58,442,A,21,4,0.0,36.0,190.00,194.50,194.86,DM, CLAY WITH VERY FINE SILTY COMPONENT," 10YR5/2-GREY ISH BROWN,-BROWN TO -DK.BROWN", SLIGHT GRADUAL COLOR CHANGE IN BOTTOM 5 CM FROM BROWN TO DK.BRN TOWARDS 10YR5/2,,,,,, FIRM, 33213000
58,442,A,21,CC,0.0,20.0,190.00,195.36,195.46,DM, CLAY, 10YR5/2-GREYISH BROWN,,,,,,, FIRM*,
58,442,A,22,1,0.0,129.0,199.50,199.50,200.79,DM, GRADED DRILLING BRECCIA (CLAY)," 10YR3/3-DK.BROWN, 10YR4/1-DK.GREY"," BRECCIA FROM FINE GRAVEL SIZE,DOWN THE CORE INCREASES TO ""COBBLES"" UP TO 6 CM IN DIAM, CONSISTS OF 10YR3/3 AND 10YR4/1 CLAY", DRILLING BREC CIA,,,," ONLY 1 SECT. RECOVERED,SIMILAR TO CORES ABOVE AS IN 17 OR 16 ETC.*",,
58,442,A,22,1,129.0,150.0,199.50,200.79,201.00,DM, SILTY CLAY, 10YR5/3-BROWN,,,,,, 1 SECT.REC, FIRM*,
58,442,A,22,CC,0.0,20.0,199.50,201.10,201.20,DM, SLIGHTLY SILTY CLAY, 10YR4/3-BROWN TO 10YR4/4-DK. BROWN TO -DK.YELLOWISH BROWN,,,,,,, FIRM, 33213000.3450
58,442,A,23,1,0.0,150.0,209.00,209.00,210.50,M, CLAY," 10YR6/4-LT.YELLOWISH BROWN,10YR4/2-DK.GREYI SH BROWN", BRECCIATED TO 2-5 CM DIA. BLOCKS FILLED W ITH RATHER SOFT SOMEWHAT WATERY CLAY, BRECCIA," 10Y R4/2 PARTS IRREGULARLY SHAPED AT 12,95,AND 114 CM",,,," VERY FIRM,HARD", 33213000
58,442,A,23,2,0.0,96.0,209.00,210.50,211.46,M, CLAY," 10YR6/4-LT.YELLOWISH BRN,10YR4/2-DK.GREYISH BRN", BRECCIATED TO 2-5 CM DIA BLOCKS FILLED WITH R ATHER SOFT CLAY, BRECCIA," 10YR4/2 PART,IRREGULARLY SHAPED (44-49 CM),TRANSITIONAL TO SURROUNDING 10YR6 /4 CLAY",, PLANT DEBRIS? IN 10YR4/2 PART,, VERY FIRM HARD CLAY IN SOFT MATRIX*,
58,442,A,23,3,0.0,150.0,209.00,212.00,213.50,M, CLAY," 10YR6/4-LT.YELLOWISH BRN,10YR4/2-DK.GREY BR N"," BRECCIATED 2-5 CM BLOCKS,SAME AS 23-2", BRECCIAT ED THROUGHOUT AND WATERY IN PLACES, 10YR4/2 PARTS A T 70 AND 103 CM,,, SAME AS 23-2, VERY FIRM WITH SOFT COMPONENTS, 33213000
58,442,A,23,4,0.0,150.0,209.00,213.50,215.00,M, CLAY, -LT.YELLOW BRN," BRECCIATED,FILLED WITH WAT ERY SAME COLORED CLAY", BRECCIATED,,,, CUT BY SUPER-SA W," VERY FIRM-HARD,SOUPY INTERVAL 58-120 CM", 33213000
58,442,A,23,5,0.0,23.0,209.00,215.00,215.23,M, CLAY, -LT.YELLOW BRN," BRECCIATED,FILLED WITH WAT ERY SAME COLORED CLAY", BRECCIATED,,,, CUT BY SUPER-SA W, VERY FIRM*,
58,442,A,23,CC,0.0,20.0,209.00,215.33,215.43,M, CLAY, -LT.YELLOW BRN," BRECCIATED,FILLED WITH WAT ERY SAME COLORED CLAY", BRECCIATED,,,," CUT BY SUPER-SA W,SAME AS 23-5", VERY FIRM, 33211000
58,442,A,24,1,0.0,150.0,218.50,218.50,220.00,M, CLAY, 10YR6/4-LT.YELLOW BRN," BRECCIATED,FILLED W ITH SOFT SIMILAR CLAY", BRECCIATED,,,,, VERY FIRM*,
58,442,A,24,2,0.0,149.0,218.50,220.00,221.49,M, CLAY," 10YR6/4-LT.YELLOW BRN,5B5/1-BLUISH GREY"," B RECCIATED,FILLED WITH SOFT SIMILAR CLAY", BRECCIATED, 5B5/1 CLAY FRAGS AT 111 CM,,,," VERY FIRM IN SOFT MA TRIX,FIRM FRAGS*",
58,442,A,24,3,0.0,150.0,218.50,221.50,223.00,M, CLAY, 10YR6/4-LT.YELLOWISH BROWN,,,,,, WITHOUT VERY F IRM BRECCIATED CLAY AS SEEN IN 24-1 AND 24-2, FIRM*,
58,442,A,24,4,0.0,150.0,218.50,223.00,224.50,M, CLAY," 10YR6/4-LT.YELLOW BRN,10YR4/2-DK.GREYISH BR OWN,5G4/2-GREYISH GREEN",,," CONTAINS IRREGULARLY SHAPE D 10YR4/2 PATS IN PLACES,AND A SMALL FRAGMENT OF 5G4 /2 ""CLAYSTONE"" AT 46 CM",,, NO V.FIRM BRECCIATED CLAY, FIRM*,
58,442,A,24,5,0.0,56.0,218.50,224.50,225.06,M, CLAY, 10YR6/4-LT.YELLOW BRN,,,,,, SAME AS SECT. 24-4, FIRM*,
58,442,A,24,CC,0.0,20.0,218.50,225.16,225.26,M, CLAY, 10YR6/4-LT.YELLOW BRN,,,,,, SAME AS SECT. 24-5, FIRM, 33211000
58,442,A,25,1,0.0,150.0,228.00,228.00,229.50,DM, BRECCIATED HARD CLAY, 10YR5/4-YELLOWISH BROWN TO 10YR4/3-BROWN,, DRILLING BRECCIA,,,,, SOUPY, 33211000
58,442,A,25,2,0.0,150.0,228.00,229.50,231.00,DM, SLIGHTLY SILTY CLAY," 10YR4/4-DK.YELLOWISH BROWN,1 0YR5/2-GREYISH BROWN,10YR4/2-DK.GREENISH BROWN,-BLAC K"," NO SED STRUCTURES EVIDENT,MOTTLING WITH 10YR5/2 TO 10YR4/2 CLAY (SILTY),MOST MOTTLING BELOW 110 CM", MODERATE TO INTENSE DEFORMATION," BLACK ""BLOB"" AT 1 43 CM: PYRITE RESULTING FROM LOCALLY REDUCED AREA--H 25 IN EARLY DIAGENESIS", PYRITE (SEE U SAME CORE),,, SOFT TO FIRM*,
58,442,A,25,3,0.0,150.0,228.00,231.00,232.50,DM, CLAY," 10YR5/4-YELLOWISH BROWN,10YR4/3-DK.BROWN,10 YR3/3-DK.BRN,10YR4/2-DK.GREYISH BRN,10YR3/2-V.DK.GRE YISH BRN"," NO SED STRUCT EVIDENT,10YR5/4 CLAY WITH M OTTLING OF 10YR4/3 TO 10YR3/3,10YR4/2 TO 3/2 SILTY C LAY LAYER AT 88-93 CM", MODERATELY DEFORMED, PUMICE PELLET AT 81 CM, PUMICE,,, FIRM*,
58,442,A,25,4,0.0,135.0,228.00,232.50,233.85,DM, CLAY," 10YR3/2-V.DK.GREY BRN,10YR4/3-DK.BRN,10YR5/ 3-BRN,10YR3/1-V.DK.GREY,-BLACK"," DARK LAYERS APPEAR TO MARK BEDDING(?),0-10 CM IS MOTTLED 10YR3/2 TO 4/3 CLAY,10-86 CM IS 10YR5/3 SILTY CLAY WITH DARKER MOT TLING ESPECIALLY AT 70-80 CM,86-96 CM IS ZONE OF DAR K (10YR3/1 TO 3/2) SLIGHTLY SILTY CLAY,96-150 CM IS 10YR5/3 TO 10YR4/3 SLIGHTLY SILTY CLAY", MODERATELY DEFORMED," BLACK ""BLOBS"" (PYRITE CONCENTRATIONS) AT 0-10 CM,DK. STREAK AT 32 CM,DARKER STREAKS 96-150 CM", BLACK SPECKS AND CONCENTRATIONS OF BLACK MATERIAL ARE PROBABLY LOCALLY REDUCED AREAS CONTAINING PYRIT E AS IN SECT. 25-2 AT 143 CM,,, FIRM*,
58,442,A,25,CC,0.0,20.0,228.00,233.95,234.05,DM, CLAY," 10YR2/1-BLACK,10YR3/1-V.DK.GREY,10YR3/3-DK. BROWN"," MOTTLED 10YR2/1 AND 10YR3/1 OVERLYING 10YR3/ 3 CLAY,MOTTLED CLAY IS SLIGHTLY SILTY",,,,,, FIRM*,
58,442,A,26,1,0.0,150.0,237.50,237.50,239.00,H, CLAYEY MUD, 10YR5/4-YELLOWISH BRN, SMALL SIZED P YRITE BURROWS IN THE LOWER PART OF THE SECTION, DRI LLING BRECCIA, PYRITE BURROWS IN LOWER PART, PYRIT E,,, FIRM IN A SOUPY TO FIRM MATRIX*,
58,442,A,26,2,0.0,150.0,237.50,239.00,240.50,H, CLAY MUD, 10YR5/4-YELLOW BRN, LARGE BURROWS (WOR MS?) IN THE UPPER 80 CM FILLED WITH FRESH AND HARD P YRITE," INTENSELY DISTURBED 0-55 CM,MODERATELY DISTU RBED BELOW 55 CM", PYRITE DK. SPOTS IN THE LOWER PAR T OF THE SECT., PYRITE,,, FIRM*,
58,442,A,26,CC,0.0,22.0,237.50,240.60,240.72,H, CLAY MUD, 10YR5/4-YELLOWISH BROWN,,,,,, SAME CLAY AS 26-2, FIRM*,
58,442,A,27,1,0.0,150.0,247.00,247.00,248.50,H, MEANINGLESS DRILLING BRECCIA, 10YR5/4-YELLOWISH B ROWN,, BRECCIA,,,, AFTER REPAIRS,, 33213000
58,442,A,27,2,0.0,45.0,247.00,248.50,248.95,H, MEANINGLESS BRECCIA, 10YR5/4-YELLOW BRN,, BRECCIA,,,," CONTIN. OF BRECCIA OF SEC.1,AFTER REPAIRS",, 33213000
58,442,A,27,2,45.0,150.0,247.00,248.95,250.00,H, CLAY, 10YR5/4-YELLOWISH BROWN TO 10YR4/2-DK.GREYI SH BROWN," MOTTLED 10YR5/4 TO 10YR4/2 CLAY,FAINT EVI DENCE OF BURROW ACTIVITY", MODERATE WITH INTENSE DIS TURBANCE, 2 CM PUMICE PEBBLE 104-106 CM, PUMICE,, NO CORE CATCHER, FIRM TO STIFF, 33213000
58,442,A,28,1,0.0,150.0,256.50,256.50,258.00,H, DRILLING BRECCIA," 10YR5/4-YELLOW BRN,10YR4/1-DK.G REY", NEAR TOTAL 10YR5/4 DRILLING BRECCIA WITH DARKE R 10YR4/1 ZONES OR PEBBLES, DRILLING BRECCIA,,,, VOID 0-35 CM,, 33213000
58,442,A,28,2,0.0,100.0,256.50,258.00,259.00,H, DRILLING BRECCIAS, 10YR5/4, IRREGULARLY DISTRIBU TED DARK PYRITE AND ASH ZONES, HIGHLY DISTURBED DRI LLING BRECCIA, PYRITE AND ASH ZONES," PYRITE,ASH",, 100-150 CM IS O.C. SAMPLE, CLAY IS FIRM, 33213000
58,442,A,28,3,0.0,85.0,256.50,259.50,260.35,H, CLAY," 10YR5/4-YELLOW BRN,10YR4/1-DK.GREY", 35-45 CM IS DARKENING TO 10YR4/1 FROM 10YR5/4 (BAND OF PYR ITE RICH CLAY)," BRECCIA TO 45 CM,HIGHLY DISTURBED 6 0-85 CM",, PYRITE,, VOID 45-60 CM, FIRM, 33213000
58,442,A,28,3,85.0,105.0,256.50,260.35,260.55,H, CLAYEY ASH," 10YR5/4-YELLOW BRN,10YR4/2-DK.GREY BR N,5GY6/1-GREEN GREY,5GY4/1-DK.GREEN GREY", ZONE OF C OLOR CHANGE FROM 10YR5/4 TO 10YR4/2 (102 CM) TO 5GY6 /1 (103 CM) TO 5GY4/1, HIGHLY DIST,, ASH,,, FIRM*,
58,442,A,28,3,105.0,150.0,256.50,260.55,261.00,H, ASH WITH CLAY (CLAYEY ASH?)," 5G4/2-GREYISH GREEN, 5G5/1-GREEN GREY", 5G5/1 ASH WITH 2CM BAND OF 5G4/2 CLAYEY ASH AT 135 CM, MOD DIST,, ASH,,, FIRM*,
58,442,A,28,4,0.0,15.0,256.50,261.00,261.15,H, VOLCANIC ASH, 5G5/1-GREENISH GREY,, MOD,,,,, FIRM, 33113000
58,442,A,28,CC,0.0,10.0,256.50,261.30,261.30,H, ASH, 5G5/1-GREEN GREY,,,, ASH,, GLASS WITH CLAY, FIRM*,
58,442,A,29,1,0.0,10.0,266.00,266.00,266.10,H, INTERBEDDED ASH AND CLAY,,,,,,, CONTINUED FROM CORE 28, FIRM, 33213000.3651
58,442,A,29,1,10.0,130.0,266.00,266.10,267.30,H, CLAY, 10YR5/4, BLACK SPECKING AND STREAKING, MO DERATELY DISTURBED," BLACK SPECKING AND STREAKING (T AR-LIKE?) ORGANICS 80-110 CM,DK.SOFT PEBBLE AT 120? CM--ORGANIC",, ORGANICS,, FIRM*,
58,442,A,29,1,130.0,150.0,266.00,267.30,267.50,H, CLAYEY VOLC. ASH," 5Y7/1-LT.GREY,10YR5/4-BROWN", A N UNSHARP CONTACT BETWEEN 5Y7/1 ASH AND 10YR5/4 OVER LYING CLAY, HIGHLY DISTURBED,, ASH,,, FIRM*,
58,442,A,29,2,0.0,55.0,266.00,267.50,268.05,H, INTERBEDDED ASH AND CLAY," 2.5Y6/2-LT.BRNSH GREY,1 0YR5/4", 2.5Y6/2 ASH AND 10YR5/4 CLAY,,, ASH,,, FIRM, 33213000
58,442,A,29,2,55.0,80.0,266.00,268.05,268.30,H, ASH," 2.5Y6/4-LT.YELLOW BRN,2.5Y4/2-DK.GREY BRN", 2.5Y6/4 GRADE DOWN TO 2.5Y4/2 ASH WITH SPECKS,,, ASH,, SLIG HT TO MODERATE DISTURBANCE, FIRM*,
58,442,A,29,2,80.0,150.0,266.00,268.30,269.00,H, CLAY," 10YR5/4,2.5Y4/4-OLIVE BRN"," 10YR5/4 CLAY WI TH OCCASIONAL DARKER AREAS,GOING TO 2.5Y4/4", SLIGHT DEFORMATION,,,,, FIRM*,
58,442,A,29,3,0.0,150.0,266.00,269.00,270.50,SM, CLAY," 2.5Y4/4-OLIVE BROWN,-BLACK"," BURROWING?--MO TTLING,BLACK STREAKING", SLIGHT DISTURBANCE," BLACK STREAKING (PYRITIC),PUMICE FRAGS."," PUMICE,PYRITE",, 145-150 CM IS VOID, FIRM, 33213000
58,442,A,30,1,0.0,16.0,275.50,275.50,275.66,SM, CLAY," 10YR5/4-YELLOW BRN,10YR4/2-DK.YELLOW BRN,10 YR3/4-DK.YEL BRN"," MOTTLED APPEARANCE DUE TO DRILLIN G BUT ALSO BURROWING TRACES,GRADES DOWNWARD TO 10YR3 /4 CLAY,CONTACT IS REL. SHARP", MODERATELY DISTURBED,,,, SMEAR AT 15 CM, HARD*,
58,442,A,30,1,16.0,55.0,275.50,275.66,276.05,SM, CLAY, 10YR3/4-DK.YELLOW BRN, EXTENSIVE BURROW MO TTLING, MODERATE DISTURBANCE,,,, SHARP CONTACT AT 55 CM, FIRM, 33213000
58,442,A,30,1,55.0,65.0,275.50,276.05,276.15,SM, CLAY," 10YR5/4-YELLOW BROWN,10YR3/4-DK.YEL. BRN"," 10YR5/4 GRADES DOWNWARD WITH IRREGULARITY INTO 10YR3 /4,REL. SHARP CONTACT AT 65 CM", MODERATE,,,,, FIRM, 33213000
58,442,A,30,1,65.0,102.0,275.50,276.15,276.52,SM, CLAY, 10YR3/4-DK. YELLOW BRN, EXTENSIVE BURROWS, MODERATE DISTURBANCE,,,,, FIRM*,
58,442,A,30,1,102.0,150.0,275.50,276.52,277.00,SM, CLAY," 10YR5/6-YELLOW BRN,10YR3/4-DK.YELLOW BRN"," 10YR5/6 CLAY TO 119 CM,119-123 CM GRADING INTO MOTTL ED MIXTURE OF 10YR5/6 AND 10YR3/4 WHICH CONTINUES TO 150 CM,EXTENSIVE BURROWING", MOD DIST,,,,, FIRM, 33213000
58,442,A,30,2,0.0,13.0,275.50,277.00,277.13,SM, CLAY, 7.5YR5/6-STRONG BROWN, MOTTLED, BRECCIATE D,,,, PROBABLE SHARP CONTACT AT 13 CM, FIRM*,
58,442,A,30,2,13.0,150.0,275.50,277.13,278.50,SM, CLAY," 10YR3/4-DK.YELLOW BROWN,5YR8/3-PINK"," MOTTL ED,BURROWED (EXTREMELY BELOW 70 CM),MN BEDDED AT BAS E,NOT SHARP CONTACT AT 53 CM,SHARP CONTACT AT 70 CM, 5YR8/3 CLAY 53-70 CM", MODERATE DISTURBANCE," PINK C LAY LAYER 53-70 CM,MN SPECKLES AT BASE", MN SPECKLES,, CONTACT AT 70 CM IRREGULAR, FIRM, 33211000
58,442,A,30,3,0.0,138.0,275.50,278.50,279.88,SM, CLAY, 10YR3/4-DK. YELLOW BROWN," EXTREMELY BURROW ED,LIGHTENS AND DARKENS WITH BURROWS", NO DISTURBANC E, SCATTERED MN, SCATTERED MN,,, FIRM*,
58,442,A,30,CC,0.0,20.0,275.50,279.98,280.08,SM, CLAY," -DK.BROWN,-PINK", DK.BRN OVER PINK,,,,,, FIRM, 33211000
58,442,A,31,1,0.0,34.0,285.00,285.00,285.34,DM, DRILLING BRECCIA," 5Y6/2-LT.OL.GREY,5YR3/4-DK.REDD ISH BRN,10YR6/3-PALE BROWN,5YR2/2-DK.RED BRN", DRILL ING BRECCIA CONSISTING OF 5Y6/2 INDURATED CLAY AND 5 YR3/4 SILTY CLAY AND 10YR6/3 SILTY CLAY AND 5YR2/2 M UD, HIGHLY DISTURBED DRILLING BRECCIA,,,," SECT. WAS C ONTAINED (TOTAL) IN 65 CM OF CORE BEFORE PROCESSING, IN PROCESSING FOR STUDY THE ""SEDIMENTARY GARBAGE"" WA S COMPRESSED INTO 34 CM", FIRM TO HARD*,
58,442,A,31,1,34.0,70.0,285.00,285.34,285.70,DM, LIMESTONE WITH BLACK SPECKS, 7.5YR7/2-PINKISH GRE Y," FINE-GRAINED,WITH FILLED BURROWS SAME COMPOSITIO N,DENSE,OCCUR IN BOULDER-LIKE PIECES (AT 34-45 45-50 AND 50-70 CM)",,,,,, V.HARD, 12130000
58,442,A,31,1,70.0,76.0,285.00,285.70,285.76,DM, WEATHERED BASALT FRAGS AND MUD, 5YR3/2-DK.RED BRN," LIMESTONE FRAGMENTS,WEATHERED BASALT FRAGMENTS AN D 5YR3/2 MUD",,," BASALT,LIMESTONE",,,, 12130000
