leg,site,hole,core,section,top interval depth (cm),bottom interval depth (cm),top of core depth(m),top of layer depth (m),bottom of layer depth (m), describer,lithology,color,structures,deformations due to drilling,unusual occurrences,minerals,paleontology,other observations,hardness or induration,z-coding
58,442,A,2,1,5.0,150.0,9.50,9.55,11.00,SM, MUD (SILTY CLAY)," N4-DK.GREY,5GY4/1-DK.GREENISH G REY,N5-GREY"," 5-15 CM IS N4 BUT DARKER THAN N4 THAT IS 15-85 CM,85-150 CM IS 5GY4/1,N4 CHANGES PROBABLY NOT VALID", DEFORMATION INTENSE CAUSING INJECTION LI KE APPEARANCE OF CORE," A FEW SCATTERED CLAY CHUNKS, ASH ZONE NOTED AT 80 CM (N5 COLORED)", ASH,, SILICEO US RICH SANDY AND SILTY CLAY," SOFT,FIRMER BELOW 85*",
58,442,A,2,2,0.0,150.0,9.50,11.00,12.50,SM, SILICEOUS SANDY AND SILTY CLAY," 5GY4/1-DK.GREENIS H GREY,5Y4/1-DK.GREY,N3-V.DK.GREY"," 5GY4/1 ZONE 0-10 CM,SUBTLE CHANGE INTO 5Y4/1 INTO N3 10-30 CM,NO COL OR CHANGE BELOW 30 CM", INTENSE DEFORMATION, SCATTE RED CLAY CHUNKS 137-141 CM,,,, SOUPY*,
58,442,A,2,3,0.0,95.0,9.50,12.50,13.45,H, VOLCANIC AND SILICEOUS SILTY CLAY," N4-DK.GREY,5GY 4/1-DK.GREENISH GREY", N4 WITH 5GY4/1 ZONES AND DARK GREY ASH, INTENSE DEFORMATION, DK.GREY ASH, DK. GREY ASH,, 95-150 CM IS ORGANIC SAMPLE," SOFT 0-35 C M,FIRM 35-93 CM*",
58,442,A,2,4,0.0,150.0,9.50,14.00,15.50,H, CLAY," N4-DK.GREY,-GREENISH GREY", SPLOTCHES OF GR EENISH GREY 45-52 AND 58-67 CM, INTENSE DEFORMATION," CLAY CHUNKS AT 25,44,48,55,61,AND 67CM(APPROX), , VOLC ASHES AR 110,123,134CM", VOLC.ASH,,, SOFT*,
58,442,A,2,5,0.0,68.0,9.50,15.50,16.18,H, SILTY CLAY, 5GY4/1-DK.GREENISH GREY,, INTENSE DEF ORMATION, ASH AT 25 CM, ASH AT 25 CM,,, SOFT*,
58,442,A,2,5,68.0,110.0,9.50,16.18,16.60,H, SILTY CLAYEY SAND, 5Y6/1-GREY, GOING LESS SANDY AND MORE GREYISH TOWARDS THE TOP, NO DEFORMATION,,,, VOID 68-73 CM, SOFT*,
58,442,A,2,5,110.0,150.0,9.50,16.60,17.00,H, SILTY CLAYEY SAND, N4-DK.GREY,, INT.DEF,,,,, SOFT*,
58,442,A,2,6,0.0,150.0,9.50,17.00,18.50,H, QUARTZY CLAY," N/4-DK.GREY,5GY4/1-GREENISH GREY", 5GY4/1 STRINGS SCATTERED THROUGHOUT," INTENSE DEFORM ATION,SLURRY 100-125 CM"," ASHES AT 5,11, AND 81 CM", ASHES,,, SOUPY 100-125 CM*,
58,442,A,2,7,0.0,25.0,9.50,18.50,18.75,H, CLAY," N/4-DK.GREY,5GY4/1-GREENISH GREY"," PATCHES (STRINGERS?) OF 5GY4/1 AT BASE OF CORE,SAME AS 2-6", INTENSE DEFORMATION,,,,, SOFT*,
58,442,A,2,CC,0.0,5.0,9.50,18.88,18.83,H, CLAY, N/4-DK.GREY, SAME AS 2-6, INTENSE DEFORM,,,,, SOFT*,
58,442,A,3,1,0.0,20.0,19.00,19.00,19.20,SM, SILTY CLAY, 5Y4/1-DK.GREY,, HIGHLY DISTURBED,,,,, SO UPY*,
58,442,A,3,2,0.0,150.0,19.00,20.50,22.00,SM, CLAY," 5Y4/1-DK.GREY,N4-DK.GREY", 5Y4/1 TO N4 HEMI PELAGIC? CLAY," INTENSE DEFORMATION TO SOFT BRECCIA 0-75 CM,MODERATE DEFORMATION 75-150 CM", ASH ZONE AT 5 CM, ASH,,, SOFT BUT FIRMER THAN CORE 2*,
58,442,A,3,3,0.0,150.0,19.00,22.00,23.50,SM, VERY SILTY CLAY," 5Y4/1-DK.GREY,N4-DK.GREY,5BG4/1- DK.GREENISH GREY,5B4/1-DK.BLUE GREY,5/1-GREY,4/1-DK. GREY"," 5Y4/1 TO N4 SILTY CLAY (ASHY?),88-102 CM AND 105-136 CM HAS 5BG4/1 TO 5B4/1 STRINGERS OF CONVOLUT ED CLAY (PROBABLY DRILLING DEFORMATION),ASH ZONES (I N BALLS) 5/1 TO 4/1 PUMICE AT 65 AND 110 CM"," INTENS E DEFORMATION,INTENSE BRECCIA TO 90 CM"," ASH ZONES ( IN ""BALLS"") AT 65 AND 110 CM", ASH (PUMICE),,, FIRM*,
58,442,A,3,4,0.0,150.0,19.00,23.50,25.00,M, SILTY CLAY," 5Y4/1-DK.GREY,5BG4/1-DK.GREENISH", ST RINGERS OF CONVOLUTED 5BG4/1 CLAY 0-49 AND 106-121 C M, INTENSE DEFORMATION THROUGHOUT, LARGE PYRITE NO DULE (APPROX. 3 CM) REMOVED AT 65 CM, PYRITE,, SMEA R SLIDE AT 75 CM, FIRM*,
58,442,A,3,5,0.0,150.0,19.00,25.00,26.50,M, SILTY CLAY, 5Y4/1-DK.GREY,, INTENSE DEFORMATION, 3 CM PYRITE NODULE AT 85 CM, PYRITE,,, FIRM*,
58,442,A,3,6,0.0,150.0,19.00,26.50,28.00,M, SILTY CLAY," 5Y4/1-DK.GREY,5Y6/1-GREY,5Y3/1-V.DK.G REY"," 5Y3/1 BALL 91-101 CM,5Y3/1 IRREGULAR SHAPE PAT CH 125-137 CM,BOTH FORMED BY DEFORMATION", INTENSE D EFORMATION," VOLCANIC ASH (IN BALLS) 5Y6/1 IN COLOR AT 35-38,42-52,66-68,AND 99-101 CM", VOLCANIC ASH,,, FIRM*,
58,442,A,3,7,0.0,120.0,19.00,28.00,29.20,M, SILTY CLAY, 5Y4/1-DK.GRAY,, INTENSE DEFORMATION,,,,," FIRM AT 0-99CM,99-120 CM IS SOFT*",
58,442,A,3,CC,0.0,8.0,19.00,29.35,29.33,M, SILTY CLAY, 5Y4/1-DK.GREY,, HIGHLY DIST,,,,, SOFT*,
58,442,A,4,1,0.0,150.0,28.50,28.50,30.00,M, SILTY PELAGIC CLAY, N4-DK.GREY," NO VISIBLE BEDDI NG,COLOR CHANGES,ETC.", INTENSE DEFORM-DRILLING BREC CIA (SOUP),,,,, SOUPY*,
58,442,A,4,2,0.0,40.0,28.50,30.00,30.40,DM, PELAGIC CLAY," 5Y4/1-DK.GREY,5GY4/1-DK.GREENISH GR EY"," 5Y4/1 TO 5GY4/1 CLAY,V. SLIGHTLY SILTY--POSS. A SH", INTENSE DEFORMATION--BRECCIA,,,, WATERY, SOFT*,
58,442,A,4,2,40.0,110.0,28.50,30.40,31.10,DM, PELAGIC CLAY," N/4-DK.GREY,5BG4/1-DK.GREENISH GREY", N/4 CLAY WITH MOTTLING OF 5BG4/1 CLAY," INTENSE D EFORMATION,BRECCIA", ASH ZONE AT 81 CM*,,,, MED. FIRM,
58,442,A,4,2,110.0,150.0,28.50,31.10,31.50,DM, PELAGIC CLAY, 5GY4/1-DK.GREENISH GREY,, LESS INTE NSE DEFORMATION THAN ABOVE, HARD CLAY NODULE 102-10 5 CM,,,, FIRM*,
58,442,A,4,3,0.0,107.0,28.50,31.50,32.57,DM, PELAGIC SILTY CLAY," N/4-DK.GREY,5GY4/1-DK.GREENIS H GREY,5Y4/1-DK.GREENISH GREY", N/4 CLAY WITH MOTTLI NG OF 5GY4/1 TO 5Y4/1 CLAY, HIGHLY DEFORMED, CARBO NATE CONCRETION(?) IN 10-11 CM,,,, MODERATELY FIRM*,
58,442,A,4,3,107.0,150.0,28.50,32.57,33.00,DM, CLAY," N/4-GREY,5B4/1-DK.BLUISH GREY", N/4 CLAY WI TH MOTTLING OF 5B4/1 V. SLIGHTLY V. FINE SILTY CLAY, INTENSELY DEFORMED, CLAY NODULE 107-110CM,,,, FIRM*,
58,442,A,4,4,0.0,150.0,28.50,33.00,34.50,DM, PELAGIC CLAY," N/4-DK.GREY,5GY4/1-DK.GREENISH GREY ,5BG4/1-DK.BLUISH GREY", N4  TO 5GY4/1 CLAY WITH MOT TLING OF 5BG4/1 CLAY WITH MANY SMALL CLAY PELLETS AN D/OR NODULES, INTENSE DEFORMATION, SMALL CLAY PELL ETS OR NODULES,,,, FIRM*,
58,442,A,4,5,0.0,40.0,28.50,34.50,34.90,DM, SLIGHTLY SILTY PELAGIC CLAY, 5BG4/1-DK.BLUISH GRE Y,, INTENSELY DEFORMED,,,,, FIRM--FIRMNESS INCREASING D OWNWARD*,
58,442,A,4,5,40.0,70.0,28.50,34.90,35.20,DM, PELAGIC CLAY, 5GY4/1-DK.GREENISH GREY," SLIGHTLY SILTY,SLIGHTLY MORE SILTY THAN ABOVE", INTENSELY DEF ORMED,,,,, FIRM--CRUMBLY*,
58,442,A,4,CC,0.0,4.0,28.50,35.30,35.24,DM, SLIGHTLY SILTY PELAGIC CLAY," N4-DK. GREY,5GY4/1-D K.GREENISH GREY",,,,,,, SOFT*,
58,442,A,5,1,0.0,39.0,38.00,38.00,38.39,DM, SILTY PELAGIC CLAY," 5GY4/1-DK.GREY GREEN,5G4/1-DK .GREY GREEN", NO BEDDING OR SED. STRUCTURES VISIBLE, INTENSELY DEFORMED (BRECCIATED), ABUNDANT HARD CL AY PELLETS AND NODULES,,, WATERY, SOFT*,
58,442,A,5,1,39.0,120.0,38.00,38.39,39.20,DM, SILTY PELAGIC CLAY," 5Y4/1-DK.GREY GREEN,5GY4/1-DA RKER GREY GREEN"," NO BEDDING OR SED. STRUCT.,5Y4/1 M OTTLED WITH 5GY4/1", INTENSELY DEFORMED,,,,, FIRM*,
58,442,A,5,1,120.0,150.0,38.00,39.20,39.50,DM, SILTY PELAGIC CLAY, 5Y4/1-DK.GREY GREEN,, INTENSE LY DEFORMED,,,,, LESS FIRM THAN ABOVE*,
58,442,A,5,2,0.0,150.0,38.00,39.50,41.00,DM, SILTY PELAGIC CLAY (PUMACEOUS?)," 5GY4/1-DK.GREENI SH GREY,5Y4/1-SLIGHTLY LIGHTER DK.GREENISH GREY,N/4- DK.GREY,5Y5/1-GREY"," 5GY4/1 CLAY MOTTLED WITH SLIGHT LY LIGHTER 5Y4/1 CLAY,WITH MOTTLING N/4 CLAY (LESS S ILTY),5Y5/1 ASHY ZONES AT 113,130-132,AND 137-140 CM"," V.INTENSE DEFORMATION,BRECCIATED"," PUMICE NODULES AT 54-70 CM,ASHY ZONES ARE VERY FINE (SILT SIZE) PU MICE ASH,INDURATED CLAY PELLETS"," PUMICE,ASH",,, FIRM*,
58,442,A,5,3,0.0,150.0,38.00,41.00,42.50,DM," PELAGIC CLAY,ASHY"," 5GY4/1-DK.GREY GREEN,N4-DK. GR EY,N5 -GREY"," HIGHLY CONTORTED MOTTLING--NO SED. STR UCT. OR BEDDING,5GY4/1 TO N4 ,ZONES OF PUMICE THROUG HOUT,BUT APPEAR MORE ABUNDANT 0-50 AND 110-135 CM,PU MICE ZONES ARE VERY FINE AND N/5", INTENSE DEFORMATI ON," PUMICE ZONES,SEVERAL INDURATED CLAY PELLETS IN PUMACEOUS ZONES", PUMICE,, AT 128 CM AVOID CRACK  1 CM WIDE (NODULE REMOVED?), FIRM*,
58,442,A,5,4,0.0,150.0,38.00,42.50,44.00,DM, PELAGIC CLAY WITH ASH (NO SILT)," 5GY4/1-DK.GREENI SH GREY,N/4-DK.GREY"," N/4 DEFORMED BEDDING PLANES VI SIBLE,PUMACEOUS GLOBS PROMINENT TO 92 CM,N/4 MOTTLIN G IN LOWER PART", MODERATELY DEFORMED BUT NOT BRECCI ATED (DEFORMATION MUCH LESS THAN PREVIOUS SECTION)," PUMACEOUS GLOBS,INDURATED CLAY PELLETS THROUGHOUT", PUMICE,,, FIRM*,
58,442,A,5,5,0.0,50.0,38.00,44.00,44.50,DM, PELAGIC CLAY," N4 -DK.GREY,5GY4/1-DK.GREENISH GREY"," ALTERNATING LAYERS OF DARKER AND LIGHTER COLOR,EA CH ABOUT 5-10 CM THICK,ARE EVIDENT EVEN THOUGH DEFOR MED"," DEFORMATION RELATIVELY MILD (MODERATE TO SLIGH T),LESS INTENSE THAN SEC.4",,,,, FIRM*,
58,442,A,5,5,50.0,106.0,38.00,44.50,45.06,DM, PELAGIC CLAY," 5GY4/1-DK.GREYISH GREEN,-DK.GREY", MOTTLING OF DK.GREY INDURATED CLAY (BURROW??) AT 84 CM, DEFORMATION RELATIVELY MODERATE," OCCASIONAL IN DURATED CLAY PELLETS,RARE PUMICE NODULES", PUMICE,,, FIRM*,
58,442,A,5,5,106.0,150.0,38.00,45.06,45.50,DM, CLAY," N4-DK. GREY,5GY4/1-DK.GREENISH GREY,5Y4/1-D K.GREENISH GREY,-BLACK"," 106-110 CM IS N4  TO BLACK HARD LAYER--INDURATED CLAY WITH SLIGHTLY DEFORMED 5G Y4/1 TO 5Y4/1 PELAGIC CLAY BELOW,CLAY CONTAINS PIECE S OF INDURATED CLAY"," MODERATE TO SLIGHT,HARD LAYER BRECCIATED",,,,," HARD 106-110 CM,CLAY BENEATH IS FIRM WI TH INDURATED CLAY PIECES*",
58,442,A,5,6,0.0,30.0,38.00,45.50,45.80,DM, PELAGIC CLAY," 5Y4/1-DK.GREENISH GREY,N4 -DK.GREY", 5Y4/1 MOTTLED WITH N4, INTENSE DEFORMATION,,,, NO SMEAR, FIRM*,
58,442,A,5,CC,0.0,15.0,38.00,45.96,46.01,DM, PELAGIC CLAY, 5Y4/1-DK.GREENISH GREY,,,,,,, SOFT*,
58,442,A,6,1,0.0,150.0,47.50,47.50,49.00,DM, PELAGIC CLAY," 5Y4/1-DK.GREENISH GREY,5GY4/1-DK.GR EENISH GREY"," 0-131 CM IS 5Y4/1 TO 5GY4/1 SLIGHTLY S ILTY CLAY,131-138 CM IS 5GY4/1 SLIGHTLY SILTY CLAY,1 38-150 CM IS 5Y4/1 TO 5GY4/1 CLAY"," INTENSE DEFORMAT ION,BRECCIATED AT 54-64 AND 131-138 CM",,,," WATERY 0-13 8 CM,NO BEDDING"," SOFT 0-131 CM,FIRM TO SOFT 131-138 CM,FIRM 138-150 CM*",
58,442,A,6,2,0.0,30.0,47.50,49.00,49.30,DM, PELAGIC CLAY WITH PUMICE LAPILLA, 5GY4/1-DK.GREEN ISH GREY," SLIGHTLY SILTY,POSSIBLE LAYERS EVIDENT"," LESS INTENSE THAN SEC.1,MODERATELY INTENSE", LARGE P UMICE LAPILLA AT 28 CM, PUMICE,,, FIRM*,
58,442,A,6,2,30.0,88.0,47.50,49.30,49.88,DM, PELAGIC CLAY, 5GY4/1-DK.GREENISH GREY," NO SILT,P OSSIBLE LAYERS EVIDENT",,,,,, FIRM*,
58,442,A,6,2,88.0,150.0,47.50,49.88,50.50,DM, PELAGIC CLAY, 5GY4/1-DK.GREENISH GREY," NO VISIBL E CHANGE IN COLOR OR TEXTURE BUT MOTTLED SPOTS ARE M ORE ""CRUMBLY"" (ASHY?)"," MODERATE INTENSE DEFORMATION ,MOTTLING APPARENTLY DUE TO DRILLING",, ASH?,,, FIRM*,
58,442,A,6,3,0.0,55.0,47.50,50.50,51.05,DM, PELAGIC CLAY, 5GY4/1-DK.GREENISH GREY," MOTTLED W ITH MORE ""CRUMBLY"" CLAY OF SAME COLOR (ASHY?)", SLIG HT TO MODERATE DEFORMATION,, ASH?,, APPEARS (WHOLE C ORE) TO BE LAYERED, FIRM*,
58,442,A,6,3,55.0,83.0,47.50,51.05,51.33,DM, VERY FINE SILTY PELAGIC CLAY, 5Y4/1-DK.GREY," VER Y FINE ""GRITTY"" (ASHY?) TEXTURE", SLIGHT TO MODERATE DEFORMATION,,,, CORE SEEMS LAYERED, FIRM*,
58,442,A,6,3,83.0,94.0,47.50,51.33,51.44,DM, PELAGIC CLAY, 5GY4/1-DK.GREENISH GREY,, SLIGHT TO MODERATE,,,, CORE APPEARS TO BE LAYERED, FIRM*,
58,442,A,6,3,94.0,121.0,47.50,51.44,51.71,DM, PELAGIC CLAY, 5Y4/1-GREY," VERY FINE ""GRITTY"" TEX TURE (ASHY?),I.E. WITH VERY FINE SILT", SLIGHT TO MO DERATE,,,, CORE APPEARS LAYERED, FIRM*,
58,442,A,6,3,121.0,129.0,47.50,51.71,51.79,DM, HARD INDURATED CLAY, 5BG4/1-DK.GREENISH GREY,, BR ECCIATED,,,, SIMILAR TO HARD ZONES IN CORE 5 (SUBMARIN E DIAGENESIS?)," HARD,INDURATED", 33211000
58,442,A,6,3,129.0,150.0,47.50,51.79,52.00,DM, PELAGIC CLAY," 5Y4/1-DK.GREENISH GREY,5BG4/1-DK.GR EENISH GREY",, SLIGHT TO MODERATE, HARD BRECCIATED 5BG4/1 CLAY NODULE AT 138-139 CM,,,, FIRM, 33211000
58,442,A,6,4,0.0,120.0,47.50,52.00,53.20,DM, PELAGIC CLAY, -DK.GREENISH GREY," NO BEDDING OR S TRUCTURES EVIDENT,COHESIVE CLAY,INCLUSIONS OF THE ""C RUMBLY"" MATERIAL OF SAME TEXTURE AND COLOR", INTENSE DEFORMATION," CLAY? NODULE AT 17 CM (REMOVED),BRECC IATED INDURATED CLAY POCKET AT 60 CM",,,, FIRM*,
58,442,A,6,4,120.0,150.0,47.50,53.20,53.50,DM, PELAGIC CLAY, 5Y4/1-DK.GREY, LOOSELY CONSOLIDATE D,,,,,, SOFT*,
58,442,A,6,5,0.0,150.0,47.50,53.50,55.00,DM, PELAGIC CLAY," 5GY4/1-DK.GREENISH GREY,N4-DK. GREY"," NO BEDDING OR SED. STRUCT. EVIDENT,0-85 CM IS 5GY 4/1 CLAY WITH SLIGHT AMT. VERY FINE SILTY TEXTURE AN D MOTTLED WITH N4 CLAY, 85-109 CM IS 5GY4/1 CLAY WIT H ""CRUMBLY"" CONSOLIDATION (DIFFERENT FROM SMOOTH CLA Y ABOVE) GRADING DOWNWARD INTO SMOOTH FIRM CLAY,109- 150 CM IS TOP OF LAYER OF CRUMBLY CLAY SIMILAR TO 85 CM MOTTLED N4  WITH VERY VERY FINE SILTY CONTENT (A SHY?) AND CLAY NODULES", INTENSE DEFORMATION, AT 13 6 CM IS CAVITY WHERE NODULE WAS REMOVED,,,," MOSTLY FIR M,SOFTER 48-60 CM", 33213000
58,442,A,6,6,0.0,70.0,47.50,55.00,55.70,DM, PELAGIC CLAY," 5GY4/1-DK.GREENISH GREY,5Y4/1-DK.GR EENISH GREY,N4-DK. GREY"," NO STRUCTURES,5GY4/1 TO 5Y 4/1 CLAY MOTTLED WITH N4 CLAY", INTENSE DEFORMATION,,,,, MODERATELY FIRM TO SOFT, 33213000
58,442,A,6,CC,0.0,20.0,47.50,55.80,55.90,DM, PELAGIC CLAY, 5Y4/1-DK.GREENISH GREY,,,,,,, SOFT-FIRM, 33213000
58,442,A,7,1,0.0,150.0,57.00,57.00,58.50,H, CLAY PASSING DOWNWARDS TO SILTY SAND (LOOKS LIKE A SHES)," 5Y4/1-LT.GREY,5GY4/1-LT.GREENISH GREY,5GY5/1 -GREENISH GREY,5Y6/1-GREY"," 0-80 CM IS 5Y4/1 TO 5GY4 /1 HEMIPELAGIC CLAY,80-110 CM IS DOWNWARD PROGRESSIV ELY 5GY5/1 THEN 5Y6/1,110-150 CM IS 5GY5/1 CLAY", MO DERATE TO INTENSE DEFORMATION," ASH ZONES (5Y6/1 COL OR?) AT 82,105,AND 115 CM,CLAY CHUNKS AT 140 AND 145 CM",,,, SOFT TO FIRM, 33213000
58,442,A,7,2,0.0,71.0,57.00,58.50,59.21,M, CLAY," 5GY5/1-GREENISH GREY,5G4/1-DK.GREENISH GREY",, HIGHLY DEFORMED," 5G4/1 CLAY CHUNKS AT 5,25,30,70 ,73,AND 122 CM",,, GRADUAL CHANGE INTO LAYER BELOW, FIRM, 33213000
58,442,A,7,2,71.0,150.0,57.00,59.21,60.00,M, CLAY, 5Y5/1-GREY,, HIGHLY DISTURBED,,,, GRADUAL CHA NGE FROM PREVIOUS LAYER, FIRM, 33213000
58,442,A,7,3,0.0,101.0,57.00,60.00,61.01,M, CLAY," 5GY5/1-GREENISH GREY,10R4/1-DK.REDDISH GREY ,5G4/1-DK.GREENISH GREY",, INTENSE DEFORMATION, 10R4 /1 PART 73-87 CM SURROUNDED (A LITTLE ON EACH SIDE) BY BRECCIATED HARD 5G4/1 CLAY,,,, FIRM, 33213000
58,442,A,7,4,0.0,38.0,57.00,61.50,61.88,M, CLAY, 5GY5/1-GREENISH GREY,, MODERATELY DISTURBED,,,,, FIRM, 33213000
58,442,A,7,4,38.0,54.0,57.00,61.88,62.04,M, VOLCANIC ASH ALTERNATED WITH GREYISH GREEN LAYER," 5Y6/1-GREY,5G4/2-GREYISH GREEN"," 38-50 CM IS 5Y6/1 ASH,50-54 CM IS ALTERNATED 5Y6/1 AND 5G4/2 LAYERS", SLIGHTLY DISTURBED,, VOLCANIC ASH,, GRADUAL PASSING FROM LAYER ABOV E (AND BELOW?), FIRM*,
58,442,A,7,4,54.0,141.0,57.00,62.04,62.91,M, CLAY," 5GY5/1-GREENISH GREY,10R4/1-DK.REDDISH"," 5G Y5/1 CLAY WITH BRECCIATED HARD CLAY NODULES AT 80,12 5 AND 128 CM,INTERCALATED 10R4/1 CLAY LAYER AT 137-1 38 CM", MODERATELY DISTURBED," BRECCIATED CLAY SPOTS ,10R4/1 CLAY LAYER",,,, FIRM*,
58,442,A,7,5,0.0,134.0,57.00,63.00,64.34,M, CLAY," 5GY5/1-GREENISH GREY,10R4/1-DK.REDDISH",, MO DERATELY DISTURBED," 10R4/1 CLAY SPLOTCHES AT 21,26- 32 (STRINGER?),AND 40 CM",,, 134-150 CM VOID*," FIRM 0-126 CM,126-134 CM SOFT",
58,442,A,7,CC,0.0,20.0,57.00,64.44,64.54,M, CLAY, 5GY5/1-GREENISH GREY,,,,,,, SOFT, 33213000
58,442,A,8,1,0.0,150.0,66.50,66.50,68.00,M, CLAY," 5G4/1-DK.GREENISH GREY,5Y5/1-GREY", BRECCIA TED (0.5-1.5 CM DIAMETER) 5G4/1 CLAY AND SOUPY 5Y5/1 CLAY, BRECCIA AND SLURRY,,,,, SOFT*,
58,442,A,8,2,0.0,150.0,66.50,68.00,69.50,M, CLAY," 5G4/1-DK.GREENISH GREY,5Y5/1-GREY"," BRECCIA TED 5G4/1 WITH SOUPY 5Y5/1,BELOW 100 CM SLOWLY PASSI NG TO FIRM BRECCIATE CLAY",,,,, SEE 8-1 FOR 0-100 CM, SOFT*,
58,442,A,8,3,0.0,150.0,66.50,69.50,71.00,M, CLAY," 5G4/1-DK.GREENISH GREY,5Y5/1-GREY"," 0-42 AN D 110-150 CM IS FIRM BRECCIATED CLAY,42-110 CM IS SO UPY BRECCIATED CLAY (SAME AS 8-2 0-100 CM AND 8-1)", BRECCIA,,,,," FIRM 0-42 110-150 CM,SOUPY 42-110 CM*",
58,442,A,8,4,0.0,150.0,66.50,71.00,72.50,M, CLAY," 5Y5/1-GREY,5YR3/2-DK.REDDISH BROWN"," VERTIC AL STRINGERS OF 5YR3/2 CLAY 0-35 CM,1 CM(?) BAND OF 5YR3/2 CLAY ARCHING FROM 40 CM THROUGH 38 CM BACK TO 40 CM",,,,,, FIRM*,
58,442,A,8,5,0.0,126.0,66.50,72.50,73.76,M, CLAY, 5Y5/1-GREY,,,,,," SAME AS 8-4,126-150 CM IS VOID", FIRM, 33213000
58,442,A,8,CC,0.0,20.0,66.50,73.91,74.01,M, CLAY, 5Y5/1-GREY,,,,,, SAME AS 8-5, FIRM, 33213000
58,442,A,9,1,0.0,150.0,76.00,76.00,77.50,M, CLAY," 5G4/1-DK.BLUISH GREY,2.5Y7/2-LT.GREY", 5G4/ 1 HARD BRECCIATED CLAY WITH SOUPY CLAY, DRILLING BR ECCIA," PUMICE BRECCIA (1.5 CM DIA.,2.5Y7/2 COLOR) A T DEPTHS OF 100 AND 130 CM", PUMICE,,, HARD CLAY WITH SOUPY CLAY MIXED IN, 33213000
58,442,A,9,2,0.0,150.0,76.00,77.50,79.00,M, CLAY, 5G4/1-DK.BLUISH GREY," 5G4/1 HARD BRECCIATE D CLAY WITH SOUPY CLAY,SAME AS 9-1", BRECCIA,,,,," HARD WITH SOUPY,SOUPY PART BECOMES SOFT 68-111 CM*",
58,442,A,9,3,0.0,41.0,76.00,79.00,79.41,M, CLAY, 5G4/1-DK.BLUISH GREY, HARD CLAY (5G4/1) WI TH SOUPY CLAY, BRECCIA,,,,, HARD AND SOUPY CLAYS, 33213000
58,442,A,9,CC,0.0,20.0,76.00,79.52,79.62,M, CLAY, 5G4/1-DK.BLUISH GREY, HARD CLAY (5G4/1) WI TH SOUPY CLAY, BRECCIA,,,,, HARD AND SOUPY PARTS, 33213000
58,442,A,10,1,0.0,150.0,85.50,85.50,87.00,M, CLAY," 5G5/1-GREENISH GREY,5GB4/1-DK.GREENISH GREY ,2.5Y7/1-LT.GREY"," 0-45 CM IS GRANULE AND SAND SIZED WITH SOUPY MUD,45-80 CM IS SUB-ANGULAR ROUNDED GRAN ULE (0.2 TO 0.4 CM DIA GRAINS PREDOMINANT),80-150 CM IS SUBANGULAR-SUBROUNDED GRANULE (0.4 TO 0.6 CM DIA GRAINS PREDOMINANT),GRANULE: 5G5/1 AND 5GB4/1 CLAY ASSOCIATED WITH SMALL AMOUNT OF 2.5Y7/1 VOLC. ASH", DRILLING BRECCIA,,,, BOUNDARIES ARE GRADUAL PASSING," SOFT OVERALL,5G5/1 AND 5GB4/1 CLAYS ARE VERY FIRM,2. 5Y7/1 VOLC. ASH IS HARD", 33213000
58,442,A,10,2,0.0,40.0,85.50,87.00,87.40,M, CLAY, 5G5/1-GREENISH GREY," HARD CLAY BRECCIA,SEE 10-1", DRILLING BRECCIA,,,,, HARD, 33213000
58,442,A,10,2,40.0,107.0,85.50,87.40,88.07,M, CLAY, 5GY6/1-GREENISH GREY, HARD CLAY WITH SOUPY CLAY, DRILLING BRECCIA--INTENSE DEFORMATION,,,,, HARD WITH SOME SOUPY COMPONENTS*,
58,442,A,10,2,107.0,150.0,85.50,88.07,88.50,M, CLAY, 5GY6/1-GREENISH GREY,, BRECCIATED,,,,, VERY FI RM, 33213000
58,442,A,10,3,0.0,150.0,85.50,88.50,90.00,H, MUD, 5Y5/1-GREY,, SLIGHTLY DEFORMED, VOLCANIC PI ECE AT 116 CM, VOLCANICS,,, FIRM, 33213000
58,442,A,10,4,0.0,58.0,85.50,90.00,90.58,M, CLAY," 5GY5/1-GREENISH GREY,5Y6/1-GREY (LT.)",,," BRE CCIATED HARD CLAY AT 18 CM,5Y6/1 VOLCANIC ASH ZONE 3 4 TO 36 CM AND SPOT OF SAME AT 40 CM"," VOLC. ASH,CLA Y",,, VERY FIRM*,
58,442,A,10,CC,0.0,15.0,85.50,90.72,90.77,M, CLAY, 5GY5/1-GREENISH GREY,,,,,,, SOFT*,
58,442,A,10,CC,15.0,20.0,85.50,90.77,90.82,M, ASH, 5YR3/1-V.DK.GREY,,,,,,, SOFT, 33213000.3651
58,442,A,11,1,20.0,150.0,95.00,95.20,96.50,H, MUD, 5GY4/1-DK.GREENISH GREY,," ALL DRILLING CLAY BRECCIA,VERY INTENSELY DEFORMED",,,,, SOUPY TO SOFT, 33213000
58,442,A,11,2,0.0,150.0,95.00,96.50,98.00,H, MUD, 5GY4/1-DK.GREENISH GREY,,, VOLCANIC FRAGMENTS, VOLC.FRAGS,," ALL DRILLING CLAY BRECCIA,VERY INTENSELY DEFORMED", SOFT TO SOUPY, 33213000
58,442,A,11,3,0.0,30.0,95.00,98.00,98.30,H, MUD, 5GY4/1-DK.GREENISH GREY,," 0-6 CM IS BRECCIAS :DRILLING DISTURBANCES,6-30 CM IS MODERATELY DEFORME D",,,,," SOUPY AT 0-6 CM,6-30 CM IS FIRM*",
58,442,A,12,1,0.0,65.0,104.50,104.50,105.15,H, CLAY BRECCIAS, 5Y4/1-DK.GREY,," DRILLING BRECCIAS, VERY INTENSELY DEFORMED", SOME VOLCANIC PIECES, SOM E VOLC. PIECES,, VOID 65-150 CM, VERY FIRM IN A SOU PY MATRIX*,
58,442,A,12,2,0.0,150.0,104.50,106.00,107.50,H, CLAY BRECCIAS, 5Y4/1-DK.GREY,," DRILLING BRECCIAS, VERY INTENSELY DEFORMED", SOME VOLCANIC PIECES, SOM E VOLC. PIECES,,, VERY FIRM IN A SOUPY MATRIX*,
58,442,A,12,3,0.0,150.0,104.50,107.50,109.00,H, CLAY BRECCIAS, 5Y4/1-DK.GREY,, DRILLING BRECCIAS, SOME VOLCANIC PIECES, SOME VOLC. PIECES,, SAME AS IN SECT. 1 AND 2, VERY FIRM IN A SOUPY MATRIX*,
58,442,A,12,4,70.0,150.0,104.50,109.70,110.50,H, CLAY, 5Y4/1-DK.GREY, SOUPY CLAY AND DRILLING CLA Y BRECCIAS, DRILLING BRECCIA, SOME VOLCANIC PIECES, SOME VOLC. PIECES,,, SOUPY CLAY AND BRECCIA*,
58,442,A,12,5,0.0,83.0,104.50,110.50,111.33,H, CLAY, 5Y4/1-DK.GREY,, VERY INTENSELY DEFORMED,,,,, V ERY FIRM BRECCIAS IN A SOUPY MATRIX*,
58,442,A,12,CC,0.0,21.0,104.50,111.43,111.54,H, CLAY, 5Y4/1-DK.GREY,, VERY INTENSELY DEFORMED,,,,, V ERY FIRM BRECCIA IN A SOUPY MATRIX*,
58,442,A,13,1,0.0,150.0,114.00,114.00,115.50,H, MUD, 5Y4/1-DK.GREY,, DRILLING BRECCIA TO INTENSEL Y DEFORMED, SOME PIECES OF VOLCANIC MATERIAL, SOME PIECES OF VOLC. MATERIAL,,, SOFT TO FIRM*,
58,442,A,13,2,0.0,73.0,114.00,115.50,116.23,H, MUD, 5Y4/1-DK.GREY,," INTENSELY DEFORMED,SOME MORE GREENISH BRECCIAS (40-45 AND 60-65 CM)",,,,, FIRM, 33213000
58,442,A,13,2,73.0,79.0,114.00,116.23,116.29,H, SAND, 5Y5/1-DK.GREY, CLAYEY UPWARDS, SLIGHTLY D EFORMED,,,,, FIRM*,
58,442,A,13,2,79.0,150.0,114.00,116.29,117.00,H, CLAYEY MUD, 5GY5/1-GREENISH GREY,, SLIGHTLY TO MO DERATELY DEFORMED, VOLCANIC LUMPS AT 120 AND 128 CM, VOLC. LUMPS,, VOID 80-87 CM, FIRM*,
58,442,A,13,3,0.0,20.0,114.00,117.00,117.20,H, CLAYEY MUD, 5Y5/1-GREY,, INTENSELY DEFORMED,,,,, SOF T*,
58,442,A,13,3,20.0,40.0,114.00,117.20,117.40,H, CLAYEY MUD, 5Y4/1-DK.GREY,," ""LAPILLI'S"" BRECCIAS CAUSED BY DRILLING",,,,, FIRM*,
58,442,A,13,CC,0.0,5.0,114.00,117.50,117.45,H, CLAYEY MUD, 5Y4/1-DK.GREY,," ""LAPILLI'S"" BRECCIAS CAUSED BY DRILLING",,,,, FIRM*,
58,442,A,14,1,0.0,150.0,123.50,123.50,125.00,H, CLAY, 5Y5/1-GREY,, DRILLING LAPILLI BRECCIAS IN A SOUPY CLAYEY MATRIX,,,,, VERY FIRM BRECCIAS IN A SOUPY MATRIX*,
58,442,A,14,2,27.0,85.0,123.50,125.27,125.85,H, CLAYEY MUD, 5Y5/1-GREY, MOTTLED BRECCIAS, HIGHL Y DEFORMED DRILLING BRECCIAS,,,, VOID 0-27 CM, SOFT T O FIRM*,
58,442,A,14,2,85.0,101.0,123.50,125.85,126.01,H, CLAYEY MUD, 5Y5/1-GREY,,,,,,, SOUPY, 33213000
58,442,A,14,3,0.0,33.0,123.50,126.50,126.83,H, CLAYEY MUD, 5Y5/1-GREY, MOTTLED BRECCIAS, DRILL ING BRECCIA,,,,, SOFT TO FIRM, 33213000
58,442,A,14,3,33.0,150.0,123.50,126.83,128.00,H, CLAYEY MUD, 5Y5/1-GREY, HOMOGENEOUS GREY CLAYEY MUD, MODERATELY DEFORMED, CLAY CHUNKS AT 115 CM,,,, FIRM*,
58,442,A,14,4,0.0,17.0,123.50,128.00,128.17,H, CLAYEY MUD, 5Y5/1-GREY,, SLIGHTLY TO HIGHLY DEFOR MED,,,, 0-2 CM IS VOID, FIRM*,
58,442,A,14,CC,0.0,18.0,123.50,128.27,128.35,H, CLAYEY MUD, 5Y5/1-GREY,, SLIGHTLY TO HIGHLY DEFOR MED,,,,, FIRM*,
58,442,A,15,1,0.0,118.0,133.00,133.00,134.18,H, CLAYEY DRILLING BRECCIAS," 5Y5/1-GREY,-BLACKISH,-R EDDISH", GREY CLAYEY DRILLING BRECCIAS WITH PIECES O F BLACKISH TO REDDISH CLAY-LIKE ROCKS, DRILLING BRE CCIA, PIECES OF BLACKISH TO REDDISH CLAY-LIKE ROCKS,,,, SOFT TO FIRM, 33213000
58,442,A,15,1,118.0,150.0,133.00,134.18,134.50,H, CLAYEY MUD, 5GY5/1-GREENISH GREY,, INTENSELY DEFO RMED,,,,, SOFT*,
58,442,A,15,2,0.0,150.0,133.00,134.50,136.00,H, CLAY," 5Y5/1-GREY,5GY5/1-GREENISH GREY", HOMOGENEO US 5Y5/1 TO 5GY5/1 CLAY, MODERATELY DEFORMED,,,, SMEA R SLIDE AT 70 CM, FIRM*,
58,442,A,15,3,0.0,150.0,133.00,136.00,137.50,H, CLAY," 5Y5/1-GREY,5GY5/1-GREENISH GREY", HOMOGENEO US, MODERATELY DEFORMED,,,, SAME LITHOLOGICAL FACIES AS IN SECT. 2 AND 4, FIRM, 33213000
58,442,A,15,4,0.0,46.0,133.00,137.50,137.96,H, CLAY," 5Y5/1-GREY,5GY5/1-GREENISH GREY,5Y4/2-OLIVE GREY"," 6-7 CM IS 5Y4/2 FIRMLY CLAYEY INTERBED,HOMOG ENEOUS", MODERATELY DEFORMED,,,,, FIRM*,
58,442,A,15,CC,0.0,10.0,133.00,138.06,138.06,H, MUDSTONE," 5Y5/1-GREY,5GY5/1-GREENISH GREY,5Y6/1-G REY"," 2 PIECES OF MUDSTONE: TOP IS 5Y5/1 TO 5GY5/1,B OTTOM IS 5Y6/1",,,,," 2 SMEAR SLIDES,PELAGIC CLAY IN BOTH CASES",, 33213000
58,442,A,16,1,0.0,150.0,142.50,142.50,144.00,H, CLAYEY MUD, 5Y5/1-GREY,," VARIABLY DEFORMED (FROM MODERATE TO BRECCIA),BRECCIA 14-23 44-88 AND 145-150 CM,MODERATE 88-120 CM,HIGHLY 23-44 120-145 CM",,,, VOI D 0-14 CM, VERY FIRM*,
58,442,A,16,2,0.0,150.0,142.50,144.00,145.50,H, CLAY," 5Y5/1-GREY,5Y4/2-OLIVE GREY,-GREENISH", 5Y5 /1 COLOR WITH A TREND TO MORE GREENISH (INTERMEDIATE WITH 5Y4/2), SLIGHTLY TO MODERATELY DEFORMED,,,, SME AR AT 75 CM:CLAY (99% CLAY SIZE MATERIAL), FIRM*,
58,442,A,16,3,0.0,20.0,142.50,145.50,145.70,H, CLAY," 5Y5/1-GREY,-WHITE",, MODERATELY TO INTENSELY DEFORMED, WHITE PUMICES (UP TO 1 CM) AT 17 CM, PU MICE,,, FIRM*,
58,442,A,16,CC,0.0,20.0,142.50,145.80,145.90,H, CLAY, 5Y5/1-GREY,, MODERATELY TO INTENSELY DEFORM ED,,,,, FIRM*,
58,442,A,17,1,0.0,147.0,152.00,152.00,153.47,H, CLAYEY MUDS," 5Y5/1-GREY,5BG4/1-DK.GREENISH GREY", PRESENCE OF 5BG4/1 MUDS--PROBABLE BROKEN INTERBEDS," DRILLING BRECCIAS,DEFORMATION A LITTLE LESS MARKED AT THE BOTTOM OF THE SECT. (BELOW 140 CM)",,,,, SOUPY*,
58,442,A,17,2,0.0,49.0,152.00,153.50,153.99,H, MUD, 5Y5/1-GREY, LARGE PIECES OF MUD IN A SOUPY MATRIX, BRECCIA,,,,, FIRM IN SOUPY MATRIX, 33213000
58,442,A,17,2,49.0,100.0,152.00,153.99,154.50,H, MUD, 5Y5/1-GREY,, INTENSELY DEFORMED,,,,, FIRM*,
58,442,A,17,CC,0.0,20.0,152.00,154.66,154.76,H, CLAY, 5Y5/1-GREY,,," ASH PIECES ( 6 AND 18 CM),BLAC KISH CLAY PIECES", ASH,,, FIRM*,
58,442,A,18,1,0.0,150.0,161.50,161.50,163.00,H, CLAYEY DRILLING BRECCIAS," 5Y5/1-GREY,N4-DK.GREY"," LOOKS LIKE GRADED BEDS,SIZE INCREASING DOWNWARDS,NO TE PRESENCE OF N4 MUDSTONES ALL ALONG SECTION--PROBA BLY RESULTING FROM THE BREAKDOWN OF DK. INTERBEDS", BRECCIA,,,,, VERY FIRM CLAY PEBBLES IN SOFTY MATRIX, 33213000
58,442,A,18,2,0.0,90.0,161.50,163.00,163.90,H, CLAYEY BRECCIAS," 5Y5/1-GREY,N4-DK.GREY"," LOOKING LIKE GRADED-BED SIZE INCREASING DOWNWARDS,PRESENCE O F BROKEN N4 PARTICLES", DRILLING BRECCIA, BROKEN N4 PARTICLES,,,,, 33213000
58,442,A,18,2,90.0,105.0,161.50,163.90,164.05,H, MUD, 5Y5/1-GREY,, VERY INTENSELY DEFORMED,,,, SAME MATERIAL AS ABOVE (18-2 0-90 CM), FIRM, 33213000
58,442,A,18,2,105.0,140.0,161.50,164.05,164.40,H, MUD," 5Y5/1-GREY,10YR5/4-YELLOWISH BROWN", PROGRES SIVE PASSAGE TO A 10YR5/4 MUD, INTENSE DEFORMATION,,,,, FIRM*,
58,442,A,18,2,140.0,150.0,161.50,164.40,164.50,H, MUD, 10YR5/4-YELLOWISH BROWN, HOMOGENEOUS,,,,,, VERY FIRM, 33213000
58,442,A,18,3,0.0,69.0,161.50,164.50,165.19,H, MUD, 10YR5/4-YELLOWISH BROWN, HOMOGENEOUS, SLIG HTLY DEFORMED,,, PRESENCE OF TEETH AND HEAD BONES OF FISH AROUND 53 CM,, FIRM, 33213000
58,442,A,18,3,69.0,75.0,161.50,165.19,165.25,H, MUD," 10YR5/4-YELLOWISH BROWN,10YR5/2-BROWN", INTE RBEDS OF 10YR5/2 MUD, SLIGHTLY DEFORMED,,,,, FIRM*,
58,442,A,18,CC,0.0,18.0,161.50,165.35,165.43,H, MUD, 10YR5/4-YELLOWISH BROWN, HOMOGENEOUS,,,,,, FIRM,
58,442,A,19,1,0.0,150.0,171.00,171.00,172.50,SM, PELAGIC CLAY, 10YR5/4-YELLOWISH BROWN, SOME DARK ENING AT BASE,,,,, 0-85 CM IS DOWNHOLE CONTAMINATION ZO NE, FIRM HARD CLAY*,
