Sample,Top [cm],Bottom [cm],Top Depth [m],Bottom Depth [m],Zone name (short),Sample comment,Preservation,Group abundance,Florisphaera profunda,Emiliania huxleyi,Gephyrocapsa ericsonii,Gephyrocapsa oceanica,Gephyrocapsa caribbeanica,Pseudoemiliania lacunosa,Pseudoemiliania ovata,Reticulofenestra asanoi,Reticulofenestra pseudoumbilicus,Reticulofenestra minuta,Reticulofenestra haqii,Reticulofenestra rotaria,Dictyococcites antarcticus,Cyclicargolithus floridanus,Coccolithus pelagicus,Coccolithus miopelagicus,Calcidiscus leptoporus,Calcidiscus macintyrei,Umbilicosphaera sibogae,Umbilicosphaera jafari,Umbilicosphaera rotula,Oolithotus fragilis,Helicosphaera carteri,Helicosphaera wallichii,Helicosphaera pavimentum,Helicosphaera intermedia,Helicosphaera inversa,Helicosphaera sellii,Helicosphaera stalis,Helicosphaera walbersdorfensis,Pontosphaera multipora,Pontosphaera japonica,Pontosphaera discopora,Scyphosphaera apsteinii,Scyphosphaera pulcherrima,Scyphosphaera canescens,Scyphosphaera globulata,Rhabdosphaera clavigera,Discosphaera tubifera,Umbellosphaera irregularis,Umbellosphaera tenuis,Syracosphaera pulchra,Syracosphaera lamina,Calciosolenia murrayi,Ceratolithus cristatus,Ceratolithus acutus,Amaurolithus tricorniculatus,Amaurolithus delicatus,Amaurolithus primus,Amaurolithus amplificus,Sphenolithus abies,Sphenolithus moriformis,Sphenolithus heteromorphus,Sphenolithus belemnos,Discoaster brouweri,Discoaster triradiatus,Discoaster variabilis,Discoaster pentaradiatus,Discoaster surculus,Discoaster tamalis,Discoaster asymmetricus,Discoaster quinqueramus,Discoaster berggrenii,Discoaster bollii,Discoaster bellus,Discoaster loeblichii,Discoaster hamatus,Discoaster neohamatus,Discoaster deflandrei,Discoaster kugleri,Discoaster petaliformis,Discoaster signus,Discoaster druggii,Orthorhabdus rugosus,Calcidiscus premacintyrei,Catinaster calyculus,Catinaster coalitus,Ceratolithus larrymayeri,Gephyrocapsa omega,Coronocyclus nitescens,Helicosphaera ampliaperta,Helicosphaera euphratis,Minylitha convallis,Orthorhabdus serratus,Sphenolithus capricornutus,Sphenolithus disbelemnos,Triquetrorhabdulus carinatus,Algirosphaera robusta,Braarudosphaera bigelowii,Calcidiscus pacificanus,Calcidiscus pataecus,Calcidiscus quadriperforatus,Calcidiscus tropicus,Calciosolenia brasiliensis,Catinaster mexicanus,Cryptococcolithus mediaperforate,Dictyococcites bisectus,Discoaster altus,Discoaster bergenii,Discoaster braarudii,Discoaster calcaris,Discoaster challengeri,Discoaster exilis,Discoaster extensus,Discoaster musicus,Discoaster neorectus,Discoaster prepentaradiatus,Discoaster spp.,Gephyrocapsa lumina,Gephyrocapsa muellerae,Gladiolithus flabellatus,Hayaster perplexus,Hayella challengeri,Helicosphaera gertae,Helicosphaera granulata,Helicosphaera magnifica,Helicosphaera mediterranea,Helicosphaera obliqua,Helicosphaera orientalis,Helicosphaera perch-nielseniae,Helicosphaera recta,Helicosphaera scissura,Ceratolithus atlanticus,Helicosphaera truempyi,Helicosphaera vedderi,Helicosphaera waltrans,Holodiscolithus macroporus,Hughesius gizoensis,Hughesius tasmaniae,Ilselithina fusa,Orthorhabdus rioi,Orthorhabdus striatus,Pontosphaera spp.,Pontosphaera syracusana,Reticulofenestra daviesii,Reticulofenestra gelida,Reticulofenestra minutula,Rhabdosphaera poculii,Rhabdosphaera spp.,Scyphosphaera apsteinii forma dilatata,Scyphosphaera cylindrica,Scyphosphaera intermedia,Scyphosphaera lagena,Scyphosphaera tubifera,Scyphosphaera ventriosa,Solidopons petrae,Sphenolithus calyculus,Sphenolithus conicus,Sphenolithus dissimilis,Syracolithus schilleri,Tetralithoides quadrilaminata,Tetralithoides symeonidesii,Triquetrorhabdulus challengeri,Triquetrorhabdulus milowii,Umbilicosphaera hulburtiana,Reworked species,Diatoms,Radiolarian fragments,Datum type,Ship File Links,Shore File Links,File Data,Exp,Site,Hole,Core,Type,Section,A/W,eodp_id
363-U1482A-1H-2-W 50/50-NANNO,0,0,2.0,2.0,NN21,AGSF - common Gephyrocapsa size is 4 to 5 microns; Ceratolithus cristatus HET coccolithomoprha present; Thoracosphaera fragments present - Braarudosphaera pentalith present (fragment),G [P33],A,A,C,F,C,,,,,,,,,,,P,,R,,F,,,,R,R,R,,,,,,,,,,,,,F,,,,F,,F,,,,,,,,,,,,,,,,,,,,,,,,,,,,,,,,,,,,,,,,,,,,,P,,,,,,,,,,,,,,,,,,,,,,,,,,,,,,,,,,,,,,,,,,,,,,,,,,,,,,,,,,,,,,,,,,,,,,,,,,363,U1482,A,1,H,2,W,8e9643cf62f3e235ef1678d86836e94e
363-U1482A-1H-CC-PAL-NANNO,0,5,2.93,2.98,NN21,TDJ - VG preservation need to add category,G [P41],A,A,A,,A,,,,,,,,,,,,,F,,F,,,,F,,,,,,,,,,,,,,,R,P,,,F,,,,,,,,,,,,,,,,,,,,,,,,,,,,,,,,,,,,,,,,,,,,,,,,,,,,,,,,,,,,,,,,,,,,,,,,,,,,,,,,,,,,,,,,,,,,,,,,,,,,,,,,,,,,,,,,,R,,,,,,,,363,U1482,A,1,H,CC,PAL,239523f229cf858768f47672a7b029ef
363-U1482A-2H-2-W 75/75-NANNO,0,0,5.15,5.15,,AGSF - Common Gephyrocapsa 3-4 microns in length - abundant; Pontosphaera sp. - Pontosphaera plana - Ceratolithus cristatus (including hoop-like coccoliths); B. bigelowii coccosphere,G [P33],D,A,C,F,A,,,,,,,,,,,,,F,,C,,,P,R,R,P,,,,,,P,,R,P,,,,R,R,R,,F,P,F,,,,,,,,,,,,,,,,,,,,,,,,,,,,,,,,,,,,,,,,,,,,,R,,,,,,,,,,,,,,,,,,,,,,,,,,,,,,,,,,,,,,,,,,,,P,,,,,,,,,,,,,,,,,,,P,,,,,,,,,,,363,U1482,A,2,H,2,W,6aa45e966c557700921dc2fac5308d6b
363-U1482A-2H-5-W 75/75-NANNO,0,0,9.65,9.65,,AGSF - P lacunosa present; Gephyrocapsa 4-5 um common; Gephyrocapsa <4 um also common; Reworked Discoaster pentaradiatus and W. barnesiae and Sphenolithus; Ceratolithus hoop like coccoliths,G [P33],A,A,,F,A,C,F,,,,,,,,,,,F,,F,,,,F,F,,,,,,,P,,,,,,,R,,,,F,,F,,,,,,,,,,,,,,,,,,,,,,,,,,,,,,,,,,,,,,,,,,,,,,,,,,,,,,,,,,,,,,,,,,,,,,,,,,,,,,,,,,,,,,,,,,,,,,,,,,,,,,,,,,,,,,,,,,,,,,,363,U1482,A,2,H,5,W,0f64ac810350ceafb78c8a30889e18ac
363-U1482A-2H-CC-PAL-NANNO,0,5,12.7,12.75,NN21,TDJ - VG pres; small Gephyro with low angle bar <3um; Ceratolithus cristatus HET coccolithomorpha type,G [P41],A,A,A,,A,,,,,,,,,,,,,,,F,,,,C,,,,,,,,,,,,,,,F,P,,,F,,,P,,,,,,,,,,,,,,,,,,,,,,,,,,,,,,,,,,,,,,,,,,,,,,,,,,,,,,,,,,,,,,,,,,,,,,,,,,,,,,,,,,,,,,,,,,,,,,,,,,,,,,,,,,,,,,,,,,,,,,363,U1482,A,2,H,CC,PAL,9f8bb2569b6f49c43866b73331d1bac3
363-U1482A-3H-2-W 75/75-NANNO,0,0,14.65,14.65,,AGSF - abundant to very abundant small Gephyrocapsa spp.; possible Reticulofenestra asanoi; Scyphosphaera sp.; Gephyrocapsa sp 4 to 5 microns also common to abundant; Pontosphaera plana; Ceratolithus hoop like coccoliths; NOTE: P lacunosa not observed in the sample LB -Above Ac G.caribbenica,G [P33],D,A,,A,A,C,,,P,,,,,,,P,,F,,F,,,,F,R,,,,,,,P,,,,,,,R,,,,R,F,F,,,,,,,,,,,,,,,,,,,,,,,,,,,,,,,,,,,,,,,,,,,,,,,,,,,,,,,,,,,,,,,,,,,,,,,,,,,,,,,,,,,,,,,,,,,,,,,,,,,,,,,,,,,,,,,,,,,,,,,363,U1482,A,3,H,2,W,931b5950544cdc912d530b529728e9ad
363-U1482A-3H-4-W 75/75-NANNO,0,0,17.65,17.65,,"AGSF - Ceratolithus telesmus - 2; Thoracosphaera; Gephyrocapsa size disrtibution: a. Gephyrocapsa 4 to 5 um - C to A, b. Gephyrocapsa < 4 um - C to A, c. small Gephyrocapsa spp, - A to VA; Note: in terms of the abundance of the 2 larger Gephyrocapsa, it seems that they are almost equal in abundance; Helicosphaera sp.; Rewoked taxa - Prediscosphaera and Watzanaueria; encountered 1 P. lacunosa LB-In Ac G.caribbeanica",G [P33],D,A,,A,A,C,P,,,,,,,,,,,R,,F,,,,F,P,,,,,,,P,,,,,,,R,,,,F,,F,,,,,,,,,,,,,,,,,,,,,,,,,,,,,,,,,,,,,,,,,,,,,,,,,,,,,,,,,,,,,,,,,,,,,,,,,,,,,,,,,,,,,,,,,,,,,,,,,,,,,,,,,,,,,,,,,,,,,,,363,U1482,A,3,H,4,W,eb1976875648679a58eef3a01945158e
363-U1482A-3H-6-W 75/75-NANNO,0,0,20.65,20.65,,"AGSF - Reworked taxa: R. pseudoumbilicus, Discoaster spp., Watznaueria; Ceratolithus hoop like coccoliths; Thoracosphaera fragments; Gephyrocapsa <4 and 4-5 um both present, but the former is more common than the latter",G [P33],D,A,,A,A,C,,,,,,,,,,,,F,,F,,,,F,P,,,,,,,P,,,P,,,,R,P,,,R,P,F,,,,,,,,,,,,,,,,,,,,,,,,,,,,,,,,,,,,,,,,,,,,,,,,,,,,,,,,,,,,,,,,,,,,,,,,,,,,,,,,,,,,,,,,,,,,,,,,,,,,,,,,,,,,,,,,,,,,,,,363,U1482,A,3,H,6,W,5ea143bdc88422dbfd030ed5ab48d914
363-U1482A-3H-CC-PAL-NANNO,0,5,22.12,22.17,NN21,TDJ - E. hux present; C. cristatus holo hoop; coccospheres present,VG [P33],D,V,A,,A,C,,,,,,,,,,,,F,,A,,,,C,R,,,,,,,,,,,,,,F,,,R,C,,,,,,,,,,,,,,,,,,,,,,,,,,,,,,,,,,,,,,,,,,,,,,,,,,,,,,,,,,,,,,,,,,,,,,,,,,,,,,,,,,,,,,,,,,,,,,,,,,,,,,,,,,,,,,,,,,,,,,,,,363,U1482,A,3,H,CC,PAL,2c9df9880f7775e4f8e017bd6f274bbd
363-U1482A-4H-2-W 75/75-NANNO,0,0,24.15,24.15,,"AGSF - The sample contains rounded P. lacunosa specimens rare to few; Reworked taxa: Discoasters, Sphenolithus; Pontosphaera plana; Holodiscolithus macroporus; with occurrene of G. parallela (~5.5 um) - these are large Gephyrocapsa sp with large central area spanned by almost horizontal bridge/bar - few to common In the sample; Gephyrocapsa <4 microns, although there are significant numbers of large (>5 um) Gephyrocapsa; small Gephyrocapsa also common in occurence LB-No E.huxleyi",G [P33],D,A,,C,A,C,F,,,,,,,,,,,F,,C,,,,F,,,,,,,,P,P,,,,,,R,,,P,F,,F,,,,,,,,,,,,,,,,,,,,,,,,,,,,,,,,,,,,,,,,,,,,,,,,,,,,,,,,,,,,,,,,,,,,,,,,,,,,,,,,,,,,,,,,,,,,,,,,,,,,,,,,,,,,,,,,,,,,,,,363,U1482,A,4,H,2,W,ea74fe56715c7675993ea08ff7915cd9
363-U1482A-4H-4-W 75/75-NANNO,0,0,27.15,27.15,,"AGSF - reworked taxa - Sphenolithus sp.; Ceratolithus telesmus; Gephyrocapsa sizes: a. Gephyrocapsa 4-5 um - C to A, b. Gephyrocapsa <3 um (small) - C to A, c. Gephyrocapsa <4 um - C; It appears that in the sample, 4 to 5 microns Gephyrocapsa sp. are more common than the other sizes",G [P33],D,A,,C,A,C,R,,,,,,,,,,,F,,C,,,,F,,,,,,,,P,,P,,,,,R,P,,,F,P,F,,,,,,,,,,,,,,,,,,,,,,,,,,,,,,,,,,,,,,,,,,,,,,,,,,,,,,,,,,,,,,,,,,,,,,,,,,,,,,,,,,,,,,,,,,,,,,,,,,,,,,,,,,,,,,,,,,,,,,,363,U1482,A,4,H,4,W,223c5c9820ac062b0e72cd4282fecaac
363-U1482A-4H-6-W 75/75-NANNO,0,0,30.15,30.15,,"AGSF - Gephyrocapsa 4 to 5 microns abundant; Gephyrocapsa ericsonii includes small Gephyrocapsa spp. <3 microns, Gephyrocapsa < 4um - few to common; P lacunosa - 2; Holodiscolithis macroporus; Pontosphaera plana",G [P33],A,A,,C,A,C,R,,,,,,,,,,,F,,R,,,,F,,,,,,,,P,,,,,,,R,,,,R,P,F,,,,,,,,,,,,,,,,,,,,,,,,,,,,,,,,,,,,,,,,,,,,,,,,,,,,,,,,,,,,,,,,,,,,,,,,,,,,,,,,,,,,,,,,,,,,,,,,,,,,,,,,,,,,,,,,,,,,,,,363,U1482,A,4,H,6,W,2fa7d23c390506195b50416070fde2f6
363-U1482A-4H-CC-PAL-NANNO,0,5,30.64,30.69,NN19,TDJ - P. lacunosa present,G [P33],D,V,,,V,A,F,P,,,,,,,,,,F,,A,,,,,,,,,,,,,,P,,,,,F,,R,,C,,,,,,,,,,,,,,,,,,,,,,,,,,,,,,,,,,,,,,,,,,,,,,,,,,,,,,,,,,,,,,,,,,,,,,,,,,,,,,,,,,,,,,,,,,,,,,,,,F,,,,,,,,,,,,,,,,,,,,,,,,363,U1482,A,4,H,CC,PAL,ec1dd17fddfbbb8ef1460a66e8408f02
363-U1482A-5H-2-W 75/75-NANNO,0,0,33.65,33.65,,"AGSF - Pontosphaera are quite common in the sample; Scyphosphaera porosa; Reworked taxa - Watznaueria; Thoracosphaera; For Gephyrocapsa sizes, it seems that 4 to 5 microns and <4 microns are almost equal in abundance; P lacunosa present",G [P33],A,A,,C,A,C,P,,,,,,,,,,,F,,F,,,,F,R,,,,,,,F,P,,R,,,,R,P,,,C,,F,,,,,,,,,,,,,,,,,,,,,,,,,,,,,,,,,,,,,,,,,,,,,,,,,,,,,,,,,,,,,,,,,,,,,,,,,,,,,,,,,,,,,,,,,,,,,,,,,,,,,,,,,,,,,,,,,,,,,,,363,U1482,A,5,H,2,W,ff36660197a9ab820ed8853a9ee1e28a
363-U1482A-5H-4-W 75/75-NANNO,0,0,36.65,36.65,,"AGSF - Thoracosphaera few to common in the samples; small Gephyocapsa very abundant; Scyphosphaera sp. few to common (s. porosa); G ericsonii includes small Gephyrocapsa spp.; G. oceanica common size is 3-4 um (not so much in the 4 to 5 microns category; compared to previous sample, less G. oceanica medium to large size); Reworked taxa: Discoaster, Watzanaueria",G [P33],A,A,,A,C,F,A,,P,,,,,,,,,R,,C,,,,C,,,,,,,,P,,,,,,,P,P,,,R,,,,,,,,,,,,,,,,,,,,,,,,,,,,,,,,,,,,,,,,,,,,,,,P,,,,,,,,,,,,,,,,,,,,,,,,,,,,,,,,,,,,,,,,,,,,,,,,,,,,,,,,,,,,,,,,,,,,,,,,,,363,U1482,A,5,H,4,W,3a89df0bb286e4c23fd1d4be5f85f5e2
363-U1482A-5H-6-W 75/75-NANNO,0,0,39.65,39.65,,AGSF - pontosphaera plana; reworked taxa: discoasters; Thoracosphaera few to common; Scyphosphaera porosa; Most Gephyrocapsa spp are < 4um although there are some that exceed 4 um in length;,G [P33],A,A,,C,A,C,A,,,,,,,,,,,R,,F,,,,F,,,,,,,,R,,P,P,,,,R,,,,,,F,F,,,,,,,,,,,,,,,,,,,,,,,,,,,,,,,,,,,,,,,,,,,,,,,,,,,,,,,,,,,,,,,,,,,,,,,,,,,,,,,,,,,,,,,,,,,,,,,,,,,,,,,,,,,,,,,,,,,,,,363,U1482,A,5,H,6,W,3f9bc51834a3654c310408a7aac223da
363-U1482A-5H-CC-PAL-NANNO,0,5,40.97,41.02,NN19,TDJ - reworked discoaster spp.; possibly reworked R. pseudoumbilicus,G [P33],D,V,,,A,,C,F,,,,,,,,,,F,,C,,,,F,,,,,,,,,P,,,,,,F,,,,C,,,P,,,,,,,,,,,,,,,,,,,,,,,,,,,,,,,,,,,,,,,,,,,,,,,,,,,,,,,,,,,,,,,,,,,,,,,,,,,,,,,,,,,,,,,,,,,,,,,,,,,,,,,,,,,,,,,R,,,,,,,363,U1482,A,5,H,CC,PAL,4849181629b674b7f8e1c72a708efb62
363-U1482A-6H-2-W 75/75-NANNO,0,0,43.15,43.15,,"AGSF - small Gephyrocapsa abundant; compared to previous samples, Gephyrocapsa 4 to 5 and <4 are almost non-existent; only small Gephyrocapsa spp are present",G [P33],A,A,,A,P,C,A,,,,,,,,,,,F,,R,,,P,F,,,,,,,,p,,P,,,,,R,,,,F,,F,,,,,,,,,,,,,,,,,,,,,,,,,,,,,,,,,,,,,,,,,,,,,,,,,,,,,,,,,,,,,,,,,,,,,,,,,,,,,,,,,,,,,,,,,P,,,,,,,,,,,,,,,,,,,,,,,,,,,,,,363,U1482,A,6,H,2,W,c8a98cec34d671228210962d8db47183
363-U1482A-6H-4-W 75/75-NANNO,0,0,46.15,46.15,,AGSF - small Gephyrocapsa acme (marked in the table as G. ericsonii); pontosphaera plana;,G [P33],D,A,,V,,C,A,,R,,,,,,,,,R,,R,,,,F,P,,,,,,,,P,,,,,,P,P,,,F,,F,,,,,,,,,,,,,,,,,,,,,,,,,,,,,,,,,,,,,,,,,,,,,,,,,,,,,,,,,,,,,,,,,,,,,,,,,,,,,,,,,,,,,,,,,P,,,,,,,,,,,,,,,,,,,,,,,,,,,,,,363,U1482,A,6,H,4,W,a4d296c1d4a72a6ee296ff1eb018bbf2
363-U1482A-6H-6-W 75/75-NANNO,0,0,49.15,49.15,,AGSF - small Gephyrocapsa acme (marked in the table as G. ericsonii); Thoracosphaera; pontosphaera plana; ** absent medium to large Gephyrocapsa; Reworked taxa: Sphenolithus,G [P33],D,A,,V,,C,A,,R,,,,,,,,,F,,F,,,R,F,,,,,,,,,,R,,,,,F,,,,F,,C,,,,,,,,,,,,,,,,,,,,,,,,,,,,,,,,,,,,,,,,,,,,,,,,,,,,,,,,,,,,,,,,,,,,,,,,,,,,,,,,,,,,,,,,,,,,,,,,,,,,,,,,,,,,,,,,,,,,,,,363,U1482,A,6,H,6,W,306b4a996aa98f72e94643440e6e5c58
363-U1482A-6H-CC-PAL-NANNO,0,5,50.79,50.84,NN19,TDJ - small Gephyrocapsa interval; U. foliosa present,G [P33],D,A,,,A,,C,C,,,,,,,,,,F,,F,,,,F,,,,,,,,,,,,,,,C,,,R,C,,,P,,,,,,,,,,,,,,,,,,,,,,,,,,,,,,,,,,,,,,,,,,,,,,,,,,,,,,,,,,,,,,,,,,,,,,,,,,,,,,,,,,,,,,,,,,,,,,C,,,,,,,,,,,,,,,,,,,,,,,,363,U1482,A,6,H,CC,PAL,c91b27175702e0e9d9dbf862b1f998b9
363-U1482A-7H-2-W 75/75-NANNO,0,0,52.65,52.65,,"AGSF - the large Gephyrocapsa spp is back (maximum size measured is ~6 microns); Thoracosphaera common; NOTE: small Gephyrocapsa did not disappear. Reworked taxa - D. pentaradiatus, Sphenolithus. Uniplanarius; Ceratolithus fragments, most probably C cristatus; Gephyrocapsa >5 um common as well as Gephyrocapsa <4 um; Ceratolithus cristatus",G [P33],A,A,,A,C,C,C,,,,,,,,,,,C,,C,,,R,C,P,,,,,,,,,R,P,P,,,C,,,P,R,,F,,,,,,,,,,,,,,,,,,,,,,,,,,,,,,,,,,,,,,,,,,,,,,,,,,,,,,,,,,,,,,,,,,,,,,,,,,,,,,,,,,,,,,,,,R,,,,,,,,,,,,,,,,,,,,,,,,,,,,,,363,U1482,A,7,H,2,W,11bffedd443243dfb9528fd3e5dad7af
363-U1482A-7H-4-W 75/75-NANNO,0,0,55.65,55.65,,"AGSF - Gephyrocapsa > 5 um- few to common, <4 microns also few to common; Reworked taxa: Discoasters; small Gephyrocapsa included in G ericsonii; Thoracosphaera sp.; P. ovata included in P lacunosa; Helicosphaera princei",G [P33],A,A,,A,C,C,C,,,,,,,,,,,F,,C,,,,C,,,,,,,,P,,P,R,F,,,C,P,,,F,,,,,,,,,,,,,,,,,,,,,,,,,,,,,,,,,,,,,,,,,,,,,,,,,,,,,,,,,,,,,,,,,,,,,,,,,,,,,,,,,,,,,,,,,,,F,,,,,,,,,,,,,,,,,,,,,,,,,,,,,,363,U1482,A,7,H,4,W,367d1fdca801c6b4579282f7066efd43
363-U1482A-7H-6-W 75/75-NANNO,0,0,58.65,58.65,,AGSF - Gephyrocapsa >5 um few to common in abundance; P lacunosa includes P ovata; ; small Gephyrocapsa common to abundant; Gephyrocapsa 3-4 um few to common as well.,G [P33],A,A,,C,C,C,C,,,,,,,,,,,F,,C,,,,C,,,,,R,,,P,P,P,P,,,,C,R,,,F,,R,,,,,,,,,,,,,,,,,,,,,,,,,,,,,,,,,,,,,,,,,,,,,,,,,,,,,,,,,,,,,,,,,,,,,,,,,,,,,,,,,,,,,,,,,P,,,,,,,,,,,,,,,,,,,,,,,,,,,,,,363,U1482,A,7,H,6,W,85b9438e2775a130e7c83c1f1798a466
363-U1482A-7H-CC-PAL-NANNO,0,5,60.16,60.21,NN19,TDJ - small Gephyrocapsa dominant,G [P33],D,A,,,A,,C,F,,,,,,,,,,F,,F,,,,C,,,,,,,,,,,,,,,F,P,,,C,,,,,,,,,,,,,,,,,,,,,,,,,,,,,,,,,,,,,,,,,,,,,,,,,,,,,,,,,,,,,,,,,,,,,,,,,,,,,,,,,,,,,,,,,,,,,,,,,,,,,,,,,,,,,,,,,,,,,,,,,363,U1482,A,7,H,CC,PAL,682599173b04dbb7af683963cdbcd77b
363-U1482A-8H-2-W 75/75-NANNO,0,0,62.15,62.15,,"AGSF - reworked forms- Discoaster pentaradiatus, Sphenolithus, Watznaueria; Thoracosphaera; Scyphosphaera spp.; small Gephyrocapsa sp (<3) included in G ericsonii tally; Gephyrocapsa < 4 - few to common; Scyphosphaera porosa; TDJ - reworked? very rare C. macintyrei",G [P33],A,A,,A,C,,C,,,,,,,,,,,C,,F,,,,C,,,,,R,,,,,R,R,,,,R,P,,,F,,R,,,,,,,,,,,,,,,,,,,,,,,,,,,,,,,,,,,,,,,,,,,,,,,,,,,,,,,,,,,,,,,,,,,,,,,,,,,,,,,,,,,,,,,,,R,,,,,,,,,,,,,,,,,,,,,,,,,,,,,,363,U1482,A,8,H,2,W,f983be7cd65c9f1433cb75524671b862
363-U1482A-8H-4-W 75/75-NANNO,0,0,65.15,65.15,,"AGSF - reworked taxa: Discoaster and Sphenolithus spp., Reticulofenestra pseudoumbilicus; Sample doesn't contain Gephyrocapsa > 4um; Gephyrocapsa <3 um included in G ericsonii",G [P33],A,A,,C,R,,C,,,,,,,,,,,F,R,C,,,,C,,,,,P,,,,,,,,,,C,,,,,,,R,,,,,,,,,,,,,,,,,,,,,,,,,,,,,,,,,,,,,,,,,,,,,,,,,,,,,,,,,,,,,,,,,,,,,,,,,,,,,,,,,,,,,,,,,,,,,,,,,,,,,,,,,,,,,,,,,,,,,,363,U1482,A,8,H,4,W,3d10c4e237eb36c0a51828fc2cebe579
363-U1482A-8H-6-W 75/75-NANNO,0,0,68.17,68.17,,AGSF - Gephyrocapsa >4 um absent; few C. macintyrei but also frequent C. pelagicus,,,,,A,,,C,,,,,,,,,F,,,F,,,,,,,,,,F,,,,,,,,,,,,,,,,,,,,,,,,,,,,,,,,,,,,,,,,,,,,,,,,,,,,,,,,,,,,,,,,,,,,,,,,,,,,,,,,,,,,,,,,,,,,,,,,,,,,,,,,,,,,,,,,,,,,,,,,,,,,,,,,,,,,,,,363,U1482,A,8,H,6,W,d521340abf3f6a502079b4e6dde0d102
363-U1482A-8H-CC-PAL-NANNO,0,5,69.74,69.79,NN19,TDJ - C. macintyrei present; small Gephyrocapsa 'oceanica' dominate gephyrocapsa; C. pelagicus present,G [P33],D,A,,,A,,C,F,R,,,,,,,R,,F,P,F,,,,F,,,,,,,,,F,,,,,,F,P,,,C,,,,,,,,,,,,,,,,,,,,,,,,,,,,,,,,,,,,,,,,,,,,,,,,,,,,,,,,,,,,,,,,,,,,,,,,,,,,,,,,,,,,,,,,,,,,,,,,,,,,,,,,,,,,,,,,,,,,,,,,,363,U1482,A,8,H,CC,PAL,a34b0348b91542bc27d4c479098cc29b
363-U1482A-9H-2-W 75/75-NANNO,0,0,71.65,71.65,,AGSF - Gephyrocapsa >4 um absent; D. brouweri most probably reworked,,,,,A,,,C,,,,,,,,,F,,,P,,,,,,,,,,F,,,,,,,,,,,,,,,,,,,,,,,,,,,,,,,,,,,,,,,,,,,,,,,,,,,,,,,,,,,,,,,,,,,,,,,,,,,,,,,,,,,,,,,,,,,,,,,,,,,,,,,,,,,,,,,,,,,,,,,,,,,,,,,,,,,,,,,363,U1482,A,9,H,2,W,d914c7dbbb39c4c2a32a489274c29369
363-U1482A-9H-4-W 75/75-NANNO,0,0,74.65,74.65,,AGSF - sample has common occurrence of Pontosphaera and Helicosphaera; D. brouweri probably reworked; Gephyrocapsa >4 um absent,,,,,A,,,C,,,,,,,,,,,,P,,,,,,,,,,F,,,,,,,,,,,,,,,,,,,,,,,,,,,,,,,,,,,,,,,,,,,,,,,,,,,,,,,,,,,,,,,,,,,,,,,,,,,,,,,,,,,,,,,,,,,,,,,,,,,,,,,,,,,,,,,,,,,,,,,,,,,,,,,,,,,,,,,363,U1482,A,9,H,4,W,45eb5ca016025e65aa02a1d95761008a
363-U1482A-9H-6-W 75/75-NANNO,0,0,77.69,77.69,,AGSF - Discoasters (D. pentaradiatus and D. brouweri) observed most probably reworked. Other reworked taxa include Sphenolithus spp. ; C. macintyrei not observed in the sample,,,,,A,C,,C,,,,,,,,,,,,,,,,,,,,,,F,,,,,,,,,,,,,,,,,,,,,,,,,,,,,,,,,,,,,,,,,,,,,,,,,,,,,,,,,,,,,,,,,,,,,,,,,,,,,,,,,,,,,,,,,,,,,,,,,,,,,,,,,,,,,,,,,,,,,,,,,,,,,,,,,,,,,,,363,U1482,A,9,H,6,W,38f58c23531c081f44670916e8e981cd
363-U1482A-9H-CC-PAL-NANNO,0,5,79.25,79.3,NN19,"TDJ - No discoaster, dominated by small Gephyrocapsa; no C. macintyrei",G [P33],D,A,,,A,,C,F,,,,,,,,,,F,x,C,,,,,,,,,,,,P,F,P,,,,,P,P,,,C,,,P,,,,,,,,,,,,,,,,,,,,,,,,,,,,,,,,,,,,,,,,,,,,,,,,,,,,,,,,,,,,,,,,,,,,,,,,,,,,,,,,,,,,,,,,,,,,,,,,,,,,,,,,,,,,,,,,,,,,,,363,U1482,A,9,H,CC,PAL,0fc09ff5fcc86a2de7b0f20ffff8634d
363-U1482A-10H-2-W 75/75-NANNO,0,0,81.15,81.15,,AGSF - Discoaster fragments present (D brouweri and D pentaradiatus); Gephyrocapsa 3 to 4 um present although some could slightly exceed 4 um in size; C. macintyrei consistently present - best estimate of top of C. mac.,,,,,A,P,,C,,,,,,,,,,,,F,,,,,,,,,,F,,,,,,,,,,,,,,,,,,,,,,,,,,,,,,,,,,,,,,,,,,,,,,,,,,,,,,,,,,,,,,,,,,,,,,,,,,,,,,,,,,,,,,,,,,,,,,,,,,,,,,,,,,,,,,,,,,,,,,,,,,,,,,,,,,,,,,,363,U1482,A,10,H,2,W,35d44e8c4505a720178083e540a61e23
363-U1482A-10H-4-W 75/75-NANNO,0,0,84.18,84.18,,AGSF - reworked forms include Sphenolithus; Gephyrocapsa >4 um absent!!; TDJ - C. macintyrei is present frequent,,,,,C,,,C,,,,,,,,,,,,F,,,,,,,,,,R,,,,,,,,,,,,,,,,,,,,,,,,,,,,,,,,,,,,,,,,,,,,,,,,,,,,,,,,,,,,,,,,,,,,,,,,,,,,,,,,,,,,,,,,,,,,,,,,,,,,,,,,,,,,,,,,,,,,,,,,,,,,,,,,,,,,,,,363,U1482,A,10,H,4,W,12a70f601ecdeb65d2e5b3b7d3480092
363-U1482A-10H-6-W 75/75-NANNO,0,0,87.22,87.22,,"AGSF - Reworked Discoasters (D. berggrenii/D. quinqueramus), fragments present as well, Sphenolithus spp. ; H sellii not observed in sample",,,,,C,,,C,,,,,,,,,,,,F,,,,,,,,,,,,,,,,,,,,,,,,,,,,,,,,,,,,,,,,,,,,,,,,,,,,,,,,,,,,,,,,,,,,,,,,,,,,,,,,,,,,,,,,,,,,,,,,,,,,,,,,,,,,,,,,,,,,,,,,,,,,,,,,,,,,,,,,,,,,,,,,,363,U1482,A,10,H,6,W,2d32bb8a097fb18538a876d9770df7e3
363-U1482A-10H-CC-PAL-NANNO,0,5,88.91,88.96,NN19,TDJ - 1 C. macintyrei; 1 reworked Discoaster; seemingly few Gephyrocapsa - dominated by Pseudoemiliania; double checked again - in 10H-4 there are frequent C. macintyrei - in this core catcher very rare (?reworked - 1 specimen).,G [P33],D,A,,,F,F,F,A,,,,,,,,P,,R,P,F,,,,C,R,,,,,,,,,C,,,,,R,,,,C,,,P,,,,,,,,,,,,,,,,,,,,,,,,,,,,,,,,,,,,,,,,,,,,,,,,,,,,,,,,,,,,,,,,,,,,,,,,,,,,,,,,,,,,,,,,,,,,,,,,,,,,,,,,,,,,,,,,,,,,,,363,U1482,A,10,H,CC,PAL,656ab79e83a313e23c90e9d626bd93e4
363-U1482A-11H-2-W 75/75-NANNO,0,0,90.65,90.65,,agsf - reworked taxa - Sphenolithus,,,,,C,,,C,,,,,,,,,,,,F,,,,,,,,,,R,,,,,,,,,,,,,,,,,,,,,,,,,,,,,,,,,,,,,,,,,,,,,,,,,,,,,,,,,,,,,,,,,,,,,,,,,,,,,,,,,,,,,,,,,,,,,,,,,,,,,,,,,,,,,,,,,,,,,,,,,,,,,,,,,,,,,,,363,U1482,A,11,H,2,W,12179aa55f2209d5e4cabe6c405b2f7b
363-U1482A-11H-4-W 75/75-NANNO,0,0,93.65,93.65,,"AGSF - reworked taxa include Cretaceous forms, Sphenolithus, Amuarolithus and Discoasters",,,,,,,,C,,,,,,,,,,,,F,,,,,,,,,,R,,,,,,,,,,,,,,,,,,,,,,,,,,,,,,,,,,,,,,,,,,,,,,,,,,,,,,,,,,,,,,,,,,,,,,,,,,,,,,,,,,,,,,,,,,,,,,,,,,,,,,,,,,,,,,,,,,,,,,,,,,,,,,,,,,,,,,,363,U1482,A,11,H,4,W,6faeb03793fc9d57cc2a54457caa0dd2
363-U1482A-11H-6-W 75/75-NANNO,0,0,96.66,96.66,,"AGSF - reworked Discoasters? some are well preserved, others fragmented",,,,,F,,,C,,,,,,,,,,,,F,,,,,,,,,,,,,,,,,,,,,,,,,,,,,,,,,,,,,,,,,,,,,,,,,,,,,,,,,,,,,,,,,,,,,,,,,,,,,,,,,,,,,,,,,,,,,,,,,,,,,,,,,,,,,,,,,,,,,,,,,,,,,,,,,,,,,,,,,,,,,,,,,363,U1482,A,11,H,6,W,4ef8971db09425aef36d89538b07a178
363-U1482A-11H-CC-PAL-NANNO,0,5,98.07,98.12,NN19,TDJ - no primary discoasters - some reworked (?) fragments,M [P33],D,A,,,,A,F,F,,,,,,,,,,R,,F,,,,F,,,,,,,,,,,,,,,,,,,F,,,,,,,,,,,,,x,,,,,,,,,,,,,,,,,,,,,,,,,,,,,,,,,,,,,,,,,,,,,,,,,,,,,,,,,,,,,,,,,,,,,,,,,,,,,,,,,,,,,,,,,,,,,,,,,,,,,,,,,,,,363,U1482,A,11,H,CC,PAL,8b4e8f5c13f85a4888ae6200ed082c49
363-U1482A-12H-2-W 75/75-NANNO,0,0,100.16,100.16,,"TDJ - D. brouweri frequent; Discoaster ""airplane""!",,,,,F,,,C,,,,,,,,,,,,P,,,,,,,,,,,,,,,,,,,,,,,,,,,P,,,,,,,,,,F,,,,,,,,,,,,,,,,,,,,,,,,,,,,,,,,,,,,,,,,,,,,,,,,,,,,,,,,,,,,,,,,,,,,,,,,,,,,,,,,,,,,,,,,,,,,,,,,,,,,,,,,,,,,363,U1482,A,12,H,2,W,7902aba2552e40305d9d0d8d57487684
363-U1482A-12H-4-W 75/75-NANNO,0,0,103.17,103.17,,TDJ - D. brouweri common; 1 (reworked?) D. pentaradiatus,,,,,,,,,,,,,,,,,,,,,,,,,,,,,,,,,,,,,,,,,,,,,,,,,,,,,,,,,C,,,,,,,,,,,,,,,,,,,,,,,,,,,,,,,,,,,,,,,,,,,,,,,,,,,,,,,,,,,,,,,,,,,,,,,,,,,,,,,,,,,,,,,,,,,,,,,,,,,,,,,,,,,,363,U1482,A,12,H,4,W,dec1cd3c352428ce1734f30c14b7a123
363-U1482A-12H-6-W 75/75-NANNO,0,0,106.19,106.19,,TDJ - D. brouweri common; D. triradiatus present,,,,,,,,,,,,,,,,,,,,,,,,,,,,,,,,,,,,,,,,,,,,,,,,,,,,,,,,,C,P,,,,,,,,,,,,,,,,,,,,,,,,,,,,,,,,,,,,,,,,,,,,,,,,,,,,,,,,,,,,,,,,,,,,,,,,,,,,,,,,,,,,,,,,,,,,,,,,,,,,,,,,,,,363,U1482,A,12,H,6,W,a18ee7250f0eb09760fbf2917f85d418
363-U1482A-12H-CC-PAL-NANNO,0,5,107.79,107.84,NN18,"TDJ - D. brouweri present; D. ""airplane"" present; 1 reworked D. pentaradiatus",M [P33],D,,,,,,,,,,,,,,,,,,,,,,,,,,,,,,,,,,,,,,,,,,,,,,,,,,,,,,,C,,,x,,,,,,,,,,,,,,,,,,,,,,,,,,,,,,,,,,,,,,,,,,,,,,,,,,,,,,,,,,,,,,,,,,,,,,,,,,,,,,,,,,,,,,,,,,,,,,,,,,,,,,,,,363,U1482,A,12,H,CC,PAL,5d6929ea0a31e6eb85432b9006058f7b
363-U1482A-13H-2-W 75/75-NANNO,0,0,109.65,109.65,,TDJ - D. pentaradiatus frequent,,,,,,,,,,,,,,,,,,,,,,,,,,,,,,,,,,,,,,,,,,,,,,,,,,,,,,,,,,,,F,,,,,,,,,,,,,,,,,,,,,,,,,,,,,,,,,,,,,,,,,,,,,,,,,,,,,,,,,,,,,,,,,,,,,,,,,,,,,,,,,,,,,,,,,,,,,,,,,,,,,,,,,363,U1482,A,13,H,2,W,bb8729e2eaf18dc9993f48c210bc8141
363-U1482A-13H-4-W 75/75-NANNO,0,0,112.67,112.67,,TDJ,,,,,,,,,,,,,,,,,,,,,,,,,,,,,,,,,,,,,,,,,,,,,,,,,,,,,,,,,,,,F,,,,,,,,,,,,,,,,,,,,,,,,,,,,,,,,,,,,,,,,,,,,,,,,,,,,,,,,,,,,,,,,,,,,,,,,,,,,,,,,,,,,,,,,,,,,,,,,,,,,,,,,,363,U1482,A,13,H,4,W,34bf0579b7be448ec5ff673a31b55e5f
363-U1482A-13H-6-W 75/75-NANNO,0,0,115.69,115.69,,TDJ,,,,,,,,,,,,,,,,,,,,,,,,,,,,,,,,,,,,,,,,,,,,,,,,,,,,,,,,,,,,F,,,,,,,,,,,,,,,,,,,,,,,,,,,,,,,,,,,,,,,,,,,,,,,,,,,,,,,,,,,,,,,,,,,,,,,,,,,,,,,,,,,,,,,,,,,,,,,,,,,,,,,,,363,U1482,A,13,H,6,W,4ed292b71e8fc3ab93168bf761b5ab84
363-U1482A-13H-CC-PAL-NANNO,0,5,117.47,117.52,NN17,TDJ - D. pentaradiatus present,M [P33],D,,,,,,,,,,,,,,,,,,,,,,,,,,,,,,,,,,,,,,,,,,,,,,,,,,,,,,,F,,,C,,,,,,,,,,,,,,,,,,,,,,,,,,,,,,,,,,,,,,,,,,,,,,,,,,,,,,,,,,,,,,,,,,,,,,,,,,,,,,,,,,,,,,,,,,,,,,,,,,,,,,,,,363,U1482,A,13,H,CC,PAL,f8a907a13193f5b99dbe92bff657309e
363-U1482A-14H-2-W 75/75-NANNO,0,0,119.15,119.15,,TDJ - 1 no D. surculus,,,,,,,,,,,,,,,,,,,,,,,,,,,,,,,,,,,,,,,,,,,,,,,,,,,,,,,,,,,,C,X,,,,,,,,,,,,,,,,,,,,,,,,,,,,,,,,,,,,,,,,,,,,,,,,,,,,,,,,,,,,,,,,,,,,,,,,,,,,,,,,,,,,,,,,,,,,,,,,,,,,,,,,363,U1482,A,14,H,2,W,bc5a723b1cb0fa74d00087d005c3923c
363-U1482A-14H-4-W 75/75-NANNO,0,0,122.17,122.17,,TDJ - D. surculus present,,,,,,,,,,,,,,,,,,,,,,,,,,,,,,,,,,,,,,,,,,,,,,,,,,,,,,,,,,,,,P,,,,,,,,,,,,,,,,,,,,,,,,,,,,,,,,,,,,,,,,,,,,,,,,,,,,,,,,,,,,,,,,,,,,,,,,,,,,,,,,,,,,,,,,,,,,,,,,,,,,,,,,363,U1482,A,14,H,4,W,7755544f90a414d9c160fb2a64471bcb
363-U1482A-14H-6-W 75/75-NANNO,0,0,125.18,125.18,,TDJ,,,,,,,,,,,,,,,,,,,,,,,,,,,,,,,,,,,,,,,,,,,,,,,,,,,,,,,,,,,,,,,,,,,,,,,,,,,,,,,,,,,,,,,,,,,,,,,,,,,,,,,,,,,,,,,,,,,,,,,,,,,,,,,,,,,,,,,,,,,,,,,,,,,,,,,,,,,,,,,,,,,,,363,U1482,A,14,H,6,W,d2d8f6a3575281ad6fdd2472f66225f2
