leg,site,hole,core,section,top interval depth (cm),bottom interval depth (cm),top of core depth(m),top of layer depth (m),bottom of layer depth (m), describer,lithology,color,structures,deformations due to drilling,unusual occurrences,minerals,paleontology,other observations,hardness or induration,z-coding
28,272,,1,1,46.0,105.0,4.00,4.46,5.05,, DIATOM SILTY CLAY, 10Y4/2-GRAYISH OLIVE,, INTENSE DEFORMATION,,,, DOES NOT FEEL GRITTY TO SCRAPE, SOFT, 00000000
28,272,,1,1,105.0,117.0,4.00,5.05,5.17,, SILTY CLAY, 5GY4/1-DARK GREENISH GRAY,, MODERATE DEFORMATION,,,, FEELS VERY GRITTY, SOFT, 00000000
28,272,,1,1,117.0,150.0,4.00,5.17,5.50,, DIATOM RICH SILTY CLAY, 5Y5/2-LIGHT OLIVE GRAY,, MODERATE DEFORMATION,,,, SLIGHTLY TEARING BUT NOT GRIT TY, SOFT, 00000000
28,272,,1,2,0.0,58.0,4.00,5.50,6.08,, SILTY CLAY, 5GY4/1-DARK GREENISH GRAY," GRADING I NTO SAND RICH SILTY CLAY 52-58 CM,DIATOM RICH SILTY CLAY 0-3 CM", MODERATE DEFORMATION,,,, SCATTERED COARS E SAND ESPECIALLY AFTER 26 CM, FIRM, 33213000
28,272,,1,2,58.0,150.0,4.00,6.08,7.00,, SAND BEARING CLAYEY SILT, 5Y4/1-OLIVE GRAY," SAND RICH SILTY CLAY TO CLAYEY SILT WITH HIGHER CHROMA T HAN UNDERLYING UNIT 58-71 CM,CLASTS", MODERATE DEFOR MATION,,,," NO DISTINCT CLUSTERS OF PEBBLES ALTHOUGH SO ME AREAS ARE RELATIVELY FREE AND BIGGER ONES TEND NO T TO BE RANDOMLY SCATTERED,NO DISTINCTIVE ROUNDNESS TO CLASTS", FIRM, 00000000
28,272,,1,3,0.0,70.0,4.00,7.00,7.70,, SAND RICH CLAYEY SILT," 5Y4/1-OLIVE GRAY,7Y4/1", 3 -4 SMALL (2-6 MM) CLASTS SIMILAR TO 140-143 CM, INT ENSE DEFORMATION,,,,, SOFT, 33213000
28,272,,1,3,70.0,150.0,4.00,7.70,8.50,, CLAYEY SILT," 5Y3/1-OLIVE GRAY,N4,5Y4/1", CLAST OF STIFF SILTY CLAY (5Y4/1) 140-143 CM, INTENSE DEFOR MATION,,,, SCATTERED SAND, SOFT, 33213000
28,272,,1,4,0.0,150.0,4.00,8.50,10.00,, CLAYEY SILT AND SILTY CLAY," 5Y4/1-OLIVE GRAY,N4"," COARSE SAND AND GRANULES AND PEBBLES SCATTERED THRO UGHOUT,NO OBVIOUS CONCENTRATIONS", INTENSE DEFORMATI ON,,,, UNIFORM, FIRM, 00000000
28,272,,1,5,0.0,150.0,4.00,10.00,11.50,, SILTY CLAY," 5Y4/1-OLIVE GRAY,N4",, INTENSE DEFORMA TION, SAND GRANULES AND PEBBLES SCATTERED THROUGHOU T,,, UNIFORM, FIRM, 00000000
28,272,,1,CC,0.0,0.0,4.00,11.60,11.60,, CLAYEY SILT, 5Y4/1-OLIVE GRAY,,, SOME PEBBLES,,,, SO FT, 00000000
28,272,,2,1,113.0,150.0,13.50,14.63,15.00,, SILTY CLAY, 5Y3/1-DARK OLIVE GRAY,,, ABUNDANT PEBB LES AND GRANULES,,,, FIRM, 00000000
28,272,,2,2,8.0,150.0,13.50,15.08,16.50,, SILTY CLAY, 5Y3/1-DARK OLIVE GRAY,,, ABUNDANT PEBB LES AND GRANULES WITH SOME TENDENCY TO CONCENTRATE,,," A FEW SMALL SHELL FRAGMENTS,UNIFORM MATRIX", STIFF, 00000000
28,272,,2,3,0.0,150.0,13.50,16.50,18.00,, SILTY CLAY AND CLAY, 5Y3/1-DARK OLIVE GRAY,, MODE RATE DEFORMATION 30-50 AND 100-150 CM, ABUNDANT PEB BLES AND GRANULES,,,, STIFF, 00000000
28,272,,2,4,0.0,150.0,13.50,18.00,19.50,, SILTY CLAY, 5Y3/1-DARK OLIVE GRAY,, MODERATE DEFO RMATION, ABOUT 1 GRANULE PER 2-3 CM OF CORE,,," RATHE R LOWER CLAST CONCENTRATION THAN SEC 2-3,OFTEN IRREG ULAR AND STREAKED CONTACTS WITH STIFF SEDIMENT"," FIR M, SOFT AT ABOUT 40%", 00000000
28,272,,2,5,0.0,150.0,13.50,19.50,21.00,, SILTY CLAY AND CLAY, 5Y3/1-DARK OLIVE GRAY,," MODE RATE DEFORMATION 0-30 AND 110-150 CM,INTENSE DEFORMA TION 30-110 CM"," ABOUT 1 GRANULE PER 2-3 CM IN STIFF LITHOLOGY,1 GRANULE PER 5-8 CM IN SOFT LITHOLOGY",,,," SOFT 30-110 CM,STIFF 130-150 CM", 00000000
28,272,,2,CC,0.0,0.0,13.50,21.10,21.10,, SILTY CLAY, 5Y3/1-DARK OLIVE GRAY,,, SOME PEBBLES,,,, FIRM, 00000000
28,272,,3,1,15.0,50.0,23.00,23.15,23.50,, SILTY CLAY, -DARK OLIVE,,,,,, NOT CUTTINGS, FIRM, 00000000
28,272,,3,1,50.0,150.0,23.00,23.50,24.50,, CLAYEY SILT AND SILTY CLAY, -OLIVE BLACK,,,,,," VOID 1 23-126 CM,ALMOST NO GRANULES AND PEBBLES,A LITTLE CO ARSE BUT MUCH FINE SAND", FIRM, 00000000
28,272,,3,2,0.0,150.0,23.00,24.50,26.00,, CLAYEY SILT, 5Y3/1-DARK OLIVE GRAY,,, RARE PEBBLES AND GRANULES,,," SLIGHT FIZZING IN ACID,NO TRACE OF B EDDING", SOFT, 00000000
28,272,,3,3,0.0,150.0,23.00,26.00,27.50,, SILTY CLAY, 5Y3/1-DARK OLIVE GRAY,, FRACTURED 0-1 2 CM AND 50-95 CM,,,, SLIGHT FIZZ IN ACID, SEMILITHIF IED, 00000000
28,272,,3,4,0.0,136.0,23.00,27.50,28.86,, SILTY CLAY," 5Y3/1-DARK OLIVE GRAY,10Y4/2-GRAYISH OLIVE", LAYER GRAYISH OLIVE DIATOM CLAYEY SILT 26-27 CM, FRACTURED THROUGHOUT,,,, SHELL FRAG 73 CM, FIRM, 00000000
28,272,,3,CC,0.0,0.0,23.00,29.10,29.10,, SILTY CLAY, 5Y3/1-DARK OLIVE GRAY,,,,,, NO PEBBLES, SEMILITHIFIED, 00000000
28,272,,4,1,73.0,150.0,32.50,33.23,34.00,, SILTY CLAY, 5Y3/1-DARK OLIVE GRAY,, FRACTURED 130 -150CM, A FEW PEBBLES AND GRANULES,,,, SEMILITHIFIED, 00000000
28,272,,4,2,0.0,150.0,32.50,34.00,35.50,, SILTY CLAY, 5Y3/1-DARK OLIVE GRAY,," MICROFRACTURE D THROUGHOUT SLIGHT FIZZ WITH ACID,NO BEDDING VISI BLE,VOID 36-38 CM",,,,, SEMILITHIFIED, 00000000
28,272,,4,3,0.0,150.0,32.50,35.50,37.00,, SILTY CLAY AND CLAY, 5Y3/1-DARK OLIVE GRAY,, MICR OFRACTURED THROUGHOUT," SCATTERED PEBBLES AND GRANUL ES,SOME CLUSTERS",,,, FIRM, 00000000
28,272,,4,4,0.0,147.0,32.50,37.00,38.47,, SILTY CLAY AND CLAY, 5Y3/1-DARK OLIVE GRAY,," MICR OFRACTURED THROUGHOUT,MODERATE DEFORMATION 90-147 CM",,,, NO BEDDING VISIBLE, FIRM, 00000000
28,272,,4,5,0.0,150.0,32.50,38.50,40.00,, SILTY CLAY AND CLAY, 5Y3/1-DARK OLIVE GRAY,, MICROFRACTURED, SCAT TERED PEBBLES AND GRANULES,,, NO VIS IBLE BEDDING, FIRM, 33213000
28,272,,4,CC,0.0,0.0,32.50,40.10,40.10,, DIATOM BEARING SILTY CLAY, N4-MEDIUM DARK GRAY,,,,,,, SEMILITHIFIED, 00000000
28,272,,5,1,72.0,150.0,42.00,42.72,43.50,, SILTY CLAY, 5Y2/1-OLIVE BLACK,,,,,," MORE ANGULAR THAN IN CORES 3 AND 4,NO BEDDING VISIBLE", FIRM, 00000000
28,272,,5,2,0.0,150.0,42.00,43.50,45.00,, SILTY CLAY, 5Y2/1-OLIVE BLACK,, MODERATE DEFORMAT ION 100-110 CM AND 125-130 CM,,,, SOME PARTS FIZZ SLIG HTLY WITH ACID, FIRM, 00000000
28,272,,5,3,0.0,150.0,42.00,45.00,46.50,, SILTY CLAY, 5Y2/1-OLIVE BLACK,, MICROFRACTURED TH ROUGHOUT, A FEW PEBBLES AND GRANULES,,,, FIRM, 00000000
28,272,,5,CC,0.0,0.0,42.00,46.60,46.60,, SILTY CLAY, 5YR2/1-OLIVE BLACK,,,,,, NO PEBBLES, SEM ILITHIFIED, 00000000
28,272,,6,1,0.0,99.0,51.50,51.50,52.49,, SILTY CLAY," 5Y2/1-OLIVE BLACK,10Y4/2-GRAYISH OLIV E"," 50 MM PEBBLE OF DIORITE IN VOID 19-33 CM,GRAYISH OLIVE SEMILITHIFIED AND PARTLY FRACTURED BED OR CLA ST OF DIATOM SILTY CLAY 41-53 CM",,,,," METHANE GAS,NEITH ER BLACK NOR GREEN LITHOLOGIES FIZZ WITH ACID", SEMI LITHIFIED, 00000000
28,272,,6,2,0.0,150.0,51.50,53.00,54.50,, SILTY CLAY, 5Y2/1-OLIVE BLACK,, MICROFRACTURED TH ROUGHOUT,,,, SLIGHTLY MORE LITHIFIED LAYER 37-44 CM, SEMILITHIFIED, 00000000
28,272,,6,3,0.0,150.0,51.50,54.50,56.00,, SILTY CLAY, 5Y3/1-DARK OLIVE GRAY,,,,,, VERY GASSY, STIFF TO SEMILITHIFIED, 00000000
28,272,,6,4,0.0,150.0,51.50,56.00,57.50,, SILTY CLAY, 5Y3/1-DARK OLIVE GRAY, MORE BRITTLE AND FRACTURED BED 78-83 CM,,,,," VERY GASSY,FRACTURE PAT TERN SUGGEST POSSIBLE VAGUE HORIZONTAL BEDDING"," MOS TLY STIFF (DUE TO GAS EXPANSION?),SOME PARTS AT TOP ARE SEMILITHIFIED", 00000000
28,272,,6,CC,0.0,0.0,51.50,57.60,57.60,, SILTY CLAY AND CLAYEY SILT, 5Y2/1-OLIVE BLACK,,,,,, N O PEBBLES SEEN, FIRM, 00000000
28,272,,7,1,103.0,150.0,61.00,62.03,62.50,, SILTY CLAY, 5Y2/1-OLIVE BLACK, SINGLE BLACK INCL USION 146-151 CM (NOT CARBONATE), MODERATE DEFORMAT ION,,,, METHANE GAS, SEMILITHIFIED, 00000000
28,272,,7,2,0.0,150.0,61.00,62.50,64.00,, SILTY CLAY, 5Y3/1-DARK OLIVE GRAY,, HIGHLY MICROF RACTURED 80-130 CM,,,," GENERALLY IN 10 CM BLOCKS,LACK OF PEBBLES AND GRANULES IN UPPER PART OF SECTION", S EMILITHIFIED, 33213000
28,272,,7,CC,0.0,0.0,61.00,64.10,64.10,, DIATOM RICH SILTY CLAY, 5Y3/1-DARK OLIVE GRAY,,, A FEW PEBBLES AND GRANULES,,,, FIRM, 33213000.2220
28,272,,8,1,0.0,150.0,70.50,70.50,72.00,, SILTY CLAY, 5Y3/1-DARK OLIVE GRAY,, MICROFRACTURE D, A FEW SCATTERED PEBBLES AND GRANULES,,," HAS THE G ENERAL APPEARANCE OF A DRILLING BRECCIA,GAS EXPANDED", SOFT, 33213000
28,272,,8,2,0.0,49.0,70.50,72.00,72.49,, BRECCIA,,,,,,, AS IN 8-1,, 00000000
28,272,,8,2,73.0,150.0,70.50,72.73,73.50,, SILTY CLAY," 5Y3/1,5GY4/1-DARK GREENISH GRAY", COM PLETELY BRECCIATED MATERIAL 82-94 CM,, SOME SCATTERE D COARSE SAND AND GRANULES,,, SOME SPLITTING FRACTURI NG BUT GENERALLY QUITE GOOD, STIFF-SEMILITHIFIED, 00000000
28,272,,8,3,0.0,150.0,70.50,73.50,75.00,, SILTY CLAY," 5GY4/1-DARK GREENISH GRAY,5Y3/1", POS SIBLE VAGUE (LESS THAN 10 CM) BEDDING PICKED OUT BY COLOR, SOME LOCAL FRACTURING RESULTING FROM SPLITTI NG,,,, MOSTLY DIATOM BEARING, STIFF TO SEMILITHIFIED, 00000000
28,272,,8,4,0.0,150.0,70.50,75.00,76.50,, SILTY CLAY, 5GY4/1-DARK GREENISH GRAY, CLASTS TH ROUGHOUT, SOME LOCAL FRACTURING RESULTING FROM SPLI TTING BUT GENERALLY QUITE GOOD,,,," SOME SUBTLE COLOR V ARIATIONS,SURFACE TOO ROUGH TO SEE ANY STRUCTURES", STIFF TO SEMILITHIFIED, 00000000
28,272,,8,CC,0.0,0.0,70.50,76.60,76.60,, SILTY CLAY, 5Y3/1-DARK OLIVE GRAY,,, RARE GRANULES,,,, SEMILITHIFIED, 00000000
28,272,,9,1,80.0,150.0,80.00,80.80,81.50,, SILTY CLAY, 5Y2/1-OLIVE BLACK, CLASTS THROUGHOUT, BROKEN UP 100-105 CM, GRANULES AND PEBBLES,,," MET HANE + ETHANE GAS,NO CARBONATE LITHIFICATION,WHOLE C ORE SANDIER THAN 8,CUT ON DIAMOND SAW BECAUSE OF CLA STS,MATRIX IS BAND SAW HARD", SEMILITHIFIED TO LITHI FIED, 00000000
28,272,,9,2,0.0,150.0,80.00,81.50,83.00,, SILTY CLAY," 5Y2/1-OLIVE BLACK,-BLUE,-RED", CORE O F GRANITE COBBLE 27-29, MODERATE DEFORMATION 0-50 C M," COMMON SAND + GRANULES + PEBBLES 40-145 CM,RED J ASPEROID 82/98/112 CM,BLUE QUARTZ 59 CM,REDDISH GRAN ITE 134 CM,DARK ARGILLITE 138 CM",,, SCATTERED BLOCKS OF SILTY CLAY, FIRM, 00000000
28,272,,9,3,0.0,150.0,80.00,83.00,84.50,, SILTY CLAY," 5Y2/1-SILTY CLAY,-WHITE,-RED"," CLASTS THROU GHOUT,WHITE QUARTZITE 67 CM,RED JASPEROID 115 CM", MODERA TE DEFORMATION 30-40/70-80/140-150 CM,,,," S HELL FRAGMENT 130 CM,FIZZES SLIGHTLY WITH ACID IN MO ST PLACES,BROKEN INTO MANY BLOCKS,ONLY ABOUT 60% OF CORE SURFACE IS SUITABLE FOR CLAST SEARCHING", SEMIL ITHIFIED, 00000000
28,272,,9,4,0.0,150.0,80.00,84.50,86.00,, SILTY CLAY, 5Y3/1-DARK OLIVE GRAY, GREENER INTER VAL 59-63 AND 135-136 CM,," SHARP OBLIQUE CONTACT AT 79 CM WITH OVERLYING LITHOLOGY GREENER AND LESS SAND Y,MICROFRACTURING 50-77/92-120/140-150 CM,SAWN BLOCK S 0-34/77-92/120-140 CM,FRACTURED BLOCKS 34-50 CM",,,, FIRM, 00000000
28,272,,9,CC,0.0,0.0,80.00,86.10,86.10,, SILTY CLAY, 5Y3/1-DARK OLIVE GRAY,,, SOME PEBBLES AND GRANULES,,,, STIFF TO SEMILITHIFIED, 00000000
28,272,,10,1,0.0,150.0,89.50,89.50,91.00,, SILTY CLAY," 5Y3/1-DARK OLIVE GRAY,10R2/2",,," SCATTE RED GRANULES AND PEBBLES,100X60X50 MM COBBLE OF QUAR TZITE WITH QUARTZ VEIN AND SOME TRACES OF BEDDING",,," 2 MM SHELL FRAGMENT 87 CM,GAS IN CORE", SEMILITHIFIE D, 00000000
28,272,,10,2,0.0,150.0,89.50,91.00,92.50,, SILTY CLAY," 5Y3/1-DARK OLIVE GRAY,5Y6/4,10Y4/2",,," SCATTERED GRANULES AND SMALL PEBBLES,LIMESTONE CLAST 81 CM,SEMILITHIFIED MUDSTONE 104 CM",,," SAWN BLOCKS T HROUGHOUT,5% VOIDS,NO FIZZ WITH ACID,IN INTERVALS WI TH NO GRANULES EXISTS MUCH COARSE SAND", SEMILITHIFI ED, 00000000
28,272,,10,3,0.0,150.0,89.50,92.50,94.00,, SILTY CLAY, 5Y3/1-DARK OLIVE GRAY,,, SCATTERED GRA NULES AND FINETCOARSE SAND THROUGHOUT,,, MICROFRACTUR ING, SEMILITHIFIED, 00000000
28,272,,10,4,6.0,150.0,89.50,94.06,95.50,, SILTY CLAY, 5Y3/1-DARK OLIVE GRAY,," HIGHLY FRACTU RED 116-139CM,LOOSE FRACTURED BLOCKS 6-29 CM,SAWN BL OCKS 29-116 CM AND 139-150 CM"," RARE PEBBLES,SCATTER ED GRANULES AND COARSE SAND THROUGHOUT",,, 10% VOIDS 2 9-116 CM, FIRM, 00000000
28,272,,10,5,0.0,150.0,89.50,95.50,97.00,, SILTY CLAY, 5Y3/1-DARK OLIVE GRAY,," LOOSE FRACTUR ED BLOCKS 0-16 AND 100-150 CM,SAWN BLOCKS (20% VOIDS ) 16-100 CM", SCATTERED GRANULES AND COARSE SAND THR OUGHOUT,,," A FEW PARTS FIZZ WITH ACID,NO BEDDING", SE MILITHIFIED, 00000000
28,272,,10,CC,0.0,0.0,89.50,97.10,97.10,, SILTY CLAY, 5Y2/1-OLIVE BLACK,,, SOME PEBBLES AND GRANULES,,,, FIRM, 00000000
28,272,,11,1,0.0,150.0,99.00,99.00,100.50,, SILTY CLAY, 5Y3/1-DARK OLIVE GRAY,," SAWN BLOCKS ( 15% VOID) 0-115 CM,FRACTURED BLOCKS 115-150 CM", SCA TTERED GRANULES AND FINE PEBBLES, 1 MM LUMP OF PYRI TE 13 CM,," NO BEDDING VISIBLE,EVEN WHERE NO GRANULES THERE IS COARSE SAND", FIRM, 00000000
28,272,,11,2,0.0,150.0,99.00,100.50,102.00,, SILTY CLAY, 5Y3/1-DARK OLIVE GRAY,," FRACTURED BLO CKS 0-90 CM,MOSTLY SAWN BLOCKS (30% VOIDS) 90-150 CM", RARE GRANULES + SOME COARSE SAND,,," VOID 142-144 C M,SOME OBLIQUE FRACTURES ALTHOUGH MOST ARE HORIZONTA L", FIRM, 00000000
28,272,,11,3,0.0,150.0,99.00,102.00,103.50,, SILTY CLAY, 5Y3/1-DARK OLIVE GRAY,, MOSTLY SAWN B LOCKS (20% VOID), RARE PEBBLES AND GRANULES,,,, FIRM, 00000000
28,272,,11,4,0.0,150.0,99.00,103.50,105.00,, SILTY CLAY," 5Y3/1-DARK OLIVE GRAY,10Y4/2-GRAYISH OLIVE"," GRAYISH OLIVE DIATOM RICH SILTY CLAY BED WIT H ABOUT 1 CM INTERBEDDING OF MAJOR LITHOLOGY 11-22 C M,TWO IRREGULAR RATHER LENTICULAR BEDS OF SILTY CLAY WITHOUT GRANULES OR COARSE SAND (DIATOM RICH?)85-86 AND 86-5-87 CM", FRACTURED 31-40 AND 97-102 CM, SC ATTERED GRANULES AND COARSE SAND,,,, FIRM, 00000000
28,272,,11,5,0.0,148.0,99.00,105.00,106.48,, SILTY CLAY," 5Y3/1-DARK OLIVE GRAY,1/Y4/2", BED OF SOFTER SILTY CLAY (10Y4/2) WITH FEWER COARSE SAND G RAINS BUT STILL SOME SAND & GRANULES AND SHARP BASE 87-89 AND 97-99 CM, SAWN BLOCKS THROUGHOUT," MUDSTO NE CLAST 15 CM,SCATTERED GRANULES AND PEBBLES",,," VOID 8-10 AND 37-39 CM,SHELL FRAGMENT (2 MM) 46 CM,FRACT URES ABOVE 97 CM ARE HORIZONTAL,25 DEGREE DIP FRACTU RES 119 AND 135 CM", FIRM, 00000000
28,272,,11,CC,0.0,0.0,99.00,106.60,106.60,, SILTY CLAY,,,,,,,, FIRM, 00000000
28,272,,12,1,28.0,150.0,108.50,108.78,110.00,, SILTY CLAY," 5Y2/1-OLIVE BLACK,10Y4/2",," DRILLING B RECCIA 28-90 CM,HORIZONTAL FRACTURES"," 4X3X3 CM PURP LISH PEBBLE 29 CM,6X4X3 CM PEBBLE 89 CM,3 MUDSTONE C LASTS 119 CM,MUDSTONE CLAST 125 CM",,, CONSIDERABLY MO RE CLAYEY THAN 9-11, SEMILITHIFIED, 00000000
28,272,,12,2,0.0,150.0,108.50,110.00,111.50,, SILTY CLAY, 5Y3/1-DARK OLIVE GRAY,," SEVERE SPLITT ING DISTURBANCE,MICROFRACTURED,BROKEN INTO LARGE BLO CKS THROUGHOUT",,,," A FEW SAW BLOCKS SUGGEST 1 GRANULE PER 3-6 CM,NO PEBBLES SEEN EXCEPT 1 DISC SHAPED 10 M M,RARE GRANULES AND COARSE SAND", FIRM, 00000000
28,272,,12,CC,0.0,0.0,108.50,111.60,111.60,, SILTY CLAY,,,,,,,, FIRM, 00000000
28,272,,13,1,0.0,150.0,118.00,118.00,119.50,, SILTY CLAY," 5Y3/1-DARK OLIVE GRAY,10Y4/2-GRAYISH OLIVE"," MOTTLED (10Y4/2) 125-130 CM,BED OF 10Y4/2 13 0-134 CM"," SAWN BLOCKS (30% VOIDS) 0-27 CM,FRACTURED BLOCKS WITH MICROFRACTURED MATERIAL AND RARE SAWN B LOCKS 27-150 CM"," OCCASIONAL SMALL PEBBLES+GRANULES, RARE COARSE SAND,PEBBLE (60X30X25 MM) 110 CM",,, VOID 134-148 CM, FIRM, 33213000
28,272,,13,2,0.0,150.0,118.00,119.50,121.00,, SILTY CLAY," 10Y4/2-GRAYISH OLIVE,5Y3/1"," MOTTLES (<1 CM) OF 10Y4/2 THAT MAY BE CLASTS OR BURROWS (RAT HER ANGULAR) 0-51 CM,MOTTLED SHARP CONTACTS 36-39 CM"," SAWN OR CLEARLY FRACTURED BLOCKS 0-100 CM,SEVERE SPLITTING DEFORMATION AND MANY BLOCKS+MICROFRACTURIN G 100-150 CM"," GRANULES AND COARSE SAND THROUGHOUT,M ICACEOUS QUARTZITE PEBBLE(42X30X16 MM)128 CM",,,, FIRM, 33213000
28,272,,13,3,0.0,150.0,118.00,121.00,122.50,, SILTY CLAY, 5Y2/1-OLIVE BLACK,," FRACTURED BLOCKS 0-60 CM,SAWN BLOCKS 60-90 CM,SAWN BLOCKS 98-105 CM,F RACTURED BLOCKS 105-150 CM"," SCATTERED GRANULES AND PEBBLES IN LOW CONCENTRATIONS EXCEPT IN CARBONATE LI THIFIED TUBE 85-90 CM,NO CLASTS >5 MM SEEN EXCEPT IN SAWN BLOCKS",,,, FIRM, 33213000
28,272,,13,CC,0.0,0.0,118.00,122.60,122.60,, DIATOM SILTY CLAY,,,,,,,, FIRM, 00000000
28,272,,14,1,0.0,150.0,127.50,127.50,129.00,, SILTY CLAY," 5Y3/1-DARK OLIVE GRAY,10Y4/2", SUGGES TION OF 4 BEDS ( 1 CM) OF 10Y4/2 LITHOLOGY IN HIGHLY DISTURBED AREA 50-125 CM," FRACTURED BLOCKS 0-49 AN D 83-119 CM,HIGHLY MICROFRACTURED WITH MUCH SPLITTIN G DISTURBANCE 49-83 AND 119-150 CM", RARE GRANULES ( 1 PER 5-10 CM) AND A LITTLE COARSE SAND,,,, FIRM, 00000000
28,272,,14,2,0.0,150.0,127.50,129.00,130.50,, SILTY CLAY, 5Y3/1-DARK OLIVE GRAY,," MICROFRACTURE D AND SEVERE SPLITTING DISTURBANCES 0-93 CM,SAWN AND FRACTURED BLOCKS 93-150 CM"," RARE PEBBLES+GRANULES, A LITTLE COARSE SAND",,,, SEMILITHIFIED, 00000000
28,272,,14,3,0.0,150.0,127.50,130.50,132.00,, SILTY CLAY," 5Y3/1,5GY4/1,5Y4/4,10Y4/2"," BURROW SA G-BLOCK CONTACTS APPEAR FAULTED,DIATOM SILTY CLAY 66 -68.4 CM,SILTY CLAY WITH COARSE SAND+GRANULES 68.4-6 9 CM,DIATOMITE 69-70-4 CM,SILTY CLAY WITH RARE GRANU LES 70.4-80 CM,SILTY CLAY (MORE DIATOMS?) 80-85 CM,S ILTY CLAY WITH RARE GRANULES 85-150 CM"," FRACTURED B LOCKS 0-58 CM,SAWN BLOCKS 58-72 CM,INTENSELY FRACTUR ED 72-93 CM,CLEARLY FRACTURED BLOCKS 93-150 CM", RAR E GRANULES,,,, FIRM, 00000000
28,272,,14,4,0.0,150.0,127.50,132.00,133.50,, SILTY CLAY, 5Y3/1-DARK OLIVE GRAY,," MOSTLY FRACTU RED BLOCKS WITH SOME SAWN BLOCKS 0-100 CM,MOSTLY MIC ROFRACTURED WITH SOME FRACTURED BLOCKS 100-150 CM"," SAWN BLOCKS SUGGEST 1 GRANULE OR PEBBLE >5 MM PER 10 CM,NO CLASTS > 5 MM SEEN",,,, FIRM, 00000000
28,272,,14,CC,0.0,0.0,127.50,133.60,133.60,, SILTY CLAY, 5GY4/1-DARK GREENISH GRAY,,, A FEW PEB BLES+GRANULES,,,, SEMI-LITHIFIED, 00000000
28,272,,15,1,88.0,150.0,137.00,137.88,138.50,, SILTY CLAY, 5Y3/1-DARK OLIVE GRAY,," DRILLING BREC CIA 88-96 CM,IRREGULARLY FRACTURED BLOCKS (SUFFICIEN TLY LARGE TO BE IN PLACE (NOT DRILLING BRECCIA) 96-1 50 CM"," 8 MM PEBBLE 142 CM,1 GRANULE PER 20 CM,RARE COARSE SAND",,,, FIRM, 00000000
28,272,,15,2,0.0,115.0,137.00,138.50,139.65,, SILTY CLAY," 5Y2/1-OLIVE BLACK,5Y5/2-LIGHT OLIVE G RAY,10Y4/2-GRAYISH OLIVE",, MUCH MICROFRACTURING IN U PPER PART OF CORE," GRANITE PEBBLE (40X30X30 MM) 35 CM,1 GRANULE OR PEBBLE EVERY 20 CM",,, 3 MM SHELL FRAG MENT 78 CM, STIFF, 00000000
28,272,,15,2,115.0,150.0,137.00,139.65,140.00,, DIATOM SILTY CLAY," 5Y5/2-LIGHT OLIVE GRAY,10Y4/2- DIATOM SILTY CLAY", LIGHT OLIVE GRAY BAND OF SILTY C LAY DIATOMITE 115-119 CM,,,,,, STIFF, 00000000
28,272,,15,CC,0.0,0.0,137.00,140.10,140.10,, DIATOM RICH SILTY CLAY, 5GY4/1-DARK GREENISH GRAY,,,,,, NO GRANULES OR PEBBLES SEEN, SEMILITHIFIED, 00000000
28,272,,16,1,80.0,150.0,146.50,147.30,148.00,, DIATOM SILTY CLAY, 5GY4/1-DARK GREENISH GRAY," 10 DEGREE BEDDING DIP IN CORED BLOCK 88-97 CM AT TOP ( BEDDING PICKED OUT BY THIN SANDIER LAMINAE,DIAGENETI C LENSE 3X10 MM) 109 CM", DRILLING BRECCIA 80-87 CM,,,, 2 MM SHELL FRAGMENT 105 CM, STIFF, 00000000
28,272,,16,2,0.0,150.0,146.50,148.00,149.50,, DIATOM SILTY CLAY," 5GY4/1-DARK GREENISH GRAY,10Y4 /2-GRAYISH OLIVE",,," LOW GRANULE/PEBBLE RATIO,COARSE S AND VERY RARE",,, GRAYISH OLIVE 136-150 CM, STIFF, 00000000
28,272,,16,3,0.0,10.0,146.50,149.50,149.60,, DIATOM SILTY CLAY, 10Y4/2-GRAYISH OLIVE,,,,,,, FIRM, 33213000.2220
28,272,,16,3,10.0,140.0,146.50,149.60,150.90,, SILTY CLAY," 5Y3/1-DARK OLIVE GRAY,5GY4/1-DARK GRE ENISH GRAY,10Y4/2", SOME VAGUE PATCHES OF DARK GREEN ISH GRAY 10-57 CM, MODERATE DEFORMATION AND VERY BL OCKY 10-40 CM," A FEW CLASTS,ABUNDANT GRANULES+PEBBL ES,COARSE SAND COMMON",,," DARK OLIVE GRAY 10-57 CM,CAR BONATE LITHIFIED DARK OLIVE GRAY 57-82 CM,DARK OLIVE GRAY 82-140 CM", FIRM, 33213000
28,272,,16,CC,0.0,0.0,146.50,151.10,151.10,, QUARTZ DIORITE,,,,,,," DRILLED COBBLE,UNCUT DIMENSION IS 4 CORE", HARD, 00000000
28,272,,17,1,86.0,150.0,156.00,156.86,157.50,, DIATOM SILTY CLAY, 5Y3/1-DARK OLIVE GRAY,,," SPARSE SMALL PEBBLES+GRANULES OF DIATOM RICH SILTY CLAY,TW O HARD GRANULES",,,, FIRM, 33213000.2220
28,272,,17,2,6.0,150.0,156.00,157.56,159.00,, DIATOM SILTY CLAY, 5Y3/1-DARK OLIVE GRAY,, SAWN B LOCKS 6-61CM," CLASTS, SMALL PEBBLES",,," BLOCK CARBONA TE LITHIFIED DIATOM SILTY CLAY,VOID 65-72CM", FIRM, 33213000.2220
28,272,,17,3,0.0,65.0,156.00,159.00,159.65,, SILTY CLAY, 5Y4/1-DARK OLIVE GRAY,,,,,, OFTEN DIATOM RICH OR DIATOM SILTY CLAY, FIRM, 33213000
28,272,,17,3,66.0,150.0,156.00,159.66,160.50,, DIATOM SILTY CLAY," 5GY4/1-DARK GREENISH GRAY,10Y4 /2-GRAYISH OLIVE,5Y2/1-OLIVE BLACK"," GRAYISH OLIVE G RAY 66-67 CM,DARK PATCHES (5Y4/1),RARE LARGE MOTTLES OF 5Y4/1 100-122 CM",,,,," DARK GREENISH GRAY 67-100 CM, GRAYISH OLIVE 100-122 CM,OLIVE BLACK 122-130 CM,DARK GREENISH GRAY 130-150 CM", FIRM, 33213000.2220
28,272,,17,CC,0.0,0.0,156.00,160.60,160.60,, SILTY CLAY DIATOMITE, 5GY4/1-DARK GREENISH GRAY,,,,,, NO PEBBLES OR GRANULES SEEN,, 00000000
28,272,,18,1,0.0,150.0,165.50,165.50,167.00,, SILT CLAY-RICH DOLOMITE, 5GY6/1-GREENISH GRAY," T HIN INDISTINCT DARK LAMINAE THE WIDTH OF CORE AT 118 CM,SUGGESTIONS OF SEVERAL SIMILAR LAMINAE ABOVE AND BELOW,CLOSE-SPACED CONJUGATE SHEER APPARENT FROM ZO NES UP TO 1 MM WIDE - ACUTE ANGLE (70 DEGREES) CLOSE R TO VERTICAL",,,,," CORE WELL PRESERVED,UNIDENTIFIED THI N WALLED BROKEN SHELL 28 CM,NO ALTERED BEDDING,NO CL ASTS",, 00000000
28,272,,18,2,0.0,150.0,165.50,167.00,168.50,, SILT CLAY DOLOMITE," 5GY4/1-LIGHT GREENISH GRAY,5G Y6/1-DARK GREENISH GRAY"," DARK THIN LAMINAE EVERY 2- 4 CM DOWN TO 70 CM WHERE THERE IS A GRADATION INTO A DARKER SHADE OF DIATOMITE,THIN DARK LAMINAE 122 CM",, NODULE 120 CM,, LOW SPIRAL GASTROPOD 15 CM,,, 00000000
28,272,,18,CC,0.0,0.0,165.50,168.60,168.60,, DIATOM SILT, 10Y4/2-GRAYISH OLIVE,,,,,, NO PEBBLES OR GRANULES SEEN, FIRM, 00000000
28,272,,19,1,128.0,150.0,175.00,176.28,176.50,, SILT CLAY DIATOMITE, 10Y4/2-GREYISH OLIVE," MODER ATE MOTTLING (INDISTINCT BUT DEFINITE),SUGGESTIONS O F HORIZONTAL BEDDING",,,,,, SEMILITHIFIED, 00000000
28,272,,19,2,0.0,150.0,175.00,176.50,178.00,, SILT CLAY DIATOMITE," 10Y4/2-GRAYISH OLIVE,5Y2/1-O LIVE BLACK"," MOTTLED >1.5 CM 0-27 CM,LAMINAE AND BED S AND MOTTLES OF OLIVE BLACK BECOMING INCREASINGLY C OMMON DOWNWARD UNTIL IT PREDOMINATES 27-60,ORIGINALL Y 3 1-5 CM BEDS OF 10Y4/2 DIATOMITE 114-141 CM"," BRE CCIATED 60-95 CM,INTENSE DEFORMATION 115-140 CM"," 2 3 MM ?CLASTS OR ?MOTTLES (10Y4/2) 113 CM,COARSE SAND +GRANULES",,,,, 00000000
28,272,,19,3,0.0,150.0,175.00,178.00,179.50,, SILTY CLAY DIATOMITE, 5Y3/1-DARK OLIVE GRAY,,," VER Y RARE GRANULES AND A FEW COARSE SAND GRAINS,LIMESTO NE CLAST 45 CM",,, SOME OBLIQUE FRACTURING THROUGHOUT CORE, SEMILITHIFIED, 00000000
28,272,,19,4,0.0,80.0,175.00,179.50,180.30,, SILTY CLAY, 5Y4/1-OLIVE GRAY,,,,,," THIN SHELL FRAGMEN T (5 MM) 53 CM,RARE COARSE SAND GRAINS", SEMILITHIFI ED, 00000000
28,272,,19,4,80.0,150.0,175.00,180.30,181.00,, DIATOM SILTY CLAY, 5Y4/1-OLIVE GRAY,,,,,,, STIFF, 00000000
28,272,,19,5,0.0,144.0,175.00,181.00,182.44,, DIATOM SILTY CLAY, 5Y2/1-OLIVE BLACK,,, VERY FINE GRANULES+FINE PEBBLES,," SMALL BIVALVE 88 CM,SLICED C ROSS-SECTION OF BIVALVE 14 AND 80 CM",, STIFF, 00000000
28,272,,19,6,0.0,150.0,175.00,182.50,184.00,, DIATOM SILTY CLAY, 5Y2/1-OLIVE BLACK,,," SAWN THROU GH AND BROKEN UP GRANITE PEBBLE (ORIGINALLY 12MM) 37 CM,VERY RARE GRANULES",, FLAKES OF SHELL 44 AND 78 A ND 137 CM,, STIFF, 00000000
28,272,,19,CC,0.0,0.0,175.00,184.10,184.10,, DIATOM BEARING SILTY CLAY, 5Y3/1-DARK OLIVE,,,,,, NO PEBBLES OR GRANULES SEEN, FIRM, 00000000
28,272,,20,CC,0.0,0.0,184.50,184.60,184.60,, DIATOM SILTY CLAY," 5Y3/1-DARK OLIVE GRAY,5GY4/1-D ARK GREENISH GRAY", 1-3 MM BANDS OF DARK GREENISH GR AY 100-109 CM,,,,, NO PEBBLES OR GRANULES, FIRM, 33213000.2220
28,272,,21,1,112.0,150.0,194.00,195.12,195.50,, DIATOM SILTY CLAY, 5Y3/1-OLIVE GRAY,,,,,, A FEW EVENL Y SCATTERED COARSE SAND GRAINS, SEMILITHIFIED, 33213000.2220
28,272,,21,2,0.0,150.0,194.00,195.50,197.00,, SILTY CLAY DIATOMITE, 5Y3/1-OLIVE GRAY,,, SMALL IR REGULAR (HIGHLY DEFORMED) SOFT SEDIMENT CLASTS 130 C M,, 4 SCATTERED THIN SHELL FRAGMENTS 2-4 MM LONG AND SOME SMALLER PIECES," APPARENT DIPS 50 DEGREES IN FRACTURES THAT MAY BE DUE TO DRILLING,AREA OF UNIFOR M COLOR VERY SLIGHTLY DARKER THAN THE HOST SEDIMENT WHICH IS ALSO UNIFORM, NO DENSITY DIFFERENCE,NO GRAN ULES BELOW 108 CM BUT SAND GRAINS CONTINUE", SEMILIT HIFIED, 00000000
28,272,,21,3,0.0,137.0,194.00,197.00,198.37,, SILTY CLAY DIATOMITE," 5Y3/1-DARK OLIVE GRAY,10Y4/ 2",,," RARE GRANULES,FINE PEBBLES+COARSE SAND",," SHELL F RAGMENTS,1 CM LONG CROSS SECTIONS OF ARTICULATED BIV ALVES FILLED WITH 10Y4/2 SILTY CLAY DIATOMITE"," HORI ZONTAL FRACTURES,CLOSE FRACTURING DIPPING 60 DEGREES 131-137 CM",, 00000000
28,272,,21,3,137.0,150.0,194.00,198.37,198.50,, SILTY CLAY, 10Y4/2-GRAYISH OLIVE, INDISTINCTLY M OTTLED,,,,,, FIRM, 33213000
28,272,,21,4,0.0,150.0,194.00,198.50,200.00,, DIATOM SILTY CLAY, 5Y3/1-DARK OLIVE GRAY,, MOSTLY BRECCIATED 115-130 CM, RARE COARSE SAND+GRANULES,," SHELL FRAGS 15,17,26,77CM"," PARALLEL FRACTURES IN C ORE DIPPING O5-40 DEGREES,VERY CLOSE FRACTURING AT 7 0-80CM,OTHERWISE BROKEN INTO 2-20 CM BLOCKS", FIRM, 33213000.2220
28,272,,21,5,0.0,150.0,194.00,200.00,201.50,, SILTY CLAY DIATOMITE AND DIATOM SILTY CLAYSTONE," 5Y3/1-OLIVE GRAY,5GY4/1-DARK GREENISH GRAY",,,,,, COLOR D IFFERENCES MUCH STRONGER IN THIS SECTION,, 33213000.2220
28,272,,21,CC,0.0,0.0,194.00,201.60,201.60,, DIATOM SILTY CLAYL DIATOM SILTY CLAY,, RARE TRACEZ 00000000*,,,,, IVE BLACK, FIRM,
28,272,,22,1,0.0,150.0,203.50,204.00,205.50,, DIATOM SILTY CLAY, DARK GREENISH GRAY, HORIZONTA L BEDDING (VAGUE),, VERY RARE COARSE SAND + GRANULES,,, FRACTURES ARE HORIZONTAL, FIRM, 00000000
28,272,,22,2,0.0,150.0,203.50,205.50,207.00,, DIATOM SILTY CLAY, 5Y3/1-DARK OLIVE GRAY,,," VERY R ARE COARSE SAND+GRANULES,MUDSTONE PEBBLE 40 AND 140 CM",," BIVALVE SHELL 18 CM,SHELL FRAGMENTS 43/56/59/66 /138/145/148 CM", SUBHORIZONTAL FRACTURES, FIRM, 00000000
28,272,,22,3,0.0,150.0,203.50,207.00,208.50,, DIATOM SILTY CLAYSTONE, 5GY4/1-DARK GREENISH GRAY,,,,," 2 MM THIN SHELL FRAGMENTS 45 CM,SHELL FRAGMENT 51 CM",, SEMILITHIFIED, 00000000
28,272,,22,4,0.0,150.0,203.50,208.50,210.00,, DIATOM SILTY CLAY, 5Y3/1-DARK OLIVE GRAY,, INTENS E DEFORMATION 25-30/35-45/120-125/142-150 CM, VERY RARE GRANULES+COARSE SAND,, 1 MM SHELL FRAGMENT 68 A ND 127 CM,, SEMILITHIFIED, 00000000
28,272,,22,5,0.0,150.0,203.50,210.00,211.50,, DIATOM SILTY CLAY, 5GY3/1-DARK GREENISH GRAY,, IN TENSE DEFORMATION 12-30 AND 90-107 CM," PEBBLE 144 C M,VERY COARSE SAND",, 1 MM SHELL FRAGMENT 40 AND 46 C M," NO BEDDING VISIBLE,SOME OBLIQUE FRACTURES", SEMI LITHIFIED, 00000000
