leg,site,hole,core,section,top interval depth (cm),bottom interval depth (cm),top of core depth(m),top of layer depth (m),bottom of layer depth (m), describer,lithology,color,structures,deformations due to drilling,unusual occurrences,minerals,paleontology,other observations,hardness or induration,z-coding,eodp_id,sample
57,438,,1,1,0.0,24.0,0.00,0.00,0.24,K, COARSE SANDY MUD, 5Y4/1,, MOD,,,, SMEAR AT 9CM DOM, SOFT*,,08015097d1bd0117da222daa49a72814,57-438-1-1
57,438,,1,1,24.0,150.0,0.00,0.24,1.50,K, MED SANDY MUD, 5Y4/1, PATCHES OF COARSE PUMACEOUS (?) SAND AT 60-66 + 88-100CM," BRECCIA AT 24-115CM, MOD AT 115-150CM",,,, SMEAR AT 131CM DOM, SOFT*,,2a2d5fa3d83d2d0d670456a426b32b17,57-438-1-1
57,438,,1,2,0.0,150.0,0.00,1.50,3.00,K, MED SANDY MUD, 5Y4/1, PATCHES OF COARSE PUMACEOUS SAND AT 10-15 + 20-24 + 68-73CM, MOD, PUMICE PEBBLES 5MM MAX SIZE AT 135-141CM,,, SMEAR AT 60CM DOM, SOFT*,,53c5ff6110c835da44f1b1c3edea3050,57-438-1-2
57,438,,1,3,0.0,150.0,0.00,3.00,4.50,B, SANDY (MED-COARSE) MUD WITH POCKETS OF SAND, 5Y4/1," 109-135CM IS VOID, VERY COARSE SAND POCKET AT 29-33CM", MOD, PUMICE PEBBLES AT 32 + 43 + 68- 70CM,,," SMEARS AT: 24CM DOM, 77CM DOM",, 33212000,72294957a6485eb9b2f863f442653e0f,57-438-1-3
57,438,,1,4,0.0,35.0,0.00,4.50,4.85,MA, COARSE SANDY MUD," 5Y4/1, 5Y4/2"," 0-10CM IS VOID, GRAIN SIZE INCREASES TOWARD BOTTOM (PROB DRILL WASH), DK + LT GRAINS VERY COMMON AT BOTTOM ROCK FRAGS", MOD,,,,, SOFT, 33212000,4a9659ad392ba15f619497e405ea2a9e,57-438-1-4
57,438,,2,1,0.0,50.0,5.00,5.00,5.50,MA, FINE MUDDY SAND, 5Y4/2-OLIVE GRAY,, BRECCIA,,,, SMEAR AT 24CM DOM*, SOUPY,,b310431bd1069e2efb338c7dfb2680e4,57-438-2-1
57,438,,2,1,50.0,115.0,5.00,5.50,6.15,MA, SANDY-SILTY MUD, 5Y4/2-OLIVE GRAY,, MUD," OCCAS PEBBLE SUBROUNDED-ROUNDED UP TO 5MM OR SO, WHITE PUMICE FRAG 1CM DIA AT 76-78CM",,, SMEAR AT 104CM DOM, SOFT*,,703c1e21df552478866b82c0766d0475,57-438-2-1
57,438,,2,1,115.0,150.0,5.00,6.15,6.50,MA, COARSE MUDDY SAND, 5Y4/2-OLIVE GRAY," PARTICLES ARE SUBROUNDED-SUBANG, SLIGHTLY GRADED (DRILLING DISTURBANCE ?)", MOD,,,,, SOFT, 33212000,7aafd242bad86c489933c0826ec43f73,57-438-2-1
57,438,,2,2,0.0,54.0,5.00,6.50,7.04,MA, MUDDY SAND, 5Y4/2-OLIVE GRAY," MED TO COARSE GRAINED AT BASE, 41-54CM IS SLIGHTLY SANDIER MED GRAINED"," BRECCIATED BUT SLIGHTLY GRADED AT 0-18CM, HIGH AT 18-54CM",,,,, SOFT, 33214000,ae887c881e70b08f18fcf4aaeb680a91,57-438-2-2
57,438,,2,2,54.0,128.0,5.00,7.04,7.78,MA, FINE SANDY OR SILTY CLAYS, 5Y4/2-OLIVE GRAY, SLIGHTLY SANDIER LAYERS DEFINE INTENSELY DEFORMED BEDDING, HIGH,,,, SMEAR AT 93CM DOM, SOFT*,,6389d87a45756c3c00abc644372a9399,57-438-2-2
57,438,,2,2,128.0,150.0,5.00,7.78,8.00,MA, SILTY CLAY, 5Y4/2-OLIVE GRAY, LESS SILTY SAND THAN HIGHER UP, HIGH, LARGE PUMICE FRAG (GLACIAL ERRATIC ?) LT GRAY-WHITE STREAKED GLASSY BIOTITE DK STREAKS 3-4CM AT BOTTOM OF SECTION,,,, SOFT, 33213000,522f064e838bedaba3892fe2c45835d6,57-438-2-2
57,438,,2,3,0.0,150.0,5.00,8.00,9.50,MA, SILTY TO SANDY MUD, 5Y4/2-OLIVE GRAY," OCCAS MUDDY SAND POCKETS, LT GREEN-OLIVE GREENISH GRAY ASHY ZONE WITH ISOLATED ROUNDED OUTLINES AT 101 -104CM, SANDY POCKET AT 128-132CM, SMALL POCKETS OF ASH AT 131-137 + 145CM", HIGH," SUBROUNDED-SUBANG PUMICE CLAST 5CM DIA- VESICLES FILLED WITH OLIVE GREENISH YELLOW VERY FINE MATERIAL (LOOKS OILY BUT DOES NOT FLUORESCE) AT 0-5CM, ROUNDED DK GRAY PEBBLES: 8MM DIA (OBLONG) AT 123CM + 7MM DIA AT 138CM + 5MM DIA AT 140CM",,, SMEAR AT 79CM DOM, SOFT*,,ac36ca7ec2b8d3420357dd3564658f18,57-438-2-3
57,438,,2,4,0.0,22.0,5.00,9.50,9.72,MA, SANDY MUD, 5Y3/2-DK OLIVE GRAY, FINE SAND POCKETS, HIGH,,,, SMEAR AT 14CM DOM, SOFT*,,f95b8465804baccb0975ca2273af5590,57-438-2-4
57,438,,2,4,22.0,62.0,5.00,9.72,10.12,MA, CLAY (SLIGHTLY SILTY), 5Y4/2-OLIVE GRAY," OCCAS SLIGHT LAM/BEDDING, SEVERAL FINE <1CM THICK DK MUDDY SAND LAYERS", SLIGHT,,,,, SOFT, 33211000,b71e69fd29285786f582dd0f691d8057,57-438-2-4
57,438,,2,4,62.0,118.0,5.00,10.12,10.68,MA, MUD TO SLIGHTLY SILTY MUD, 5Y4/2,, HIGH,,,, SMEAR AT 74CM DOM, SOFT*,,949ce0789d42c9a055b5b92ea0787e31,57-438-2-4
57,438,,2,4,118.0,150.0,5.00,10.68,11.00,MA, MUD TO SLIGHTLY SILTY/SANDY MUD,," 118-127CM IS A SANDY (F.G.) INTERVAL DISTURBED BY DRILL ASH POCKETS, A WHITE/GRAY ASH POD AT 122-125, DARK F.G. SANDY POCKETS AT 124-126CM, F.G. SAND + ASH POCKETS AT BASE", HIGH,,,, SMEAR AT 123CM DOM, SOFT*,,1618bb65ccc732ee9b46a550fae56379,57-438-2-4
57,438,,2,5,5.0,145.0,5.00,11.05,12.45,MA, CLAY (MUD), 5Y3/2-DK OLIVE GRAY," FAIRLY HOMOG, MULTIPLE ASH LAYERS-SLIGHTLY DISTURBED- AT 21-31CM, ASH POCKET AT 56-57CM, LT GRAY-WHITE ASH AT 95-97 + 103-106 + 107-111CM", SLIGHT TO MOD,, OCCAS PYR SPECS THROUGHOUT,," SMEARS AT: 47CM DOM, 110CM DOM , 145-150CM IS I.W. SAMPLE", SOFT, 33211000,991bb40c105cf085b0c8d8e88bb6accb,57-438-2-5
57,438,,2,6,0.0,150.0,5.00,12.50,14.00,MA, MUD (CLAY) TO SLIGHTLY SILTY MUD, 5Y3/2-DK OLIVE GRAY," FAIRLY HOMOG, NO VISIBLE BEDDING FEATURES, 1CM GRAY-WHITE ASH POD AT 25-26CM", MOD,, SMALL PYRITIC (SULFIDES) SPECS COMMON,, H25 ODOR, SOFT, 33213000,78e8963a947aff0999041c604b626909,57-438-2-6
57,438,,2,7,0.0,22.0,5.00,14.00,14.22,MA, SLIGHTLY SILTY MUD, 5Y3/2-DK OLIVE GRAY," HOMOG, GRAY-WHITE ASH AT 27-28 + 30-31CM, DK GRAY F.G. SAND POCKET AT 34-35CM", MOD,,,,, SOFT, 33213000,7ddccb8d01db350687d5cdee3dfe0a3c,57-438-2-7
57,438,,2,CC,0.0,10.,5.00,14.32,14.32,MA, SLIGHTLY SILTY MUD,,,,,,,, SOFT, 33213000,9432fa5a65c2c03a372dcd18ac0f9755,57-438-2-CC
57,438,,3,1,0.0,150.0,14.50,14.50,16.00,MA, SLIGHTLY SILTY GRITTY MUD," 5Y4/2-OLIVE GRAY, 5Y3/2-DK OLIVE GRAY"," ""HOMOG"", NO VISIBLE STRUCTURES, GRAY/WHITE ASH POCKETS AT 85-94CM,OCCAS SMALL SAND POCKETS (F.G. TO M.G.) AT 120-150CM,SMALL PYR BLEBS COMMON", MOD, F.G.(APHANITIC) DK GRAY-BLACK ROU NDED PEBBLES:6MM DIA AT 14CM + 3MM DIA AT 62 CM,,," H25 ODOR ON OPENING, SMEAR AT 61CM DOM", SOFT*,,f46bb4bd2dfb5c4ba4a9069785002121,57-438-3-1
57,438,,3,2,0.0,150.0,14.50,16.00,17.50,MA, MUD (SILTY TO SANDY AT TIMES), 5Y4/2 -OLIVE GRAY," FAINTLY BEDDED, SAND POCKETS AT 5-13 + 82-110CM, LT GRAY POCKET OF PUMICEOUS ASH AT 15-26CM, SAND SMEARED ALONG CORE LINER AT 54-67CM, SMALL M.G. TO C.G. SAND POD AT 135-138CM", HIGH,, PYRITIC,, H25 ODOR,, 33213000,520e1cb6f1500f24767df04b5f368458,57-438-3-2
57,438,,3,3,0.0,150.0,14.50,17.50,19.00,MA, MUD + SILTY MUD, 5Y4/2-DK OLIVE GRAY," FAINT BEDDING, OCCAS SAND POCKETS (F.G.), INDIVID F.G. THIN SAND/SILT LAYERS- SLIGHTLY DEFORMED- DK GRAY GREEN TO BLACK AT 76-94CM, DK GRAY F.G. SAND/ SILT POCKETS AT 118-140CM", HIGH,, PYRITIC,," H25 ODOR, SMEARS AT: 48CM DOM, 118CM DOM", SOFT*,,50618497f1b52c82c6d9d14232d680b9,57-438-3-3
57,438,,3,4,0.0,150.0,14.50,19.00,20.50,MA, MUD TO SILTY/SANDY MUD, 5Y4/2-OLIVE GRAY," HOMOG TO FAINTLY BEDDED, BEDDING EMPHASIZED BY SLIGHT INCR/DECR IN SAND CONTENT, F.G. SAND LAYER AT 96-102CM", HIGH,, PYRITIC, CLOSELY SPACED NUMEROUS HINGE TEETH- PUNKY CALCAR FOSSIL (MOLUSC PELECYPOD- PROB TAXODONT ) AT 2-5CM," H25 ODOR, SMEAR AT 97CM*",,,62434f07b4da882d5d298feb3b71d79a,57-438-3-4
57,438,,3,5,7.0,150.0,14.50,20.57,22.00,MA, SILTY SANDY MUD, 5Y4/2-OLIVE GRAY," LIGHTLY BEDDED, DK ROUNDED PEBBLES 1CM DIA AT 25- 28 + 85-88 + 81-83 + 127-129CM, DISRUPTED SAND LAYERS AT 60-75CM, SAND POCKETS AT 96-110CM, DISRUPTED PEBBLY SAND DK GRAY TO BLACK PEBBLES UP TO 5MM DIA- C.G. SAND AT 138-145CM, APHANITIC DK GRAY ROUNDED PEBBLE 1.5CM DIA (SOLITARY) AT 147-149CM", HIGH,,,, SMEAR AT 116CM DOM, SOFT*,,ef6d33676151d4c48e61f381cb5a8e59,57-438-3-5
57,438,,3,6,0.0,150.0,14.50,22.00,23.50,MA, SILTY SANDY MUD, 5Y3/2-DK OLIVE GRAY," DISRUPTED SAND LAYERS + POCKETS AT 0-40CM, DK GRAY APHANITIC PEBBLES AT 8 + 12 + 19 + 19-24(2.5CM DIA) CM, NUMEROUS F.G. SAND POCKETS- HIGHLY DISRUPTED- AT 48-75CM, C.G. MASSIVE GRAY-WHITE SOMEWHAT DISTURBED ASH LAYER (OR REWORKED VOLC DETRITUS) AT 91-105CM, SLIGHTLY GRADED F.G. DISRUPTED SAND LAYERS (GRAY-OLIVE GREEN) WITH INTERBEDDED MUDS (POSSIBLE TURBIDITES) AT 115-130CM, 139-150CM IS END OF GRADED UNIT BEGINNING IN CC", MOD,,,," SMEARS AT: 42CM DOM, 65CM DOM, 94CM MINOR", STIFFER THAN 1ST 2 CORES SOFT, 33212000,db276ffe9f82be36df8e20bf9d839dd3,57-438-3-6
57,438,,3,7,0.0,40.0,14.50,23.50,23.90,MA, V.C.G. SAND AT BASE GRADING TO FINE SAND + SILT AT TOP INTO SEC 6, 5Y4/2-OLIVE GRAY, GRADED UNIT (REAL ? OR DRILLING INDUCED ?), SLIGHT,,,,, SOFT, 33214000,2cc9337593749b58fee7e9c061913fcb,57-438-3-7
57,438,,3,CC,0.0,5.0,14.50,24.00,23.95,MA, F.G. TO M.G. SAND, 5Y4/2-OLIVE GRAY,, SLIGHT,,,,, SOFT, 33214000,de42b81e470878ae04c6c9e76a292046,57-438-3-CC
57,438,,5,1,0.0,150.0,33.50,33.50,35.00,MA, PEBBLY SANDY MUD + MUDDY SAND, 5Y4/2-OLIVE GRAY," PEBBLES: PUMIC E + DARK GRAY-BLACK APHANITIC VOLCANIC(?) MUDSTONE (?) + SANDSTONE- FRIABLE, WELL-ROUNDED 0.5-3.5CM DIA", BRECCIA,,,,, LIQUIFIED FROM DRILLING SOFT, 33212000,d9d67bbf7ca73c57894779f1634cb1c6,57-438-5-1
57,438,,5,2,0.0,150.0,33.50,35.00,36.50,MA, PEBBLY SANDY MUD + MUDDY SAND, 5Y4/2-OLIVE GRAY,, BRECCIA, LARGE ROUNDE D SS PEBBLE  (SS FRIABLE BUT INDURATED) AT 13-17 CEN TIMETERS,,,, LIQUIFIED (FROM DRILLING), 33212000,130c47da087e4745ecd953d6dba89622,57-438-5-2
57,438,,5,3,0.0,102.0,33.50,36.50,37.52,MA, PEBBLY SANDY MUD + MUDDY SAND, 5Y4/2-OLIVE GRAY, ABUNDANT WELL-R OUNDED PEBBLES MAX-4CM AVERAGE-1CM, BRECCIA,,,, BECOMING MOSTLY MUDDY SAND, LIQUID (FROM DRILLING), 33212000,fe9a1331cf441be437d7375ab79381fd,57-438-5-3
57,438,,5,4,0.0,150.0,33.50,38.00,39.50,MA, MUDDY SILTY SAND (F.G. TO M.G.), 5Y4/2-OLIVE GRAY, NO INTERNAL SED STRUCTURES, HIGH," LARGE WOOD FRAG AT 128-131CM, LT COLORED GREEN-GRAY 1.5CM DIA ROUNDED PEBBLES AT 132-134 + 142-144CM",,, SMEAR AT 134CM DOM, SOFT*,,533fe7647f7f787e2e258f10966e0ca8,57-438-5-4
57,438,,5,5,0.0,150.0,33.50,39.50,41.00,MA, MUDDY SILTY SAND F.G. TO M.G., 5Y4/2-DK OLIVE GRAY," DISRUPTED, NO APPARENT STRUCTURES, MOD TO POORLY SORTED, OCCAS PEBBLES", HIGH," 2CM WOOD CHIP AT 18-20CM, 2CM DIA PUMICE SUBANG TO SUBROUNDED + OTHER SMALLER FRAGS AT 24-28CM, DK GRAY APHANITIC PEBBLE AT 82-85CM, LT GREEN-GRAY PEBBLE AT 96-97CM",,,, SOFT, 33214000,f85616ba2354936a7e2d1db56dfeb251,57-438-5-5
57,438,,5,6,0.0,133.0,33.50,41.00,42.33,GW, SILTY M.G. SAND," 5Y2/1-OLIVE BLACK, N1-BLACK"," PREDOM 5Y2/1, 1CM DISTORTED COARSER N1 LAYERS, BEDS 8CM THICK"," 0-14 + 78-90CM IS BRECCIA, HIGH AT 14-78 + 90-133CM",, 1CM PUMICE PEBBLES AT 14 + 29 + 127CM,," SMEARS AT:114CM MINOR, 121CM", FIRM, 33213000,28e1f071c82ed2265fb90f1fa185d935,57-438-5-6
57,438,,5,CC,0.0,10.0,33.50,42.43,42.43,GW, SILTY MED SAND, 5Y2/1-BROWNISH BLACK,, HIGH,, 5MM ROUNDED PUMICE PEBBLE AT 6CM,,, FIRM, 33214000,7a717278dad35546192a1c613a3d978e,57-438-5-CC
57,438,,7,1,0.0,150.0,52.50,52.50,54.00,GW, SILTY FINE SAND," 5Y3/2-DK OLIVE GRAY, 5Y4/4-MOD OLIVE BROWN, 5Y3/2-OLIVE GRAY, 5Y2/1-OLIVE BLACK, -BLACK"," PREDOM 5Y3/2, 5Y4/4 SANDY SILT LAYERS AT 69-74 + 122-130CM, 5Y2/1 MED SAND FIRM LAYER AT 118-120CM"," 0-70 + 80-112CM IS BRECCIA, HIGH AT 70-80 + 112-131CM",," 5MM BLACK BASALT PEBBLES AT 20 + 99CM, 5MM PUMICE PEBBLE AT 20CM",," SMEARS AT: 81CM DOM, 119CM MINOR, 126CM MINOR", FIRM, 33214000,898e27537e0a0ea8b0daf3316415cde5,57-438-7-1
57,438,,7,2,0.0,150.0,52.50,54.00,55.50,GW, SILTY FINE SAND," 5Y3/2-DK OLIVE GRAY, 5B6/1-MED BLUISH GRAY, -BLACK"," PREDOM 5Y3/2, 1CM 5B6/1 ASH LAYERS AT 49-50 + 104-105CM"," 0-30 + 63-150CM IS BRECCIA, HIGH AT 30-63CM",," 3MM BASALT PEBBLE AT 23MM, 2MM BLACK GRAIN AT 140CM",," SMEARS AT: 44CM DOM , 49CM MINOR, 104CM MINOR", FIRM, 33214000,55a2d993d44507b9f18ef714b556e4d6,57-438-7-2
57,438,,7,3,0.0,150.0,52.50,55.50,57.00,GW, SANDY SILT," 5Y3/2-DK OLIVE GRAY, -BLACK", PREDOM 5Y3/2, BRECCIA,, BLACK BASALT(?) PEBBLES- 3MM AT 90 + 2MM AT 140CM,, SMEAR AT 130CM DOM, SOFT*,,3312b2faf512cbd7b067685547556977,57-438-7-3
57,438,,7,4,0.0,150.0,52.50,57.00,58.50,GW, SANDY SILT, 5Y3/2-DK OLIVE GRAY," CORE FRACTURED INTO 2CM BLOCKS BUT THEY MAY BE FAIRLY WELL IN PLACE, BLACK 2MM PEBBLE AT 65CM", BRECCIA,,,, SMEAR AT 92CM DOM, SOFT*,,8c19c070dd6e2532bf3afab5e5fdd747,57-438-7-4
57,438,,7,5,0.0,70.0,52.50,58.50,59.20,GW, SANDY SILT, 5Y3/2-DK OLIVE GRAY," 47-52CM IS VOID, 2CM CORE BLOCKS MAY BE FAIRLY WELL IN PLACE"," 0-47CM IS BRECCIA, SLIGHT AT 52-70CM",,,, SMEAR AT 37CM DOM*, FIRM AT 52 -70CM,,d1b64232c4d4c44f15916858d0fa314a,57-438-7-5
57,438,,7,5,70.0,140.0,52.50,59.20,59.90,GW, SILT, 5Y3/2-DK OLIVE GRAY,, SLIGHT,,,," 140-150CM IS IW SAMPLE, SMEAR AT 116CM DOM*", FIRM,,89c89e23480da93eee72db88d3be6b3a,57-438-7-5
57,438,,7,6,0.0,19.0,52.50,60.00,60.19,GW, SANDY SILT, 5Y3/2-DK OLIVE GRAY, FINE SAND LAYER AT 11-12CM, SLIGHT,,,,, FIRM, 22112220.3450,cefe1aa038cc25b9bc7865c07ee4b063,57-438-7-6
57,438,,7,6,19.0,65.0,52.50,60.19,60.65,GW, SILT, 5Y3/2-DK OLIVE GRAY, SANDY AT BASE, SLIGHT, SOFT 1CM ASH FRAGS AT 22-23 + 43-44CM,,,, FIRM, 22112220.3450,60e791187f78385d477bda26cc40492d,57-438-7-6
57,438,,7,6,65.0,129.0,52.50,60.65,61.29,GW, SILT, 5Y4/2-OLIVE GRAY,, SLIGHT,,,, SMEAR AT 104CM DOM, FIRM, 33213000,ce35ee0d46ef1cfa2d413da45ef0fe9b,57-438-7-6
57,438,,7,6,129.0,150.0,52.50,61.29,61.50,GW, SANDY SILT, 5Y4/2-OLIVE GRAY," 2CM MOTTLES, 3CM GRAY PEBBLE AT 141CM", SLIGHT,,,,, FIRM, 33213000,6ec7cfd309e4b08987acd7f190253391,57-438-7-6
57,438,,7,7,0.0,2.0,52.50,61.50,61.52,GW, SANDY SILT, 5Y4/2-OLIVE GRAY,, SLIGHT,,,,, FIRM, 33213000,4bb7c70ca7777ba315ce92df83ced4b1,57-438-7-7
57,438,,7,7,2.0,5.0,52.50,61.52,61.55,GW, MED SANDY ASH, 5Y3/2-DK OLIVE GRAY,,,,,,, FIRM*,,df3dc98ae35d4d756c120a7e22124f2c,57-438-7-7
57,438,,7,7,5.0,43.0,52.50,61.55,61.93,GW, SANDY SILT," 4Y4/2-OLIVE GRAY, N3, N8",, SLIGHT,," N3 3MM ASH FRAG AT 15CM, N8 2MM PUMICE FRAG AT 25CM",, SMEAR AT 28CM DOM*, FIRM,,f92202ec26e04a5c1c866692c1df349d,57-438-7-7
57,438,,7,CC,0.0,10.0,52.50,62.03,62.03,GW, SANDY SILT, 5Y4/2-OLIVE GRAY,, SLIGHT,,,,, FIRM, 33213000,5f0b7f2b65d5e5abdddb203fa583cd93,57-438-7-CC
57,438,,8,1,0.0,106.0,62.00,62.00,63.06,GW, SANDY SILT, 5Y4/2-OLIVE GRAY,, BRECCIA,,,,, SOFT, 33213000.2220,a02ac27e81b267d3bc33e2200653b077,57-438-8-1
57,438,,8,1,106.0,150.0,62.00,63.06,63.50,GW, SILT, 5Y4/2-OLIVE GRAY,," HIGH AT 106-145CM , BRECCIA AT 145-150CM",,,, SMEAR AT 125CM DOM*, FIRM,,52d9cf832aa58583a18c2d2f43038971,57-438-8-1
57,438,,8,2,0.0,60.0,62.00,63.50,64.10,GW, SILT, 5Y4/2-OLIVE GRAY,, HIGH,,,,, FIRM, 33213000.2220,848910ed79c7a6d32cd23ea9254b36dd,57-438-8-2
57,438,,8,2,60.0,150.0,62.00,64.10,65.00,GW, SANDY SILT, 5Y4/2-OLIVE GRAY 5Y2/2-OLIVE BLACK, 5Y2/2 MED SAND LAYER AT 86-88CM, HIGH,, GRAYWACKE PEBBLES: 1CM AT 67CM + 0.5CM AT 87CM + 2MM AT 106CM,,, FIRM, 33213000.2220,f2aa4bd4641026165eb55bc89fe8a38a,57-438-8-2
57,438,,8,3,0.0,150.0,62.00,65.00,66.50,E, MUDDY SILT, 5Y4/2," MASSIVE, BLACKISH ASH POCKETS AT 1-4 + 13-15 + 24-27 + 78-82 + 104-105CM, WHITISH ASH POCKETS AT 3-6 + 7-9CM, PEBBLES AT 40 + 64 + 77 + 87 + 93 + 132 + 137 + 139 + 147CM", MOD,,,,, FIRM, 33213000.2220,a36d00fd5eda68dd836c148003c9d85c,57-438-8-3
57,438,,8,4,0.0,150.0,62.00,66.50,68.00,E, MUDDY SILT, 5Y4/2," MASSIVE, BLACK ASH POCKETS AT 10-30 + 43-50 + 53-55 + 70-72 + 74-82 + 94 + 95-96 + 100-103 + 113-117CM, WHITE ASH POCKETS AT 81-83 + 83-87CM, PEBBLES AT 31 + 39 + 60CM, 15MM DIA LAPILLA AT 62-67CM", MOD,,,,, FIRM, 33213000.2220,bd107d13c658a360a3e56a360a4bc14e,57-438-8-4
57,438,,8,5,0.0,150.0,62.00,68.00,69.50,E, MUDDY SILT, 5Y4/2, 35-60 + 117 -140CM IS VOID," SLIGHT AT 0-35CM, BRECCIA AT 60-80 + 140-150CM, INTENSE AT 80-117CM", VOLC ASH LAPILLI AT 9+31CM,,,, SOFT, 33213000.2220,859631680e43c94fe8482d23e0864650,57-438-8-5
57,438,,8,6,0.0,150.0,62.00,69.50,71.00,GW, SANDY MUD," 5Y4/2-OLIVE GRAY, 5Y3/2-DK OLIVE GRAY 5Y2/1 -OLIVE BLACK"," 0-124CM IS PREDOM 5Y4/2, 5Y2/1 MED SAND (VOLC ?) 2CM BED AT 88-103CM (DIAGONAL), 124-150CM IS 5Y3/2"," BRECCIA AT 0-83 + 99-103CM, HIGH AT 83-99CM, MOD AT 103-150CM",, 2MM QTZ GRAIN AT 144CM,," SMEARS AT: 94CM MINOR, 121CM DOM, 148CM DOM", SOFT, 33213000.2220,c881bdc69b252d09c58e3e8c4d1c735b,57-438-8-6
57,438,,8,7,0.0,28.0,62.00,71.00,71.28,GW, SANDY MUD," 5Y4/2, N4, N6"," PREDOM 5Y4/2, F.G. N6-N4 ASH LAYER AT 9-12CM 1CM ASH BODY AT 6-7CM", SLIGHT,,,,, FIRM SOFT, 33213000.2220,a72290907bd82c7d6c7086cec1674d9f,57-438-8-7
57,438,,8,CC,0.0,10.0,62.00,71.39,71.39,GW, SANDY MUD, 5Y4/2,, MOD,,,,, SOFT, 33213000.2220,b33bb67e1dc6564f0ac2dca9563fe7cb,57-438-8-CC
57,438,,9,1,0.0,150.0,71.50,71.50,73.00,GW, SANDY MUD, 5Y3/2,, BRECCIA, 2MM BLACK PEBBLE AT 38CM,,,, FIRM SOFT, 33213000.2220,40f8b58057e9029ba935731680cee79a,57-438-9-1
57,438,,9,2,0.0,150.0,71.50,73.00,74.50,GW, SANDY MUD, 5Y4/2, 44-53CM IS FIRM SILT LAYER DRILLING BRECCIA BLOCKS PROB NOT MUCH DISPLACED," 0-44 + 53-150CM IS BRECCIA, HIGH AT 44-53CM",,,, SMEAR AT 134CM DOM, FIRM SOFT*,,71a8bda548147d096e63000b88801130,57-438-9-2
57,438,,9,3,0.0,150.0,71.50,74.50,76.00,GW, SANDY MUD, 5Y4/2," 131-142CM IS VOID, BLACK PEBBLES: 5MM AT 2CM + 2MM AT 122CM", BRECCIA,,,,, SOFT, 33212000,13ec86b83e063d157c461006aaf2f215,57-438-9-3
57,438,,9,4,0.0,11.0,71.50,76.00,76.11,GW, SANDY MUD, 5Y4/2,, SLIGHT,,,,, SOFT, 33212000,31278ad05221ce5f98f0ca3b572f2849,57-438-9-4
57,438,,9,4,11.0,60.0,71.50,76.11,76.60,GW, SILT, 5Y4/2," 9-26CM IS VOID, 26- 60CM IS SLIGHTLY MOTTLED", SLIGHT,,,,, FIRM, 33213000,a0f061b133ea63cfa18494c7b8e673de,57-438-9-4
57,438,,9,5,0.0,150.0,71.50,77.50,79.00,GW, SANDY MUD, 5Y4/2," 3 5Y4/2 SILTSTONE BEDS 5-10CM THICK, CORE DUMPED ON DECK SO ORDER GOT MIXED, WAS ORIGINALLY A GOOD CORE", BRECCIA,, 1.5CM GRAYWACKE PEBBLE,,, FIRM, 33212000,6d211078f841ddb4fb832ec327772050,57-438-9-5
57,438,,10,1,0.0,56.0,81.00,81.00,81.56,GW, SANDY MUD, 5Y4/2, 19-36 + 44-50CM IS VOID, BRECCIA,,,,, SOFT, 33212000,bb48f32674bcd400f117f170dd8d3953,57-438-10-1
57,438,,10,1,56.0,131.0,81.00,81.56,82.31,GW, SILT, 5Y4/2," 2MM BLACK PEBBLE AT 68CM, 70-81 + 88-103 + 131-150CM IS VOID", BRECCIA,,,,, SOFT, 33215000,0f933624b9c74cb429858a7ce2bd4c10,57-438-10-1
57,438,,10,2,7.0,150.0,81.00,82.57,84.00,GW, SANDY MUD, 5Y4/2, 0-7 + 20-26 + 40-87 + 115-136CM IS VOID, BRECCIA,, BLACK GRAYWACKE PEBBLES: 1CM AT 12CM + 3CM AT 88CM,,, SOFT, 33212000,1eaf4815f034c1320080a0f3dc1593f2,57-438-10-2
57,438,,10,3,0.0,150.0,81.00,84.00,85.50,GW, SANDY MUD, 5Y4/2,," BRECCIA AT 0-77CM, HIGH AT 77- 150CM",,,, SMEAR AT 118CM DOM*, FIRM,,da0b87ecffd6534e42bd2ac573da54ee,57-438-10-3
57,438,,10,4,3.0,17.0,81.00,85.53,85.67,GW, SANDY MUD, 5Y4/2, 0-3CM IS VOID, SLIGHT,,,,, FIRM, 33212000,b58a3e1e80837829cf223d18f4aa5c47,57-438-10-4
57,438,,10,4,17.0,23.0,81.00,85.67,85.73,GW, FINE SAND ASH, 5Y5/1,, SLIGHT,,,, SMEAR AT 23CM MINOR, FIRM*,,f9ce572769105b93d86ae84fb625b458,57-438-10-4
57,438,,10,4,23.0,98.0,81.00,85.73,86.48,GW, SILT, 5Y4/2,, SLIGHT,,,, SMEAR AT 88CM DOM*, FIRM,,389b8ab069100fcf1b990abb76784063,57-438-10-4
57,438,,10,5,0.0,150.0,81.00,87.00,88.50,GW, SANDY MUD," 5Y4/2, 5Y3/1, 5Y6/1, N5, N3"," PREDOM 5Y4/2, 0-2CM IS FIRM SILT, 5Y3/1 FINE SANDY ASH LAYER AT 17-22CM, DK ASH LUMP WITH PUMICE FRAGS AT 55-57CM, DK ASH LUMP AT 75CM, 5Y6/1 AT BASE (75-80CM) + MORE SANDY, N5-N3 FINE SANDY ASH LAYER AT 81-83CM", SLIGHT,,,," SMEARS AT: 79CM DOM, 82CM DOM*", FIRM,,1ba6956fc57b0da539deaae9a307ecc4,57-438-10-5
57,438,,10,6,0.0,20.0,81.00,88.50,88.70,GW, SANDY MUD, 5Y4/2,,,, 2MM PUMICE FRAGS AT 3CM,,, FIRM, 33212000,6254280bfd1975b2570d4a256ce208a1,57-438-10-6
57,438,,10,6,20.0,25.0,81.00,88.70,88.75,GW, VERY FINE ASH, 5B7/1, SILT SIZE,,,,, SMEAR AT 23CM DOM, FIRM*,,d88dbbded1178776647389f108e26df7,57-438-10-6
57,438,,10,6,25.0,33.0,81.00,88.75,88.83,GW, FINE SD ASH, 5Y3/1,,,,,, SMEAR AT 27CM, FIRM*,,33b3fc530de9fdc6bbca4635046227a8,57-438-10-6
57,438,,10,6,33.0,75.0,81.00,88.83,89.25,GW, SANDY MUD, 5Y4/2,,,,,,, FIRM, 33212000,7a64f84027793a4c498219bef7435fad,57-438-10-6
57,438,,10,CC,0.0,10.0,81.00,89.35,89.35,GW, SANDY MUD, 5Y4/2,, BRECCIA,,,,, FIRM, 33212000,69b515c815ea867bc3db4632136e8e60,57-438-10-CC
57,438,,11,1,0.0,150.0,90.50,90.50,92.00,GW, SANDY MUD," 5Y4/2, 5Y2/1, N4, N5, 5Y3/2"," 0-8 + 16-31 + 37-41CM IS 5Y4/2, 44-150CM IS 5Y3/2, 8-16CM IS 5Y2/1 FINE SD ASH LAYER, 31-36CM IS N4-N5 MED SD ASH, 41-44CM IS N4 MED SD ASH", SLIGHT,," PUMICE FRAGS AT 66 + 80 + 86CM, 3MM GRAYWACKE PEBBLE AT 122CM",,, FIRM, 33212000,123bf89dbfc4a1ac553ca0c774cf6a2a,57-438-11-1
57,438,,11,2,0.0,150.0,90.50,92.00,93.50,GW, SANDY MUD," 5Y3/2, 5Y2/1"," PREDOM 5Y3/2, 69-72 + 105-111 + 127-143CM IS 5Y2/1 MUDDY FINE SD", SLIGHT,, PUMICE FRAGS: 1CM AT 116CM + 5MM AT 139CM (+ SS FRAG ?),," SMEARS AT: 42CM DOM, 126CM DOM", FIRM, 33212000,53a384e2bdd22d6f698003378350b405,57-438-11-2
57,438,,11,3,0.0,150.0,90.50,93.50,95.00,GW, SANDY MUD," 5Y3/2, N4, 5B6/1, 5Y3/1"," PREDOM 5Y3/2, N4 COARSE SD ASH AT 29-36 + 88-94CM, 125-131CM IS 5B6/1-5Y3/1 SANDY ASH, 131-138 CM IS 5Y3/2 MUDDY MED SAND", SLIGHT,,,,, FIRM, 33212000,503aab92f1ce855011179758de56bde5,57-438-11-3
57,438,,11,4,6.0,150.0,90.50,95.06,96.50,GW, SANDY MUD," 5Y3/2, 5B6/1, 5Y4/2"," 0-6CM IS VOID, PREDOM 5Y3/2, 65-83CM IS 5Y4/2, 5B6/1 MED SD ASH AT 58-65 + 83-95 + 111-115CM, 1CM ASH BODY AT 10CM", SLIGHT,, 3MM PUMICE FRAG AT 124CM,,, FIRM, 33212000,ecd02fa91a17732080ada39fa80156be,57-438-11-4
57,438,,11,5,0.0,111.0,90.50,96.50,97.61,GW, SANDY MUD," 5Y3/2, 5Y4/2, 5B6/1, 5B7/1"," 58-66CM IS VOID, 0-5CM IS 5Y3/2, 11-25 + 32 -58 + 75-106CM IS 5Y4/2, 5-11CM IS 5Y3/2 VITRIC MED SD LAYER, 25-32CM IS 5B6/1 MED SD ASH, 66-75CM IS 5Y4/2 MUDDY SAND, A 1CM ASH BODY AT 73-74CM, 106-111 CM IS 5B7/1 MED SD ASH", SLIGHT,,,,, FIRM, 33212000,50d083316f02c8837e9b373ddff3d165,57-438-11-5
57,438,,11,5,111.0,145.0,90.50,97.61,97.95,GW, SILT, 5Y4/2,, SLIGHT,,,, 144-155CM IS IW SAMPLE, FIRM, 33215000,ae059237621dbd4c96a9f910dbec3007,57-438-11-5
57,438,,11,6,0.0,145.0,90.50,98.00,99.45,GW, SILT, 5Y4/2, 129-134 + 145-150CM IS VOID, SLIGHT,, 1MM PUMICE GRAINS AT 16 + 50CM,, SMEAR AT 10CM DOM*, FIRM,,1680609f2c82543786fa4c45da69351f,57-438-11-6
57,438,,11,CC,0.0,4.0,90.50,99.55,99.49,GW, SILT, 5Y4/2,, BRECCIA,,,,, FIRM, 33215000,69624f96d19c7f5c0202a3623d1c2c1b,57-438-11-CC
57,438,,11,CC,4.0,20.0,90.50,99.49,99.65,GW, SILT ASH, 5B6/1,, BRECCIA,,,,, FIRM, 33215000.3651,520696f9bfe9055ad228fa3c66c85aeb,57-438-11-CC
57,438,,12,1,0.0,150.0,100.00,100.00,101.50,MA, SILTY + SANDY (F.G.) MUD, 5Y3/2-DK OLIVE GRAY, 13-17 + 96-104CM IS VOID, BRECCIA,, OCCAS SMALL (<5MM) ROUNDED PUMICE PEBBLES,,, LIQUIFIED PARTIALLY, 33213000.2220,7236163f91e80dc29c8c5bb194f71ae2,57-438-12-1
57,438,,12,2,0.0,118.0,100.00,101.50,102.68,MA, SANDY SILTY MUD (DRILLING INDUCED), 5Y3/2," 10-24 + 118-150CM IS VOID, PEBBLEY IN PART WITH DK GRAY APHANITIC + PUMICE CLASTS <0.5CM", BRECCIA,,,,, LIQUIFIED, 33213000.2220,239d051c4b58c504bf42300c0df0f6fd,57-438-12-2
57,438,,12,3,37.0,150.0,100.00,103.37,104.50,MA, SANDY SILTY MUD, 5Y3/2,, BRECCIA,,,,, LIQUIFIED, 33213000.2220,d07b3d9473aa8cd88e897d60677bef12,57-438-12-3
57,438,,12,4,0.0,150.0,100.00,104.50,106.00,MA, STIFF MUD + SILTY MUD, 5Y4/2," HOMOG, DISTURBANCE IN DRILLING AT 10-20CM", MOD,,, SPONGES (SILIC) WHITE CYLINDRICAL OR OBLONG WITH BLACK CENTERS AT 50 + 76 + 100CM," SMEARS AT: 34CM DOM, 50CM MINOR, 100CM DOM",, 33213000.2220,c3210656a23055a2cee9ff01ef293e66,57-438-12-4
57,438,,12,5,0.0,68.0,100.00,106.00,106.68,MA," MUD, OCCAS SILTY", 5Y4/2,, 0-68CM IS MOD,, 2CM DIA ROUNDED PUMICE CLAST FLOATING IN CLAY MARIX (GLACIAL ERRATIC ?) (ABUND BIOT) AT 22-26CM, WHITE SPECKS FILLED WITH BLACK AS IN CORE 12-4 AT 36 + 50 CM (SS SHOWS THOUSANDS OF SP.SPICS- PROBL SMALL SPONGES)," THIN 2MM LAYER GRAY-BLACK ASHY SAND AT 61CM SMEARS AT:10CM DOM,61CM MINOR", STIFF STIFF*,,814b94abd8d9a6b3bfaf85286aabb183,57-438-12-5
57,438,,12,CC,0.0,20.0,100.00,106.78,106.88,MA," MUD,OCCAS SILTY",,,,,,, BRECCIA, STIFF, 33213000,8cdc6e86aca6fc41deaa97c902972468,57-438-12-CC
