65,483,,25,1,10.0,196.00,196.10,  197.46,"ZOLOTAREV, B.",PLAG-CPX-OL SPARSELY PHYRIC BASALT,"PCES 2 (10-11), 3 (14-18), 4 (20-32), 5 (34-45), 6 (46-60), 7 (62-70), 8 (72-78), 9 (81-105), 10 (106-121), 11 (124-126), 12 (130-135), 13 (137-146)","VERY FINE-GRAINED TO FINE-GRAINED, SPARSELY PHYRIC","FRACTURES PCES(4,7,10) FILLED WITH SMECTITE AND CARB AND RARE PYRITE",SLIGHTLY,"TWO COOLING UNITS WITH BOUNDARY BETWEEN PCES 1-2, DARK GREY",         <1-5          SMECTITE comments : CONTENT VARIES FROM 5% TO <1% AG     <1-2       1-3 CONTENT OF PLAG PHENOS VARIES FROM TRACE(2-3) TO 1% PCES(5-6) AND UP TO 2% PCES(12-13),CPX         1     1-1.5 | OL         <1     1-1.5 comments : OL REPLACED BY SMECTITE AND SERPENTINE(?),,SMECTITE               OL | SERP                   OL comments :  ID SERPENTINE QUESTIONABLE,,
65,483,,25,2,0.0,196.00,197.50,  198.26,"ZOLOTAREV, B.",PLAG-CPX-OL SPARSELY PHYRIC BASALT,"PCES 1 (1-8), 2 (11-20), 3 (22-30), 4 (32-36), 5 (39-49), 6 (52-67), 7 (52-59), 8 (62-65), 9 (67-76)","MEDIUM-GRAINED, SPARSELY PHYRIC",FRACTURES FILLED WITH CARB AND SMEC AND PYRITE(VERY RARE),SLIGHTLY,"SMAE UNIT AS 25-1, GREY",,PLAG      1-2      TO 4 comments : SOMETIMES GLOMEROPHYRIC | OL         <1       2-3 comments : OL REPLACED BY SECONDARY MINERALS SMECTITE ANDSERPENTINE(?) | CPX        <1       2-3,,SMECTITE | SERP | PYRITE | CARB,,
65,483,,26,1,0.0,200.00,200.00,  200.40,"SCHMINCKE, H.",PLAG-OL SPARSELY PHYRIC BASALT,"PCES 1 (1-6), 2A (7-21), 2B (21-35), 3 (36-40)","FINE TO MEDIUM-GRAINED, DECREASING GRAIN SIZE TOWARDS BASE WITH O.5CM OF DEVITRIFIED GLASS CRINKLED AT CONTACT TO SEDIMENTS WITH PATCHY SULFIDE ON BASAL SURFACE",,,LOWER PART OF COOLING UNIT THAT MAY CONTINUE FROM 25-2(SIMILAR GRAIN SIZE AND MINEROLOGY),,PLAG       <1        <2 | OL         <1        <2 comments : OL PHENOS RESORBED AND REPLACED BY SMECTITE(?) ANDCALCITE AND IN PLACES SULFIDE WITH SOMECONCENTRATION IN LAYERS IN TOP OF 2B,,,,
65,483,,26,1,40.0,200.00,200.40,  200.50,"SCHMINCKE, H.",SEDIMENTSILTSTONE,PCE 4 (40-50),,,,BROWN INDURATED,,,,,,
65,483,,26,1,52.0,200.00,200.52,  201.04,"SCHMINCKE, H.",PLAG SPARSELY PHYRIC BASALT,"PCE 5 (52-56), 6 (58-63), 7 (64-69), 8 (71-76), 9A (77-85), 9B (85-91), 9C (91-104)","FINE-GRAINED, SPARSELY PHYRIC",,SLIGHTLY,,     1-3 <1.5,PLAG       <1        <2 comments : PLAG MICROPHENOS | OL          0 comments : OL ABSENT OR VERY RARE,,,,
65,483,,26,1,105.0,200.00,201.05,  201.50,"SCHMINCKE, H.",PLAG SPARSELY PHYRIC BASALT,"PCES 10A (105-114), 19B (114-118), 19C (120-126), 10D (127-143), 11 (145-150)","FINE-GRAINED, SPARSELY PHYRIC","FRACTURES WITH SOME CHLORITE(?) AND MAYBE BLUE- YELLOW ZEOLITE, CRACKS FILLED WITH LIGHT TO DARK GREEN SMECTITE AND SULFIDE(PATCHY MARCASITE)","SLIGHT HALOS ALONG FRACTURES CHARACTERIZED ESPECIALLY BY DIFFERENCES IN VESICLE FILLING, RED OXIDIZED HALO ALONG FRACTURE IN PCE 2A","PETROGRAPHICALLY SIMILAR TO OVERLYING COOLING UNIT, SOME BLACK PLATY MAFIC(TABULAR)", comments : SOME VESICLES PRESENT,PLAG | OL comments : PSEUDOMORPHS,,"SULFIDES comments :  GRANULAR, DARK BLACK MATERIAL UP TO 1CM AWAY FROM CRACK CONSISTS OF SULFIDES AND ZEOLITES AND CARB | ZEOLITE comments :  ID ZEOLITE UNCERTAIN, LIGHT COLORED | CARB | MARCASIT comments :  ID MARCASITE UNCERTAIN",,
65,483,,26,2,0.0,200.00,201.50,  203.00,"SCHMINCKE, H.",PLAG VERY SPARSELY PHYRIC BASALT,"PCES 1A (2-16), 1B (16-25), 2 (26-36), 3A (38-48), 3B (47-55), 4A (56-67), 4B (68-80), 4C (82-88), 4D (89-100), 4E (100-107), 4F (106-115), 5 (117-124), 6 (125-130), 7 (133-139), 8 (140-150)","VERY SPARSELY PHYRIC, OPHIMOTTLED, FINE TO MEDIUM- GAINED WITH GRAIN SIZE INCREASING DOWNWARDS","FRACTURES WITH NARROW HALOS AND SOME SLICKENSIDED CHLORITE(??) LINING FRACTURES, SOME FRACTURE ZONES APPEAR BLEACHED",comments: NARROW HALOS AROUND FRACTURES,CONTINUING CORE SECTION FROM 26-1,"    <1-3  1-5          SMEC,ZEOL |                        PHILLIPSITE comments : UPPER PART OF CORE VERY VESICULAR(CA 5% AT TOP) DECREASING DOWNWARDS TO <1%, <1MM, SIZE DECREASES FROM UP TO 3MM DOWN TO <1MM, MOST ABRUPT CHANGE IS BETWEEN 4B AND 4C, ID UNCERTAIN FOR SMEC AND ZEOL AND PHIL",PLAG                2-6 comments : POSSIBLY SEVERAL GENERATIONS OF PLAG PHENOS: RARERELATIVELY LARGE(TO 6MM) CRYSTALS AND GLOMEROCRYSTWHILE MOST ARE MICROPHENOCRYSTS(<2MM) | CPX comments : RARE BLACK CPX(?),,SULFIDE | SMECTITE | CHLORITE comments :  SOME SLICKEN SIDED CHLORITE(?) | ZEOLITE comments :  BOTRYOIDAL OF SPHERULITIC ZEOLITE(?) | CARB,,
65,483,,26,3,0.0,200.00,203.00,  204.50,"FLOWER, M.",PLAG-OL SPARSELY PHYRIC BASALTMASSIVE,"PCES 1 (0-12), 2 (15-23), 3 (25-34), 4 (35-45), 5 (47-60), 6 (62-70), 7 (72-79), 8A (81-91), 8B (90-98), 9A (99-113), 9B (110-113), 10A (115-123), 10B (124-134), 10C (134-143), 10D (143-148)","SPARSELY PHYRIC, PCE 2 ODD FRAGMENTS POSSIBLY FINE- GRAINED OTHERWISE MEDIUM-GRAINED WITH PCES(3-10) INCREASING SLIGHTLY, OPHIMOTLED GROUNDMASS TEXTURE","HAIRLINE CRACKS ARE UNFILLED OR CONTAIN DARK GREEN SMECTITE, ONE VEIN IN PCE 10C IS LINED WITH SMEC WITH INNER FILLING OF WHITE CRYSTALLINE PHASE (ZEOLITE?), PCES(1-3) CONTAIN VEINS OF CALCITE AND SMECTITE, PCE 2 HAS ODD FRAGMENTS POSSIBLY FINE- GRAINED, MASSIVE",,GREY,,PLAG       <5         1 | OL                  <.5 comments : VERY SPARSE,,SMEC | ZEOLITE comments :  ID ZEOLITE UNCERTAIN,,
