28,270,,18,5,39.0,42.0,148.50,154.89,154.92,, SANDY SILTY CLAYSTONE, 5Y4/1-OLIVE GRAY, CONTACT AT 42 CM APPEARS TO BE SHARP,, SEVERAL PEBBLES AND GRANULES OF DENSE DK GRAY ROCK,,,,, 33231000,8d6e7ff62a38afc0adbd8f45ff4abb83,28-270-18-5
28,270,,18,5,42.0,150.0,148.50,154.92,156.00,, SILTY CLAYSTONE," 5GY4/1-DK GREENISH GRAY,-LT GRAY ,N5-MEDIUM GRAY,5Y6/1-LT OLIVE GRAY"," APPEARS STRUCT URELESS BETWEEN 42 AND 55 CM,CONTACT AT 42 CM APPEAR S TO BE SHARP,CONTACT AT 55 CM GRADATIONAL,ABOUT 30 PERCENT OF 55 TO 70 CM IS DISC-SHAPED TO LENTICULAR MASSES (INTRAFORMATIONAL) OF LIGHTER GRAY CLAYSTONE TO MEDIUM GRAY TO LT OLIVE GRAY,SHARP CHANGE AT 70 C M,FAIRLY HOMOGENEOUS APPEARING DK GREENISH GRAY FROM 70 TO 150 CM,ONLY SCATTERED DARKER STREAKS AND LENS ES OF DARKER GRAY SILTSTONE BETWEEN 70 AND 150 CM-AS AS 113 AND 119 CM-EXCEPTIONALLY LARGE LENS 4 CM LON G AT 142 CM",,,,," FROM 42 TO 55 CM HAVING GRITTIER FEEL THAN CLAYSTONE OF 0 TO 30 CM,LENTICULE-BEARING CLAYS TONE BELOW 55 CM",, 33231000,137cc6f29297182b023b9bea611cc73f,28-270-18-5
28,270,,18,CC,0.0,0.0,148.50,156.10,156.10,, SILTY CLAYSTONE, 5Y4/1-OLIVE GRAY,,,,,, A FEW SMALL F RAGMENTS,, 00000000,22a35590c61b73f610883bf40a37a373,28-270-18-CC
28,270,,19,1,3.0,150.0,158.00,158.03,159.50,, SILTY CLAYSTONE, 5GY4/1-DK GREENISH GRAY," NO DISCERNIBLE BEDDING,SEVERAL BANDS DETECTABL E DIFFUSE DARKER SUBCIRCULAR PATCHES ABOUT 1 CM ACRO SS",," RARE HARD GRANULES,A FEW SOFTER ANGULAR CLAYSTO NE CLASTS ABOUT 3 TO 5 MM ACROSS",, NO DISCERNIBLE SH FRAGS OTHER THAN BIVALVE CROSS-SECTION 3 BY 2 BY 0. 1 MM AT 50 CM, LITTLE COARSE SAND (CORE SMOOTH), LITHIF IED, 00000000,8b836432c2039f5f49e4d022d3a52be1,28-270-19-1
28,270,,19,2,0.0,150.0,158.00,159.50,161.00,, CLAYSTONE, 5GY4/1-DK GREENISH GRAY, ?LARGE BURROWS IN BLOCK FROM 56 TO 61 CM,," RARE GRAN ULES,CHERT OR SILICIFIED ARGILLITE CLAST 6 CM ACROSS AT 54 CM,A FEW SCATTERED FAINT DIFFUSE DARKER PATCH ES 1 TO 3 CM ACROSS ?MICRONODULES IN UPPER 90 CM",, 1 OR 2 THIN TINY CARB SH FRAGS," CORE FEELS SMOOTH DO WN TO 30 CM WHERE IT BECOMES MORE GRITTY DOWN TO 53 CM,CORE IS SMOOTH WITH 1 OR 2 SLIGHTLY GRITTY INTERV ALS-ABOUT 20 PERCENT OF LENGTH-DOWN TO 150 CM", LITHIFIED, 00000000,a74eb83a4d0b2d432cd34641e5245582,28-270-19-2
28,270,,19,3,0.0,150.0,158.00,161.00,162.50,, SILTY CLAYSTONE," 5Y4/1-OLIVE GRAY,5GY4/1-DK GREEN ISH GRAY"," NO DISCERNIBLE BEDDING FROM 0 TO 9 CM AND 44 TO 110 CM,INTERVALS 9 TO 44 CM AND 9 6 TO 110 CM APPEAR TO HAVE SANDY LAMINAE IN PLACES,U PPER AND LOWER CONTACTS EXTEND OVER ABOUT 1 CM AND M AY BE GRADATIONAL OR SHARP-HARD TO TELL,SAND AT 125 CM AS AT 120 CM ?BURROW-SURROUNDED BY NARROW DIFFUSE DARKER ZONE 1 TO 3 MM WIDE",,,," ONLY 2 OR 3 THIN SH FR AGS,BIVALVE 0.1 BY 12 MM AT 120 CM"," INTERVALS 0 TO 9 CM AND 44 TO 96 CM AND 96 TO 110 CM LACK COARSE SA ND OR GRIT,INTERVALS 9 TO 44 CM AND 96 TO 110 HAVE C OARSE SAND AND MUCH GRIT (FEEL MUCH ROUGHER) AND APP EAR TO HAVE SANDY LAMINAE IN PLACES", LITHIFIED, 00000000,df2a21ac03d7c3b610ddf8f6a9798d31,28-270-19-3
28,270,,19,4,0.0,150.0,158.00,162.50,164.00,, SILT-BEARING CLAYSTONE, 5GY4/1-DK GREENISH GRAY, LITTLE BEDDING APPARENT BUT RARE LENTICULAR SHAPED ERRATIC GRANULES ARE MORE OR LESS ALIGNED AND PERPEN DICULAR TO CORE AXIS,," MANY MICRONODULES 10 TO 20 MI CRONS AROUND 139 CM,ERRATIC CLASTS-MOSTLY GRANITE TO FINE SAND-ARE RARE,1 UNUSUALLY LARGE PEBBLE AT 75 C M IS AN ALTERED MAFIC IGNEOUS ROCK-PROBABLY PLUTONIC",,, ENTIRE CORE SECTION HAS A COMPARATIVELY SMOOTH FE EL-SO NO APPARENT SAND-RICH INTERVALS PRESENT,, 00000000,7f7be30d15d9a14f579f8cb93b96d239,28-270-19-4
28,270,,19,5,0.0,150.0,158.00,164.00,165.50,, SILTY CLAYSTONE, 5GY5/1-GREENISH GRAY," CLAYSTONE BELOW 125 CM HAS LIGHTER THICK IRREGULA R LAMINAE AND EQUANT BODIES UP TO 2 CM ACROSS,INDIST INCT STRATIFICATION IN GRITTY SANDY INTERVAL FROM 70 TO 115CM COARSE SAND LENS 4 MM TH ICK AT ABOUT 93 CM",," SCATTERED GRANULES MOSTLY DK ARGILLITE,M ICRONODULES AND OPACITIZED DIATOM FRAGS",, BIVALVE 4 MM ACROSS AT ABOUT 108 CM, BECOMES GRITTY TO TOUCH ABOUT 7 0 CM TO A MAXIMUM ABOUT 95 CM AND BECOMES SMOOTH AGA IN ABOUT 115 CM GRADING DOWN INTO CLAYSTONE ABOUT 12 5 CM, LITHIFIED, 00000000,cce3ab35ab4f67a0f6bfc11d945313a1,28-270-19-5
28,270,,19,CC,0.0,0.0,158.00,165.60,165.60,,,,,,,,, VOID,, 00000000,fe0c1314c0d314c6feb15722dbe07173,28-270-19-CC
28,270,,20,1,0.0,128.0,167.50,167.50,168.78,, SILT-BEARING CLAYSTONE," 5GY4/1-DK GREENISH GRAY,5 G4/1-",,, ERRATIC CLASTS," SUBROUNDED CALCAREOUS GRAN ULE AT 35 CM,AT 94 CM WHITE QUARTZITE? PEBBLE,AT 110 CM WHITE SANDSTONE?,DENSE DK GRAY CLASTS AT 100 AND 101 CM", DEFORMED FLATTENED CLAM 1.5 CM ACROSS AT 60 CM FILLED BY SILTY CLAY," ENTIRE CORE SEEMS UNIFORMLY SMOOTH IN FEEL ,FEW GRANULES PRESENT-LITTLE SAND",, 00000000,3a6a0299dcd93a0436b3d0d24a09aee4,28-270-20-1
28,270,,20,2,0.0,150.0,167.50,169.00,170.50,, SILTY CLAYSTONE, 5GY4/1-DK GREENISH GRAY,,, ALTERED GRANITE PEBBLE AT 130 CM,,," FROM 0 TO 1 25 SMOOTH FEEL-NONGRITTY,FROM 125 TO 150 APPARENT SA ND TO SILT(RATIO)RICHER SECTION HAVING GRITTY FEEL,N OTE-SMEAR SLIDE IS OF SECTION THAT APPEARS IN HAND S PECIMAN TO BE UNUSUALLY GRANULAR-SMEAR SLIDE DOES NO T SHOW THIS COARSENESS", LITHIF IED, 00000000,b299d3cf6aac108a7dbb1b471222648f,28-270-20-2
28,270,,20,3,0.0,150.0,167.50,170.50,172.00,, SILTY CLAYSTONE, 5GY4/1-DK GREENISH GRAY," SUBTLE SLIGHTLY DARKER MOTTLING WITH PATCHES E LONGATE PARALLEL TO BEDDING,5 MM SAND LAMINA AT 123 CM",, SOFT DK CLAST 5 MM AT 196 CM,, SHELL 0.5 BY 5 MM AT 60 CM, SLIGHTLY MORE GRITTY FROM 90 TO 130 CM, LITHIF IED, 00000000,741031951fd7aad3354507a8182939c1,28-270-20-3
28,270,,20,4,0.0,150.0,167.50,172.00,173.50,, CLAYSTONE, 5Y4/1-OLIVE GRAY," IRREGUL AR DK MOTTLING APPEARS TO FOLLOW DEFORMATION STRUCTU RES FROM 9 TO 70 CM,?LOAD OR PULL-APART STRUCTURES F ROM 110 TO 130 CM STRUCTURELESS POORLY SO RTED SAND BED GRADED UP IN SILTY CLAY AT 80 CM FROM 105 TO 80 CM",, CLASTS MAINLY OF DK ARGILLITE,, 1 OR 2 SMALL THIN SH FRAGS,, LITHIFIED, 00000000,92a84851fed65e26a502a2685681823d,28-270-20-4
28,270,,20,5,0.0,150.0,167.50,173.50,175.00,, SILTY CLAYSTONE, 5GY4/1-DK GREENISH GRAY," LITTLE BEDDING APPARENT IN UPPER 120 CM,FROM 120 TO 150 CM VAGUE SUBHORIZONTAL LT TO DK STREAKINESS-BEDDING?",," FEW CLASTS,SANDSTONE CLAST AT 25 CM,BLACK DENSE CLA ST AT 141 AND AT 144 CM",,, CORE BECOMES GRITTIER IN S ECTION 120 TO 150 CM,, 00000000,a6bfdfe3ee75e34ed781db769100c48a,28-270-20-5
28,270,,20,6,0.0,100.0,167.50,175.00,176.00,, SILTY CLAYSTONE, -DK GREENISH GRAY," 0 TO 13 CM U NIFORM CLAYSTONE,13 TO 15 CM GRANULE-RICH LAYER,1K T O 100 CM UNIFORM CLAYSTONE-LITTLE LAYERED STRUCTURES",,,,,,, 00000000,b8eecd4e2710c2bb102dd03628103424,28-270-20-6
28,270,,20,6,100.0,116.0,167.50,176.00,176.16,, SILTIER AND SANDIER SILTY CLAYSTONE,, SUBHORIZONTAL LAYERING-LAYER S 1 TO 5 CM THICK-COMMON IN INTERVAL,,,,, LITHOLOGY IN DICATED BY GRITTINESS,, 00000000,98ce57d1b2fa8fb326684279bfb03e54,28-270-20-6
28,270,,20,6,116.0,150.0,167.50,176.16,176.50,, SILTY CLAYSTONE,, WITH PARTS OF AT LEAST 4 LOAD CA STS OR SANDY INCLUSIONS,,,,,,, 00000000,1323b86b902999a2e89258ba8ab64920,28-270-20-6
28,270,,20,CC,0.0,0.0,167.50,176.60,176.60,,,,,,,,, VOID,, 33232000.3908.3311,12510cfe232f17bbe2295ad1d874d297,28-270-20-CC
28,270,,21,1,70.0,150.0,177.00,177.70,178.50,, SILTY CLAYSTONE, 5G4/1-DK GREENISH GRAY," FAIRLY UNIFORM THROUGHOUT SECTION,RARE DARKER C LAYSTONE LENSES LOCALLY PRESENT-BUT VAGUELY SEEN",," M AFIC IGNEOUS CLAST AT 94 CM,GRANULE MUDSTONE PEBBLE AT 96 CM,ERRATIC CLASTS",,,, LITHIFI ED, 00000000,d34c37db0d6efffc4d653a6c2f28f141,28-270-21-1
28,270,,21,2,0.0,150.0,177.00,178.50,180.00,, SILTY CLAY," 5Y4/1-OLIVE GRAY,5GY4/1-DK GREENISH G RAY", NO DISCERNIBLE BEDDING EXCEPT PERH APS AT TOP,,,," RARE THIN SH FRAGS 2 TO 3 MM LONG,BIVAL VE 0.5 BY 7 MM AT 87 CM", SPLITS STRAIGHT ACROSS COR E, LITHIFIED, 00000000,d2c73dbe32ff17edd9285dfc8cac8322,28-270-21-2
28,270,,21,3,0.0,150.0,177.00,180.00,181.50,, SILTY CLAY," 5Y4/1-OLIVE GRAY,5GY4/1-DK GREENISH G RAY"," NO DISCERNIBLE BEDDING,DK GRAY PATCHES UP TO 5 CM LONG DIFFUSING OUT FROM CRACKS OR CLASTS",, GREENIS H BROWN NONCALCAREOUS PIECES UP TO 4 MM AT 110 AND 1 15 CM,," ?FORA M AT 110 CM,BIVALVE 0.5 BY 10 CM AT 110 CM",, FIRM, 33233000.3908.3450,bb17782591242baba742f050addbe4ea,28-270-21-3
28,270,,21,4,0.0,75.0,177.00,181.50,182.25,, SILTY CLAY, 5GY4/1-DK GREENISH GRAY," MINOR MOTTLING AND BURROWS,GRADATIONAL CONTACT INTO CARB CLAY BELOW",,,,,, LITHIFIED, 33233000.3908.3450,60db4bc153a00d4672ec9e0a2f44fd6b,28-270-21-4
28,270,,21,4,75.0,88.0,177.00,182.25,182.38,, CARB-BEARING CLAY, 5GY4/1-DK GREENISH GRAY, GRAD ATION CONTACTS WITH SILTY CLAY ABOVE AND CARB-FREE C LAY BELOW,, ROCK AT 80 CM BY DSDP CLASSIFICATION IS A DETRITAL CLAYEY SILT LIMESTONE ACCORDING TO SMEAR SLIDE,,,, FIRM, 00000000,03fee4b062ebf7636a681ae0ddee9a2f,28-270-21-4
28,270,,21,4,88.0,150.0,177.00,182.38,183.00,, SILTY CLAY, 5GY4/1-DK GREENISH GRAY," MOTTLING AND BURROWING MORE CONSPICUOUS AT 103 TO 1 05 CM AND AT 128 AND 130 CM,GRADATIONAL CONTACT INTO CARBONATE CLAY ABOVE",,,,,, LITHIFIED, 33213000,6fef3a9e6763bd669b3a986432bf7e3c,28-270-21-4
28,270,,21,5,0.0,150.0,177.00,183.00,184.50,, SILTY CLAYSTONE," 5Y4/1-OLIVE GRAY,5GY4/1-DK GREEN ISH GRAY", INDISTINCT IRREGULAR THICK MO RE CLAYEY LAMINAE LENSOID IN UPPER 50 CM-MORE REGULA R WHERE VISIBLE IN LOWER 100 CM,,,, SH FRAG 0.5 BY 8 MM AT 130 CM, SUBHORIZONTAL WAVE Y FRACTURE PLANES EVERY 1 TO 2 CM, LITHIFIED, 00000000,286a789c09f38e0daf44e2321a6f7f15,28-270-21-5
28,270,,21,CC,0.0,0.0,177.00,184.60,184.60,,,,,,,,, VOID,, 33233000,0220665c50f083a258c959c4d86523ad,28-270-21-CC
28,270,,22,1,0.0,150.0,186.50,187.00,188.50,, CLAYSTONE, 5GY4/1-DK GREENISH GRAY," UNIFORM THRO UGH SECTION,SUBHORIZONTAL DARKER GRAY LENSES RARE-BU T LOCALLY PRESENT,INDISTINCT",," DENSE BLACK CLAST AT 10 CM,CLAST AT 35 CM,LT COLORED CLAST AT 75 CM,CLAST AT 115 AND AT 118 CM,BLACK CLAST AT 137 CM",,,,, 31230000,6b11bc9eb3d349fa0d5a355e60c6ed85,28-270-22-1
28,270,,22,2,0.0,150.0,186.50,188.50,190.00,, CLAYEY SANDSTONE, 5GY5/1-GREENISH GRAY, ELONGATE THIN DIFFUSE DARKER PATCHES UP TO 3 CM LONG PRESUMABLY INDICATING BEDDING THOUGH RATHER IRR EGULAR SCATTERED THROUGH THE CORE,, NO CALCAREOUS MA TERIAL BUT THERE ARE DK ZONES AROUND NARROW SLOTS AB OUT 2 TO 3 MM LONG ORIENTED WITHIN ABOUT 30 DEGREES OF BEDDING IN THE LOWER 50 CM,,,, LITHIFIE D, 33234000,cccee1eaea712ad97def537b79e8eef4,28-270-22-2
28,270,,22,3,0.0,150.0,186.50,190.00,191.50,, SILTY CLAYSTONE, 5GY4/1-DK GREENISH GRAY, NO OBVIOUS BEDDING BUT SCATTERED DARKER PATCHE S ELONGATE PERPENDICULAR TO CORE,, A FEW SOFT SEDIME NT CLASTS UP TO 10 MM LONG AT 25 AND 32 AND 45 AND 1 30 CM,, 4 MM SH AT 30 CM,, LITHIF IED, 00000000,818121e5ac60dc3e70ea044c3775fbce,28-270-22-3
28,270,,22,4,0.0,150.0,186.50,191.50,193.00,, SILTY CLAY, -DK GREENISH GRAY,,," CONTAINS NUMEROUS LENS-SHAPED TO IRREGULAR SUBHO RIZONTAL DK GRAY SHALE CLASTS,CLASTS GENERALLY 1 OR 2 CM LONG BY ABOUT 5 MM THICK,WELL-ROUNDED BROWNISH GRAY DENSE PEBBLE AT 50 CM",, 5 MM LONG AT 70 C M,, FIRM, 33213000,e3c9609cb4bbfa372087b80cb277e728,28-270-22-4
28,270,,22,5,0.0,104.0,186.50,193.00,194.04,, SILTY CLAYSTONE, 5GY4/1-DK GREENISH GRAY, UNIFORM WITH NO DISCERNIBLE BEDDING EXCEPT FOR A FEW FAINT LENSOID DARKER PATCHES 1 TO 2 CM ACROSS,, ROUND SOFT SILTSTONE CLAST 21 MM AT 118 AND 120 C M,,, SLIGHTLY MORE CLAY-RICH FROM 76 TO 104 CM, LITHIF IED, 00000000,405d74d98300d3169dfe572274ac06b8,28-270-22-5
28,270,,22,6,0.0,150.0,186.50,194.50,196.00,, SILTY CLAYSTONE, 5GY4/1-DK OLIVE GRAY," HETEROGEN EOUS WITH NUMEROUS LENS-SHAPED TO MORE IRREGULAR DAR KER GRAY CLAYSTONE CLASTS DISTRIBUTED MORE OR LESS E VENLY THROUGH ENTIRE SECTION,ALL CLASTS LIE APPROXIM ATELY SUBHORIZONTAL-THUS PROBABLY ARE FILLED BURROWS",,,,," ALL SIZE GRADATIONS FROM SOME ONLY A FEW MM LONG TO THOSE 2 OR MORE CM LONG,MANY OF THESE CLASTS ARE WISPY AND VAGUELY DEFINED-SOME ONLY SLIGHTLY DARKER THAN CLAYSTONE OF MATRIX",, 00000000,8a86e58a01a9fc6745e6e8b2eaed8554,28-270-22-6
28,270,,22,CC,0.0,0.0,186.50,196.10,196.10,,,,,,,,, VOID,, 00000000,6c87f9c5c29e37b523c032b6ac9d6c6b,28-270-22-CC
28,270,,23,1,83.0,150.0,196.00,196.83,197.50,, SILTY CLAYSTONE," 5Y4/1-OLIVE GRAY,5GY4/1-DK GREEN ISH GRAY"," BEDDING NOT DISCERNIBLE PROPORTION OF COARSE SAND AND GRIT INCREASES DOWN T O 100CM, SPARSE SAND TO ABOUT 130 CM WHEN PROPORTION OF GRIT INCREASES DOWN TO 150 CM",, BROWNISH GRAY ARGILLITE CLAST AT 103 CM,, NO SH FRAGS,, LITHIFIED, 00000000,ee45c44e459e358d05881ed1eac2fd77,28-270-23-1
28,270,,23,2,0.0,29.0,196.00,197.50,197.79,, SILTY SANDY CLAY, 5Y4/1-OLIVE GRAY, GRADING DOWN TO SHARP BASAL CONTACT AT 29 CM,,,,, COARSE, FIRM, 00000000,aa060b43f4ba98ac8f933a0a298ffc9b,28-270-23-2
28,270,,23,2,29.0,150.0,196.00,197.79,199.00,, SILTY CLAY, 5GY4/1-DK GREENISH GRAY,,," CONTAINING ONLY RARE SCATTERED INTRAFORMATIONAL TYPE CLAY CLAST S-LENTICULAR SHAPED SUBHORIZONTAL AND DK GRAY IN COL OR,BLACK? VOLCANIC PEBBLE AT 30 CM,PEBBLE BED AND OV ERLYING LAYER CLAST 2.5 CM LONG AT 58 CM",,,, FIRM, 00000000,a55c345821fd7ba14ce3fc611f7f7abc,28-270-23-2
28,270,,23,3,0.0,144.0,196.00,199.00,200.44,, SILTY CLAYSTONE," 5Y4/1-OLIVE GRAY,5GY4/1-DK GREEN ISH GRAY", BEDDING EVIDENT IN ONLY A FEW PLACES AND THEN INDISTINCTLY,," A FEW CLASTS-LIKE HO ST LITHOLOGY BUT MORE CLAYRICH-SOFT-EQUANT-FROM 3 TO 10 MM LONG,PATCHES WITH HIGHLY IRREGULAR ATTENUATED OUTLINE-FOR EXAMPLE AT 26 CM-IN UPPER 50 CM SAND- FILLED MOLD OF A BIVALVE? 3 BY 40 MM AT 120 CM,SOFT DK WELL-DEFINED OVAL PATCHES UP TO 7 MM ACROSS FROM 122 TO 132 CM",," CARB SH FRAGS 0.1 BY 14 MM AT 75 CM, MOLD OF SH 1 BY 15 MM AT 75 CM",, LITHIFIED, 00000000,ca57f7e70a1d470d45e446519feeedd7,28-270-23-3
28,270,,23,4,0.0,150.0,196.00,200.50,202.00,, SILTY CLAYSTONE, 5GY4/1-DK GREENISH GRAY,,, SHARPLY DEFINED SUBROUND BOULD ER OF CLAYEY TO SILTY FINE SANDSTONE-DK GRAY,, CLAM SH FILLED WITH MUDSTONE (SILTY CLAYSTONE) 5 MM LONG AT 90 CM, SOME ROCK CONTINUES TO BASE BUT IS MUCH MORE FISSILE FROM 60 TO 150 CM, LITHIF IED, 00000000,613228326da80b94e18ed887ad1b14b8,28-270-23-4
28,270,,23,CC,0.0,0.0,196.00,202.10,202.10,, CLAYEY SILTSTONE, 5GY4/1-DK GREENISH GRAY, NO BEDDING,, NO OBVIOUS GRANULES,, NO OBV IOUS SH FRAGS,, SEMIL ITHIFIED, 00000000,1c89dd709dac82763ad85f3428602f13,28-270-23-CC
28,270,,24,1,0.0,64.0,205.50,205.50,206.14,, SILTY CLAY, 5G4/1-DK GREENISH GRAY," FINELY LAMINATED,INTERLAMINAE OF SANDY SILT BEDS 1 T O 5 MM THICK MAKE UP 5 TO 10 PERCENT OF CORE HERE-BE COME FEWER BELOW 41 CM DEPTH AND ABSENT BELOW 47 CM",,,,,, LITHIFIED, 00000000,f227211adfed6e0355e7ab0da8c05363,28-270-24-1
28,270,,24,1,64.0,91.0,205.50,206.14,206.41,, DETRITAL CLAY-SILT MICARB-LIMESTONE, N6-MEDIUM LT GRAY, SHARP CONTACT AT 64 CM,,,,,,, 00000000,3448e353d223630fcff3bd14f26e92ab,28-270-24-1
28,270,,24,2,0.0,150.0,205.50,207.00,208.50,, CLAYEY SANDSTONE, 5G3/1-DK GREENISH GRAY," FINELY LAMINATED,INDISTINCTLY LA MINATED OR UNBEDDED AND MICROLAMINATED",, INDISTINCTL Y LAMINATED INTERVALS HAVE A FEW SCATTERED GRANULES,,,, SEMILI THIFIED-LITHIFIED, 00000000,9e4cf9921e557456ab29690b4c1084a7,28-270-24-2
28,270,,24,3,0.0,150.0,205.50,208.50,210.00,, SILTY CLAYSTONE, 5GY3/1-DK GREENISH GRAY, FINE TO COARSE LAMINAE OF SANDY SILT-ABOUT 10 PERCENT-AND SILTY CLAY MOSTLY PLANAR BUT SOME AR E GENTLY WAVEY,, VERY SPARSE SCATTERED GRANULES LESS THAN 2 MM ACROSS,,, SPLITS EASILY ALONG SAND SILT LA MINAE, SEMILI THIFIED, 33233000,91461a822f9cd89d4053d82d700ca135,28-270-24-3
28,270,,24,CC,0.0,0.0,205.50,210.10,210.10,, SILTY CLAYSTONE," 5Y2/1-OLIVE GRAY,5GY2/1-DK GREEN ISH GRAY", SOME SANDY LAMINAE,, NO E VIDENT GRANULES,, NO EVIDENT SH FRAGS,, SEMILITHIFIED, 33233000,105aae286fa25078815a75aa65f13847,28-270-24-CC
28,270,,25,1,29.0,92.0,215.00,215.29,215.92,, SILTY CLAY, 5GY4/1-DK GREENISH GRAY, POORLY BEDDED,," DK GRAY MUDSTONE CLAST ABOUT 12 MM LONG AT 30 CM,DK GRAY MUDSTONE CLAST AT 43 CM",, FOSS IL SH FRAG 0.6 CM LONG AT 85 CM,, LITHIFIED, 00000000,36cebd0197c5d710eb1db53843e64ad5,28-270-25-1
28,270,,25,1,104.0,150.0,215.00,216.04,216.50,, SILTY CLAY, 5GY4/1-DK GREENISH GRAY, POORLY BEDDED,," GRANITIC PEBBLE AT 120 CM,FROM 105 TO 123 CM AND 123 TO 127 CM ARE LARGE AREAS OF PYRIT E-PROBABLY AUTHIGENIC-LARGEST 10 MM ACROSS JUST LEFT OF 14 MM PEBBLE",,,, LITHIFIED, 33213000,8dc71569fa3886a212b2fe51d8d2b1b7,28-270-25-1
28,270,,25,2,0.0,150.0,215.00,216.50,218.00,, SILTY CLAYSTONE, 5Y4/1-OLIVE GRAY," INDISTINCTLY LAMINATED OR UNBEDDED,MORE CLAY RICH-LACKING COARSE SAND AND GRANULES-FROM 35 TO 60 CM",," SPARSELY SCATTERED COARSE SAND AND GRANUL ES BECOMING SLIGHTLY MORE COMMON FROM 74 TO 82 CM,SC ATTERED CLAY FRAGS MOSTLY A FEW MM ACROSS AND EQUANT BUT A FEW UP TO (OMITTED)",,,, SEMILITHIFIED -LITHIFIED, 00000000,fa07616421603d527dc432c0b90ac7ee,28-270-25-2
28,270,,25,3,0.0,72.0,215.00,218.00,218.72,, SILTY CLAYSTONE, 5GY4/1-DK GREENISH GRAY," TOP AND B ASE OF PEBBLE BED AT 13 TO 14 CM GRADATIONAL INTO SI LTY CLAY,A FEW GRANULES AND PEBBLES IN NONSORTED CLA YSTONE BELOW PEBBLE BED",, RICH IN GRANULES AND SMALL PEBBLES,,,, LITHIF IED, 00000000,443024c6d2222f3d1d302dd84f574069,28-270-25-3
28,270,,25,3,72.0,114.0,215.00,218.72,219.14,, MICARB-RICH CLAYEY SILT, N6- MEDIUM LT GRAY, GRA DATIONAL CONTACT AT 76 CM AND AT 114 CM,,,,,, FIRM, 00000000,1560b83780e1b86fc8a8cce5b8ac1720,28-270-25-3
28,270,,25,3,114.0,150.0,215.00,219.14,219.50,, SILTY CLAYSTONE, 5GY4/1-DK GREENISH GRAY, INDIST INCT WAVY LENTICULAR LAYERING-IS MORE OR LESS BEDDIN G?,,,,,,, 33233000,bd092a8079f107a5f6c298171ebeb5d4,28-270-25-3
28,270,,25,4,0.0,150.0,215.00,219.50,221.00,, SILTY CLAYSTONE, 5GY4/1-DK GREENISH GRAY," INDISTINCTLY BEDDED OR UNBEDDED,GRADES DOWN FR OM SLIGHT TO MODERATELY GRITTY AT 25 CM,SLIGHTLY GRI TTY FROM 25 TO 60 CM,LACKING COARSE SAND OR GRIT UNT IL 100 CM WHERE IT GRADES INTO MOD GRITTY TO 135 CM, SLIGHTLY GRITTY TO 150 CM",," SANDY LENTICLE 32 MM AT 140 AND 145 CM,CLASTS 10 MM AT 137 AND 139 CM,RED QU ARTZITE CLASTS AT 117 AND 119 CM",,,, LITHIF IED, 00000000,bfac939ae924fea55b83907e89be31fd,28-270-25-4
28,270,,25,CC,0.0,0.0,215.00,221.10,221.10,,,,,,,,, VOID,, 33233000,7717307dfca1d4e7fbeea6ede09c2b15,28-270-25-CC
28,270,,26,1,110.0,150.0,224.50,225.60,226.00,, SILTY CLAYSTONE, 5GY4/1-DK GREENISH GRAY, NO BEDDING DISCERNIBLE,, COARSE SAND AND GRIT COMMON,,,, LITHIF IED, 00000000,67727f744c1b148469cb8eec34cdf4d2,28-270-26-1
28,270,,26,2,0.0,150.0,224.50,226.00,227.50,, SANDY CLAYEY SILTSTONE, 5GY4/1-DK GREENISH GRAY," NO BEDDING DISCERNIBLE,CHANGES IN GRITT INESS SHARP AT 9 TO 6 CM-REST APPEAR GRADATIONAL",," M OST CLASTS ARE DK ARGILLITE OR GRANITE YELLOWISH BROWN? DOLOMITE AT 130 CM, 16 MM CLAY CLAST AT 5K CM",," RARE SMALL THIN SH FRAGS GASTROPOD CROSS-SECTION 4 MM AT 127 CM,3 MM SH AT 65 CM",, LITHIFIED, 00000000,7dda0c57d670b7014cf6404adccf78b0,28-270-26-2
28,270,,26,3,0.0,150.0,224.50,227.50,229.00,, CLAYEY SILTSTONE, 5Y4/1-OLIVE GRAY, NO CONTACTS VISIBLE ALTHOUGH THERE ARE GRADATIONS IN TO PEBBLE-RICH SECTIONS AS NEAR 120 CM,," GABBRO PEBB LE 13 MM AT 134 CM,LOCALLY WITH ABUNDANT PEBBLES",,, C ORE SURFACE HAS GRITTY FEEL THROUGHOUT, LITHIFIED, 00000000,390f16e46d3f58da61be1ea22d41d37b,28-270-26-3
28,270,,26,4,0.0,150.0,224.50,229.00,230.50,, SILTY CLAYSTONE, 5GY4/1-DK GREENISH GRAY, MODERATELY GRI TTY FROM 0 TO 30 CM AND 42 TO 77 CM AND 97 TO 150,," SCATTERED CLASTS THROUGHOUT MOSTLY LESS THAN 6 MM BUT UP TO 30 MM LONG,MICRITE CEMENTED FROM 30 TO 42 CM AND 47 TO 97 CM",," RARE THIN BIVALVE SH FRAGS IN CARBONATE CEMENTED PARTS,CROSS-SECTION OF GASTROP OD ABOUT 3 MM IN DIAMETER AT 112 CM",, LITHIF IED, 00000000,ac99166c7f87338c4a3f64cefcae02c9,28-270-26-4
28,270,,26,5,0.0,150.0,224.50,230.50,232.00,, CLAYEY SILT, 5Y4/1-OLIVE GRAY," NO BEDDING APPARENT,CORE APPEARS QUITE UNIFORM AND FEELS MODERATELY GRITTY",," NO CO NCENTRATIONS OF PEBBLES,BLACK DENSE CLAST 10 MM AT 9 CM,7 MM CLAST AT 27 CM,10 MM DENSE DK GRAY CLAST AT 111 CM,5 MM BLACK DENSE CLAST AT 130 CM AND AT 143 CM",,,, LITHIFIED, 00000000,5f54fc11ab17783db0f36f6c44f725d3,28-270-26-5
28,270,,26,6,0.0,150.0,224.50,232.00,233.50,, CLAYEY SILT, 5GY4/1-DK GREENISH GRAY," HORIZONTAL THIN DK LAMANINAE LOCALLY PRESENT AS AT ABOUT 30 AND 50 AND 120 AND 145 CM,NO OTHER INDICAT IONS OF BEDDING IN SECTION",, SULFIDE NODULE 30 MM AT 100 CM,,, CORE THROUGHOUT SECTION HAS A MODERATELY G RITTY FEEL, LITHIFIED, 00000000,0f6246ac7efad2edd9cb4f669a0e3eba,28-270-26-6
28,270,,26,CC,0.0,0.0,224.50,233.60,233.60,, SANDSTONE," 5G4/1-DK GREENISH GRAY,N5-MEDIUM GRAY"," POORLY SORTED WITH CLAY MATRIX AND CLA STS,NO OBVIOUS BEDDING",, CLASTS UP TO 5 MM,,,, LITHIFIED, 00000000,ee99e61a47eeddc6619bd182cd22518a,28-270-26-CC
28,270,,27,1,0.0,150.0,234.00,234.00,235.50,, CLAYEY SANDSTONE, 5GY4/1-DK GREENISH GRAY," MAINLY UNBEDDED BUT INTERVALS OF DISTINCT LAM INATION FROM 30 TO 38 AND 86 TO 101 CM,CARBONATE CEM ENTED ZONES FROM 56 TO 75 AND 90 TO 91 CM WITH GRADU AL CONTACTS WA VY BEDDING AT 76 CM,MODERATELY GRITTY FROM 0 TO 22 A ND 37 TO 56 AND 75 TO 90 AND 91 TO 150 CM",, SCATTERE D CLASTS,, RARE THIN SH FRAGS IN UPPER 50 CM,, LITHI FIED, 00000000,05cb8008b6fccf300666a9105ef7e1cc,28-270-27-1
28,270,,27,2,0.0,150.0,234.00,235.50,237.00,, CLAYEY SANDY SILTSTONE, 5Y4/1-/LIVE GRAY," 90 TO 150 CM DK LAMINAE ABUNDANT-LOCALLY INCLINED, 101 TO 108 CM LAMINAE INCLINED AT ABOUT 30 DEGREES-F ORESETS?",,,,, GRITTINESS UNIFORM THROUGH SECTION-MODERATELY, LITHIF IED, 00000000,512eb04c9dd479ad8d4e55b5fcd9e30e,28-270-27-2
28,270,,27,3,0.0,150.0,234.00,237.00,238.50,, SANDY CLAYEY SILTSTONE, N4-MEDIUM DK GRAY, NO CLEAR BEDDING OTHER THAN THAT DUE TO CHANG ES IN PEBBLE CONCENTRATION,," SCATT ERED CLASTS UP TO 24 MM LONG,CLAST LITHOLOGIES MAINL Y FINEGRAINED AND BROWNISH OR DK GRAY-BUT 1 OR 2 ARE GRANITIC,CLASTS ARE SUBANGULAR TO WELL-ROUNDED AT L EAST IN SECTION,DIP OF ELONGATE CLASTS IN A LITTLE I NDISTINCT BEDDING BETWEEN 133 AND 137 CM",," RARE THIN SH FRAGS UP T O 6 MM LONG SCATTERED THROUGH CORE,CRUSHED THIN SHEL L AT 30 CM,SH FRAGMENT 0.1 BY 6 MM AT 105 CM",, LITHI FIED, 33233000,cb03a1fddd96e551fdd6882bbb757e44,28-270-27-3
28,270,,27,4,0.0,135.0,234.00,238.50,239.85,, CLAYEY SILTSTONE, 5Y4/1-OLIVE GRAY," LITTLE OR NO BEDDING-ONLY LOCALLY AS AT 67 CM,GENERA LLY POOR TO WEAK SORTING,108 TO 112 CM CALCAREOUS ZO NE AND 0 TO 20 CM,PEBBLE RICH LAYER 0.5 CM THICK AT 65 CM",," GRANITIC ROCK AT 108 CM,SMALL HORIZONTALLY-A LIGNED CLASTS BETWEEN 100 AND 108 CM,GRANITIC ROCK A T 62 CM,PARTS OF CALCAREOUS BOULDERS? AT 0 AND 10 CM ,SCATTERED CLASTS",,,, LITHIFIED, 33233000,60ac6243b3f161c6adcdb0e5dddb117f,28-270-27-4
28,270,,27,4,135.0,150.0,234.00,239.85,240.00,, SILTY SANDY CLAY, -OLIVE GRAY,,,,,,, FIRM, 00000000,bd30c0647a27f40dea61330b49c0c2b4,28-270-27-4
28,270,,27,5,0.0,150.0,234.00,240.00,241.50,, SANDY CLAYEY SILTSTONE," 5Y4/1-OLIVE GRAY,5Y3/1-OL IVE GRAY", MAINLY UNBEDDED,," LARGE CLAST S ARE GRANITIC OR FINE GRAINED AND NONCALCAREOUS,SMA LLER CLASTS ARE DK ARGILLITE OR GRANITIC,CLASTS ARE ANGULAR TO ROUNDED",,,, LITHIFIED, 00000000,43fd5c6f0c528e5ecb0a9661c18aeb49,28-270-27-5
28,270,,27,CC,0.0,0.0,234.00,241.60,241.60,,,,,,,,, VOID,, 00000000,276e66f21d624c000bc48fb101968498,28-270-27-CC
28,270,,28,1,0.0,150.0,243.50,244.00,245.50,, CLAYEY SANDY SILT, 5GY4/1-DK GREENISH GRAY, FAINT INDISTINCT LAMINAE AND FRACTURES ARE D ISTINCTLY INCLINED AT ABOUT 30 DEGREES TO CORE AXIS BETWEEN 14 AND 80 CM,, CLASTS >4 MM AT 6/20/23/40/50/53/108/119/149 CM,," CLAM FRAGMENT 5 MM AT 104 CM, CLAM FRAGMENT AT 65 CM"," PEBBLE IMPRESSION 8 MM AT 7 CM,SLIGHT SUGGESTION FROM FRACTURES THAT BEDDING IN CLINED BETWEEN 125 AND 145CM IS AS AT 24 TO 80 CM", LITH IFIED, 00000000,f75b90af18a8ba5150c4b32ccf496aff,28-270-28-1
28,270,,28,2,0.0,150.0,243.50,245.50,247.00,, SANDY SILTY CLAYSTONE," 5Y4/1-OLIVE GRAY,5GY4/1- DK GREENISH GRAY", BEDDING AND PARALLEL FRACTURES DIP AT UP TO 45 DEGREES FROM 65 TO 100 CM BUT ARE SHALLOWER WHERE PRESENT ABOVE AND BELOW,," ANGULAR TO ROUNDED CLASTS UP TO 4 0 MM,MANY LITHOLOGIES,CLASTS >4 MM AT 6/8/10/11/16/1 8/21/44/95/105/115/125/133/134/136/142 CM,DK RED BRO WN? VOLCANIC CLAST AT 125 CM",, RA RE THIN SH FRAGS SH 0.3 BY 6 MM AT 130 CM,, LITHIFIED, 00000000,05115f6f657ece6e8a1190585dd72892,28-270-28-2
28,270,,28,3,0.0,150.0,243.50,247.00,248.50,, SANDBEARING CLAYEY SILTSTONE, 5GY4/1-DK GREENISH GRAY," FINE DK GRAY LAMINAE COMMON THROUGH SECTION,A PPARENT INCLINATIONS TO CORE AXIS RANGE FROM ABOUT 2 0 TO 40 DEGREES",, QTZ 6 MM AT 21 CM,," 144 CM ?CLAM SH FRAGMENT,114 CM CL AM SH FRAGMENT (END PIECE OF CORE),93 CM CLAM SH FRA GMENT (END PIECE OF CORE),FOSSIL SH GRAGMENT AT 19 C M", PEBBLE/BOULDER IMPRESSION FR OM 84 TO 90 CM,, 00000000,ce8f730dd60abaa9ff41606ed6564e30,28-270-28-3
28,270,,28,4,0.0,150.0,243.50,248.50,250.00,, CLAYEY SILTSTONE, 5Y4/1-OLIVE GRAY, HIGHLY DEFORMED AND IRREGULAR DK LAMINAE MARK DISTOR TED POCKETS OF STRATA BELOW 70 CM,,,, RARE THIN SH FRA GS UP TO 4 MM LONG," MODERATELY GRITTY FROM 0 TO 35 CM,SLIGHTLY GRITTY BELOW 35 CM,FRACTURE AT 55 CM", LITHIFIED, 00000000,d8a8c4f0413201157f3288f0ac29bf3e,28-270-28-4
28,270,,28,5,0.0,150.0,243.50,250.00,251.50,, SANDY CLAYEY SILTSTONE," N3-DK GRAY,5Y3/1-OLIVE GRAY"," DEFORMED AND VARIOUSLY ORIENTED L AMINATED PATCHES AS MUCH AS 15 CM LONG STAND OUT AS DARKER COLORED,FRACTURES PARALLEL TO BEDDING AT 55 A ND 93 CM",," SCATTERED CLASTS,CARBONATE CLAST AT 90 CM",,, CARBONATE CEMENTED AREA FROM 77 TO 88 CM, LITHIFIED, 00000000,9294707ab266af38a95ff234c7ff0b2b,28-270-28-5
28,270,,28,6,0.0,150.0,243.50,251.50,253.00,, CLAYEY SILTSTONE," N4-MEDIUM DK GRAY,N3-DK GRAY"," 0 TO 45 CM FINE DARKER GRAY OR BL ACKISH GRAY LAMINAE DIP ABOUT 30 DEGREES,45 TO 110 C M VAGUE LENTICULAR STRUCTURES LOCALLY SUGGEST THAT B EDDING IS HORIZONTAL",," GABBRO PEBBLE 18 MM AT 30 CM, GRANITE PEBBLES 12 AND 9 MM AT 0 AND 3 CM",,, MUD BELOW 110 CM, HARD, 33233000,92a57fa418f47db23cc87289746c57ba,28-270-28-6
