leg,site,hole,core,section,top interval depth (cm),bottom interval depth (cm),top of core depth(m),top of layer depth (m),bottom of layer depth (m), describer,lithology,color,structures,deformations due to drilling,unusual occurrences,minerals,paleontology,other observations,hardness or induration,z-coding,eodp_id,sample
28,270,,1,1,73.0,110.0,0.00,0.73,1.10,, DIAT DET SILTY CLAY, 5G5/1-GREENISH GRAY,, DRILLI NG BRECCIA,,,,, SOUPY TO SOFT, 00000000,12c26b8ccc8832a13712399deadb2161,28-270-1-1
28,270,,1,1,110.0,140.0,0.00,1.10,1.40,, SAND-BEARING CLAYEY SILT, 5Y6/1-LT OLIVE GRAY,, M ODERATELY DEFORMED," SCATTERED PEBBLES UP TO 1 CM AC ROSS,AROUND 10 MM",,,, SOFT, 00000000,378fe48d28f646ab9800a214275350bc,28-270-1-1
28,270,,1,2,0.0,142.0,0.00,1.50,2.92,, SAND-BEARING SILTY CLAY," 5Y6/1-LT OLIVE GRAY,5GY5 /1-GREENISH GRAY,5GY4/1-DK GREENISH GRAY", NO OB VIOUS BEDDING," SMALL STI FFER PATCHES 1 TO 2 CM ACROSS SUGGEST THROUGH MIXING DURING DRILLING,DRILLING BRECCIA 0 TO 56 CM"," PEBBLES UP TO 3 CM LONG INTERSECT CO RE SURFACE EVERY 20 CM BETWEEN 56 AND 140 CM,PEBBLE CONCENTRATIONS AT 63 TO 65 CM",,," PATCH LIKE 56 TO 140 CM F ROM 35 TO 45 CM,LT OLIVE GRAY MIXED WITH GREENISH GR AY 0 TO 56 CM,DK GREENISH GRAY 56 TO 140 CM"," SOFT FROM 0 TO 56 CM ,STIFF FROM 56 TO 140 CM", 00000000,8ea7816f6d27821c487561c782f19c2f,28-270-1-2
28,270,,1,CC,0.0,0.0,0.00,3.10,3.10,, CLAYEY SILT, 5GY5/1-GREENISH GRAY,,, SCATTERED PEB BLES 1 CM ACROSS,,,, STIFF, 00000000,cb7a3083b69ecbff8d676c7d42302756,28-270-1-CC
28,270,,2,CC,0.0,0.0,6.00,6.10,6.10,, SILTY CLAY, 5Y5/1-LT OLIVE GRAY,,, SCATTERED PEBBL ES UP TO 2 CM ACROSS,,, DRILLER THINKS WE PASS ED THROUGH BOULDER AT SOME POINT, SOFT, 00000000,4e4e471763650c18b0b263bc38326f7d,28-270-2-CC
28,270,,3,1,98.0,150.0,15.50,16.48,17.00,, DIATOM-RICH SILTY CLAY, 5Y4/1-OLIVE GRAY,,,,,, STIFF OLIVE GRAY CLASTS UP TO 1 CM AT 135 AND 142 CM, STIFF, 00000000,fda9b5c6a0a05b867906004ca4b5d6d3,28-270-3-1
28,270,,3,CC,0.0,0.0,15.50,17.10,17.10,, DIATOM-BEARING SILTY CLAY, 5Y4/1-OLIVE GRAY,, COMPACTED," SCA TTERED PEBBLES TO 1 CM ACROSS 1 FINE-G RAINED GRANITE PEBBLE CAUGHT IN BOTTOM OF CORE CATCH ER,PEBBLE IS 41 BY 49 BY 69 MM AND SCORED BY TOOTHMA RKS ABOUT 1 TO 2 MM DEEP AND UP TO 4 MM ACROSS",,,, VER Y STIFF, 00000000,bc2ef5b698f6ad5df347c9688d5fd8c5,28-270-3-CC
28,270,,4,CC,0.0,0.0,25.00,25.10,25.10,, SILTY CLAY-DIAMICTITE, 5Y3/1-OLIVE GRAY,,," FEW PEBBLES LESS THAN 1 CM FROM THE SOFTER SED IMENT IN THE BOTTOM FEW CM OF THE CORE CATCHER,MAY B E DOWNHOLE WASHINGS",, SCATTER ED CALC.SH.FRAGS ABOUT 0.5 MM THICK AND UP TO 8 MM L ONG,," SEMI-LITHIFIED,SLIGHTLY FISSIL E", 00000000,38ed42c660ab50239306116cf80de060,28-270-4-CC
28,270,,5,1,130.0,150.0,25.50,26.80,27.00,, SILTY CLAY-DIAMICTITE," 5Y3/1-OLIVE GRAY,5GY3/1-DK GREENISH GRAY",,, SCATTERED SAND AND GRAN ULES UP TO 5 MM ACROSS,, RARE SCATTERED THIN CAL C.SH.FRAGS UP TO 5 MM LONG, CONCHOIDAL FRACTURE, LITHIFIED, 00000000,31b76a9771f8297bf9a985e09671243c,28-270-5-1
28,270,,5,2,0.0,150.0,25.50,27.00,28.50,, SILTY CLAY-DIAMICTITE, 5Y3/1-OLIVE GRAY, NO LAMINAE BUT SEVERAL SLIGHTLY DK AND SOFT ER ZONES 5 TO 10 CM THICK-GRADING UP AND DOWN OVER S EVERAL CM,," SC ATTERED CLASTS UP TO 8 MM ACROSS,FINE-GRAINED,DK.GRA NITIC?",, RARE TH IN CARB.SH.FRAGS UP TO 4 MM LONG IN UPPER 70 CM, CONCHOIDAL FRACTURE, LITHIFIED, 00000000,e84ad2cbfff7a8bb1e1d72f878f4a3e8,28-270-5-2
28,270,,5,CC,0.0,0.0,25.50,28.60,28.60,, SILTY CLAYSTONE-DIAMICTITE," 5Y3/1-OLIVE GRAY,5GY3 /1-DK GREENISH GRAY",,,,, SCATTERED THIN CALC.SH.FRAGS U P TO 4 MM LONG, SEMI- LITHIFIED TO LITHIFIED OLIVE GRAY TO DK GREENISH GRA Y, SEMI-LITHIFIED TO LITHIFIED, 00000000,d3857236407edf602476430e33c24ede,28-270-5-CC
28,270,,6,1,43.0,150.0,34.50,34.93,36.00,, SILTY CLAY-DIAMICTITE, 5Y2/1-OLIVE BLACK,,," R ARE SCATTERED CLASTS UP TO 7 MM ACROSS,MOSTLY DK.AND FINE-GRAINED",, VERY R ARE SCATTERED THIN CARB.SH.FRAGS UP TO 3 MM LONG,, SEMI-LITHIFIED, 00000000,c64fcde9068313d918ce28e32bbb0e77,28-270-6-1
28,270,,6,2,0.0,150.0,34.50,36.00,37.50,, SILTY CLAY-DIAMICTITE, 5Y3/1-OLIVE GRAY," NO BEDDING OTHER THAN THAT SHOWN BY SH.FRAGS,SEVERAL CALCITE VEINS UP TO 1 MM THICK FROM 120 TO 126 CM WITH A FEW DK VEINS UP TO 0.2 MM THICK PYRITE?",," ABSENT OR VERY RARE CLASTS TO 5MM ACROSS FROM 0 TO 30 AND 126 TO 150 CM, SCATTERED CLASTS UP TO 11 CM ACROSS FROM 30 TO 126 C M,CLASTS ARE EITHER GRANITE OR FINE-GRAINED AND DK,S EVERAL CALCITE VEINS UP TO 1 MM THICK FROM 120 TO 12 6 CM,A FEW DK VEINS UP TO 0.2 MM THICK PYRITE?",," THI N 0.2 MM CARB SH FRAGS UP TO 3 MM LONG COMMON FROM 3 0 TO 32 CM,TWO TRACHOIDAL GASTROPODS ABOUT 8 MM LONG FROM 16 TO 20 CM", CONCHOIDAL FRACTURE," SEMI-LI THIFIED FROM 0 TO 30 AND 126 TO 150 CM,LITHIFIED FRO M 30 TO 126 CM CARB-CEMENTED?", 33213000,b02fea7943926e264841c34959ae1ebf,28-270-6-2
28,270,,6,CC,0.0,0.0,34.50,37.60,37.60,, SILTY CLAY-DIAMICTITE, 5Y3/1-OLIVE GRAY, NO BEDDING,, RARE SCATTERED CLASTS UP TO 10 MM LONG,, RARE SCATTERED THIN CARB SH FRAGS UP TO 3 MM LONG, CONCHOIDAL FRACTURE, LITHIFI ED, 00000000,e01954b75621988a3e3bf52ac634ce1a,28-270-6-CC
28,270,,7,1,86.0,150.0,44.00,44.86,45.50,, SILTY CLAYSTONE-DIAMICTITE, 5Y4/1-OLIVE GRAY, NO BEDDING DISCERNIBLE,, RAR E SCATTERED CLASTS UP TO 6 MM ACROSS OF A FINE-GRAIN ED LT.COLORED LITHOLOGY,, SO SH.FRAGS, CONCHOIDAL FRACTURE, LI THIFIED, 00000000,cd936673c7465cb476a86ea20467e13c,28-270-7-1
28,270,,7,2,0.0,144.0,44.00,45.50,46.94,, SILTY CLAY-DIAMICTITE, 5Y3/1-OLIVE GRAY," NO BEDDING,VEINS ABOU T 0.1 MM THICK OF IRONY SULFIDE? PYRITE?",," RARE SCAT TERED CLASTS UP TO 14 MM LONG OF FINE-GRAINED LT AND DK LITHOLOGIES,ROTTEN WITH QTZ GRAINS ABOUT 1 MM AC ROSS AT 105 CM,QTZ GRAINS TEARING AT 20 CM",," VERY RARE THIN CARB SH FRAGS OF VARIABLE ORIENT ATION INCLUDING VERTICAL UP TO 3 MM LONG,SINGLE SH A T ABOUT 0.3 AND 45 AND 75 CM",," LITHIFI ED LITHIFI ED,SEEMS SLIGHTLY SOFTER AT 20 CM AND SEVERAL OTHER INDEFINITE ZONES OR PATCHES CUT ACROSS LOWER IN CORE", 00000000,201ebe61104e6ac8283993d36038777a,28-270-7-2
28,270,,7,3,0.0,142.0,44.00,47.00,48.42,, SILTY CLAYSTONE-DIAMICTITE," 5Y4/1-OLIVE GRAY,5Y2/ 1-OLIVE GRAY"," ONLY BEDDING EVIDENT IS F ROM 117 TO 130 WHERE THERE ARE IRREGULAR TENSORIAL D ISCONTINUOUS THICK LAMINAE OF CLAYSTONE,DK CLAYSTONE LENSES UP TO 10 BY 3 MM AT ABOUT 116 AND 118 CM,IRR EGULAR CLAYSTONE LENSES UP TO 10 MM THICK BETWEEN 12 0 AND 125 CM,PYRITE VEIN? AT ABOUT 5 CM",," SCATTERED CLASTS UP TO 8 MM ACROSS MAINLY OF DK FINE-GRAINED L ITHOLOGY,CLAYSTONE PEBBLES-SUBROUNDED-6 MM ACROSS AT ABOUT 130 CM",," RARE SCATTERED CARB SH FRAGS 0.3 MM THICK AND UP TO 4 MM LONG EXCEPT AT 35 CM WHERE THEY ARE 1.5 CM THICK,ORIENTATION APPEARS RANDOM",, LITHIFIED, 00000000,2b2a2b79d972848525c696cef2b0e77b,28-270-7-3
28,270,,7,CC,0.0,0.0,44.00,48.60,48.60,, SILTY CLAYSTONE-DIAMICTITE, 5Y3/1-OLIVE GRAY," NO BEDDING,BARROW-LIKE FEATURE 20 MM LONG AND 4 MM WIDE AT CUTFACE",," SCATTERED RARE GRANULES,C UTFACE EXPOSED CLAST WITH IRREGULAR BUT EQUAL OUTLIN E 15 BY 10 MM",,,, LI THIFIED, 00000000,2bb6de4985d6a650496a8f7314724094,28-270-7-CC
28,270,,8,1,43.0,150.0,53.50,53.93,55.00,, SILTY CLAY-DIAMICTITE, 5Y3/1-OLIVE GRAY, NO BEDDING DISCERNIBLE,, RARE SCATTERED CLASTS UP TO 8 MM LONG MAINLY FINE-GRAINED LT TO DK ROCKS,, RARE SCATTERED NON-ORIENTED CARBONATE SH FRAGS 0.3M M THICK AND UP TO 3 MM LONG,, LITHIFI ED, 00000000,52e587edc32f3011949677aca187ca98,28-270-8-1
28,270,,8,2,0.0,150.0,53.50,55.00,56.50,, SILTY CLAY-DIAMICTITE, 5Y3/1-OLIVE GRAY," NO BEDDING EVIDENT,CARBONATE 3 BY 14 MM AT 62 CM",," SCATTERED CLASTS MAINLY OF FINE-GRAINED LT AND DK ROCKS UP TO 13 MM ACROSS,CARBONATE 3 BY 14 MM AT 62 CM",," RARE SCATTERED CARB SH FRAGS RANDOMLY ORIENTED UP TO 3 MM LONG AND 0.3 MM WIDE,CLAM SH 1 BY 20 MM A T 35 CM", CONCHOIDAL FRACTURE THOUGH SOME BREAK CL EANLY PERPENDICULAR TO CORE AXIS, LITHIFI ED, 00000000,25245dc565bfce2045243c1a3ce00085,28-270-8-2
28,270,,8,3,0.0,150.0,53.50,56.50,58.00,, SILTY CLAY-DIAMICTITE, 5Y3/1-OLIVE GRAY, NO DISCERNIBLE BEDDING,, SCATTERED C LASTS UP TO 18 MM LONG,, VERY RARE SCATTERED CA RBONATE SH FRAGS FROM 0 TO ABOUT 80 CM, CONCHOIDAL FRACTURE THOUGH SOME STRAIGHT BREAKS ACROSS THE CORE, LITHIFI ED, 00000000,1712802a1831812cdc3736d041944fff,28-270-8-3
28,270,,8,CC,0.0,0.0,53.50,58.10,58.10,, SILTY CLAYSTONE-DIAMICTITE, 5Y3/1-OLIVE GRAY, TWO LAR GE PIECES AND MANY FRAGS,, SCATTERED CLASTS UP TO 4 MM LONG,,,, LI THIFIED, 00000000,15827f650f72c14aff582e68794a25f4,28-270-8-CC
28,270,,9,1,0.0,39.0,63.00,63.00,63.39,, SILTY CLAYSTONE-DIAMICTITE, 5Y3/1-OLIVE GRAY, NO DISCERNIBLE BEDDING BU T SOME PIECES BREAK STRAIGHT ACROSS CORE,," RARE SCATTERED CLASTS UP TO 5 MM LONG,LARG E CARB CLAST 23 BY 15 MM AT ABOUT 22 CM EXTENDING 28 MM ON BACK SIDE OF CORE",, VERY RARE CARB SH FRAGS 0.1 MM THICK AND UP TO 4 MM LONG MAIN LY SUBHORIZONTAL BUT SOME ARE NEAR VERTICAL, CORE P ULLED UP FROM BOTTOM OF SECTION DURING SPLITTING, LI THIFIED, 00000000,fb8ad7f84ddc98754b45088e2acda05f,28-270-9-1
28,270,,9,2,0.0,150.0,63.00,64.50,66.00,, SILTY CLAYSTONE-DIAMICTITE, 5Y3/1-OLIVE GRAY, NO DISCERNIBLE BEDDING BUT PIECES BREAK ST RAIGHT ACROSS CORE,, SCATTERED CLASTS MOSTLY LESS TH AN 5 MM BUT UP TO 19 MM LONG,, RARE SCATTERED CARBON ATE SH FRAGS 0.1 TO 0.3 MM THICK AND 4MM LONG RANDOM LY ORIENTED EXCEPT FOR THE CLAM SHELL AT 30 CM WHICH IS 1 BY 8 MM,, LI THIFIED, 00000000,5a169a949343f1d41716bfb53b78a0b2,28-270-9-2
28,270,,9,3,0.0,150.0,63.00,66.00,67.50,, SILTY CLAYSTONE-DIAMICTITE, 5Y3/1-OLIVE GRAY," NO BEDDING DISCERNIBLE EXCEPT WHERE NOTED, SPLITS CLEAN PERPENDICULAR TO CORE AXIS,FROM 86 TO 88 CM STREAKED OUT LAMINAE OF INTERBEDDED SILTY CLAY AND CLAY WHICH FORM EN ECHELAN LENSES ABOUT 1 MM TH ICK IN LOWER CM,FROM 120 TO 121 THIN LAMINAE OF FINE SAND",," SPARSELY SCATTERED CL ASTS OF LT AND DK FINE-GRAINED ROCKS UP TO 10 MM LON G,BIOT HB CLAST AT 107 CM",, VERY RARE SCATTERED CARB SH FRAGS UP TO 4 MM LONG WITH RANDOM ORIENTATION,, LI THIFIED, 00000000,77b78ccd0b6f64d66dc18ebc72e998a2,28-270-9-3
28,270,,9,CC,0.0,0.0,63.00,67.60,67.60,, SILTY CLAYSTONE-DIAMICTITE, 5Y4/1-OLIVE GRAY, NO DISCERNIBLE BEDDING,,,,, ONE PIECE 10 CM L ONG, LI THIFIED, 00000000,a270ea3e9900d30f3ed5c5b0f7e0414e,28-270-9-CC
28,270,,10,1,67.0,150.0,72.50,73.17,74.00,, SILTY CLAYSTONE-DIAMICTITE, 5Y3/1-OLIVE GRAY,,, SPARSE LY SCATTERED CLASTS MOSTLY LESS THAN 5 BUT UP TO 12 MM LONG,, RARE SCATTERED CARB SH FRAGS ABOUT 0.1 MM THICK AND UP TO 3 MM LONG RANDOMLY ORIENTED,, LI THIFIED, 00000000,311fbbbbb14d87f78544bdf655e803be,28-270-10-1
28,270,,10,2,0.0,150.0,72.50,74.00,75.50,, SILTY CLAYSTONE-DIAMICTITE," 5Y3/1-OLIVE GRAY,5Y5/ 1-LT OLIVE GRAY", NO DISCERNIBLE BEDDING,," SPARSELY SCATTERED CLASTS MOSTLY LESS THAN 5 MM AND FINE-GRAINED LT OR DK ROCK BUT A FEW UP TO 24 M M OF COARSE-GRAINED BASIC PLUTONIC ROCKS AND FINE-GR AINED LT OLIVE GRAY LIMESTONE,PYRITE? 9 BY 6 MM AT A BOUT 2 CM",," RARE SCATTERED THIN CARB SH FRAGS BUT TWO OR THRE E LARGER FRAGS,SHELL 1 BY 7 MM AT 90 CM,BIVALVE CROS S SECTION 3 BY 13 MM ABOUT 0.1 MM THICK AT ABOUT 77 CM", CONCHOIDAL FRACTURE BUT SOME STRAIGHT BR EAKS ACROSS THE CORE, LITHIFIED, 00000000,80b1459124d34f36458a2a5b36ca8ffd,28-270-10-2
28,270,,10,CC,0.0,0.0,72.50,75.60,75.60,, SILTY CLAYSTONE-DIAMICTITE, 5Y4/1-OLIVE GRAY, NO BEDDING,, RARE SCATTERED GRANULES,, NO SH FRAGS," CONCHOIDAL FRACTURE,4 PIECES,5 TO 8 PIECE S ACROSS", LI THIFIED, 00000000,a2578b7f92260d3228164e98005f263e,28-270-10-CC
28,270,,11,1,16.0,150.0,82.00,82.16,83.50,, SILTY CLAYSTONE-DIAMICTITE, 5Y3/1-OLIVE GRAY,,," SPARSELY SCATTERED CLASTS MOS TLY LESS THAN 5 BUT UP TO 14 MM LONG,LARGE CARB CLAS T 2.5 BY 3.5 CM AT ABOUT 38 CM,LARGE MAFIC IGNEOUS P EBBLE AT ABOUT 74 CM,LARGE LT GRAY PEBBLE WITH 1 MM WIDE WHITE RIM AT ABOUT 82 CM",, VERY RARE THIN CARB SH FRAGS UP TO 3 MM LO NG RANDOMLY ORIENTED,, LI THIFIED, 00000000,da671b48c51ed7657a0e5c8afdf750fc,28-270-11-1
28,270,,11,2,0.0,49.0,82.00,83.50,83.99,, SILTY CLAYSTONE-DIAMICTITE, 5Y3/1-OLIVE GRAY, NO DISCERNI BLE BEDDING,, SPARSELY SCATTERED CLASTS UP TO 5 MM L ONG,, VERY RARE THIN CARB SH FRAGS, CONCHOIDAL FRACTURE, LI THIFIED, 00000000,38569a8c5a91af0d52d7a779b2562ba5,28-270-11-2
28,270,,11,2,49.0,137.0,82.00,83.99,84.87,, SILTY CLAYSTONE-DIAMICTITE, 5Y4/1-OLIVE GRAY, INDISTINCT IRREG ULAR LAMINATION OF SILTY CLAY AND MORE CLAYEY LAMINA E THOUGH BOTH ARE POORLY SORTED,," CLASTS VERY RARE,A FEW SCATTERED CLASTS OF SILTY CLAYSTONE OF VARIOUS SHAPES TO 20 MM ACROSS E SPECIALLY FROM 49 TO 72 CM,LENTICULAR CLASTS ARE PAR ALLEL BEDDING",, SH FRAGS AT 71 CM,, LI THIFIED, 00000000,92b542d7d93a3406636416d5dc050e73,28-270-11-2
28,270,,12,1,0.0,150.0,91.50,91.50,93.00,, SILTY CLAYSTONE, 5Y3/1-OLIVE GRAY," NO BEDDING DISC ERNIBLE EXCEPT FOR INTERVALS 25 TO 30 CM AND 106 TO 110 CM,BEDDING THERE IS PACKED WITH THIN SLIGHTLY DA RKER INDISTINCTIVE WAVEY LAMINAE LOCALLY WITH A CROS S-CUTTING BASE",, C LASTS UP TO 5 MM LONG,," VERY RARE THIN SH FRAGS,CLAM SH 2 CM LONG DORSEL DOWN AT 45 CM",, LITHIFIED, 00000000,c963de30acc621ab65a3699f8052d2c2,28-270-12-1
28,270,,12,2,0.0,150.0,91.50,93.00,94.50,, SILTY CLAYSTONE," 5Y3/1-OLIVE GRAY,5Y2/1-OLIVE BLA CK", NO DISCERNIBLE BEDDING,, SPARSELY S CATTERED CLASTS UP TO 6 MM LONG,," RARE THIN SH FRAGS ,THIN SH AT 5 CM"," PIECES SPLIT ROUGHLY STRAIGHT ACR OSS CORE,OLIVE GRAY TO OLIVE BLACK", LITHIFIED, 00000000,61e742d60a632505230b5d0bd26035d5,28-270-12-2
28,270,,12,3,0.0,150.0,91.50,94.50,96.00,, SILTY CLAYSTONE, 5Y3/1-OLIVE GRAY, N O BEDDING DISCERNIBLE,, SPARSE SC ATTERED CLASTS MOSTLY LESS THAN 5 MM BUT UP TO 10 MM MAINLY OF FINE-GRAINED LT TO DK ROCKS,, RARE THIN SH FRAGS UP TO 6 M M LONG SHOW NEAR COMPLETE BIVALVE SHELLS, PIECES BREA K STRAIGHT ACROSS CORE, LITHIFIED, 00000000,495475c7422fe2fbda2228bf2bbe6c7c,28-270-12-3
28,270,,12,4,0.0,150.0,91.50,96.00,97.50,, SILTY CLAY," 5Y3/1-OLIVE GRAY,5Y2/1-OLIVE BLACK,5Y 6/4-DUSKY YELLOW,5Y5/1", NO DISCERNIBLE BEDDING,, SPARSELY SCATTERED F INE-GRAINED LT TO DK CLASTS MOSTLY UP TO 5 MM LONG B UT ONE IS 15 MM LONG," FINE-GRAINED CARB 5Y5/1 AT 30 CM,DUSKY YELLOW CARB AT 44 CM"," RARE SMALL THIN-SHELLED BIVALVES AND GASTR OPODS UP TO 15 MM LONG,BIVALVE CROSS-SECTION 0.5 BY 10 MM AT ABOUT 33 CM"," PIECES BREAK STRAIGHT ACROSS CORE,CORE COLOR IS OLIVE GRAY TO OLIVE BLACK", LITHIFIED, 00000000,7b2cd8e18d029971dc3fe65345d10ff5,28-270-12-4
28,270,,12,CC,0.0,0.0,91.50,97.60,97.60,, SILTY CLAYSTONE, 5Y3/1-OLIVE GRAY,,, S PARSELY SCATTERED GRANULES,,,, LITHIFIED, 00000000,bb264b8d2e29b76739ec6c4d17d29761,28-270-12-CC
28,270,,13,1,69.0,150.0,101.00,101.69,102.50,, SILTY CLAYSTONE, 5Y3/1-OLIVE GRAY, O NLY BEDDING FEATURE IS A HIGHLY IRREGULAR SLIGHTLY L IGHTER COLORED PATCH FROM 142 TO 145 CM,, SPARSELY S CATTERED CLASTS MOSTLY LESS THAN 5 MM LONG BUT UP TO 9 MM OF DK TO LT FINE-GRAINED ROCKS, DARK ?ARGILLI TE SEEMS DOMINANT,,, LITHIFIED, 00000000,aa20390b2df026ab5b8e99b143039595,28-270-13-1
28,270,,13,2,0.0,146.0,101.00,102.50,103.96,, SILTY CLAYSTONE, 5Y4/1-OLIVE GRAY, N O DISCERNIBLE BEDDING,," SPARSE CLASTS MOSTLY LESS TH AN 5 MM BUT UP TO 19 MM,DENSE DK GRAY AT 55 CM,GRANI TIC ROCK AT 59 CM,GABBRO AT 135 CM",," RARE THIN SH FR AGS UP TO 4 MM LONG,CLAM SH CROSS-SECTION FILLED WIT H COARSE QUARTZOSE SAND AT 85 CM", PIECES SPLIT STRA IGHT ACROSS CORE, LITHIFIED, 00000000,9d6133ad91d22050976296a225b90167,28-270-13-2
28,270,,13,3,0.0,150.0,101.00,104.00,105.50,, SILTY CLAY, 5Y4/1-OLIVE GRAY, NO DIS CERNIBLE BEDDING EXCEPT FOR SLIGHTLY DARKER BAND 0.5 MM WIDE GRADING UP AND DOWN AT 98 MM,, SP ARSE SCATTERED CLASTS MOSTLY LESS THAN 5 MM BUT UP T O 12 MM LONG,," RARE THIN SH FRAGS MOSTLY LESS THAN 4MM LONG,SH FRAGS 0.5 MM BY 6 MM AT 0.5 CM AND 0.3 BY 10 MM AT ABOUT 122 CM",, LITHIFIED, 00000000,967db44735a856f8fdb119bb451e671a,28-270-13-3
28,270,,13,CC,0.0,0.0,101.00,105.60,105.60,, SILTY CLAYSTONE, 5GY4/1-DK GREENISH GRAY, NO DISCERNIBLE BEDDING,, RARE COARSE SAND GRANULES,, GASTROPOD FRAGS,, LITHIF IED, 00000000,ffca35f215def691c610186a7bb4c8fd,28-270-13-CC
28,270,,14,1,0.0,150.0,110.50,110.50,112.00,, SILTY CLAYSTONE, 5Y2/1-OLIVE BLACK, NO DISCERNIBLE BEDDING,," SPARSE CLASTS MOSTLY LESS T HAN 5 MM BUT UP TO 37 MM LONG,LIMEY PEBBLE AT 23 AND AT 95 CM",," RARE THIN SH FRAGS,2 MM LONG SH FRAG AT 111 CM",, LITHIFIED, 00000000,a1e5677a85838b71eb0f272ba668c4ac,28-270-14-1
28,270,,14,2,0.0,150.0,110.50,112.00,113.50,, SILTY CLAYSTONE, 5Y4/1-OLIVE GRAY, N O DISCERNIBLE BEDDING EXCEPT FOR INDISTINCT IRREGULA R LAMINAE AT 60 AND 133 CM,, SPARSE CLASTS MOSTLY LESS THAN 4 MM BUT UP TO-BLANK-MM LONG,," RARE THIN SH FRAGS RAND OMLY ORIENTED AND UP TO 4 MM LONG,CLAM FRAG AT 98 CM ,SH AT 133 CM",, LITHIFIED, 00000000,bf612041e82b3a08645ca56dcff1c005,28-270-14-2
28,270,,14,3,0.0,150.0,110.50,113.50,115.00,, SILTY CLAYSTONE, 5Y4/1-OLIVE GRAY, N O DISCERNIBLE BEDDING,," SPARSE CLASTS MOSTLY LE SS THAN 5 MM BUT UP TO 13 MM,RED CLAST AT 17 CM",," RARE THIN SH FRAGS UP TO 4 M M,CLEAR SH 1 BY 16 MM AT 23 CM,FOSSIL SH ?CLAM AT 76 CM,FOSSIL FRAG? AT 128 CM", BL OCK FROM 81 TO 94 CM APPEARS BRECCIATED INTO LENSOID PIECES ABOUT 1 BY 2 CM, LITHIFIED, 00000000,63d5c6d47ea0a38e22b38a435c139dd2,28-270-14-3
28,270,,14,CC,0.0,0.0,110.50,115.10,115.10,, SILTY CLAYSTONE, 5Y3/1-OLIVE GRAY,,, R ARE COARSE SAND GRANULES,, RARE CARB SH FRAGS,, LITHIFIED, 00000000,3829cf71ed7ebfa8dc7c1a02bbf675dd,28-270-14-CC
28,270,,15,1,0.0,100.0,120.00,120.00,121.00,, SILTY CLAY, 5Y3/1-OLIVE GRAY, INDISTINCT IRREGULAR BEDDING IN UPPER 10 C M,," SPARSE CLASTS MOSTLY LESS THAN 4 MM BUT UP TO 10 MM,BLACK FINE CLASTS COMMON", CARBONATE AT 32 AN D 42 CM," RARE THIN SH FRAGS 2 TO 3 MM LO NG,THIN CIRCULAR SHELLS AT 6 CM",, LITHIFIED, 00000000,e6ef970585d038e95f304f8174242d0a,28-270-15-1
28,270,,15,1,100.0,150.0,120.00,121.00,121.50,, CLAYEY SILT,, SEVERAL DK SANDY LAM INAE 2 TO 3 MM THICK AT 117 CM,,,,,, SEMILITHIFIED, 00000000,af5999e193749de550ac8c3929c8921c,28-270-15-1
28,270,,15,2,0.0,150.0,120.00,121.50,123.00,, SILTY CLAYSTONE, 5GY4/1-DK GREENISH GRAY, NO BEDDING DISCERNIBLE EXCEPT FOR THIN LAM INAE IN A SANDY SILT INTERVAL FROM 30 TO 40 CM WITH SHARP UPPER AND LOWER CONTACTS,, RARE CLASTS UP TO 5 MM LONG,," TRACES OF THIN SHEL L MATERIAL, FOSSIL SHELL AT 5 CM",, SEMILI THIFIED, 33233000,7c7013b631a723f250bfd627050be684,28-270-15-2
28,270,,15,3,0.0,150.0,120.00,123.00,124.50,, SANDY CLAYSTONE," 5Y4/1-OLIVE GRAY,5GY4/1-DK GREEN ISH GRAY"," RARE BEDDING,DK BAND AT 128 CM ABOUT 3 MM THICK GRADING UP AND DOWN,FRACTURE PATTERNS BETWEEN 100 AND 110 CM",, SPARSE COARSE SAND AND GRANULES WI TH RARE CLASTS UP TO 12 MM,, RARE THIN SH FRAGS," SO ME STRETCHES ARE MORE FRIABLE-53 TO 64 CM-AND SEEM T O EXPAND WHEN REMOVED FROM LINER,VOID FROM 5 CM TO 1 3 CM",, 00000000,f8c7a5861248c5ff8e21fcbdb22afd94,28-270-15-3
28,270,,15,CC,0.0,0.0,120.00,124.60,124.60,, SILTY CLAYSTONE," 5Y2/1-OLIVE BLACK,10Y4/2-GRAYISH OLIVE,10Y6/2-PALE OLIVE", NO DISCERNIBL E BEDDING,, NO DISCERNIBLE GRANULES,, NO SH MATERIAL," LUMP AT BOTTOM OF CORE CATCHER ABOUT 7 CM IN DIAM ETER GRADES FROM GRAYISH OLIVE TO PALE OLIVE,THE CON TACT AREA CUTFACE IS HIGHLY IRREGULAR AND DIFFUSE OV ER A ZONE RANGING FROM 1 TO 5 MM,FACE SHOWS COMPLETE LY FOLDED LT COLORED LAMINAE UP TO 2 MM WIDE EXTENDI NG FROM THE LT TO THE DK ZONE BUT SUBPARALLEL TO THE CONTACT", LITHIFIED, 00000000,f8de0a15e148b20a1e879ff816909b08,28-270-15-CC
28,270,,16,1,115.0,150.0,129.50,130.65,131.00,, SILTY CLAY, 5Y4/1-OLIVE GRAY," NO DISCERNIBLE BEDDING,DK SANDY LAMINAE 1 MM THICK AT 147 CM",, RARE CLASTS UP TO 5 MM,, RARE MINUTE SH FRAGS,, SEMILITHIFIED, 00000000,b39a19c580f2d824aa13edacad373ad5,28-270-16-1
28,270,,16,2,0.0,150.0,129.50,131.00,132.50,, SILTY CLAYSTONE, 5GY4/1-DK GREENISH GRAY, SUBHORIZONTAL THIN LENTICULAR OR WAVY STRUCTUR ES THAT AT LEAST AT 70 TO 90 CM APPEAR TO BE BURROWS,," CORE H AS GRITTY FEEL-BUT CLASTS GREATER THAN 1 OR 2 MM EXT REMELY RARE,2 CM PEBBLE AT ABOUT 97 CM",, 2 MM LONG FOSSIL SH CLAM? AT ABOUT 33 CM,, LITHIF IED, 00000000,ab7c3eb1511d957c6dfb07b9c3259eed,28-270-16-2
28,270,,16,3,0.0,150.0,129.50,132.50,134.00,, CLAYEY SILT, 5GY4/1-DK GREENISH GRAY," BURROWS UP TO 3 MM WIDE FROM 40 TO 55 CM FILLE D WITH SILTY SAND,SEDIMENT POORLY SORTED AND BECOMIN G SLIGHTLY FINER BELOW 60 CM",, RARE CLASTS UP TO 5 MM ACROSS,, NO EVIDENT CARB SH MA TERIAL BUT SCATTERED THIN OUTLINES UP TO 4 MM LONG,, SEMILITHIF IED, 00000000,668c331a589ace66fc20a1f772bc4cd0,28-270-16-3
28,270,,16,4,0.0,150.0,129.50,134.00,135.50,, SILTY CLAYSTONE," 5Y4/1-OLIVE GRAY,5GY4/1-DK GREEN ISH GRAY"," POORLY SORTED,INDISTINCT LAMI NATION FROM 110 TO 150 CM,SOME DISTURBED BEDDING AT 120 CM",, A FEW PENECONTEMPORANEOUS CLASTS-BUT ONE IS 19 MM LONG AT 33 CM,," FORAM? AT ABOUT 32 CM,CROSS S ECTION OF BIVALVES 0.3 BY 5 MM AT 15 CM",, LITHIFIED, 00000000,430bb222498b675a8192978a6653fffc,28-270-16-4
28,270,,16,CC,0.0,0.0,129.50,135.60,135.60,,,,,,,,, VOID,, 00000000,348c0944bdb6a053bff54cc288e5886f,28-270-16-CC
28,270,,17,1,57.0,150.0,139.00,139.57,140.50,, SILTY CLAYSTONE," 5GY4/1-DK GREENISH GRAY,5GY2/1-G REENISH BLACK,N4-DK GRAY"," FROM ABOUT 10 0 TO 150 CM OCCUR DK GRAY TO GREENISH BLACK LENTICUL AR TO WAVY LUMPS 1 TO 3 OR 4 CM BY A FEW MM OF CLAYS TONE-SUBHORIZONTAL AND APPEARS TO DEFINE A POOR BEDD ING DIRECTION,BEDDING ESPECIALLY PROMINENT IN CORE S ECTION 130 TO 140 CM",," 10 MM LONG LT GRAY CLAYSTONE CLAST AT ABOUT 129 CM, 3 BY 18 MM CLAST OF DK GRAY CLAYSTONE AT AB OUT 131 CM,2.3 BY 0.4 CM CLAST OF DENSE LT GRAY QUAR TZITE? ROCK AT ABOUT 144CM",," FOSSIL-CALCITE CLAM SH 1.5 CM LONG AT 85 CM,1 CM LONG FOSSIL CLAM?-NONCALCITE-AT 146 CM", CORE SURFACE HAS A SLIG HTLY GRITTY FEEL, LITHIFIED, 00000000,c5a89a7e6e9e9069d5ac47af6ece1fdf,28-270-17-1
28,270,,17,2,0.0,150.0,139.00,140.50,142.00,, SILTY CLAYSTONE, 5GY4/1-DK GREENISH GRAY, ONLY DISCERNIBLE BEDDING CONSISTS OF THIN INCL INED DARKER LAMINAE AT 130 AND 147 CM,, A FEW GRANULES,," SCATTERED TH IN NONCARBONATE SH FORMS-THOUGH THE LARGER OF THE 2 OBVIOUS BIVALVE CROSS-SECTIONS IS CARB,NONCARBONATE SH FORM 0.3 BY 8 MM AT 81 CM", SOME THING AT ABOUT 101 CM IS 0.2 BY 6 BY 23 MM, LITHIF IED, 00000000,7fcbb4ca3b74ccaaa1344736cc194d27,28-270-17-2
28,270,,17,3,0.0,150.0,139.00,142.00,143.50,, SILTY CLAYSTONE, 5GY4/1-DK GREENISH GRAY," VAGUE BEDDING? DEFINED POORLY BY ORIENTATION O F RARE CLASTS AND CLAM SHELLS AND BY WAVEY AND LENTI CULAR LUMPY DK GRAY CLAYSTONE CLASTS IN LIGHTER GRAY TYPICAL CLAYSTONE MATRIX,LENTICULAR BEDDING STRUCTU RE ESPECIALLY PROMINENT BETWEEN 35 AND 51CM-THESE ST RUCTURES HAVE A PLASTIC APPEARANCE AND COULD BE INTE RPRETED AS SOFT SEDIMENT FLOWAGE-MORE A DEFORMATION THAN TYPICAL SEDIMENTATION STRUCTURE",," RARE CLASTS,LUMPY DK GRAY CLAYSTONE CLASTS",," RARE CLAM SHE LLS,CLAM SH OF CALCITE 9 MM LONG AT 97 CM CONCAVE DO WNWARD", CORE HAS A SLIGHTLY GRITTY FEEL, LITHIF IED, 00000000,6c8668655dedb02a265b18c7699fd446,28-270-17-3
28,270,,17,4,0.0,150.0,139.00,143.50,145.00,, SILTY CLAYSTONE, 5GY4/1-DK GREENISH GRAY," UNIFORM APPEARANCE,BEDDING EVIDENT ONLY BELOW 114 CM WHERE IT DIPS AT AS MUCH AS (SENTENCE INCOMPL ETE)",, RARE GRANULES,, RARE THIN CARB SH FRAGS,, LITHIF IED, 00000000,025fda26e51b0c2bebbd11734e96c11c,28-270-17-4
28,270,,17,5,0.0,150.0,139.00,145.00,146.50,, CLAYSTONE, 5GY4/1-DK GREENISH GRAY," NO OBVIOUS BEDDING BUT A FEW SUBTLE COLOR CHANGES AC ROSS THE CORE,THIN DIFFUSE DK LAMINAE IN LOWER 20CM HAVE MICRONODULES-MANGANESE?",," MICRONODULES-MANGANES E? IN LOWER 20 CM,INTENSE OPAQUE MINERALIZATION OF D IATOM FRAGS,RARE GRANULES",, ONLY SH FRAG IS BIVALVE 0.1 BY 1.5 BY 8 MM LONG-SEDIMENT INSIDE IS SAME AS O UTSIDE-AT 45 CM,, LITHIFIED, 00000000,8c0730e0af4a9bde4971a271c9af33a2,28-270-17-5
28,270,,17,CC,0.0,0.0,139.00,146.60,146.60,, SILTY CLAYSTONE, 5GY4/1-DK GREENISH GRAY,,, SPARSE GRANULES,, THIN BIVALVE SH FRAGS 1 CM L ONG,, LITHIF IED, 00000000,2096eed2ebf8abee2b0769908d07aa60,28-270-17-CC
28,270,,18,1,55.0,150.0,148.50,149.05,150.00,, SILTY CLAYSTONE," 5Y4/1-OLIVE GRAY,5GY4/1-DK GREEN ISH GRAY"," CORE APPEARS FREE OF LENTICUL AR VAGUE BEDDING? STRUCTURES AS SEEN IN UPPER PART O F CORE NUMBER 17-3,PATCHY BLACKISH GRAY AREAS AT ABO UT 62 AND 69 CM",," GRANITIC PEBBLE AT 110 CM,DENSE DK GRAY CLASTS AT 111 AND 114 CM",,, CORE SURFACE HAS A SLIGHTLY GRITTY FEEL, LITHIFIED, 00000000,03227c82866ab291b8c01659199aca6f,28-270-18-1
28,270,,18,2,0.0,150.0,148.50,150.00,151.50,, SILTY CLAYSTONE," 5Y4/1-OLIVE GRAY,5GY4/1-DK GREEN ISH GRAY", CAL CAREOUS LAYER 2 TO 3 MM THICK AROUND 65 CM,, ERRATIC CLASTS (MM),, 7 MM LO NG CLAY-FILLED CLAM SHELL-HORIZONTAL AT 142 CM," CORE SU RFACE MUCH LESS GRITTY THAN PREVIOUS ONES,CORE APPEA RS MUCH MORE FISSILE-SPLITS INTO MANY SMALL PIECES", LITHIFIED, 00000000,5af9f7557376098cd3cecdc51936e447,28-270-18-2
28,270,,18,3,0.0,150.0,148.50,151.50,153.00,, (SILTY) CLAYSTONE, 5GY4/1-DK GREENISH GRAY," SOFTER SANDIER AND FISSILE WITH THIN SANDY LAMINAE FROM 0 TO 38 CM CHANGING TO HARDER AND MISSIVE FROM 44 TO 150 CM,NO DISCERNIBLE BEDDING BUT SPARSE SCATTERED THIN LT TO DK STREAKS U P TO 3 MM LONG RUN ACROSS THE CORE,DIFFUSE DARKER AR EAS FROM 60 TO 150 CM-CIRCULAR IN SECTION IF ABOUT 5 MM ACROSS BUT OVAL WITH LONG AXIS PERPENDICULAR TO CORE LENGTH FROM 2 TO 5 CM ACROSS-SIMILAR CHARACTER TO MICRONODULE-BEARING LAMINAE (17-5/136)",, RARE GRA NULES,, NO SH FRAGS EVIDENT,, SEMI LITHIFIED TO LITHIFIED, 33231000,a216f5721c35f415462e05dbf291902b,28-270-18-3
28,270,,18,4,0.0,150.0,148.50,153.00,154.50,, SILTY CLAYSTONE, 5GY4/1-DK GREENISH GRAY,,," GRAYISH WHITE CLAYSTONE PEBBLES AT ABOUT 32 AN D 39 CM,GRANITIC PEBBLES BETWEEN 78 AND 88 CM-GRITTY SURFACE TEXTURE,TAN CALCAREOUS FLATTENED PEBBLE AT ABOUT 127 CM",,, PROBABLY A LITTLE SANDIER FROM 75 TO 105 CM, LITHIF IED, 33231000,9dede14fee890b71321871eead1288d1,28-270-18-4
28,270,,18,5,0.0,39.0,148.50,154.50,154.89,, SILTY CLAYSTONE, 5GY4/1-DK GREENISH GRAY," FAIRLY UNIFORM FROM 0 TO 30 CM,NUMEROUS LENTICULAR STRUCTU RES FROM 30 TO 39 CM WITH A FEW SANDY SILTY LENSES A FEW MM THICK",, QTZ SANDSTONE PEBBLE AT 23 CM,,,,, 00000000,a3665462fcddc40ac79bdeb1a7c2ec25,28-270-18-5
