33,318,,30,3,0.0,150.0,701.00,704.00,705.50,," SANDSTONE AND CLAYEY LIMESTONE,SILT"," 5G6/1-GREENI SH GRAY TO 5GY4/1-DARK GREENISH GRAY,5Y6/1-OLIVE TO 5Y2/1-OLIVE BLACK,5GY2/1-GREENISH BLACK,5G2/1,5BG3/ 2-DUSKY BLUE GREEN"," GRADED UNITS AS ABOVE,LAMINAE, CROSS STRATIFICATION,GOOD BURROW AT 94 CM,SILTY BAND S",,,,, COLORS SAME AS ABOVE AND TENDING TOWARD DARKER SHADES ESPECIALLY IN SANDY LAYERS,, 00000000,ac91bcfefc85427ab7fc585c0178f216
33,318,,31,1,93.0,150.0,719.50,720.43,721.00,," SANDSTONE,SILTSTONE,LIMESTONE"," 5BG7/2-PALE BLUE G REEN THROUGH 5BG5/2-GRAYISH BLUE GREEN,5BG3/2-DUSKY BLUE GREEN"," LAMINAE,MINOR SILTY UNITS AT 134 CM,LOA D CASTS AT 132 CM,GRADED UNITS OF THE LITHOLOGIES",,,,,,, 00000000,cbdcc39b2fa33d5e5077a1745554581f
33,318,,31,2,0.0,150.0,719.50,721.00,722.50,," SANDSTONE,SILTSTONE,LIMESTONE"," 5BG7/2-THROUGH 5BG 5/2,5BG3/2"," GRADED UNITS AS ABOVE,LAMINAE,BURROWED CONTACT AT 75 CM,FINE MED AND COARSE SANDSTONE",,,,,,, 00000000,ffae432eec3993f1c113c95f97ea8f1c
33,318,,32,1,52.0,150.0,739.00,739.52,740.50,," SANDSTONE,SILTSTONE,MUDSTONE,LIMESTONE", -GREEN GR AY COLORS," GRADED UNITS,GRANULE BRECCIA AT 64 CM,LA MINAE,DEFORMED BURROWS AT 130 CM,REVERSE GRADING (?? ) AT 90 CM",,,,,,, 00000000,a67d21dbbfa0229603275a81bd3f2f8a
33,318,,32,2,39.0,150.0,739.00,740.89,742.00,, SAND SILT CLAY(LIMESTONE)LAYERS AS ABOVE,," GRADED UNITS,ONE GRADED UNIT FROM 85 CM CONTINUOUS UP TO 13 8 CM IN CORE 32 SECTION 1,LAMINAE,CROSS STRATIFICATI ON",,,, LOTS OF FORAMS AT 119 CM,,, 33234000,6723f4eb570a3c8fe50ece439631ecf9
33,318,,32,3,0.0,150.0,739.00,742.00,743.50,," SANDSTONE,SILTSTONE,CLAYSTONE",," GRADED UNITS,ONE B ED FROM 130 CM UP,BURROWS,LAMINAE,SLIGHTLY CROSS STR ATIFICATION,MUDDY SANDSTONE INCLUDED IN 120 TO 150 C M",,,,,,, 33234000,b100fdbb54883b3f78146a9f5fde99f9
33,318,,32,4,0.0,150.0,739.00,743.50,745.00,, SANDSTONE, 5G4/4-DARK GREENISH GRAY TO 5G2/1-GREE NISH BLACK," ONE SINGLE GRADED SANDSTONE UNIT WITH I TS TOP AT 45 CM IN CORE 32 SECTION 3,MUDDY SANDSTONE ,LAMINAE,SCATTERED AND ABUNDANT GRANULES,85 TO 98 CM ARE BANDS OF ABUNDANT FORAMS",,, PALAGONITE GRAINS IN UPPER REGION, FORAM FROM 85 TO 98 CM,,, 33234000,eaeabc008deb6b474a9fe943b316b391
