leg,site,hole,core,section,top interval depth (cm),bottom interval depth (cm),top of core depth(m),top of layer depth (m),bottom of layer depth (m), describer,lithology,color,structures,deformations due to drilling,unusual occurrences,minerals,paleontology,other observations,hardness or induration,z-coding,eodp_id,sample
79,544,,1,1,0.0,143.0,0.00,0.00,1.43,JANS, NANNOFOSSIL FORAMINIFER OOZE, LIGHT BROWN,, MODERATELY DISTURBED, DOLOMITE CRYSTALS,,,, SOFT, 00000000,963d18a7a485134a2744e84dbb7f1fb3,79-544-1-1
79,544,,1,2,0.0,150.0,0.00,1.50,3.00,JANS, NANNOFOSSIL FORAMINIFER OOZE," LIGHT BROWN,GRAYISH ORANGE PINK"," BEDDING,LAMINAE,CONTACT", MODERATELY TO GREATLY DISTURBED,,,,, SOFT, 00000000,b8877a3acfa87f56408f30a2357c858d,79-544-1-2
79,544,,1,3,0.0,85.0,0.00,3.00,3.85,JANS, CLAYEY NANNOFOSSIL FORAMINIFER OOZE," LIGHT BROWN,GRAYISH ORANGE PINK", BEDDING, GREATLY DISTURBED,,,,, SOFT, 00000000,4b6e726200ba75c4bbc64862cd3af9c3,79-544-1-3
79,544,,1,4,0.0,97.0,0.00,4.50,5.47,JANS, CLAYEY NANNOFOSSIL FORAMINIFER OOZE," LIGHT BROWN,GRAYISH ORANGE",, GREATLY DISTURBED,,,,, SOFT, 00000000,3d962d28ba4efece9766f21c2f488c96,79-544-1-4
79,544,,1,CC,0.0,15.0,0.00,5.60,5.65,JANS, CLAYEY NANNOFOSSIL FORAMINIFER OOZE, YELLOWISH BROWN,, GREATLY DISTURBED,,,,, SOFT, 00000000,dcf0c79f7445ad5bc3434fd4dfff008d,79-544-1-CC
