40,364,,16,6,0.0,150.0,501.50,509.00,510.50,, MARLY CHALK," 7.5YR6/4-LT.BROWN,5Y7/2-LT.GRAY,7.5Y R5/4-BROWN,-WHITE"," HEAVILY MOTTLED,HEAVILY BURROWED", MODERATE DEFORMATION TO INTENSE DEFORMATION TOWAR D BASE,, WHITE PRISMATIC CARBONATE AT 62 AND 75 CM,,, STIFF TO HARD, 00000000,2da72f5e94de534a602971383f58f39e
40,364,,17,0,0.0,45.0,530.00,530.00,530.45,, MARLY CHALK," 5YR6/4-LT.BROWN,5Y7/2-LT.GRAY,5Y6/1- GRAY", HEAVILY BURROWED,,,,, GRAY 148-150 CM, STIFF TO HARD, 00000000,97f7c68c2145f3e1b2fb02bb54517b5f
40,364,,17,1,0.0,150.0,530.00,530.45,531.95,, MARLY CHALK," 7.5YR3/2-DK.BROWN,5YR6/4-LT.BROWN, 5Y7/2-LT.GRAY,5Y6/1-LT.GRAY"," MODERATE TO INTENSELY BURROWED,DARK IRREGULAR LAMINA THAT IS BURROWED AT 30-36 CM,LT.GRAY MOTTLES",,,,, LT.BROWN+LT.GRAY EXCEPT DK.BROWN 30-36 CM AND GRAY+LT.GRAY 112-118 CM, STIF F TO HARD, 00000000,3462c85b6c03499ec14947633c84e1b6
40,364,,17,2,0.0,150.0,530.00,531.95,533.45,, MARLY CHALK," 7.5YR5/4-BROWN,5Y7/1-LT.GRAY,5Y5/2-O LIVE GRAY"," LT.GRAY MOTTLES,INTENSELY BURROWED WITH VERY SMALL BURROWS (AVERAGE 2-3 MM DIAMETER)",,,,," OLIVE GRAY 15-20 AND 88-90 CM,70% IS 7.5YRK/4 AND 27% IS 5Y7/1 AND 3% IS GRAY", STIFF TO HARD, 00000000,d0237485a6c78a2915ae61b7ed804365
40,364,,17,3,0.0,150.0,530.00,533.45,534.95,, MARLY CHALK," 5Y6/1-GRAY,7.5YR5/4-BROWN,5YR4/3-RED DISH BROWN"," INTENSELY BURROWED THROUGHOUT (MOST BUR ROWS 2-3 MM IN DIAMETER),ZOOPHYCOS PRESENT BUT NOT COMMON",,,,," 5Y6/1 25-27 CM AND 80-83 CM,7.5YR5/4 0-150 + 35-40% 5Y7/1,5YR4/3 AT 68-71 CM", STIFF TO HARD, 00000000,3fc90f46ea5352ee4c0ab04371eb6054
40,364,,17,4,0.0,150.0,530.00,534.95,536.45,, MARLY CHALK," 5Y7/1-LT.GRAY,5Y6/1-GRAY,7.5YR6/4-LT .BROWN,5GY6/1-GREENISH GRAY"," INTENSELY BURROWED THR OUGHOUT,BURROWS VERY FINE,GREENISH GRAY LAYER AT 81 CM IS LAMINATED AT BASE AND BECOMES BURROWED ONE-THI RD OF THE WAY TOWARD TOP,LT.GRAY MOTTLES",,, WHITE PRI SMATIC CARBONATE AT 100 AND 106 CM,,, STIFF TO HARD, 00000000,34facec4107a124efbe0ed398ccc9e9d
40,364,,17,5,0.0,150.0,530.00,536.45,537.95,, MARLY CHALK," 5Y7/1-GRAY,7.5YR6/4-LT.BROWN"," INTEN SELY BURROWED (2-3 MM DIAMETER),BROWN BACKGROUND WIT H GRAY MOTTLES,BURROW FILLINGS,BEDS OF 5Y7/1 AT 25 AND 75 AND 145-150 CM",,,,,, STIFF TO HARD, 00000000,9024accecc100b3e8d2eca4a1804db42
40,364,,17,6,0.0,150.0,530.00,537.95,539.45,, MARLY CHALK," 5Y7/1-GRAY,10YR7/1-LT.GRAY,7.5YR6/4- LT.BROWN"," 5Y7/1 MOTTLES,LAYER OF 5Y7/1 TO GREENISH- GRAY BLACK AT 25 CM", SLIGHT DEFORMATION,,,, LT.GRAY AT TOP GRADUALLY DARKENS TO LT.BROWN AT BASE, STIFF TO HARD, 00000000,52a6ee41dd8e5bca213b56ea901acaa8
40,364,,18,1,63.0,150.0,549.00,549.63,550.50,, MARLY CHALK," 7.5YR6/4-LT.BROWN,5Y7/1-LT.GRAY,5Y6/ 1-GRAY", INTENSELY BURROWED," MODERATE DEFORMATION 63-100 CM AND 120-150 CM,SLIGHT DEFORMATION 100-120 CM",, WHITE CALCITE PRISMS AT 78 CM,,, STIFF TO HARD, 00000000,76705601d7c9eba44f9d346713da0ee1
40,364,,18,2,0.0,140.0,549.00,550.50,551.90,, MARLY CHALK," 5Y6/1-GRAY,10YR6/4-PALE BROWN,5Y7/1- LT.GRAY,10YR7/2-LT.GRAY,5Y3/1-V.DK.GRAY"," INTENSELY BURROWED,V.DK.GRAY LOAD CASTS? AT 100-105 CM,5Y6/1 LAYERS AT 10-15 AND 55 CM",,,,,, STIFF TO HARD, 00000000,796d670ef795a902ec7b669e9d2e532a
40,364,,18,3,0.0,150.0,549.00,552.00,553.50,, MARLY CHALK," 10YR6/4-PALE BROWN,10YR7/2-LT.GRAY, 10YR5/2-GRAYISH BROWN"," INTENSELY BURROWED,GRAY MOTT LES AND BEDS", MODERATE DEFORMATION,,,, CLASTS SET IN MATRIX FROM 110-150 CM, STIFF TO HARD, 00000000,7623a9a31101c03b83338dd6f2588dbf
40,364,,19,1,7.0,150.0,568.00,568.07,569.50,, MARLY CHALK," 5Y7/1-LT.GRAY,10YR4/3-DK.BROWN,5Y6/1 -GRAY,10YR5/4-YELLOW BROWN,10YR6/4-PALE BROWN"," MICR OFAULT AT 120-130 CM,LT.GRAY MOTTLES AND BEDS INTENS ELY BURROWED",,,,, MINOR LITHOLOGY COLORS AT 20 + 28 + 50 + 60 + 90 + 105 + 120 CM, STIFF TO HARD, 00000000,fb0fac54b886cd16289301797a20332a
40,364,,19,2,0.0,150.0,568.00,569.50,571.00,, MARLY CHALK," 10YR6/3-PALE BROWN,5Y6/1-GRAY,10YR5/ 4-YELLOW BROWN,10YR3/1-V.DK.GRAY,5Y7/1-LT.GRAY,10YR3 /1-V.DK.GRAY"," MOST EXTREMELY BURROWED (BURROWS SMAL L),MINOR LT.GRAY MOTTLES,V.DK.GRAY LAMINATION 40-50 CM,GRAY LAYERS WHICH SHOW LOADING AT BASES OF SOME LAYERS AND LITTLE BURROWING ON THE BASE BUT SOME BURROWING UPWARD AND ARE USUALLY UNDERLAIN BY LT.GRA Y AND ARE LOCATED AT 23 CM AND 35 AND 83 AND 90 AND 135 CM",,,,, BASIC COLOR IS PALE BROWN, STIFF TO HARD, 00000000,e5f6bb1e01f753eeefaa5ac90ea96201
40,364,,19,3,0.0,140.0,568.00,571.00,572.40,, MARLY CHALK," 10YR4/3-DK.BROWN,5Y7/1-LT.GRAY,5YR3/ 3-DK.RED BROWN"," CONTRASTING COLORS AND INTENSE BURR OWING RESULT IN SPECTACULAR CORE APPEARANCE,MANY COM POSITE BURROWS 90-120 CM,DK.BROWN LAYER AT 8 CM",,,,," DK .RED BROWN AT 43-47 AND 90-95 AND 125-130 CM,MOST OF CORE IS 7.5YR5/4 WITH MINOR 5Y7/1", STIFF TO HARD, 00000000,5238597737a7d7995ae6528b6451f83b
40,364,,19,4,0.0,150.0,568.00,572.50,574.00,, MARLY CHALK," 5YR3/3-DK.RED BROWN,5Y7/1-LT.GRAY,10 YR6/3-PALE BROWN", COLORS IN LAYERS," MODERATE DEFOR MATION,PLASTIC DEFORMATION 118-125 CM",,,, SAME COMMENT S AS FOR SEC.3, STIFF TO HARD, 00000000,5f429a72009ccbedd42095f59a81577a
40,364,,20,1,90.0,150.0,577.50,578.40,579.00,, CHALK," 5Y7/1-LT.GRAY,5Y5/1-GRAY"," HEAVILY BURROWE D EXCEPT FOR A FEW LAMINATED ZONES 126-140 CM,SOME L AMINATIONS (AT 127 CM) UNDISTURBED BY BURROWING,SHAR P LOWER CONTACT AND BURROWED UPPER CONTACT OF GRAY LAYER AT 95-98 CM",,,,,, STIFF TO HARD, 00000000,cb98751c6bf8285f3f33d8c3e2471164
40,364,,20,2,0.0,150.0,577.50,579.00,580.50,, MARLY CHALK," 5Y5/1-GRAY,5Y4/2-OLIVE GRAY,5GY4/1-D K.GREENISH GRAY"," INTENSELY BURROWED,DARK LAYERS BUR ROWED AT TOP BUT NOT AT BASE,5GY4/1 AT 80-85 CM,5Y5/ 1 LAYER AT 16 AND 55-60 CM,OLIVE GRAY LAYER AT 30-37 CM",,,,, CORE PRIMARILY LT.GRAY, STIFF TO HARD, 00000000,1c729e13c272d1e69cf6dce424b4b27c
40,364,,20,3,0.0,120.0,577.50,580.50,581.70,, MARLY CHALK," 5GY4/1-DK.GREEN GRAY,5G6/1-GREENISH GRAY,5B7/1-LT.BLUISH GRAY", INTENSELY BURROWED,, BLA CK COAL AT 103 AND 120 CM (SEAMS) APPEAR TO BE SAPRO PELE,,," DK.GREEN GRAY AT 25 AND 77 AND 100-105 CM,DOM INANTLY GREENISH GRAY WITH MINOR LT.BLUISH GRAY", ST IFF TO HARD, 00000000,3f08b5b0be2a25aab5150a0245e9224f
40,364,,20,4,0.0,150.0,577.50,582.00,583.50,, MARLY CHALK," 5GL/1-GREENISH GRAY,5GY4/1-DK.GREEN GRAY"," NUMEROUS DARK GREENISH GRAY ZONES (NOTED) THA T TYPICALLY ARE MORE HIGHLY BURROWED ON TOP THAN BAS E,2 OR 3 COAL SEAMS,MOST OF CORE IS HIGHLY BURROWED EXCEPT FOR BOTTOM OF DK.GREEN-GRAY ZONES AND THIN LA MINA AT 27 CM AND AT COAL SEAMS",, COAL SEAMS AT 105 AND 125 CM,,,, STIFF TO HARD, 00000000,c37261b5ba8681ed8d60fc7e1a36ac72
40,364,,20,5,0.0,150.0,577.50,583.50,585.00,, MARLY CHALK AND CLAYSTONE," 2.5Y3/2-V.DK.GRAYISH BROWN,7.5YR3/2-DK.BROWN,5Y6/1-GRAY"," BURROWING INTEN SE IN MOST OF CORE,WELL-PRESERVED LAMINATIONS AT 52- 55 AND 92-93 CM",,,,," 5Y6/1 AT TOP TURNS TO 2.5Y6/2 AT BASE,GREEN FROM LAST SECTION REPLACED BY BROWN TONES IN THIS SECTION,DK.BROWN AT 100 AND 110-115 AND U24 -130 CM AND 135 CM,V.DK.GRAYISH BROWN AT 22-28 AND 45-50 CM", STIFF TO HARD, 00000000,6fce780923767641d7c0df7037a3d806
40,364,,21,0,0.0,15.0,596.50,596.50,596.65,, CALCAREOUS MARL OR MARLY CHALK, 10YR5/2-GRAYISH BROWN, BURROWED,,,,,, STIFF TO HARD, 12221110.3450,fabd452126c5f6bc68f7211f1b415c98
40,364,,21,1,0.0,150.0,596.50,596.65,598.15,, MARLY CHALK," 10YR4/3-BROWN,1/YR3/2-V.DK.GRAYISH BROWN,10YR5/2-GRAYISH BROWN,-LT.BROWNISH GRAY"," HEAV ILY BURROWED,DARK LAYERS MORE HEAVILY BURROWED AT TOP", MODERATE DEFORMATION,,,, 10YR4/3 0-90 CM, STIFF TO HARD, 00000000,7928ec4980a6489d889503a8ca7d536e
40,364,,21,2,0.0,150.0,596.50,598.15,599.65,, MARLY CHALK," 5Y2/2-BLACK,5GY4/1-DK.GREENISH GRAY, 5G6/1-GREENISH GRAY,10YR5/2-GRAYISH BROWN,2.5Y3/2-V. DK.GRAYISH BROWN"," HEAVILY BURROWED THROUGHOUT MOST OF CORE,DARK LAYERS LESS BURROWED ESPECIALLY BOTTOM OF EACH BED", SLIGHT DEFORMATION,,,, GREENISH TONES AT TOP GIVE WAY TO BROWN TONES IN LAST 2/3 OF CORE, STIFF TO HARD, 00000000,8a84082505099889078cbffc09641ba2
40,364,,21,3,0.0,150.0,596.50,599.65,601.15,, MARLY CHALK," 10YR5/2-GRAYISH BROWN,10YR3/2-V.DK.G RAYISH BROWN"," LIGHT LAYERS (90%) HEAVILY BURROWED,D ARK LAYERS (BURROWED AT TOP- FREE OF BURROWS AT BASE),SOME BURROWS INFILLED WITH WHITISH MATERIAL - LIGHTER THAN CAN BE FOUND IN ABOVE SEDIMENTS",,,,, MOSTL Y GRAYISH BROWN, STIFF TO HARD, 00000000,edc77768a9994ee55e926f7ab156a147
40,364,,21,4,0.0,150.0,596.50,601.15,602.65,, MARLY CHALK," 10YR5/2-GRAYISH BROWN,5G6/1-GREENISH GRAY,5GY4/1-DK.GREENISH GRAY,N1-BLACK"," BLACK SHALE LAYERS AT 85-90 AND 98-104 AND 116-121 AND 134-140 CM,CHALK HEAVILY BURROWED,MUDSTONE AND SHALE SHOW MUCH LESS BURROWING",,, PYRITE ABUNDANT AT 117-127 CM,, CLAYSTONE IS DK.GREEN AND LOCATED AT L0-75 CM AND WITH SHALE AT 80-150 CM, STIFF TO HARD, 11121110.3450,3178902515f16c3588ed76f437bc785e
40,364,,21,5,0.0,141.0,596.50,602.65,604.06,, MARLY CHALK AND MUDSTONE," 5G6/1-GREENISH GRAY,5GY 4/1-DK.GREENISH GRAY,10YR5/2-GRAYISH BROWN,-BLACK,2. 5Y3/2-V.DK.GRAYISH BROWN"," LIGHTER LAYERS HEAVILY BURROWED,DARKER LAYERS LIGHTLY BURROWED OR NOT BURRO WED,LAMINATIONS PRESENT IN NON-BURROWED LAYERS,BLACK LAYERS AT 10-15 AND 36-37 CM",,,,, MARLY CHALK IS GREEN AND MUDSTONE IS V.DK.GREEN GRAY + V.DK.GRAYISH BROW N, STIFF TO HARD, 00000000,2c45a91b792f144c921e168eaa437acb
40,364,,21,6,0.0,150.0,596.50,604.15,605.65,, MARLY CHALKS AND MUDSTONE," 2.5Y3/2-V.DK.GRAYISH BROWN,10YR5/2-GRAYISH BROWN,5G6/1-GREENISH GRAY,5GY4 /1-DK.GREENISH GRAY", MUDSTONES MUCH LESS BURROWED THAN CHALKS (EXPECIALLY AT BASE),,, AUTHIGENIC CRYSTA LS (BARITE?) AT 35-40 CM (SAME AS 22 CC),," COLORS AND OITHOLOGIES IN LAYERS,MARLY CHALKS ARE LIGHTER COLOR AND MUDSTONES ARE DARKER", STIFF TO HARD, 00000000,ea881544d1f632416127280e80448b36
40,364,,22,1,130.0,150.0,615.50,616.80,617.00,, MARLY CHALK," 5G6/1-GREENISH GRAY,5GY4/1-DK.GREENI SH GRAY", BURROWED THROUGHOUT,,,,,, STIFF TO HARD, 00000000,006e4afaf4a12b931af80adb530ff575
40,364,,22,2,0.0,120.0,615.50,617.00,618.20,, CALCAREOUS MARL AND MUDSTONE," 5G6/1-GREENISH GRAY ,5GY4/1-DK.GREENISH GRAY,10YR5/2-GRAYISH BROWN,2.5Y3 /2-V.DK.GRAYISH BROWN"," MARL IS HEAVILY BURROWED,MUD STONE BURROWED ONLY AT TOP",,, PYRITE AT 17 CM,," MARL IN LIGHTER UNITS,MUDSTONE IN DARK UNITS", STIFF TO HARD, 00000000,581d4a133be1dbe16113b44246fc9ffe
40,364,,22,3,0.0,150.0,615.50,618.50,620.00,, MARLY CHALK AND MUDSTONE," 2.5Y3/2-V.DK.GRAYISH BR OWN,5GY4/1-DK.GREENISH GRAY,5G6/1-GREENISH GRAY,5GY6 /1-GREENISH GRAY,10YR5/2-GRAYISH BROWN,10YR6/1-GRAY"," LIGHTER COLORED CHALK (OR CALC.MARL) IS HEAVILY BU RROWED,DARKER BEDS TYPICALLY BURROWED ONLY AT THE TOP",,,,, COLORS IN LAYERS WITH SOME GRADING, STIFF TO HARD, 00000000,e058e904be25130afaa05f8d7b1658b5
40,364,,22,4,0.0,58.0,615.50,620.00,620.58,, CHALK," 10YR5/2-GRAYISH BROWN,2.5Y3/2-V.DK.GRAYISH BROWN,-GREENISH GRAY", BURROWED EXCEPT FOR DARK LAY ERS,,,,," 2.5Y3/2 35-40 CM,10YR5/2 0-35 CM,GREENISH GRAY 40-58 CM,MOSTLY CHALK", STIFF TO HARD, 00000000,cb626597386c5673f85b2a642b8028b1
40,364,,22,4,58.0,100.0,615.50,620.58,621.00,, MUDSTONE," 2.5Y3/2-V.DK.GRAYISH BROWN,-GRAYISH BRO WN", ONLY BURROWED IN LIGHTER PARTS,,,,, MINOR GRAYISH BROWN, HARD, 00000000,0eca4003d4cb6527d5cc28c18d04452f
40,364,,22,4,100.0,150.0,615.50,621.00,621.50,, CHALK," -GREENISH GRAY,-GRAYISH BROWN", BURROWED THROUGHOUT,,,,,, STIFF TO HARD, 00000000,beb04a2f65d30bd4a01d2b2f761f4343
40,364,,22,CC,0.0,0.0,615.50,621.60,621.60,, MUDSTONE," 5B5/1-MED.BLUISH GRAY,5G6/1-GREENISH GR AY,5BG5/2-GRAYISH BLUE GREEN", BURROWS, ROUNDED CLA STS ARE DRILLING BRECCIA,, FINE PYRITE AND HARD PYRITE NODULE,, LARGE FRAGMENT HAS ROUNDE D MUDSTONE CLASTS SET IN A CRYSTALLINE MATRIX (SUSPE CT EVAPORITE (MINERAL IS SOFT (H<2.5) AND HAS CLEAVA GE)," SOFT MATR IX TO HARD CLASTS,SOFT MINERAL", 00000000,f9096445f6b9a3c2713b93ac6be9417a
40,364,,23,1,47.0,55.0,644.00,644.47,644.55,, MARL OR CALCAREOUS MUDSTONE, 5G6/1-GREENISH GRAY," LAMINATED,SLIGHTLY BURROWED",,, PYRITE,, PYRITE ABUN DANT AS LENSES OF FINE CRYSTALS IN THE CLAY MATRIX S HOWING SPECKS OF BRASSY GOLD COLR," HARD,STIFF MATRI X", 12211110.3450,a9f2c7ff740aae042c02c788833b62cc
40,364,,23,1,55.0,65.0,644.00,644.55,644.65,, MUDSTONE," -DK.BLACK TO -GREENISH BLACK,-V.DK.GREE NISH GRAY"," LAMINATED,PYRITE-RICH LAYERS,NO BURROWIN G",,, PYRITE-RICH LAYERS,, MUDSTONE TO SHALE,, 00000000,0e3d3c217f31008b6463bd748219279e
40,364,,23,1,65.0,97.0,644.00,644.65,644.97,, CHALK, 5G6/1-GREENISH GRAY," SLIGHTLY LAMINATED, BURROWS MAKE MOST LAMINAE DISCONTINUOUS",,, PYRITE AS DISSEMINATED CRYSTALS IN PATCHES AND AS SMALL NODULE S AND AS SOLID BURROW FILLINGS (70-80 CM),,, STIFF TO HARD, 00000000,ade88d94abf17a2605bb2a71ee6a3da6
40,364,,23,1,97.0,150.0,644.00,644.97,645.50,, SHALE," N1-BLACK,5G6/1-GREENISH GRAY,-V.DK.GREENIS H GRAY,-GREEN", SLIGHTLY BURROWED,,," PYRITE AS NODULE S AND SEAMS,ABUNDANT PYRITE IN MUDSTONE",," BLACK SAPR OLITIC SHALE IS FOUND LOWER IN BURROWS,BLACK 100-105 CM AND 115-12K CM AND 130-135 CM", HARD, 00000000,534e96e9962fdc09850bc56a0e1d1030
40,364,,23,2,0.0,142.0,644.00,645.50,646.92,, MARLY CHALK TO CALCAREOUS MUDSTONE," 5G6/1-GREENIS H GRAY,5B7/1-LT.BLUISH GRAY,5GY4/1-DK.GREENISH GRAY, N1-BLACK"," BURROWING COMMON IN LIGHTER COLORED BEDS BUT DOES NOT COMPLETELY DESTROY LAMINATIONS,LAMINATI ONS WELL-DEVELOPED LOCALLY",,," PYRITE BURROW FILLS AT 17-25 CM,AUTHIGENIC CRYSTALS AT 80 AND 110 CM (SH OULD BE TESTED FOR BARITE) ARE 2 MM DIAMETER AVERAGE",,, STIFF TO HARD, 00000000,17983d75281565fc26a4a5a4927f8daa
40,364,,23,3,0.0,150.0,644.00,647.00,648.50,, MARLY CHALK," 5G6/1-GREENISH GRAY,N1-BLACK"," BURRO WED BUT NOT SO HEAVILY TO DISRUPT ALL THE LAMINAE,SH ALE LAMINATED TO THINLY LAMINATED",,," PYRITE COMMON ES PECIALLY AS BURROW FILLINGS,RICH IN FINELY DISSEMINA TED PYRITE IN SHALE ZONES,LARGE PYRITE NODULES AT 135 CM",, BLACK SHALE AT 65 AND 70-73 AND 80-85 AND 92-100 AND 122-140 CM, STIFF TO HARD, 00000000,cac9dd095cff9f85a8a488e8c6730787
40,364,,23,4,0.0,150.0,644.00,648.50,650.00,, MARLY CHALK," N1-BLACK,5G6/1-GREENISH GRAY",,,,,," SAME AS SEC.3,BLACK AT 50-55 (PYRITE) AND 10-20 CM (BURRO W FILL) AND 70-73 AND 85-89 AND 120-140 AND 148-150 CM", STIFF TO HARD, 00000000,c2de39108a9507b785603bfa4303cf86
40,364,,24,1,20.0,137.0,672.50,672.70,673.87,, CALCAREOUS MUDSTONE," 5GY4/1-DK.GREENISH GRAY,N1-B LACK"," LIGHT BURROWING,LAMINATED,BURROWED AT TOP OF EACH BLACK SHALE UNIT",,," FINE PYRITE SPECKS IN MUDSTO NE,SHALE IS PYRITE BEARING",, BLACK SHALE AT 25-32 CM AND 60-75 AND 90-100 AND 110-120 AND 133-137 CM, STIFF TO HARD, 33213000,dc6e8418206d5d3de0afe15d65d42627
40,364,,24,2,0.0,150.0,672.50,674.00,675.50,, CALCAREOUS MUDSTONE," 5GY4/1-DARK GREENISH GRAY,N 1-BLACK"," BLACK IS MORE BURROWED,SECTION 2 MORE LAMI NATED THAN SEC 1",,,,, BLACK AT 22-32 AND 50-58 AND 73-7 7 AND 105-114 AND 127-134 AND 147-150 CM, STIFF TO HARD, 00000000,e218c62c4fb816a28522644ac7002f0d
40,364,,25,0,0.0,35.0,701.00,701.00,701.35,, SHALE, N1-BLACK," THINLY LAMINATED,HAS A FEW (<1 MM) LIGHTER LAMINAE",,,,,, HARD, 00000000,b1f19558b0d01c211a269b54c1625263
40,364,,25,1,0.0,150.0,701.00,701.35,702.85,, MUDSTONE," 5GY4/1-DK.GREENISH GRAY,5Y2/1-OLIVE BL ACK,5Y7/1-LT.GRAY,-BLACK"," HEAVILY BURROWED IN MUCH OF SECTION BUT STILL SHOWS LAMINATIONS IN SEVERAL AREAS (ESPECIALLY 70-80 CM),BLACK SHALE IS THINLY LAMINATED AND HAS SOME BURROWS AND IS FOUND FILLING SOME BURROWS IN UNDERLYING MUDSTONE,TWO ESPECIALLY NICE BURROWS AT 63 CM",,,,," BLACK SHALE AT 40 CM,OLIVE BLACK AT 35-45 CM", STIFF TO HARD, 00000000,3ef0e59bafbe22070c53203c9b523cbf
40,364,,25,2,10.0,150.0,701.00,702.95,704.35,, MARLY CHALK OR CALCAREOUS MUDSTONE," 5GY4/1-DK.GRE ENISH GRAY,5G6/1-GREENISH GRAY,5G5/1,5G4/1"," INTENS ELY BURROWED THROUGHOUT,MANY SUBTLE COLOR CHANGES AS WELL AS ABRUPT CHANGES AS RESULT OF BURROWING",,,,, MIN OR 5G5/1 AND 5G4/1, STIFF TO HARD, 00000000,b72644f44cc458e63f36ab737846c032
40,364,,25,3,0.0,150.0,701.00,704.35,705.85,, CALCAREOUS MARL OR MARLY CHALK," 5G5/1-DK.GREENISH GRAY,5G2/1-GREENISH BLACK,-BLACK,5G6/1-GREENISH GRA Y"," INTENSELY BURROWED EXCEPT FOR BOTTOM 0.75 OF BLA CK LAYER WHICH IS LAMINATED,BLACK LAYERS AT 22-28 AND 55-70 CM",,, ABUNDANT PYRITE SEEN AS SMALL BRIGHT SPECKS AT 120 CM,,, STIFF TO HARD, 00000000,11413ead5d731330f2dda0bd2b334179
40,364,,25,4,0.0,150.0,701.00,705.85,707.35,, MARLY CHALK OR CALCAREOUS MUDSTONE," 5G5/1-GREENIS H GRAY,5G6/1,5G4/1,N1-BLACK,5G2/1-GREENISH BLACK"," B LACK STRINGERS AT 73-77 CM,GREENISH GRAY GRADING UPW ARD TO BLACK FROM 120-110 CM,ZOOPHYCOS PRESENT,HEAVI LY BURROWED THROUGHOUT",,,,,, STIFF TO HARD, 00000000,5006e0d4de74874669df4a213e423072
40,364,,25,5,0.0,150.0,701.00,707.35,708.85,, MARLY CHALK OR CALCAREOUS MUDSTONE," 5G4/1-DK.GREE NISH GRAY,5G6/1-GREENISH GRAY"," A FEW MORE LAMINATIO NS PRESERVED THAN IN SEC 4,LAMINATED 0-7 AND 80-100 AND 135-U38 CM",,,,, 30-40% GREENISH GRAY (5GL/1), STIF F TO HARD, 00000000,d3f9bac5d179d9eb657edc578e6e4cb2
40,364,,25,6,0.0,50.0,701.00,708.85,709.35,, MARLY CHALK, 5G6/1-GREENISH GRAY,,,,,,, STIFF TO HARD, 00000000,6acced2c014344318593250f45707087
40,364,,25,6,50.0,90.0,701.00,709.35,709.75,, MUDSTONE, 5GY2/1-GREENISH BLACK, BURROWS,,," PYRIT E FILLS BURROWS AND OCCURS AS SCATTERED FINE CRYSTAL S,LAMINATED LOCALLY",,, STIFF TO HARD, 00000000,811065e714b6c8fc751f766b41a3db43
40,364,,25,6,90.0,150.0,701.00,709.75,710.35,, MARLY CHALK, 5G6/1-GREENISH GRAY, LAMINATED LOCA LLY,,, PYRITE CRYSTALS AT U04 CM,,, STIFF TO HARD, 00000000,443453a84dc7b3b11680284992dd41f4
40,364,,26,0,0.0,40.0,710.50,710.50,710.90,, CALCAREOUS MUDSTONE," -DK.REDDISH GRAY,-GRAY"," BUR ROWED,MINOR GRAY BURROW FILLINGS",,,, SANDY (TESTS) AT 145 CM,, STIFF TO HARD, 00000000,f3f964d1a4df3e6e065015b00a86f4dc
40,364,,26,1,0.0,150.0,710.50,710.90,712.40,, CALCAREOUS MUDSTONE," 5YR3/3-DK.REDDISH BROWN,5G4 /1-DK.GREEN GRAY,5G6/1-GREENISH GRAY", MODERATELY HEAVY BURROWING BUT HARD TO SEE BECAUSE OF UNIFORM COLOR OVER MOST OF CORE,,,,," DK.GREEN GRAY AT 57 CM,5G6 /1 AT 60-63 AND 68-71 AND 73-77 CM,DK.GREEN GRAY LAY ER AT 128 CM", STIFF TO HARD, 00000000,954b9b96e48b6ef577502734484ab993
40,364,,26,2,0.0,150.0,710.50,712.40,713.90,, CALCAREOUS MUDSTONE," 5YR3/3-DK.REDDISH BROWN,5G6/ 1-GREENISH GRAY,5Y4/1-DK.GRAY"," BURROWS PRESENT THRO UGHOUT MOST OF CORE BUT IS NOT HEAVY,GRAY LAYERS AT 14 AND 20 CM,DARK GRAY LAYERS AT 25 AND 30 CM",,,,," SAND Y AT 73-77 AND 125-128 CM,VARIOUS SHADES OF DARK GRAYS AND REDDISH BROWNS AT 125-150 CM,DK.GRAY 115-1 25 CM,GREENISH GRAY 90-115 CM", STIFF TO HARD, 00000000,ea033721ffbb69c75c6fb4392315ccee
40,364,,26,3,0.0,150.0,710.50,713.90,715.40,, CALCAREOUS MUDSTONE," 5G6/1-GREENISH GRAY,5YR4/3-R EDDISH BROWN,5B7/1-LT.BLUISH GRAY,5G4/1-DK.GREENISH GRAY"," BROWNISH CALCAREOUS MUDSTONE GRADING DOWNWARD INTO MARLY CHALK,MOST SHOWS BURROWING,THINLY LAMINA TED AT 56-57 CM",,,,," 5B7/1 + 5G6/1+ MINOR 5G4/1 AT 50-1 50 CM, 5YR4/3 +5G6/1 AT 0-50 CM", STIFF TO HARD, 00000000,d8cc1033d1a63d026e0cf24547317619
40,364,,26,4,0.0,120.0,710.50,715.40,716.60,, MARLY CHALK TO CALCAREOUS MUDSTONE," 5G6/1-GREENIS H GRAY,10YR4/2-DK.GRAYISH BROWN"," MODERATE TO SLIGHT BURROWING THROUGHOUT,COLOR GRADATION AT 55 CM",,,,, 5G6 /1 AT 0-55 AND 10YR4/2 AT 55-120CM, STIFF TO HARD, 00000000,99791b4cae5bb3258901671e8ab6eb8c
40,364,,26,5,0.0,150.0,710.50,716.90,718.40,, CALCAREOUS MUDSTONE OR MARLY CHALK," 10YR5/2-GRAYI SH BROWN,5G5/1-DK.GREENISH GRAY,5G6/1-GREENISH GRAY"," HEAVILY BURROWED THROUGHOUT,GOOD ZOOPHYCOS,SANDY LAYERS AT 34 AND 78 CM (BELIEVE IT TO BE TESTS)",,,,," 10 YR5/2 0-50 CM,5G6/1 AT 60-150 CM + 5G5/1", STIFF TO HARD, 00000000,5afa3bb4d491502a8dd7a6cf91698cb9
40,364,,26,6,0.0,150.0,710.50,718.40,719.90,, CALCAREOUS MUDSTONE OR MARLY CHALK," 5G6/1-GREENIS H GRAY,5G5/1-DK.GREENISH GRAY,5YR3/3-DK.REDDISH BROW N", HEAVILY BURROWED THROUGHOUT,,,,," 5YR3/3 AT 110-150 CM,5G6/1 TO 5G5/1 (GRADATIONAL) FROM 0 TO 110 CM", S TIFF TO HARD, 00000000,9a71b22ae165d21bcf1c00d4967f2475
40,364,,27,1,140.0,150.0,720.00,721.40,721.50,, MUDSTONE, 5YR3/3-DK.REDDISH BROWN,,,,,,, STIFF TO HARD, 00000000,ed79e2ff169024cfa85f9de65c46d751
40,364,,27,2,5.0,50.0,720.00,721.55,722.00,, MUDSTONE," 5YR3/3-DK.REDDISH BROWN,-GRAY"," MODERAT E BURROWING,GOOD ZOOPHYCOS 15-25 CM",,,,, GRAY AT 21 CM, STIFF TO HARD, 00000000,a5a6e5e7be0bf05d55d3d4e2b6f91c53
40,364,,27,2,50.0,80.0,720.00,722.00,722.30,, CHALK, 5B7/1-LT.BLUISH GRAY," MODERATE BURROWING, LT.COLOR FILLS BURROWS AT TOP OF NEXT UNIT,RED IS RE DUCED TO GRAY COLOR AROUND BURROWS",,,,,, STIFF TO HARD, 00000000,969230a071162aee446203d6993befa6
40,364,,27,2,80.0,150.0,720.00,722.30,723.00,, MUDSTONE," 5YR3/3-DK.RED.BROWN,-GRAY"," GOOD BURROW S DEV., 2 SANDY LAYERS NEAR BASE (SUSPECT THEY ARE BIOGENIC)",,,,," LT.FILLINGS AT 80-83 CM,BECOMES GRAYER NEAR BASE", STIFF TO HARD, 00000000,e3cdf2a5b8211994981c2d14e5f36a72
40,364,,27,3,0.0,150.0,720.00,723.00,724.50,, CALCAREOUS MUDSTONE," 5YR3/3-DK.RED.BROWN,5G5/1-GR EEN GRAY,5G6/1-GREENISH GRAY,5G4/1-DK.GREENISH GRAY"," NUMEROUS BURROWS,SMALLER BURROWS COMMON BUT ALSO GOOD ZOOPHYCOS,SOME LAMINATIONS PRESERVED BUT MOST DISTURBED BY ORGANISMS",,,,," SANDY AT 30-35 CM,COLORS IN ZONES", STIFF TO HARD, 33213000.1110.3450,28e845aee34caa77a974352004dbba1a
40,364,,27,4,10.0,150.0,720.00,724.60,726.00,, MARLY CHALK AND CALCAREOUS MUDSTONE," 5G5/1-GREENI SH GRAY,5YR6/1-LT.BROWNISH GRAY,5G6/1-GREENISH GRAY, 5Y7/1-LT.GRAY,5R6/2-PALE RED,5YR4/1-BROWNISH GRAY"," HEAVILY BURROWED THROUGHOUT,COLOR CHANGES ARE GRADAT IONAL,ZOOPHYCOS AT 70 AND 73 AND 77 CM",,,,," SANDY AT 30-35 CM,SILTY 110-150 CM,5R6/2 TO 5YR6/1 + 5Y7/1 AT 100-110 CM,5G5/1 AT 10-35 AND 47-100 CM,5YR4/1 + 5Y R6/1 AT 110-150 CM", STIFF TO HARD, 00000000,f409b63f00f22908419abb45c211c7fe
40,364,,27,5,3.0,150.0,720.00,726.03,727.50,, MARLY CHALK," 5YR3/3-DK.REDDISH BROWN,5YR4/3-REDDI SH BROWN,5Y7/1-LT.GRAY,5B7/1-LT. BLUISH GRAY"," SCATT ERED GRAY BURROW INFILLINGS,HEAVILY BURROWED THROUGH OUT,GOOD ZOOPHYCOS AT 3-15 CM,SOME LAMINATIONS PRESE RVED,VERY GRADATIONAL COLOR CHANGE FROM 5B7/1 TO 5YR 3/3 AT 85 CM",,,,,, STIFF TO HARD, 00000000,e181d8c804d096f2aeba6bb8a63ef63b
40,364,,28,1,45.0,150.0,748.50,748.95,750.00,, MARLY CHALK," 5Y7/1-LT.GRAY,5YR4/3-REDDISH BROWN, 5YR3/3-DK.RED.BROWN"," HEAVILY BURROWED,SILTY TEXTURE LOCALLY",,,,," LT.GRAY 45-50 CM,REDDISH BROWN TO DK.RED. BROWN AND BACK TO RED. BROWN AT 50-150 CM", STIFF TO HARD, 00000000,050f5b8e2115583c00f843618d16617c
40,364,,28,2,0.0,130.0,748.50,750.00,751.30,, MARLY CHALK," 5Y5/1-GRAY,5YR4/3-REDDISH BROWN,5YR7 /1-LT.GRAY"," HEAVILY BURROWED THROUGHOUT,ZOOPHYCOS AT 125 CM",,,,," 5Y5/1 + 5YR4/3 TO 5Y5/1 0-60 CM,5YR7/1 A T 60-70 CM,5Y5/1 70-120 CM,5YR7/1 120-130 CM", STIFF TO HARD, 00000000,0e9f6256f4df4e09d7e0fcd6d383e6e7
40,364,,28,3,7.0,53.0,748.50,751.57,752.03,, CALCAREOUS MARL TO MARLY CHALK," 5G5/1-DK.GREENISH GRAY,5BG5/2-GRAYISH BLUE GREEN"," MODERATELY BURROWE D AT BASE -HEAVILY BURROWED AT TOP,SILTY TO FINE SAN D AT 27-35 CM",,,,,, STIFF TO HARD, 00000000,ab2ff59d2239e4415d5e6887b770ae7d
40,364,,28,3,53.0,70.0,748.50,752.03,752.20,, MARLY CHALK," 5B7/1-LT.BLUISH GRAY,-DK.GREEN", DK. GREEN BURROW FILLINGS,,,,,, STIFF TO HARD, 00000000,cc7f6b4d30f6a676b5a873ab68306a2c
40,364,,28,3,70.0,150.0,748.50,752.20,753.00,, MARLY CHALK," 5G5/1-DK.GREENISH GRAY,5G6/1-GREENIS H GRAY,-LT.BLUISH GRAY"," HEAVILY BURROWED,BURROWS IN LT.BLUISH GRAY GO DOWN INTO DARK LAYER AT 115-130 CM,LAMINATED FINE SANDY LAYER AT 135-140 CM(ORGANIC SAND?),SAND LAYER AT 76 CM",,, PYRITE NODULES AT 138 CM,,, STIFF TO HARD, 00000000,ddbd6b06c29b4c446a74e1a105f996f4
40,364,,28,4,0.0,150.0,748.50,753.00,754.50,, CHALK," 5B7/1-LT.BLUISH GRAY,5G6/1-GREENISH GRAY, 5YR4/1-BROWNISH GRAY,5Y6/1-LT.OLIVE GRAY"," STYOLITIC SEAM AT 5 CM,HEAVILY BURROWED THROUGHOUT, IRREGULAR LENSES OF GREENISH GRAY AT 20 CM",,,,," 5B7/1 AT 0-60 CM ,5YR4/1 AT 60-65 CM,5G6/1 AT 65-110 CM,5Y6/1 AT 110- 150 CM", STIFF TO HARD, 00000000,6a084c4f8e1d6f744c2aa7a22d9c24f3
40,364,,29,1,50.0,150.0,767.50,768.00,769.00,, CHALK," 5B7/1-LT.BLUISH GRAY,-GREEN,5G5/1-DK.GREEN GRAY"," DARKER GREENISH IRREGULAR LENSES AND LAMINAE ,MODERATELY BURROWED,STYOLITIC SEAMS WITH BLACK SEAM FILLINGS AT 103 CM,LAMINATIONS PRESENT BUT ARE WAVY AND DISCONTINUOUS",,,,, DARK GREEN GRAY 122-130 CM, ST IFF TO HARD, 00000000,8194cf481308974ba5d567312295ddb7
40,364,,29,2,0.0,150.0,767.50,769.00,770.50,, CHALK," N1-BLACK,5B9/1-BLUISH WHITE,5B7/1-LT.BLUIS H GRAY,5G6/1-GREENISH GRAY"," WAVY LAMINATIONS AT 7-1 2 CM,STYOLITIC SEAM AT 20 CM,BURROWING AT 40-45 CM",,,,," VOID 131-140 CM,MOST IS 5B9/1 TO 5B7/1 WITH DARKER LAMINAE OF 5G6/1,NODULAR TOWARD BASE", STIFF TO HARD, 00000000,e706b2192fa7a90c1e324ff2c8fa14dd
40,364,,29,3,0.0,150.0,767.50,770.50,772.00,, LIMESTONE," 5B./1-BLUISH WHITE,5BM/1-BLUISH GRAY, 5G5/1-DK.GREEN GRAY,5Y4/1-OLIVE GRAY,5Y4/1-OLIVE GRA Y"," LAMINATIONS (BROWNISH BLACK) AT 20-25 CM ARE CUR VED AT BASE AND APPEAR TRUNCATED,FAULTS AT 42 + 47 + 53 + 74 + 90 CM,STEEPLY DIPPING (TO 45 DEGREES) LAM INATIONS AT 75-90 CM,MANY STYOLITIC SEAMS 105-125 CM ,MANY IRREGULAR LAMINATIONS AND DIPPING STRATA AND OFFSETS",,,, FECAL REMAINS AT 0-6 CM," NODULAR LIMESTONE 122-137 CM,OLIVE GRAY 14 5-150 CM,5G5/1 AT 130-136 CM,SMALL OFFSETS AT 65 CM", HARD, 00000000,374d4904858c496bbc424dcd352f9491
40,364,,29,4,0.0,150.0,767.50,772.00,773.50,, LIMESTONE," 5B9/1-BLUISH WHITE,5Y4/1-OLIVE GRAY,5G 7/1-GREENISH GRAY,-DK.GREEN.GRAY,-LT.BLUISH GRAY,-DK .GREEN"," OVERTURNED LAMINAE AT 10-15 CM TRUNCATED AT BASE,INCLINED LAMINAE 15-48 CM (SOME TRUNCATED AT BASE),SANDY LAYER 48-52 CM,THINLY LAMINATED 80-150 CM,DK.GREEN LAYERS AT 120 AND 122 CM",,,,," LT.BLUISH GRA Y 80-150 CM,BLUISH WHITE 25-75 CM,GREEN GRAY 75-80 CM,OLIVE GRAY 5-15 CM,5G7/1 15-25 CM", HARD, 00000000,2014eace854450553ce7e69194e768e9
