leg,site,hole,core,section,top interval depth (cm),bottom interval depth (cm),top of core depth(m),top of layer depth (m),bottom of layer depth (m), describer,lithology,color,structures,deformations due to drilling,unusual occurrences,minerals,paleontology,other observations,hardness or induration,z-coding,eodp_id
40,364,,1,0,0.0,25.0,7.50,7.50,7.75,, MARLY OOZE TO CALCAREOUS MUD," 5Y3/2-DK.OLIVE GRAY ,5Y4/2-OLIVE GRAY", HOMOGENEOUS EXCEPT PATCH OF LIGH TER MATERIAL AT 17-18 CM,,,,, SULFUR DIOXIDE ODOR PRESE NT, SOFT, 00000000,acdaffdb1cad056259b9b751ec9189bf
40,364,,1,1,7.0,150.0,7.50,7.82,9.25,, MARLY OOZE," 5Y3/2-DK.OLIVE GRAY,5Y4/2-OLIVE GRAY", DISCONTINUOUS ZONES AND PATCHES OF LIGHTER COLORED OLIVE GRAY-LIGHTER PATCHES MAY BE SLIGHTLY COARSER, SLIGHT DEFORMATION,,,," FAINT HYDROGEN SULFIDE SMELL, 5Y4/2 AT 70 AND 80 AND 85 AND 90 AND 95 CM,VOID 55-6 0 CM AND 99-102 CM", SOFT, 00000000,4f294b22670eccc7241b464cf79736cd
40,364,,1,2,0.0,150.0,7.50,9.25,10.75,, MARLY CALCAREOUS OOZE," 5Y3/2-DK.OLIVE GRAY,5Y4/2- OLIVE GRAY"," STREAKS OF 5Y4/2 FROM 75-150 CM,STREAKS AND PATCHES OF OLIVE GRAY AT 15-40 CM"," MODERATE DEFORMATION 0-30 CM,INTENSE DEFORMATION 30-150 CM",,,, FAINT HYDROGEN SULFIDE ODOR, SOFT, 00000000,a0658edb76bc6de98ef3b59bd134c0e9
40,364,,1,3,0.0,150.0,7.50,10.75,12.25,, MARLY CALCAREOUS OOZE," 5Y3/2-DK.OLIVE GRAY,5Y4/2- OLIVE GRAY",, INTENSE DEFORMATION,,,, FAINT HYDROGEN SULFIDE ODOR," SOFT,PLASTIC FEELING", 00000000,7968e3a3ac68f2a4e4ddb9893a405208
40,364,,1,4,10.0,150.0,7.50,12.35,13.75,, MARLY CALCAREOUS OOZE," 5Y3/2-DK.OLIVE GRAY,5Y4/2- OLIVE GRAY,5Y2/2-BLACK"," BLACK LAYER AT U02-107 CM, 5Y4/2 LAYERS AT 112-115 CM AND 130-135 CM"," INTENSE DEFORMATION 10-100 CM,SLIGHT TO MODERATE DEFORMATIO N 100-150 CM",,,, FAINT HYDROGEN SULFIDE ODOR," SOFT,PL ASTIC", 00000000,e543e8719dd5fef01042174da39cfc64
40,364,,1,5,0.0,135.0,7.50,13.75,15.10,, MARLY CALCAREOUS OOZE," 5Y3/2-DK.OLIVE GRAY,5Y4/2", 5Y4/2 BANDS 95-100 AND 105-110 CM AND 0-4 CM," INT ENSE DEFORMATION 0-85 CM,SLIGHT DEFORMATION 85-135 CM",,,, HYDROGEN SULFIDE ODOR FAINT," SOFT,PLASTIC", 00000000,7183ac5e3646c2855f8e26309a4eea97
40,364,,1,6,0.0,150.0,7.50,15.25,16.75,, MARLY CALCAREOUS OOZE, 5Y4/2-OLIVE GRAY," LAMINAE AND PATCHES AND STREAKS OF OLIVE GRAY,AT 95-150 CM START TO GET LAMINATIONS THAT ARE QUITE DISTINCT"," M ODERATE DEFORMATION 0-30 CM,INTENSE DEFORMATION 30-9 5 CM,SLIGHT DEFORMATION 95-150 CM",,,, FAINT HYDROGEN SULFIDE SMELL," SOFT,PLASTIC", 00000000,6757a68ee7f5c5375dcfd7c48ecc02bf
40,364,,2,1,30.0,150.0,36.00,36.30,37.50,, MUD," 5Y3/2-DK.OLIVE GRAY,5Y4/2-OLIVE GRAY", MINOR VERTICAL STREAKS OF OLIVE GRAY, INTENSE DEFORMATIO N,,,, FAINT HYDROGEN SULFIDE SMELL, SOFT, 00000000,b9b304e3c952d51565c6889071b51617
40,364,,2,2,0.0,150.0,36.00,37.50,39.00,, MUD," 5Y3/2-DK.OLIVE GRAY,5Y4/2-OLIVE GRAY"," STREA KS OF OLIVE GRAY MUD,ANY ORIGINAL LAMINATIONS BADLY DEFORMED"," INTENSE DEFORMATION,LAMINATIONS DEFORMED",,,, SLIGHT HYDROGEN SULFIDE ODOR, SOFT, 00000000,a8f7bc2c94198705f370880df623a784
40,364,,2,3,0.0,150.0,36.00,39.00,40.50,, MUD," 5Y3/2-DK.OLIVE GRAY,5Y4/2-OLIVE GRAY",," MODER ATE DEFORMATION 0-75 CM,SLIGHT M5-100 CM,INTENSE DEF ORMATION", PYRITE NODULE AT 130 CM, PYRITE AT 130 CM,," MOSTLY 5Y3/2 WITH MINOR 5Y4/2 0-75 CM,MOSTLY 5Y4/2 WITH 5Y3/2(MINOR) AT 75-150 CM,SLIGHT HYDROGEN SULFIDE ODOR", SOFT, 00000000,3a9fed539de1cb756ce671091c0e6664
40,364,,3,1,15.0,145.0,64.50,64.65,65.95,, MUD," 5Y5/1-GRAY,5Y5/2-OLIVE GRAY,-BLACK",," BRECCIA 0-25 CM,INTENSE DEFORMATION", NUMEROUS BLACK PATCHE S THAT ARE STRETCHED VERTICALLY BY DRILLING AND SAMP LE SPLITTING (BLACK PATCHES APPEAR TO BE FINELY DISS EMINATED PYRITE, POSSIBLE PYRITE IN BLACK PATCHES,, 5Y5/1 20-42 CM, SOFT, 00000000,b29da822a4260d30b0b3eddffb4fa0ad
40,364,,3,2,0.0,150.0,64.50,66.00,67.50,, MUD," 5Y5/2-OLIVE GRAY,-GREEN,-BLACK"," BLACK (PYRI TIC?) STREAKS,FAINT GREENISH STREAKS,BEFORE DRILLING AND CUTTING-WHAT ARE NOW STREAKS WERE MOST LIKELY MOTTLES", INTENSE DEFORMATION,,,, MANY SMALL PIN-SIZED HOLES ON CUT SURFACE INDICATE GAS ESCAPING, FIRM, 00000000,85296c1a82ecd2cb2c4cf61e770cb758
40,364,,3,3,0.0,150.0,64.50,67.50,69.00,, MUD," 5GY4/1-DK.GREENISH GRAY,5Y5/2-OLIVE GRAY,-BL ACK", NUMEROUS MOTTLES AND STREAKS OF GREENISH GRAY TO DK.GREENISH GRAY AND OF BLACK (PYRITE?), INTENSE DEFORMATION,, BLACK PYRITE ?,,, FIRM, 00000000,235bf9b822160951693ad14660e0d5fb
40,364,,3,4,0.0,130.0,64.50,69.00,70.30,, MUD," 5Y5/2-OLIVE GRAY,5Y5/1-GRAY", MANY PATCHES AND STREAKS OF BLACK PYRITE-RICH MATERIAL, INTENSE DEFORMATION,,,," HALF 5Y5/2 + HALF 5Y5/1 0-60 CM,5Y5/1 + MINOR OLIVE GRAY (5Y5/2) 60-130 CM", FIRM, 00000000,9160963921f3c2a7b73778e4995e569b
40,364,,3,5,0.0,130.0,64.50,70.50,71.80,, MUD," 5Y4/1-OLIVE GRAY,5GY6/1-LIGHTER GREENISH GRA Y,-BLACK", NUMEROUS BLACK STREAKS AND PATCHES (PYRIT IC?)," INTENSE DEFORMATION 0-90 CM,SLIGHT .0-130 CM",,,, MOST IS OLIVE GRAY WITH LIGHTER GREENISH GRAY, FI RM, 00000000,2ff44cc81c6c4532c4af1164f8bc5386
40,364,,3,6,0.0,150.0,64.50,72.00,73.50,, MUD," 5Y5/1-GRAY,5Y4/1-OLIVE GRAY,-BLACK", MANY SMALL BLACK (PYRITIC) STREAKS AND PATCHES," MODERATE DEFORMATION 0-55 CM,SLIGHT DEFORMATION 55-150 CM",,,, 5Y5/1 WITH ABOUT 30% 5Y4/1, FIRM, 00000000,969e81811a71022f77bd733dacec3ffb
40,364,,4,0,0.0,40.0,102.50,102.50,102.90,, MUD," 5Y4/3-OLIVE,5Y4/2-OLIVE GRAY,-BLACK", MOTTLE S OF BLACK (PYRITIC) AND STREAKS OF 5Y4/3 AT 140-150 CM, INTENSE DEFORMATUON,,,,, FIRM, 31210000.3450.3350,66339cb1a85fc1e781b67eab1ad528be
40,364,,4,1,0.0,150.0,102.50,102.90,104.40,, MUD," 5GY6/1-DK.GREENISH GRAY,5Y4/1-DK.GRAY,5Y4/3- OLIVE"," SOME BLACK PYRITIC STREAKS,PATCHES OF OLIVE AT 45-50 CM AND 110-115 CM"," INTENSE DEFORMATION 0-1 00 CM,MODERATE DEFORMATION 100-150 CM",,,," 5GY6/1 AT 0- 55 CM AND 50% AT 55-110 CM AND 5GY6/1 110-150 CM,50% 5!4/1 AT 50-110 CM", FIRM, 00000000,55928cf1d11abb759319a2c68bb1935a
40,364,,4,2,0.0,150.0,102.50,104.40,105.90,, MUD," 5Y4/1-DK.GRAY,5Y5/2-OLIVE GRAY,5Y4/3-OLIVE"," 5Y4/1 ON TOP GRADING TO 5Y5/2 HALF WAY DOWN,PATCHES AND STREAKS OF BLACK (PYRITIC?)", INTENSE DEFORMATI ON,,,, SOME IRREGULAR PATCHES OF OLIVE SCATTERED THROU GH LOWER HALF, FIRM, 00000000,28d75816f2f5ec2fd8572c57eadca555
40,364,,4,3,0.0,150.0,102.50,105.90,107.40,, MUD," 5Y4/3-OLIVE,5GY6/1-DK.GREENISH GRAY,5Y4/1-DK .GRAY", VERTICAL COLOR CHANGES, HIGHLY DISTURBED,,,," 35% DK.GRAY,60% DK.GREENISH GRAY,5% OLIVE", FIRM, 00000000,39cca20b39e2511f8e218ad016db7788
40,364,,4,4,0.0,150.0,102.50,107.40,108.90,, MUD," 5Y5/2-OLIVE GRAY,5Y4/3-OLIVE,5Y4/2-DK.GRAY, 5Y5/1-GRAY"," IRREGULAR VERTICAL PATCHES OF 5Y5/2 + 5GY5/1 0-40 CM,5Y5/2 + 5Y4/3 PATCHES 40-110 CM,OLIVE PATCHES AT 60-70CM AND 85-90 CM",,,, SANDY (FORAMS?) AT 25 CM, MOSTLY GRAY 110-150 CM, FIRM, 00000000,502a1776ee5ac6573062a030bb3d2425
40,364,,4,5,0.0,150.0,102.50,108.90,110.40,, MUD," 5Y4/1-DK.GRAY,5Y4/3-OLIVE,-BLACK", MINOR OLI VE STREAKS AND NUMEROUS BLACK (PYRITIC?) STREAKS AND MOTTLES, INTENSE DEFORMATION,, PYRITE?,,, FIRM, 00000000,c3332cdd644291bf68125ca5a5261ef5
40,364,,4,6,0.0,150.0,102.50,110.40,111.90,, MUD," 5Y4/1-DK.GRAY,5Y4/3-OLIVE,-DK.GRAY TO -BLACK", DARK GRAY TO BLACK PYRITIC? STREAKS AND MOTTLES, INTENSE DEFORMATION,,,,, FIRM, 00000000,588a58261f74118424c197e826307035
40,364,,5,1,133.0,150.0,150.00,151.33,151.50,, MUD," 10YR5/3-BROWN,10YR4/3-DK.BROWN",,,,,, THIS MARKS A MAJOR COLOR CHANGE, STIFF, 00000000,beeba673ca4502d5daeff34b6002e28b
40,364,,5,2,0.0,150.0,150.00,151.50,153.00,, MUD," 10YR4/4-DK.YELLOWISH BROWN,5Y5/3-OLIVE,10YR5 /4-YELLOWISH BROWN,5Y5/1-GRAY", PATCHES AND STREAKS OF GRAY, SLIGHT DEFORMATION,,,, OLIVE (5Y5/3) AT TOP CHANGES GRADUALLY TO 10YR5/4 AT BOTTOM, STIFF, 00000000,821dae882c433d36c266a71b1918fbc4
40,364,,5,3,0.0,135.0,150.00,153.00,154.35,, MUD," 10YR5/4-YELLOWISH BROWN,5Y5/1-GRAY,10YR4/4-D K.YELLOWISH BROWN", SLIGHTLY MOTTLED, SLIGHT DEFORM ATION,,,, MOSTLY YELLOWISH BROWN WITH MINOR 5Y5/1 AND 10YR4/4, STIFF, 00000000,119dd88125fddeaba39874b2f17ac21a
40,364,,5,4,0.0,150.0,150.00,154.50,156.00,, MUD," 10YR5/4-YELLOWISH BROWN,10YR4/4-DK.YELLOW BR OWN,5Y5/1-GRAY", SLIGHTLY MOTTLED, SLIGHT DEFORMATI ON,,,,, STIFF, 00000000,74615a04798c4ec99b753d8e34fe7d39
40,364,,6,1,0.0,150.0,197.50,197.50,199.00,, MUD," 5Y5/3-OLIVE,5GY6/1-GREENISH GRAY,5GY5/1-GREE NISH GRAY"," SLIGHTLY MOTTLED,LIGHT COLORED SANDY LAY ERS (PROBABLY TESTS) AT 63 AND 105 AND 130 CM", SLIG HT DEFORMATION,,,," 5Y503 0-60 CM,5GY5/1 AT 60-150 CM, MAJOR COLOR CHANGE,SUBTLE COLOR CHANGES TOO SLIGHT TO GIVE DIFFERENT NAMES", STIFF, 00000000,89718e6111270aac5e8ad543ec66fc05
40,364,,6,2,0.0,150.0,197.50,199.00,200.50,, MUD," 5GY5/1-GREENISH GRAY,5GY6/1-LIGHTER GREENISH GRAY,-BLACK"," LIGHTER GREENISH GRAY SANDY LAYERS AT 90 AND 100 CM,SLIGHTLY MOTTLED THROUGHOUT WITH SU BTLE COLOR CHANGES",, BLACK PYRITE NODULES AT 120 CM,,,, STIFF, 00000000,bdce9e7cf9e5d2e0ae930ea628164550
40,364,,6,5,98.0,127.0,197.50,204.48,204.77,, MUD, 5GY5/1-GREENISH GRAY,,,,,,, STIFF, 00000000,69ea8e1e5ff73d89743dd4e4403314ab
40,364,,6,6,0.0,150.0,197.50,205.00,206.50,, MUD," 5GY5/2-GREENISH GRAY,-WHITE", SLIGHTLY MOTTL ED WITH VARIOUS SUBTLE TONES OF GREENISH GRAY,, NUME ROUS 1-2 MM WHITISH SPECKS OF SAND-SIZED FRAGMENTS (PROBABLY TESTS) SCATTERED THROUGHOUT,,,, STIFF, 00000000,e8894f0a3be13e9e594209c23ee867b3
40,364,,7,1,0.0,150.0,245.00,245.00,246.50,, MUD," 5Y5/2-OLIVE GRAY,5GY6/1-GREENISH GRAY,10YR5/ 3-BROWN,5Y5/1-OLIVE GRAY,5GY5/1-GREENISH GRAY", MODE RATELY MOTTLED, SLIGHT DEFORMATION,,,," 5Y5/2 + 5GY6/1 0-17 CM,10YRK/3 + 5Y5/2 17-40CM,5Y502 + 5GY6/1 40-1 13 CM,5Y5/1 + 5GY5/1 113-150 CM", STIFF, 00000000,59c1b5cf70dc130594edf91c3a28c99d
40,364,,8,0,0.0,30.0,283.00,283.00,283.30,, MUD," 5Y6/3-PALE OLIVE,5Y2/2-LT.GRAY", LT.GRAY MOT TLES,,,,,, STIFF, 33213000.3450,4f214b72d5431d4dbe05371798011b6f
40,364,,8,1,0.0,150.0,283.00,283.30,284.80,, MUD," 10YR7/2-LT.GRAY,5Y7/1-LT.GRAY,10YR6/3-PALE BROWN"," LT.GRAY STREAKS AND MOTTLES AND BURROW FILLI NGS AND LAMINAE AT 30-U50 CM,COLORS GREATLY MIXED BY BURROWING,INTENSELY BURROWED THROUGHOUT (SHEARING THROUGH DRILLING HAS STRETCHED BURROWS -BELOW 36 CM -MAKING THEM FLATTENED)"," SLIGHT DEFORMATION 0-30 CM ,MODERATE DEFORMATION 30-150 CM",,,," 10YR7/2+MINOR 5Y7/1 0-30 CM,10YR6/3 + 10YR7/2 + 5Y 7/1 (AT 85 AND 100 AND 120-127 CM) FROM 30-150 CM,SM ALL VOID POCKETS AT 10-20 + 53-56 + 75-77 + 112-116 + 117-127 + 148-150 CM", VERY STIFF MUD TO SOFT CHAL K, 33213000.3450,279ca2318e5c573463a69b4f4cd9a1ae
40,364,,8,2,0.0,150.0,283.00,284.80,286.30,, CHALK OR MARLY CHALK," 5Y7/1-LT.GRAY,10YR5/4-YELLO W BROWN,10YR6/3-PALE BROWN"," NUMEROUS BURROWS BUT SH EARING BY DRILLING HAS LEFT MOST AS ALMOND-SHAPED PATCHES (ESPECIALLY TRUE IN SOFTER CHALKS,BLACK STRE AK AT 10 CM,COLORS IN BANDS", DEFORMED,,,,, STIFF TO SO FT, 11121210.3450,cad1bd0d66ef80d8ba5147001f4b591c
40,364,,8,3,0.0,150.0,283.00,286.30,287.80,, CALCAREOUS CHALK OR MARLY CALCAREOUS CHALK," 10YR7 /1-LT.GRAY,10YR6/4-LT.YELLOW BROWN,10YR5/4-YELLOWISH BROWN", NUMEROUS BURROWS-MOST APPEAR TO BE EITHER C OMPRESSED OR STRETCHED,,,,,, STIFF TO SOFT, 00000000,b78ca27feb38f9baaa4e69bb090be9d2
40,364,,8,4,0.0,150.0,283.00,287.80,289.30,, CHALK OR MARLY CHALK," 10YR6/4-LT.YELLOW BROWN,10Y R7/1-LT.GRAY,10YR5/4-YELLOWISH BROWN,10YR6/3-PALE BROWN", BURROWS NUMEROUS (SAME AS IN SEC 3),,,,," 10YR6/ 4 AT 0-10 + 18-85 + 112-150 CM,10YR7/1 AT 10-17 CM, 10YR5/4+10YRL/2 AT 85-112 CM", STIFF TO SOFT, 00000000,72693f9f10585b9519a32cfc9196a425
40,364,,8,5,0.0,150.0,283.00,289.30,290.80,, CALCAREOUS CHALK OR MARLY CALCAREOUS CHALK," 10YR6 /3,10YR6/4-LT.YELLOW BROWN,10YR5/4-YELLOW BROWN"," MA NY BURROWS THROUGHOUT,MINOR LENSES OF 10YR3/4 AT 35- 150 CM,10YR6/4 GRADES TO 10YR5/4 NEAR 15 CM",,,,,, STIFF TO SOFT, 00000000,02fc3c0dc92a40b0784c8a0dcb8716e0
40,364,,8,6,0.0,150.0,283.00,290.80,292.30,, CHALK OR MARLY CHALK," 10YR6/4-LT.YELLOW BROWN,7.5 YR7/4-BROWN,5Y6/2-LT.OLIVE GRAY,5Y7/2-LT.GRAY,10YR5/ 4-YELLOW BROWN"," MOST COLOR CHANGES GRADATIONAL,BURR OWED THROUGHOUT MOST OF SECTION", LOWER PART SHEARED BY DRILLING,,,, COLORS IN BANDS, STIFF TO SOFT, 00000000,4eb5b18499d59bf7671b5ed29b1d148a
40,364,,9,1,15.0,150.0,321.00,321.15,322.50,, CHALK," 7.5YR6/4-LT.BROWN,2.5Y7/2-LT.GRAY"," BURROW ED THROUGHOUT BUT BURROWS DIFFICULT TO SEE,GRAY BURR OW FILLINGS AT 50-55 AND 100 AND 115 AND 130-140 CM",,,,," LT,BROWN WITH TRACES OF LT.GRAY", STIFF TO SOFT, 00000000,7edb96689233069c882698161dc3c168
40,364,,9,2,0.0,150.0,321.00,322.50,324.00,, CHALK," 2.5Y7/2-LT.GRAY,2.5YR5/8-RED,7.5YR6/4-LT.B ROWN"," PATCHES AND LAMINAE OF 2.5Y7/2,FOR FIRST TIME CORE SHOWS GOOD LAMINATED-TO-THINLY-STRATIFIED NATU RE IN PLACES,BURROWED AND POORLY LAMINATED 0-43 CM, RED LAMINAE AT 46 CM,LAMINATED 53-70 CM,BURROWED 70- 110 CM,MOTTLED 110-150 CM", BROKEN CORE ROTATED AS INDIVIDUAL PIECES,,,,, STIFF TO SOFT, 00000000,d6e1fb43622192791a09c25b62a4fe0e
40,364,,9,3,0.0,150.0,321.00,324.00,325.50,, CALCAREOUS CHALK AND MARLY CALCAREOUS CHALK," 2.5Y R5/6-RED,5Y7/1-LT.GRAY"," FAINT BURROWS ALMOST UNRECO GNIZABLE BECAUSE OF STRONG MOTTLING,STRONGLY MOTTLED RED AND LT.GRAY 0-110 CM",,,,, TWO-THIRDS LT.GRAY 110-1 50 CM AND ONE-THIRED RED, STIFF TO SOFT, 00000000,4b18c974bfea868a5717178c72ab8bb1
40,364,,9,4,0.0,150.0,321.00,325.50,327.00,, CHALK AND MARLY CHALK," 2.5YR4/6-RED,5Y7/1-LT.GRAY ,-GRAY"," MOTTLED AND BURROWED MIXTURES OF GRAY AND RED-BROWN COLORS,GOOD BURROWS IN SOME FIRM CLASTS,SE VERAL CYCLES OF COLOR CHANGES -MOSTLY RED AT BASE GRADING TO LIGHTER BROWNS TO GRAYS", MODERATE DEFORM ATION,,,," LIGHT COLOR GRADES TO DARK IN 20 CM LONG ZON ES FROM 60-150 CM,HARD ROUNDED FRAGMENTS IN SOFT MAT RIX (45-50 CM)"," HARD FRAGMENTS IN SOFT MATRIX 45-50 CM,SOME FIRM CLASTS", 00000000,64f96afd5c86c8ee87e7f0bc19a031bf
40,364,,10,1,40.0,150.0,349.50,349.90,351.00,, CALCAREOUS CHALK AND MARLY CALCAREOUS CHALK," 5Y7/ 1-LT.GRAY,5YR4/6-YELLOWISH RED"," BROWNISH AND GRAY COLORS BOTH HEAVILY BURROWED,GOOD ZOOPHYCOS BURROWS AT 116 AND 115 CM",,,,,, STIFF TO SOFT, 00000000,b392edf2a5519708807feaf72d542184
40,364,,10,2,0.0,150.0,349.50,351.00,352.50,, CALCAREOUS CHALK," 5Y7/1-LT. GRAY,5YR5/4-REDDISH BROWN"," MOTTLES AND LAYERS OF 5YR5/4,RED LAYERS AT 45-50 AND 95-110 AND 128-140 CM,BOTH RED AND GRAY LA YERS ARE HEAVILY BURROWED",,,,," 70% GRAY,30% RED-BROWN", STIFF TO SOFT, 00000000,a2e849f5c70c2dd6a7734b64e47caef1
40,364,,10,3,0.0,150.0,349.50,352.50,354.00,, CALCAREOUS CHALK," 5Y7/1-LT.GRAY,5YR5/4-REDDISH BR OWN,10YR6/4-LT.YELLOWISH BROWN", STRONGLY BURROWED THROUGHOUT,,,,," LT,GRAY PREDOMINATES-MIXTURE WITH REDDI SH BROWN CREATES THE OVERALL COLOR OF LT.YELLOWISH BROWN", STIFF TO SOFT, 00000000,076ad923bc1190c5c760704f5af0fb3e
40,364,,10,4,0.0,130.0,349.50,354.00,355.30,, CALCAREOUS CHALK," 10YR6/4-LT.YELLOW BROWN,5Y7/1-L T.GRAY,-REDDISH BROWN"," SMALL FAULT AT 30 CM,THIN (1 MM) GRAY LAMINAE AT 126 CM,BURROWED THROUGHOUT",,,,,, S TIFF TO SOFT, 00000000,b0c28768714738c2616617019fad8fdd
40,364,,10,5,0.0,150.0,349.50,355.50,357.00,, CALCAREOUS CHALK AND MARLY CALCAREOUS CHALK," 10YR 5/4-YELLOWISH BROWN,5Y7/1-LT.GRAY,5YR4/6-YELLOW BROW N"," INTENSELY BURROWED THROUGHOUT (INCLUDING ZOOPHYC OS),STRIKING COLOR CONTRAST AT 108 CM,ZOOPHYCOS AT 26 AND 30 CM",,,,, MORE OF THE DARK RED THAN SEEN BEFORE IN CORE 10, STIFF TO SOFT, 00000000,2153815614faf88509669d03e593e797
40,364,,10,6,0.0,150.0,349.50,357.00,358.50,, MARLY CALCAREOUS CHALK AND CHALK," 5YR4/6-YELLOW BROWN,5Y7/1-LT.GRAY"," HEAVILY BURROWED,GRAY MATERIAL FILLS SOME BURROWS IN THE YELLOW BROWN ZONES",,,,," 5YR4 /6 AT 0-115 AND 145-150CM,5Y7/1 115-145 CM", STIFF T O SOFT, 00000000,e72cd3f7f8a48b375b4261f6d5eade4f
40,364,,11,0,0.0,30.0,359.00,359.00,359.30,, CHALK AND MARLY CHALK," 7.5R5/4-BROWN,5R7/1-LT.GRA Y", BURROWED THROUGHOUT, INTENSE DEFORMATION 105-12 0 CM,,,," 7.5R5/4 115-125 CM AND U35-140 CM,5R7/1 125-1 35 AND 140-150 CM", STIFF TO SOFT, 11120000.1110.1210.3450,e3c786c8e69a0cb57d3aed64cb49c1d0
40,364,,11,1,0.0,150.0,359.00,359.30,360.80,, CHALK AND MARLY CHALK," 10YR6/4-LT.YELLOW BROWN,10 YR7/4-VERY PALE BROWN,5Y7/1-LT.GRAY,2.5Y6/2-LT.BROWN GRAY", HEAVILY BURROWED, EDGES OF CORE ARE DISTURB ED-CENTER IS O.K.,,,," LT.YEL.BRN +V.PALE BROWN 0-20 CM ,LT.GRAY 20-70 CM,LT.BRN GRAY 70-75 AND 94-95 CM AND PATCHES AT 130-135 AND 140-145 CM,V.PALE BRN 75-90 AND 95-150 CM", STIFF TO SOFT, 00000000,271817b6783c7ffa3b39112a66d023ca
40,364,,11,2,0.0,150.0,359.00,360.80,362.30,, CALCAREOUS CHALK AND MARLY CHALK TO MUDSTONE," 5Y7 /1-LT.GRAY,2.5Y6/2-LT.BROWNISH GRAY,10YR5/4-YELLOWIS H BROWN"," STRONG BURROWING THROUGHOUT,ALTERNATE REDD ISH BROWN AND GRAY COLORS", FRAGMENTS APPEAR TO BE ROTATED ON ONE-INCH-SPACED PLANES DISTURBING EDGES VERY MUCH,,,,, STIFF TO FIRM, 00000000,84553e9a7099e8eaa8b0fdf1a0eb5a0f
40,364,,11,3,0.0,150.0,359.00,362.30,363.80,, CHALK AND CALCAREOUS MUDSTONE," 10YR5/4-YELLOWISH BROWN,-LT.GRAY", HEAVILY BURROWED THROUGHOUT -INCLUD ING ZOOPHYCOS BURROWS AT 81 AND 82 CM(DISTURBED BY D RILLING -NOT INTERNALLY DISTURBED BUT ROTATED IN REL ATION TO MATERIAL ABOVE AND BELOW), DISTURBED,,,, COL ORS IN BANDS, STIFF, 00000000,b9f658d5628e288ce6a216b8218fcf93
40,364,,11,4,0.0,150.0,359.00,363.80,365.30,, CHALK OR CALCAREOUS MUDSTONE," 10YR5/4-YELLOW BROW N,5Y7/1-LT.GRAY", HEAVILY BURROWED THROUGHOUT, DRIL LING HAS DISTURBED CORE BY ROTATING SLABS ONE INCH TO ONE AND ONE-HALF INCHES APART,,,," 10YR5/4 +SOME 5Y7 /1 0-45 CM,5Y7/1 + MINOR 10YR5/4 45-75 CM,10YR5/4 + MINOR 5Y7/1 75-115 CM,LT.GRAY 115-122 AND 135-150 CM", STIFF TO HARD, 00000000,8ab0073c9a0e8eec56c982d8cc7770aa
40,364,,11,5,0.0,137.0,359.00,365.30,366.67,, CALCAREOUS CHALK AND/OR CALCAREOUS MUDSTONE," 10YR 5/4-YELLOWISH BROWN,5Y7/1-LT.GRAY,5GY7/1-GREENISH GR AY,5B9/1-BLUISH WHITE", EXTREME BURROWING THROUGHOUT, SLABS ROTATED ON ONE-INCH TO TWO-INCH INTERVALS,,,, 5GY7/1 + 5B9/1 AT 70-137 CM, STIFF TO HARD, 00000000,772a5933f049217385ae93b0808c1297
40,364,,11,6,0.0,150.0,359.00,366.80,368.30,, CALCAREOUS CHALK AND/OR CALCAREOUS MUDSTONE," 10YR 5/4-YELLOWISH BROWN,5Y7/1-LT.GRAY,5GY7/1-LT.GREENISH GRAY",, DRILLING DISTURBANCE,,,," 10YR5/4 +MINOR 5Y7/1 0-45 CM,MOSTLY 5Y7/1 +MINOR 10YR5/4 45-95 CM, CM,LT.GRAY + 5GY7/1 95-150 CM", STIFF TO HARD, 00000000,3487e07880b3bb98301cab4ac125424e
40,364,,12,0,0.0,30.0,368.50,368.50,368.80,, CALCAREOUS MUDSTONE OR MARLY CHALK," 7.5YR5/4-BROW N,5Y7/2-LT.GRAY", BURROWED, BRECCIA 115-130 CM,,,,, ST IFF TO HARD, 00000000,faf78aef8927ba86a94687201cefa308
40,364,,12,1,0.0,150.0,368.50,368.80,370.30,, CALCAREOUS MUDSTONE OR MARLY CHALK," 5Y7/2-LT.GRAY ,7.5YR5/4-BROWN"," MOSTLY BROWN WITH MOTTLES OF GRAY, HEAVILY BURROWED THROUGHOUT--GOOD COMPOSITE BURROWS AT 25-26 CM AND 46-47 CM AND 65 CM AND 67 CM AND 120 -121 CM AND 139 CM",,,,, BROWN ZONES ALTERNATE WITH ZONE S OF BROWN+ MINOR LT.GRAY, STIFF TO HARD, 00000000,1badc9c6380ffb7c6d9a24396cb17341
40,364,,12,2,0.0,150.0,368.50,370.30,371.80,, CALCAREOUS MUDSTONE TO MARLY CHALK," 7.5YR5/4-BROW N,5Y7/2-GRAY", HEAVILY BURROWED THROUGHOUT INCLUDING EXCELLENT COMPOSITE BURROWS BROWN WITH LT.GRAY MOTTLES 0-90 CM," DRILLING HAS BROKEN CORE INTO ONE-INCH TO ONE-AND-ONE-HALF INCH LAYERS THAT HAVE BEEN ROTATED RELATIVE TO THE ADJACENT ONE, TRUNCATION OF STRUCTURE RESULT OF DRILLING", GRAY AR OUND BLACK SPECKS (REDUCING) AT 55 CM,,, LT.GRAY 90-100 CM, STIFF TO HARD, 00000000,a6a4c713aa53d8518b417419b847c6aa
40,364,,12,3,0.0,150.0,368.50,371.80,373.30,, CALCAREOUS MUDSTONE TO MARLY CHALK," 5Y7/2-LT.GRAY ,7.5YR5/4-BROWN,7.5YR4/4-BROWN,5GY6/1-GREENISH GRAY"," SEVERAL GREENISH GRAY MOTTLES 50-150 CM,GRAY PART (0-50 CM) HEAVILY BURROWED,BROWN BURROWED AT TOP BUT LOSE BURROWING BELOW 60 CM", DRILLING BREAKS,,,,, STIFF TO HARD, 00000000,6568ef7902b48cc349862f7fcc97e28f
40,364,,12,4,0.0,150.0,368.50,373.30,374.80,, SLIGHTLY CALCAREOUS MUDSTONE," 7.5YR4/4-BROWN,5GY6 /1-GREENISH GRAY,-DK.BROWN", SEVERAL GREENISH GRAY MOTTLES, DRILLING HAS BROKEN CORE ON THREE-AND-ONE- QUARTER TO 1.5 INCH SLABS,,,, GRAY COLOR AROUND BLACK SPECKS SUGGEST MICRO-REDUCING ENVIRONMENT, STIFF TO HARD, 00000000,3cf439a489f59b5b6451916cc2ef8b53
40,364,,12,5,0.0,120.0,368.50,374.80,376.00,, MUDSTONE," 7.5YR4/4-BROWN,-DK.BROWN,5Y7/2-LT.GRAY, 10YR5/4-YELLOWISH BROWN,10YR4/4-DK.YELLOWISH BROWN"," BURROWING THROUGHOUT BUT HEAVIEST BELOW 50 CM (12 ZOOPHYCOS 70-122 CM),LAYERS", ROTATION OF LAYERS BY DRILLING,,,,, STIFF TO HARD, 00000000,0d717648ef98e04405d1c669f0b81019
40,364,,12,6,0.0,150.0,368.50,376.30,377.80,, MUDSTONE," 5YR4/4-REDDISH BROWN TO 5YR4/6-YELLOWIS H RED,5Y7/2-LT.GRAY", HEAVILY BURROWED THROUGHOUT, 0.75 INCH TO 1.5 INCH SLABS HAVE BEEN ROTATED IN DRI LLING,,,, FEW SPECKS OF LT.GRAY 0-95 CM, STIFF TO HAR D, 00000000,e72512172e86c3cfa99334dc16084e43
40,364,,13,1,45.0,150.0,397.00,397.45,398.50,, MUDSTONE," 5Y7/2-LT.GRAY,5YR4/6-YELLOWISH RED", HE AVILY BURROWED THROUGHOUT, MODERATE DEFORMATION,,,, O RIENTATION OF 95-100CM NOT CERTAIN, STIFF TO HARD, 00000000,cfd53896f6cc98a64c3069ccce8bc8da
40,364,,13,2,0.0,150.0,397.00,398.50,400.00,, MARLY CHALK OR CALCAREOUS MUDSTONE," 10YR7/4-V.PAL E BROWN,5Y7/2-LT.GRAY,5YR4/6-YELLOWISH RED",,,,,,,, 00000000,a248d037b1c54e93941ff47409a3a4ec
40,364,,14,1,95.0,150.0,425.50,426.45,427.00,, MARLY CHALK OR CALCAREOUS MUDSTONE, 5YR6/6-REDDIS H YELLOW," BURROWED THROUGHOUT,COMPOSITE BURROW AT 106 CM",,,,,, STIFF TO HARD, 00000000,1371d4635e82eed9b06b9488bf446612
40,364,,14,2,0.0,150.0,425.50,427.00,428.50,, CALCAREOUS MARL OR MARLY CHALK, 5YR6/6-REDDISH YELLOW, HEAVILY BURROWED BUT COLOR QUITE UNIFORM MAKING BURROWS DIFFICULT TO SEE, MODERATE DEFORMATI ON,,,,, STIFF TO HARD, 00000000,66b76632b3a6bd750edfde6e42d41b6a
40,364,,14,3,0.0,150.0,425.50,428.50,430.00,, CALCAREOUS MARL OR MARLY CHALK, 5YR6/6-REDDISH YE LLOW, HEAVILY BURROWED, MODERATE DEFORMATION,,,,, STI FF TO HARD, 00000000,ea586aa83829f146a2a1ec7e8e581b01
40,364,,14,4,0.0,150.0,425.50,430.00,431.50,, MARLY CHALK," 7.5R5/6-BROWN,5YR5/6-YELLOWISH RED, 5Y7/2-LT.GRAY,-WHITE"," HEAVILY BURROWED INCLUDING ZO OPHYCOS AND COMPOSITE BURROWS,MINOR LIGHT GRAY MOTTL ES",,, PRISMATIC CARBONATE,," GRAY WITH WHITE PRISMATIC CARBONATE (INOCERAMUS ?) AT 20-25 CM,WHITE PRISMATIC CARBONATE AT 100-103 CM", STIFF TO HARD, 00000000,2edc28179d23008d764d2896306ed7c9
40,364,,14,5,0.0,105.0,425.50,431.50,432.55,, MARLY CHALK," 5Y7/2-LT.GRAY,7.5R5/6-BROWN,5YR5/6-Y ELLOWISH RED"," HEAVILY BURROWED THROUGHOUT,MINOR MOT TLES OF LT.GRAY",,,,,, STIFF TO HARD, 00000000,a96bfabf6de414d0f2c64b8d4dbb282f
40,364,,14,6,0.0,150.0,425.50,433.00,434.50,, MARLY CHALK," -LT.GRAY,-WHITE",,,, WHITE PRISMATIC CARBONATE FRAGMENTS AT 40-43 AND AT 115 CM,, SAME AS 14-4 AND 14-5, STIFF TO HARD, 00000000,8bc82e8deed3fcd8dcb77e5b276dbfd5
40,364,,15,1,35.0,150.0,463.50,463.85,465.00,, MARLY CHALK," 7.5YR6/6-REDDISH YELLOW,5Y7/2-LT.GRA Y", SMALL FAULT AT 90 CM HEAVILY BURROWED THROUGHOUT, 3-5 % LT.GRAY,,,,, STIFF TO HARD, 00000000,4b35eb445a9104cc544b9f1fb4079a08
40,364,,15,2,0.0,150.0,463.50,465.00,466.50,, MARLY CHALK," 7.5YR6/6-REDDISH YELLOW,5Y7/2-LT.GRA Y,-WHITE"," VERY HEAVILY BURROWED THROUGHOUT,WHITE PR ISMATIC CARBONATE LAYERS 95-100 AND 115 AND 128-132 CM",,, WH ITE PRISMATIC CARBONATE AT 95 AND 115 AND 130 CM,," 7.5YR6/6 0-65 AND 80-150 CM,5Y7/2 65-80 CM", S TIFF TO HARD, 00000000,d72ffefca534041610b32d646642f990
40,364,,15,3,0.0,140.0,463.50,466.50,467.90,, MARLY CHALK," 5YR5/6-YELLOWISH RED,5Y7/2-LT.GRAY"," HEAVILY BURROWED THROUGHOUT,BURROW INFILLING HAS PRODUCED MICRO-REDUCING ENVIRONMENT FOR DIAGENETIC CHANGES,SOME ZOOPHYCOS PRESENT,LT.GRAY MOTTLES",,, WHI TE PRISMATIC CARBONATE AT 40 CM,,, STIFF TO HARD, 00000000,459a6cca0ec3c142b6cd15a6a68663fe
40,364,,15,4,0.0,150.0,463.50,468.00,469.50,, MARLY CHALK," 5Y7/2-GRAY,7.5YR6/4-LT.BROWN"," HEAVI LY BURROWED THROUGHOUT,BROWN LAYER AT 20-30 CM,GRAY LAYER AT 87-93 CM",,, PRISMATIC CARBONATE AT 112 CM,," 5Y7/2 + MINOR 7.5YR6/4 0-40 CM, 7.5YR6/4 + MINOR LT.GRAY BURROW INFILLING AT 40-150 CM", STIFF TO HARD, 00000000,682028e8b76f86d46a3c1571955047e5
40,364,,15,5,0.0,150.0,463.50,469.50,471.00,, MARLY CHALK," 5YR5/8-YELLOWISH RED,5Y7/2-LT.GRAY, 5YR6/6-REDDISH YELLOW"," MODERATE TO HEAVILY BURROWED ,MOTTLING PROMINENT IN UPPER HALF"," MODERATE DEFORMA TION 60-80 CM,INTENSE 80-110 CM",,,,, HARD FRAGMENTS IN SOFT MATRIX 80-150 CM, 00000000,3a7e136c618547e7904611e6aa633c99
40,364,,16,1,80.0,143.0,501.50,502.30,502.93,, MARLY CHALK," 5Y6/1-GRAY,7.5YR7/2-PINKISH GRAY"," H EAVILY BURROWED THROUGHOUT,SOME COMPOSITE BURROWS, BROWN BURROW INFILLS AND LAMINAE 105-143 CM",,,,," 5Y6/1 7.5YR5/4 90-95 CM,7.5YR7/2 80-105 CM,7.5YR7/2 + MIN OR BROWN 105-143 CM", STIFF TO HARD, 00000000,131b2ea489ec867eaae1b7fdab121569
40,364,,16,2,0.0,150.0,501.50,503.00,504.50,, CHALK," 5Y6/1-GRAY,7.5YR6/4-LT.BROWN,5Y7/2-LT.GRAY ,-BLACK"," BLACK 1-MM LAMINAE AT 122 CM(SHOULD BE CHE CKED FOR PYRITE),HEAVILY BURROWED THROUGHOUT,DARK GRAY LAYERS STAND OUT BECAUSE THEY ARE EITHER (A.DAR K BURROW FILLS OR B.DARK MATRIX WITH LIGHT BURROW INFILLS",,,,, 5Y6/1+7.5YR6/4 GRADES INTO 5Y7/2 +MINOR LT .BROWN(AND 6 DISTINCT GRAY ZONES THAT APPEAR DARK) A T 75 CM, STIFF TO HARD, 00000000,48db46ac9f776e9323618a7a64559660
40,364,,16,3,2.0,150.0,501.50,504.52,506.00,, MARLY CHALK," 5Y6/1-GRAY,7.5YR6/4-LT.BROWN,7.5YR5/ 4-BROWN,5Y7/2-LT.GRAY"," HEAVILY BURROWED THROUGHOUT, MOTTLES AND BURROW FILLINGS (LT.GRAY)",,, WHITE PRISMA TIC CARBONATE AT 65 CM,, 20% 7.5YR5/4 + 15% LT.GRAY+ 65% LT.BROWN, STIFF TO HARD, 00000000,bf258a8107b71d5aa7bf795791a40de1
40,364,,16,4,0.0,120.0,501.50,506.00,507.20,, MARLY CHALK," 5Y6/1-GRAY,7.5YR6/4-LT.BROWN,7.5YR5/ 4-BROWN,5Y7/2-LT.GRAY", GRAY LAYER AT 10 CM,,,,, SAME AS SEC 3, STIFF TO HARD, 00000000,2cb57f65ecc60f9e437cf309ee5247ed
40,364,,16,5,6.0,150.0,501.50,507.56,509.00,, MARLY CHALK," 7.5YR6/4-LT.BROWN,5Y7/2-LT.GRAY,5Y6/ 1-GRAY"," HEAVILY BURROWED THROUGHOUT,GRAY LAYER AT 60 CM", MODERATE DEFORMATION 70-150 CM (BROKEN INTO MANY HARD PIECES,,,," 7.5YR6/4 5-55 CM,5Y7/2 55-65 CM, 7.5YR6/4 65-150 CM", STIFF TO HARD, 00000000,f3f70892a49b97e5617f38cec165962c
