43,387,,16,1,105.0,150.0,260.10,261.15,261.60,, SILICIFIED CLAYSTONE (NON-CALCAREOUS) OR RAD MUDST ONE," 5Y4/1-OLIVE GRAY, 5G4/1-DARK GREENISH GRAY, 5G 6/2-GRAYISH GREEN, 5Y4/2-MODERATE OLIVE GRAY"," 5Y4/1 LAMINATED LAYERS AT 105-115 CM AND 125-127 CM, 5G4/ 1 BURROWED/MOTTLED ? AT 115-125 CM, 5G6/2 BURROWED/M OTTLED AT 135-141 CM, MOTTLED CHERT AT 127-135 CM", HIGHLY DISTURBED ?,,,, HOMOGENOUS 5Y4/2 AT 141-150 CM, HARD, 00000000,e42d0c0719f58d0b49f78c81ff83ffb2,43-387-16-1
43,387,,16,2,0.0,150.0,260.10,261.60,263.10,, SILICIFIED CALCAREOUS CLAYSTONE," 5G4/1-DARK GREEN ISH GRAY, 5Y4/1-OLIVE GRAY, 5Y4/2-OLIVE GRAY, 5GY6/1 -GREENISH GRAY"," 5G4/1 BURROWED/MOTTLED AT 0-5 CM AN D 55-56 CM, LAMINATED 5Y4/1 AT 27-32 CM WITH LOAD CA ST ON BASE, LAMINATED 5Y4/2 AT 50-55 CM, CHERT BURRO WED/MOTTLED AT 32-38 CM, LIGHTER GREEN BURROWED/MOTT LED ? OR HOMOGENOUS ? AT 38-50 CM"," BRECCIATED AT 35 -50 CM,HIGHLY DISTURBED AT 0-25 CM, MODERATELY DISTU RBED AT 25-35 CM AND 50-60 CM, REST SLIGHTLY DISTURB ED",,,," HOMOGENOUS STRUCTURELESS AT 5-27 CM AND 60-150 CM, 5Y4/1 AT 5-27 CM, 5GY6/1 AT 60-150 CM, ORGANIC CHEM ISTRY SAMPLE TAKEN AT 120-150 CM", HARD, 00000000,378eb011588148859e16eed1aa9dbfdb,43-387-16-2
43,387,,16,CC,0.0,0.0,260.10,264.70,264.70,, CLAYSTONE, 5GY6/1-GREENISH GRAY,, DRILL BRECCIA,,,,, HARD, 00000000,b959c98c42b1a536855e9c2a09e3215b,43-387-16-CC
43,387,,17,1,88.0,150.0,269.60,270.48,271.10,, SILICIFIED CALCAREOUS CLAYSTONE, 5GY6/1-GREENISH GRAY, PIECES OF CHERT DARKER GREEN MOTTLED/BURROWED AND LAMINATED AND SILICIFIED CLAYSTONE LIGHTER GREE N BURROWED/MOTTLED ALL AT 88-110 CM,,,,, HOMOGENOUS 5GY 6/1 AT 110-150 CM, HARD, 00000000,aef53777d3d7b93aac0ea29589ab373f,43-387-17-1
43,387,,17,2,0.0,60.0,269.60,271.10,271.70,, SILTY CLAYSTONE, 5GY6/1-GREENISH GRAY," MUDDY SAN DSTONE WITH MUD CLASTS AT 53-56 CM, CALCAREOUS SANDS TONE WITH FORAMS AT 56-60 CM",,,,,, HARD, 00000000,e7932ab9f3966ad926467e6cd686a91f,43-387-17-2
43,387,,17,2,60.0,140.0,269.60,271.70,272.50,, CHERT," -OLIVE, -GREEN"," DARKER GREEN BURROWED/MOT TLED AT 78-83 CM 102-108 CM AND 125-135 CM WITH CHER T RUBBLE, LIGHTER AND DARKER GREEN BURROWED/MOTTLED AT 83-91 CM, LAMINATED AT 91-102 CM, RUBBLE OF LAMIN ATE AT 118-125 CM",,,,, HOMOGENOUS RUBBLE AT 112-118 CM, HARD, 00000000,b97670a4a9f8f24e40d67ab6c65700ff,43-387-17-2
43,387,,17,2,140.0,150.0,269.60,272.50,272.60,, CHERTY CLAYSTONE,,,,,,, HOMOGENOUS, HARD, 00000000,7f5561253d82ca2eadb284d80d15784f,43-387-17-2
43,387,,17,CC,0.0,0.0,269.60,272.70,272.70,, PIECES OF CHERT," -OLIVE GRAY, -GREENISH GRAY", LA MINATED BURROWED/MOTTLED,,,,,, HARD, 00000000,a7d50c91092eeab6087d727ba1bec641,43-387-17-CC
43,387,,18,1,24.0,150.0,288.70,288.94,290.20,, SILICIFIED CLAYSTONE," 5G4/1-DARK GREENISH GRAY, 5 G3/1-DARK GREENISH GRAY, 10Y4/2-GRAYISH OLIVE, 5GY6/ 1-GREENISH GRAY"," AT 24-46 CM LAMINATED MOTTLING THR OUGHOUT AND THIN LAMINATION IN FLAT PIECES IN 35 CM (MORE SOFT), 10Y4/2 HOMOGENOUS AT 46-77 GRADING TO C HERT AT 68-77 CM, THINLY LAMINATED AND MOTTLED AT 77 -96 CM, 10Y4/2 AT 113-116 CM SIMILAR TO 46-77 CM GRA DING TO CHERT AT 113-116 CM, 5G4/1 TO 5G3/1 THINLY L AMINATED AND MOTTLED AT 116-123 CM, 5GY6/1 CALCAREOU S MUD AT 123-126 CM 10Y4/2 AT 126-150 CM SIMILAR TO 46-77 CM GRADING T O CHERT AT 143-150 CM"," DRILLING BRECCIA AT 24-46 CM 70-96 CM 114-126 CM AND 146-150 CM, REST UNDISTURBE D",,,, 5G4/1 TO 5G3/1 AT 24-46 CM," HARD, SOFT AT 123-1 26 CM", 00000000,97a4dff62dabc4ba9e32be3ac8ec21f6,43-387-18-1
43,387,,18,CC,0.0,0.0,288.70,290.30,290.30,, SILICIFIED CLAYSTONE," 5G5/1-GREENISH GRAY, 5G4/1- DARK GREENISH GRAY, 5Y6/1-LIGHT OLIVE GRAY, 10Y5/2-G RAYISH OLIVE, 5Y4/1-OLIVE GRAY, 5Y3/1-OLIVE GRAY"," P IECE OF TOP OF CORE CATCHER AT 0-4 CM IS HOMOGENOUS ON TOP 10Y5/2 AT 0-1 CM THEN 5Y4/1 LAMINATED AT 1-3 CM THEN 5Y3/1 COARSE AT 3-4 CM, 5G5/1 TO 5G4/1 THINL Y MOTTLED CALCAREOUS SILICIFIED CLAYSTONE AT 4-10 CM", DRILLING BRECCIA,,,, 5Y6/1 AT 10-26 OF DIFFERENT FR AGMENTS IN DRILLING BRECCIA, HARD, 00000000,17d0ec17e979d958a55d19e4d9b90772,43-387-18-CC
43,387,,19,1,46.0,150.0,307.70,308.16,309.20,, CLAYSTONE," 5G6/1-GREENISH GRAY, 10Y4/2-GRAYISH OL IVE, 5G4/1-DARK GREENISH GRAY, 10Y3/2-GRAYISH OLIVE"," 5G6/1 AT 47-58 CM WITH BLACK STREAKS (BURROWED/MOT TLED) AND TRANSITIONAL LOWER CONTACT, 10Y4/2 AT 58-6 4 CM WITH DARK STREAKS MOTTLED, 10Y4/2 AT 64-95 ALMO ST HOMOGENOUS WITH RARE LARGE BURROWS, A MICRO-FAULT AT 95 CM WITH DISTINCT BASE CONTACT, 5G4/1 AT 95-97 CM SLIGHTLY LAMINATED AND BURROWED, 5G6/1 AT 97-101 CM WITH RARE STREAKS GRADING TO OLIVE GRAY WITH ABU NDANT SMALL MOTTLES AT 101-104 CM 10Y4/2 (OR 10Y3/2) AT 104-150 CM WITH RARE LARGE B URROWS ALMOST HOMOGENOUS", SLIGHTLY TO HIGHLY DISTUR BED,,,,, HARD, 00000000,e9ed6852fceb51dbd677904fb1d1ecce,43-387-19-1
43,387,,19,2,0.0,50.0,307.70,309.20,309.70,, CLAYSTONE, 10Y4/2-GREENISH OLIVE, RARE BURROWS, SLIGHTLY DISTURBED,,,,, HARD, 00000000,de8cdaa0d565f05c0b38b80826781ead,43-387-19-2
43,387,,19,2,50.0,65.0,307.70,309.70,309.85,, SILICIFIED SPONGE SPICULA MUDSTONE, 10Y4/2-GRAYIS H OLIVE, FAINTLY LAMINATED," SLIGHTLY DISTURBED AT 50-63 CM, BRECCIATED AT 63-65 CM, CONTACT DISTURBED BY DRILLING PROBABLY SHARP BASE",,,,, HARD, 00000000,35ee184e0dabe437957fc88d88186a4d,43-387-19-2
43,387,,19,2,65.0,150.0,307.70,309.85,310.70,, SILICIFIED CLAYSTONE," 5G6/1-GREENISH GRAY, 10Y4/2 -GRAYISH OLIVE, 5G4/1-DARK GREENISH GRAY, 5GY6/1-GRE ENISH GRAY, 5Y4/1-OLIVE GRAY, 5GY5/1-GREENISH GRAY"," 10Y4/2 AT 78-88 CM WITH UNDISTINCT LAMINATIONS, SHA RP BASE AT 90 CM AND 109 CM, 5G4/1 AND 5GY6/1 AT 88- 99 CM WITH STREAKS AND MOTTLES, 5Y4/1 AT 99-108 LAMI NATED IN UPPER PART, 5G4/1 AT 108-130 CM INTENSELY M OTTLED (BURROWED) WITH ABUNDANT DARK STREAKS, MORE U NIFORM AT 125-130 CM, RELATIVELY COARSER UNDISTINCT LAMINATIONS AT 140-145 CM DISTINCT NOT SHARP BASE OF UNIT OR BOUNDARY AT 145 CM CALC AREOUS AT 68-78 CM"," BRECCIATED AT 65-68 CM 76-90 CM AND 97-100 CM, SLIGHTLY DISTURBED AT 68-76 CM AND 90-97 CM, NO DIS TURBANCE TO BRECCIATED AT 100-150 CM",,,," 5G4/1 AT 66-6 8 CM, 5G6/1 AT 68-78 CM, 5GY5/1 AT 130-140 CM", HARD, 00000000,d9be7e354837b81c42c749a187281afa,43-387-19-2
43,387,,19,3,0.0,45.0,307.70,310.70,311.15,, CLAYSTONE," 5GY4/1-DARK GREENISH GRAY, 5GY5/1-GREE NISH GRAY, 5GY6/1-GREENISH GRAY"," 5GY4/1 AT 0-5 CM M OTTLED, 5GY5/1 FAINTLY LAMINATED AT 15-19 CM WITH SH ARP BASE, 5G4/1 MOTTLED AT 19-25 CM, 5GY6/1 TO 5GY5/ 1 AT 25-35 CM WITH RARE BURROWS IN THE UPPER PART, 5 GY5/1 AT 35-44 CM LAMINATED (DARK LAMINATIONS) COLOR CHANGE INSIDE OF THE LAMINATED LAYER AT 42 CM", BRE CCIATED AT 0-19 CM,,,," TRANSITIONAL LOWER BOUNDARY, VO ID AT 5-8 CM, HOMOGENOUS AT 8-15 CM", HARD, 00000000,3422653244ffc06cd996bb6e12097ad9,43-387-19-3
43,387,,19,3,45.0,103.0,307.70,311.15,311.73,, CLAYSTONE (SPONGE SPICULA CLAYSTONE ?), 5Y4/2-OLI VE GRAY," 5Y4/2 WITH THIN LIGHT STREAKS (PARALLEL TO THE BEDDING) THROUGHOUT THE LAYER (APPEARANCE OF SI LTY CLAY), SHARP BASE",,,,,, HARD, 00000000,37afae84d8cf4b0048c5498651d7f92c,43-387-19-3
43,387,,19,3,103.0,120.0,307.70,311.73,311.90,, CLAYSTONE," 5G4/1-DARK GREENISH GRAY, 5G5/1-GREENI SH GRAY"," 5G4/1 AT 103-111 CM WITH DARK STREAKS MOTT LED AND BURROWED, 5G5/1 WITH RARE BURROWS AT 111-120 CM", BRECCIATED,,,, TRANSITIONAL LOWER BOUNDARY, HAR D, 00000000,0a99094f60e70e90fc09e36af44b5de7,43-387-19-3
43,387,,19,3,120.0,150.0,307.70,311.90,312.20,, SPONGE SPICULA CLAYSTONE, 5Y4/2-OLIVE GRAY, UNDI STINCT LAMINATION,,,,,, HARD, 00000000,c591b535a24431c36d69e83cc2402d33,43-387-19-3
43,387,,19,CC,0.0,5.0,307.70,312.30,312.25,, SPICULA MUDSTONE," 5Y4/1-OLIVE GRAY, 5B5/1-BLUISH GRAY", LAMINATED, BRECCIATED*,,,," 5B5/1 AT 6-11 CM, 5Y4/1 AT 0-6 CM", VERY HARD,,40d695f4500a4af7ebccec998a8ab2a8,43-387-19-CC
43,387,,19,CC,5.0,10.0,307.70,312.25,312.30,, SILICIFIED CLAYSTONE," 5GY5/1-GREENISH GRAY, 5GY4/ 1-DARK GREENISH GRAY",, BRECCIATED,,,, 5GY5/1 WITH DARK ER 5GY4/1 LAYER AT 15-17 CM, VERY HARD (CHERT ?), 00000000,57e120e4814196bbeecb19058dbc32a3,43-387-19-CC
43,387,,20,1,37.0,150.0,326.70,327.07,328.20,, SILICIFIED CLAYSTONE," 5G6/1-GREENISH GRAY, 10GY7/ 2-PALE YELLOWISH GREEN, 10G6/2-PALE GREEN, 5G5/2-GRA YISH GREEN, 5GY6/1-GRAYISH GREEN, 5Y5/1-OLIVE GRAY, 5G3/2-GRAYISH OLIVE GREEN, 10GY6/2-GRAYISH GREEN, 10 GY5/2-GRAYISH GREEN"," 10G6/2 LAMINATED AT 65-73 CM, 5G5/2 MOTTLED AND BURROWED AT 80-88 CM, 5GY6/1 WITH RARE STREAKS AT 92-98 CM, 5G6/1 AT 98-111 CM WITH CO MMON STREAKS UNDISTINCTLY LAMINATED, 5G3/2 SILTY CLA YSTONE AT 130-135 CM FAINTLY LAMINATED (WITH DETRITA L MATERIAL)", SLIGHTLY DISTURBED AND BRECCIATED BRECCIATED AT 110-121 CM,,,," SHARP BASE AT 80 CM 117 CM 136 CM, DISTURBED BASE AT 55 CM, VOID ? CHERT ? AT 53-55 CM, 5G6/1 AT 37-55 CM, 10GY7/2 AT 73-80 CM, NO DISTINCT CHANGES IN TEXTURE, 5Y5/1 AT 110-115 CM , PROBABLY VOID AT 120-121 CM AND 128-130 CM (THE ME DIUM PART OF UNIT IS ABSENT), 10GY6/2 AT 136-138 CM, 10GY5/2 HOMOGENOUS AT 137-150 CM"," VERY HARD ON BAS E MORE SOFT ON TOP AT 37-55 CM, RELATIVELY HARDER BE LOW 80 CM, VERY HARD AT 110-115 CM, REST HARD", 00000000,4b78960d420011ffdc6c3e233598df06,43-387-20-1
43,387,,20,2,0.0,76.0,326.70,328.20,328.96,, SILICIFIED CLAYSTONE," 10GY5/2-GRAYISH GREEN, 5GY6 /1-GREENISH GRAY, 5G4/1-DARK GREENISH GRAY, 5GY5/1-G REENISH GRAY, 5G5/1-DARK GREENISH GRAY, 5GY4/1-DARK GREENISH GRAY"," 5GY6/1 CALCAREOUS ? AT 7-20 CM AND 3 2-37 CM, 5G4/1 BURROWED WITH DARK STREAKS AT 21-26 C M, 5GY5/1 SLIGHTLY BURROWED AT 40-44 CM",,,,," 10GY5/2 HO MOGENOUS AT 0-7 CM, SHARP BASE MARKED BY DARK GREEN BAND AT 7 CM, SHARP BASES AT 21 CM (DISTURBED ?) 33 CM AND 65 CM, 5GY5/1 AT 26-32 CM, 5G5/1 AT O7-40 CM, 5GY5/1 AT 44-60 CM 76-83 CM, 5GY4/1 AT 58-65 CM",, 00000000,294dd0577c95319a50c453d9cc173c80,43-387-20-2
43,387,,20,3,0.0,76.0,326.70,329.70,330.46,,,,,,,,," THE CORE COLOR CHANGES DUE TO MINOR COMPONENTS (CA LCIUM CARBONATE, DETRITAL ETC.) AND/OR IRON MANGANES E, NO DISTINCT TEXTURAL FEATURES", HARD, 00000000,1e39612095710561ae867d98383bad78,43-387-20-3
43,387,,20,3,76.0,100.0,326.70,330.46,330.70,, SILTY CLAYSTONE," 5GY5/1-GREENISH GRAY, 5G3/2-GRAY ISH OLIVE GREEN",, BRECCIATED AT 83-95 CM,,,," 5GY5/1 AT 73-95 CM, 5G3/2 AT 95-100 CM (SAME AS 128-132 CM IN SECTION 1)", HARD, 00000000,769467468cc195ae8e7e03252b31826b,43-387-20-3
43,387,,20,3,100.0,130.0,326.70,330.70,331.00,, SILICIFIED CLAYSTONE," 5GY4/1-DARK GREENISH GRAY, 5GY5/1-GREENISH GRAY", 5GY4/1 BURROWED AT 100-108 CM AND 128-130 CM,,,,," 5GY5/1 AT 110-128 CM, SUBUNITS ARE NOT CLEAR NO DISTINCT BASAL CONTACT", HARD, 00000000,05a24d6bee3a034c258a998275a0cc8d,43-387-20-3
43,387,,20,CC,0.0,0.0,326.70,331.30,331.30,, CLAYSTONE, 5GY6/1-GREENISH GRAY,, BRECCIATED,,,,, MO DERATELY HARD, 00000000,3f21c863a394261d4bcdaef1bbe6dd6c,43-387-20-CC
43,387,,21,1,23.0,132.0,345.70,345.93,347.02,, RAD MUDSTONE," 5GY5/1-GREENISH GRAY, 5GY4/1-DARK G REENISH GRAY, 5Y4/1-OLIVE GRAY, 5G4/1-DARK GREENISH GRAY -BLUISH"," 5GY4/1 LAMINATED ? AT 52-55 CM, 5GY5/1 BURROW ED/MOTTLED AT 60-66 CM, 5GY5/1 HOMOGNEOUS AT 69-95 C M GRADING DOWN TO UNDISTINCTLY LAMINATED, 95-115 CM GRADING DOWNWARD FROM 5GY5/1 TO 5Y4/1 UNDISTINCT LAM INATION AND SILT (SPICULA) INCREASING DOWNWARD, 5G4/ 1 AT 113-120 CM MOTTLED WITH ABUNDANT BLUISH DARK ST REAKS, 5G4/1 MOTTLED AT 120-123 CM", BRECCIATED AT 2 3-30 CM 55-67 CM AND 110-130 CM,,,," 5GY5/1 HOMOGENOUS AT 23-50 CM, RADS MORE ABUNDANT AT 95-115 CM, SHARP CONTACT AT 52 CM 115 CM", INDURA TED, 00000000,1d61236941961ce1073fb460308adffa,43-387-21-1
43,387,,21,1,132.0,150.0,345.70,347.02,347.20,, CLAYSTONE," 5GY6/1-GREENISH GRAY, 5GY5/1-GREENISH GRAY, 5GY4/1-DARK GREENISH GRAY"," 5GY4/1 AT 132-135 CM BURROWED AND MOTTLED, 5GY6/1 AT 135-150 CM BURROW ED WITH 5GY4/1 AT 135-140 CM", BRECCIATED AT 147-150 CM,,,, HOMOGENOUS AT 140-147 CM, INDURATED, 00000000,3ef93fa09609268379b3b7ad151a149f,43-387-21-1
43,387,,21,2,0.0,36.0,345.70,347.20,347.56,, RAD MUDSTONE," 5GY4/1-DARK GREENISH GRAY, 5GY5/1-G REENISH GRAY"," 5GY4/1 INTENSELY BURROWED (LIGHT MOTT LES) AT 0-7 CM, 5GY5/1 AT 7-10 CM BURROWED WITH 5GY4 /1, 5GY5/1 AT 10-36 CM WITH INCREASING OF RADS DOWNW ARD AND UNDISTINCT LAMINATION AT 26-36 CM",,,,, SHARP BA SE, INDURATED, 00000000,b16756f4f93cca04a4659a4261867828,43-387-21-2
43,387,,21,2,36.0,148.0,345.70,347.56,348.68,, CLAYSTONE," 5GY6/1-GREENISH GRAY, 5GY4/1-DARK GREE NISH GRAY, 5G6/1-GREENISH GRAY, 5Y4/1-DARK OLIVE GRA Y, 5G4/1-DARK GREENISH GRAY, -BLACK, 5GY5/1-GREENISH GRAY"," 5GY4/1 BURROWED/MOTTLED AT 36-38 CM, 5GY6/1 AT 38-43 CM, 5G6/1 AT 55-60 CM WITH RARE DARK BURROW S, 5GY6/1 AT 60-90 CM WITH BURROWS AT 60-65 CM AND B LACK STREAKS AT 60-80 CM AND VERY UNDISTINCT LAMINAT ION AT 80-90 CM, 5G4/1 AT 93-98 CM WITH BLACK STREAK S, 5GY6/1 (AS 60-90 CM) AT 98-121 CM WITH RARE BLACK PATCHES AND UNDISTINCT LAMINATIONS AT 118-121 CM 5G4/1 AT 127-148 CM INTENSELY BURROWED", BRECCIATE D AT 53-60 CM 87-97 CM AND 130-148 CM,,,," SHARP BASE A T 93 CM, DISTINCT BASE AT 126 CM, UNSHARP BOUNDARY A T 53 CM, 5Y4/1 AT 90-93 CM, 5GY5/1 AT 121-126 CM"," I NDURATED, HARDNESS INCREASES DOWNWARD", 00000000,ae86dca1a64f685eb47a8f237484fec0,43-387-21-2
43,387,,21,CC,0.0,0.0,345.70,348.80,348.80,, SILICIFIED CLAYSTONE," 5GY5/1-GREENISH GRAY, 5G4/1 -DARK GREENISH GRAY"," 5GY5/1 MOTTLED AT 0-9 CM, 5G4/ 1 AT 13-20 CM WITH DARK STREAKS BURROWED (CHERT ?)", BRECCIATED,,,,, VERY HARD, 33233000,2d02a18563e87a881bb1e5ca35ebc3e0,43-387-21-CC
43,387,,22,1,130.0,150.0,355.20,356.50,356.70,, RAD CLAYSTONE," 5YR6/1-LIGHT BROWNISH GRAY, 5YR4/4 -MODERATE BROWN, 5G6/1-GREENISH GRAY", SILICIFIED AT 138-150 CM, BRECCIATED,,,," 5YR6/1 AT 130-138 CM, 5YR 4/4 AT 138-142 CM AND 147-150 CM, 5G6/1 AT 142-147 C M, SHARP IRREGULAR CONTACT (MOTTLED) AT 142 CM, SHAR P CONTACT AT 147 CM"," RELATIVELY SOFT AT 130-138 CM, VERY HARD AT 138-150 CM", 33233000,535b65d6cdcb627db26ad92e26191093,43-387-22-1
43,387,,22,2,0.0,25.0,355.20,356.70,356.95,, RAD OOZE," 5Y4/4-OLIVE BROWN, -GREENISH GRAY, -BRO WN"," SILICIFIED AT 11 CM, GREENISH GRAY WITH MOTTLES OF BROWN AT 0-5 CM", ALL BRECCIATED EXCEPT 10-17 CM WHICH HAS NO DISTURBANCE,,,," DISTINCT BASE AT 10 CM, DISTURBED LOWER BOUNDARY, 5Y4/4 AT 5-25 CM", FIRM, 00000000,c5d01faaa5c500077dc0aa934bad8c80,43-387-22-2
43,387,,22,2,25.0,150.0,355.20,356.95,358.20,, RAD MUDSTONE," 5Y3/2-OLIVE GRAY, 10GY5/2-GRAYISH G REEN, -GREENISH GRAY, 10GY4/2-GRAYISH GREEN, 10GY6/2 -GRAYISH GREEN, -BROWN"," 10GY5/2 AT 55-79 CM GRADING DOWNWARD TO LAMINATED SILICIFIED FORAM RAD MUDSTONE AT 74-79 CM ALTERNATION OF DARKER (GREENISH GRAY) A ND LIGHTER LAMINA (FORAM AND RAD LAYERS ?), 10GY5/2 AT 86-98 CM SLIGHTLY LAMINATED AT .4-98 CM, 10GY4/2 MOTTLED/BURROWED AT 79-86 CM AND 98-102 CM, 10GY6/2 GRADING DOWNWARD TO 10GY5/2 (DARKER) AT 102-128 CM, FAINTLY LAMINATED COARSER AT 120-128 CM INTENSELY MOTTLED AND BURROWED WITH IRREGULAR PATC HES OF GRAYISH GREEN AND BROWN AT 128-150 CM", BRECC IATED AT 25-30 CM AND 44-55 CM,,,," DISTURBED BOUNDARY (BASE) AT 46 CM, SHARP ERODED BOUNDARY (BASE) AT 79 CM, DISTURBED BASE AT 128 CM, 5Y3/2 AT I5-48 CM", IN DURATED, 00000000,7dedd4e7a96068ba1af131a310868e55,43-387-22-2
43,387,,22,3,0.0,150.0,355.20,358.20,359.70,, RAD MUDSTONE," 5GY4/1-DARK GREENISH GRAY, 10GY5/2- GRAYISH GREEN, 5GY5/1-GREENISH GRAY"," 5GY4/1 BURROWE D AT 0-4 CM AND INTENSELY BURROWED AT 50-57 CM AND 9 0-128 CM (MOTTLED ALSO), SLIGHTLY LAMINATED AT 43-50 CM AND 91-95 CM, WELL DEVELOPED WITH DISTINCT BURRO WING AT 128-135 CM",,,,," DISTINCT BASE AT 50 CM, SHARP B ASE AT 95 CM, 10GY5/2 AT 4-50 CM AND 57-95 CM, 5GY5/ 1 AT 135-150 CM", INDURATED, 00000000,a3221ada6e7dab77154d9c02c1ebc029,43-387-22-3
43,387,,23,1,0.0,25.0,374.30,374.30,374.55,, PORCELLANITE," 5G7/1-LIGHT GREENISH GRAY, 5G5/2-GR EENISH GRAY", 5G5/2 MOTTLED PARTLY SILICIFIED INCREA SING UPWARDS AT 7-25 CM,,,,," 5G7/1 HOMOGENOUS AT 0-7 CM , BROKEN CONTACT AT 25 CM", HARD, 21230000,102cb354c4dd3f7b3980a504186023b1,43-387-23-1
43,387,,23,1,25.0,65.0,374.30,374.55,374.95,, CLAYSTONE," 5G7/1-LIGHT GREENISH GRAY, 5G5/2-GREEN ISH GRAY"," 5G5/2 MOTTLED PORCELLANITE AT 50-55 CM, 5 G5/2 MOTTLED AT 55-65 CM",,,,," 5G7/1 HOMOGENOUS AT 25-50 CM, BRECCIATED CONTACT AT 65 CM", INDURATED TO HARD, 33231000,1bbf2729585a3c554b51c395fc838850,43-387-23-1
43,387,,23,1,65.0,150.0,374.30,374.95,375.80,, CALCAREOUS CLAYSTONE," 5G7/1-LIGHT GREENISH GRAY, 5G5/2-GREENISH GRAY"," 5G5/2 MOTTLED AT 85-116 CM, MO TTLED AND BURROWED AT 65-70 CM AND 116-120 CM",,,,," 5G7/ 1 AT 65-85 CM AND 116-150 CM, IN WHOLE SECTION CLAYS TONE AT BOTTOM GRADES UPWARD TO PORCELLANITE AT TOP", INDURATED, 00000000,769caf7da859d65390dd990302f16272,43-387-23-1
43,387,,23,2,0.0,150.0,374.30,375.80,377.30,, SLIGHTLY SILICIFIED CLAYSTONE," 5G7/1-LIGHT GREENI SH GRAY, 5G5/2-GREENISH GRAY, 10GY6/2-GREENISH GRAY, 5GY4/2-GREENISH GRAY"," 5G5/2 MOTTLED AT 6-14 CM 46- 80 CM, 10GY6/2 AT 14-46 CM 80-115 CM AND 126-134 CM MOTTLED AT 14-20 CM AND LAMINATED AT 43-46 CM 131-13 4 CM, 5GY4/2 FAINTLY MOTTLED AT 115-126 CM AND 133-1 50 CM (VERY FAINTLY)"," SLIGHTLY DISTURBED AT 0-109 C M, BRECCIATED AT 109-121 CM, MODERATELY DISTURBED AT 121-150 CM",,,, 5G7/1 HOMOGENOUS AT 0-6 CM, INDURATED, 00000000,c2fb9676eb63e96f714b9753ea84b604,43-387-23-2
43,387,,23,3,0.0,150.0,374.30,377.30,378.80,, CLAYSTONE," 5G5/2-GREENISH GRAY, 10GY6/2-GREENISH GRAY, 5GY5/2-DUSKY YELLOW GREEN, 10Y6/2-PALE OLIVE, 5GY6/2-LIGHT YELLOWISH GREEN, 5Y5/2-LIGHT OLIVE BROW N, -LIGHT BROWNISH GREEN, -PALE BROWNISH GREEN, -WHI TE, -PALE GREENISH BROWN, -LIGHT GREENISH BROWN"," 5G 5/2 MOTTLED AT 0-23 CM, 10GY6/2 AT I3-33 CM MOTTLED AT 23-27 CM AND LAMINATED AT O1-33 CM, LIGHT BROWNIS H GREEN MOTTLED AT 33-43 CM, FAINT LAMINATION AND WH ITE (CALCAREOUS) SAND (FINE) SIZED GRAINS AT 54-56 C M WITH A DIP OF 18 DEGREES PALE BROWNISH GREEN MOTTLED AT K6-63 CM, 10Y6/2 AT 63-77 CM LAMINATED AT 75-77 CM, PALE GREENISH BROWN MOTTLED/BURROWED AT 77-85 CM, 5GY6/2 AT 85-93 CM LA MINATED AT 87-93 CM WITH LOWER CONTACT HAVING DIP OF 17 DEGREES, LIGHT GREENISH BROWN (NEAR 5Y5/2) MOTTL ED AT 93-103 CM GRADING DOWN TO HOMOGENOUS 10Y6/2 AT 103-117 CM, 10GYL/2 LAMINATED AT 117-120 CM",,,,," 5GY5/ 2 HOMOGENOUS AT 43-53 CM, ORGANIC CHEMISTRY SAMPLE T AKEN AT 120-150 CM", INDURATED, 00000000,b7c2e34c7cbc67306cd329ea0c54d1a9,43-387-23-3
43,387,,23,4,0.0,150.0,374.30,378.80,380.30,, CLAYSTONE," -BROWNISH GREEN, 10Y6/2-PALE OLIVE, 5G Y6/2-LIGHT YELLOW GREEN, 2.5YR4/6-RED, -REDDISH GREE N, 10Y5/2-LIGHT OLIVE"," BROWNISH GREEN MOTTLED/BURRO WED AT 12-24 CM AND 10-112 CM, 10Y6/2 AT I4-43 CM MO TTLED AT O9-43 CM AND LAMINATED AT 33-39 CM, BROWNIS H GREEN AT 106-112 CM GRADES DOWN TO 2.5YR4/6 AT 125 -130 CM LAMINATED, MOTTLED AT 112-125 CM, REDDISH GR EEN MOTTLED AT 130-140 CM"," SEVERELY DISTURBED, BREC CIATED AT 10-12 CM AND 20-22 CM",,,, 5GY5/2 FRAGMETNS O F HOMOGENOUS LUMPS AT 43-106 CM 10Y5/2 HOMOGENOUS AT 140-150 CM, INDURATED, 00000000,3620127a1e3e489e6ec932a54f649cbc,43-387-23-4
43,387,,23,5,0.0,150.0,374.30,380.30,381.80,, CLAYSTONE," 5GY6/2-GRAYISH YELLOW GREEN, -BLUE GRE EN  -GREENISH BROWNS, 5YR5/4-LIGHT BROWN, 10Y5/2-LIG HT OLIVE, 5GY5/2-DUSKY YELLOW GREEN, -BROWN, -GREEN"," 5GY6/2 AT 0-26 CM MOTTLED AT 22-26 CM, ASSORTED PI ECES IN GREENS (5GY6/2) AND GREENISH BROWNS MOTTLED AND HOMOGENOUS AT 26-71 CM, 5YR5/4 AT 71-81 CM MOTTL ED, 5GY6/2 AT 92-116 CM MOTTLED BURROWS OF 5YR5/4, 5 GY5/2 HOMOGENOUS AT 116-134 CM WITH LAMINATIONS AT 1 31-134 CM, BROWN/GREEN MOTTLED AT 134-140 CM, 5YR5/4 FAINTLY MOTTLED AT 140-146 CM",,,,," 10Y5/2 AT 81-92 CM, BROWN/GREENISH BROWN AT 146-15 0 CM", INDURATED, 00000000,bbfcb08f454be0b24bdb6ec2358556a6,43-387-23-5
43,387,,23,CC,0.0,0.0,374.30,381.90,381.90,, CLAYSTONE," 5G6/2-LIGHT GREENISH GRAY, 10Y5/2-LIGH T OLIVE, -BROWNISH GREEN"," 5G6/2 LAMINATED AT 0-6 CM , 10Y5/2 (BROWNISH GREEN) MOTTLED AT 6-14 CM",,,,,, INDUR ATED, 00000000,7724cf515d9326f25146911f7f46c6ff,43-387-23-CC
43,387,,24,1,54.0,150.0,393.30,393.84,394.80,, CLAYSTONE," 5G4/1-DARK GREENISH GRAY, 5G3/1-DARK G REENISH GRAY, 5Y2/1-OLIVE BLACK"," CYCLES OF INTENSEL Y MOTTLED 5G4/1 TO 5G3/1 AND SLIGHTLY TO MODERATELY MOTTLED 5Y2/1 WITH PYRITE, INTENSELY MOTTLED 5G4/1 T O 5G3/1 AT 54-64 CM 86-99 CM 103-111 CM 125-138 CM, 5Y2/1 APPROXIMATELY HOMOGENOUS (3 BURROWS) AT 64-86 CM, PART LAMINATED MODERATELY BURROW MOTTLED AT 99-1 04 CM, SLIGHTLY MOTTLED BUT LARGE BURROWS (7 MM DIAM ETER) AT 111-125 CM, SLIGHTLY MOTTLED 5Y2/1 AT 138-1 50 CM BURROW MOTTLE CUTTING BOUNDARY FILLED WITH OLIVE B LACK AT 86 CM"," BRECCIATED AT 54-58 CM, REST SLIGHTL Y DISTURBED",,,,, INDURATED, 00000000,5443497c14a4cfacb841f651e764acb2,43-387-24-1
43,387,,24,CC,0.0,0.0,393.30,394.90,394.90,, CLAYSTONE," 5Y2/1-OLIVE BLACK, -DARK GREENISH GRAY"," CONTINUATION OF CYCLES, INTENSELY MOTTLED AT 11-1 6 CM DARK GREENISH GRAY, 5Y2/1 AT 0-11 CM AND 16-20 CM SLIGHTLY MOTTLED (PYRITE)", SEVERELY DISTURBED,,,,, INDURATED, 00000000,7dcb3094f34049192550054d12534bb5,43-387-24-CC
43,387,,25,1,79.0,150.0,402.80,403.59,404.30,, CLAYSTONE," N3-DARK GRAY, 5G4/1-DARK GREENISH GRAY , -OLIVE BLACK", 5G4/1 INTENSELY MOTTLED AT 115-148 CM," SLIGHTLY DISTURBED, BRECCIATED AT 105-115 CM",,,," OLIVE BLACK AT 147-150 CM, N3 HOMOGENOUS AT 81-105 C M", INDURATED, 00000000,06257fdc37903cd6cbdb8ca2b6818f44,43-387-25-1
43,387,,25,2,0.0,150.0,402.80,404.30,405.80,, CLAYSTONE," 5YR2/1-BROWNISH BLACK, -DARK GREENISH GRAY, -GREEN, 5Y4/2-MODERATE OLIVE GRAY, 10Y4/1-DARK GRAYISH OLIVE"," CYCLES OF 5YR2/1 AND DARK GREENISH GRAY AT 0-104 CM, BURROW AT 11 CM, LAMINATED AT 18-2 0 CM 50-54 CM 78-82 CM AND 91-104 CM, BURROW CUT ACR OSS BOUNDARY AT 21 CM SOME 5YR2/1 BURROWED DOWN TO D ARK GREENISH GRAY, RARE BURROWS (3) AT 40 CM, BURROW ED BOUNDARY AT 55 CM ORIGINALLY SHARP, 5YR2/1 AT 60- 85 CM HOMOGENOUS BUT WITH 2 OR 3 WORM BURROWS, THIN GREEN LAMINATIONS CUT BY 2 WORM BURROWS AT 78-82CM MOTTLED AT 85-90 CM, SOME BURROWS IN LAMINATIONS A T 90-96 CM, BURROW MOTTLED AT 104-110 CM",,,,," 5YR2/1 AT 0-20 CM 35-55 CM 60-85 CM 96-104 CM, DARK GREENISH GRAY AT 20-35 CM 55-60 CM 85-96 CM, 5Y4/2 HOMOGENOUS AT 104-130 CM, 10Y4/1 HOMOGENOUS AT 130-150 CM", IN DURATED, 00000000,45ac360e7d095bf4b5e50be0440a156a,43-387-25-2
43,387,,25,3,0.0,150.0,402.80,405.80,407.30,, CLAYSTONE," N4-MEDIUM DARK GRAY, 5Y2/1-OLIVE BLACK , -DARK GREENISH GRAY, 10Y5/2-LIGHT OLIVE, 10Y4/2-GR AYISH OLIVE"," MOTTLED AT 34-35 CM, A FEW BURROWS AT 51-60 CM, BURROWED ZONE ? AT 88-92 CM"," SLIGHTLY DIS TURBED AT 0-33 CM, BRECCIATED AT O8-54 CM",,,," N4 HOMOG ENOUS AT 0-34 CM, DARK GREENISH GRAY AT O4-46 CM, 5Y 2/1 AT 46-51 CM, 10Y5/2 HOMOGENOUS AT 51-88 CM, 10Y4 /2 AT 88-150 CM HOMOGENOUS", INDURATED, 00000000,05814fb8048858164a22a126d22665fa,43-387-25-3
43,387,,25,CC,0.0,0.0,402.80,407.40,407.40,, CLAYSTONE, 10Y4/2-GRAYISH OLIVE, LAMINATED IN PL ACES, SEVERELY DISTURBED,,,, HOMOGENOUS, INDURATED, 00000000,e8196d180beeeca8d09c2425aa53a69f,43-387-25-CC
43,387,,26,1,0.0,150.0,412.20,412.20,413.70,, CLAYSTONE," 5Y2/1-OLIVE BLACK, 5GY4/1-DARK GREENIS H GRAY, 5GY5/1-MEDIUM GREENISH GRAY, N3-DARK GRAY"," 5Y2/1 VERY FAINTLY LAMINATED (THIN LAMINATIONS) AT 0 -28 CM, 5Y2/1 AT 28-41 CM AND 50-58 CM LAMINATED AT 50-58 CM AND 33-41 CM AND BURROWED AT 28-33 CM, 5GY4 /1 AT 41-50 CM HOMOGENOUS MOTTLED AT 41-43 CM, 5GY5/ 1 AT 58-97 CM THINLY LAMINATED AND MOTTLED BURROWED AT TOP MAXIMUM, N3 LAMINATED AT 147-150 CM", BRECCIA TED AT 140-147 CM,,,, N3 HOMOGENOUS AT 98-150 CM, IND URATED, 00000000,49393128790a3ab9823dfad1a524aa77,43-387-26-1
43,387,,26,2,0.0,135.0,412.20,413.70,415.05,, CLAYSTONE," 5Y2/1-OLIVE BLACK, -DARK GREENISH GRAY , 5G2/1-GREENISH BLACK, 5GY4/1-DARK GREENISH GRAY, 5 YR2/1-BROWNISH BLACK"," 5Y2/1 LAMINATED AT 0-6 CM AND 12-18 CM (MOTTLED), DARK GREENISH GRAY MOTTLED AT 6 -12 CM, 5GY4/1 AT 19-48 CM MOTTLED AT 19-24 CM AND L AMINATED WITH A FEW MOTTLES AT 31-48 CM",,,,," 5G2/1 AT 1 8-19 CM, 5YR2/1 HOMOGENOUS AT 48-118 CM, INTERSTITIA L WATER AND ORGANIC CHEMISTRY SAMPLE TAKEN AT 118-13 5 CM", INDURATED, 00000000,46aedcad7e35c06fa3c7e1798f235714,43-387-26-2
43,387,,26,3,0.0,150.0,412.20,415.20,416.70,, CLAYSTONE," 5GY4/1-DARK GREENISH GRAY, N3-DARK GRA Y"," 5GY4/1 WITH THIN LAMINATIONS AT 0-19 CM, N3 AT 1 9-65 CM WITH FAINT THIN LAMINATIONS, N3 FAINTLY MOTT LED AND BURROWED AT L9-150 CM",,,,, 5GY4/1 AT 65-69 CM, INDURATED, 00000000,603ae1d6c647c8a07770a6267a0096f3,43-387-26-3
43,387,,27,0,0.0,45.0,440.80,440.80,441.25,, CLAYSTONE, 5GY4/1-DARK GREENISH GRAY, DIFFUSE LA MINATIONS AT I5-45 CM,,,,, APPROXIMATELY HOMOGENOUS, I NDURATED, 00000000,12a0e45c6fc0692827e907c2e09f60ce,43-387-27-0
43,387,,27,1,0.0,111.0,440.80,441.25,442.36,, CLAYSTONE," 5GY4/1-DARK GREENISH GRAY, 5YR2/1-BROW NISH BLACK"," 5GY4/1 WITH DIFFUSE LAMINATIONS AT 0-60 CM, MOTTLED AT 20-23 CM, LAMINATED AND MOTTLED LAMI NAE OF COARSER SILTY MATERIAL AT 94-111 CM WITH MORE SILT AT BOTTOM",,,,, 5YR2/1 HOMOGENOUS AT L0-94 CM, IN DURATED, 00000000,117cee6e2be86e4649a983030798c0db,43-387-27-1
43,387,,27,1,111.0,150.0,440.80,442.36,442.75,, SILTY CLAYSTONE," 5G2/1-GREENISH BLACK, 5GY4/1-DAR K GREENISH GRAY"," 5G2/1 LAMINATED WITH LITTLE MOTTLI NG AT 111-131 CM WITH LESS SILT GRADING UPWARD, 5GY4 /1 AT 131-144 CM MOTTLED WITH DIFFUSE LAMINATIONS AT 133-144 CM, MOTTLED AT 144-146 CM, THINNER LAMINATI ONS AT 146-150 CM",,,,,, INDURATED, 00000000,8f37772ba0adbaf47f5d08fccc3069c1,43-387-27-1
