58,446,A,16,1,0.0,505.00,505.00,  506.50,"MARSH, N.",APHYRIC BASALT,"PCE 1A (1-13), 1B (13-15), 1C (15-17), 2 (18-22), 3A (24-33), 3B (27-35), 4 (37-48), 5 (50-61), 6 (62-66), 7 (68-72), 8 (74-77), 9 (79-85), 10 (87-93), 11 (95-97), 12A (99-109), 12B (108-115), 13 (117-121), 14 (123-128), 15 (132-135), 16 (137-143), 17 (145-149)","APHYRIC, FINE-GRAINED BASALT",CROSS CUTTING VEINS AND FRACTURES LINED BY DARK GREEN OR LIGHT OLIVE GREEN CLAYS + PYRITE + CARB,SLIGHTLY,BASALT IS DARK GRAY, comments : OCCASIONAL LARGE VESICLES LINED BY LIGHT GRAY OR LIGHT OLIVE GREEN CLAY OR FINE-GRAINED PYRITE AND CARBONATE,,,"CLAY comments :  DARK GREEN FILLS VEINS AND FRACTURES, LIGHT OLIVE GREEN FILLS VEINS AND FRACTURES AND LINES OCCASIONAL LARGE VESICLES, LIGHT GRAY LINES OCCASIONAL LARGE VESICLES | PYRITE comments :  FILLS VEINS AND FRACTURES, FINE-GRAINED LINES OCCASIONAL LARGE VESICLES | CARB comments :  FILLS VEINS AND FRACTURES AND LINES OCCASIONAL LARGE VESICLES",,
58,446,A,16,2,0.0,505.00,506.50,  507.67,"MARSH, N.",APHYRIC BASALTSIMILAR TO CORE 16-1,"PCE 1 (2-7), 2 (10-13), 3 (15-21), 4A (24-27), 4B (27-31), 5 (35-39), 6A (41-73), 6B (70-78), 6C (79-97), 7 (99-105), 8 (107-117)","APHYRIC, FINE-GRAINED, CHILL ZONE AND GLASSY MARGIN- GLASS (98-103CM) ALTERED TO BLUISH GRAY MATERIAL","CROSS CUTTING CALCITE VEINS AND DARK CLAY FILLED VEIN (<0.5MM WIDE), FRACTURE SURFACES COVERED BY GREENISH CLAY MATERIAL AND DARK BLACK MATERIAL-RARE PYRITE",FRESH,PCE 8 IS DRILLING RUBBLE | BASALT IS DARK GRAY COLOR,"    <0.5               CARB comments : LINES OR ZONES OF VESICLES CROSS CUT BASALT, ALTERATION ZONE OF GRAY CLAYEY MATERIAL IN ZONE",,,"CALCITE comments :  FILLS VEINS | CARB comments :  FILLS VESICLES | CLAY comments :  DARK - FILLS VEINS, GREENISH COVERS FRACTURE SURFACES | PYRITE comments :  RARE - COVERS FRACTURE SURFACES",,
58,446,A,16,2,118.0,505.00,507.68,  508.00,"MARSH, N.",SEDIMENT,,,,,,,,,,,
58,446,A,17,CC,0.0,514.50,518.29,  518.40,"MARSH, N.",SEDIMENT,,,,,,,,,,,
58,446,A,17,CC,21.0,514.50,518.40,  518.49,"MARSH, N.",APHYRIC BASALT,PCE 1 (22-29),"APHYRIC, FINE-GRAINED",,FRESH,BASALT IS DARK GRAY COLOR,"      10                                ROUNDED |  10-15X2                                PIPE |     10X8                                ANGULAR comments : TRIANGULAR CROSS SECTION IN SHAPE comments : SEVERAL LARGE VESICLES AT TOP OF PCE OFTEN PIPE- LIKE comments : VESICLES OFTEN LINED BY GRAY CLAY MATERIAL AND CARBONATE, LIGHT OLIVE GREEN CLAY IN SOME VESICLES, APPROX. 5% TOTAL VESICLES",,,"CLAY comments :  GRAY - LINES VESICLES, OLIVE GREEN ON OUTER SURFACE AND IN SOME VESICLES | PYRITE comments :  FOUND ON OUTER SURFACE AND IN SOME VESICLES",,
58,446,A,18,3,0.0,524.00,527.00,  527.20,"DICK, H.",BITS OF BAKED SEDIMENT + GLASSY BASALT,PCE 1 (2-19),,,SLIGHTLY TO MOD,,,,,,,
58,446,A,18,3,22.0,524.00,527.22,  528.35,"DICK, H.",APHYRIC BASALTMASSIVE BASALT,"PCE 2 (23-28), 3 (31-39), 4 (41-45), 5 (47-50), 6A (52-85), 6B (80-104), 6C (102-110), 6D (110-122), 6E (121-125), 7 (127-135)",APHYRIC,"MASSIVE, AMYGDULES",SLIGHTLY TO MOD,,"   2-3 5-15          CALCITE comments : 50% VESICLES 50% AMYGDULES, SOME ARAGONITE NEEDLES VISIBLE IN A FEW VUGS",,,CALCITE comments :  FILLS VESICLES AND AMYGDULES | ARAGONIT comments :  NEEDLES VISIBLE IN A FEW VUGS,,
58,446,A,18,4,0.0,524.00,528.50,  530.00,"DICK, H.",APHYRIC BASALTMASSIVE BASALT,"PCE 1 (1-15), 2 (17-25), 3 (30-34), 4 (37-43), 5 (45-50), 6 (51-55), 7 (58-67), 8 (68-72), 9 (74-78), 10 (81-90), 11 (91-108), 12 (110-118), 13 (120-131), 14A (133-142), 14B (143-150)",APHYRIC,"MASSIVE, FAR FEWER AMYGDULES THAN PREVIOUS SECTION",SLIGHTLY,,         5-10          CALCITE comments : PYRITE VISIBLE AS FREE CRYSTALS IN VESICLES comments : CHAINS OF VESICLES ORIENTED HORIZONTALLY,,,CALCITE comments :  FILLS VESICLES AND AMYGDULES | PYRITES comments :  VISIBLE AS FREE CRYSTALS IN VESICLES,,
58,446,A,18,5,0.0,524.00,530.00,  530.50,"DICK, H.",APHYRIC BASALTMASSIVE BASALT,"PCE 1 (1-13), 2 (17-26), 3 (27-38), 4 (41-50)","APHYRIC, FINE-GRAINED","MASSIVE, VEIN",SLIGHTLY,, .2-1  0-7,,,CALCITE | PYRITE | CHLORITE comments :  A LITTLE OF EACH VISIBLE ON VEIN SURFACE,,
58,446,A,19,1,0.0,533.50,533.50,  534.91,"DICK, H.",APHYRIC BASALTMASSIVE BASALT,"PCE 1 (0-4), 2A (7-40), 2B (35-48), 3A (52-73), 3B (73-95), 3C (95-125), 3D (125-140)","APHYRIC MASSIVE, FINE-GRAINED","SOME GREEN CLAY OR CHLORITE ON OCCASIONAL FRACTURE SURFACES, NO CARB FILLED VEINS",MOD,,          0-3          CALCITE,,,CALCITE comments :  IN VESICLES | CLAY comments :  CLAY OR CHLORITE FOUND ON FRACTURE SURFACES | CHLORITE comments :  CLAY OR CHLORITE ON FRACTURE SURFACES,,
58,446,A,19,2,0.0,533.50,535.00,  536.50,"DICK, H.",APHYRIC BASALTMASSIVE,"PCE 1A (0-15), 1B (16-77), 1C (77-97), 1D (92-98), 2 (100-109), 3A (110-116), 3B (115-121), 4 (123-131), 5A (133-145), 5B (145-150)","APHYRIC AND MASSIVE, FINE-GRAINED","CALCITE-FILLED AMYGDULES, A FEW CARB VEINS IN PCE 4",SLIGHT TO MOD,GRAY BASALT,    .2-2  0-7,,,CALCITE comments :  IN AMYGULES | CARB comments :  IN VEINS,,
58,446,A,19,3,10.0,533.50,536.60,  536.75,"DICK, H.",SEDIMENT,INTERVAL 10-25CM,,,,,,,,,,
58,446,A,19,3,0.0,533.50,536.50,  537.95,"DICK, H.",APHYRIC BASALTMASSIVE,"PCE 1 (0-10), 2 (28-35), 3 (37-42), 4 (45-48), 5 (52-58), 6 (60-65), 7 (67-75), 8 (76-80), 9 (81-89), 10A (90-99), 10B (100-105), 10C (105-109), 11 (110-114), 12A (115-121), 12B (121-126), 13A (127-136), 13B (135-144)","APHYRIC, GLASSY TO APHANITIC AND FINE-GRAINED MASSIVE PCES 2-13B, CHILL ZONE AT BOTTOM OF PCE 1, GLASSY CHILL ZONE TOP OF PCE 2, GLASSY IN PCE 1, GRAIN SIZE INCREASES DOWNWARD","PYRITES ON FRACTURE PCE 9, CARB VEINS PCES 10B+10C+12A+12B+13B, CLAY VEINS IN PCE 13A",SLIGHTLY PCE 2 | MODcomments: PCE 1 AND PCES 3-13B,,"   .2-.5   10 comments : PCE 1, BUT ABSENT FROM GLASSY ZONE |     .5-1  1-2          CLAY,SULFIDE comments : PCES 2-13B |                        PYRITE,PYRRHOT comments : IN PCE 12A",, comments : APHANITIC,CARB comments :  IN VEINS | CLAY comments :  IN VEINS PCE 13A | PYRITE comments :  IN VESICLES AND ON FRACTURE ON PCE 9 | PYRRHOT comments :  IN VESICLES PCE 12A,,
58,446,A,19,4,0.0,533.50,538.00,  538.20,"DICK, H.",APHYRIC BASALTMASSIVE,"PCE 1 (0-10), 2 (12-20)","APHYRIC, MASSIVE, FINE-GRAINED","CARB VEINS AND CLAY VEINS (TWO GENERATIONS) PCE 1, CARB VEIN ON FRACTURE PCE 2",SLIGHTLY,, 0.5-1.0    1          CLAY comments : AMYGDULES,,,CLAY comments :  IN AMYGDULES | CARB comments :  IN VEINS | CLAY comments :  IN VEINS,,
58,446,A,20,1,0.0,543.00,543.00,  544.50,"NISTERENKO, G.",APHYRIC BASALT,"PCE 1 (0-3), 2A (4-14), 2B (15-19), 3A (20-25), 3B (26-30), 4 (32-35), 5A (37-46), 5B (47-53), 6 (55-58), 7 (60-67), 8 (70-74), 9A (75-97), 9B (97-113), 9C (113-125), 9D (125-134), 9E (135-145), 9F (145-147), 9G (147-149)","APHYRIC, FINE-GRAINED",NUMEROUS CALCITE VEINS (1-2MM) WITH CHLORITE AND PYR MOD,,DARK GRAY BASALT,"      <2  3-5          CALC,CHLOR,PYR comments : VESICULAR",,,CALCITE | CHLOR | PYR comments :  ALL THREE FOUND IN VESICLES AND VEINS,,
58,446,A,20,2,0.0,543.00,544.50,  545.87,"NISTERENKO, G.",APHYRIC BASALT,"PCE 1 (0-15), 2 (17-29), 3 (30-35), 4 (37-40), 5 (42-47), 6A (50-60), 6B (60-65), 7 (67-75), 8 (76-79), 9 (81-90), 10 (93-97), 11 (97-102), 12 (103-107), 13 (110-116), 14 (118-125), 15 (126-131), 16 (133-136)","APHYRIC, FINE-GRAINED",,SLIGHTLY PCES 4+5+6A+6B+ 11-16 | FRESH PCES 1-3 AND 7-10,"DARK GRAY BASALT PCES 1-3, REST IS GRAY BASALT","      <1    3          CALC,CHLOR,PYR comments : PCES 1+2+3 |       <1 comments : PCES 3-16",,,CALCITE | CHLORITE | PYRITE comments :  ALL 3 MINERALS FILL VESICLES,,
58,446,A,20,3,0.0,543.00,546.00,  547.50,"NISTERENKO, G.",APHYRIC BASALT,"PCE 1A (0-20), 1B (22-35), 1C (36-54), 1D (55-80), 2 (82-88), 3 (90-97), 4 (99-104), 5 (105-109), 6 (110-113), 7 (115-125), 8 (127-130), 9 (133-147)","APHYRIC, FINE-GRAINED, VESICULAR FROM 0-80CM",CALCITE VEIN WITH CHLORITE AND PYRITE IN 115-150CM,SLIGHTLYcomments: CHLORITIZATION OF SECTION,"DARK GRAY FROM 0-80CM, GRAY BASALT FROM 80-150CM","      <2    1          CALCITE,ZEOL comments : PRESENCE OF ZEOLITE NOT CERTAIN, VESICLES FOUND FROM 0-80CM",,,"CALCITE comments :  FILLS VEIN AND VESICLES | CHLORITE comments :  FILLS VEIN | PYRITE comments :  FILLS VEIN | ZEOLITE comments :  ID UNCERTAIN, IF PRESENT THEN FOUND IN VESICLES",,
58,446,A,20,4,0.0,543.00,547.50,  548.44,"NISTERENKO, G.",APHYRIC BASALT,"PCE 1 (0-15), 2 (16-30), 3 (32-51), 4 (53-57), 5 (61-66), 7A (73-81), 7B (80-93)","APHYRIC, FINE-GRAINED BUT COARSER THAN BEFORE",,MOD,DARK GRAY (GREENISH) BASALT,,,,CHLORITE comments :  CHLORITIZATION OF SECTION,,
58,446,A,21,1,0.0,552.50,552.50,  553.91,"NISTERENKO, G.",APHYRIC BASALT,"PCE 1A (0-24), 1B (25-30), 1C (30-51), 2 (53-58), 3A (62-72), 3B (73-78), 3C (79-91), 4A (93-105), 4B (105-112), 5 (115-129), 6 (130-140)","APHYRIC, FINE-GRAINED, CHILL ZONE (TOP OF THE NEXT LAVA FLOW) FROM 50-65CM","CALCITE VEIN WITH CHLORITE AND PYRITE FOUND IN INTERVAL 65-140C, SLIGHTLY",,,     <.5  <<1 comments : IN INTERVAL 65-140CM,,,CALCITE | CHLORITE | PYRITE comments :  ALL 3 MINERALS FOUND IN VEIN,,
58,446,A,21,2,0.0,552.50,554.00,  555.50,"NISTERENKO, G.",APHYRIC BASALT,"PCE 1 (0-11), 2 (13-21), 3 (23-28), 4 (30-40), 5 (42-53), 6 (55-60), 7 (62-67), 8A (70-80), 8B (81-107), 9A (110-125), 9B (125-150)","APHYRIC, FINE-GRAINED",VEINS THROUGHOUT SECTION,MOD,,,,,,,
58,446,A,21,3,0.0,552.50,555.50,  556.90,"NISTERENKO, G.",APHYRIC BASALT,"PCE 1A (0-10), 1B (10-20), 2 (22-34), 3 (35-46), 4A (47-60), 4B (60-67), 5A (70-85), 5B (85-100), 6 (101-115), 7 (117-121), 8 (124-140)","APHYRIC, FINE-GRAINED, VESICULAR",,SLIGHTLY ALMOST FRESH,GRAY BASALT,      <110-15 comments : UNFILLED,,,,,
58,446,A,21,4,0.0,552.50,557.00,  558.50,"NISTERENKO, G.",APHYRIC BASALT,"PCE 1 (0-18), 2A (20-30), 2B (30-36), 2C (37-55), 3A (57-72), 3B (73-92), 3C (93-103), 4 (105-114), 5 (115-130), 6 (134-148)","APHYRIC, FINE-GRAINED, VESICULAR",,SLIGHTLY PCES 1+3A+3B+3C+4+5+6 | MOD,GRAY BASALT,      <110-15 comments : UNFILLED,,,,,
58,446,A,21,5,0.0,552.50,558.50,  560.00,"NISTERENKO, G.",APHYRIC BASALT,"PCE 1 (0-14), 2A (15-29), 2B (30-37), 3 (40-43), 4A (45-61), 4B (62-70), 4C (70-90), 5 (91-99), 6 (100-109), 7 (115-120), 8 (123-126), 9 (129-147)","APHYRIC, FINE-GRAINED (COARSER THAN BEFORE 50-110CM) ",,SLIGHTLY,GRAY BASALT,"      <1   10          CALC,CHLOR,PYR comments : VESICULAR",,,CALCITE | PYR | CHLORITE comments :  ALL THREE FOUND IN VESICLES,,
58,446,A,21,6,0.0,552.50,560.00,  561.02,"NISTERENKO, G.",APHYRIC BASALT,"PCE 1A (0-7), 1B (10-25), 2 (27-35), 3 (37-40), 4A (41-44), 4B (45-59), 5 (61-65), 6 (67-77), 7 (80-87), 8 (90-94), 9 (97-100)","APHYRIC, FINE-GRAINED, BOTTOM OF LAVA FLOW FROM 0-67CM, TOP OF NEXT LAVA FLOW 67-78CM ALSO CHILL ZONE (GLASS) IN THIS INTERVAL",,SLIGHTLY PCES 6+7 | FRESH PCES 1-5 AND 8+9,"DENSE PCE 7, GRAY BASALT PCES 1-5, DARK PCE 6, DARK GRAY BASALT PCES 7+8+9 | FROM 0-67CM SAME FLOW AS CORE 21-5, FROM 67-78 TOP OF NEXT LAVA FLOW, FROM 78-88CM FINE-GRAINED (APHANITIC) DARK DENSE BASALT, FROM 88-101CM FINE-GRAINED DARK GRAY FRESH BASALT",,, comments : APHANITIC FROM 78-88CM,,,
58,446,A,22,1,0.0,562.00,562.00,  562.35,"MARSH, N.",PLAG SPARSELY PHYRIC BASALT,"PCE 1 (0-5), 2 (7-10), 3A (11-19), 3B (20-26), 3C (24-30), 4 (31-34)","PLAG SPARSELY PHYRIC, NO EVIDENCE OF CHILL ZONE ABOVE OR BELOW SEDIMENT, FINE-GRAINED",CROSS CUTTING CHLORITIC AND ZEOL-LINED VEINS AND FRACTURES (DARK CLAY),SLIGHTLY,DARK GRAY BASALT,"      .5    1          CLAY,PYR OR ZEOL comments : VESICLES FILLED BY DARK CLAY, PYRITE OR ZEOL",PLAG     <1-1       2-3,,"CLAY comments :  IN VESICLES | PYR comments :  ID UNCERTAIN, POSSIBLY IN VESICLES | ZEOL comments :  ID UNCERTAIN, POSSIBLY IN VESICLES, PRESENT IN VEINS | CHLORITE comments :  IN VEINS",,
58,446,A,22,1,35.0,562.00,562.35,  563.25,"MARSH, N.","SEDIMENTCLAYSTONE, SANDY MUDSTONE AND VOLCANIC ASH SEDIMENTS",,,,,NO IMMEDIATELY OBVIOUS SIGNS OF BAKING,,,,,,
58,446,A,22,1,126.0,562.00,563.26,  563.50,"MARSH, N.",APHYRIC BASALT,"PCE 6 (127-132), 7 (134-150)","APHYRIC, FINE-GRAINED, NO EVIDENCE OF CHILL MARGIN ABOVE OR BELOW SEDIMENT",,SLIGHTLY,LIGHT GRAY BASALT,    .5-2               CLAY comments : VESICLES LINED BY GREEN CLAY (OVERLYING ZEOLS ?),,,"CLAY comments :  GREEN CLAY LINES VESICLES | ZEOL comments :  ID UNCERTAIN, POSSIBLY UNDERLYING CLAY",,
58,446,A,22,2,0.0,562.00,563.50,  565.00,"MARSH, N.",APHYRIC BASALT,"PCE 1A (0-3), 1B (3-6), 2 (7-19), 3 (21-24), 4A (26-36), 4B (37-40), 4C (40-47), 5 (49-59), 6 (62-64), 7 (65-83), 8 (85-95), 9 (97-107), 10 (108-113), 11 (115-118), 12 (120-127), 13A (130-137), 13B (140-145), 13C (145-150)","APHYRIC, FINE TO MEDIUM-GRAINED",FRACTURE SURFACES WITH CHLORITIC LINING WITH ODD PYRITE GRAIN BETWEEN PCES 4A+4B 13A+13B+13C AND ON PCES 2+12,SLIGHTLY,LIGHT GRAY BASALT,"    .5-1  1-2          CLAY,PYR,ZEOL comments : OCCASIONALLY 2MM ACROSS, VESICLES OCCUR MAINLY BETWEEN 15-70CM AND ARE LINED BY GREEN CLAY comments : OCCASIONAL PYRITE AND ZEOLITE",PLAG              1.5-2 comments : ODD PLAG PHENO,,ZEOL comments :  IN VESICLES | PYRITE comments :  IN FRACTURES AND VESICLES | CLAY comments :  IN VESICLES,,
58,446,A,22,3,0.0,562.00,565.00,  566.50,"MARSH, N.",APHYRIC BASALT,"PCE 1 (0-7), 2A (10-16), 2B (16-23), 2C (23-32), 2D (33-51), 2E (52-60), 3A (63-85), 3B (85-102), 4 (103-110), 5 (111-116), 6 (119-125), 7A (125-134), 7B (135-145), 8 (145-150)","APHYRIC, MEDIUM-GRAINED","CROSS CUTTING CHLORITIC/CLAY (GREYISH AND GREENISH)- LINED VEINS FROM .5-2MM WIDE, ALSO LINES FRACTURES, PYRITE VISIBLE ON FRACTURE SURFACES",SLIGHTLY,LIGHT GRAY BASALT,, comments : PLAG AND PYX DISCERNABLE UNDER BINOCULARMICROSCOPE <.5-1MM,,PYRITE comments :  ON FRACTURES | CLAY comments :  CLAY IS CHLORITIC FOUND IN VEINS AND FRACTURES,,
58,446,A,22,4,0.0,562.00,566.50,  567.56,"MARSH, N.",APHYRIC BASALT,"PCE 1A (0-29), 1B (30-43), 1C (43-51), 1D (51-61), 1E (61-76), 1F (76-87), 1G (87-105)","APHYRIC, MEDIUM TO FINE-GRAINED",CROSS CUTTING CHLORITIC AND PYRITE-LINED FRACTURES AND VEINS,SLIGHTLY,LIGHT GRAY BASALT,,,,PYRITE | CHLORITE comments :  BOTH LINE VEINS AND FRACTURES,,
58,446,A,23,1,0.0,571.50,571.50,  572.67,"MARSH, N.",SEDIMENTMUDSTONE AND CLAYSTONE,,,,,,,,,,,
58,446,A,23,1,117.0,571.50,572.67,  573.00,"MARSH, N.",APHYRIC BASALT,"PCE 1 (117-125), 2 (126-133), 3 (135-150)","APHYRIC, APHANITIC TO FINE-GRAINED",ODD CROSS CUTTING CARB-LINED VEIN,SLIGHTLY,LIGHT GRAY BASALT," comments : CARBONATE FILLED AMYGDULES OR LINED BY LIGHT OLIVE GREEN CLAY (SMEC?) PCES 2+3, TWO LARGE VUGS INFILLED BY CARB ONE 20MM X 5MM, OTHER 8MM X 3MM PCE 3 |             1 comments : PCES 2+3",,,"CARB comments :  IN VEINS, VUGS + AMYGDULES | CLAY comments :  OLIVE GREEN CLAY (SMEC?) LINING AMYGDULES",,
58,446,A,23,2,0.0,571.50,573.00,  574.27,"MARSH, N.",APHYRIC BASALT,"PCE 1A (0-17), 1B (17-24), 1C (25-50), 2A (52-72), 2B (73-87), 2C (87-99), 2D (99-126)","APHYRIC, FINE-GRAINED","CROSS CUTTING CALCITE OR CHLORITIC AND PYRITE-LINED VEINS,CHLORITIC VEIN WITH 2MM WIDE ALTERATION ZONE I 97-103CM",SLIGHTLY,GRAY BASALT," comments : LARGE VUG 25X40MM FILLED BY CARB (CONTINUES FROM OUTER SURFACE TO INNER ?) BETWEEN PCES 1B+1C,LARGE VUG 17X10MM FILLED WITH CARB PCE 2B,SOME OTHER VUGS FROM 5-10MM |     .5-1               CARB,CLAY comments : OCCASIONAL VESICLES USUALLY FILLED BY CARB OR LINED BY LIGHT OLIVE GREEN CLAY (SMEC)",,,CARB comments :  IN VESICLES AND VUGS | CLAY comments :  (SMEC) IN VESICLES | CHLORITE comments :  IN VEINS | CALCITE comments :  IN CROSS CUTTING VEINS | PYRITE comments :  IN CROSS CUTTING VEINS,,
58,446,A,23,3,0.0,571.50,574.50,  575.90,"DICK, H.",APHYRIC BASALT,"PCE 1A (0-30), 1B (30-45), 1C (46-64), 2A (65-76), 2B (75-85), 3A (86-91), 3B (91-105), 3C (105-124), 3D (125-131), 3E (131-140)","APHYRIC, FINE-GRAINED",A FEW CARB-FILLED VEINS HAVE CAUSED THE CORE TO SPLIT LENGTHWISE IN PCE 3C,SLIGHTLY TO MOD,,           <1          CALCITE,,,CALCITE comments :  IN AMYGDULES | CARB comments :  IN VEINS,,
58,446,A,23,4,0.0,571.50,576.00,  577.45,"DICK, H.",APHYRIC BASALTMASSIVE,"PCE 1A (0-21), 1B (20-35), 2 (37-53), 3A (55-59), 3B (60-71), 3C (73-85), 4 (86-104), 5A (106-120), 5B (120-144)","APHYRIC, FINE-GRAINED","THICK CALCITE (1MM OR LESS) CLAY AND PYRITE-FILLED VEINS, CARB VEINS IN PCES 1A+1B, CLAY + CARB + PYR VEIN IN PCE 5B",SLIGHTLY TO MOD,,           <1          CALCITE,,,CALCITE comments :  IN VEINS AND VESICLES | CARB comments :  IN VEINS | PYRITE comments :  IN VEINS,,
58,446,A,23,5,0.0,571.50,577.50,  578.92,"DICK, H.",APHYRIC BASALTMASSIVE,"PCE 1A (0-23), 1B (24-29), 2A (31-45), 2B (45-55), 3 (57-77), 4 (80-90), 5 (92-100), 6 (103-120), 7 (121-135), 8 (135-140)","APHYRIC, MASSIVE, FINE-GRAINED, NO CHILL ZONE",,SLIGHTLY TO MOD,,           <1          CLAY,,,CLAY comments :  FILLS AMYGDULES,,
58,446,A,23,6,0.0,571.50,579.00,  580.41,"DICK, H.",APHYRIC BASALT (?)MASSIVE,"PCE 1 (0-10), 2 (11-25), 3 (27-32), 4 (35-40), 5 (42-53), 6 (55-61), 7A (63-76), 7B (77-88), 7C (89-122), 7D (123-130), 7E (130-140)","APHYRIC, MASSIVE",,SLIGHTLY TO MOD,"THE ROCK APPEARS QUITE LEUCOCRATIC COMPARED TO MOST BASALTS, BUT THERE APPEARS TO BE NO BREAK BETWEEN IT AND THE MORE BASALTIC MATERIAL IN ABOVE SECTIONS 1-5, MAFICS PRESENT IN GRAIN MOUNT BUT LACK CLEAVAGE AND COULD BE EPIDOTE, THIS MAY BE SIMPLY A HIGHLY ALTERED BASALT, FINAL DETERMINATION AWAITS THIN SECTION",          <<1 comments : VIRTUALLY ABSENT,,PLAG comments : GRAIN MOUNT INDICATES THAT PLAG IS AROUND AN55-AN65M HOWEVER QTZ IS PRESENT | QUARTZ,,,
58,446,A,24,1,0.0,581.00,581.00,  581.22,"DICK, H.",PLAG PHYRIC BASALT,"PCE 1 (0-5), 2A (7-17), 2B (17-21)","PLAG PHYRIC, GLASSY RIND PCE 1",,SLIGHTLY,,                       CLAY,PLAG      3-4      .5-2 comments : PLAG LATHS IN GLASSY ZONE,OL comments : POSSIBLE RELICT OL,CLAY     RARE comments :  FILLING AMYGDULES,,
58,446,A,24,1,23.0,581.00,581.23,  581.32,"DICK, H.",CLAYSTONE,,,,,,,,,,,
58,446,A,24,1,34.0,581.00,581.34,  581.64,"DICK, H.",PLAG PHYRIC BASALT,"PCE 3 (34-56), 4 (57-64)","PLAG PHYRIC, CHILL ZONE PCE 3",,SLIGHTLY,,                       CLAY,PLAG      3-4      .5-2,,CLAY     RARE comments :  FILLS AMYGDULES,,
58,446,A,24,1,65.0,581.00,581.65,  582.45,"DICK, H.",SEDIMENT,,,,,"BAKED APPEARANCE AND BRICK-LIKE HARDNESS, GOES FROM BROWN TO GREEN",,,,,,
58,446,A,24,2,0.0,581.00,582.50,  583.30,"DICK, H.",SEDIMENT,,,,,NOTICEABLY HARDER NEAR BASALT,,,,,,
58,446,A,24,2,80.0,581.00,583.30,  583.95,"DICK, H.",MASSIVE APHYRIC BASALT,"PCE 1 (83-87), 2 (90-102), 3 (105-115), 4A (117-127), 4B (127-140), 4C (140-144)","MASSIVE APHYRIC, FINE-GRAINED, COARSENS DOWNWARDS, CHILL ZONE PCE 1",,SLIGHT TO MOD,,,,,,,
58,446,A,24,3,0.0,581.00,584.00,  585.10,"DICK, H.",APHYRIC BASALT,"PCE 1A (0-12), 1B (12-20), 1C (17-30), 2 (33-47), 3A (41-45), 3B (45-50), 3C (50-57), 4A (60-63), 4B (62-77), 4C (78-90), 5 (92-95), 6 (97-103), 7 (105-110)","APHYRIC, FINE-GRAINED",,SLIGHTLY,,"    .2-4 0-30          CALC,CLAY comments : VESICLES FILLED IN ALL EXCEPT PCES 5+6+7 WHICH ARE EMPTY, NOTE HORIZONTAL ORIENTATION OF SOME CHAINS OF VESICLES",,,CALCITE comments :  FILLS VESICLES | CLAY comments :  FILLS VESICLES,,
58,446,A,24,4,0.0,581.00,585.50,  586.55,"DICK, H.",MASSIVE APHYRIC BASALT,"PCE 1A (0-10), 1B (10-30), 1C (30-42), 1D (43-64), 1E (65-76), 2A (78-86), 2B (86-97), 2C (95-104)","MASSIVE APHYRIC, FINE-GRAINED FOR ALL PCES EXCEPT FOR PCE 2C WHICH ABRUPTLY BECOMES MEDIUM-GRAINED",,FRESH,,                       CLAY |            10 comments : IN TOP 1.5CM OF PCE 1A ONLY,,,CLAY comments :  FILLS AMYGDULES,,
58,446,A,25,1,0.0,590.50,590.50,  591.90,"NISTERENKO, G.",APHYRIC BASALT,"PCE 1A (1-20), 1B (20-46), 1C (47-50), 2 (51-71), 3 (74-104), 4A (105-120), 4B (120-140)","APHYRIC, FINE-GRAINED",,MOD,DARK GRAY BASALT,     2-3  1-2          CALCITE comments : FILLED WITH CALCITE FROM 0-80CM |      2-3  1-2          CHLORITE comments : FILLED WITH CHLORITE FROM 80-140CM, comments : UPPER ONE-THIRD APPEARS TO HAVE APPROX. 5%RELICT PHENOS POSSIBLY AFTER OL AS SUGGESTED BYEUHEDRAL OUTLINES WITH EXPANSION CRACKS ININ ALTERATION PRODUCTS,,CALCITE comments :  IN VESICLES | CHLORITE comments :  IN VESICLES,,
58,446,A,25,2,0.0,590.50,592.00,  593.35,"NISTERENKO, G.",APHYRIC BASALTSIMILAR TO CORE 25-1,"PCE 1A (0-42), 1B (44-55), 1C (56-72), 1D (73-94), 1E (95-115), 1F (116-135)","APHYRIC, FINE-GRAINED",,MOD PCE 1A | SLIGHTLY PCES 1B+1C+1D+1G+1F,"GRAY BASALT PCE 1A, DARK GRAY BASALT ALL OTHERS, NEW FLOW AT 40CM","      <2   <1          CHLORITE,CALCITE comments : PCE 1A |             0 comments : PCES 1B+1C+1D+1E+1F, NEW FLOW",,,CALCITE comments :  IN VESICLES | CHLORITE comments :  IN VESICLES,,
58,446,A,25,3,0.0,590.50,593.50,  594.37,"NISTERENKO, G.",APHYRIC BASALT,"PCE 1A (0-27), 1B (28-46), 1C (47-71), 1D (72-86)","APHYRIC, FINE-GRAINED",,FRESH,DARK BASALT,,,,,,
58,446,A,25,3,87.0,590.50,594.37,  595.00,"NISTERENKO, G.",SEDIMENT,,,,,,,,,,,
58,446,A,26,1,0.0,600.00,600.00,  600.05,"NISTERENKO, G.",SEDIMENT,,,,,,,,,,,
58,446,A,26,1,5.0,600.00,600.05,  601.45,"NISTERENKO, G.",APHYRIC BASALT,"PCE 1A (7-20), 1B (21-35), 2 (37-61), 3A (63-77), 3B (78-85), 3C (85-94), 4 (95-97), 5A (100-110), 5B (110-119), 6 (120-128), 7 (130-134), 8 (135-137), 9 (140-144)","APHYRIC, FINE-GRAINED",,SLIGHTLY,GRAY BASALT,"      <2  5-7 comments : VESICLES IN PCES 3A+3B+3C+4 |       <1    1          CALC,CHLORITE comments : VESICLES THROUGHOUT SECTION",,,CHLORITE comments :  IN VESICLES | CALCITE comments :  IN VESICLES,,
58,446,A,26,2,0.0,600.00,601.50,  602.95,"NISTERENKO, G.",APHYRIC BASALT,"PCE 1A (0-10), 1B (10-17), 2 (20-23), 3 (25-33), 4 (35-44), 5A (46-54), 5B (55-58), 5C (59-72), 6A (74-82), 6B (83-87), 7 (90-100), 8 (102-110), 9A (113-121), 9B (120-127), 10 (130-138), 11 (140-144)","APHYRIC, FINE-GRAINED",VEIN FILLED WITH CALCITE AND CHLORITE,SLIGHTLY A LITTLE FRESHER THAN SECTION BEFORE,,      <1   <1          CHLORITE,,,CALCITE comments :  IN VEIN | CHLORITE comments :  IN VEIN AND VESICLES,,
58,446,A,26,3,0.0,600.00,603.00,  603.55,"NISTERENKO, G.",APHYRIC BASALT,"PCE 1 (0-14), 2 (15-18), 3 (20-28), 4A (30-32), 4B (33-42), 4C (43-52), 4D (52-55)","APHYRIC, FINE-GRAINED",,SLIGHTLY,,,,,,,
58,446,A,26,3,55.0,600.00,603.55,  604.07,"NISTERENKO, G.",SEDIMENT,,,,,,,,,,,
58,446,A,26,3,107.0,600.00,604.07,  604.50,"NISTERENKO, G.",APHYRIC BASALT,"PCE 5 (108-111), 6 (114-117), 7A (120-124), 7B (123-134), 7C (135-148)","APHYRIC, FINE-GRAINED",,SLIGHTLY,"NEXT LAVA FLOW BEGINS ON THIS INTERVAL, DARK GRAY BASALT, 0-55CM SIMILAR TO CORE 26-2","      <2    1          CALC,CHLORITE comments : FOR INTERVAL 107-150",,,CALCITE comments :  IN VESICLES | CHLORITE comments :  IN VESICLES,,
58,446,A,26,4,0.0,600.00,604.50,  604.94,"NISTERENKO, G.",APHYRIC BASALT,"PCE 1A (0-11), 1B (11-23), 1C (23-26), 2A (27-32), 2B (33-43)","APHYRIC, FINE-GRAINED, CHILL ZONE IN PCES 2A+2B, GLASS IN PCE 2A, FINE-GRAINED TO APHANITIC IN PCE 2A, NEXT LAVA FLOW BEGINS WITH PCE 2A",VEIN WITH CALCITE IN INTERVAL 27-43CM,SLIGHTLY PCES 1A+1B+1C | FRESH PCES 2A+2B,"DARK BASALT, NEW LAVA FLOW AT 27CM",,, comments : GRADES TO APHANITIC IN 2A+2B,CALCITE comments :  IN VEIN,,
58,446,A,27,1,0.0,609.50,609.50,  611.00,"MARSH, N.",APHYRIC BASALT,"PCE 1 (0-3), 2 (5-12), 3 (13-16), 4 (20-23), 5A (24-30), 5B (31-36), 5C (37-40), 6 (41-51), 7 (53-55), 8 (57-62), 9A (63-68), 9B (69-72), 9C (72-85), 9D (84-87), 10 (90-95), 11 (97-102), 12 (104-108), 13 (110-117), 14 (117-121), 15 (123-126), 16 (127-131), 17 (134-140), 18 (143-149)",APHYRIC,"ODD CALCITE VEIN IN THIS INTERVAL PCES 1-7, VEINS FILLED WITH CHLORITE/CLAY AND LINED FRACTURES  IN PCES 8-12, VEINS LINED WITH PYR IN PCE 18",MOD,"GRAY BASALT, DRILLING BRECCIA PCES 6+11+16","   .25-2   10          CARB,PYR,SMEC comments : PCES 1-7 AMYGDULES |            10          CHLORITE,PYR comments : PCES 8-12 AMYGDULES, GREENISH CHLORITIC CLAY MATERIAL AND FINE-GRAINED PYR - ORIGINALLY 10% BUT FADING OUT |    30X10                CLAY,PYR comments : LARGE VUG PARTIALLY FILLED IN PCE 17", comments : POSSIBLY ALTERED MICROPHENOS OF OL IN PCES 2-5C,,"PYRITE comments :  IN PCES 1-12 AND PCE 17 | CARB comments :  IN PCES 1-7 | SMEC comments :  IN PCES 1-7 | CLAY comments :  CLAY IS CHLORITIC, PCES 8-12, DARK CLAY IN PCE 17 VUG",,
58,446,A,27,2,0.0,609.50,611.00,  612.45,"MARSH, N.",APHYRIC BASALT,"PCE 1 (0-4), 2 (5-14), 3 (15-27), 4A (30-34), 4B (33-42), 5 (44-47), 6 (49-52), 7 (54-57), 8 (58-62), 9 (63-72), 10 (74-78), 11 (81-84), 12 (86-93), 13 (94-106), 14A (110-116), 14B (117-127), 14C (127-129), 14D (129-136), 14E (132-137), 15 (139-144)",APHYRIC,"VEINS LINED WITH CROSS CUTTING CLAY AND PYRITE, 3MM VEIN WITH EUHEDRAL CARB XTLS PCE 15, CLAYEY FILLED VEIN 1CM THICK PCE 4B",MOD,DARK GRAY BASALT,  .25-10               CLAY comments : OCCASIONAL VESICLES LINED OR FILLED BY DARK CLAY MINERALS |     <.25   10          CLAY comments : VERY FINE VESICLES PCES 13-14E,PLAG               .5-1 comments : OCCASIONAL PLAG PHENOS | OL comments : OCCASIONAL ALTERED OL comments : SOME MICROPHENOS OF ALTERED OL (?),,CLAY | CARB comments :  IN VEIN PCE 15 | PYRITE,,
58,446,A,27,2,145.0,609.50,612.45,  612.50,"MARSH, N.",SEDIMENT,,,,,,,,,,,
58,446,A,28,1,0.0,619.00,619.00,  619.07,"MARSH, N.",APHYRIC BASALT,PCE 1 (0-7),"APHYRIC, APHANITIC",,MOD,"OUTER SURFACES OF PCES COVERED BY DARK GREEN CHLORITIC MATERIAL WITH VERY FINE PYRITE OR DARK GRAY CLAYEY MATERIAL, POSSIBLY UPHOLE CONTAMINATION","    .5-1               SMEC comments : ODD VESICLE LINES WITH LIGHT OLIVE GREEN CLAY (SMEC), ODD QUARTZ OR ZEOL GRAIN IN VESICLE ON OUTER SURFACE OF ONE PIECE",,,"SMEC comments :  IN VESICLE | PYRITE comments :  ID UNCERTAIN, POSSIBLY COVERING SURFACES OF PCES | QUARTZ comments :  ID UNCERTAIN, POSSIBLY A GRAIN IN VESICLE | ZEOL comments :  ID UNCERTAIN, POSSIBLY A GRAIN IN VESICLE",,
58,446,A,28,1,7.0,619.00,619.07,  620.50,"MARSH, N.",SEDIMENT,,,,,,,,,,,
