leg,site,hole,core,section,top interval depth (cm),bottom interval depth (cm),top of core depth(m),top of layer depth (m),bottom of layer depth (m), describer,lithology,color,structures,deformations due to drilling,unusual occurrences,minerals,paleontology,other observations,hardness or induration,z-coding
13,120,,1,CC,0.0,0.0,60.00,60.10,60.10,, SILICEOUS NANNO OOZE, 5G8/1-LIGHT GREENISH GRAY,,,,,, ONLY A LUMP 8 CM LONG RECOVERED IN THE CORE CATCHER, STIFF TO FIRM(BUT NOT SEMI-INDURATED, 11111210
13,120,,2,1,69.0,150.0,144.00,144.69,145.50,, SILICEOUS NANNO OOZE," 5G6/1-DARK GREENISH GRAY,5Y 4/2-OLIVE GRAY,-WHITE -BLACK,-GREEN,-PURPLE"," FINE HORIZONTAL LAMINATIONS IN 116-137 SECTION WITH OBLIQUE (45 DEGREE) STREAKS OF GREEN AND PURPLE COLORS, BLACK MARK AROUND 80 CM, OLIVE GRAY LAYER OF SOFTER MATERIAL AT 115-116 CM, W HITE CRYSTALINE INCLUSION OF CALCITE AT 114-146 CM",,, CALCITE,,, SOFT, 00000000
13,120,,3,CC,0.0,0.0,164.00,164.10,164.10,, SILICEOUS NANNO OOZE, 5G4/1-DARK GREENISH GRAY, SHALEY(HORIZONTAL LAMINATIONS),,,,, 14 CM IN CC, HARD, 00000000
13,120,,4,1,8.0,150.0,199.60,199.68,201.10,, SILICEOUS NANNO OOZE," N5-MEDIUM GRAY,5G4/1-DARK G REENISH GRAY", SLUMP STRUCTURE (BRECCIA WITH ANGULAR FRAGMENTS) 25-150 CM LAMINATED (SHALEY) MEDIUM GRAY UNIT 8-25 CM,,,,,, HARD, 00000000
13,120,,5,1,80.0,150.0,219.00,219.80,220.50,, SILICEOUS NANNO OOZE, N5-MEDIUM GRAY, PLANES OF FOLIATION (SCHISTOSITY) AT 45 DEGREES SLUMP STRUCTURES AND BURRO WS, CORE IS BROK EN IN SMALL PIECES,,,,," HARD,NON-HOMOGENEOUS INDURATION -SOME PIECES ARE SOFTER", 00000000
13,120,,6,CC,0.0,0.0,226.00,226.10,226.10,, SILICEOUS NANNO OOZE, N5-MEDIUM GRAY, HOR IZONTAL LAMINATIONS (SHALEY),,,,, 12 CM OF CORE IN CORE CATCHER, HARD, 00000000
13,120,,7,1,30.0,150.0,229.00,229.30,230.50,, SILICEOUS NANNO OOZE," N6-MEDIUM LIGHT GRAY,5G6/1- GREENISH GRAY,10R4/2-GRAYISH RED", GENERALLY HORIZON TAL LAMINATIONS WITH BURROWS, BROKEN IN PIEC ES SOME OF WHICH WERE ROLLED IN THE LINER AND ERODED AS PEBBLES,,,, VARIABLE COLORS. MAINLY MEDIUM GRAY W ITH GREENISH GRAY AND GRAYISH RED, HARD, 00000000
13,120,,8,1,60.0,150.0,251.70,252.30,253.20,, GABBRO,, TWO PIECES OF RADIOL ARITES AROUND 115 CM, BROKEN INTO PIECES,,,,, HARD, 00000000
