57,439,,15,2,139.0,150.0,935.00,937.89,938.00,US, CURRENT RIPPLE LAMINATIONS, 5Y2.5/1-3/1-DK GRAY T O BLACK," SEQUENCES LAMINATED,SLIGHTLY GRADED", UNDI ST,,,, SEE TOP NEXT CORE FOR PARTS A AND C OF 43CM BOU MA CYCLE THAT THIS SECTION AND PREVIOUS SECTION ARE A PART OF, FIRM, 33233000,00301c934baa216906f814235dd17a6d
57,439,,15,3,0.0,20.0,935.00,938.00,938.20,US, FINE GRAIN SAND TO SILT," 5Y4/1-OL GRAY (DOM),-DK GRAY"," ORGANIC MATTER COMPOSES ABUNDANT DARK LAMINAT IONS (UP TO 2 MM) THINLY DK GRAY AND 5Y4/1,FAULT 2MM OFFSET 5-12 CM", UNDISTURBED,,, ORG.MATTER, THIS SE CTION CONTINUES SEQUENCE FROM BOTTOM OF SECT 2 (BOUM A CYCLE), FIRM, 33233000,6a534265200203616451bad405bc33e0
57,439,,15,3,20.0,24.0,935.00,938.20,938.24,US, COARSE GRAINED F.G.SAND, 5Y4/1-OL GRAY, SHARP CO NTACT AT 24CM, UNDIST,,,, SECT A OF BOUMA SEQ, FIRM, 33233000,e03a865a5d53c9a33e7250699d262d07
57,439,,15,3,24.0,112.0,935.00,938.24,939.12,US, SILTY CLAYSTONE, 5Y4/1-OL GRAY," 45-70 CM SLIGHTL Y INCLINED LAMINATION AGAIN EMPHASIZE BY ORGANIC-RIC H INTERVALS (BOUMA), SHARP CONTACT AT 70 CM,DEWATERI NG VEINS(BETWEEN TURBIDITES),70-107 CM VERY LITTLE B IOTURBATION,107-110 CM THIN (ABOUT 3 CM THICK) SLIGH TLY LAMINATED,FAINT GRADING (BOUMA)", UNDISTURBED, LAMELLIBRANCH OR PELECYPOD AT 37 CM,, LAMELLI OR PEL ECYPODS, SHARP CONTACT AT 70 CM POSSIBLY COARSER SA ND WASHED-OUT BROKEN BLOCK CONTACT,, 33231000,48646fee0f277b64db3e53fb78e9c3db
57,439,,15,3,112.0,140.0,935.00,939.12,939.40,US, GRADING SILT TO CLAY, 5Y4/1-OL GRAY," BIOTURBATED MASSIVE UPPER PART,GRADED SLIGHTLY,FINELY LAMINATED", UNDIST,,,," BOUMA-C,D,E", FIRM, 33231000,b6c2a70194f3f74fac1ab2ff133d67c2
57,439,,15,3,140.0,150.0,935.00,939.40,939.50,US, SILTY CLAY, 5Y4/1-OL GRAY," SHARP CONTACT AT 140 CM,MOTTLED TO HOMOGENEOUS", UNDISTURBED, MOLLUSK AT 140-144CM,, MOLL, SHARP CONTACT(ANY MISSING? AGAIN BROKEN BLOCK CONTACT), FIRM, 33211000,4775c87522aeed4c47f4aa9bb712a631
57,439,,15,4,0.0,25.0,935.00,939.50,939.75,US, SILTY CLAYSTONE, 5Y4/1, MASSIVE, MOD DIST,,,,,, 33231000,c83d50fd885884265ee185572ddb90f8
57,439,,15,4,25.0,40.0,935.00,939.75,939.90,US, BOUMA CDE, 5Y4/1," LAMINATIONS,FAULTS AT BASE,SHA RP CONTACT AT 40 CM", HIGHLY DISTURBED,,, ORG.MATTER," ORGANIC MATTER IN LAMINATIONS,FAULTS L.T. 1 CM OFF SET (NORMAL),SHARP CONTACT,BUT SECTION DEFINITELY MI SSING,A AND B MAY BE MISSING FROM BOUMA DUE TO WASH OUT IN DRILLING", FIRM, 33231000,9977751b825b0004a6315184ef036c48
57,439,,15,4,40.0,55.0,935.00,939.90,940.05,US, ORGANIC-RICH SILTSTONE, 5Y4/1," MASSIVE TO LAMINA TED,BLOCKS ROTATED BUT SHOWS ANOTHER PARTIAL TURB SE QUENCE", HIGHLY DISTURBED,,, ORG.MATTER*,,,,c5925ca4b001bb73f3d2f5250d32c10a
57,439,,15,4,55.0,122.0,935.00,940.05,940.72,US, TURBIDITE, 5Y4/1," THICK,GRADED SEQUENCE,ORGANIC MATTER IN LAMINAE", MOD DISTD, PELECYPOD FRAGS,," OR G.MATTER,PELECYPODS"," SILT TO F.G. SILT IS PRESENT, BEGINS W MASSIVE BOUMA A THEN CDE(B MISSING)", FIRM, 33232000,e0eb2bffcdf4e684bb738926b89635b6
57,439,,15,CC,0.0,0.0,935.00,940.85,940.85,US, SILTY CLAYSTONE, 5Y4/1, MASSIVE TO SLIGHTLY BURR OW-MOTTLED, MOD DISTURBED,,,,,, 33212000,ab9c206a92d2c186131363bcd5f37f15
57,439,,16,1,0.0,22.0,944.50,944.50,944.72,US, BIG TO M.G.SAND GRADING UPWARD TO COARSE SILT," 5Y 4/1-OL GRAY,N3-N5"," MASSIVE,TURBIDITES,SHARP IRREGUL AR CONTACT AT 22CM", UNDIST,,,," BOUMA A,C,D", FIRM, 33212000,a0ea5662d58a0deefe082f382470e743
57,439,,16,1,22.0,31.0,944.50,944.72,944.81,US, GRADED SILT TO CLAY, 5Y4/1-OLIVE GRAY," DISRUPTED LAMIN,MOTTLED UPPER PART,SHARP IRREGULAR CONTACT AT 31 CM,TURBIDITE", UNDIST,,,," BOUMA A,C,D,E", FIRM, 33212000,8a066039cf2a4e9e23c27c70f35e0157
57,439,,16,1,31.0,107.0,944.50,944.81,945.57,US, GRADED F.G. SAND TO COARSE SILT, 5Y4/1-OLIVE GRAY," SOME ORGANIC LAMINATIONS,MASSIVE BASE,SOME LAMINA TIONS TO HOMOG 5Y4/1,SHARP BASAL CONTACT", UNDIST, BROKEN PELECYPOD(BADLY DISSOLVED),, PELECYPODS," SIL TY CLAYSTONE AROUND 60CM,BOUMA PARTS A,C,D,E", FIRM, 33212000,06a7feedb55351d89b95e585d3b558b6
57,439,,16,1,107.0,150.0,944.50,945.57,946.00,US, SLIGHTLY GRADED FINE SILT TO CLAY SIZE, 5Y4/1-OLI VE GRAY," SLIGHTLY GRADED,MASSIVE THROUGHOUT,FAINT C ONTACT,TURBIDITE(TO 140 CM)", UNDISTURBED, THIN-SHE LLED MOLLUSK FRAGMENT,, MOLL," BOUMA A,C,E", FIRM*,,c645f4c954a629e1a9ad343e15add802
57,439,,16,2,0.0,25.0,944.50,946.00,946.25,US, FAINTLY GRADED FINE SILT TO CLAY,," NO LAMIN,IRREGU LAR FAIRLY SHARP CONTACT AT 25 CM", UNDISTURBED,,,," AP PARENT DIP 0-2 DEGS,BOUMA D-E OR A,E?", FIRM, 33213000.3908.3311,47cc9c8e19e450768fed309c6cc37019
57,439,,16,2,25.0,82.0,944.50,946.25,946.82,US, F.G. SAND TO SILT,," GRADED,LAMINATED,FROM BASAL CO NTACT HOMOGENEOUS AND GRADED TO ABOUT 60 CM (THE UPP ER SILTY PART),LGE 1-2 CM BURROW MOTTLES,LAMINATIONS DEFLECTED BY BURROWS,VERY SHARP CONTACT AT 82 CM,FA INT ORGANIC-RICH LAMIN AT 43 CM", UNDISTURBED,,, ORG. MATTER, BOUMA C-E, FIRM, 33213000.3908.3311,22bea2d08bb3f84fd877fb500d6c1e80
57,439,,16,2,82.0,101.0,944.50,946.82,947.01,US, FAINTLY GRADED FINE SILT TO CLAY,," MASSIVE,FAIRLY SHARP CONTACT AT 101 CM",, UNDISTURBED,,,, HARD, 33213000.3908.3311,550dfebe53c97513a978ae696243d230
57,439,,16,2,101.0,123.0,944.50,947.01,947.23,US, GRADED F.G. SAND TO SILT AND CLAY,," FAIRLY MASSIVE ,SHARP CONTACT AT 123 CM",, UNDISTURBED,,, BOUMA A-E O R D-E ?, HARD, 33213000.3908.3311,72f9d6c95a36b0ef88df02c2b02ceea2
57,439,,16,2,123.0,129.0,944.50,947.23,947.29,US, SILT-CLAY,," LAMINATED,ABUNDANT ORG MATTER IN LAMIN", UNDISTURBED,,, ORG.MATTER,, HARD, 33213000.3908.3311,a769bfbf60445a44db1a778e2265843b
57,439,,16,2,129.0,150.0,944.50,947.29,947.50,US, FAINTLY GRADED FINE SILT-CLAY,," MASSIVE,BURROW-MOT TLE", UNDISTURBED,,,,, HARD, 33213000.3908.3311,5375214e85fbab8e6d0d8c81a6d9b959
57,439,,16,3,0.0,34.0,944.50,947.50,947.84,US, GRADED LAMINATED SILTSTONE INTERVALS," 5Y4/1-OLIVE GRAY (DOM),5Y2.5/1-3/1"," BURROWED UPPER PART,GRADED ,LAMINATED,SHARP CONTACT AT 34 CM", SLIGHTLY DISTURB ED,,,," BOUMA C,D,E",, 33235000,25b72101e0a4ca690c8a60e9f60adbfc
57,439,,16,3,34.0,130.0,944.50,947.84,948.80,US, SILTY CLAYSTONE, 5Y4/1-OLIVE GRAY," SLIGHTLY MOTT LED THROUGHOUT,NO VISIBLE SEQUENCES"," HIGHLY DISTURB ED 50-112 CM,SOUPY 112-130 CM,34-50 CM IS UNDISTURBE D", MOLLUSK FRAGTS AT 38 99 128 CM,, MOLL,,, 33231000,63f936412e5ffede03e9cf85712a2930
57,439,,16,CC,0.0,0.0,944.50,948.91,948.91,US, SILTY CLAYSTONE AND FRAGTS OF MASSIVE F.G. SAND, 5Y4/1-OLIVE GRAY,, SOUPY, FRAGTS OF MASSIVE F.G. SA ND,,,,, 33231000,470601d1fbf9dd43d2688e82af41beaf
57,439,,17,1,18.0,150.0,954.00,954.18,955.50,US, SILTY CLAYSTONE, 5Y3/1-DK OL GRAY, BLUE GRAY SIL TY MOTTLES THROUGHOUT," HIGHLY FRACTURED(BADLY DISTU RBED IN DRILLING),18-90 HIGHLY DISTURBED,90-150 SOUP Y",,,, NO SEQUENCES NOTED,, 33233000.3908.3450,bc8c62ea8f2af1cf236e0793f9a49df1
57,439,,17,2,0.0,150.0,954.00,955.50,957.00,US, SILTY CLAYSTONE, 5Y3/1-DK OL GRAY," SILT MOTTLES AND LENSES,SOME POSSIBLE FRACTURES(HEALED) FROM 92 T O 110 CM DARKER F.G. MATERIAL ALONG THEM"," 0-70 CM S OUPY,70-150 HIGHLY DISTURBED*",,,,,,,c127aae8b9aa178702cc3febfe95ff93
57,439,,17,3,0.0,60.0,954.00,957.00,957.60,US, SILTY CLAYSTONE, 5Y3/1-DK OL GRAY,, SOUPY,,,, NO SE QUENCES,, 33233000.3908.3450,0c655b82392ab27e05e47c2fc462df1c
57,439,,17,CC,0.0,0.0,954.00,957.70,957.70,US, SILTY CLAYSTONE, 5Y3/1-DK OL GRAY,, SOUPY,,,, NO SE QUENCES,, 33233000.3908.3450,ebf146f480a4d383aa5bb265b8c61513
57,439,,18,1,15.0,30.0,963.50,963.65,963.80,US, M.G. TO C.G. SAND,," GRADED,TURBIDITE,SHARP BASAL A T 30 CM", UNDISTURBED, PLENTIFUL WOOD FRAGS," QTZ,L ITH",," SAND CONSISTS OF QTZ LITHIC FRAGS(DARK) GRAINS ROUNDED TO SUBROUNDED,CHANGE TO COARSER TURBIDITE S ANDS USUALLY ONLY BOUMA A E OR POSSIBLY D-E?", HARD, 33233000.3908.3450,c44639a7d875310b2f33c372f5c211cf
57,439,,18,1,30.0,64.0,963.50,963.80,964.14,US, SAND,," FAULT JUXTAPOSES COARSER ORGANIC-RICH SAND AGAINST SILTY CLAYSTONE,60-64 CM VOID", SOUPY, PELE CYPOD FRAGT AT 45 CM," PELECYPODS,QTZ,LITH(SEE O)",, SAME O AS PREVIOUS CORE, HARD, 33214000,1b4a43adb450d3504036bb2eb80b6279
57,439,,18,1,64.0,70.0,963.50,964.14,964.20,US, M.G. TO F.G. SAND-SILT,, SCOURED BASAL CONTACT, U NDISTURBED,," QTZ,LITH(SEE O)",, SAME AS PREVIOUS CORE OBSERVATIONS, HARD, 33214000,4e5b48e4935b70bccddde96e70add76c
57,439,,18,1,70.0,105.0,963.50,964.20,964.55,US, TURBIDITE F.G. SAND,," 70-77 CM BREAK BETWEEN BLOCK S(MAY BE WASHED OUT),VERY SCOURED BASAL CONTACT AT 7 7 CM,MOTTLED GRADED AT 77 CM TO 105 CM,SHARP SCOURED CONTACT AT 105 CM", UNDISTURBED," ORG.MATTER CONCEN TRATED AS LAG(WOOD FRAGS AT BASE OF SCOUR),QTZ,LITH( SEE O)",,, SAME O AS PREVIOUS CORE, HARD, 33233000.3908.3450,6ffb4929f56bf808edfd69433941d0f8
57,439,,18,1,105.0,130.0,963.50,964.55,964.80,US, C.G. TO F.G. SAND GRADING TO SILTY CLAY,," NO LAMIN ,SHARP,SCOURED CONTACT", UNDISTURBED," SMALL MOLLUSK AT 109 CM,SMALL LTER-STAINED MOTTLE(OXIDATION SPOT? ),ABUNDANT CHIPS OF DARK ORGANIC MATTER WOOD TO LOW- RANK COAL(?)"," ORG.MATTER,QTZ,LITH(SEE O)", MOLL, S AME O AS PREVIOUS CORE, HARD*,,89c35542055c173bafb6e1aa09390a64
57,439,,18,1,130.0,150.0,963.50,964.80,965.00,US, SILTY CLAY,,, UNDISTURBED," WHITE GRAINS(QUARTZ),DA RK GRAINS AND CHIPS(COAL?)", QTZ,,, HARD, 33232000.3450.3311,59a1e9316c07ded0adbe148944e7bb56
57,439,,18,2,0.0,21.0,963.50,965.00,965.21,US, M.G. SAND WITH A SLIGHTLY COARSER-GRAINED INTERVAL ,," SHARP CONTACT AT 2 CM,SLIGHTLY COARSER-GRAINED IN TERVAL IS LAMINATED(5-8 CM,FAIRLY SHARP NO SO SCOURE D CONTACT AT 21 CM)", UNDISTURBED,,,,, HARD, 33213000,cb38baad6cde5c6bbbefee53010579a3
57,439,,18,2,21.0,50.0,963.50,965.21,965.50,US, M.G.-C.G. SAND GRADING TO LAMINATED SILT INTO HOMO GENEOUS SILTY CLAY,," FAULTED WITH AT LEAST 10 CM OFF SET,HOMOGENEOUS(THE SILTY CLAY),SCOURED BASAL CONTAC T(SHARP)", UNDISTURBED, ORGANIC WOOD CHIPS AND LOW- RANK COAL (?) FRAGMENTS UP TO 1.5 CM LONG ACCUMULATE IN UPPER PART(LOWER DENSITY FRAGTS)SLIGHT PARALLEL ORIENTATION, ORG.MATTER,," BOUMA(A,C,D,E)", HARD, 33213000,51e723f5b469c983dc151af5458e1e50
57,439,,18,2,50.0,92.0,963.50,965.50,965.92,US, M.G. TO F.G. SAND GRADING TO SILT,," SCOURED BASAL CONTACT,M.G. SANDY INTERVAL (POSSIBLY LOST AND BROKE N UP IN DRILLING)", UNDISTURBED," POSSIBLE MUD CLAST S(FLATTENED:OR BURROWS?),COARSE SAND SIZE WOOD CHIPS SUBPARELLEL IN UPPER PART OF SAND, ORG. MATTER",,," BO UMA A-E,OR POSSIBLE D-E(TOO COARSE?)", HARD*,,97394fa64b6cfe8c1eed8928ea356587
57,439,,18,2,92.0,150.0,963.50,965.92,966.50,US, F.G. SAND-SILT," 5Y5/2,N-2"," SANDY BURROW FILLING, 109-111 CM IS 5Y5/2 MOTTLED CLAYSTONE 111-114 CM IS N-2 VOLC.ASH BIOTURBATED AND DISRUPTED BY FAULT,SAND LENSE AT 127-129 CM,OFFSET DARK LAMINAE APPROX .7 C M IN FAULTS(NORMAL)", UNDISTURBED,, VOLC.ASH,,, HARD*,,d1d47d8b34ede6bb4450427ade8dc411
57,439,,18,3,0.0,35.0,963.50,966.50,966.85,US, FINE SILT GRADING TO SILTY CLAY, 5Y3/1-DK OLIVE G RAY, CONTACT AT 35 CM(NOT SCOURED), UNDISTURBED,,,, FAINT GRADED UNIT, HARD, 33233000,80602c2bb6e667abc0276035d9f2ca82
57,439,,18,3,35.0,66.0,963.50,966.85,967.16,US, HOMOGENEOUS SILTY CLAYSTONE, 5Y3/1-DK OLIVE GRAY, HOMOGENEOUS 5Y3/1, SLIGHTLY DIST,,,,,, 33233000,989c02c54514eaf2bd2182fa136cfffd
57,439,,18,CC,0.0,0.0,963.50,967.27,967.27,US, SILTY CLAYSTONE, 5Y3/1-DK OL GRAY, HOMOGENEOUS 5 Y3/1, SOUPY,,,,,, 33233000,abd622363016b4e88b082a752e74dacf
57,439,,19,1,0.0,25.0,973.00,973.00,973.25,US, F.G.SAND GRADING UPWARD TO SILTY CLAY, 5Y3/1-DK O LIVE GRAY," FLATTENED MUD CLASTS,SHARP SCOURED BASAL CONTACT,ABUNDANT 2-4 MM WOOD CHIPS,MASSIVE 0-18 CM"," SOUPY 0-18 CM,18-25 CM UNDISTURBED",,,,, HARD, 33233000,c892ae96930f43a9745d0f04123a4a35
57,439,,19,1,25.0,37.0,973.00,973.25,973.37,US, SEPARATE BLOCK AND ORIGINAL THICKER SAND, 5Y3/1-D K OL GRAY, SAND LENSES, UNDISTURBED,,,," SEPARATE BLO CK(25-35 CM) MAYBE WASHOUT,ORIGINAL THICKER SAND AT 37 CM AND ABOUT 2 CM THICK", HARD, 33214000,abfa969995b02591d70ec0339eeb32aa
57,439,,19,1,37.0,75.0,973.00,973.37,973.75,US, M.G.SAND GRADING UPWARD TO FINE SILTY AND CLAYEY S ILT, 5Y3/1-DK OLIVE GRAY," MASSIVE,SOME BURROW MOTT LING,ABUNDANT(UP TO 1 CM)LGE WOOD CHIPS FROM 60-66 C M(COARSER THAN MATRIX SAND),SHARP,SCOURED BASAL CONT ACT", UNDISTURBED,,,, BOUMA(AE), HARD, 33233000,11676236e31fff2ec903704fdaa13a48
57,439,,19,1,75.0,111.0,973.00,973.75,974.11,US, VERY FINE-GRAINED CLAYEY SILT, 5Y3/1-DK OL GRAY, APPARENTLY HOMOGENEOUS, UNDISTURBED EXCEPT FOR 82- 103 CM(BRECCIATED IN CORING),,,,, HARD, 33233000,5d5ff083ca9f52acf735914701ef8aa8
57,439,,19,CC,0.0,0.0,973.00,974.22,974.22,US," FIRST 7CM SMALL F.G. SAND TO CLAYEY SILT,REST IS C LAYEY SILT TO SILTY CLAY", 5Y3/1-DK OL GRAY," FIRST PART IS GRADED AND BURROWED,REST IS HOMOGENEOUS"," FI RST PART IS UNDISTURBED,SECOND PART IS SOUPY",,,,, HARD, 33233000,f605faf1f072bcb7caecea79dc6d953b
57,439,,20,1,6.0,26.0,982.50,982.56,982.76,US,,,, UNDISTURBED,,, CONTACT AT 26 CM," COMPLETE BOUMA SE QUENCE (ABCDE),A MAY ACTUALLY BE THICKER SOME SAND W ASHED OUT IN DRILLING", HARD, 33233000.3908.3311,2af1ecb8a3ba515fd8fe54ee80bb2362
57,439,,20,1,26.0,83.0,982.50,982.76,983.33,US, CLAYEY SILTSTONE, 5Y4/1-3/1-OL GRAY TO DK OL GRAY," HOMOGENEOUS,MOTTLED WITH SILT,F.G.SAND TO SILT LA YER-FAULTED,MOTTLED SANDIER INTERVAL(WASHED OUT?)THE RE IS A BREAK BETWEEN BLOCK", UNDISTURBED*,,,,,,,076b8c78ae13378ccab2dd7b6a12d5dc
57,439,,20,1,83.0,115.0,982.50,983.33,983.65,US, M.G.SAND TO SILTY CLAY AND SILTY CLAYSTONE, 5Y4/1 -3/1-OL GRAY TO DK OL GRAY," NUMEROUS MOTTLES OF SIL T IN SILTY CLAYSTONE NEAR TOP,MASSIVE,GRADED,SHARP S COURED BASAL CONTACT", UNDISTURBED," CONCENTRATION O F PARALLELORIENTED WOOD CHIPS AND FLAKES OF ORGANIC MATTER 98-103 CM,CHERT LITHIC FRAGS IN SAND"," CHERT, LITH,ORG.MATTER*",,,,,790d635be8b4d8c69b10ed10b0aedd87
57,439,,20,1,115.0,150.0,982.50,983.65,984.00,US, CLAYEY SILTSTONE, 5Y4/1-3/1-OL GRAY TO DK OL GRAY," MOTTLED,SLIGHT VARIATION IN SILT CONTENT", UNDIST URBED,,,,,, 33232000,93cbac2bebac06aaefed6dde2d59c83f
57,439,,20,2,5.0,10.0,982.50,984.05,984.10,US, TURBIDITE(GRADED F.G. SAND), 5Y4/1-3/2-OL GRAY TO DK OL GRAY, MOTTLED, UNDISTURBED,,,," DARKER AT BASE ,BOUMA(A)", HARD, 33232000,bbb2f76b99e2a4033a1594b99246c0c3
57,439,,20,2,10.0,51.0,982.50,984.10,984.51,US, SILTY CLAYSTONE(OR CLAYEY SILTST?), 5Y4/1-3/2-OL GRAY TO DK OL GRAY,, UNDISTURBED, CONCENTRATION OF ORGANIC MATTER IN CHIPS AND GRAINS, ORG.MATTER,,,, 33232000,a0336b086be1cdd67ad53cc168428763
57,439,,20,2,51.0,60.0,982.50,984.51,984.60,US, 2 CM F.G. SAND GRADING INTO SILTY CLAY, 5Y4/1-3/2 -OL GRAY TO DK OL GRAY, SHARP CONTACT AT 60 CM, UN DISTURBED,,,, BOUMA(AE), HARD, 33214000,39d5af44ccd5d7275caa74e77572ed41
57,439,,20,2,60.0,66.0,982.50,984.60,984.66,US, SANDY LAYER WITH CLAYEY SILT UPPER PART OF INTERVA L, 5Y4/1-3/2-OL GRAY TO DK OL GRAY, NO GRADING, U NDISTURBED,,,,, HARD, 33214000,424a71cc93ece352ddccb857249d97fd
57,439,,20,2,66.0,90.0,982.50,984.66,984.90,US, SILTY CLAYSTONE WITH THIN SAND AT BASE, 5Y4/1-3/2 -OL GRAY TO DK OL GRAY,, UNDISTURBED,,,, SAND L.T. 1 C M(NOT GRADED? WASHED OUT AT BASE?),, 33232000,a96a09ff9546f07e6ee409de4f17e070
57,439,,20,2,90.0,150.0,982.50,984.90,985.50,US, CLAYEY SILTSTONE, 5Y4/1-3/2-OL GRAY-DK OL GRAY," LAMINATED 1 CM ORGANIC-RICH SILT OFFSET BY FAULTS(L. T. .5 CM NORMAL) AT 91-100 CM,SOME F.G. SAND AND OR SILT LENSES WITH SEVERAL MICRO FAULTS 135-145 CM"," U NDISTURBED 90-111 CM,SOUPY 111-150 CM",,,,,, 33233000,11ce81def4c6ff24050504d9d8698c8f
57,439,,20,3,0.0,10.0,982.50,985.50,985.60,US, SLIGHTLY GRADED F.G. SAND TO SILTSTONE, 5Y4/1-OL GRAY, SHARP BASAL CONTACT, UNDISTURBED,,,,,, 33233000,f5ad2dde8600ad9d45d18ea82e004a78
57,439,,20,3,10.0,40.0,982.50,985.60,985.90,US, CLAYEY SILTSTONE, 5Y4/1-OL GRAY, MOTTLES AND LEN SES OF COARSER GRAINED SILT, UNDISTURBED,,,,,, 33233000,458a834a25dbf8987bb6922d5b6b478d
57,439,,20,CC,0.0,0.0,982.50,986.02,986.02,US, CLAYEY SILTSTONE, 5Y4/1-OL GRAY, MOTTLES AND LEN SES OF COARSER GRAINED SILT, UNDISTURBED,,,,,, 33233000,e1cf632662bd535063903a233cd032c7
57,439,,21,1,0.0,40.0,992.00,992.00,992.40,US, CLAYEY SILTSTONE, 5Y3/1-DK OL GRAY,, SOUPY,,,,,, 33233000,92db78b89bd76aa7664ddf6a4aecb43a
57,439,,21,1,40.0,74.0,992.00,992.40,992.74,US, F.G.SAND GRADING UPWARD THROUGH MASSIVE SILT TO CL AYEY SILTSTONE, 5Y3/1-DK OL GRAY," SHARP BUT FAINT CONTACT AT 74 CM,SOME FAINT LAMINATIONS", UNDISTURB ED,,,," SAND GRADES INTO SOME FAINT LAMINATIONS THEN UP WARD THROUGH THE SILT THEN SILTSTONE ALREADY MENTION ED,BOUMA(ACDE)", HARD, 33233000,cc4ca1911037ce68f9cc3058930e0ebc
57,439,,21,1,74.0,110.0,992.00,992.74,993.10,US, MG SAND GRADING THROUGH LAMIN INTERVAL TO MASSIVE F.G. SAND INTO CLAYEY SILTSTONE, 5Y3/1-DK OL GRAY," CURIOUS DARK LAMINAE W SILT AT TOP,DARK F.G. SILT L AMINAE AT 82 CM FAULTED(NORMAL L.T. .5 CM OFFSET),FA INT LAMINATION 85-95 CM,SHARP BASAL CONTACT", UNDIST URBED,,,," BOUMA(ACDE),RAPID TRANSITION AT TOP,CURIOUS DARK ORG LAMIN AT TOP IS COARSER THAN BOUMA E BELOW BUT FINER THAN SAND ABOVE*",,,89e37fdb845ea795637ced7b3768fb94
57,439,,21,1,110.0,150.0,992.00,993.10,993.50,US, SILTY CLAYSTONE, 5Y3/1-DK OL GRAY," FRACTURED,SOM E SLICKENSIDES ON FRACTURE PLANES", MODERATELY DISTU RBED TO SOUPY,,,,,, 33233000,3d8dac2902f7f0f196a60412aa52f9d5
57,439,,21,2,0.0,80.0,992.00,993.50,994.30,US, SILTY CLAYSTONE, 5Y4/3-OLIVE GRAY," ABUNDANT SILT Y STREAKS AND MOTTLES,SMALL FAULT AT 15-25 CM,SMALL SYNSEDIMENTARY NORMAL FAULTS(NOTE THICKENING OF LAMI NAE OVER DOWNDROPPED BLOCK WITHIN SAND UNIT(RELIEF L EVELS OUT AT TOP)) SMALL LOAD CAST ON LEFT SIDE:SHAR P SCOURED BASAL CONTACT ALL AT 50-55 CM", UNDISTURBE D,,,,,, 33233000,5ef372785bfab8761b10997105348607
57,439,,21,2,80.0,112.0,992.00,994.30,994.62,US, F.G.GRAINED SAND GRADING TO FINE SILT, 5Y4/3-OL G RAY," NO BASAL CONTACT,CLAY MOTTLES,SILTY MOTTLED(BU RROWS)", UNDISTURBED,,,,, HARD, 33233000,cf45b6376aa7cf337d680ec26aa0a014
57,439,,21,3,0.0,150.0,992.00,995.00,996.50,US, CLAYEY SILTSTONE," 5Y3/1-OL GRAY,5B6/1-BLUISH GRAY"," FAIRLY HOMOGENEOUS(OR MASSIVE?)5Y3/1,MOTTLED AND STREAKED,5B6/1 BIOTURBATED SILT LENSES(AT 18 AND 30 CM),SILTY MOTTLES AT 50-52 CM", UNDISTURBED,,,,,, 33233000,8d1958c02f8d8388f81c0edd7cb46ff9
57,439,,21,4,0.0,50.0,992.00,996.50,997.00,US, COARSE SILT GRADING UPWARD RAPIDLY TO CLAYEY SILT, 5Y3/1 DK OL GRAY, GRADATIONAL CONTACT AT 50 CM, UNDISTURBED,,,, BOUMA DE OR AE?, HARD, 33233000,4e525461d3b9bceaefcf5348b59fcb02
57,439,,21,4,50.0,72.0,992.00,997.00,997.22,US, CLAYEY SILT, 5Y3/1-DK OL GRAY, SILTY MOTTLES AT 65-68 CM, UNDISTURBED,,,,, HARD, 33215000,312fcde2ee29758cfe8da5266b348fe9
57,439,,21,CC,0.0,0.0,992.00,997.32,997.32,US, CLAYEY SILTSTONE, 5Y3/1,, UNDISTURBED,,,,,, 33233000,c2bbc6f2ebe36139e903344e1e0c51e2
57,439,,22,1,0.0,150.0,1001.50,1001.50,1003.00,US, CLAYEY SILTSTONE, 5Y3/1-DK OLIVE GRAY," FAIRLY HO MOGENEOUS OR MASSIVE,VERY FAINT SMALL MOTTLES"," UNDI STURBED 0-121 CM,MOD DIST 121-150 CM*",,,,,,,c191e335a226e510056044a5ed144ec8
57,439,,22,2,0.0,150.0,1001.50,1003.00,1004.50,US, COARSE-GRAIN SILTSTONE OR VERY FINE-GRAINED SANDST ONE, N5-MED LT GRAY," MODERATELY WELL-SORTED,MASSIV E,SLIGHT PARTING PARALLEL TO BEDDING", UNDISTURBED," ARTICULATED BIVALVE AT 80 CM,MOLLUSK FRAGT AT 100 CM", QTZ-RICH," BEN.FORAMS,MOLL,ARTICULATED BIVALVE", PRONOUNCED CHANGE THIS SECTION, MODER FRIABLE*,,97ce32fd189e0cb803dea2be77d509ca
57,439,,22,3,0.0,150.0,1001.50,1004.50,1006.00,US, SILTSTONE, N5-MED LT GRAY," MASSIVE,PROMINENT PAR TING,MODERATELY WELL-SORTED", UNDISTURBED, PELECYPO DS AT 46 87 125 140 CM,, PELECYPODS, SAME(SILTSTONE ) AS IN PREVIOUS SECTION*,,,fe3de1202f5ee9e040c22940728a017c
57,439,,22,4,0.0,0.0,1001.50,1006.00,1006.00,US, F.G.SAND, N5-MED LT GRAY, MASSIVE(NO BEDDING FEA TURES WHATSOEVER), UNDISTURBED," CONCENTRATION OF PELECYPODS(ALL ARTICULATED) 55-65 CM,PELECYPOD FRAGS AT 85 88 104 123 128 CM",, PELECYPODS," CONTINUES F. G. SAND UNIT-COULD SECT 2 3 4 BE ONE CONTINUOUS GRAD ED SAND UNIT OF TURBID ORIGIN? SECT 4 COULD BE COARS ER AT BASE,PELECYPODS ARE NOT IN GROWTH POSITION", FIRM*,,cf29a285e780df415be52712ad1e9dd4
57,439,,22,5,0.0,150.0,1001.50,1007.50,1009.00,US, SAND,," MASSIVE,NO BEDDING OR GRAIN SIZE VARIATION", UNDISTURBED," SCAPHOPODS AT 10-16 AND 40-46 CM,MOL LUSK DEBRIS AT 81-84 116-120 127-133 CM,PELECYPOD SH ELL FRAG AT 143 CM,GASTROPODS AT 147-149 CM,SHELL HA SH(GASTROPODS AND PELECYPODS) AT 94-100 CM",," PELECY PODS,MOLL,GASTROPODS,SCAPHOPODS(?)"," CONTINUE MASSIV E SAND,SCAPHOPODS(?)", FIRM*,,ecc8066f227aae26355f709590f0ce16
57,439,,22,6,0.0,122.0,1001.50,1009.00,1010.22,US, FINE GRAIN SAND,, MASSIVE, UNDISTURBED,,," GASTROPO D(WHOLE) AT 70 CM,FRAGMENTS NEAR BASE AND AT 2 13 CM GASTROPODS", CONTINUE AS ABOVE F.G. SAND UNIT," M ODERATE INDURATION,BUT FRIABLE", 33212000,a4d3ba787e97585e9df3dc705570b30d
57,439,,23,1,0.0,150.0,1011.00,1011.00,1012.50,US, M.G.SAND, 5Y4/1-OLIVE GRAY," MASSIVE,NO BEDDING S TRUCTURES,VERY FAINT ALIGNMENT OF PLATEY ORGANIC FRA GS AND SHELL FRAGS,OCCASIONAL VERY FAINT LAMINATION SUGGESTS 35 DEG DIP"," 0-10 CM SOUPY,10-150 CM UNDIST URBED"," MOLLUSK BEARING(NOT IN GROWTH POSITION,BUT M ANY ARTICULATED-GASTROPODS PELECYPODS SCAPHOPODS),AR TICULATED PELECYPOD 15 CM,GASTROPOD 37 CM,BEAUTIFULL Y PRESERVED HIGH-SPIRED GASTROPOD(TURITELLA?)78 CM,W OOD CHIP 110 CM,SOME WOOD CHIPS AND OTHER ORG MATTER"," QTZ,LITHIC ARENITE"," ORG.MATTER,MOLL,GASTROPODS,P ELECYPODS,SCAPHOPODS"," QTZ-RICH,CONTINUATION OF CORE 22,REDEPOSITED OR BEACH SAND?", INDURATED MODERATE TO WELL*,,8119e6ddd522ef869651bae00411cd97
57,439,,23,2,0.0,150.0,1011.00,1012.50,1014.00,US, M.G.SAND, 5Y4/1-OLIVE GRAY," MASSIVE,CONTINUE AS 23-1", UNDISTURBED," PELECYPOD AND SCAPHOPOD AT 28-3 0 CM,PELECYPOD AT 40 83 CM,ARTICULATED PELECYPOD AT 50 CM,GASTROPOD AT 91 140 CM",," PELECYPODS,SCAPHOPODS ,GASTROPODS", CONTINUE AS CORE 23-1, FIRM, 33232000.3908.3800,4d84c3eedfab8dda8eaf11ec273d50ef
57,439,,23,3,0.0,72.0,1011.00,1014.00,1014.72,US, M.G.SAND," 5Y4/1-OLIVE GRAY,N3"," SOME NACREOUS ARA GONITIC LAYER APPARANTLY STILL PRESERVED,CONTINUE FR OM 23-1 AND -2", UNDISTURBED," ARTICULATED PELECYPOD W N3 FILLING OF CALCAREOUS SILT(WELL CEMENTED),FRAG S AT 20 CM", ARAGONITE, PELECYPODS, CONTINUE FROM 23-1 AND -2, FIRM, 33232000.3908.3800,cfdf76f0edceee86f358cd36e5cdf6ba
57,439,,23,CC,0.0,0.0,1011.00,1014.82,1014.82,US, SILTY SAND DRILLING BRECCIA,,, DRILLING BRECCIA,,,,,, 33232000.3908.3800,ab3d13659e263515987a5d44fec53201
57,439,,24,1,0.0,100.0,1020.50,1020.50,1021.50,US, SANDY SILTSTONE, 5Y4/1, CONTINUE AS CORE 23, UN DISTURBED," MOLLUSCAN SHELL AND FRAGS 46-53 CM,NUMER OUS SMALL WOOD CHIPS 92-100 CM",, MOLL," NO STRIKING DIFFERENCE WITH CORE 23,FOSSILS ARE FILLED WITH THE SAME SANDY MATERIAL SO EITHER THEY LIVED IN THIS MAT ERIAL OR THEY WERE TRANSPORTED AS EMPTY SHELL TO THE IR ACTUAL PLACE,VERY SLIGHT DIFFERENCE BETWEEN THIS AND THE REST OF THIS CORE SECTION(TO BE DESCRIBED NE XT) MATERIAL EXCEPT COARSER-MAY BE A BREAK IN SEDIME NTATION", FRIABLE*,,9a9f86f113f24ced338796206feaa52b
57,439,,24,1,100.0,125.0,1020.50,1021.50,1021.75,US, FINER GRAIN SILTSTONE, 5Y4/1, BURROW MOTTLING VE RY FAINT AT TOP OF THIS INTERVAL, UNDISTURBED,,,," FIN ER GRAIN SANDSTONE AROUND TOP OF THIS INTERVAL,SLIGH TLY MORE COARSE THAN ABOVE*",,,63aa16108e1d6577c4f3a7acafb65892
57,439,,24,2,0.0,150.0,1020.50,1022.00,1023.50,K, SANDY SILTSTONE, 5Y4/1," HOMOGENEOUS,SAND,MASSIVE", UNDISTURBED,,," WOOD CHIPS EVERYWHERE,GASTROPODS 30 -36 CM,PELECYPODS AT 70,149,AND 110-115 (VERY THIN) CM,ARTICULATED PELECY AT 80 CM", VOID 0-6 CM, INDUR ATED, 33233000,0c866b8bfc99be540a4717f63d62c8c9
57,439,,24,3,0.0,150.0,1020.50,1023.50,1025.00,K, SANDY SILTSTONE, 5Y4/1," HOMOGENEOUS,NO GRADATION VISIBLE", UNDISTURBED,,," NUMEROUS WOOD CHIPS THROUGH OUT,PELECY AT 2 CM,GASTROPODS AT 144 CM,SM. SHELL FR AGS AT 25-30 CM", N HCL EFFECT (EXCEPT ON SHELLS),, 33233000,0852524678590ee252343fca44158ed4
57,439,,24,4,0.0,150.0,1020.50,1025.00,1026.50,K, SILTSTONE, 5Y4/1, NO GRADING, UNDISTURBED,, PYR ITE AT 128 CM," NUMEROUS WOOD CHIPS (ACCUMULATION AT 40CM,CHIP AT 140 CM),PELECY AT 130 AND 55 (VERY THI N) CM,BIG ARTICULATED PELECY (CALC. SILTST. INSIDE) AT 70 CM,SM. GASTROPODS AT 140 CM*",,,,93b2fbdac79ee8a07e076472d87c9482
57,439,,24,5,0.0,150.0,1020.50,1026.50,1028.00,K, SILTSTONE, 5Y4/1,, UNDISTURBED,, PYRITE AT 30 AND 125-128 CM," PELECY AT 20 (HORIZ.),75 (THIN),AND 13 2 (CRUSHED) CM",,, 33233000,e5858826f65ad2eecb4da9510bf57a21
57,439,,24,6,0.0,130.0,1020.50,1028.00,1029.30,K, SILTSTONE, 5Y4/1, BURROWS AT 60 CM AND 100-110 C M, UNDISTURBED,," PYRITE AT 15,85,AND 95 CM"," PELECY AT 25,50,AND 55 CM", I.W. SAMPLE 130-150 CM,, 33233000,2fc13d338567923f9344487263957341
57,439,,24,7,0.0,68.0,1020.50,1029.50,1030.18,K, SILTSTONE, 5Y4/1,," MODERATELY DEFORMED 0-35 CM,DR ILLING BRECCIA 35-68 CM",,,,,, 33233000,985112a5aa1c3402e033c6d1ac01bf32
57,439,,24,CC,0.0,20.0,1020.50,1030.28,1030.38,K, SILTSTONE, 5Y4/1,, DRILLING BRECCIA,,,,,, 33233000,2f72c581fe27d205c52d2a03bae460ee
57,439,,25,1,0.0,150.0,1030.00,1030.00,1031.50,K, SANDY SILTSTONE, 5Y4/1, VERY HOMOGENEOUS,,," PYRIT E AT 58,62,AND 125 CM"," SM.SHELL AT 20 CM,WOOD CHIPS AT 140 CM,PELECY SHELL AT 65 CM?",,, 33233000,149382796a414ebe86f8e425358c5c87
57,439,,25,2,0.0,150.0,1030.00,1031.50,1033.00,K, SILTSTONE, 5Y4/1," VERY HOMOGENEOUS,NO GRADATION",,,," SHELL (LAMELLI) AT 30 CM,SM.PELECY AT 50 AND 98 CM ,WOOD CHIPS AT 105 (ACCUMULATION) AND 145 CM",,, 33233000,a9b1f39ea2e8547654e44e7949963e2e
57,439,,25,3,0.0,150.0,1030.00,1033.00,1034.50,K, CLAYEY SILTSTONE, 5Y4/1, FRACTURE AT 70-80 CM WI TH DIP AT 65 DEGREES, UNDISTURBED,, PYRITE AT 140 C M," LG. (3 CM) GASTROPOD AT 27 CM,COSTULATED GASTROP OD AT 125 CM,SM.GASTROPOD AT 134 CM,PELECY AT 36 CM*",,,,7a6ce20753d88d0e11cf8570f643b3cd
57,439,,25,4,0.0,110.0,1030.00,1034.50,1035.60,K, SANDY SILTSTONE, 2.5Y3/0-V.DK.GREY,,, LIMESTONE NO DULE AT 91 CM, LIMESTONE," WOOD CHIP AT 15 CM,SM.GA STROPOD SHELL AT 55 CM", 110-150 CM IS O.G.SAMPLE*,,,aba52161ddb3f838c433f6f382d02c06
57,439,,25,5,0.0,150.0,1030.00,1036.00,1037.50,K, CLAYEY SILTSTONE, N3-V.DK.GREY,,,, PYRITE AT 74 CM," PELECY AT 20 AND 65 CM,GASTROPOD AT 25 AND 92 CM,W OOD AT 75 CM,LAMELLI AT 132 CM*",,,,f9e360a97e295c1fec74f40bc049b2b7
