44,391,C,28,2,0.0,150.0,1162.00,1163.50,1165.00,, LIMESTONE," 5Y6/1-LIGHT GREY,5Y5/2-OLIVE GREY,5B7/ 1-LIGHT BLUE GREY,5Y8/1-WHITE,2.5YN2.5/-BLACK,2.5YN3 /-VERY DARK GREY,2.5YN/4-DARK GREY,5Y3/1-VERY DARK G REY"," LIGHT BLUE GREY TO OLIVE GREY BIOTURBATED CALC ILUTITE WITH <1MM THICK WHITE CALCILUTITE BLEBS LOCA TED FROM 0-7 10-14 32-41 55-58 61-66 76-81 AND 120-1 26CM,DARK GREY TO VERY DARK GREY CALCILUTITE WITH MI LLIMETER SIZE LAMINATIONS LOCATED FROM 7-10 14-25 41 -55 58-61 70-76 81-89 AND 99-106,BLACK TO VERY DARK GREYSHALE FROM 106-108CM LIGHT GREY TO OLIVE GREY CALCILUTITE WITH MILLIMET ER SIZE LAMINATIONS LOCATED FROM 25-32 66-70 89-99 1 08-120 126-134 AND 135-150CM,OLIVE GREY MASSIVE CALC ILUTITE FROM 134-135CM,1CM DIAMETER BURROWS AT 128CM", SLIGHTLY CRACKED,,,,, HARD, 11131110,69bf4ac1863b69a543d8b9176050e178,44-391C-28-2
44,391,C,28,3,0.0,150.0,1162.00,1165.00,1166.50,, LIMESTONE," 5Y6/1-LIGHT GREY,5Y5/2-OLIVE GREY,5B7/ 1-LIGHT BLUE GREY,5Y8/1-WHITE,2.5YN2.5/-BLACK,2.5YN3 /-VERY DARK GREY,2.5YN/4-DARK GREY,5Y3/1-VERY DARK G REY"," LIGHT GREY TO OLIVE GREY CALCILUTITE WITH MILL IMETER SIZE LAMINATIONS LOCATED FROM 0-14 15-18 19-2 3 24-40 43-50 51-59 60-66 67-80 85-94 AND 102-104,BL ACK TO VERY DARK GREY SHALE FROM 14-15 18-19 23-24 4 0-43 50-51 59-60 94-95 129-130 133-135 142-143 AND 1 45-146CM LIGHT BLUE GREY BIOTURBATED CALCILUTITE WITH <1MM THICK WHITE CALCILUTITE BLEBS LOCATED FROM 80-85 104 -113 AND 146-150CM,DARK GREY TO VERY DARK GREY CALCI LUTITE WITH MILLIMETER SIZE LAMINATIONS LOCATED FROM 95-102 113-129 130-133 135-142 AND 143-145CM,1CM DI AMETER BURROWS FROM 105-114CM", SLIGHTLY CRACKED,,, F ISH REMAINS AT 31CM,, HARD, 00000000,62af19b95b59e2ba10f80b231646eb38,44-391C-28-3
44,391,C,28,4,0.0,150.0,1162.00,1166.50,1168.00,, LIMESTONE," 5Y6/1-LIGHT GREY,5Y5/2-OLIVE GREY,5B7/ 1,5Y8/1-WHITE,2.5YN2.5/-BLACK,2.5YN3/-VERY DARK GREY ,2.5YN/4-DARK GREY,5Y3/1-VERY DARK GREY"," DARK GREY TO VERY DARK GREY CALCILUTITE WITH MILLIMETER SIZE L AMINATIONS LOCATED FROM 0-10 11-13 14-19 20-22 AND 7 5-81CM,BLACK TO VERY DARK GREY SHALE FROM 10-11 13-1 4 19-20 22-23 81-82 99-100 AND 124-126CM,LIGHT GREY TO OLIVE GREY CALCILUTITE WITH MILLIMETER SIZE LAMIN ATIONS LOCATED FROM 23-46 56-64 82-99 AND 106-124CM LIGHT BLUE GREY BIOTURBATED CALCILUTITE WITH <1MM THICK WHITE CALCILUTITE BLEBS LOCATED FROM 46-56 64- 75 100-106 AND 126-150CM,CHONDRITE BURROWS AT 48CM", SLIGHTLY CRACKED EXCEPT FOR MODERATELY FRAGMENTED I NTERVAL FROM 39-51CM,,,,, HARD, 00000000,3c0f3c0d566463ca7c48345ca7e22b7f,44-391C-28-4
44,391,C,29,1,53.0,150.0,1171.50,1172.03,1173.00,, LIMESTONE," 5Y6/1-LIGHT GREY,5Y5/2-OLIVE GREY,5B7/ 1-LIGHT BLUE GREY,5Y8/1-WHITE,2.5YN2.5/-BLACK"," SECT ION CONSISTS MOSTLY OF LIGHT GREY TO OLIVE GREY CALC ILUTITE WITH MILLIMETER SIZE LAMINATIONS EXCEPT FOR INTERVALS OF BLACK SHALE FROM 67-68 69-70 77-78 124- 125 138-139 142-145CM AND AT 71 74 73 75 93 94 95 11 0 129 AND 147CM,LIGHT BLUE GREY BIOTURBATED CALCILUT ITE WITH <1MM THICK WHITE BLEBS LOCATED FROM 127-129 CM,SCOUR STRUCTURE AT 126CM WITH GRADING ABOVE", SLI GHTLY CRACKED, COAL FRAGMENTS AT 105CM,,,, HARD, 12231110,54213c082160271646718f4cd58fa5bb,44-391C-29-1
44,391,C,29,2,0.0,150.0,1171.50,1173.00,1174.50,, LIMESTONE," 5Y6/1-LIGHT GREY,5Y5/2-OLIVE GREY,2.5Y N2.5/-BLACK,5Y4/2-OLIVE GREY"," SECTION CONSISTS MOST LY OF LIGHT GREY TO OLIVE GREY CALCILUTITE WITH MILL IMETER SIZE LAMINATIONS EXCEPT FOR INTERVALS OF BLAC K SHALE FROM 20-21 25-26 O8-39 54-55 59-61 70-71 79- 80 105-106 AND 145-146CM AND AT 5 11 13 15 42 48 49 49.5 65 76 108 AND 123CM,5Y4/2-OLIVE GREY CALCILUTIT E LAYER FROM 107-111CM", SLIGHTLY CRACKED,,,,, HARD, 00000000,9d36366db5670ea020cafc4dbf3f71fa,44-391C-29-2
44,391,C,29,3,0.0,150.0,1171.50,1174.50,1176.00,, LIMESTONE," 5Y6/1-LIGHT GREY,5Y5/2-OLIVE GREY,5B7/ 1-LIGHT BLUE GREY,5Y8/1-WHITE,-BLACK,2.5YN/4-DARK GR EY,5Y3/1-VERY DARK GREY"," LIGHT GREY TO OLIVE GREY C ALCILUTITE WITH MILLIMETER SIZE LAMINATIONS LOCATED FROM 0-5 6-48 54-71 77-107 108-115 116-125 132-140 A ND 148-150CM,BLACK SHALE FROM 5-6 51-54 76-77 107-10 8 AND 115-116CM,DARK GREY TO VERY DARK GREY CALCILUT ITE WITH MILLIMETER SIZE LAMINATIONS LOCATED FROM 48 -51 AND 71-76CM LIGHT BLUE GREY BIOTURBATED CALCILUTITE WITH <1MM THICK WHITE CALCILUTITE BLEBS LOCATED FROM 125-132 A ND 140-148CM", SLIGHTLY CRACKED,,, TRACES OF BLACK CH ITONOUS? SHELL MATERIAL,, HARD, 00000000,f137c8ddc3ba9adcdf1e8870f1abf3b5,44-391C-29-3
44,391,C,29,4,0.0,150.0,1171.50,1176.00,1177.50,, LIMESTONE," 5Y6/1-LIGHT GREY,5Y5/2-OLIVE GREY,5B7/ 1-LIGHT BLUE GREY,5Y,/1-WHITE,-BLACK,2.5YN/4-DARK GR EY,5Y3/1-VERY DARK GREY"," 1CM THICK BLACK SHALE LAYE RS AT 13 27 55 84 118 AND 142CM,DARK GREY TO VERY DA RK GREY CALCILUTITE WITH MILLIMETER SIZE LAMINATIONS LOCATED FROM 74-79CM,LIGHT BLUE GREY BIOTURBATED CA LCILUTITE WITH <1MM THICK WHITE CALCILUTITE BLEBS LO CATED FROM 132-139 AND 146-150CM,REMAINDER OF SECTIO N LIGHT GREY TO OLIVE GREY CALCILUTITE WITH MILLIMET ER SIZE LAMINATIONS", SLIGHTLY CRACKED,,,,, HARD, 12231110,5b37003b375f71aa523795ba1d15e7e2,44-391C-29-4
44,391,C,29,5,0.0,150.0,1171.50,1177.50,1179.00,, LIMESTONE," 5Y6/1-LIGHT GREY,5Y5/2-OLIVE GREY,5B7/ 1-LIGHT BLUE GREY,5Y8/1-WHITE,-BLACK"," LIGHT BLUE GR EY BIOTURBATED CALCILUTITE WITH <1MM THICK WHITE CAL CILUTITE BLEBS LOCATED FROM 45-55 65-73 119-123 AND 145-150CM,<1CM THICK INTERLAYERS OF BLACK SHALE AND LIGHT GREY TO OLIVE GREY CALCILUTITE LOCATED FROM 80 -91CM,1CM THICK BLACK SHALE LAYERS AT 1 11 31 35 63 98 115 117 119 AND 143CM,REMAINDER OF SECTION LIGHT GREY TO OLIVE GREY CALCILUTITE WITH MILLIMETER SIZE LAMINATIONS", SLIGHTLY CRACKED EXCEPT FOR MODERATELY FRAGMENTED INTERVALS FROM 3-11 54-62 97-107 AND 126-138 CM,,,,, HA RD, 12231110,f30bda845f9f9f4201e8280452be204a,44-391C-29-5
44,391,C,30,1,100.0,150.0,1181.00,1182.00,1182.50,, LIMESTONE," 5Y6/1-LIGHT GREY,5Y5/2-OLIVE GREY,2.5Y N/4-DARK GREY,5Y3/1-VERY DARK GREY,-BLACK"," 1CM THIC K BLACK SHALE LAYERS AT 101 108 143 AND 145CM,DARK G REY TO VERY DARK GREY CALCILUTITE WITH MILLIMETER SI ZE LAMINATIONS FROM 145-149CM,REMAINDER OF SECTION L IGHT GREY TO OLIVE GREY CALCILUTITE WITH MILLIMETER SIZE LAMINATIONS,POSSIBLE STARVED RIPPLES AT 147CM", SLIGHTLY CRACKED,, PYRITE AT 147CM,,, HARD, 12231110,de70b0cccc7d6efa8140fb9bac92a4d1,44-391C-30-1
44,391,C,30,2,0.0,112.0,1181.00,1182.50,1183.62,, LIMESTONE," 5Y6/1-LIGHT GREY,5Y5/2-OLIVE GREY,5B7/ 1-LIGHT BLUE GREY,5Y8/1-WHITE,2.5YN2.5/-BLACK,2.5YN3 /-VERY DARK GREY,2.5YN/4-DARK GREY,5Y3/1-VERY DARK G REY"," LIGHT GREY TO OLIVE GREY CALCILUTITE WITH MILL IMETER SIZE LAMINATIONS LOCATED FROM 0-7 11-22 28-53 56-69 AND 75-78CM,BLACK TO VERY DARK GREY SHALE FRO M 6.5-7.5 8.5-9.5 22-23 27-28 AND 89-90CM,DARK GREY TO VERY DARK GREY CALCILUTITE WITH MILLIMETER SIZE L AMINATIONS LOCATED FROM 7.5-8.5 9.5-11 53-56 78-89 A ND 90-112CM LIGHT BLUE GREY CALCILUTITE WITH <1MM THICK WHITE CALCILUTITE BLEBS LOCATED FROM 69-75CM,BURROWS FROM 66-75CM LINED WITH CARBONACEOUS MATRIX?", SLIGHTLY C RACKED,,, SHELL AT 71CM,, HARD, 12231110,64813005bb34e010e972e26bac1ef246,44-391C-30-2
44,391,C,30,3,0.0,150.0,1181.00,1184.00,1185.50,, LIMESTONE," 5Y6/1-LIGHT GREY,5Y5/2-OLIVE GREY,5B7/ 1-LIGHT BLUE GREY,5Y8/1-WHITE,2.5YN2.5/-BLACK,2.5YN3 /-VERY DARK GREY,2.5YN/4-DARK GREY,5Y3/1-VERY DARK G REY"," LIGHT GREY TO OLIVE GREY CALCILUTITE WITH MILL IMETER SIZE LAMINATIONS LOCATED FROM 0-11 AND 45-55C M SAME SEDIMENT IS MIXED WITH LIGHT BLUE GREY BIOTUR BATED CALCILUTITE WITH <1MM THICK WHITE CALCILUTITE BLEBS FROM 121-127CM LATTER SEDIMENT ALONE LOCATED F ROM 28-45 95-120 AND 140-150CM BLACK TO VERY DARK GREY 1CM THICK SHALE LAYERS AT 21.5 27 59 66 82 84 94 120 AND 139CM,DARK GREY TO VE RY DARK GREY CALCILUTITE WITH MILLIMETER SIZE LAMINA TIONS LOCATED FROM 11-21.5 22.5-27 55-59 60-66 67-82 83-84 85-94 AND 127-135CM", SLIGHTLY CRACKED EXCEPT FOR MODERATELY FRAGMENTED INTERVALS FROM 45-55 AND 130-138CM,,,,, HARD, 12230000.3450,8c0eb395c1fbc3a64b2b5c069744d6f3,44-391C-30-3
44,391,C,30,4,0.0,104.0,1181.00,1185.50,1186.54,, LIMESTONE," 5B7/1-LIGHT BLUE GREY,5Y8/1-WHITE,5Y6/ 1-LIGHT GREY,5Y5/2-OLIVE GREY,2.5YN2.5/-BLACK,2.5YN3 /-VERY DARK GREY,2.5YN/4-DARK GREY,5Y3/1-VERY DARK G REY"," LIGHT BLUE GREY BIOTURBATED CALCILUTITE WITH < 1MM THICK WHITE CALCILUTITE BLEBS LOCATED FROM 0-20. 5 AND 47-74 SAME SEDIMENT TRANSITIONAL TO LIGHT GREY TO OLIVE GREY CALCILUTITE WITH MILLIMETER SIZE LAMI NATIONS FROM 74-81 AND IS MIXED WITH THIS SEDIMENT F ROM 30-36CM LIGHT GREY TO OLIVE GREY CALCILUTITE ALO NE LOCATED FROM 85-95 AND 96-104CM DARK GREY TO VERY DARK GREY CALCILUTITE WITH MILLI METER SIZE LAMINATIONS LOCATED FROM 20.5-30 36-43 44 -47 AND 81-85CM,1CM THICK LAYERS OF BLACK TO VERY DA RK GREY SHALE LOCATED AT 43 AND 95CM,TRUNCATED BUT A PPARENTLY NOT SCOURED SURFACE AT 132CM", SLIGHTLY CR ACKED EXCEPT FOR MODERATELY FRAGMENTED INTERVAL FROM 45-55CM,,,,, HARD, 00000000,06bc6d119472d2c0bccdb04200810c85,44-391C-30-4
44,391,C,30,4,104.0,118.0,1181.00,1186.54,1186.68,, SHALE," 2.5YN2.5/-BLACK,5Y3/1-VERY DARK GREY",, SLI GHTLY CRACKED,,,,, HARD, 00000000,255159303e53e10b8c5608b8653e3d2c,44-391C-30-4
44,391,C,30,4,118.0,150.0,1181.00,1186.68,1187.00,, LIMESTONE," 5B7/1-LIGHT BLUE GREY,5Y8/1-WHITE", SE DIMENT CONTAINS <1MM THICK WHITE CALCILUTITE BLEBS-B IOTURBATION, SLIGHTLY CRACKED,,,,, HARD, 00000000,3bb5db626f10658501140dfbd2e367ef,44-391C-30-4
44,391,C,31,1,45.0,150.0,1190.50,1190.95,1192.00,, LIMESTONE," 5Y6/1-LIGHT GREY,5Y5/2-OLIVE GREY,2.5Y N/4-DARK GREY,5Y3/1-VERY DARK GREY"," LIGHT GREY TO O LIVE GREY CALCILUTITE WITH MILLIMETER SIZE LAMINATIO NS LOCATED FROM 45-60 AND 83-108CM,DARK GREY TO VERY DARK GREY CALCILUTITE WITH MILLIMETER SIZE LAMINATI ONS LOCATED FROM 60-83 AND 108-150CM", SLIGHTLY CRAC KED,,,,, HARD, 00000000,0d343437c05f88b44b6a70afe5cf2076,44-391C-31-1
44,391,C,31,2,0.0,150.0,1190.50,1192.00,1193.50,, LIMESTONE," 5Y6/1-LIGHT GREY,5Y5/2-OLIVE GREY,2.5Y N/4-DARK GREY,5Y3/1-VERY DARK GREY,2.5Y2.5/-DARK GRE Y,2.5YN3/-VERY DARK GREY"," LIGHT GREY TO OLIVE GREY CALCILUTITE WITH MILLIMETER SIZE LAMINATIONS LOCATED FROM 0-4.5 5.5-39 59-75 85-99.5 AND 114-141,DARK GR EY TO VERY DARK GREY CALCILUTITE WITH MILLIMETER SIZ E LAMINATIONS LOCATED FROM 36-48 49-60 76-82 83-89 1 00-101 102-114 AND 142-150CM,BOUNDARIES BETWEEN TWO CALCILUTITES OVERLAP AND ARE TRANSITIONAL BLACK TO VERY DARK GREY SHALE FROM 4.5-5.5 48-49 7 5-76 82-83 99.5-100 101-102 AND 141-142CM",,,,,, HARD, 00000000,1b6f96c91606f5c26edfbfc26a5b7652,44-391C-31-2
44,391,C,31,3,0.0,150.0,1190.50,1193.50,1195.00,, LIMESTONE," 5Y6/1-LIGHT GREY,5Y5/2-OLIVE GREY,2.5Y N/4-DARK GREY,5Y3/1-VERY DARK GREY,2.5Y2.5/-DARK GRE Y,2.5YN3/-VERY DARK GREY"," DARK GREY TO VERY DARK GR EY CALCILUTITE WITH MILLIMETER SIZE LAMINATIONS LOCA TED FROM 0-14 52-56 67-74 88-107 AND 112-129CM,LIGHT GREY TO OLIVE GREY CALCILUTITE WITH MILLIMETER SIZE LAMINATIONS LOCATED FROM 10-20 21-43 44-52 57-70 73 -81 82-90 108-113 126-146 AND 147-150,BOUNDARIES BET WEEN THE TWO CALCILUTITES OVERLAP AND ARE TRANSITION AL BLACK TO VERY DARK GREY SHALE LAYERS FROM 20-21 43 -44 56-57 81-82 107-108 AND 146-147CM", SLIGHTLY CRA CKED,,,,, HARD, 12130000,325ce43afbe4442f075138322790968b,44-391C-31-3
44,391,C,31,4,0.0,150.0,1190.50,1195.00,1196.50,, LIMESTONE," 5Y6/1-LIGHT GREY,5Y5/2-OLIVE GREY,2.5Y N2.5/-BLACK,2.5YN3/-VERY DARK GREY,2.5YN/4-DARK GREY ,5Y3/1-VERY DARK GREY"," DARK GREY TO VERY DARK GREY CALCILUTITE WITH MILLIMETER SIZE LAMINATIONS LOCATED FROM 0-41 42-70 99-112 114-148,LIGHT GREY TO OLIVE GREY CALCILUTITE WITH MILLIMETER SIZE LAMINATIONS LO CATED FROM 68-113CM,BOUNDARIES BETWEEN THE TWO CALCI LUTITES OVERLAP AND ARE TRANSITIONAL,BLACK TO VERY D ARK GREY SHALE LAYERS FROM 41-42 112-114 AND 148-150 CM", SLIGHTLY CRACKED,,,,, HARD, 12130000,777c905085e0f71ecdcf966d8e29bc6b,44-391C-31-4
44,391,C,31,5,0.0,150.0,1190.50,1196.50,1198.00,, LIMESTONE," 5Y6/1-LIGHT GREY,5Y5/2-OLIVE GREY,2.5Y N2.5/-BLACK,2.5YN3/-VERY DARK GREY,2.5YN/4-DARK GREY ,5Y3/1-VERY DARK GREY"," DARK GREY TO VERY DARK GREY CALCILUTITE WITH MILLIMETER SIZE LAMINATIONS LOCATED FROM 0-1 2-33 34-45 54-56 57-80 102-135,LIGHT GREY TO OLIVE GREY CALCILUTITE WITH MILLIMETER SIZE LAMIN ATIONS LOCATED FROM 46-55 81-104 AND 135-150CM,BOUND ARIES BETWEEN THE TWO CALCILUTITES OVERLAP AND ARE T RANSITIONAL,BLACK TO VERY DARK GREY SHALE LAYERS FRO M 0-1 33-34 45-46 56-57 AND 80-81CM AND AT 110CM", SLIGHTLY CRACKED,,,,, HARD, 00000000,9c5e6cc69fce5eaaa625dbf765359a2c,44-391C-31-5
44,391,C,31,6,0.0,150.0,1190.50,1198.00,1199.50,, LIMESTONE," 5Y6/1-LIGHT GREY,5Y5/2-OLIVE GREY,5B7/ 1-LIGHT BLUE GREY,5Y8/1-WHITE,2.5YN2.5/-BLACK,2.5YN3 /-VERY DARK GREY,2.5YN/4-DARK GREY,5Y3/1-VERY DARK G REY"," DARK GREY TO VERY DARK GREY CALCILUTITE WITH M ILLIMETER SIZE LAMINATIONS LOCATED FROM 0-9 42-55 64 -68 99-114 AND 137-150CM,DARK GREY TO VERY DARK GREY CALCILUTITE WITH MILLIMETER SIZE LAMINATIONS LOCATE D FROM 7-48 53-65 67-101 AND 112-121CM,LIGHT BLUE GR EY BIOTURBATED CALCILUTITE WITH <1MM THICK WHITE CAL CILUTITE BLEBS LOCATED FROM 120-139CM BOUNDARIES BETWEEN DIFFERENT CALCILUTITE LAYERS OV ERLAP AND ARE TRANSITIONAL,1CM THICK BLACK TO VERY D ARK GREY SHALE LAYERS AT 105 AND 109CM", SLIGHTLY DE FORMED EXCEPT FOR MODERATELY FRAGMENTED INTERVALS FR OM 30-42 86-104 AND 130-150CM,,,,, HARD, 00000000,94fc3b5cc9fca6753c85afc72099e567,44-391C-31-6
44,391,C,31,CC,0.0,0.0,1190.50,1199.60,1199.60,, LIMESTONE," 2.5YN2.5/-BLACK,2.5YN3/-VERY DARK GRAY ,5B7/1-LIGHT BLUE GREY,5Y8/1-WHITE"," BLACK TO VERY D ARK GREY SHALE LAYER FROM 0-4CM,LIGHT BLUE GREY BIOT URBATED CALCILUTITE WITH <1MM THICK WHITE CALCILUTIT E BLEBS LOCATED FROM 4-13CM", SLIGHTLY CRACKED,,,,, HAR D, 00000000,030efe190e88df75d7817df8171bbeaf,44-391C-31-CC
44,391,C,32,1,110.0,150.0,1200.00,1201.10,1201.50,, LIMESTONE," 5Y6/1-LIGHT GREY,5Y5/2-OLIVE GREY,5B7/ 1-LIGHT BLUE GREY,5Y8/1-WHITE"," LIGHT BLUE GREY BIOT URBATED CALCILUTITE WITH <1MM THICK WHITE CALCILUTIT E BLEBS LOCATED FROM 110-113,LIGHT GREY TO OLIVE GRE Y CALCILUTITE WITH MILLIMETER SIZE LAMINATIONS LOCAT ED FROM 113-150CM",,,,,, HARD, 00000000,05a00e27166578d09a4782eccdb8afbe,44-391C-32-1
44,391,C,32,2,0.0,150.0,1200.00,1201.50,1203.00,, LIMESTONE," 5Y6/1-LIGHT GREY,5Y5/2-OLIVE GREY,5B7/ 1-LIGHT BLUE GREY,5Y8/1-WHITE,2.5YN/4-DARK GREY,5Y3/ 1-VERY DARK GREY", LIGHT GREY TO OLIVE GREY CALCILUT ITE WITH MILLIMETER SIZE LAMINATIONS LOCATED FROM 0- 61 94-105 120-127 AND 137-140CM SAME SEDIMENT IS MIX ED WITH LIGHT BLUE GREY CALCILUTITE WITH <1MM THICK WHITE CALCILUTITE BLEBS FROM 80-94 AND 105-112 CM TH E LATTER LIGHT BLUE GREY CALCILUTITE OCCURS ALONE FR OM 61-70 112-113 127-137 AND 146-150CM DARK GREY TO VERY DARK GREY CALCILUTITE WITH MILLI METER SIZE LAMINATIONS LOCATED FROM 70-80 113-120 AN D 140-146CM," MODERATELY FRAGMENTED FROM 0-50CM,SLIG HTLY CRACKED FROM 50-150CM",,,,, HARD, 00000000,fb79d811c9cc74f36d2e89434fba8d5e,44-391C-32-2
44,391,C,32,3,0.0,150.0,1200.00,1203.00,1204.50,, LIMESTONE," 5Y6/1-LIGHT GREY,5Y5/2-OLIVE GREY,-LIG HT BLUE GREY,5B7/1-LIGHT BLUE GREY,5Y8/1-WHITE,2.5YN /4,5Y3/1-VERY DARK GREY"," LIGHT GREY TO OLIVE GREY C ALCILUTITE WITH MILLIMETER SIZE LAMINATIONS LOCATED FROM 0-12 40-50 51-65 AND 72-96CM SAME SEDIMENT IS T RANSITIONAL TO A LIGHT BLUE GREY CALCILUTITE WITH <1 MM SIZE WHITE CALCILUTITE BLEBS FROM 96-105CM AND GR ADES INTO A DARK GREY TO VERY DARK GREY CALCILUTITE WITH MILLIMETER SIZE LAMINATIONS FROM 114.5-150CM LIGHT BLUE GREY BIOTURBATED CALCILUTITE WITH <1MM THICK WHITE CALCILUTITE BLEBS LOCATED FROM 12-21 AND 25-40CM,DARK GREY TO VERY DARK GREY CALCILUTITE WIT H MILLIMETER SIZE LAMINATIONS LOCATED FROM 21-25 50- 51 65-72 AND 105-114.5CM", SLIGHTLY CRACKED EXCEPT F OR MODERATELY FRAGMENTED INTERVALS FROM 11-20 75-88 AND 115-128CM,,,,, HARD, 00000000,a2ffeed8f43af5b1506cce4bc7c28b49,44-391C-32-3
44,391,C,32,4,0.0,150.0,1200.00,1204.50,1206.00,, LIMESTONE," 5Y6/1-LIGHT GREY,5Y5/2-OLIVE GREY,5B7/ 1-LIGHT BLUE GREY,5Y8/1-WHITE,2.5YN/4-DARK GREY,5Y3/ 1-VERY DARK GREY"," LIGHT GREY TO OLIVE GREY CALCILUT ITE WITH MILLIMETER SIZE LAMINATIONS LOCATED FROM 3- 25 35-50 94-101 AND 110-150CM,DARK GREY TO VERY DARK GREY CALCILUTITE WITH MILLIMETER SIZE LAMINATIONS L OCATED FROM 0-3 50-55 80-83 85-94 AND 101-110CM,LIGH T BLUE GREY BIOTURBATED CALCILUTITE WITH <1MM THICK WHITE CALCILUTITE BLEBS LOCATED FROM 25-35 55-80 AND 83-85CM,SMALL NORMAL TYPE FAULT FROM 42-48CM", SLIGHTLY CRACKED EXCEPT FOR INTERVAL OF DRILLING B RECCIA FROM 11-24CM, COAL POSSIBLY PRESENT AT 110CM,,,, HARD, 00000000,1fc38042941a572bb7eae963edfdf681,44-391C-32-4
44,391,C,32,CC,0.0,0.0,1200.00,1206.10,1206.10,, LIMESTONE," 5Y6/1-LIGHT GREY,5Y5/2-OLIVE GREY,2.5Y N2.5/-BLACK,2.5YN3/-VERY DARK GREY,2.5YN/4-DARK GREY ,5Y3/1-VERY DARK GREY"," BLACK TO VERY DARK GREY SHAL E LOCATED FROM 0-2 AND 18-19CM,LIGHT GREY TO OLIVE G REY CALCILUTITE WITH MILLIMETER SIZE LAMINATIONS LOC ATED FROM 2-15CM,DARK GREY TO VERY DARK GREY CALCILU TITE WITH MILLIMETER SIZE LAMINATIONS LOCATED FROM 1 5-18 AND 19-21CM", MODERATELY FRAGMENTED,,,,, HARD, 00000000,11cb5c376fcc26ce260e7f425b9263af,44-391C-32-CC
44,391,C,33,1,90.0,150.0,1209.50,1210.40,1211.00,, LIMESTONE," 5Y6/1-LIGHT GREY,5Y5/2-OLIVE GREY,5B7/ 1-LIGHT BLUE GREY,5Y8/1-WHITE,2.5YN/4-DARK GREY,5Y3/ 1-VERY DARK GREY"," LIGHT BLUE GREY BIOTURBATED CALCI LUTITE WITH <1MM THICK WHITE CALCILUTITE BLEBS LOCAT ED FROM 90-104.5CM,LIGHT GREY TO OLIVE GREY CALCILUT ITE WITH MILLIMETER SIZE LAMINATIONS LOCATED FROM 10 4.5-135 AND 136-150CM,DARK GREY TO VERY DARK GREY CA LCILUTITE WITH MILLIMETER SIZE LAMINATIONS LOCATED F ROM 135-136CM", MODERATELY FRAGMENTED,,,, SOFT-SEDIMEN T DISTORTION AT 130CM, HARD, 00000000,90cfbd3b4112e3cd621ce614338e1491,44-391C-33-1
44,391,C,33,3,0.0,150.0,1209.50,1212.50,1214.00,, LIMESTONE," 5Y6/1-LIGHT GREY,5Y5/2-OLIVE GREY,5B7/ 1-OLIVE GREY,2.5YN/4-DARK GREY,5Y3/1-VERY DARK GREY, 5B7/1-LIGHT BLUE GREY,5Y8/1-WHITE"," LIGHT GREY TO OL IVE GREY CALCILUTITE WITH MILLIMETER SIZE LAMINATION S LOCATED FROM 15-29 31-44 AND 63-71CM-SAME SEDIMENT IS MIXED WITH A LIGHT BLUE GREY BIOTURBATED CALCILU TITE WITH <1MM THICK WHITE CALCILUTITE BLEBS FROM 0- 8CM-THIS LIGHT BLUE GREY CALCILUTITE OCCURS ALONE FR OM 46-63 71-100 AND 102-150CM DARK GREY TO VERY DARK GREY CALCILUTITE WITH MILLI METER SIZE LAMINATIONS LOCATED FROM 8-15 29-31 44-46 AND 100-102CM,FAULT WITH .5CM THROW AT 40CM,SOFT SE DIMENT SLUMP AND SEDIMENT HEALED FRACTURES FROM 115- 121CM,INCLINED SHALY STRINGERS FROM 128-131CM,SUB-HO RIZONTAL LAMINATIONS FROM 148-150CM", SLIGHTLY CRACK ED EXCEPT FOR MODERATELY FRAGMENTED INTERVAL FROM 56 -67CM,, PYRITE AT 117CM-REPLACES RADS, PYRITIZED RA DS AT 117CM,, HARD, 00000000,a38538c3cdfb539d5a4dd3d1cb97dc8b,44-391C-33-3
44,391,C,34,1,87.0,150.0,1219.00,1219.87,1220.50,, LIMESTONE," 5Y4/1-DARK GREY,5Y5/1-GREY,5G6/1-GREEN ISH GREY,5PB5/2-GREY BLUE,5B5/1-MEDIUM BLUISH GREY,1 0G4/2-GREY GREEN,-LIGHT BROWNISH GREY"," DARK GREY TO GREY ARGILLACEOUS LIMESTONE WITH MILLIMETER SIZE LA MINATIONS AND MICRO-FAULTS LOCATED FROM 87-89CM,GREE NISH GREY BURROWED CALCILUTITE LAYERS FROM 89-93 AND 98-119CM,GREENISH GREY BURROWED CALCILUTITE WITH TO NES OF GREY BLUE LOCATED FROM 93-98CM,MEDIUM BLUISH GREY TO GREENISH GREY BURROWED CALCILUTITE LOCATED F ROM 119-122CM VERY ARGILLACEOUS GREY GREEN CALCILUTITE FROM 122- 132CM,GREY GREEN CALCILUTITE WITH CRUDE LAMINATIONS LOCATED FROM 132-150CM CALCILUTITE IN THIS INTERVAL BECOMES VERY ARGILLACEOUS TOWARDS THE BASE AND TAKES ON LIGHT BROWNISH GREY TONES",,,,,, HARD, 00000000,c1a68bbbab11eed27223233636419b45,44-391C-34-1
44,391,C,34,2,0.0,150.0,1219.00,1220.50,1222.00,, LIMESTONE," -DARK GREY,-GREENISH,-DARK GREEN,5B9/1 -BLUISH WHITE,5B5/1-MEDIUM BLUISH GREY,5Y3/1-VERY DA RK GREY"," DARK GREY ARGILLACEOUS LIMESTONE LAMINITE WITH LAMINAE INCLINED IN CORE LINER AND WITH MICROFA ULTS LOCATED FROM 0-10CM,BURROWED GREENISH LIMESTONE WITH CRUDE DARKER GREEN LAMINAE LOCATED FROM 10-60C M,GREENISH LIMESTONE IN INTERVAL FROM 10-29CM IS LAM INATED AT TOP AND MARBLE-LIKE AT BASE AND CONTAINS M ICROFAULTS THAT DIE OUT WITHIN CORE ONE NORMAL AND ONE REVERSE FAULT IN INTERVAL FROM 29-37CM WITH BOTH DYING OUT WITHIN CORE,GREENISH LIM ESTONE IN INTERVAL FROM 37-60CM IS LAMINATED AT THE TOP AND MARBLY AT THE BASE,DARK GREY TO VERY DARK GR EY CALCILUTITE LAMINITE FROM 60-62CM,BLUISH WHITE CA LCILUTITE WITH MEDIUM BLUISH GREY STRINGERS LOCATED FROM 62-150CM AND CONTAINS <1CM LARGE ISOLATED? BURR OWS", SLIGHTLY CRACKED,,,, STRINGERS CONTAIN MORE CLAY AND POSSIBLY MORE ORGANIC MATERIAL GREEN LIMESTONE LITHOLOGY IS CONFORMABLE WITH OVER LYING LAMINITES THE EVIDENCE BEING THE OBSERVATION T HAT THE TWO LITHOLOGIES ARE INTERBEDDED AND THAT THE RE IS A GRADATION BETWEEN THE TWO LITHOLOGIES AND TH AT THERE IS AN APPARENT ABSENCE OF ANY SURFACE OF ER OSION, HARD, 00000000,1f570ac072907c59c07e81caaa8a9810,44-391C-34-2
44,391,C,34,3,0.0,150.0,1219.00,1222.00,1223.50,, LIMESTONE," 5B9/1-BLUISH WHITE,5B5/1-MEDIUM BLUISH GREEN"," SECTION CONSISTS OF BLUISH WHITE CALCILUTIT E WITH MEDIUM BLUISH GREEN STRINGERS AND BURROW FILL INGS,BASAL 40CM OF SECTION MORE UNIFORMLY MEDIUM BLU ISH GREEN", SLIGHTLY CRACKED,,,, COMPACTION AND/OR SLI DING OF UNCONSOLIDATED SEDIMENTS PRODUCED WISPY CREP E FABRIC, HARD, 00000000,636c43e25a1451a471fe3f66929ea3c6,44-391C-34-3
44,391,C,34,4,0.0,150.0,1219.00,1223.50,1225.00,, LIMESTONE," 5Y6/1-LIGHT GREY,5Y5/2-OLIVE GREY,2.5Y N/4-DARK GREY,5Y3/1-VERY DARK GREY,5B5/1-BLUISH GREE N,5B9/1-BLUISH WHITE"," LIGHT GREY TO OLIVE GREY CALC ILUTITE WITH MILLIMETER SIZE LAMINATIONS LOCATED FRO M 0-6CM,DARK GREY TO VERY DARK GREY CALCILUTITE WITH MILLIMETER SIZE LAMINATIONS LOCATED FROM 6-14CM,BLU ISH WHITE CALCILUTITE WITH WISPY BLUISH GREEN LAMINA E LOCATED FROM 14-150CM", SLIGHTLY CRACKED,,,,, HARD, 00000000,c591c2df56308694b9b9882011de6783,44-391C-34-4
44,391,C,35,1,0.0,150.0,1228.50,1228.50,1230.00,, LIMESTONE," 5B5/1-BLUE GREEN,5B9/1-BLUISH WHITE"," SECTION CONSISTS OF LARGELY BIOTURBATED MIXED BLUE G REEN AND BLUISH WHITE CALCILUTITE WITH SPARSE LAMINA TIONS,OBVIOUS BURROWS PLUS GENERAL BUT ENIGMATIC OBL ITERATION OF LAMINAE", SLIGHTLY CRACKED,,,,, HARD, 00000000,74ba3b2ee60ede0a726c1a732ed7e789,44-391C-35-1
44,391,C,35,2,0.0,150.0,1228.50,1230.00,1231.50,, LIMESTONE," 5B5/1-BLUE GREEN,5B9/1-BLUISH WHITE,2. 5YN/4-DARK GREY,5Y3/1-VERY DARK GREY"," SPARSELY LAMI NATED LARGELY BIOTURBATED MIXED BLUISH GREEN AND BLU ISH WHITE CALCILUTITE LOCATED FROM 0-52 70-81 AND 83 -150CM,DARK GREY TO VERY DARK GREY CALCILUTITE WITH MILLIMETER SIZE LAMINATIONS LOCATED FROM 52-70 AND 8 1-83CM, GENERAL OBLITERATION OF LAMINAE", SLIGHTLY C RACKED,,,,, HARD, 00000000,8d567624d68b7c5c1f21e5e1e4d4f6a5,44-391C-35-2
44,391,C,35,3,0.0,150.0,1228.50,1231.50,1233.00,, LIMESTONE," 5B5/1-BLUISH GREEN,5B9/1-BLUISH WHITE, 2.5YN/4-DARK GREY,5Y3/1-VERY DARK GREY"," BIOTURBATED AND SPARSELY LAMINATED BLUISH GREEN TO BLUISH WHITE CALCILUTITE LOCATED FROM 0-4 6-50 52-75 83-138 AND 138-140CM,DARK GREY TO VERY DARK GREY LAMINATED CALC ILUTITE LOCATED FROM 4-6 50-52 75-83 AND 138-140CM", SLIGHTLY CRACKED EXCEPT FOR MODERATELY FRAGMENTED I NTERVAL FROM 0-4CM,,,,, HARD, 00000000,79c20ce24ac6b87605d6276c0cc1b50c,44-391C-35-3
44,391,C,35,4,0.0,120.0,1228.50,1233.00,1234.20,, LIMESTONE," 5B5/1-BLUISH GREEN,5B9/1-BLUISH WHITE, 5Y4/1-DARK GREY"," SECTION BIOTURBATED AND SPARSELY L AMINATED,.5CM THICK DARK GREY SHALE LAYERS AT 69 AND 90CM", SLIGHTLY CRACKED FROM 0-90CM,,,,, HARD, 00000000,ad48083b0e9bbe766059e02ebb69915d,44-391C-35-4
44,391,C,36,1,40.0,150.0,1238.00,1238.40,1239.50,, LIMESTONE," 5B5/1-BLUISH GREEN,5B./1-BLUISH WHITE", SECTION IS BIOTURBATED AND SPARSELY LAMINATED,,,,,, HA RD, 00000000,8701a93a11145003cc6b4d038a14c77a,44-391C-36-1
44,391,C,36,2,0.0,150.0,1238.00,1239.50,1241.00,, LIMESTONE," 5B9/1-BLUISH WHITE,5GY6/1-GREENISH GRE Y,5Y4/1-OLIVE GREY,2.5YN/4-DARK GREY,5Y3/1-VERY DARK GREY"," DARK GREY CALCILUTITE LAMINITE LOCATED FROM 0-3 AND 19-27CM,1CM THICK SOLID DARK LAYER AT 53CM,R EMAINDER OF SECTION BLUISH WHITE BIOTURBATED CALCILU TITE WITH IRREGULAR BLUISH WHITE AND GREENISH GREY L AMINAE-MORE EVEN LAMINATIONS FROM 44-48 80-83 87-96 107-114 AND 130-146CM", SLIGHTLY CRACKED EXCEPT FOR MODERATELY FRAGMENTED INTERVALS FROM 11-27 AND 78-88 CM,,,, SECTION HAS CREPE APPEARANCE, HARD, 00000000,4648409ee1849e369594a739261a2a82,44-391C-36-2
44,391,C,36,3,0.0,150.0,1238.00,1241.00,1242.50,, LIMESTONE," 5B9/1-BLUISH WHITE,5GY6/1-GREENISH GRE Y,5Y4/1-OLIVE GREY,2.5YN/4-DARK GREY,5Y3/1-VERY DARK GREY,5Y6/1-LIGHT GREY,5Y5/2-OLIVE GREY"," DARK GREY CALCILUTITE LAMINITE FROM 10-15CM,INTERVAL FROM .2-1 00CM CONTAINS SEDIMENT INTERMEDIATE BETWEEN A LIGHT GREY TO OLIVE GREY CALCILUTITE AND A DARK GREY TO VE RY DARK GREY CALCILUTITE,REMAINDER OF SECTION BLUISH WHITE BIOTURBATED CALCILUTITE WITH GREENISH GREY AN D OLIVE GREY LAMINAE,ROBUST BURROWS FROM 80-90CM", S LIGHTLY CRACKED,,,, SECTION HAS A CREPE APPEARANCE, HARD, 00000000,d1fcbeae7cae0bfc906f80fc976b74f9,44-391C-36-3
44,391,C,36,4,0.0,150.0,1238.00,1242.50,1244.00,, LIMESTONE," 5B9/1-BLUISH WHITE,5GY6/1-GREENISH GRE Y,5Y4/1-OLIVE GREY,-DARK GREY,-BLACK"," DARK GREY CAL CILUTITE LAMINITE LOCATED FROM 38-39CM,BLACK STAINED SILKENSIDES AT 135CM-MINERALIZED,ROBUST BURROWS FRO M 105-120CM,REMAINDER OF SECTION BLUISH WHITE BIOTUR BATED CALCILUTITE WITH IRREGULAR GREENISH GREY AND O LIVE GREY LAMINAE"," SLIGHTLY CRACKED FROM 0-136CM,MO DERATELY FRAGMENTED FROM 136-150CM",,,, SECTION HAS CRE PE APPEARANCE, HARD, 00000000,96eb5ff53735a2d8c48cfa72acb2fd60,44-391C-36-4
44,391,C,36,5,0.0,150.0,1238.00,1244.00,1245.50,, LIMESTONE," 5B9/1-BLUISH WHITE,5GY6/1-GREENISH GRE Y,5Y4/1-OLIVE GREY,2.5YN/4-DARK GREY"," DARK GREY CAL CILUTITE LAMINITE LOCATED FROM 92-104 AND 134-135CM, REMAINDER OF SECTION BLUISH WHITE BIOTURBATED CALCIL UTITE WITH IRREGULAR GREENISH GREY AND OLIVE GREY LA MINAE-THIS SEDIMENT HAS A CREPE APPEARANCE,MICROFAUL TS AT 35CM AND FROM 92-104CM",,,,,, HARD, 00000000,e9c6c664c3408f0ea4b53c2289cd18e1,44-391C-36-5
