44,391,C,15,2,0.0,150.0,1010.00,1011.50,1013.00,, ARGILLACEOUS LIMESTONE," 5Y3/1-DARK GREY,5Y4/1-DAR K GREY"," LIMESTONE+SHALE PRESENT,CONVOLUTE LAMINATIO NS FROM 7-11CM,CROSS LAMINATIONS AT 135 AND FROM 109 -110CM,GRADED BEDDING FROM 45-51 61-66 75-79 90-93 A ND 127-129CM", MODERATELY DEFORMED,, PYRITE CONCRETI ON AT 93CM,,, HARD, 00000000,240f35197071b89277bff8a95f3d7414,44-391C-15-2
44,391,C,15,3,0.0,65.0,1010.00,1013.00,1013.65,, LIMESTONE," 5Y5/1-GREY,5Y5/2-OLIVE GREY", PULL-APA RT ZONE AT 62CM, MODERATELY FRAGMENTED,, PYRITIZED COPROLITE FROM 16-18CM,, CALCILUTITE+CALCISILITE+CAL CARENITE PRESENT, HARD, 00000000,436b9e23cd448103bbebfdbf02e26721,44-391C-15-3
44,391,C,15,3,65.0,81.0,1010.00,1013.65,1013.81,, SHALE," 5Y5/2-OLIVE GREY,5Y2.5/1",, MODERATELY DEFO RMED,,,,, HARD, 33233000,9ea022f5a5d161e2fed90c578dbf9cca,44-391C-15-3
44,391,C,15,3,81.0,150.0,1010.00,1013.81,1014.50,, LIMESTONE," 5Y5/1-GREY,5Y5/2-OLIVE GREY"," CROSS LA MINATIONS FROM 83-84 AND 123-125CM,GRADED BEDDING AT 130CM AND GRADED CALCARENITE FROM 133-136CM,PULL AP ART ZONE AT 82CM", MODERATELY FRAGMENTED,, CARB LITH OCLASTS FROM 94-99CM, MOLLUSK DEBRIS FROM 94-99CM,, HARD, 12130000,b56d99a3afb03be414f8450743a849a8,44-391C-15-3
44,391,C,16,1,64.0,110.0,1019.50,1020.14,1020.60,, LIMESTONE," 5Y5/1-GREY,5Y5/2-OLIVE GREY,5Y2.5/1"," 5Y2.5/1 SHALE LAYER FROM 89-91CM,CROSS LAMINATIONS F ROM 74-77 AND 93-100CM,POSSIBLE BIOTURBATION FROM 64 -71CM,SCOUR AND FILL STRUCTURE FROM 93-100CM", MODER ATELY FRAGMENTED EXCEPT FOR INTERVAL OF DRILLING BRE CCIA FROM 70-76CM,,,,, HARD, 12130000,9cf41ed6ebe233a62c35d8d37fcb4676,44-391C-16-1
44,391,C,16,2,0.0,150.0,1019.50,1021.00,1022.50,, SHALY LIMESTONE," 5Y5/1-GREY,5Y2.5/1"," BIOTURBATIO N FROM 23-29 AND 68-72CM,SCOUR+FILL STRUCTURE AT 89C M,GRADED BEDDING FROM 119-12MCM WITH CALCARENITE AT BASE", MODERATELY FRAGMENTED,,,,, HARD, 00000000,ef2df7827a625bc7756b9ace35efea5a,44-391C-16-2
44,391,C,16,3,0.0,150.0,1019.50,1022.50,1024.00,, SHALY LIMESTONE," 5Y5/1-GREY,5Y2.5/1"," BIOTURBATIO N FROM 10-14CM,BURROW AT 28CM", MODERATELY FRAGMENTE D, SHALE CLAST AT 12CM,,,, HARD, 00000000,482333f7861a699fbd6042b586ef78f2,44-391C-16-3
44,391,C,16,4,0.0,70.0,1019.50,1024.00,1024.70,, SHALY LIMESTONE," 5Y5/1-GREY,5Y2.5/1"," CROSS LAMIN ATIONS FROM 37-38CM,LENTICULAR LAMINATIONS FROM 64-6 9CM-SCOUR+FILL,SCOUR+FILL STRUCTURES AT 15CM,POSSIBL E BIOTURBATION FROM 58-63CM", MODERATELY FRAGMENTED EXCEPT FOR INTERVAL OF DRILLING BRECCIA FROM 57-59CM,,,,, HARD, 00000000,654416e9fa6039d6739e84f762746ee0,44-391C-16-4
44,391,C,16,4,70.0,126.0,1019.50,1024.70,1025.26,, SANDY LIMESTONE," 5Y5/1-GREY,5Y2.5/1", SHALE STRIN GERS AND CLASTS THROUGHOUT, MODERATELY FRAGMENTED,,,,, HARD, 00000000,c1953431bb21207501015983b004c756,44-391C-16-4
44,391,C,16,4,126.0,150.0,1019.50,1025.26,1025.50,, SHALY LIMESTONE," 5Y5/1-GREY,5Y2.5/1", BIOTURBATIO N FROM 140-142CM, MODERATELY FRAGMENTED,,,,, HARD, 00000000,edd9b88d8617177aeb6a8d0d66f9e552,44-391C-16-4
44,391,C,17,1,63.0,98.0,1029.00,1029.63,1029.98,, SANDY LIMESTONE," 5Y5/1-GREY,5Y2.5/1"," SANDY CALCA RENITE FROM 63-68CM AND AT 72CM WITH FILLED BURROWS, SHALY CALCISILITE FROM 88-93CM,5Y2.5/1 SHALE FROM 79 -81CM,BIOTURBATION 84-88CM"," DRILLING BRECCIA FROM 6 3-80CM,MODERATELY FRAGMENTED FROM 80-98CM",,,,, HARD, 00000000,9f1ece37150ed4ec2596e8836e63cd93,44-391C-17-1
44,391,C,17,1,98.0,106.0,1029.00,1029.98,1030.06,, SHALE, 5Y2.5/1,, MODERATELY FRAGMENTED,,,,, HARD, 00000000,bb2e96fce8de37f3f5df3d6fbf6d4caa,44-391C-17-1
44,391,C,17,1,106.0,150.0,1029.00,1030.06,1030.50,, SANDY LIMESTONE, 5Y5/1-GREY," GRADED TURBIDITE IN TERVAL FROM 106-145CM,INCLINED LAMINAE AT 130CM,BURR OWED CALCARENITE FROM 106-108CM", MODERATELY DEFORME D,,,,, HARD, 00000000,bbbbd7d50f71934f4d37c47564c197d8,44-391C-17-1
44,391,C,17,2,0.0,30.0,1029.00,1030.50,1030.80,, SANDY LIMESTONE," 5Y5/1-GREY,5Y2.5/1"," WHOLE INTER VAL POSSIBLE GRADED TURBIDITE DEPOSIT,5Y2.5/1 SHALE PARTING ON TOP,1CM THICK DARK LAMINAE AT 22CM", MODE RATELY FRAGMENTED,,,,, HARD, 00000000,9396b9e653d311f31192ae2c558a4f36,44-391C-17-2
44,391,C,17,2,30.0,40.0,1029.00,1030.80,1030.90,, SHALE, 5Y2.5/1,, HIGHLY FRAGMENTED,,,,, HARD, 00000000,bb4b3571fc8dc700990182010753606c,44-391C-17-2
44,391,C,17,2,40.0,150.0,1029.00,1030.90,1032.00,, SANDY LIMESTONE," 5Y5/1-GREY,5Y2.5/1"," GRADED TURB IDITE INTERVALS FROM 40-110 AND 126-150CM,CROSS LAMI NATED FROM 40-47 AND 126-130CM,5Y2.5/1 SHALE LAYER F ROM 108-110CM", SLIGHTLY CRACKED EXCEPT FOR MODERATE LY FRACTURED INTERVAL FROM 110-125CM,,,,, HARD, 00000000,c31f7d74dc8a4da9dfd80f5274e4eb39,44-391C-17-2
44,391,C,18,1,0.0,150.0,1038.50,1038.50,1040.00,, SANDY LIMESTONE," 5Y5/1-GREY,5Y4/1-DARK GREY"," CRO SS LAMINATIONS THROUGHOUT,CROSS LAMINATION ABUT UNDE RLYING EROSIONAL SURFACE FROM 130-139CM,BURROWS FROM 139-149CM", MODERATELY DEFORMED,," PYRITE STRINGER F ROM 113-114CM,CALCISPHERES PRESENT", SHELL FRAGMENT PRESENT AT 10/CM, LIMESTONE INCLUDES CALCARENITES, HARD, 00000000,6d2f03646f3fc0465da066525d401147,44-391C-18-1
44,391,C,18,CC,0.0,0.0,1038.50,1040.10,1040.10,, SANDY LIMESTONE," 5Y5/1-GREY,5Y4/1-DARK GREY"," CRO SS LAMINATIONS FROM 7-15 AND 16-18CM,BURROWS FROM 7- 15CM", DRILLING SLURRY FROM 15-16CM, LITHOCLAST CHIPS FROM 18-22CM,, SKELETAL CHIPS FROM 18-22CM,, HARD, 00000000,5ca313ff9b7c30a551e570290d4d802a,44-391C-18-CC
44,391,C,21,1,40.0,129.0,1086.00,1086.40,1087.29,, CALCAREOUS CLAYSTONE, 2.5YN5/-GREY,, DRILLING BRE CCIA,,,,, HARD, 00000000,ba246fbbd590e4752bf05f7301bb8b5d,44-391C-21-1
44,391,C,21,2,10.0,150.0,1086.00,1087.60,1089.00,, CALCAREOUS CLAYSTONE, 5Y5/1-GREY,, DRILLING BRECC IA,,,, VOID FROM 69-85CM, HARD, 00000000,92abe1f379c5fe5480f428d97d938dfa,44-391C-21-2
44,391,C,21,3,0.0,100.0,1086.00,1089.00,1090.00,, CALCAREOUS CLAYSTONE," 2.5YN3/-VERY DARK GREY,5B5/ 1-MEDIUM BLUE GREY,5YR4/3-RED BROWN", MIXTURE OF MED IUM BLUE GREY AND VERY DARK GREY CALCAREOUS CLAYSTON E ALONG WITH TRACES OF RED BROWN CLAYSTONE, DRILLIN G BRECCIA,,,,, HARD, 00000000,e05f0a4a5b3e76ed986a208327c494d6,44-391C-21-3
44,391,C,21,4,0.0,60.0,1086.00,1090.50,1091.10,, CALCAREOUS CLAYSTONE," 2.5YN3/-VERY DARK GREY,5B5/ 1-MEDIUM BLUE GREY,5B5/1-RED BROWN", MIXTURE OF VERY DARK GREY AND MEDIUM BLUE GREY CALCAREOUS CLAYSTONE ALONG WITH TRACES OF RED BROWN CALCAREOUS CLAYSTONE AND SOME PYRITIC CLAYSTONE, DRILLING BRECCIA,, PYR ITE,,, HARD, 00000000,986b3f08c56bb91b3dbd55f5c9e504f2,44-391C-21-4
44,391,C,21,4,60.0,75.0,1086.00,1091.10,1091.25,, SANDY PYRITIC CALCARENITE," 5Y6/1-LIGHT GREY,5Y5/1 -GREY", VAGUELY LAMINATED, MODERATELY FRAGMENTED, WOOD CHIPS PRESENT, CALCISPHERES AND PYRITE PRESENT,,, HARD, 00000000,1de1e3c4d25a00f6abe8420f956adf95,44-391C-21-4
44,391,C,21,4,75.0,150.0,1086.00,1091.25,1092.00,, CALCAREOUS MUDSTONE," 2.5YN/4-GREY,2.5YN/3-VERY DA RK GREY"," LAYERS UP TO 10CM THICK OF BIOTURBATED GRE Y MUDSTONE,1-2CM LAYERS OF VERY DARK GREY CLAYSTONE LAYER OF PROBABLE SHALE FROM 138-140CM,CROSS-LAMINAT IONS FROM 134-135CM", MODERATELY FRAGMENTED EXCEPT F OR INTERVAL OF DRILLING BRECCIA FROM 138-140CM,,,,, HAR D, 00000000,a0733e1c736d5e0c78b3d41df948892a,44-391C-21-4
44,391,C,24,1,48.0,150.0,1124.00,1124.48,1125.50,, ARGILLACEOUS LIMESTONE," 5B7/1-LIGHT BLUISH GREY,5 Y4/1-DARK GREY,2.5YN2.5/"," BIOTURBATED LIGHT BLUISH GREY CALCILUTITE FROM 48-57 AND 65-67CM,VERY NUMEROU S MILLIMETER SIZE LAMINATIONS THROUGHOUT-MICROGRADIN G COMMON IN MILLIMETER LAMINATED LIMESTONES,VERY CAL CAREOUS 2.5YN2.5/ SHALE FROM 114-119CM"," SLIGHTLY CR ACKED FROM 48-114CM,MODERATELY FRAGMENTED FROM 114-1 50CM",, CALCISPHERES PRESENT THROUGHOUT MOSTLY FILLED WITH SPARRY CALCITE THOUGH SOME HOLLOW AND PYRITIZE D, SHELL FRAGMENTS FROM 124-125CM, DARK LAYERS EVEN MORE CALCAREOUS THAN LIGHT LAYERS, HARD, 00000000,98c9fa0ebb862172d6fcb4062cc0dc24,44-391C-24-1
44,391,C,24,2,0.0,14.0,1124.00,1125.50,1125.64,, SHALE, 2.5YN2.5/,," DRILLING BRECCIA FROM 0-7CM,SL IGHTLY CRACKED FROM 7-14CM",, SCATTERED PYRITE PRESEN T INCLUDING NODULE AT 7CM, PLANT DEBRIS AND LOCAL P LLECYPODS PRESENT,, HARD, 00000000,0325609722e5f9c8628eb1f0dde1daf8,44-391C-24-2
44,391,C,24,2,14.0,150.0,1124.00,1125.64,1127.00,, LIMESTONE," 5B7/1-LIGHT BLUISH GREY,5Y4/1-DARK GRE Y,2.5YN2.5/"," LIMESTONE WITH MILLIMETER SIZE LAMINAT IONS FROM 35-54CM,2.5YN2.5/ SHALE FROM 29-30CM,MILLI METER LAMINATIONS COMMONLY CRINKLY AND ARE ACTUALLY PAVEMENTS OF CALCISPHERES 1-3 CALCISPHERES THICK,BIO TURBATED LIGHT BLUISH GRAY CALCILUTITE FROM 66-79 85 -93 AND 124-150CM,POSSIBLE FLUTE AT 85CM"," SLIGHTLY CRACKED FROM 14-20 AND 83-150CM,MODERATELY CRACKED F ROM 20-83CM",, CALCISPHERES,,, HARD, 00000000,5da3d2a0e21cd4154ab9b869bc8bb392,44-391C-24-2
44,391,C,24,3,0.0,150.0,1124.00,1127.00,1128.50,, LIMESTONE," 5B7/1-LIGHT BLUISH GREY,5Y4/1-DARK GRE Y,2.5YN2.5/,5Y3/2-DARK OLIVE GREY"," 2.5YN2.5/ SHALE LAYER FROM 12-15CM,UNUSUAL DARK OLIVE GREY CROSS LAM INATED CALCILUTITE LAYER FROM 42-46CM,BIOTURBATED LI GHT BLUISH GREY CALCILUTITE LAYER WITH 1MM LAMINATIO NS OF DARK GREY CALCILUTITE LOCATED FROM 46-63CM,DAR K GREY LAMINATED LAYER FROM 63-82CM,CRINKLY MILLIMET ER SIZE LAMINATIONS FROM 82-95CM,LIGHT BLUISH GREY B IOTURBATED CALCILUTITE FROM 97-145CM", SLIGHTLY CRACKED EXCEPT FOR HIGHLY FRAGMENTED INTE RVAL FROM 34-46CM,,,,, HARD, 00000000,c89ce2a1c9a52e0d846650304b2621e6,44-391C-24-3
44,391,C,24,4,0.0,100.0,1124.00,1128.50,1129.50,, LIMESTONE," 5B7/1-LIGHT BLUISH GREY,5Y4/1-DARK GRE Y,5Y7/2-LIGHT GREY"," DARK GREY CALCILUTITE LAYER FRO M 0-7CM,BIOTURBATION FROM 7-22 AND 46-64CM,MILLIMETE R SIZE LAMINATIONS FROM 22-46 AND CROSS LAMINATIONS AT 70CM,CALCARENITIC LAYER FROM 71-72CM,LIGHT GREY L AYER WITH MILLIMETER SIZE LAMINATIONS FROM 72-100CM", SLIGHTLY CRACKED EXCEPT FOR INTERVALS OF DRILLING BRECCIA FROM I5-30 AND 63-65CM,, PYRITE AND CALCISPH ERES FROM 71-72CM, HOLLUSK FRAGS AND PYRITIZED RADS AND SPONGE SPIC FROM 71-72CM,, HARD, 00000000,2849d7878ec33145c6b9db60f59bb630,44-391C-24-4
44,391,C,24,4,100.0,110.0,1124.00,1129.50,1129.60,, SHALE, 2.5YN2.5/,, SLIGHTLY CRACKED,,,,, HARD, 33233000,260f685482ad09fc9a0006bea0232de1,44-391C-24-4
44,391,C,24,4,110.0,150.0,1124.00,1129.60,1130.00,, LIMESTONE," 5B7/1-LIGHT BLUISH GREY,5Y4/1-DARK GRE Y"," 2.5YN2.5/ CALCILUTITE LAYER FROM 120-123CM,CALCI LUTITE WITH MILLIMETER SIZE LAMINATIONS LOCATED FROM 123-150CM", SLIGHTLY CRACKED,,,,, HARD, 12130000,84ff026874f8e3982402d95e4bce00fa,44-391C-24-4
44,391,C,24,5,0.0,150.0,1124.00,1130.00,1131.50,, LIMESTONE," 5Y6/1-LIGHT GREY,5Y4/1-DARK GREY,2.5YN 3/-VERY DARK GREY,2.5YN2.5/"," VERY DARK GREY CALCILU TITE FROM 6-7CM,GRADED CALCISILTITE LAYER WITH SCOUR ED BASE AND BURROWED TOP LOCATED FROM 21-24CM,SLIGHT BIOTURBATION FROM 52-57 AND 61-64CM,2.5YN2.5/ SHALE LAYERS FROM 67-68 95-96 AND 110-113CM,MILLIMETER LA MINATIONS THROUGHOUT CRINKLED LAMINAE FROM 136-144CM", SLIGHTLY CRACKED,,," FECAL PELLETS AT 30CM,CLAM AT 147CM",, HARD, 00000000,3ade354f5106d9cd9f0b9bc9212bd899,44-391C-24-5
44,391,C,24,6,0.0,38.0,1124.00,1131.50,1131.88,, LIMESTONE," 5Y6/1-LIGHT GREY,5Y5/2-OLIVE GREY,2.5Y N/4-DARK GREY,5Y3/1-VERY DARK GREY"," MASSIVE OLIVE G REY CALCILUTITE FROM 0-3CM,LIGHT GREY TO OLIVE GREY CALCILUTITE WITH MILLIMETER SIZE LAMINATIONS FROM 3- 25CM,DARK GREY TO VERY DARK GREY CALCILUTITE WITH MI LLIMETER SIZE LAMINATIONS LOCATED FROM 25-38CM", MOD ERATELY FRAGMENTED,,,,, HARD, 00000000,50c2b69ab27766b8ff8ecc0a66052f62,44-391C-24-6
44,391,C,24,6,38.0,47.0,1124.00,1131.88,1131.97,, SHALE," 2.5YN2.5/-BLACK,2.5YN3/-VERY DARK GREY",, S LIGHTLY CRACKED,,,,, HARD, 33233000,13d415fc25e40743e885cd8eea2449e6,44-391C-24-6
44,391,C,24,6,47.0,113.0,1124.00,1131.97,1132.63,, LIMESTONE," 5Y6/1-LIGHT GREY,5Y5/2-OLIVE GREY,5B7/ 1-LIGHT BLUE GREY,2.5YN/4-DARK GREY,5Y3/1-VERY DARK GREY 5Y8/1-WHITE"," LIGHT GREY TO OLIVE GREY CALCILUTITE WITH MIL LIMETER SIZE LAMINATIONS LOCATED FROM 47-54 AND FROM 99-113CM,DARK GREY TO VERY DARK GREY CALCILUTITE WI TH MILLIMETER SIZE LAMINATIONS LOCATED FROM 54-59 AN D FROM 81-84CM,LIGHT BLUE GREY BIOTURBATED CALCILUTI TE FROM 59-71 74-81 AND 84-99CM CONTAINS <1MM THICK WHITE CALCILUTITE BLEBS THAT ARE POSSIBLY BURROWS,MA SSIVE OLIVE GREY CALCILUTITE FROM 71-74CM EROSIONAL SURFACE AT 72CM"," SLIGHTLY CRACKED FROM 47-99CM,MODERATELY CRACKED FROM 99-111 CM",,, PELECYPOD AT 70CM,, HARD, 12130000,317ec052a2e0d02bec09c47f62f5ac71,44-391C-24-6
44,391,C,24,6,113.0,139.0,1124.00,1132.63,1132.89,, SHALE," 2.5YN2.5/-BLACK,2.5YN3/-VERY DARK GREY",, M ODERATELY CRACKED,,,,, HARD, 00000000,e3cb1eba58d8a6e76dd4773809814346,44-391C-24-6
44,391,C,24,6,139.0,150.0,1124.00,1132.89,1133.00,, MASSIVE CALCILUTITE, 5Y5/2-OLIVE GREY,, MODERATEL Y CRACKED,, PYRITE REPLACING RADS, PYRITIZED RADS,, HARD, 00000000,20223c88a79d00e711ee606c4875d349,44-391C-24-6
44,391,C,25,1,35.5,44.0,1133.50,1133.85,1133.94,, SHALE," 2.5YN2.5/-BLACK,2.5YN3/-VERY DARK GREY",, S LIGHTLY CRACKED,,,,, HARD, 00000000,e79d75aa97add2a9ae37029a5ced15ac,44-391C-25-1
44,391,C,25,1,44.0,150.0,1133.50,1133.94,1135.00,, LIMESTONE," 5Y6/1-LIGHT GREY,5Y5/2-OLIVE GREY,5B7/ 1-LIGHT BLUE GREY,5Y8/1-WHITE,2.5YN/4-DARK GREY,5Y3/ 1-VERY DARK GREY"," DARK GREY TO VERY DARK GREY CALCI LUTITE WITH MILLIMETER SIZE LAMINATIONS LOCATED FROM 44-50 65-70 94-101 AND 104-126CM,MASSIVE OLIVE GREE N CALCILUTITE FROM 50-54 AND 70-72CM,LIGHT GREY TO O LIVE GREY CALCILUTITE WITH MILLIMETER SIZE LAMINATIO NS FROM 54-65 AND 80.5-94CM,LIGHT BLUE GREY BIOTURBA TED CALCILUTITE WITH <1MM THICK WHITE CALCILUTITE BL EBS LOCATED FROM 72-80.5 101-104 AND 126-150CM", SLIGHTLY CRACKED,,,,, HARD, 00000000,17d8ba3fe0811627dab7e0b30c8632c3,44-391C-25-1
44,391,C,25,2,0.0,150.0,1133.50,1135.00,1136.50,, LIMESTONES," 5Y6/1-LIGHT GREY,5Y5/2-OLIVE GREY,5B7 /1-LIGHT BLUE GREY,5Y8/1-WHITE,2.5YN2.5/-BLACK,2.5YN 3/-VERY DARK GREY,2.5YN/4-DARK GREY,5Y3/1-VERY DARK GREY 5GY6/1-GREENISH GREY"," DARK GREY TO VERY DARK GREY CALCILUTITE WITH MILLIMETER SIZE LAMINATIONS LOCATED FROM 0-16 52-54 AND 69-80CM,LIGHT GREY TO OLIVE GREY CALCILUTITE WIT H MILLIMETER SIZE LAMINATIONS FROM 16-29 30-34 59-79 AND 85-113CM,MASSIVE OLIVE GREY CALCILUTITE FROM 29 -30 34-35 136-138 AND 140-145 MASSIVE GREENISH GREY CALCILUTITE FROM 145-150CM LIGHT BLUE GREY BIOTURBATED CALCILUTITE WITH <1MM THICK WHITE CALCILUTITE BLEBS LOCATED FROM 35-52 125 -136 AND 138-140CM,BLACK TO VERY DARK GREY SHALE FRO M 80-85CM,CHONDRITE? BURROWS AT 14 AND 118CM"," SLIGH TLY CRACKED FROM 0-43 AND 80-150CM,DRILLING BRECCIA FROM 55-60 AND FROM 69-80CM",,, IRREGULAR MASSES OF PY RITE FROM 127-135CM,, HARD, 00000000,c55f8e67dba73549f2760892dda84c89,44-391C-25-2
44,391,C,25,3,0.0,45.0,1133.50,1136.50,1136.95,, LIMESTONE," 5B7/1-LIGHT BLUE GREY,5Y8/1-WHITE,5Y5/ 2-OLIVE GREY,2.5YN/4-DARK GREY,5Y3/1-VERY DARK GREY"," MASSIVE OLIVE GREY CALCILUTITE FROM 0-3 AND 5-14CM ,DARK GREY TO VERY DARK GREY CALCILUTITE WITH MILLIM ETER SIZE LAMINATIONS LOCATED FROM 3-5 AND 14-20CM,L IGHT BLUE GREY BIOTURBATED CALCILUTITE WITH <1MM THI CK WHITE CALCILUTITE BLEBS LOCATED FROM 20-45CM", SL IGHTLY CRACKED EXCEPT FOR INTERVAL OF DRILLING BRECC IA FROM 18-20CM,,,,, HARD, 00000000,7b892fdcb4b698cb0d4c4502c88ae59b,44-391C-25-3
44,391,C,25,3,45.0,52.0,1133.50,1136.95,1137.02,, SHALE," 2.5YN2.5/-BLACK,2.5YN3/-VERY DARK GREY",, S LIGHTLY CRACKED,,,,, HARD, 00000000,005278d97cb4a13c9882ebd9bbe0ab39,44-391C-25-3
44,391,C,25,3,52.0,150.0,1133.50,1137.02,1138.00,, LIMESTONE," 5Y6/1-LIGHT GREY,5Y5/2-OLIVE GREY,5B7/ 1-LIGHT BLUE GREY,5Y8/1-WHITE,2.5YN2.5/-BLACK,2.5YN3 /-VERY DARK GREY,2.5YN/4-DARK GREY,5Y3/1-VERY DARK G REY"," LIGHT GREY TO OLIVE GREY CALCILUTITE WITH MILL IMETER SIZE LAMINATIONS LOCATED FROM 52-80CM SAME SE DIMENT GRADES INTO DARK GREY TO VERY DARK GREY CALCI LUTITE WITH MILLIMETER SIZE LAMINATIONS IN THE INTER VALS FROM 85-115 AND 132-150CM,DARK GREY TO VERY DAR K GREY CALCILUTITE WITH MILLIMETER SIZE LAMINATIONS LOCATED FROM 80-82CM BLACK TO VERY DARK GREY SHALE FROM 82-85CM,LIGHT B LUE GREY BIOTURBATED CALCILUTITE WITH <1MM THICK BLE BS OF WHITE CALCILUTITE LOCATED FROM 115-132CM", SLI GHTLY CRACKED,,,,, HARD, 00000000,e31679379ac555367de61856cb1ccff3,44-391C-25-3
44,391,C,25,4,0.0,150.0,1133.50,1138.00,1139.50,, LIMESTONE," 5Y6/1-LIGHT GREY,5Y5/2-OLIVE GREY,5B7/ 1-LIGHT BLUE GREY,5Y8/1-WHITE,2.5YN/4-DARK GREY,5Y3/ 1-VERY DARK GREY -AMBER BROWN"," LIGHT GREY TO OLIVE GREY CALCILUT ITE WITH MILLIMETER SIZE LAMINATIONS LOCATED FROM 0- 4 O7-47 95-145 AND 146-150CM,DARK GREY TO VERY DARK GREY CALCILUTITE WITH MILLIMETER SIZE LAMINATIONS LO CATED FROM 4-12 21-25 AND 71-95CM,LIGHT BLUE GREY BI OTURBATED CALCILUTITE WITH <1MM THICK WHITE CALCILUT ITE BLEBS LOCATED FROM 12-21 25-33 34-37 AND 47-71CM MASSIVE OLIVE GREY CALCILUTITE FROM 33-34 AND 145- 146CM,VERY LARGE BURROW 61-81CM AND LARGE BURROWS FR OM 138-143", SLIGHTLY CRACKED FROM 60-150CM,," PYRITE REPLACES RADS,AMBER BROWN SPAR AT 13CM,ABUNDANT CAL CISPHERES AT 50CM"," CALCIFIED TRIAXON SPONGE SPICULE S,PYRITIZED RADS",, HARD, 00000000,70ec379ca894834cbbd6d98c84353687,44-391C-25-4
44,391,C,26,1,99.0,150.0,1143.00,1143.99,1144.50,, LIMESTONE," 5Y6/1-LIGHT GREY,5Y5/2-OLIVE GREY,5B7/ 1-LIGHT BLUE GREY,5B7/1-WHITE,2.5YN2.5/-BLACK,2.5YN3 /-VERY DARK GREY,2.5YN/4-DARK GREY,5Y3/1-VERY DARK G REY"," BLACK TO VERY DARK GREY SHALE FROM 99-100CM,DA RK GREY TO VERY DARK GREY CALCILUTITE WITH MILLIMETE R SIZE LAMINATIONS LOCATED FROM 100-116CM,LIGHT GREY TO OLIVE GREY CALCILUTITE WITH MILLIMETER SIZE LAMI INATIONS LOCATED FROM 116-129CM INTERVAL FROM 129-14 5CM IS TRANSITION ZONE FROM THIS SEDIMENT TO A DARK GREY TO VERY DARK GREY LAMINATED CALCILUTITE DARK GREY TO VERY DARK GREY LAMINATED CALCILUTITE FROM 145-150CM",,, CALCISPHERES," PELECYPODS AT 142CM, PROBABLE CALCIFIED RADS", LAMINAE ARE CONCENTRATIONS OF CALCISPHERES AND PROBABLE CALCIFIED RADS, HARD, 00000000,09e5889d2b4f1d7a5b79112322f3728c,44-391C-26-1
44,391,C,26,2,0.0,150.0,1143.00,1144.50,1146.00,, LIMESTONE," 5Y6/1-LIGHT GREY,5Y5/2-OLIVE GREY,5B7/ 1-LIGHT BLUE GREY,5Y8/1-WHITE,2.5YN2.5/-BLACK,2.5YN3 /-VERY DARK GREY,2.5YN/4-DARK GREY,5Y3/1-VERY DARK G REY"," LIGHT BLUE GREY BIOTURBATED CALCILUTITE WITH < 1MM THICK WHITE CALCILUTITE BLEBS LOCATED FROM 0-15 AND 129-147CM,DARK GREY TO VERY DARK GREY CALCILUTIT E WITH MILLIMETER SIZE LAMINATIONS LOCATED FROM 15-2 2 55-80 AND 98-129CM,LIGHT GREY TO OLIVE GREY CALCIL UTITE WITH MILLIMETER SIZE LAMINATIONS LOCATED FROM 22-33 35.5-55 80-86 AND 87-98CM MASSIVE OLIVE GREY CALCILUTITE FROM 33-35.5CM,BLAC K TO VERY DARK GREY SHALE FROM 86-8MCM", SLIGHTLY CR ACKED FROM 0-15 22-30 AND 42-150CM,,, FISH REMAINS AT 43 CM,, HARD, 00000000,ebd726654ee36f03c548a2a047cf921b,44-391C-26-2
44,391,C,26,3,0.0,58.0,1143.00,1146.00,1146.58,, LIMESTONE,"  5Y6/1-LIGHT GREY,5Y5/2-OLIVE GREY,5B7 /1-LIGHT BLUE GREY,5Y8/1-WHITE,2.5YN2.5/-BLACK,2.5YN 3/-VERY DARK GREY,2.5YN/4-DARK GREY,5Y3/1-VERY DARK GREY"," LIGHT GREY TO OLIVE GREY CALCILUTITE WITH MIL LIMETER SIZE LAMINATIONS LOCATED FROM 0-3 5-15 AND 5 0-57CM,BLACK TO VERY DARK GREY SHALE FROM 3-5CM,LIGH T BLUE GREY BIOTURBATED CALCILUTITE WITH <1MM THICK WHITE CALCILUTITE BLEBS LOCATED FROM 15-34 AND 40-50 CM,DARK GREY TO VERY DARK GREY CALCILUTITE WITH MILL IMETER SIZE LAMINATIONS LOCATED FROM 34-40CM", SLIGHTLY CRACKED,,,,, HARD, 11131110.3450,04c6ce36247dd310373d54e1a9c0d48b,44-391C-26-3
44,391,C,26,3,58.0,66.0,1143.00,1146.58,1146.66,, SHALE," 2.5YN2.5/-BLACK,2.5YN3/-VERY DARK GREY",, S LIGHTLY CRACKED,,,,, HARD, 33233000,d243adcdc00ec9d23d4d2935e9f6189a,44-391C-26-3
44,391,C,26,3,66.0,111.0,1143.00,1146.66,1147.11,, LIMESTONE," 5Y6/1-LIGHT GREY,5Y5/2-OLIVE GREY,5B7/ /1-LIGHT BLUE GREY,5Y8/1-WHITE,2.5YN/4-DARK GREY,5Y3 /1-VERY DARK GREY"," DARK GREY TO VERY DARK GREY CALC ILUTITE WITH MILLIMETER SIZE LAMINATIONS LOCATED FRO M 66-80 97-102 AND 108-111CM,LIGHT BLUE GREY BIOTURB ATED CALCILUTITE WITH <1MM THICK WHITE CALCILUTITE B LEBS LOCATED FROM 80-97CM,LIGHT GREY TO OLIVE GREY C ALCILUTITE WITH MILLIMETER SIZE LAMINATIONS LOCATED FROM 102-108CM,SEDIMENT GRADED FOR 1CM AT 75 79 AND 102CM", SLIGHTLY CRACKED,,,,, HARD, 12130000,765b090760c9ca1a26e902ea058cec0c,44-391C-26-3
44,391,C,26,4,0.0,150.0,1143.00,1147.50,1149.00,, LIMESTONE," 2.5Y3/2-VERY DARK GREY BROWN,5Y6/1-LIG HT GREY,5Y5/2-OLIVE GREY,5B7/1-LIGHT BLUE GREY,5Y8/1 -WHITE,2.5YN2.5/-BLACK,2.5YN3/-VERY DARK GREY,2.5YN/ 4-DARK GREY,5Y3/1-VERY DARK GREY"," LIGHT GREY TO OLI VE GREY CALCILUTITE WITH MILLIMETER SIZE LAMINATIONS LOCATED FROM 0-18CM,DARK GREY TO VERY DARK GREY CAL CILUTITE WITH MILLIMETER SIZE LAMINATIONS LOCATED FR OM 18-40 79-82 129-135 AND 149-150CM,LIGHT BLUE GREY BIOTURBATED CALCILUTITE WITH <1MM THICK WHITE CALCI LUTITE BLEBS FROM 40-74 82-95 99-129 AND 145-149CM BLACK TO VERY DARK SHALE 144-145CM,OLIVE GREY MASS IVE CALCILUTITE FROM 95-99CM,VERY DARK GREY BROWN CA LCILUTITE WITH MILLIMETER SIZE LAMINATIONS LOCATED F ROM 74-77CM,VERY DARK GREY BROWN MASSIVE CALCILUTITE FROM 77-7.CM", SLIGHTLY CRACKED EXCEPT FOR MODERATE LY FRAGMENTED INTERVAL FROM 25-40CM,,,,, HARD, 00000000,c3c6b4af7200ffa706cea38ce275c144,44-391C-26-4
44,391,C,27,1,25.0,38.0,1152.50,1152.75,1152.88,, SHALE," 2.5YN2.5/-BLACK,2.5YN3/-VERY DARK GREY",, S LIGHTLY CRACKED,,,,, HARD, 33233000,aecf71fd1dc671791c810677f4102415,44-391C-27-1
44,391,C,27,1,38.0,150.0,1152.50,1152.88,1154.00,, LIMESTONE," 5Y6/1-LIGHT GREY,5Y5/2-OLIVE GREY,5B7/ 1-LIGHT BLUE GREY,5Y8/1-WHITE,2.5YN2.5/-BLACK,2.5YN3 /-VERY DARK GREY"," LIGHT BLUE GREY BIOTURBATED CALCI LUTITE WITH <1MM THICK WHITE CALCILUTITE BLEBS LOCAT ED FROM 38-76 83.5-94 AND 95-150CM,LIGHT GREY TO OLI VE GREY CALCILUTITE WITH MILLIMETER SIZE LAMINATIONS LOCATED FROM 76-82CM,BLACK TO VERY DARK GREY SHALE FROM 82-83.5 AND 94-95CM", SLIGHTLY CRACKED,,,,, HARD, 00000000,ccd0303aee1585d10522113740d20fc7,44-391C-27-1
44,391,C,27,2,0.0,150.0,1152.50,1154.00,1155.50,, LIMESTONE," 5Y6/1-LIGHT GREY,5Y5/2-OLIVE GREY,5B7/ 1-LIGHT BLUE GREY,5Y8/1-WHITE,2.5YN/4-DARK GREY,5Y3/ 1-VERY DARK GREY"," LIGHT BLUE GREY BIOTURBATED CALCI LUTITE WITH <1MM THICK WHITE CALCILUTITE BLEBS LOCAT ED FROM 0.5 17-56 76-115 123-130 AND 139-150CM,LIGHT GREY TO OLIVE GREY CALCILUTITE WITH MILLIMETER SIZE LAMINATIONS LOCATED FROM 5-7 14-17 60-76 115-123 AN D 130-139CM,DARK GREY TO VERY DARK GREY CALCILUTITE WITH MILLIMETER SIZE LAMINATIONS LOCATED FROM 7-14 A ND 56-60CM", SLIGHTLY CRACKED EXCEPT FOR MODERATELY FRAGMENTED INTERVALS FROM 54-81 AND 115-125CM,,,,, HARD, 00000000,37454d013a9b54fc85e4274b6d5f80f0,44-391C-27-2
44,391,C,27,3,0.0,150.0,1152.50,1155.50,1157.00,, LIMESTONE," 5Y6/1-LIGHT GREY,5Y5/2-OLIVE GREY,5B7/ 1-LIGHT BLUE GREY,5Y8/1-WHITE,2.5YN2.5/-BLACK,2.5YN3 /-VERY DARK GREY,2.5YN/4-DARK GREY,5Y3/1-VERY DARK G REY"," LIGHT GREY TO OLIVE GREY CALCILUTITE WITH MILL IMETER SIZE LAMINATIONS LOCATED FROM 0-3 6-10 68-74 114-122 130-134 AND 136-150CM SAME SEDIMENT GRADES I NTO LIGHT BLUE GREY BIOTURBATED CALCILUTITE WITH <1M M THICK WHITE CALCILUTITE BLEBS IN INTERVAL FROM 10- 28CM THIS LIGHT BLUE GREY CALCILUTITE ALSO OCCURS FR OM 30-40 41-59 60-64 74-92 103-114+122-130CM DARK GREY TO VERY DARK GREY CALCILUTITE WITH MILLI METER SIZE LAMINATIONS LOCATED FROM 3-6 59-60 64-68 92-103 AND 134-136CM,BLACK TO VERY DARK GREY SHALE F ROM 28-30 AND 40-41CM", SLIGHTLY CRACKED EXCEPT FOR MODERATELY FRAGMENTED INTERVAL FROM 30-44CM,,,,, HARD, 00000000,17e87b3ab44dda8f720c5191c4b440c9,44-391C-27-3
44,391,C,27,4,0.0,54.0,1152.50,1157.00,1157.54,, LIMESTONE," 5G6/1-GREENISH GREY,5B9/1-BLUISH WHITE ,5Y6/1-LIGHT GREY,5Y5/2-OLIVE GREY,5B7/1-LIGHT BLUE GREY,5Y8/1-WHITE,2.5YN2.5/-BLACK,2.5YN3/-VERY DARK G REY"," LIGHT BLUE GREY BIOTURBATED CALCILUTITE WITH < 1MM THICK WHITE CALCILUTITE BLEBS LOCATED FROM 0-11C M,LIGHT GREY TO OLIVE GREY CALCILUTITE WITH MILLIMET ER SIZE LAMINATIONS LOCATED FROM 11-26 AND 34-41CM,M IXED GREENISH GREY AND BLUISH WHITE ARGILLACEOUS LIM ESTONE FROM 26-34 41-45 AND 47-54CM,BLACK TO VERY DA RK GREY SHALE FROM 45-47CM", SLIGHTLY CRACKED,,,,, HARD, 00000000,0d7e918292c35f5ebec1e42cb68c29c3,44-391C-27-4
44,391,C,27,4,54.0,70.0,1152.50,1157.54,1157.70,, SHALE," 2.5YN2.5/-BLACK,2.5YN3/-VERY DARK GREY",," M ODERATELY FRAGMENTED FROM 54-60CM,SLIGHTLY CRACKED F ROM 60-70CM",,,,, HARD, 33233000,b9cb65a7d476c000a8b1f851efb4ed14,44-391C-27-4
44,391,C,27,4,70.0,150.0,1152.50,1157.70,1158.50,, LIMESTONE," 5G6/1-GREENISH GREY,5B9/1-BLUISH WHITE ,5Y6/1-LIGHT GREY,5Y5/2-OLIVE GREY,5B7/1-LIGHT BLUE GREY,5Y8/1-WHITE,2.5YN/4-DARK GREY,5Y3/1-VERY DARK G REY"," LIGHT GREY TO OLIVE GREY CALCILUTITE WITH MILL IMETER SIZE LAMINATIONS LOCATED FROM 70-75 79-91 94- 101 104-123 AND 145-150CM SAME SEDIMENT INTERLAMINAT ED WITH MASSIVE OLIVE GREY CALCILUTITE FROM 91-94CM OLIVE GREY MASSIVE CALCILUTITE ALONE OCCURS FROM 75- 79CM,DARK GREY TO VERY DARK GREY CALCILUTITE WITH MI LLIMETER SIZE LAMINATIONS LOCATED FROM 101-104CM MIXED GREENISH GREY AND BLUISH WHITE ARGILLACEOUS LIMESTONE FROM 123-134CM,LIGHT BLUE GREY BIOTURBATED CALCILUTITE WITH <1MM THICK WHITE CALCILUTITE BLEBS LOCATED FROM 134-145CM,PYRITE FILLED BURROWS FROM 1 02-104CM", SLIGHTLY CRACKED, PYRITIZED RODS FROM 102-104CM, PYRITE FROM 102-109CM,,, HARD, 11131110,330f2c8c6ba778e2bae6c5d18783c1e8,44-391C-27-4
44,391,C,28,1,140.0,150.0,1162.00,1163.40,1163.50,, LIMESTONE," 5B7/1-LIGHT BLUE GRAY,5Y8/1-WHITE", SE CTION CONSISTS OF LIGHT BLUE GREY BIOTURBATED CALCIL UTITE WITH <1MM THICK WHITE CALCILUTITE BLEBS,,,,,, HARD, 11131110,237d05a95c76cbea5121c9269f4f3d50,44-391C-28-1
