80,551,,13,5,0.0,188.00,194.00,  195.50,"OTSUKA, K.",PLAG MOD PHYRIC BASALTMASSIVE LAVA FLOWS,"PCES 1A (1-3), 1B (3-7), 1C (5-14), 1D (13-25), 1E (27-50), 1F (39-58), 1G (57-71), 1H (71-87), 1I (87-93), 1J (93-95), 1K (95-97), 1L (98-108), 1M (108-115), 1N (115-120), 1O (120-131), 1P (130-143), 2 (146-150)","MOD PHYRIC,INTERVAL 42-150CM XTLLN & FINE-GRAINED","MASSIVE LAVA FLOWS,RARE CALCITE VEINS",FRESH RK TO VERY DARK GRAY BASALT(N3 TO N4),,"     1-4               CALCITE,CLAY.MINS comments : INTERVAL 0-42CM VESICLES ARE FILLED WITH CALCITE & DARK GREEN CLAY.MINS |             0 comments : INTERVAL 42-150CM IS NON-VESICULAR",PLAG               TO 3 comments : PLAG PHENOS ARE EUHEDRAL TO SUBHEDRAL,,CALCITE comments :  CALCITE FILLS VESICLES & RARE VEINS IN INTERVAL 0-42CM,,
80,551,,13,6,0.0,188.00,195.50,  197.00,"OTSUKA, K.",PLAG MOD PHYRIC BASALTMASSIVE LAVA FLOW,"PCES 1A (0-6), 1B (5-16), 1C (16-24), 1D (25-36), 1E (36-38), 1F (38-41), 2 (43-50), 3 (53-56), 4A (59-63), 4B (62-71), 4C (70-79), 4D (79-81), 4E (81-86), 4F (85-91), 4G (92-98), 4H (97-109), 4I (109-119), 4J (119-126), 4K (126-140), 4L (140-149)","MOD PHYRIC,APHANITIC,MICROXTLLN","MASSIVE LAVA FLOW,MANY LARGE CALCITE VEINS RUNNING ALMOST VERTICALLY THROUGHOUT SECTION,A LARGE CALCITE VEIN RUNS FROM PCE 4A TO PCE 4F WHERE IT SPLITS & CONTINUES TO THE BOTTOM OF THE SECTION,THE WIDTH OF THE VEINS VARY FROM 1-5MM",FRESH TO SLIGHTLY SOME ALTERATION ALONG VEIN WALLS,"PCES 1A-1F 2.5Y 3/0,PCES 2-4L ARE OLIVE GRAY (5Y 5/2)", comments : VERY SMALL RARE VESICLES IN PCES 4A-4F,PLAG               TO 3 comments : PLAG PHENOS ARE EUHEDRAL TO SUBHEDRAL,,CALCITE comments :  CALCITE FILLS VEINS,,
80,551,,13,7,0.0,188.00,197.00,  197.35,"OTSUKA, K.",PLAG MOD PHYRIC BASALTMASSIVE LAVA FLOW,"PCES 1 (0-10), 2 (14-24), 3A (28-32), 3B (32-35)","MOD PHYRIC,PCE 1 IS XTLLN,PCES 2+3B FINE-GRAINED, PCE 3A IS VITROPHYRIC","MASSIVE LAVA FLOW,CALCITE & CLAY.MIN-FILLED VEINS IN PCE 1,PCE 3A HAS CLAY.MIN-FILLED VEINS,PCE 3B HAS CALCITE-FILLED VEINS","FRESH E 1 IS DARK GRAY BASALT(N3-N4),PCE 2 IS DARK GRAY SALT(N3),PCES 3A-3B ARE GRAY BASALT(5Y 6/1)",,                       CLAY.MIN comments : PCE 3B HAS CLAY.MIN-FILLED VESICLES,PLAG     TO 5      TO 3 comments : PLAG PHENOS ARE EUHEDRAL TO SUBHEDRAL,,"CALCITE | CLAY.MIN comments :  CALCITE & CLAY.MINS FILL VEINS,VESICLES IN PCE 3B FILLED WITH CLAY.MINS",,
80,551,,14,1,0.0,197.50,197.50,  199.00,"OTSUKA, K.",PLAG-OL MOD PHYRIC BASALTMASSIVE LAVA FLOW,"PCES 1A (0-20), 1B (20-28), 1C (29-63), 1D (64-87), 1E (88-93), 1F (95-150)",MOD PHYRIC,"MASSIVE LAVA FLOW,UNIDENT.MIN & CALCITE-FILLED VEINS COMMON THROUGHOUT,LARGE WHITE BLEBS(CALCITE?) & SMALL BLACK ONES IN PCE 1D","FRESH TO SLIGHTLY BROWN WEATHERING RIM AROUND TOP OF PCE 1D,BASALT WEATHERED IN INTERVALS 94-105+109-119+123-130CM",BASALT IS GRAY(N3) THROUGHOUT,"            0 comments : PCES 1A-1C |                        CALCITE,SMEC comments : PCES 1D-1F ARE VESICULAR WITH VESICLES FILLED WITH CALCITE &/OR SMEC-ID SMEC UNCERTAIN",PLAG      <10       1-4 | OL       RARE comments : BLACK/WHITE PHENOS,,CALCITE comments :  CALCITE VEINS & BLEBS-ID CALCITE BLEBS UNCERTAIN | UNIDENT comments :  GREEN UNIDENT.MIN FILLS VEINS IN PCE 1B | SMEC comments :  SMEC FILLS SOME VESICLES-ID SMEC UNCERTAIN,,
80,551,,14,2,0.0,197.50,199.00,  199.20,"MASSON, D. G.",PLAG-OL MOD PHYRIC BASALTMASSIVE LAVA FLOW,"PCES 1 (2-12), 2 (14-18)",MOD PHYRIC,"MASSIVE LAVA FLOW,EXTENSIVELY VEINED",,GRAY BASALT, comments : PRESENCE OF VESICLES UNCERTAIN,PLAG | OL comments : PRESENCE OF WHITE & DARK PHENOS,,,,
80,551,,14,2,20.0,197.50,199.20,  199.50,"MASSON, D. G.",SEDIMENTMUDSTONE,"PCES 3A (20-34), 3B (35-50)",,,,,,,,,,
80,551,,14,2,50.0,197.50,199.50,  200.50,"MASSON, D. G.",VOLCANICLASTIC BRECCIA,"PCES 4 (53-56), 5 (60-62), 6 (65-70), 7 (73-78), 8 (80-82), 9 (85-88), 10 (91-98), 11 (100-106), 12 (108-110), 13 (114-116), 14 (118-123), 15 (125-128), 16 (130-133), 17 (136-140), 18 (144-149)",,,,CONTAINS LARGE ANGULAR CLASTS OF MASSIVE INDURATED OLIVE BROWN SEDIMENT WITH THE MATRIX COMPRISED OF MUCH SMALLER GREEN CLASTS(USUALLY ROUNDED-ALTERED VOLCANIC MATERIAL?) WITHIN OTHER GREEN MATERIAL WHICH IS VEINED WITH PINK SEDIMENT,,,,,,
80,551,,14,3,0.0,197.50,200.50,  201.75,"MASSON, D. G.",VOLCANICLASTIC BRECCIA,"PCES 1 (3-6), 2 (10-12), 3 (15-21), 4 (25-29), 5 (32-43), 6 (46-48), 7 (52-56), 8 (59-63), 9 (66-73), 10 (76-100), 11 (103-112), 12 (115-123)",,,,"PCES 1-2 SIMILAR TO INTERVAL 50-150CM IN CORE 14-2, REST OF SECTION MADE UP OF SEDIMENTARY OR VOLCANIC BRECCIA,LARGE ANGULAR OR ROUNDED CLASTS OF MASSIVE LIGHT GRAY TO GRAY SEDIMENT",,,,,,
