34,319,A,2,3,0.0,107.50,110.50,  112.00,"BASS, M.",PLAG SPARSELY PHYRIC DIABASE,"PCE 1 (3-14), 2 (16-20), 3 (22-26), 4 (28-32), 5 (32-37), 6 (38-43), 7 (45-49), 8 (51-56), 9 (57-60), 10 (62-65), 11 (67-70), 12 (72-79), 13 (79-82), 14 (84-92), 15 (94-100)",FINE-GRAINED--COARSENS NEAR 84CM TO FINE TO MEDIUM- GRAINED,"THE CORE PIECES ARE HIGHLY ALTERED BROWNISH GRAY JOINT BLOCKS WHICH INDICATES THAT SEC 3 IS FROM A HIGHLY JOINTED & VEINED PORTION OF THE COOLING UNIT AND THUS ACCOUNTS FOR THE POOR RECOVERY & SMALL PIECES, VEINS ARE COMPOSED OF BROWN & RED-BROWN & RARELY GREEN SMECTITE & CARBONATE--THE CARBONATE DEFINITELY INCLUDES ARAGONITE IN SOME CASES EXAMINED IN SMEAR SLIDES, FE.OXIDE IS A COMMON VEIN CONSTITUENT WHICH LENDS THEIR COMMON BROWN TO RED COLOR, ONE VEIN IN 38-43CM IS COMPOSED OF STELLATE ARRAYS OF FINELY PRISMATIC ARAGONITE COATED BY DARK BROWN OPAQUE MATERIAL & ALL SET IN A BASE OF ORANGE-BROWN SMECTITE SUPERFICIALLY SIMILAR TO PALAGONITE",,"DARK BROWNISH GRAY, STYROFOAM DIVIDERS EACH ABOUT 2CM WIDE SEPARATE PIECES OF CORE THAT ARE NOT PART OF A CONTINUOUS CORE SEGMENT - AN UNKNOWN AMOUNT OF BASALT IS MISSING IN THE PLACES WHERE THE STYROFOAM HAS BEEN ADDED",,PLAG comments : MEGASCOPIC PHENOCRYSTS ARE SPARSE,PLAG | PYROXENE | OLIVINE,FE.OXIDE | SMECTITE | CARB | ARAGONIT comments :  STELLATE ARAGONITE IS NOT UNCOMMON IN THE BASEMENT FROM HOLE 319A - ESPECIALLY THE INTERIORS OF RELATIVELY THICK COOLING UNITS BUT THE ONLY OTHER OCCURRENCE OF COATED STELLATE CRYSTALS WAS SEEN IN A THIN SECTION FROM 319A-34-7-1 (88-93CM),,
34,319,A,2,3,0.0,107.50,110.50,  110.64,"BASS, M.",DIABASE,PCE 1 (3-14),FINE-GRAINED,"MINOR FLAT VEINS INCLUDING CARBONATE VEIN ON BOTTOM SURFACE, IRREGULAR VERTICAL VEIN OF INTERLAYERED CARBONATE & SMECTITE",comments: STRONGLY RUST-COLORED FOR 1+CM ON EITHER SIDE OF THE VERTICAL VEIN,,,,,CARB | SMECTITE,,
34,319,A,2,3,16.0,107.50,110.66,  110.82,"BASS, M.",DIABASESIMILAR TO PCE 1,"PCE 2 (16-20), 3 (22-26), 4 (28-32)",,PCE 4 CONTAINS A PATCH OF CARBONATE ON MODERATELY INCLINED VEIN,comments: HIGHLY ALTERED TO A BROWN COLOR--PCE 4 SOMEWHAT LESS ALTERED,,,,,CARB,,
34,319,A,2,3,32.0,107.50,110.82,  110.87,"BASS, M.",DIABASESIMILAR TO PCE 4,PCE 5 (32-37),,,comments: HIGHLY ALTERED ESPECIALLY NEAR ONE 50-DEGREE DIPPING JOINT LINED BY DARK BROWN SMECTITE & STRONGLY RUST-STAINED,,,,,SMECTITE,,
34,319,A,2,3,38.0,107.50,110.88,  110.93,"BASS, M.",DIABASESIMILAR TO PCE 5,PCE 6 (38-43),,"2 FLAT TO GENTLY DIPPING JOINTS--ONE IS COATED BY STELLATE ARRAYS OF PRISMS OF ARAGONITE & A DARK BROWN OPAQUE MINERAL WITH ORANGE ""PALAGONITE"" BETWEEN THEM - THE DARK ""PRISMS"" MAY HAVE FORMED AS COATINGS ON THE ARAGONITE (COMPARE 319A-7-1 PCE 10)",comments: ALTERED ESPECIALLY NEAR THE JOINTS,,,,,ARAGONIT,,
34,319,A,2,3,45.0,107.50,110.95,  110.99,"BASS, M.",DIABASESIMILAR TO PCE 6,PCE 7 (45-49),SLIGHTLY COARSER THAN PCE 6,ONE NON-PENETRATIVE GENTLY DIPPING CRACK,EXT,,,,,,,
34,319,A,2,3,51.0,107.50,111.01,  111.20,"BASS, M.",DIABASESIMILAR TO PCE 7,"PCE 8 (51-56), 9 (57-60), 10 (62-65), 11 (67-70)",,"TWO WHITE CARBONATE VEINS DIPPING 50 DEGREES IN PCE 8, ONE MODERATELY DIPPING RUSTY CRACK IN PCE 9, 4 FLAT TO VERTICAL ARAGONITE-COATED JOINTS IN PCE 10, ONE GENTLY DIPPING CARBONATE-COATED JOINT IN PCE 11",,,,,,ARAGONIT | CARB,,
34,319,A,2,3,72.0,107.50,111.22,  111.29,"BASS, M.",DIABASE,PCE 12 (72-79),FINE-GRAINED,RUSTY GENTLY DIPPING TO FLAT JOINTS AT TOP & BOTTOM ONLY ARE NON-PENETRATIVE,comments: HIGHLY ALTERED (BROWN),,,,,,,
34,319,A,2,3,79.0,107.50,111.29,  111.32,"BASS, M.",DIABASESIMILAR TO PCE 12,PCE 13 (79-82),,GENTLY DIPPING JOINTS WHICH ARE RUSTY OR COATED WITH BROWN SMECTITE,comments: SLIGHTLY FRESHER THAN PCE 12,,,,,SMECTITE,,
34,319,A,2,3,84.0,107.50,111.34,  111.42,"BASS, M.",DIABASESIMILAR TO PCE 13,PCE 14 (84-92),SOMEWHAT COARSE (ALMOST MEDIUM-GRAINED DIABASE),STEEP & GENTLY DIPPING RUSTY JOINTS WHICH ARE SOMETIMES ZONALLY COLORED IN RED-BROWN & OLIVE GREEN & DARK BROWN (THESE APPEAR TO BE COLOR VARIANTS OF SMECTITE WITH EARTHY FE.OXIDE IN ADDITION IN THE RED-BROWN AREAS),,,,,,SMECTITE | FE.OXIDE,,
34,319,A,2,3,94.0,107.50,111.44,  111.50,"BASS, M.",DIABASE,PCE 15 (94-100),,,,SMALL LOOSE ALTERED FRAGMENTS,,,,,,
34,319,A,2,CC,0.0,107.50,112.10,  112.10,"BASS, M.",GLASSPALAGONITE,,,,,,,,GLASS,PALAG comments :  ORANGE,,
34,319,A,3,1,0.0,117.00,117.00,  118.50,"BASS, M.",APHYRIC TO PLAG SPARSELY PHYRIC DIABASE,"PCE 1 (2-6), 2 (8-11), 3 (13-18), 4 (20-24), 5 (26-35), 6 (37-40), 7 (42-45), 8 (47-55), 9 (55-63), 10 (65-70), 11 (72-84), 12 (86-89), 13 (98-101), 14 (103-106), 15 (108-115), 16 (116-124), 17 (126-137)","FINE TO MEDIUM-GRAINED, APHANITIC TO SPARSELY PHYRIC ALTHOUGH UNJOINTED PIECES OF CORE DO OCCUR VEINS ARE NOT UNCOMMON & SUGGEST THAT INCREASED FRESHNESS & IMPROVED CORE RECOVERY ARE ONLY IN PART DUE TO A DECREASE IN THE FREQUENCY (I.E. INCREASE IN SPACING) OF JOINTS & VEINS, VEINS ARE COMPOSED OF BROWN & GREEN & BLUE-GREEN & RARELY BLACK SMECTITE (BROWN ONLY IN THE UPPER ALTERED PART OF THE SECTION) AND FE.OXIDE (ABOVE 63CM) AND SULFIDE (BELOW 72CM) AND CARBONATE, THE RECIPROCAL OCCURRENCE OF FE.OXIDE & SULFIDE SUGGESTS THAT MUCH OF THE FE.OXIDE IN VEINS & IN THE STAINED ROCK ADJACENT TO VEINS & JOINTS IN ALTERED SECTIONS OF THE CORE MAY BE FROM THE OXIDATION OF ORIGINAL PYRITE, ONE OF THE CARBONATE VEINS AT ABOUT 86CM IS A CROSS-FIBER CALCITE VEIN",,,"DOWN TO 35CM THE ROCK IS DARK BROWNISH GRAY & ALTERED, IN 35-53CM THE ROCK BECOMES PROGRESSIVELY FRESHER, FROM 53-137CM THE ROCK IS FRESH DARK GRAY MEDIUM-GRAINED DIABASE WHICH YIELDED GOOD CORE RECOVERY IN LONG INTACT PIECES WHICH CAN COMMONLY BE REFITTED OR--IF NOT--IN WHICH RECOGNIZABLE STRUCTURES INDICATE LITTLE LOSS OF SECTION, STYROFOAM DIVIDERS EACH ABOUT 2CM WIDE SEPARATE PIECES OF CORE THAT ARE NOT PART OF A CONTINUOUS CORE SEGMENT - AN UNKNOWN AMOUNT OF BASALT IS MISSING FROM THE PLACES WHERE THE STYROFOAM HAS BEEN ADDED",    TO 5          PCE 7 comments : DIKTYTAXITIC VUGS,"PLAG       TR    TO 3X2 comments : RECOGNIZABLE PLAG PHENOCRYSTS ARE PROMINENT BUTOCCUR IN TRACE AMOUNTS AT MOST - OFTEN ONLY ASINGLE RECOGNIZABLE CRYSTAL IN A GIVEN PIECE OFCORE, MOSTLY SMALLER THAN 2X1MM",,FE.OXIDE | SULFIDE | CARB | CALCITE | SMECTITE comments :  THE DISTRIBUTION OF BROWN & RED & YELLOW SMECTITE IN THIS SECTION & THOSE HIGHER IN THE CORE INDICATES THAT THEY ARE PROBABLY OXIDATION PRODUCTS OF ORIGINALLY GREEN OR BLUE-GREEN SMECTITE,,
34,319,A,3,1,2.0,117.00,117.02,  117.06,"BASS, M.",DIABASESIMILAR TO BOTTOM OF CORE 2,PCE 1 (2-6),FINE TO MEDIUM-GRAINED,DARK BROWN SMECTITE ON GENTLY DIPPING FRACTURE ON UPPER SURFACE,,DARK BROWN-GRAY,    TO 3 comments : IRREGULAR VUGS(?),"PLAG                4X5 comments : BROWN-STAINED PLAG CRYSTAL IS ONLY PHENOCRYSTSEEN,X' ON CLEAVAGES = 1.565 TO 1.567,AN70-72",,SMECTITE,,
34,319,A,3,1,8.0,117.00,117.08,  117.11,"BASS, M.",DIABASESIMILAR TO PCE 1,PCE 2 (8-11),,BROWN SMECTITE ON ONE MODERATELY DIPPING JOINT (35 DEGREES),,, comments : NO VUGS,"PLAG                3X2 comments : ONLY ONE PLAG SEEN,X'=1.562+ TO 1.564+, MAINLY1.562+,AN65-AN69 (MAINLY AN65),Z'=1.566+ TO 1.570+ (MAINLY 1.568), AN64-72(MAINLY AN67-AN68)",,SMECTITE,,
34,319,A,3,1,13.0,117.00,117.13,  117.18,"BASS, M.",DIABASESIMILAR TO PCE 2,PCE 3 (13-18),,"UNFRACTURED, UNVEINED",,,,PLAG      0.1    TO 1X2,,,,
34,319,A,3,1,20.0,117.00,117.20,  117.24,"BASS, M.",APHYRIC DIABASESIMILAR TO PCE 3,PCE 4 (20-24),"SLIGHTLY FINER-GRAINED THAN PCE 3, NO PHENOCRYSTS",DARK BROWN SMECTITE ON IRREGULAR JOINT ON BOTTOM SURFACE,,,,,,SMECTITE,,
34,319,A,3,1,26.0,117.00,117.26,  117.35,"BASS, M.",ALTERED DIABASE,PCE 5 (26-35),"MEDIUM-GRAINED, NO OR FEW PHENOCRYSTS",80-DEGREE DIPPING RUST-COLORED JOINT (IRREGULAR COAT OF SMECTITE?)--SEVERAL DISCONTINUOUS JOINTS BRANCH OFF IT & DIP 10 DEGREES OR LESS,,BROWN COLOR,,,,,,
34,319,A,3,1,37.0,117.00,117.37,  117.40,"BASS, M.",DIABASE,PCE 6 (37-40),"MEDIUM-GRAINED, ONE PLAG SEEN","ONE VERTICAL & ONE GENTLY DIPPING SMECTITE-FILLED JOINT, PATCH OF CARBONATE VEIN ON BOTTOM SURFACE",comments: SOMEWHAT FRESHER THAN PCE 5,,,PLAG                1X2 comments : ONE PLAG SEEN,,CARB,,
34,319,A,3,1,42.0,117.00,117.42,  117.45,"BASS, M.",DIABASE,PCE 7 (42-45),,THREE TIGHT YELLOW-BROWN-STAINED 45 DEGREE DIPPING JOINTS,comments: SLIGHTLY FRESHER THAN PCE 6,,"    TO 5 comments : VUGS - LARGEST IS LINED BY BOTRYOIDAL BROWN SMECTITE WITH GREEN SURFACE COAT--ANOTHER HAS DEEP RED-BROWN-STAINED WALLS, MOST VUGS ARE UNALTERED, ALL VUGS APPEAR DIKTYTAXITIC",,,SMECTITE,,
34,319,A,3,1,47.0,117.00,117.47,  117.55,"BASS, M.",DIABASE,PCE 8 (47-55),,TWO JOINTS DIP 30 DEGREES (TOP SURFACE & ONE IN MIDDLE) - BOTH VEINED BY CARBONATE,,SAME AS PCE 7 EXCEPT AT LOWER END WHERE IT IS PARTLY FRESH GRAY MEDIUM-GRAINED DIABASE IN WHICH ONE CAN DISTINGUISH COLORLESS PLAGIOCLASE & BROWN CLINOPYROXENE & PATCHES OF A DULL BLUISH GREEN MINERAL WHICH IS PROBABLY OLIVINE (OR GROUNDMASS) REPLACED BY SMECTITE--THE COARSENESS OF THE ROCK SUGGESTS OLIVINE,,,PLAG | CPX | OLIVINE,SMECTITE               OLIVINE | CARB,,
34,319,A,3,1,55.0,117.00,117.55,  117.63,"BASS, M.",PLAG SPARSELY PHYRIC DIABASE,PCE 9 (55-63),"MEDIUM-GRAINED, TRACE OF PLAG PHENOCRYSTS","UNJOINTED & UNVEINED EXCEPT FOR DENSE BROWN SMECTITE UP TO 1MM THICK ON A PATCH OF RUSTY COLORED JOINT ON THE UPPER SURFACE, A FLAT-LYING JOINT ON THE LOWER SURFACE IS COATED BY A THIN LIGHT BLUE-GREEN SMECTITE FILM",FRESH,GRAY,,"PLAG       TR             TO 1X2 comments : TRACE OF RELATIVELY LARGE PLAG, MOST COMMON SIZEIS 1X0.1MM",,SMECTITE,,
34,319,A,3,1,65.0,117.00,117.65,  117.70,"BASS, M.",PLAG SPARSELY PHYRIC DIABASESIMILAR TO PCE 9,PCE 10 (65-70),,"REMNANT PATCH OF BLUE-GREEN COATED JOINT ON UPPER SURFACE, TIGHT UNVEINED CRACK (DIPS 15 DEGREES) IN LOWER PART IS NON-PENETRATIVE",,,,,,,,
34,319,A,3,1,72.0,117.00,117.72,  117.84,"BASS, M.",DIABASESIMILAR TO PCE 10,PCE 11 (72-84),ONE PLAG PHENOCRYST,"ONE 65 DEGREE-DIPPING JOINT INTERSECTS UPPER SURFACE & SIDE - PARTIALLY COATED BY FINELY DRUSY YELLOW SULFIDE & VERY THIN BLUE-GREEN FILM, 25 DEGREE- DIPPING JOINT ON LOWER SURFACE HAS THIN BLUE-GREEN PATCHY COAT",,COLOR NEAR (2.5Y 3/0),,PLAG                3X2 comments : ONE PHENOCRYST,,SULFIDE,,
34,319,A,3,1,86.0,117.00,117.86,  117.96,"BASS, M.",APHYRIC DIABASESIMILAR TO PCE 11,PCE 12 (86-96),APHYRIC,UPPER SURFACE IS IN PART A 45 DEGREE-DIPPING JOINT WITH COAT OF BLUE-GREEN SMECTITE & COLORLESS CARBONATE & TRACE OF YELLOW SULFIDE - THE SMECTITE IS DOMINANT & SHOWS A SHRINKAGE CRACK PATTERN - THE CARBONATE IS FINELY DRUSY CROSS-FIBER CALCITE,,,,,,SMECTITE | CALCITE | SULFIDE,,
34,319,A,3,1,98.0,117.00,117.98,  118.01,"BASS, M.",DIABASESIMILAR TO PCE 12,PCE 13 (98-101),,UNFRACTURED SULFIDE PATCHES ON DARK GRAY JOINT REMNANTS FORMING PART OF BOTTOM SURFACE,,,,,,SULFIDE,,
34,319,A,3,1,103.0,117.00,118.03,  118.06,"BASS, M.",APHYRIC DIABASESIMILAR TO PCE 13,PCE 14 (103-106),APHYRIC,"UNFRACTURED, REMNANT OF FLAT JOINT ON UPPER SURFACE PATCHILY COATED BY CARBONATE & YELLOW SULFIDE",,,,,,SULFIDE | CARB,,
34,319,A,3,1,108.0,117.00,118.08,  118.15,"BASS, M.",DIABASESIMILAR TO PCE 14,PCE 15 (108-115),,"ONE VERTICAL & ONE 60-DEGREE-DIPPING JOINT--BOTH WITH IRREGULAR ROUGH SURFACES--ARE FAINTLY COATED WITH BLUE-GREEN SMECTITE, A 70-DEGREE-DIPPING JOINT CONTAINS A 0.1MM-THICK DARK GREEN SMECTITE VEIN",comments: RARE RUST SPOTS IN THE ROCK SUGGEST OXIDIZED SULFIDE GRAINS,,,,,SULFIDE | SMECTITE,,
34,319,A,3,1,116.0,117.00,118.16,  118.24,"BASS, M.",PLAG SPARSELY PHYRIC DIABASESIMILAR TO PCE 15,PCE 16 (116-124),SPARSELY PHYRIC,"UNFRACTURED EXCEPT FOR ONE VERTICAL ANASTOMOSING JOINT FILLED WITH VIRTUALLY BLACK PITCH-LIKE SMECTITE VEIN + MINOR SULFIDE, A PARALLEL IRREGULAR JOINT 1MM AWAY HAS A LIGHT BLUE-GREEN SMECTITE FILM",,BARREL-SHAPED,,PLAG       TR  TO 1X1.5,,SMECTITE | SULFIDE,,
34,319,A,3,1,126.0,117.00,118.26,  118.37,"BASS, M.",PLAG SPARSELY PHYRIC DIABASESIMILAR TO PCE 16,PCE 17 (126-137),,UNJOINTED EXCEPT FOR TOP SURFACE WHICH IS A 40 DEGREE DIPPING JOINT WITH A DISCONTINUOUS LIGHT BLUE GREEN SMECTITE FILM & RARE PATCHES OF YELLOW SULFIDE,,,,"PLAG       TR  TO 3.5X2 comments : PHENO CORE R.I.= 1.569-1.573 (MAINLY 1.572),AN77-85 (MAINLY AN83-84), X' ON CLEAVAGEFLAKES",,SMECTITE | SULFIDE,,
34,319,A,3,CC,0.0,117.00,126.10,  126.10,"BASS, M.",GLASSPALAG (ORANGE BROWN) IN TRACE AMOUNTS,NO PCE NUMBERS,,"VEIN - COLORLESS, ABOUT 1+ MM THICK CONTAINING CALCITE AND MINOR ARAGONITE,COLORLESS VEIN INTERLAYERED ON PALAG - PHILLIPSITE OR ANALCITE (ALMOST WHOLLY ISOTROPIC, R.I. > 1.420, <1.486,PROBABLY ABOUT 1.482), PLUS MINOR CARB (INCLUDES SOME ARAGONITE)",,,"     0.4                                ROUND comments : FILLING WHITE - PHILLIPSITE OR ANALCITE (ISOTROPIC TO 1ST ORDER GRAY INTERFERENCE COLORS), R.I. < 1.480",,,"CALCITE      VEIN | ARAGONIT     VEIN | CARB         VEIN | ANALCITE     VEINS, |              VESICLES | PHIL         VEINS, |              VESICLES",,
34,319,A,3,2,0.0,117.00,118.50,  120.00,"BASS, M.",PLAG SPARSELY PHYRIC DIABASE,"PCE 1 (0-20), 2 (22-26), 3 (26-41), 4 (44-47), 5 (49-54), 6 (56-58), 7 (59-64), 8 (66-74), 9 (74-81), 10 (81-86), 11 (86-95), 12 (95-113), 13 (113-117), 14 (117-132), 15 (132-147)","MEDIUM-GRAINED, AMYGDALOIDAL, OPHITIC","VEINS INCLUDE BROWN SMECTITE & CARBONATE IN THE ALTERED ROCK, THE INTERMEDIATE ALTERED ZONE CORRELATES LARGELY WITH A STEEP TO VERTICAL COMPLEX BRANCHING VEIN WHICH CAN BE TRACED FROM 66 TO 117CM - THE UPPER PART OF THIS VEIN IS IN PART CALCITE WITH OPEN DRUSES WHICH INDICATE FILLING OF AN OPEN JOINT","FRESH 0-41CM, VEINS HERE APPARENTLY OCCURRED UNDER NON- OXIDIZING CONDITIONS - LATER OXIDATION DESTROYED SULFIDES & ALTERED THE SMECTITE TO A BROWN COLOR | MOD 41-117CM, THE VUGS IN 56-64CM MAY ACCOUNT IN PART FOR INTENSE ALTERATION THERE | FRESH TO MOD 117-147CM","ROCK IS DARK GRAY TO 41CM & BROWNISH FROM 41-117CM, THE OPHITIC TEXTURE IS MUCH LIKE THAT IN SECS 2-3 & 3-1 WITH THE ADDITION THAT RELICT ORANGE-BROWN IDDINGSITE RIMS WHICH OCCUR IN AT LEAST 127-130CM SERVE TO OUTLINE & CONFIRM THE IDENTIFICATION OF SMECTITE PSEUDOMORPHS AFTER OLIVINE & CLEARLY DEMONSTRATE THEIR LARGE TO SMALL GRAIN SIZES & THEIR FORMATION THROUGHOUT ALMOST THE WHOLE CRYSTALLIZATION HISTORY OF THE MAGMA, THE VEINS & VUGS INDICATE THAT THE ALTERED ZONE CORRELATES WITH A ZONE OF HIGH POROSITY & PERMEABILITY, VEINS IN THE FRESHER PART OF THE SECTION ARE DARK GREEN & BLUE- GREEN PSEUDOMORPHS AFTER OLIVINE & MESOSTASIS IN THE HOST ROCK--THUS INDICATING THAT VEIN DEPOSITION WAS CONCURRENT WITH HOST ROCK ALTERATION & AMYGDULE FILLING, STYROFOAM DIVIDERS EACH ABOUT 2CM WIDE SEPARATE PIECES OF CORE THAT ARE NOT PART OF A CONTINUOUS CORE SEGMENT - AN UNKNOWN AMOUNT OF BASALT IS MISSING FROM THE PLACES WHERE THE STYROFOAM HAS BEEN ADDED","             PCES 2&3  SMECTITE, SULFIDE comments : AMYGDULES IN THE FRESH ROCK ARE BLUE-GREEN SMECTITE & IN SOME CASES HAVE SULFIDE CORES |              PCES 4&5  SMECTITE comments : AMYGDULES IN THE ALTERED INTERVAL ARE BROWN SMECTITE |     TO 6     PCES 6&7  SMECTITE comments : DIKTYTAXITIC VUGS IN PART LINED WITH BOTRYOIDAL BROWN SMECTITE",PLAG       TR    TO 2X2 comments : MAXIMUM SIZES FROM 2X2 TO 5X1.5MM,OLIVINE,IDDINGS | CARB | SMECTITE               OLIVINE | SULFIDE | CALCITE,,
34,319,A,3,2,1.0,117.00,118.51,  118.70,"BASS, M.",PLAG SPARSELY PHYRIC DIABASEMASSIVE,PCE 1 (1-20),MEDIUM-GRAINED,"MASSIVE, UNFRACTURED, PART OF AN IRREGULAR & ALMOST FLAT JOINT ON BOTTOM SURFACE IS PARTLY COATED WITH YELLOW SULFIDE",,COLOR IS DARK GRAY (BETWEEN 2.5Y 2.5/0 & 2.5Y 3/0),,PLAG       TR  TO 5X1.5,PYROXENE comments : LIGHT BROWN | PLAG comments : COLORLESS | OLIVINE comments : BLUE-GREEN PSEUDOMORPHS AFTER OLIVINE(?),SULFIDE,,
34,319,A,3,2,22.0,117.00,118.72,  118.91,"BASS, M.",PLAG SPARSELY PHYRIC DIABASESAME LITHOLOGY AS PCE 1,"PCE 2 (22-26), 3 (26-41)",,"20 DEGREE DIPPING JOINTS ON TOP SURFACE & 4CM DOWN - TOP SURFACE COATED WITH DENSE DARK GREEN RESINOUS SMECTITE & LIGHT BLUE-GREEN SMECTITE ETCHED IN SUCH A WAY AS TO SEEM TO BE A CROSS-FIBER VEIN - TOGETHER THESE TWO TYPES MAY HAVE BEEN A ZONED VEIN, THE LOWE JOINT IS COATED WITH YELLOW SULFIDE + CARBONATE, AN IRREGULAR VERTICAL JOINT RUNNING THE LENGTH OF THE SPECIMEN INCLUDES A THIN VEIN OF DULL GRAYISH BLUE- GREEN SMECTITE WHICH ANASTOMOSES SOMEWHAT",comments: IN LOWER PART OF SPECIMEN THE MAIN VEIN & STEEP TO GENTLY DIPPING BRANCHES ARE OXIDIZED RED-BROWN & THE ADJACENT ROCK IS STAINED BROWN,RARE YELLOW SULFIDE GRAINS IN THE BLUE-GREEN SMECTITE GRAINS IN THE MAIN ROCK,,PLAG       TR    TO 2X2,,SMECTITE | SULFIDE | CARB,,
34,319,A,3,2,44.0,117.00,118.94,  119.04,"BASS, M.",DIABASE,"PCE 4 (44-47), 5 (49-54)",MEDIUM-GRAINED,"VERTICAL & GENTLY DIPPING FRACTURES, NO VEINS",,"BROWN, ALTERED",      <1                                ROUND comments : ONE ROUND TAN AMYGDULE IN PCE 5,PLAG           TO 4X1.5,,,,
34,319,A,3,2,56.0,117.00,119.06,  119.08,"BASS, M.",DIABASESAME LITHOLOGY AS PCES 4&5,PCE 6 (56-58),,CARBONATE VEINS ON UPPER SURFACE ARE ALMOST FLAT- LYING,,,    TO 6 comments : VUGS ON LOWER SURFACE THAT ARE APPARENTLY DIKTYTAXITIC BUT POSSIBLY DUE TO SELECTIVE ALTERATION OF SOME CONSTITUENTS,,,CARB,,
34,319,A,3,2,59.0,117.00,119.09,  119.14,"BASS, M.",ALTERED DIABASESAME LITHOLOGY AS PCE 6,PCE 7 (59-64),,NO VEINS OR JOINTS,,,"    TO 5 comments : LOCALLY ABUNDANT LARGE DIKTYTAXITIC VUGS WITH EXPOSED PLAG PLATES & OPAQUE OCTAHEDRA & PYROXENE PRISMS & GRAINS, ONE VUG LINED BY BOTRYOIDAL BROWN SMECTITE",,PYROXENE | PLAG,SMECTITE,,
34,319,A,3,2,66.0,117.00,119.16,  119.97,"BASS, M.",DIABASEMASSIVE,"PCE 8 (66-74), 9 (74-82), 10 (82-86), 11 (86-95), 12 (95-113), 13 (113-118), 14 (118-132), 15 (132-147)",MEDIUM-GRAINED,"MASSIVE, PROMINENT 0.5-1+MM VEIN IS VERTICAL OVERALL & IRREGULAR & LOCALLY ANASTOMOSING IN DETAIL - IT EXTENDS FROM TOP TO 109CM, AT TOP THE VEIN IS CALCITE WITH NUMEROUS OPEN LENTICULAR DRUSY HOLES, BELOW 83CM THE VEIN BRANCHES - ONE BRANCH IS MAINLY CARBONATE THAT HORSETAILS AT 93CM & ENDS (LEAVES THE CORE) AT 107CM BUT IS STILL VUGGY & MIXED WITH SMECTITE AT LOWER END - THE OTHER BRANCH IS A 0.5MM DARK SMECTITE VEIN THAT INTERSECTS THE SIDE OF THE CORE AT 117CM--IT NARROWS PROGRESSIVELY DOWNWARD, BRANCHES FROM THE MAIN VEINS ARE FLAT TO STEEP & ARE OF THE SAME MINERALOGIES AS THE MAIN VEINS FROM WHICH THEY BRANCH (CALCITE OR SMECTITE)",,BROWN & ALTERED TO 117CM--BOTH RELATIVELY FRESH (GRAY) & ALTERED (BROWN) BELOW THAT DEPENDING ON PROXIMITY TO CRACKS & VEINS,,"PLAG       TR       4X4 comments : IN PCE 15 AT 138.5CM: 4X4MM, X'=1.564+ TO1.570+,MAINLY 1.566+ (AN69-80+),MAINLY AN72,Z'=MAX = 1.572,AN73-74 AND LESS, APPARENTLYSOME GROUNDMASS PLAG INCLUDED AS WELL AS THEZONED EDGE OF THE PHENOCRYST, PHENO NOT WELLFORMED",,CALCITE | SMECTITE,,
34,319,A,3,3,0.0,117.00,120.00,  121.50,"BASS, M.",PLAG SPARSELY PHYRIC DIABASE,"PCE 1 (0-19), 2 (21-23), 3 (25-43), 4 (45-62), 5 (62-79), 6 (82-94), 7 (94-104), 8 (104-115), 9 (115-131), 10 (132-146)","MEDIUM-GRAINED, NO VUGS OR OPEN SPACES, SPARSELY PHYRIC","LARGE PORTIONS OF THE CORE ARE UNJOINTED & UNVEINED (FOR INSTANCE PCES 2&10), ONLY ONE JOINT IS SEEN IN PCE 3, OBSERVED VEINS ARE DARK GREEN & BLUE-GREEN & BROWN SMECTITE & CALCITE",,"SIMILAR TO SEC 2, TO A DEPTH OF 74CM THERE IS A MIXTURE OF FRESH DARK GRAY & ALTERED DARK BROWNISH GRAY ROCK--THE BROWN ALTERED PARTS ARE NOT RELATED TO VISIBLE JOINTS OR VEINS BUT THESE PRESUMABLY LAY NOT FAR OUTSIDE THE PRESENT CORE WHICH EVIDENTLY PENETRATED LARGE BLOCKS BOUNDED BY WIDELY SPACED JOINTS THUS YIELDING GOOD CORE RECOVERY IN LARGE PIECES WHICH ARE READILY REFITTED, BELOW 74CM THE ROCK IS WHOLLY DARK & FRESH, IN AT LEAST TWO PLACES THE SHARP DIFFUSION-CONTROLLED CONTACTS BETWEEN ALTERED ROCK & FRESH GRAY ROCK CROSSCUT SMECTITE VEINS & THE VEINS ARE BROWN OR GREEN TO BLUE-GREEN ACCORDING TO THE DEGREE OF ALTERATION OF THE LOCAL HOST ROCK - THIS FACT DEMONSTRATES AS IN CORE 319-1-1 THAT THE OXIDATIVE ALTERATION & STAINING POSTDATE VEIN DEPOSITION - IN PCE 1 THE BROWN STAINING ADVANCED ON EITHER SIDE OF A CROSSCUT SMECTITE VEIN ABOUT 2-3CM AHEAD OF ITS POSITION IN THE HOST DIABASE MORE REMOVED FROM THE VEIN - THIS VEIN APPEARS TO HAVE BEEN MORE PERMEABLE THAN THE ROCK AS A WHOLE BUT SUCH IS NOT ALWAYS THE CASE, STYROFOAM DIVIDERS EACH ABOUT 2CM WIDE SEPARATE PIECES OF CORE THAT ARE NOT KNOWN TO BE PART OF A CONTINUOUS CORE SEGMENT - AN UNKNOWN AMOUNT OF BASALT IS MISSING FROM THE PLACES WHERE THE STYROFOAM HAS BEEN ADDED",,PLAG      0-1TO 3X2&6X2,OLIVINE comments : BLUE-GREEN SMECTITE PSEUDOMORPHS AFTER OLIVINE ARE SCATTERED THROUGHOUT THE SECTION,CALCITE | SMECTITE               OLIVINE,,
34,319,A,3,3,0.0,117.00,120.00,  120.19,"BASS, M.",PLAG SPARSELY PHYRIC DIABASE,PCE 1 (0-19),MEDIUM-GRAINED,"A 0.8MM-THICK DARK GREEN SMECTITE VEIN LOCALLY INTERLAYERED WITH CALCITE DIPS 80 DEGREES - NEAR THE TOP VERY FINE SMECTITE-FILLED CRACKS BRANCH OFF IT IN SEVERAL DIRECTIONS, THE MAIN VEIN CROSS-CUTS THE BROWN ALTERATION OF THE HOST ROCK & IN THAT PART OF THE ROCK HAS RUSTY BROWN WALLS WHEREAS IT IS WHOLLY GREEN IN THE FRESH ROCK - THE ALTERATION POSTDATES THE VEIN & WAS NOT CONTROLLED BY IT - DARK GREEN PATCHES ON THE UPPER SURFACE INDICATE IT IS IN PART A FLAT JOINT",,BROWN & MORE THAN HALF ALTERED TO FRESH GRAY,,PLAG        1    TO 4X3,,SMECTITE | CALCITE | CARB,,
34,319,A,3,3,21.0,117.00,120.21,  120.23,"BASS, M.",DIABASE,PCE 2 (21-23),,NO VEINS OR JOINTS,FRESH,"GRAY, ABRADED ON ALL SIDES",,,,,,
34,319,A,3,3,25.0,117.00,120.25,  120.43,"BASS, M.",PLAG SPARSELY PHYRIC DIABASE,PCE 3 (25-43),MEDIUM-GRAINED,"NO VEINS OR MAJOR JOINTS, ONE TIGHT NON-PENETRATIVE MODERATELY DIPPING CRACK CROSS-CUTS THE FRESH- ALTERED CONTACT",,40% GRAY & 60% BROWN ALTERED,,PLAG       TR    TO 1X4,,,,
34,319,A,3,3,43.0,117.00,120.43,  120.79,"BASS, M.",PLAG SPARSELY PHYRIC DIABASESIMILAR TO PCE 3,"PCE 4 (43-62), 5 (62-79)",,SEVERAL FLAT TO MODERATELY DIPPING JOINTS & THIN SMECTITE VEINS CROSS-CUT THE FRESH-ALTERED CONTACT & (AS IN PCE 3) THEIR DEGREE OF ALTERATION PARALLELS THAT OF THE HOST SO THEY PREDATE & DID NOT CONTROL THE RUSTY ALTERATION,,BROWN ALTERED ROCK DISAPPEARS AT 74CM & LOWER PART OF PCE 5 IS WHOLLY GRAY,,"PLAG        1    TO 3X5 comments : IN PCE 4 AT 49CM:  3X5MM (""SKELETAL"" - ABUNDANTV.F.GRAINED INCLUSIONS-PROBABLY PHENO CORES),X'= 1.568+ TO 1.574 (RANGE AN76-88), MAINLY1.570-1.573 (AN80-86)",,SMECTITE,,
34,319,A,3,3,82.0,117.00,120.82,  121.31,"BASS, M.",PLAG SPARSELY PHYRIC DIABASE,"PCE 6 (82-94), 7 (94-104), 8 (104-115), 9 (115-131)",,"SPARSE STEEPLY TO MODERATELY DIPPING PENETRATIVE & NON-PENETRATIVE CRACKS WITH OR WITHOUT A BLUE-GREEN SMECTITE VEIN, PCE 8 HAS NO CRACKS, A VERTICAL VEIN IN PCE 9 HAS THE THICKEST SMECTITE",,WHOLLY GRAY LIKE THE LOWER PART OF PCE 5,,"PLAG     TR-1    TO 2X6 comments : IN PCE 7 AT 77CM:  2X6MM (V.F.GRAINED OVOIDINCLUSIONS-PROBABLY IN PHENO CENTER),X'=1.561-1.575,AN73-90 (FAIRLY UNIFORMLYUNIFORMLY DISTRIBUTED THROUGH THIS RANGE,PART OF THE SCATTER MAY BE DUE TO IMPERFECTCLEAVAGE), Z' = 1.571-1.578 (010), MAINLY1.575, AN72-86+,MAINLY AN79",,SMECTITE,,
34,319,A,3,3,132.0,117.00,121.32,  121.46,"BASS, M.",DIABASE,PCE 10 (132-146),,"UNJOINTED, BOTTOM SURFACE IS A 20 DEGREE DIPPING JOINT WITH LIGHT BLUE-GREEN SMECTITE COATING",,GRAY,,PLAG       TR    TO 3X2,,SMECTITE,,
