leg,site,hole,core,section,top interval depth(cm),top of core depth(cm),top of section(m),sample midpoint depth(m),describer,rock name,piece numbers,texture data,structure data,alteration data,other information data,vesicle data,phenocryst data,groundmass mineral data,replacement mineral data,comments,unknown code
34,319,A,1,1,0.0,98.00,98.00,   99.22,"BASS, M.",PLAG-OL SPARSELY MICROPHYRIC BASALTDIABASE,"PCE 1 (3-5), 2 (6-9), 3 (11-17), 4 (20-27), 5 (29-37), 6 (38-46), 7 (48-53), 8 (55-59), 9 (61-64), 10 (67-71), 11 (71-73), 12 (77-81), 13 (77-81), 14 (83-90), 15 (92-96), 16 (98-102), 17 (104-107), 18 (109-115), 19 (117-120), 20 (123-126)","THE GRAIN SIZE INCREASES FROM APHANITIC AT THE TOP TO COARSE-GRAINED AT 38CM & REMAINS COARSE-GRAINED TO ABOUT 98CM & DECREASES THEREAFTER TO FINE-GRAINED VARIOLITIC (PLUMOSE) BASALT AT THE BASE, SPARSELY MICROPHYRIC",VEINS INCLUDE RED & BROWN & RED-BROWN & YELLOW-BROWN & YELLOW & GREENISH YELLOW & GREEN & BLUE SMECTITE & CALCITE & FE.OXIDE & MN.OXIDE & PHILLIPSITE(?),,"STYROFOAM DIVIDERS ABOUT 2CM WIDE SEPARATE PIECES OF CORE THAT ARE NOT PART OF A CONTINUOUS CORE SEGMENT - AN UNKNOWN AMOUNT OF BASALT IS MISSING IN THE PLACES WHERE STYROFOAM HAS BEEN ADDED, A COOLING UNIT EXTENDS FROM THE TOP OF SEC 1 TO AT LEAST 115 & POSSIBLY 122CM, THE ROCK VARIES FROM DARK GRAY (RARELY MEDIUM GRAY) WHERE FRESH TO DARK BROWNISH OR YELLOWISH GRAY","                       ARAGONITE comments : SMALL DIKTYTAXITIC VUGS APPEAR AT 29-46CM & 109- 115CM, RARE LARGE VUGS WITH ARAGONITE APPEAR AT 77-81CM",PLAG      0-2 comments : MICROPHENOCRYSTS OF PLAG & ALTERED OLIVINE VARY INABUNDANCE FROM 1% AT TOP TO ALMOST NIL THROUGHMOST OF THE UNIT TO 1-2% BELOW 104CM WITH ASUGGESTION OF ACCUMULATION IN 104-107CM | OLIVINE,,SMECTITE               OLIVINE comments :  OLIVE GREEN COLOR | FE.OXIDE | MN.OXIDE | PHIL | CALCITE comments :  CONICAL CALCITE CRYSTALS LINE OPEN JOINTS AT 77- 81CM | ARAGONIT,,
34,319,A,1,1,125.0,98.00,99.25,   99.50,"BASS, M.",APHYRIC TO PLAG-OL-AUGITE MICROPHYRIC BASALT,"PCE 21 (124-135), 22 (137-142), 23 (144-148)","APHYRIC TO MICROPHYRIC, VERY FINE-GRAINED TO COARSE- GRAINED, VARIOLITIC (PLUMOSE)",VEINS ARE COMPOSED OF RED & BROWN & RED-BROWN & GREENISH BROWN SMECTITE,,"AN INCOMPLETE COOLING UNIT WHOSE BASE IS IN SEC 2 EXTENDS FROM 125-148CM, COLOR IS DARK GRAY TO DARK BROWNISH GRAY",                       COMBINE comments : DIKTYTAXITIC VUGS AT 137-142CM CONTAIN PHILLIPSITE & MINOR ARAGONITE & CALCITE WITH TRACES OF MN.OXIDE,PLAG        1 comments : PLAG & OLIVINE & AUGITE MICROPHENOCRYSTS ARE 1% OFINTERVAL 137-142CM | OLIVINE comments : MOSTLY ALTERED TO SMECTITE AND/OR CALCITE | AUGITE,,SMECTITE               OLIVINE | CALCITE                OLIVINE | MN.OXIDE | PHIL | ARAGONIT,,
34,319,A,1,1,3.0,98.00,98.03,   98.05,"BASS, M.",SPARSELY MICROPHYRIC BASALT,PCE 1 (3-5),"APHANITIC, 1% MICROPHENOCRYSTS UP TO 1MM LONG","COMPLEX JOINT BLOCK WITH BROWN TO GREEN STAINED JOINTS OF AT LEAST 4 ORIENTATIONS--FLAT TO VERTICAL, ONE FLAT JOINT IS PARTLY COATED WITH DARK BROWN RESINOUS SMECTITE & ANOTHER IS COATED WITH A LIGHT TRANSLUCENT BLUE FILM",,DARK GRAY (2.5Y 3/0 OR 2.5/0),,,,SMECTITE,,
34,319,A,1,1,6.0,98.00,98.06,   98.09,"BASS, M.",BASALTSIMILAR TO PCE 1,PCE 2 (6-9),SLIGHTLY COARSER-GRAINED THAN PCE 1,SEVERAL JOINT ORIENTATIONS--VARIOUS ONES COATED PARTLY BY DARK RED-STAINED SMECTITE & A LIGHT YELLOW POWDERY MATERIAL (ALMOST ISOTROPIC - LIGHT BROWN TO COLORLESS IN TRANSMITTED LIGHT) & A LIGHT BLUE FILM AS IN PCE 1,,THE BLUE FILM IS FORMED OF BLADED CRYSTALS WITH LOW FIRST ORDER GRAY INTERFERENCE COLORS AND (-) ELONGATION (LENGTH FAST)--IT IS ASSOCIATED WITH AN EARTHY CLAY WITH FIRST ORDER YELLOW TO RED INTERFERENCE COLORS,,,,SMECTITE,,
34,319,A,1,1,11.0,98.00,98.11,   98.17,"BASS, M.",PLAG-OL SPARSELY MICROPHYRIC BASALTMASSIVE,PCE 3 (11-17),"FINE-GRAINED, COARSER THAN PCES 1&2, UP TO 1% MICROPHENOCRYSTS UP TO 6MM LONG","ONE VERTICAL & ONE 25-DEGREE DIPPING JOINT-- OTHERWISE MASSIVE, THE VERTICAL JOINT IS COATED BY LIGHT YELLOW CLAY SPOTTED WITH MN.OXIDE, THE 25- DEGREE JOINT HAS INTERLAYERED YELLOW & RED BROWN CLAY COATED BY A DRUSY VERY LIGHT TAN TRANSPARENT LAYER OF COLORLESS PRISMS (PHILLIPSITE?)",,DARK YELLOWISH GRAY (5Y 2.5/2),,,,MN.OXIDE | CLAY,,
34,319,A,1,1,20.0,98.00,98.20,   98.27,"BASS, M.",PLAG-OL SPARSELY MICROPHYRIC BASALTMASSIVE,PCE 4 (20-27),"FINE-GRAINED, SPARSELY MICROPHYRIC","ONE VERTICAL JOINT COATED WITH WHITE CALCITE, ONE 55-DEGREE DIPPING JOINT COATED WITH GREENISH YELLOW & MINOR RED-BROWN CLAY WITH MN.OXIDE DENDRITES, MASSIVE & UNJOINTED OTHERWISE",,"DARK YELLOWISH GRAY TO BROWNISH GRAY, BROWN TO RED SPOTS MAY BE ALTERED MESOSTASIS AND/OR OLIVINE",,PLAG        1    TO 0.6 | OLIVINE comments : MAY INCLUDE OLIVINE,,CALCITE | MN.OXIDE | CLAY,,
34,319,A,1,1,29.0,98.00,98.29,   98.37,"BASS, M.",BASALTSIMILAR TO PCE 4,PCE 5 (29-37),COARSER-GRAINED THAN PCE 4 (MEDIUM TO COARSE- GRAINED),"35-DEGREE DIPPING JOINT ON TOP SURFACE COATED WITH WAXY YELLOW-GREEN + EARTHY RED-BROWN CLAY, ANOTHER 35-DEGREE DIPPING JOINT ON BOTTOM SURFACE COATED WITH DARK EARTHY YELLOW-BROWN MATERIAL, OTHERWISE UNJOINTED",,, comments : RARE TINY DIKTYTAXITIC VUGS,,,CLAY,,
34,319,A,1,1,38.0,98.00,98.38,   98.46,"BASS, M.",BASALT OR DIABASE,PCE 6 (38-46),"COARSE-GRAINED BASALT OR FINE-GRAINED DIABASE, MORE UNIFORMLY TEXTURED THAN OVERLYING ROCKS, COARSEST ROCK SEEN IN SECTION","BROWN STAINED 30-DEGREE DIPPING JOINT WITH YELLOW- BROWN DISCONTINUOUS STAIN & BLACK MN.OXIDE SPOTS ON UPPER SURFACE, TIGHT DISCONTINUOUS CRACKS IN SEVERAL PLACES",,IRREGULAR 20-DEGREE DIPPING SURFACE (SLIGHTLY CRACKED ON ONE SIDE OF CORE) SEPARATES RELATIVELY ALTERED DARK YELLOWISH GRAY ROCK ABOVE FROM FRESHER DARK GRAY BASALT BELOW,  TO 1.5 comments : MINOR DIKTYTAXITIC VUGS--THE LARGEST HAS A BLUE COATING AND OTHERS ARE UNALTERED,,,MN.OXIDE,,
34,319,A,1,1,48.0,98.00,98.48,   98.53,"BASS, M.",SLIGHTLY MICROPHYRIC BASALT,PCE 7 (48-53),"VERY SLIGHTLY FINER-GRAINED THAN PCE 6 BUT COARSER THAN PCE 5, SLIGHTLY MICROPHYRIC","UNJOINTED EXCEPT FOR ONE FLAT TIGHT DISCONTINUOUS CRACK ABOUT 5 CM BELOW TOP, NO VEINS",,DARK GRAY,,,,,,
34,319,A,1,1,55.0,98.00,98.55,   98.59,"BASS, M.",BASALT OR DIABASEMASSIVE,PCE 8 (55-59),COARSE-GRAINED BASALT OR VERY FINE-GRAINED DIABASE,"MASSIVE, UNJOINTED EXCEPT FOR TINY REMNANT ON FLAT JOINT ON UPPER SURFACE COATED WITH LIGHT TO MEDIUM YELLOW-BROWN CLAY",,DARK BROWNISH GRAY,,,,CLAY,,
34,319,A,1,1,61.0,98.00,98.61,   98.64,"BASS, M.",BASALT,PCE 9 (61-64),"SAME GRAIN SIZE AS PCE 8 OR SLIGHTLY COARSER, NO VUGS",SLAB BOUNDED BY A STEEPLY DIPPING (80 DEGREE) JOINT WITH A 3CM BROWNISH ZONE OF ALTERATION NEXT TO IT-- THE NEXT HALF CM IS RELATIVELY FRESH,,,            0,,,,,
34,319,A,1,1,67.0,98.00,98.67,   98.71,"BASS, M.",BASALT,PCE 10 (67-71),"SLIGHTLY FINER-GRAINED THAN PCE 9, NO VUGS","UNJOINTED EXCEPT FOR ONE GREENISH BROWN-STAINED 35- DEGREE DIPPING JOINT ON BOTTOM SURFACE WITH REMNANTS OF LIGHT TAN CALCITE VEIN, SECOND JOINT SIMILAR TO FIRST (BUT UNVEINED) NEAR THE BOTTOM BUT OF DIFFERENT ORIENTATION",,STILL SOME DARK RED-BROWN SPOTS OF ALTERED MESOSTASIS OR OLIVINE,            0,,,CALCITE,,
34,319,A,1,1,71.0,98.00,98.71,   98.73,"BASS, M.",BASALTMASSIVE,PCE 11 (71-73),COARSE-GRAINED - PERHAPS SLIGHTLY FINER-GRAINED THAN PCE 10,"UNJOINTED, MASSIVE",,DARK BROWNISH GRAY,,,,,,
34,319,A,1,1,77.0,98.00,98.77,   98.81,"BASS, M.",BASALT,PCE 12 (77-81),ANGULAR CORE FRAGMENT,"REMNANTS OF IRREGULAR STEEPLY TO MODERATELY DIPPING JOINTS WITH YELLOWISH GREEN CLAY COATS, ONE JOINT HAS RARE BLACK MN.OXIDE SPOTS AND CLUSTERS OF STRIATED CONICAL ""DOGTOOTH"" CALCITE CRYSTALS OF A TYPE SEEN ALSO IN THE EXPERIMENTAL MOHOLE BASALT - THEY INDICATE DEPOSITION IN OPEN VEINS",,VISUAL DESCRIPTION FORM FOR PCE 13 IS MISSING FROM ARCHIVES | VISUAL DESCRIPTION FORM FOR PCE 14 IS MISSING FROM ARCHIVES | VISUAL DESCRIPTION FORM FOR PCE 15 IS MISSING FROM ARCHIVES | VISUAL DESCRIPTION FORM FOR PCE 16 IS MISSING FROM ARCHIVES,,,,CALCITE | CLAY | MN.OXIDE,,
34,319,A,1,1,104.0,98.00,99.04,   99.07,"BASS, M.",PLAG-OL MICROPHYRIC BASALT,PCE 17 (104-107),"MANY SMALL (TO 4CM) ANGULAR UNORIENTED FRAGMENTS OF FINER & VERY FINE-GRAINED BASALT, MICROPHYRIC",,,"DARK GRAY, COOLING UNIT BOUNDARY BETWEEN PCES 17 & 18",,PLAG      1-2      TO 1 | OLIVINE,,,,
34,319,A,1,1,109.0,98.00,99.09,   99.15,"BASS, M.",PLAG-OL MICROPHYRIC BASALT,PCE 18 (109-115),"3 REFITTED FRAGMENTS, 1% MICROPHENOCRYSTS UP TO 1MM LONG, VERY FINE-GRAINED",FRAGMENTS BOUNDED IN PART BY A VERTICAL AND A 55- DEGREE DIPPING JOINT,,"THE VERTICAL JOINT HAS A LIGHT YELLOW CLAY COATING & SOME RED STAINS & RARE MN.OXIDE SPOTS, THE 55-DEGREE DIPPING JOINT HAS A VERY THIN COATING OF AMBER YELLOW SMECTITE WITH MINOR ADMIXED CALCITE & BLACK MN.OXIDE SPOTS ON ITS SURFACE, THE ROCK IS DIFFERENT FROM AND LIGHTER COLORED THAN ANY BASALT ABOVE, THE COLOR DARKENS SLIGHTLY IN WHAT IS PRESUMED TO BE THE DOWNWARD (INWARD) DIRECTION, SEE CORE 6-1 FOR THIN SECTION INFORMATION, COLOR IS MEDIUM GRAY",    TO 1 comments : DIKTYTAXITIC VUGS,,,CALCITE | CLAY | SMECTITE | MN.OXIDE,,
34,319,A,1,1,117.0,98.00,99.17,   99.20,"BASS, M.",PLAG-OL MICROPHYRIC BASALT,PCE 19 (117-120),"MEDIUM-GRAINED, <1% MICROPHENOCRYSTS (MAXIMUM SIZE 1MM)",45-DEGREE DIPPING JOINT ON THE LOWER SURFACE IS COATED BY WAXY LIGHT GREEN-BROWN SMECTITE & REMNANT PATCHES OF WHITE CALCITE,,"MEDIUM TO DARK BROWNISH GRAY, LIGHT OLIVE RESINOUS SPOTS MAY BE ALTERED OLIVINE",,,,CALCITE | SMECTITE,,
34,319,A,1,1,123.0,98.00,99.23,   99.26,"BASS, M.",PLAG-OL MICROPHYRIC BASALT,PCE 20 (123-126),"FOUR FRAGMENTS, MICROPHYRIC, FINE-GRAINED (FINER THAN PCE 19)",,,"DARK GRAY, COOLING UNIT BOUNDARY BETWEEN PCES 20 & 21",,,,,,
34,319,A,1,1,124.0,98.00,99.24,   99.35,"BASS, M.",APHYRIC BASALTMASSIVE,PCE 21 (124-135),"VIRTUALLY APHYRIC, MEDIUM TO COARSE-GRAINED FRAGMENT","UNFRACTURED, UNJOINTED, MASSIVE",,"BARREL-SHAPED, DARK BROWNISH GRAY",,,,,,
34,319,A,1,1,137.0,98.00,99.37,   99.42,"BASS, M.",PLAG-OL SPARSELY MICROPHYRIC BASALT,PCE 22 (137-142),"ANGULAR, SLIGHTLY MICROPHYRIC, FINE-GRAINED FRAGMENT","JOINT AND FRACTURE-BOUNDED, FIVE JOINTS BELONGING TO FOUR SETS ARE COATED WITH RED & BROWN & GREENISH BROWN WAXY CLAY",,"ONE REDDISH BROWN IRREGULAR CAVERNOUS ""JOINT"" IS APPARENTLY IN PART AN OPEN VUG NOW SPARSELY LINED WITH COLORLESS PRISMS (PHILLIPSITE?) & RARE MN.OXIDE SPOTS & MINOR ARAGONITE & MINOR CALCITE, SLIGHT COLOR ZONATION RELATED TO JOINTS, DARK BROWNISH GRAY","                       CLAY comments : DIKTYTAXITIC VUGS, ONE VUG FILLED WITH YELLOW CLAY--OTHERS UNALTERED AND ALL ARE VERY SMALL",,,ARAGONIT | CALCITE | MN.OXIDE | PHIL comments :  ZONED WITH RESPECT TO BIREFRINGENCE (GENERALLY ISOTROPIC EDGES - FIRST ORDER GRAY INTERFERENCE COLORS IN THE CORE) | CLAY,,
34,319,A,1,1,144.0,98.00,99.44,   99.48,"BASS, M.",PLAG-OL SPARSELY MICROPHYRIC BASALT,PCE 23 (144-148),"FINE TO VERY FINE-GRAINED--SIMILAR TO PCE 22 OR SLIGHTLY FINER, <1% MICROPHENOCRYSTS (0.6MM MAXIMUM SIZE), NO VUGS PRESENT",ONE VERTICAL JOINT AND ONE FLAT JOINT (=TOP SURFACE) BOTH PARTIALLY COATED WITH BROWN TO RED-BROWN RESINOUS SMECTITE,,"STUCK IN CORE CATCHER AND BROKEN DURING DISLODGING PROCESS, MEDIUM DARK GRAY, POSSIBLY PART OF THE SAME COOLING UNIT AS PCE 22",            0 comments : NO VUGS PRESENT,,,SMECTITE,,
34,319,A,1,CC,0.0,98.00,99.60,   99.60,"BASS, M.",BASALT,PCE NO PIECE NUMBERS ASSIGNED,CONTAINS SOME RELATIVELY CHILLED CRYSTALLINE BASALT- EVIDENTLY CHILLED SELVAGES WERE DRILLED BUT NOT RECOVERED IN THE CORE,A DRUSY COLORLESS VEIN ON LIGHT TAN SMECTITE IS MAINLY AN ISOTROPIC TO FAINTLY BIREFRINGENT MINERAL (PROBABLY ANALCITE OR PHILLIPSITE--R.I.<1.480--SEE SITE 319A-3-CC) ACCOMPANIED BY MINOR CALCITE & ARAGONITE,,,,,GLASS      TR,PALAG comments :  TAN TO ORANGE COLOR | SMECTITE | CALCITE | ARAGONIT,,
34,319,A,2,1,0.0,107.50,107.50,  107.80,"BASS, M.",BASALTGLASS,"PCE 1 (1-5), 2 (7-9), 3 (10-15), 4 (17-24), 5 (26-30)","MEDIUM-GRAINED, APHANITIC, SPHERULITIC","ONE CARBONATE VEIN IS PRESENT NEAR TOP OF SECTION, FEW FRACTURES OR VEINS IN PCES 1-4",,"LOWER PART OF A COOLING UNIT (THE UPPER PART OF WHICH IS IN LOWER PART OF CORE 1) EXTENDS TO 30CM DEPTH - IT GRADES FROM DARK GRAY MEDIUM-GRAINED BASALT DOWNWARD THROUGH APHANITIC SPHERULITIC ROCK TO BLACK GLASS WITH MINOR ORANGE-BROWN AND ONE FILM OF COLORLESS PALAGONITE, THE STYROFOAM DIVIDERS (EACH ABOUT 2CM WIDE) SEPARATE PIECES OF CORE THAT ARE NOT PART OF A CONTINUOUS CORE SEGMENT - AN UNKNOWN AMOUNT OF BASALT IS MISSING IN THE PLACES WHERE THE STYROFOAM HAS BEEN ADDED",,PLAG comments : THE GLASS CONTAINS MICROPHENOCRYSTS OF PLAG &OLIVINE & AUGITE | OLIVINE | AUGITE,GLASS,PALAG | CARB comments :  SCATTERED CARBONATE CRYSTALS ON ONE SURFACE OF PCE 1,,
34,319,A,2,1,32.0,107.50,107.82,  109.00,"BASS, M.",PLAG-OL SPARSELY PHYRIC BASALTDIABASE,"PCE 6 (33-39), 7 (41-45), 8 (48-53), 9 (55-58), 10 (60-66), 11 (68-71), 12 (73-78), 13 (80-82), 14 (84-89), 15 (90-92), 16 (94-101), 17 (101-115), 18 (115-120), 19 (120-137), 20 (137-148)","VERY FINE TO FINE-GRAINED, VARIOLITIC, VESICULAR TO AMYGDALOIDAL ON A VERY FINE SCALE, SPARSELY PHYRIC",VEINS INCLUDE BLUE OR DARK GREEN OR LIGHT YELLOW- GREEN SMECTITE & SULFIDE (IN LOWER PART OF SECTION) & CALCITE & ARAGONITE,,"ROCK GRADES PROGRESSIVELY FROM VERY FINE-GRAINED VARIOLITIC BASALT TO FINE-GRAINED INTERGRANULAR AND VARIOLITIC DIABASE, DARK GRAY, THIS IS THE TOP OF THE THICKEST UNIT PENETRATED IN HOLE 319A (THE BOTTOM OCCURRING IN CORE 3 SEC 5)","      <1   TR          SMECTITE comments : HOLLOW VESICLES LINED WITH GREEN OR DARK GRAY OR RED OR BLUISH GRAY SMECTITE, SPARSE VESICLES AND AMYGDULES |                        SMEC, PHIL, CARB, |                        SULFIDE comments : AMYGDULES LINED BY SAME SMECTITE AS IN VESICLES & THEIR CORES FILLED BY SMECTITE & PHILLIPSITE & CARBONATE & SULFIDE ALONE OR IN COMBINATION, SULFIDE CORES APPEAR ONLY LOW IN THE SECTION",PLAG     <1-1 | OLIVINE,,SMECTITE | CARB | SULFIDE | ARAGONIT | CALCITE,,
34,319,A,2,1,48.0,107.50,107.98,  108.03,"BASS, M.",PLAG SPARSELY PHYRIC BASALT,PCE 8 (48-53),"FINE-GRAINED, VARIOLITIC, SPARSELY PHYRIC",,,,"    TO 2               SMECTITE         ROUND comments : VESICLES LINED WITH LIGHT GREEN TO BLUISH GRAY SMECTITE (RED WHERE ALTERED), THEY ARE HOLLOW & TOO ROUND TO BE DIKTYTAXITIC VUGS",PLAG       <1,,SMECTITE,,
34,319,A,2,1,55.0,107.50,108.05,  108.08,"BASS, M.",PLAG SPARSELY PHYRIC BASALT,PCE 9 (55-58),,,,SAME AS PCE 8 BUT DARKER GRAY,"                       CALCITE comments : SOME VESICLES ARE LINED OR FILLED BY A COLORLESS MINERAL INSTEAD OF THE MORE COMMON SMECTITE LINING IN PCE 8, THE FILLINGS ARE MAINLY CALCITE + A MINOR AMOUNT OF AN ISOTROPIC TO FAINTLY BIREFRINGENT MINERAL (ANALCITE OR PHILLIPSITE?)",,,CALCITE,,
34,319,A,2,1,60.0,107.50,108.10,  108.16,"BASS, M.",PLAG SPARSELY PHYRIC BASALTSAME LITHOLOGY AS PCES 8&9,PCE 10 (60-66),,CARBONATE VEIN APPEARS ON ONE SURFACE (CONTAINS BOTH CALCITE & ARAGONITE),,AN EARTHY BLUE COATING IN ONE SPOT ON ONE SURFACE,                       SMECTITE comments : VESICLES ARE HOLLOW (SMECTITE-LINED),,,CALCITE | ARAGONIT | SMECTITE,,
34,319,A,2,1,68.0,107.50,108.18,  108.21,"BASS, M.",BASALT,PCE 11 (68-71),STILL A FINE-GRAINED VARIOLITIC BASALT,,,,"                       HOLLOW           ROUND comments : VESICLES LINED BY LIGHT GREEN OR DARK GRAY MATERIAL, RARELY FILLED WITH WHITE CORES",,,,,
34,319,A,2,1,73.0,107.50,108.23,  108.28,"BASS, M.",PLAG SPARSELY GLOMEROPHYRIC BASALTSIMILAR TO PCE 11,PCE 12 (73-78),,IRREGULAR NON-PENETRATIVE CRACKS OF VARIOUS ORIENTATIONS,,," comments : MANY OR MOST VESICLES NOW FILLED WITH WHITE COMPLETE OR HOLLOW CORES - OFTEN WITH RADIAL STRUCTURE, ONE 4MM-LONG VUG",PLAG comments : SCATTERED PLAG + CPX (OR OLIVINE?) GLOMEROCRYSTS,,,,
34,319,A,2,1,80.0,107.50,108.30,  108.32,"BASS, M.",PLAG SPARSELY GLOMEROPHYRIC BASALTSAME LITHOLOGY AS PCES 8-12,PCE 13 (80-82),,,,,                       SMECTITE comments : AMYGDULES MUCH LESS COMMON THAN ABOVE & FILLED WITH DARK GREEN (OR LIGHT YELLOW GREEN WHERE ALTERED) SMECTITE RATHER THAN WHITE MATERIAL,,,SMECTITE,,
34,319,A,2,1,84.0,107.50,108.34,  108.39,"BASS, M.",PLAG SPARSELY GLOMEROPHYRIC BASALTSAME LITHOLOGY AS PCE 13,PCE 14 (84-89),,,,," comments : VESICLES UNCOMMON, VARIABLY FILLED OR HOLLOW",,,,,
34,319,A,2,1,90.0,107.50,108.40,  108.42,"BASS, M.",PLAG SPARSELY GLOMEROPHYRIC BASALTSAME LITHOLOGY AS PCE 14,PCE 15 (90-92),PERHAPS SLIGHTLY COARSER THAN ABOVE,,,,,,,,,
34,319,A,2,1,94.0,107.50,108.44,  108.50,"BASS, M.",PLAG SPARSELY GLOMEROPHYRIC BASALTSAME LITHOLOGY AS PCE 15,PCE 16 (94-100),,FRACTURE ABOUT 20 DEGREES FROM VERTICAL,,,                       SMECTITE         ROUND comments : HOLLOW SMECTITE-LINED VESICLES,,,SMECTITE,,
34,319,A,2,1,100.0,107.50,108.50,  109.00,"BASS, M.",PLAG SPARSELY PHYRIC DIABASEMASSIVE,"PCE 17 (100-115), 18 (115-120), 19 (120-137), 20 (137-150)",FINE-GRAINED,"MASSIVE, UNIFORM, STEEPLY DIPPING VEIN IS VERTICAL OVERALL BUT SOMEWHAT IRREGULAR IN DETAIL - IT CAN BE TRACED THROUGH PCES 17-20 - AT THE TOP IT IS ALMOST 2MM THICK & COMPOSED OF INTERLAYERED WHITE CALCITE(?) & DARK GREEN SMECTITE--BELOW THE MIDDLE OF PCE 20 IT IS PURE SMECTITE - THE VEIN IS ANASTOMOSING WHERE CALCITE IS PRESENT & A SINGLE WELL-DEFINED VEIN WHERE IT IS WHOLLY SMECTITE, GENTLY DIPPING CRACKS APPEAR BUT THEY ARE TIGHT & COMMONLY DISCONTINUOUS & EITHER UNFILLED OR CONTAIN ONLY A THIN SMECTITE OR CALCITE FILM, THE SMECTITE VEINS CONTAIN YELLOW SULFIDES (AS IN A THIN SUBSIDIARY CRACK IN PCE 20 FILLED BY TURQUOISE BLUE SMECTITE)",,,    TO 1               SMECTITE         ROUND comments : TINY AMYGDULES FILLED OR LINED BY DARK GREEN SMECTITE - RARELY WITH A SULFIDE CORE,PLAG     TO 1      TO 3,,CALCITE | SMECTITE | SULFIDE,,
34,319,A,2,2,0.0,107.50,109.00,  110.50,"BASS, M.",PLAG SPARSELY PHYRIC DIABASE,"PCE 1 (O-10), 2 (10-24), 3 (24-33), 4 (35-40), 5 (42-49), 6 (51-58), 7 (60-64), 8 (65-70), 9 (73-82), 10 (84-85), 11 (88-94), 12 (96-99), 13 (101-104), 14 (106-108), 15 (110-120), 16 (122-127), 17 (129-134), 18 (136-138), 19 (140-143), 20 (145-150)","UNIFORMLY FINE-GRAINED, SPARSELY PHYRIC","GENERALLY UNJOINTED & UNVEINED BUT SMALL PIECE SIZE & COMMONLY INTENSE BROWN STAINING INDICATE THAT THEY ARE JOINT BLOCKS - THE PRESENT SURFACE OF WHICH WERE NEAR THE NATURAL BOUNDING JOINTS, THE FEW CRACKS OBSERVED ARE TIGHT & COMMONLY STAINED BY FE.OXIDE, THE FEW VEINS SEEN--ALL OF WHICH ARE THIN TO VERY THIN--ARE COMPOSED OF CARBONATE & GREEN OR YELLOW OR BROWN SMECTITE - THE CARBONATE IS A MIXTURE OF CALCITE & ARAGONITE IN SMALL VEIN REMNANTS AT 65CM DEPTH, CROSSFIBER VEINS OF BOTH SMECTITE (INTERVAL 1-33CM) & CARBONATE (INTERVAL 145-150CM) ARE PRESENT",,"DARK BROWNISH GRAY TO DARK GRAY, THE FRESHEST ROCKS WERE RECOVERED IN THE INTERVAL 110-127CM IN WHICH A HORIZONTAL BROWNISH ALTERATION ZONE INDICATES THAT THE TWO PIECES WERE SEPARATED BY A HORIZONTAL VEIN OR JOINT, AT 134CM A SURFACE COATED BY CONICAL CALCITE & MAGNESIAN CALCITE(?) CRYSTALS INDICATES AN OPEN JOINT--IT COINCIDES WITH ESPECIALLY INTENSE BROWN ALTERATION, STYROFOAM DIVIDERS EACH ABOUT 2CM WIDE SEPARATE PIECES OF CORE THAT ARE NOT PART OF A CONTINUOUS CORE SEGMENT - AN UNKNOWN AMOUNT OF BASALT IS MISSING IN THE PLACES WHERE THE STYROFOAM HAS BEEN ADDED",,"PLAG      0-1 comments : PHENOCRYSTS MOSTLY OR SOLELY PLAG, A 5MM LONG PLAGFROM INTERVAL 51-58CM IS AN70-71 (TSUBOI METHOD)",,FE.OXIDE | CALCITE | ARAGONIT | SMECTITE | CARB,,
34,319,A,2,2,0.0,107.50,109.00,  109.33,"BASS, M.",PLAG SPARSELY PHYRIC DIABASE,"PCE 1 (O-10), 2 (10-24), 3 (24-33)","FINE-GRAINED, AT BOTTOM OF PCE 3 THE GRAIN SIZE IS SMALLER THAN IN PCE 2, SPARSELY PHYRIC","ONE DISTINCTLY CROSS-FIBER GREEN SMECTITE VEIN AT 10-11CM IN PCE 2, PROMINENT STEEP VEINS WITH GENTLY DIPPING BRANCHES",,"STEEP VEINS ARE THE LOCI OF BROWNISH ALTERATION OF THE OTHERWISE GRAY ROCK, DIRECT CONTINUATION OF THE LOWER END OF SECTION 1",,PLAG      0.5      TO 2 comments : PHENOCRYSTS SMALLER & SPARSER THAN SEC 2-1,,SMECTITE,,
34,319,A,2,2,35.0,107.50,109.35,  109.40,"BASS, M.",PLAG SPARSELY PHYRIC DIABASESIMILAR TO PCES 1-3,PCE 4 (35-40),,ONE FLAT-LYING DARK GREEN SMECTITE VEIN ON LOWER SURFACE,comments: BROWNER & MORE ALTERED THAN PCES 1-3,,,,,SMECTITE,,
34,319,A,2,2,42.0,107.50,109.42,  109.49,"BASS, M.",PLAG SPARSELY PHYRIC DIABASESIMILAR TO PCE 4,PCE 5 (42-49),FINE-GRAINED,"GENTLY TO MODERATELY DIPPING TIGHT CRACK, NO VEINS",comments: ALTERED,,,PLAG comments : MINOR PLAG PHENOCRYSTS,,,,
34,319,A,2,2,51.0,107.50,109.51,  109.58,"BASS, M.",PLAG SPARSELY PHYRIC DIABASESIMILAR TO PCE 5,PCE 6 (51-58),SPARSELY PHYRIC,"TIGHT CRACK, NO PROMINENT VEINS",comments: EVEN MORE ALTERED THAN PCES 4&5,FE.OXIDE STAINING,,"PLAG               TO 5 comments : X' ON CLEAVAGE FLAKE= 1.565 +,AN70-71,PROBABLY NEAR-SURFACE PHENOS RATHER THANXENOCRYSTS OR DEEP-SEATED PHENOS WHICH AREMORE CALCIC THAN AN80 IN OCEANIC BASALTS",,FE.OXIDE,,
34,319,A,2,2,60.0,107.50,109.60,  109.64,"BASS, M.",APHYRIC DIABASESIMILAR TO PCE 6,PCE 7 (60-64),NO VISIBLE PHENOCRYSTS,NO JOINTS OR VEINS,"comments: SOMEWHAT FRESHER THAN PCE 6, HIGHLY ABRADED ON ALL SIDES",SHAPED LIKE HALF A BARREL,,,,,,
34,319,A,2,2,65.0,107.50,109.65,  109.70,"BASS, M.",APHYRIC BASALTSIMILAR TO PCE 7,PCE 8 (65-70),"POSSIBLY FINER-GRAINED THAN PCE 7 (COARSE-GRAINED BASALT RATHER THAN FINE-GRAINED DIABASE), PHENOCRYST ABSENT OR SPARSE","MINOR STEEP TO GENTLE CRACKS UNVEINED EXCEPT FOR VERY THIN SMECTITE FILMS, TOP SURFACE CONTAINS TWO LIGHT GRAY PATCHES OF A CALCITE & ARAGONITE VEIN",comments: BROWNER & MORE ALTERED THAN PCE 7,,,,,SMECTITE | CALCITE comments :  IN OILS CALCITE & ARAGONITE VEIN IS 5 DEGREES BUT VARIABLE WITH SMALL BUT FINITE 2V - STRAINED CALCITE OR INTERLAYERED CALCITE & ARAGONITE | ARAGONIT | CARB,,
34,319,A,2,2,73.0,107.50,109.73,  109.82,"BASS, M.",PLAG SPARSELY PHYRIC BASALTSIMILAR TO PCE 8,PCE 9 (73-82),"MAY BE SLIGHTLY COARSER THAN PCE 8, SPARSELY PHYRIC",,,,,PLAG        1,,,,
34,319,A,2,2,84.0,107.50,109.84,  109.85,"BASS, M.",BASALTSIMILAR TO PCE 9,PCE 10 (84-85),COARSER THAN PCE 9,,,APPARENTLY WE HAVE ENTERED SECOND COOLING UNIT WITH CONTACT SOMEWHERE NEAR PCES 7&8,,,,,,
34,319,A,2,2,88.0,107.50,109.88,  109.94,"BASS, M.",BASALTSIMILAR TO PCE 10,PCE 11 (88-94),,NO CRACKS OR VEINS,comments: SLIGHTLY FRESHER THAN PCE 10,,,,,,,
34,319,A,2,2,96.0,107.50,109.96,  109.99,"BASS, M.",BASALTSIMILAR TO PCE 11,PCE 12 (96-99),,,comments: SLIGHTLY MORE ALTERED THAN PCE 11,,,,,,,
34,319,A,2,2,101.0,107.50,110.01,  110.04,"BASS, M.",PLAG SPARSELY PHYRIC BASALTSIMILAR TO PCE 12,PCE 13 (101-104),SPARSELY PHYRIC,THREE JOINTS - ONE VERTICAL & 2 MODERATELY DIPPING - 2 HAVE REMNANTS OF YELLOW TO DARK BROWN SMECTITE VEINS,,,,PLAG     TO 1      TO 2,,SMECTITE,,
34,319,A,2,2,106.0,107.50,110.06,  110.08,"BASS, M.",BASALTSIMILAR TO PCE 13,PCE 14 (106-108),,,comments: CONSIDERABLY ALTERED TO A BROWN COLOR,SMALLER FRAGMENT THAN OTHERS,,,,,,
34,319,A,2,2,110.0,107.50,110.10,  110.20,"BASS, M.",DIABASEMASSIVE,PCE 15 (110-120),SAME GRAIN SIZE AS ABOVE (FINE-GRAINED DIABASE),"UNJOINTED, MASSIVE, UNVEINED",,FRESH & GRAY EXCEPT FOR TOP 1CM WHICH IS STRONGLY RUST-COLORED,,,,,,
34,319,A,2,2,122.0,107.50,110.22,  110.27,"BASS, M.",DIABASESIMILAR TO PCE 15,PCE 16 (122-127),,,,"GRAY & FRESH EXCEPT FOR BOTTOM 1CM WHICH IS STRONGLY RUST-COLORED, REMNANT OF LIGHT GREEN EARTHY FILM ON UPPER SURFACE - IT APPEARS TO BE A HIGHLY BIREFRINGENT FLAKY MINERAL",,,,,,
34,319,A,2,2,129.0,107.50,110.29,  110.34,"BASS, M.",DIABASE,PCE 17 (129-134),,,"comments: RUSTY, ALTERED","ON UPPER SURFACE ARE A LIGHT BROWN FILM OF CROSS- FIBER ARAGONITE & A SHEET COMPOSED OF RADIAL SPLAYS OF ARAGONITE, THE LOWER SURFACE HAS SPOTTY CLUSTERS OF CONICAL STRIATED CARBONATE CRYSTALS (COMPARE TO 319A-1-1 PCE12) - THEY INCLUDE CALCITE + SOME OTHER RHOMBOHEDRAL(?) CARBONATE WITH HIGHER REFRACTIVE INDICES THAN THOSE OF CALCITE (POSSIBLY MAGNESIAN CALCITE - IT IS NOT DOLOMITE)",,,,CARB | CALCITE | ARAGONIT,,
34,319,A,2,2,136.0,107.50,110.36,  110.38,"BASS, M.",DIABASESIMILAR TO PCE 17,PCE 18 (136-138),,,comments: HIGHLY ALTERED (BROWN),THIS IS A SMALL PIECE,,,,,,
34,319,A,2,2,140.0,107.50,110.40,  110.43,"BASS, M.",DIABASESIMILAR TO PCE 18,PCE 19 (140-143),,,comments: STRONG RUST COLOR,THIS IS A SMALL PIECE,,,,,,
34,319,A,2,2,145.0,107.50,110.45,  110.50,"BASS, M.",DIABASESIMILAR TO PCE 19,PCE 20 (145-150),STILL FINE-GRAINED,,comments: STRONGLY RUSTY ALONG TWO STEEP CRACKS--AT TOP OF SPECIMEN & ON ONE SIDE,THIN FILMS OF SMECTITE &/OR CROSS-FIBER CARBONATE IN THE CRACKS,,,,CARB | SMECTITE,,
