34,319,A,3,4,0.0,117.00,121.50,  123.00,"BASS, M.",PLAG SPARSELY PHYRIC DIABASE,"PCE 1 (14-32), 2 (35-41), 3 (43-58), 4 (60-76), 5 (79-96), 6 (96-110), 7 (113-130), 8 (132-148)","MEDIUM-GRAINED WITH PERHAPS A SLIGHT GRAIN SIZE DECREASE IN PCE 8 - THE MEDIUM-GRAINED DIABASE IS OPHITIC WHEREAS THE SOMEWHAT FINER-GRAINED ROCK TENDS MORE TOWARD INTERGRANULAR TEXTURE, OVOID RADIAL SPHERULITES",VEINS INCLUDE BLUE-GREEN & GREEN & BLACK SMECTITE (ALSO SOME BROWN SMECTITE IN THE GENTLY DIPPING VEIN AT 114-116CM) & ARAGONITE & POSSIBLY SOME MINOR CALCITE,FRESH THE ONLY SIGNIFICANT ALTERATION OCCURS IN THE BOTTOM 3CM & IN A 1CM-THICK ZONE ON EITHER SIDE OF THE VEIN AT 114-116CM - THE BROWN ALTERATION PENETRATES ONLY ABOUT HALF THE CORE - OUTSIDE THE ALTERED ZONE THE VEIN IS DARK GREEN SMECTITE & INSIDE IT IS PRISMATIC ARAGONITE PLUS DARK GREEN CARBONATE WITH MINOR BROWNISH ALTERATION & AT THE EDGE OF THE ZONE IT IS DARK BROWN SMECTITE: THIS LACK OF CORRESPONDENCE OF SMECTITE COLORS WITH HOST ROCK STAINING SUGGESTS THAT STAINING ADVANCED FASTER THAN OXIDATION OF SMECTITE - BOTH STAINING & THE LOCALLY INTENSE BROWN COLOR OF THE VEIN AT THE EDGE OF THE BROWN ALTERED ZONE MAY BE DUE TO HIGH SULFIDE CONCENTRATION IN THE VEIN PRIOR TO ALTERATION - THE RESTRICTION OF ARAGONITE TO THE PART OF THE VEIN IN THE STAINED ZONE OF THE HOST ROCK PROBABLY IS COINCIDENTAL,"GRAY EXCEPT WHERE ALTERED TO BROWN, APPARENTLY THE PIECES OF THIS CORE ARE ESSENTIALLY CONTINUOUS BUT FOR BREAKS WHERE FLAT TO GENTLY-DIPPING VEINS OR FRACTURES OCCUR - IN RELATIVELY FRESH ROCK THE REMNANTS OF THOSE VEINS & FRACTURES ARE BETTER PRESERVED ON THE TOPS OF THE CORE PIECES - EVIDENTLY THE LOOSE ROTATING OR JOSTLED UPPER PIECE IS MORE ABRADED, STYROFOAM DIVIDERS EACH ABOUT 2CM WIDE SEPARATE PIECES OF CORE THAT ARE NOT KNOWN TO BE PART OF A CONTINUOUS CORE SEGMENT - AN UNKNOWN AMOUNT OF BASALT IS MISSING FROM THE PLACES WHERE THE STYROFOAM HAS BEEN ADDED","           TRPCE 2     SMEC, ARAGONIT comments : VUGS ARE LINED BY BLUE-GREEN BOTRYOIDAL SMECTITE, HOLES IN PCE 4 LINED BY GREEN SMECTITE WITH THE INNER SURFACES COATED BY LIGHT BLUE FILMS, SOME HOLES ALSO CONTAIN ARAGONITE","PLAG      0-2  TO 5.5X3 comments : ABUNDANCE INCREASES FROM <0.5% IN PCES 1-3 TO 1%IN PCES 4-6 TO 2% IN PCES 7&8, THE 2% REPRESENTS ADEFINITE INCREASE ABOVE THE NORMAL RANGE OFFLUCTUATION OF PLAG PHENOCRYST ABUNDANCE WHICHRARELY EXCEEDS 1% - THIS PORTION APPEARS TO BEPART OF A CUMULATE ZONE IN THE SENSE OF ANINCREASED VOLUME PERCENTAGE OF PHENOCRYSTS BUTWITHOUT DEVELOPMENT OF CUMULUS TEXTURES | OLIVINE comments : IN HIGHER SECTIONS IN CORE 3 & IN THIS SECTION(DOWN TO ABOUT 110CM) OLIVINE PHENOCRYSTS--WHEREPRESENT--ARE PSEUDOMORPHED BY BLUE-GREEN SMECTITE,FROM 110-148CM (PCES 7&8) THEY ARE FRESH TOLARGELY FRESH & LIGHT BOTTLE GREEN IN COLOR EXCEPTIN THE 3CM ALTERED BROWN ZONE AT THE BOTTOM","COMBINE comments : CONTAINS WELL-DEVELOPED ""QUENCHED"" GROUNDMASS WITH ABUNDANT SKELETAL CRYSTALS OF PLAG & AMPHIBOLE(?) & APATITE(?) & ZEOLITE(?) & CARBONATE & PIGEONITE (?) & SUBCALCIC AUGITE IN AN EXTREMELY FINE- GRAINED SMECTITE BASE THAT MAY HAVE BEEN GLASS, CONTAINS BROWN OVOID SPHERULITES WITH MICROCRYSTALLINE RADIAL STRUCTURES - THE SPHERULITES ARE REMARKABLY LIKE THOSE PRODUCED BY QUENCHING AT THE BASES OF THE GLASSY SELVAGES OF SUBMARINE PILLOWS & MAY BE IDENTICAL TO THESE","CARB | CALCITE | ARAGONIT | AUGITE | SMECTITE               OLIVINE, GLASS",,
34,319,A,3,4,14.0,117.00,121.64,  121.82,"BASS, M.",DIABASE,PCE 1 (14-32),MEDIUM-GRAINED,UNJOINTED BUT TOP SURFACE IS A 15 DEGREE DIPPING JOINT WITH PARTIAL COAT OF BLUE-GREEN SMECTITE,FRESH,GRAY COLOR,,PLAG      0.5  TO 4X2.5,,SMECTITE,,
34,319,A,3,4,35.0,117.00,121.85,  121.91,"BASS, M.",DIABASE,PCE 2 (35-41),,UNJOINTED & UNVEINED BUT BOTTOM SURFACE IS PARTLY AN IRREGULAR JOINT COATED BY INTERLAYERED DARK GREEN & BLACK RESINOUS SMECTITE,FRESH,GRAY COLOR, comments : BOTRYOIDAL VUG COATED BY A LIGHT BLUE-GREEN FILM,,,SMECTITE,,
34,319,A,3,4,43.0,117.00,121.93,  122.08,"BASS, M.",DIABASESIMILAR TO PCE 2,PCE 3 (43-58),,UNJOINTED & UNVEINED EXCEPT FOR BLUE-GREEN FLAT- LYING SMECTITE PATCH ON TOP SURFACE,,,,PLAG       TR    TO 2X3,,SMECTITE,,
34,319,A,3,4,60.0,117.00,122.10,  122.26,"BASS, M.",DIABASESIMILAR TO PCE 3,PCE 4 (60-76),,NO JOINTS OR VEINS BUT TOP SURFACE IS PARTLY AN IRREGULAR SMECTITE-COATED JOINT WITH HOLES LINED BY BOTRYOIDAL DARK GREEN SMECTITE WHICH IS COATED BY LIGHT BLUE-GREEN FILMS & SOME CONTAIN RADIAL SPLAY OF COLORLESS ARAGONITE,comments: RARE RUST SPOTS ON THE ROCK MAY BE OXIDIZED PYRITE,,,PLAG        1    TO 5X2,,SMECTITE | ARAGONIT | PYRITE,,
34,319,A,3,4,79.0,117.00,122.29,  122.60,"BASS, M.",DIABASE,"PCE 5 (79-96), 6 (96-110)",,A CARBONATE VEIN OCCURS ABOUT 1-3MM ABOVE THE BASE OF THE ALTERED ZONE,FRESH FRESH EXCEPT FOR A GENTLY DIPPING 1CM BROWN ALTERED ZONE AT 93-95CM WHERE THE PIECES PARTED,GRAY COLOR,,"PLAG        1  TO 5.5X3 | OLIVINE comments : GREEN, AT BOTTOM OF PCE 6",,CARB | SMECTITE comments :  NO BLUE-GREEN PSEUDOMORPHS THOUGH THEY ARE PRESENT IN PCES 4&5 AND THE UPPER PART OF PCE 6,,
34,319,A,3,4,113.0,117.00,122.63,  122.80,"BASS, M.",PLAG SPARSELY PHYRIC DIABASESIMILAR TO PCES 5&6,PCE 7 (113-130),,CARBONATE & SMECTITE VEIN IN INTERVAL 114-116CM,comments: 1CM-THICK BROWN ALTERED ZONE AT 114-116CM WITH AN INTERMIXED CARBONATE & DARK BROWN & DARK GREEN SMECTITE VEIN - THE ALTERATION DOES NOT PENETRATE THE CORE BUT APPEARS AS BROWNISH DISCOLORATION AROUND THE VEIN - APPARENTLY THE BROWN COLOR OF THE SMECTITE IS NOT COEXTENSIVE WITH BROWN DISCOLORATION OF HOST ROCK & MAY DEPEND ON THE FORMER LOCAL PRESENCE OF ANOTHER MINERAL SUCH AS PYRITE (NO PYRITE SEEN) - THE CARBONATE IS COEXTENSIVE WITH THE BROWN DISCOLORATION OF THE HOST ROCK - INFERRED HISTORY IS FORMATION OF CRACK FOLLOWED BY INFLUX OF WATER & PRECIPITATION OF SMECTITE & ARAGONITE FOLLOWED BY INFLUX OF OXYGEN & CARBON DIOXIDE ALTERING SMECTITE & HOST ROCK (THESE MAY ALL BE PHASES OF SAME GENERAL DIAGENETIC ALTERATION PROCESS) - SKETCH OF CRACK ON SHIPBOARD FORM,,,"PLAG        2    TO 5X3 comments : COMMONLY HAVE INCLUSIONS IN CORE | OLIVINE  <0.5 comments : FRESH, MORE ABUNDANT THAN IN PCE 6",,SMECTITE comments :  RARE SMECTITE SPOTS ARE SEEN BUT ARE NOT OBVIOUSLY CONNECTED WITH OLIVINE | ARAGONIT,,
34,319,A,3,4,132.0,117.00,122.82,  122.98,"BASS, M.",PLAG SPARSELY PHYRIC DIABASESIMILAR TO PCE 7,PCE 8 (132-148),THIS & PCE 7 MAY REPRESENT A CUMULATE ZONE BUT NO CUMULUS TEXTURE,"NO VEINS OR JOINTS, GREEN SMECTITE ALONG CRACKS","comments: BOTTOM 3CM BROWN & ALTERED, IN THE ALTERED ZONE THE OLIVINE IS OXIDIZED RED & PLUCKS FROM THE SURFACE OF THE CORE LEAVING PITS",,,PLAG        2 comments : PLAG & OLIVINE PHENOCRYSTS ARE LOCALLY GLOMERATIC | OLIVINE 0.5-1 comments : OXIDIZED IN THE ALTERED ZONE,,SMECTITE,,
34,319,A,3,5,0.0,117.00,123.00,  124.03,"BASS, M.",PLAG-OLIVINE SPARSELY PHYRIC DIABASEBASALT,"PCE 1 (8-24), 2 (26-42), 3 (42-49), 4 (49-64), 5 (66-84), 6 (86-88), 7 (90-93), 8 (93-96), 9 (98-103)","GRADES FROM MEDIUM-GRAINED DIABASE IN 8-25CM TO FINE TO MEDIUM-GRAINED DIABASE IN 26-75CM, BELOW 75CM THERE IS A RAPID & MEGASCOPICALLY VISIBLE DECREASE TO FINE-GRAINED DIABASE & COARSE-GRAINED BASALT AT 84CM - COARSE-GRAINED BASALT CONTINUES WITH PROGRESSIVE DECREASE OF GRAIN SIZE TO MEDIUM-GRAINED BASALT IN 98-103CM, SUBOPHITIC TO INTERGRANULAR TEXTURE AT TOP OF SEC 5 TO INTERGRANULAR THROUGH MOST OF THE ROCK BELOW 40CM TO FINELY INTERGRANULAR TO QUENCHED (WHEAT SHEAF & PLUMOSE TEXTURES) IN 98-103CM",VEINS INCLUDE DARK GREEN & GRAY-GREEN & BROWN SMECTITE WITH CALCITE & SULFIDE & (IN INTERVAL 98-103CM) POSSIBLY GOETHITE,FRESH INTERVAL 8-25CM | FRESH TO MOD INTERVAL 26-75CM | MOD INTERVAL 75-103CM,"DARK GRAY & FRESH AT TOP - DARK GRAY & FRESH OR DARK BROWNISH GRAY & ALTERED IN 26-75CM - DARK BROWNISH GRAY & ALTERED BELOW 75CM, INTERVAL 98-103CM BASALT IS THE LOWEST PIECE OF CORE RECOVERED IN THE COOLING UNIT WHICH BEGAN IN SEC 2-1 & INCLUDES CORE 2 SECS 2&3 & CORE 3 SECS 1-4, STYROFOAM DIVIDERS EACH ABOUT 2CM WIDE SEPARATE PIECES OF CORE THAT ARE NOT KNOWN TO BE PART OF A CONTINUOUS CORE SEGMENT - AN UNKNOWN AMOUNT OF BASALT IS MISSING FROM THE PLACES WHERE THE STYROFOAM HAS BEEN ADDED",,"PLAG      1-2  TO 2.5X2 comments : TOTAL PHENOCRYST PERCENTAGES RANGE FROM 1-2% IN8-24CM (LOWER PART OF CUMULATE ZONE) TO ABOUT 1%FROM 25-103CM, AN 8X5MM PLAG (THE LARGEST SEEN)OCCURS AT 39CM & AN 8X3MM PLAG IS IN INTERVAL66-84CM BUT BELOW THAT THE LARGEST ONES ARE FROM2X1 TO 2.5X2MM - THE LARGE GRAINS PROBABLY SANKFROM ABOVE WHEREAS THE SMALLER ONES AT GREATERDEPTH EITHER WERE PRESENT AT THE TIME OF ERUPTIONOR GREW ONLY SLIGHTLY THEREAFTER | OLIVINE comments : FRESH AT TOP RAPIDLY GIVING WAY DOWNWARD TOSMECTITE PSEUDOMORPHS",,GOETHITE | CALCITE                OLIVINE comments :  NEAR LOWER CONTACT OF COOLING UNIT CALCITE IS A MINOR BUT INCREASINGLY ABUNDANT COMPONENT OF THE ALTERED OLIVINE (THIS APPEARS TO BE CHARACTERISTIC OF ALTERED OLIVINE IN THIN COOLING UNITS & NEAR THE CONTACTS OF THICKER UNITS) | SMECTITE               OLIVINE comments :  OLIVINE PHENOCRYSTS GIVE WAY DOWNWARD TO PSEUDOMORPHS WHICH ARE BLUE-GREEN SMECTITE IN 25-92CM BELOW WHICH THEY BECOME BROWNISH GREEN & FINALLY BROWN | SULFIDE,,
34,319,A,3,5,104.0,117.00,124.04,  124.14,"BASS, M.",BASALT,"PCE 10 (104-107), 11 (109-114)",GRAIN SIZE DECREASES DOWNWARD FROM COARSE-GRAINED INTERGRANULAR TO FINE-GRAINED VARIOLITIC,,,A SECOND COOLING UNIT IS DEFINED FROM 104-114CM ON THE BASIS OF GRAIN SIZE CHANGES - THE BOUNDARIES OF THIS UNIT ARE UNCERTAIN - IT PROBABLY REPRESENTS A PILLOW OR A THIN FLOW,,PLAG     <0.5 comments : MICROPHYRIC | OLIVINE comments : OLIVINES ARE PSEUDOMORPHED BY SMECTITE,,SMEC                   OLIVINE,,
34,319,A,3,5,116.0,117.00,124.16,  124.50,"BASS, M.",BASALT,"PCE 12 (116-120), 13 (122-124), 14 (126-131), 15 (133-142), 16 (143-147)","GRAIN SIZE VARIES FROM APHANITIC TO VERY FINE- GRAINED, COMMONLY PILOTAXITIC IN A VARIOLITIC GROUNDMASS",,,UPPERMOST PART OF INTERVAL COULD BELONG TO THE OVERLYING UNIT BUT IT IS HERE INTERPRETED AS THE TOP OF A UNIT WHICH CONTINUES IN CORES 4&5,"                       SMECTITE, CARB comments : COMPLETELY FILLED VESICLES CONTAIN SMECTITE & SOME CARBONATE (CALCITE OR MAGNESIUM CALCITE), SMECTITES ARE YELLOW & BROWN & RED NEAR THE TOP & GREEN DEEPER DOWN",PLAG             TO 2X2 | OLIVINE,,SMECTITE               OLIVINE comments :  YELLOW & RED-BROWN | CARB,,
34,319,A,3,5,8.0,117.00,123.08,  123.24,"BASS, M.",PLAG SPARSELY PHYRIC DIABASE,PCE 1 (8-24),MEDIUM-GRAINED,AT 13-14CM THERE IS A VERY GENTLY DIPPING (ALMOST FLAT) IRREGULAR ANASTOMOSING VERY THIN (0.1MM) VEIN OF DARK GREEN SMECTITE - EXCEPT ON ONE SURFACE OF THE CORE THE VEIN IS UNALTERED,"FRESH D UPPER 3CM, THIS BROWN ALTERED ZONE IS THE COUNTERPART OF THAT AT THE BOTTOM OF 319A-3-4 (PCE 8)","GRAY, UPPER 3CM IS BROWN, THIS & PCE 8 FROM 319A-3-4 ARE VERY MUCH ALIKE EXCEPT PERHAPS FOR SLIGHTLY FEWER PHENOCRYSTS IN PCE 1",,PLAG      1-2 | OLIVINE   0.5 comments : OLIVINE IS GREEN,,SMECTITE,,
34,319,A,3,5,26.0,117.00,123.26,  123.42,"BASS, M.",PLAG SPARSELY PHYRIC DIABASE,PCE 2 (26-42),FINE TO MEDIUM-GRAINED (PERHAPS SLIGHTLY FINER THAN ABOVE),"A CALCITE VEIN REMNANT IS PRESENT ON THE BOTTOM SURFACE & HAS ABOUT THE SAME 30 DEGREE DIP AS THE ALTERED ZONE, GREEN SMECTITE CRACKS IN THE OLIVINE, NO FRACTURES OR VEINS",FRESH D PARTIALLY ALTERED (BROWN) IN LOWER 3CM BELOW A BOUNDARY DIPPING ABOUT 30 DEGREES,,,"PLAG             TO 8X5 comments : SOMEWHAT LESS ABUNDANT THAN ABOVE, LARGEST PLAGYET SEEN IS 8X5MM & DISTINCTLY OVOID IN SHAPE &OCCURS AT 39CM | OLIVINE comments : PSEUDOMORPHED BY BLUE-GREEN SMECTITE IN THEALTERED ZONE",,SMECTITE               OLIVINE | CALCITE,,
34,319,A,3,5,42.0,117.00,123.42,  123.49,"BASS, M.",DIABASE,PCE 3 (42-49),,"CARBONATE VEIN ROUGHLY ALONG CENTER OF ALTERED ZONE & A MUCH THINNER SUBSIDIARY NON-PENETRATIVE ANASTOMOSING VEIN OF IRREGULAR TREND LIES ABOUT 1-3CM BELOW MAIN CARBONATE VEIN, THE MAIN VEIN IS INTERLAYERED WITH BROWN SMECTITE FILMS & ENCLOSES THIN LENSES OF HOST ROCK - IT FORMED IN AN OPEN TENSIONAL JOINT, BOTTOM OF PCE 3 CONTAINS REMNANTS OF AN ALMOST FLAT CARBONATE VEIN","comments: BROWN & ALTERED EXCEPT FOR A SMALL PART AT BOTTOM, THIS & THE BOTTOM OF PCE 2 & TOP OF PCE 4 ARE AN ALTERED ZONE ABOUT 9CM THICK DIPPING ABOUT 35 DEGREES, AS IS USUAL BROWN ALTERATION IN THIS FLOW OR SILL CORRELATES WITH CARBONATE VEINS",,,,,CARB | SMEC,,
34,319,A,3,5,49.0,117.00,123.49,  123.64,"BASS, M.",DIABASE,PCE 4 (49-64),"FINE-GRAINED, DISTINCTLY FINER THAN ABOVE",,FRESH BELOW MINOR BROWN ALTERED ZONE AT TOP (SEE PCE 3 DESCRIPTION),GRAY,,PLAG        1 comments : LESS THAN IN PCE 1 OF THIS SECTION | OLIVINE comments : A LITTLE OR NO FRESH OLIVINE EXCEPT PERHAPS AT THETOP - AT BOTTOM BLUE-GREEN PSEUDOMORPHS PROBABLYREPRESENT ALTERED OLIVINE,,,,
34,319,A,3,5,66.0,117.00,123.66,  123.84,"BASS, M.",DIABASESIMILAR TO PCE 4,PCE 5 (66-84),"NOTICABLY & PROGRESSIVELY FINER-GRAINED THAN PCE 4 FROM ABOUT 75CM DOWNWARD, AT BOTTOM IS A PORPHYRITIC COARSE OR MEDIUM-GRAINED BASALT",,,RELATIVELY CHILLED,,"PLAG      0.5    TO 8X3 comments : AT BOTTOM, GENERALLY MUCH LARGER THAN THE AVERAGEABOVE, APPARENTLY REPRESENTING SUNKEN LARGECRYSTALS, COMMONLY CONTAIN VISIBLE DARK INCLUSIONSIN THEIR CORES",OLIVINE,"SMECTITE           TO 3OLIVINE comments :  MESH-TEXTURED BLUE-GREEN SMECTITE PSEUDOMORPHS PROBABLY REPRESENT ALTERED ""CUMULATE"" OLIVINE FROZEN INTO THIS RELATIVELY CHILLED ROCK",,
34,319,A,3,5,86.0,117.00,123.86,  123.88,"BASS, M.",DIABASE,PCE 6 (86-88),FINE-GRAINED,,,SMALL FRESH TO ALTERED FRAGMENTS OF FINE-GRAINED DIABASE,,,,,,
34,319,A,3,5,90.0,117.00,123.90,  123.93,"BASS, M.",BASALT,PCE 7 (90-92.5),"COARSE-GRAINED, MESH-TEXTURED PSEUDOMORPHS",SCATTERED FINELY DRUSY YELLOW SULFIDE PATCHES ON UPPER SURFACE - APPARENTLY A FLAT-LYING VEIN,,"GRAY ABOVE & BROWN BELOW, THE RELATIONS BETWEEN PSEUDOMORPHS & PHENOCRYSTS SUGGEST THAT THE EMPTYING MAGMA HAD MORE OLIVINE THAN PLAG CRYSTALS & THAT THE LARGE CALCIC CRYSTALS IN THE OVERLYING DIABASE GREW AFTER EMPLACEMENT & SETTLED DOWNWARD TO SOME EXTENT (I.E. TIME-CUMULATE ZONE COMPOSED OF PHENOCRYSTS XTLLIZED AFTER ERUPTION)-NOT CONFIRMED BY T.S.)",,PLAG     <0.5    TO 2X1 | OLIVINE     1 comments : BLUE-GREEN SMECTITE PSEUDOMORPHS AFTER OLIVINE,,SMECTITE               OLIVINE | SULFIDE,,
34,319,A,3,5,93.0,117.00,123.93,  123.96,"BASS, M.",BASALT,PCE 8 (93-96),COARSE-GRAINED,,,BROWN & ALTERED,,"PLAG        1  TO 2.5X2 comments : ""OLIVINE"" & PLAG OFTEN GLOMERATIC | OLIVINE   0.5 comments : DARK BROWNISH GREEN PSEUDOMORPHS AFTER OLIVINE",,SMECTITE               OLIVINE,,
34,319,A,3,5,98.0,117.00,123.98,  124.03,"BASS, M.",BASALT,PCE 9 (98-103),MEDIUM TO COARSE-GRAINED,ONE IRREGULAR FRACTURE PARTLY COATED BY THIN EARTHY FILM OF GRAY-GREEN SMECTITE(?),,"ONE SURFACE IS WHOLLY COVERED BY DARK BROWN EARTHY MATERIAL (OXIDIZED SMECTITE?) + MINOR INTERLAYERED CALCITE - THIS IS A VEIN(?) ABOUT 0.5MM THICK - ITS STREAK IS OCHRA (YELLOW-BROWN) - GOETHITE?, SUBSPHERICAL, ORIENTATION UNCERTAIN, GREENISH GRAY COLOR",,PLAG        1       1X2 comments : 1% TOTAL PERCENTAGE OF FRESH PLAG + OLIVINE | OLIVINE comments : PSEUDOMORPHS AFTER OLIVINE,,SMECTITE               OLIVINE | CALCITE,,
34,319,A,3,5,104.0,117.00,124.04,  124.07,"BASS, M.",BASALT,PCE 10 (104-107),"MEDIUM TO COARSE-GRAINED, TEXTURE APPEARS TO BE VARIOLITIC ON ABRADED CORE SURFACE - THIS IS NOT SEEN IN PCE 9 WHICH IS EVEN FINER GRAINED THAN PCE 10",,,"PARTLY BROWNISH, BASE OF SILL OR FLOW BETWEEN PCES 9&10",,PLAG     <0.5 comments : GLOMEROCRYSTS OF PLAG + OLIVINE(?) | OLIVINE comments : PSEUDOMORPHS,,,,
34,319,A,3,5,109.0,117.00,124.09,  124.14,"BASS, M.",BASALT,PCE 11 (109-114),"VARIOLITIC, SOMEWHAT FINER-GRAINED THAN PCE 10",,,GRAY WITH GREENISH TINGE,,,,,,
34,319,A,3,5,116.0,117.00,124.16,  124.20,"BASS, M.",PLAG-OLIVINE MODERATELY MICROPHYRIC BASALT,PCE 12 (116-120),"APHANITIC TO VERY FINE-GRAINED, MICROPHYRIC, FINER THAN PCE 11, VERY FINELY VARIOLITIC",,,"DARK BROWNISH GRAY, COOLING UNIT BOUNDARY BETWEEN PCES 12&13 OR PCES 11&12","                       SMECTITE         ROUND comments : TINY AMYUGDULES ARE JUST LIKE OLIVINE EXCEPT FOR SHAPE, RARE VESICLES HAVE ONLY A DARK GREEN SMECTITE LINING",PLAG      2-3 comments : MICROPHENOCRYSTS MAINLY PLAG | OLIVINE comments : MINOR PSEUDOMORPHS AFTER OLIVINE ARE YELLOW - ORRED-BROWN WHERE OXIDIZED,,SMECTITE               OLIVINE,,
34,319,A,3,5,122.0,117.00,124.22,  124.24,"BASS, M.",PLAG-OL SPARSELY PHYRIC BASALTSIMILAR TO PCE 12,PCE 13 (122-124),"SPARSELY PHYRIC, PILOTAXITIC",ONE VERTICAL JOINT WITH DARK BROWN SURFACE COAT,comments: FRESHER THAN PCE 12,,      <1               HOLLOW comments : LINED WITH SMECTITE,PLAG      1-2 comments : PHENOCRYSTS SLIGHTLY LARGER THAN PCE 12 | OLIVINE,PLAG comments : LATHS VISIBLE ON ABRADED CORE SURFACE ARE NOT RANDOM BUT SUBPARALLEL--PILOTAXITIC WITH GENTLY DIPPING OR FLAT FLOW LINES,SMECTITE,,
34,319,A,3,5,126.0,117.00,124.26,  124.31,"BASS, M.",BASALTSAME AS PCE 13,PCE 14 (126-131),LOCALLY PILOTAXITIC,TWO VERTICAL JOINTS AT RIGHT ANGLES BOTH COATED BY YELLOW-GREEN SMECTITE & THIN REMNANTS OF CARBONATE VEINS (VERY FINE-GRAINED MAGNESIAN(?) CALCITE & POSSIBLY SOME ARAGONITE - BREAKS TO NEEDLES WITH PARALLEL EXTINCTION),,,"      <1               SMECTITE, HOLLOW comments : MAY BE FILLED WITH YELLOW SMECTITE OR HOLLOW EXCEPT FOR A THIN LINING",,,SMECTITE | CARB,,
34,319,A,3,5,133.0,117.00,124.33,  124.42,"BASS, M.",PLAG-OL PHYRIC BASALT,PCE 15 (133-142),"PORPHYRITIC, VARIOLITIC",TWO VERY STEEP JOINTS - ONE STAINED DARK BROWN & THE OTHER COATED BY LIGHT TAN WAXY SMECTITE,,DARK BROWN-GRAY,"      <1               SMECTITE, CARB comments : AMYGDULES HAVE SMECTITE LINING & FILLING OF EITHER DARK GREEN SMECTITE OR COLORLESS CARBONATE",PLAG      2-3     TO 2X2,,CARB | SMECTITE,,
34,319,A,3,5,143.0,117.00,124.43,  124.47,"BASS, M.",PLAG SPARSELY MICROPHYRIC BASALT,PCE 16 (143-147),"APHANITIC, MICROPHYRIC, PILOTAXITIC","VERY THIN STEEP TO VERTICAL VEINS ARE EITHER CARBONATE OR LIGHT BROWN SMECTITE, A MODERATELY DIPPING DISCONTINUOUS VEIN IS DARK GREEN SMECTITE & A SIMILAR GENTLY DIPPING HAIRLINE VEIN IS CARBONATE, THERE IS A SUGGESTION OF MANY INCIPIENT CRACKS",,DARK BROWNISH GRAY,"      <1               SMEC, CARB, EMPTY comments : VESICLES MAY BE HOLLOW WITH A DARK GREEN SMECTITE LINING ONLY OR FILLED OR PARTLY FILLED BY CARBONATE - THE HOLLOW ONES MAY HAVE BOTRYOIDAL SURFACE WITH LIGHT GRAY-GREEN COAT OR (WHERE CARBONATE IS PRESENT) A VUGGY INTERIOR WHERE THE FILLING IS NOT COMPLETE",PLAG        1    TO 2X1 comments : OFTEN GLOMERATIC,PLAG comments : LATHS IN GROUNDMASS MAY BE RANDOM OR SUBPARALLEL (PILOTAXITIC),CARB | SMECTITE,,
34,319,A,3,6,0.0,117.00,124.50,  126.00,"BASS, M.",PLAG-OL SPARSELY TO MODERATELY PHYRIC BASALT,"PCE 1 (10-27), 2 (28-49), 3 (51-63), 4 (63-65), 5 (67-71), 6 (73-77), 7 (79-84), 8 (86-93), 9 (95-99), 10 (101-109), 11 (111-116), 12 (119-130), 13 (129-143), 14 (143-149)","COARSENS SLOWLY BUT PROGRESSIVELY DOWNWARD FROM MEDIUM-GRAINED BASALT TO COARSE & VERY COARSE- GRAINED VARIOLITIC TO SUBOPHITIC BASALT & VERGES ON FINE-GRAINED SUBOPHITIC DIABASE IN THE LOWEST PARTS OF THE SECTION, SPARSELY TO MODERATELY PHYRIC",VEINS INCLUDE BLEND OF BROWN & YELLOW & GREEN & RED & BLUE SMECTITE & CARBONATE - THE VARIOUS SMECTITE COLORS OCCUR ERRATICALLY WITH DEPTH--VARYING WITH THE LOCAL FRESHNESS OF THE HOST ROCK - WHERE VEIN CARBONATE WAS IDENTIFIED IN OILS IT WAS ALWAYS CALCITE,,"SECTION BELONGS ENTIRELY TO THE COOLING UNIT--THE TOP OF WHICH WAS PENETRATED IN THE LOWER PART OF SEC 3-5, FROM 10-65CM & 117-149CM THE ROCKS ARE MIXTURES OF FRESH DARK GRAY & ALTERED DARK BROWNISH GRAY ROCKS DISTRIBUTED IN A MANNER WHICH INDICATED THAT THEY ARE PIECES OF BLOCKS BOUNDED BY WIDELY SPACED JOINTS - CORE RECOVERY IN THESE INTERVALS WAS GOOD & IN LARGE INTACT PIECES, IN THE INTERVAL 65-117CM THE UNIFORMLY BROWN & ALTERED PIECES ARE SMALL & RECOVERY PROBABLY POOR, STYROFOAM SPACERS EACH ABOUT 2CM WIDE SEPARATE PIECES OF CORE THAT ARE NOT KNOWN TO BE PART OF A CONTINUOUS CORE SEGMENT: AN UNKNOWN AMOUNT OF BASALT IS MISSING FROM THE PLACES WHERE THE STYROFOAM HAS BEEN ADDED","                       SMECTITE         ROUND comments : VESICLES SOMETIMES FILLED WITH GREEN SMECTITE - PARTICULARLY IN PCES 1&2&11 |     TO 8     PCES 7&8  FE.OX, SMEC, CALC comments : IRREGULAR HOLES LINED BY FE.OXIDE & TAN TO BROWN SMECTITE & CALCITE","PLAG    0.5-4    TO 6X5 comments : PLAG & OLIVINE PHENOCRYSTS FORM UNIFORMLY ABOUT 1%AT 10-130CM EXCEPT IN INTERVAL 95-99CM WITH ABOUT2% & 101-116CM WITH 0.5% OR FEWER, INTERVAL130-149CM CONTAINS ABOUT 3-4% PHENOS & APPEARS TOBE A CUMULATE ZONE & MAY BE COMPLEMENTARY TO THEDEPLETED INTERVAL FROM 101-116CM, THE MAXIMUM SIZERANGES FROM 2X1.5 TO 5X3MM IN INTERVAL 10-130CM &UP TO 6X5MM IN THE CUMULATE ZONE | OLIVINE comments : OLIVINE COMMONLY REPLACED BY BLUE-GREEN OR DARKGREEN SMECTITE WITH CARBONATE IN SOME CASES",,SMECTITE               OLIVINE | CARB                   OLIVINE | FE.OXIDE | CALCITE,,
34,319,A,3,6,10.0,117.00,124.60,  124.77,"BASS, M.",PLAG SPARSELY PHYRIC BASALT,PCE 1 (10-27),"MEDIUM-GRAINED, PORPHYRITIC, DISTINCTLY COARSER THAN LOWER PART OF SEC 5 - PROBABLY THE INTERIOR OF A THIN FLOW OR PILLOW","GENTLE TO VERTICAL NON-PENETRATIVE CRACKS, ONE 65 DEGREE DIPPING JOINT IN LOWER PART FILLED WITH DARK RED-BROWN SMECTITE & A THIN CARBONATE VEIN",,"GRAY-BROWNISH GRAY (FRESH-ALTERED) BOUNDARY IS STEEP (ALMOST VERTICAL), COLOR IS DARK GRAY TO DARK BROWNISH GRAY, PROBABLY THE INTERIOR OF A THIN FLOW OR PILLOW",      <1               SMECTITE comments : AMYGDULES OF DARK GREEN SMECTITE,PLAG        1    TO 5X3, comments : LATHS IN GROUNDMASS ARE RANDOM & PROBABLY VARIOLITIC,SMECTITE | CARB,,
34,319,A,3,6,28.0,117.00,124.78,  124.99,"BASS, M.",PLAG SPARSELY PHYRIC BASALT,PCE 2 (28-49),"COARSE-GRAINED, PORPHYRITIC, VARIOLITIC, SLIGHTLY COARSER THAN PCE 1","NON-PENETRATIVE FLAT CRACK WITH VERY THIN CARBONATE VEIN (0.1MM THICK) ABOUT 5CM BELOW TOP, ONE STEEPLY DIPPING NON-PENETRATIVE CRACK",,GRAY-BROWNISH GRAY BOUNDARY IS ALMOST FLAT IN UPPER PART TO VERTICAL IN LOWER THREE-FOURTHS OF PCE 2,    <0.5   TR                           ROUND comments : VESICLES & DARK GREEN AMYGDULES,PLAG        1    TO 3X3,,SMECTITE               OLIVINE comments :  BLUE-GREEN PATCHES OF SMECTITE MAY BE CAVITY FILLINGS OR POSSIBLY PSEUDOMORPHS AFTER OLIVINE | CARB,,
34,319,A,3,6,51.0,117.00,125.01,  125.15,"BASS, M.",BASALTSIMILAR TO PCE 2,"PCE 3 (51-63), 4 (63-65)",SLIGHTLY FEWER PHENOCRYSTS THAN PCE 2,STEEP TO MODERATELY DIPPING VEINS OF CARBONATE OR BROWN SMECTITE OR BOTH INTERLAYERED - VARIES ALONG LENGTH OF SAME VEIN,,,,,,CARB | SMECTITE,,
34,319,A,3,6,67.0,117.00,125.17,  125.21,"BASS, M.",BASALT,PCE 5 (67-71),"SAME OR VERY SLIGHTLY COARSER THAN ABOVE, VARIOLITIC, FEWER & SMALLER PHENOCRYSTS THAN ABOVE",NON-PENETRATIVE FLAT CRACKS NEAR OR INTERSECTING UPPER & LOWER SURFACES,comments: ENTIRE PIECE IS BROWNISH WITH ALTERATION,COLOR IS DARK GRAY,,PLAG             TO 2X2,,,,
34,319,A,3,6,73.0,117.00,125.23,  125.27,"BASS, M.",BASALT,PCE 6 (73-77),"COARSE-GRAINED, VARIOLITIC",STEEP IRREGULAR NON-PENETRATIVE CRACKS LINED BY CALCITE & SMECTITE,comments: ENTIRE SPECIMEN IS BROWNISH & ALTERED,DARK BROWNISH GRAY,,PLAG       TR    TO 4X2,,SMECTITE | CALCITE,,
34,319,A,3,6,79.0,117.00,125.29,  125.34,"BASS, M.",PLAG SPARSELY PHYRIC BASALT,PCE 7 (79-84),"VARIOLITIC, PORPHYRITIC, LIKE PCE 6 OR SLIGHTLY COARSER",TOP SURFACE IS A CREAM OR TAN VEIN DIPPING 20 DEGREES (VERY FINE-GRAINED MICROCRYSTALLINE CALCITE OR MAGNESIAN CALCITE),,"DARK BROWN-GRAY, IRREGULAR HOLES UP TO 8MM IN MAXIMUM DIMENSION - NOT CLEAR IF THEY ARE DIKTYTAXITIC OR ALTERATION EFFECTS - SOME STAINED RED OR LINED WITH LIGHT TAN SMECTITE BUT MOST COMMONLY THEY ARE COATED BY DRUSY EQUANT CARBONATE (COLORLESS OR LIGHT GRAY OR FE-STAINED) - THEY ARE COARSE CALCITE",,PLAG        1,,SMECTITE | CALCITE,,
34,319,A,3,6,86.0,117.00,125.36,  125.43,"BASS, M.",BASALTSIMILAR TO PCE 7,PCE 8 (86-93),,,,"IRREGULAR HOLES FILLED WITH FINELY DRUSY ALMOST BOTRYOIDAL CALCITE OR LIGHT BROWN SMECTITE OR DRUSY CALCITE, ONE MASS OF DEEP RED SMECTITE & ANOTHER OF DARK GREEN SMECTITE OXIDIZED PERIPHERALLY TO A BROWN COLOR - THEIR ORIGIN UNCLEAR--THE DARK GREEN MAY BE PART OF A VEIN",,,,CALCITE | SMECTITE,,
34,319,A,3,6,95.0,117.00,125.45,  125.49,"BASS, M.",PLAG SPARSELY PHYRIC BASALT,PCE 9 (95-99),"COARSE-GRAINED, VARIOLITIC","ONE 45-DEGREE JOINT WITH DARK YELLOWISH GREEN SMECTITE ""STAIN""",,DARK BROWNISH GRAY,,PLAG        2  TO 2X1.5,,SMECTITE,,
34,319,A,3,6,101.0,117.00,125.51,  125.59,"BASS, M.",BASALTSIMILAR TO PCE 9,PCE 10 (101-109),FEWER PHENOCRYSTS THAN PCE 9,45-DEGREE JOINT COATED WITH GREENISH YELLOW & RED- BROWN SMECTITE PLUS A CARBONATE VEIN,comments: ALTERED BROWN ASPECT OVERALL,CONTAINS HOLES OR PLUCKED CRYSTALS,,PLAG     <0.5    TO 5X2,,SMECTITE | CARB,,
34,319,A,3,6,111.0,117.00,125.61,  125.66,"BASS, M.",BASALT,PCE 11 (111-116),"SLIGHTLY COARSER-GRAINED THAN ABOVE, STILL APPARENTLY VARIOLITIC","MODERATELY DIPPING CARBONATE VEIN ON UPPER SURFACE, ALMOST VERTICAL CARBONATE VEIN ON SIDE OF LOWER PART --THE BROWN ALTERED PARTS OF THIS PIECE SEEM TO BE RELATED TO THAT VEIN",comments: BOTTOM IS VERY FRESH,"THE FRESHNESS & COLORS ARE LIKE THOSE OF THE THICK UNIT HIGHER IN THIS CORE, GRAY WITH ALTERED BROWN ASPECT",,PLAG      0.5    TO 3X2,OLIVINE comments : BOTTOM CONTAINS SMECTITE PSEUDOMORPHS AFTER OLIVINE OR GROUNDMASS - HIGHER IN SECTION 6 & THE LOWER PART OF SECTION 5 THESE APPEARED AS DEEP RED-BROWN PSEUDOMORPHS DUE TO ALTERATION,SMECTITE               OLIVINE | CARB,,
