26,250,A,22,1,0.0,150.0,691.00,691.00,692.50,, ZEOLITE RICH CLAY," 5YR4/4-MODERATE BROWN,-BLACK", BLEBS AT 85 CM AND 120 CM,, BLACK NODULES AT 85 AND 121 CM, ZEOLITE THROUGHOUT,, VOID 0 TO 70 CM, SEM I LITHIFIED THROUGHOUT, 33211000.3350
26,250,A,22,2,0.0,150.0,691.00,692.50,694.00,, RED CLAY," 5YR4/4-MODERATE BROWN,-N2-BLACK"," BLACK LAMINATED AREAS AT 105 CM,BLACK SPECKS THROUGHOUT S ECTION PARALLEL TO BEDDING AT 105 CM,IRON MANGANESE? RICH LAYER AT 105 TO 109 CM",,, ZEOLITE,, VOID FROM 0 TO 3 CM, SEMI LITHIFIED THROUGHOUT, 00000000
26,250,A,22,3,0.0,150.0,691.00,694.00,695.50,, NANNO AND ZEOLITE BEARING CLAY," 5YR4/4-MODERATE B ROWN,5YR3/4-MODERATE BROWN,-N2-BLACK"," BLACK LAMINAE ,HORIZONTAL BURROWS LESS THAN 3 MM IN DIAMETER COMMO N THROUGHOUT,SCATTERED BLACK SPECKS THROUGHTOU",,,,,, SEM I LITHIFIED, 00000000
26,250,A,22,4,0.0,150.0,691.00,695.50,697.00,, NANNO AND ZEOLITE BEARING CLAY," 5YR4/4-MODERATE B ROWN TO 5YR3/4,-WHITE"," BURROWING STRUCTURES PARALLE L TO BEDDING THROUGHOUT,WHITE ZEOLITE SPECKS THROUGH OUT,MANGANESE MINERALIZATION? AT 75 CM AND 107 CM AN D 118 CM,3 MM CHERT AT 36 MM,NODULES AND LAMINAE", B RECCIA AT 15 CM,,,,, SEMI LITHIFIED, 00000000
26,250,A,22,CC,,,691.00,697.10,697.10,, NANNO AND ZEOLITE BEARING CLAY,,,,,,,, FIRM, 00000000
26,250,A,23,1,0.0,150.0,699.50,699.50,701.00,, CLAY," 5YR5/2-PALE BROWN,5Y2/1-BROWNISH BLACK,5Y6/ 2-LIGHT OLIVE GRAY,-BLACK,10YR6/2-PALE YELLOWISH BRO WN"," VERY LITTLE OBVIOUS LAMINATION OR BORING,COLOR BOUNDARIES CROSS THE LAMINATION OR BEDDING AT 50 TO 55 CM,OLIVE GRAY WITH BLACK LAMINAE AT 100 TO 105 CM ,SILTY INTERVAL? AT 100 TO 105 CM,CONTACTS FAIRLY SH ARP,SOME DIFFUSE LAMINAE OF LIGHT OLIVE GRAY"," DRILL ING BRECCIA 20 TO 35 CM AND AT 75 CM AND 85 CM AND 9 5 CM AND 105 CM,DRILLING BRECCIA MUD AT 30 TO 35 CM",,,," LITHS PERHAPS A LITTLE SILTY,VOID FROM 0 TO 20 CM", SEMI LITHIFIED, 00000000
26,250,A,23,2,0.0,150.0,699.50,701.00,702.50,, ZEOLITE RICH CLAY," 5YR5/2-PALE BROWN,5Y6/2-OLIVE GRAY,10YR7/6-YELLOWISH ORANGE,-N2.5,10YR5/4-MODERATE YELLOWISH BROWN,5YR4/4-MODERATE BROWN,-N2"," MINOR H ORIZONTAL BURROWING IRREGULAR DISTRIBUTION ON SEVERA L HORIZONS,N2.5 LAMINAE AND SPOTS AT 55 TO 60 CM,MUC H DARK (N2) DISCOLORATION WITH DISCRETE SPECKS AND L AMINAE AND DIFFUSE PATCHES,OLIVE GRAY LAYER AT 20 CM", BRECCIA AT 10 CM AND 90 CM AND 115 CM,,,,, SEMI LITH IFIED, 00000000
26,250,A,24,1,0.0,150.0,709.00,709.00,710.50,, CLAY," 5GY4/1-DARK GREENISH GRAY,5Y4/1-OLIVE GRAY, 5Y5/2-LIGHT OLIVE GRAY,5YR5/4-LIGHT MODERATE BROWN,5 3Y2/1-GREENISH BLACK", UNIDENTIFIED STRUCTURES AT 80 TO 100 CM,,,,, VOID FROM 0 TO 80 CM," SEMILITHIFIED 0- 97 CM, SOFT TO STIFF 97-150 CM", 33211000
26,250,A,24,2,0.0,150.0,709.00,710.50,712.00,, CLAY," 5Y4/2-OLIVE GRAY,5YR8/1"," SMALL? BURROWS TH ROUGHOUT BOTH LIGHTER AND DARKER THAN HOST ROCK,VERY LITTLE LAMINATION,VIRTUALLY MASSIVE IN MUCH OF SECT ION", BRECCIA 5 TO 10 CM AND 20 TO 30 CM AND 50 TO 6 5 CM AND 100 CM AND 120 TO 130 CM AND AT 140 CM,,,, VO ID FROM 0 TO 5 CM, SEMI CONSOLIDATED AND STIFF EXCE PT FOR BRECCIA, 33211000
26,250,A,25,1,0.0,60.0,718.50,718.50,719.10,, CLAY, 10YR4/2-DARK YELLOWISH BROWN," MUCH FRAGMEN TED,FEATURELESS",,,,,, SEMI LITHIFIED, 33211000
26,250,A,25,1,60.0,150.0,718.50,719.10,720.00,, COARSE SUBOPHITIC OLIVINE BASALT, 5Y2/1-OLIVE BLA CK," BRECCIATED AND VEINED WITH CALCITE AND GREEN MI NERAL,ZENOLITH?FROM 85 TO 115 CM,DEVITRIFIED WEEKENE D GLASSY BASALT OLIVINE AT 110 CM",,,,," WEATHERED APPEAR ANCE THROUGHOUT,VOID 140 TO 150 CM,ZENOLITH OF SPOTT ED HORNFELSIC APPEARANCE",, 00000000
26,250,A,25,2,0.0,150.0,718.50,720.00,721.50,, CLAY," 10YR4/2,-GREEN"," WEATHERED APPEARANCE THROU GHOUT,VEINED WITH GREEN PREHNITE THROUGHOUT UP TO .5 CM WIDE TEND TO BE PARALLEL TO ASSUMED BEDDING,CALC ITE VEINS UP TO .5 CM WIDE,CALCITE IN BRECCIATED ZON ES UP TO 2 CM ACROSS",," MUDSTONE CHIP AT 90 TO 102 CM ,GREEN CLAY AT 124 CM"," PREHNITE,CALCITE",," BASALT,CO RE VOID FROM 145 TO 150 CM", FIRM, 33211000
26,250,A,25,3,0.0,150.0,718.50,721.50,723.00,, BASALT,, LESS PREHNITE VEINING,,,,, WEATHERED APPEARA NCE THROUGHOUT,, 00000000
26,250,A,26,1,0.0,150.0,729.00,729.00,730.50,, BASALT, 5Y6/1-LIGHT OLIVE GRAY, FRACTURED AND VE INED,,,,," VOID 30 TO 150 CM,WEATHERED",, 00000000
26,250,A,26,2,0.0,150.0,729.00,730.50,732.00,, BASALT,,,,,,, INCREASE IN GRAIN SIZE WITH RESPECT TO CO RE 25,, 00000000
26,250,A,26,3,0.0,150.0,729.00,732.00,733.50,, BASALT,," PREHNITE AND CALCITE VEINING BUT LESS THA N IN CORE 25,CONTACT BASALT TO BASALT? AT 90 CM,INFI LLED VESSICLES WITH CALCITE AT 90 TO 120 CM AND 135 TO 150 CM",,,,," ALTERNATING FRESH AND WEATHERED,WEATHERI NG FOLLOWS CALCITE VEINS,WEATHERED AT 90 TO 120 CM, FRESH FROM 120 TO 150 CM",, 00000000
26,250,A,26,4,0.0,150.0,729.00,733.50,735.00,, BASALT," 5Y6/1-LIGHT OLIVE GRAY,-N4.5"," ABUNDANT C ALCITE VESSICLES FROM 0 TO 75 CM,PREHNITE VEINING LE SS OBVIOUS",,,,," WEATHERED ABOVE 100 CM,FRESH BELOW 100 CM IS OF N4.5",, 00000000
26,250,A,26,5,0.0,150.0,729.00,735.00,736.50,, BASALT, -N4.5, VERY LITTLE PREHNITE VEINING,,,,, PA RTICULARLY FRESH,, 00000000
26,250,A,26,6,0.0,150.0,729.00,736.50,738.00,, OLIVINE BASALT,, VERY LITTLE APPARENT PREHNITE VEI NING,,, SERPENTINE (CHRYSOTILE?) AND CALCITE AT 110 C M,," OVERALL INCREASE IN GRAIN SIZE THROUGHOUT WHOLE BASALT SECTION 46 TO 59 CM,PARTICULARLY FRESH",, 00000000
