42,372,,40,3,0.0,150.0,720.00,723.00,724.50,, VOLCANIC MUDSTONE, 10Y4/2-GRAYISH OLIVE TO 5GY4/1 -DARK GREENISH GRAY, FAINTLY MOTTLED BY COMPACTED B URROWS, NONE,,,,, HARD, 00000000,b03bc4a0db6b4d49c052cd4592acadf3,42-372-40-3
42,372,,40,4,0.0,150.0,720.00,724.50,726.00,, VOLCANIC MUDSTONE, 10Y4/2-GRAYISH OLIVE TO 5G4/1- DARK GREENISH GRAY, FAINTLY MOTTLED BY INTENSE BURR OWING, NONE,,,," BURROWS COMPACTED,GEOCHEMICAL SAMPLE 140-150 CM", HARD, 00000000,1899c8c620580bf26d4995ce3e3db5d2,42-372-40-4
42,372,,40,5,0.0,150.0,720.00,726.00,727.50,, VOLCANIC MUDSTONE, 10Y4/2-GRAYISH OLIVE TO 5GY4/1 -DARK GREENISH GRAY,," NONE 0-101 CM,BROKEN UP BY DRI LLING INTO FRAGMENTS WITH PARALLEL BEDDING 101-150 C M",,,,, HARD, 00000000,f258e1b8df42ac47a34cfef79d6c7da2,42-372-40-5
42,372,,40,6,0.0,150.0,720.00,727.50,729.00,, VOLCANIC MUDSTONE, 10Y4/2-GRAYISH OLIVE TO 5GY4/1 -DARK GREENISH GRAY, FAINT MOTTLING BY BURROWING," BROKEN INTO FRAGMENTS WITH PARALLEL BEDDING NO OTHER DISTURBANCE 0-86 CM,BRECCIATED BY DRILLING 86-127 C M",,,, BURROWS COMPACTED, HARD, 00000000,6ae8fd1160bef2e9a1f954082ec581ff,42-372-40-6
42,372,,41,0,0.0,29.0,758.00,758.00,758.29,, VOLCANIC MUDSTONE, 5Y3/2-OLIVE GRAY TO 5GY3/2-GRA YISH OLIVE GREEN, MOTTLED BY BURROWING, NONE,,,, BUR ROWS COMPACTED, HARD, 00000000,e4276e849457a1803ce90f6a93d23d86,42-372-41-0
42,372,,41,1,0.0,150.0,758.00,758.29,759.79,, VOLCANIC MUDSTONE, 10Y4/2-GRAYISH OLIVE TO 5Y3/2- DARK OLIVE GRAY, VERY FAINTLY MOTTLED BY BURROWING, NONE, AMORPHOUS FE MN HYDROXIDE 4.5-5 CM, FE MN HYDROXIDE,, BURROW S COMPACTED, HARD, 00000000,b57b49f43822ac7c977a86b94090d9ad,42-372-41-1
42,372,,41,2,0.0,150.0,758.00,759.79,761.29,, VOLCANIC MUDSTONE, 10Y4/2-GRAYISH OLIVE TO 5Y3/2- OLIVE GRAY, FAINTLY MOTTLED BY BURROWS, NONE,,,, BUR ROWS COMPACTED, HARD, 00000000,27b835ee4e1e5b1f26c7d701073bcc50,42-372-41-2
42,372,,41,3,0.0,150.0,758.00,761.29,762.79,, VOLCANIC MUDSTONE, 5GY4/1-DARK GREENISH GRAY TO 1 0Y4/2-GRAYISH OLIVE, FAINTLY MOTTLED BY BURROWING, NONE EXCEPT BRECCIATED 85-117 CM,,,, BURROWS COMPACTE D, HARD, 00000000,f46d0357ffa746c1322fff41f38f19fe,42-372-41-3
42,372,,41,4,0.0,150.0,758.00,762.79,764.29,, VOLCANIC MUDSTONE, 10Y4/2-GRAYISH OLIVE TO 5Y3/2- OLIVE GRAY, VERY FAINTLY MOTTLED, NONE,,, SHELLS," COMPACTED BURROWS,POSSIBLE MINUTE SHELLS 144 CM", HA RD, 00000000,17eccfaee024d6b2a8e923e30d4ebef7,42-372-41-4
42,372,,41,5,0.0,150.0,758.00,764.29,765.79,, VOLCANIC MUDSTONE, 5GY4/1-DARK GREENISH GRAY, VE RY FAINTLY MOTTLED," BRECCIATED 126-133 CM AND 94.5- 95.5 CM,NONE 0-94.5 CM 95.5-126 CM AND 133-151 CM",,,,, HARD, 00000000,a36c06c03a5be3ac9af969f1b861debe,42-372-41-5
42,372,,41,6,0.0,150.0,758.00,765.79,767.29,, VOLCANIC MUDSTONE, 10Y4/2-GRAYISH OLIVE TO 5GY4/1 -DARK GREENISH GRAY, FAINTLY MOTTLED," NONE 0-145 C M,BRECCIATED BY DRILLING 145-150 CM",,,, COMPACTED BURR OWS, HARD, 00000000,0dce794d723b0d3bc89d0d3d067f9026,42-372-41-6
42,372,,42,0,0.0,36.0,786.50,786.50,786.86,, VOLCANIC MUDSTONE, 5Y4/1-OLIVE GRAY, FAINTLY MOT TLED BY INTENSE BURROWING, NONE,,,, BURROWS COMPACTED, HARD, 12231110.3450,a6a0fffb5ec50cacaf4f8e821ecbd37f,42-372-42-0
42,372,,42,1,0.0,150.0,786.50,786.86,788.36,, VOLCANIC MUDSTONE, 10Y4/2-GRAYISH OLIVE TO 5Y3/2- OLIVE GRAY, VERY FAINT MOTTLING, NONE,,,, BURROWS CO MPACTED, HARD, 00000000,ceef62c8fed3ba5ca02e43e8417dbbd4,42-372-42-1
42,372,,42,2,0.0,150.0,786.50,788.36,789.86,, VOLCANIC MUDSTONE, 10Y4/2-GRAYISH OLIVE TO 5GY4/1 -DARK GREENISH GRAY," VERY FAINT MOTTLING,INTENSELY BURROWED 20 CM,LAYER OF ZOOPHYCUS 88-92 CM ZOOPHYCUS"," NONE 0- 107 CM AND 108-150 CM,SOMEWHAT BROKEN BY DRILLING 10 7-108 CM",,,, COMPACTED BURROWS, HARD, 00000000,12bc3bf66594ddb79b0c2f92b8d47bc3,42-372-42-2
42,372,,42,3,0.0,150.0,786.50,789.86,791.36,, VOLCANIC MUDSTONE," 10Y4/2-GRAYISH OLIVE,10Y4/2-OL IVE GRAY", FAINT MOTTLING, NONE,,,, COMPACTED BURROWS, HARD, 00000000,3ed064cda85ac60afeb986a8d5ac5b87,42-372-42-3
42,372,,42,4,0.0,150.0,786.50,791.36,792.86,, VOLCANIC MUDSTONE, 5GY4/1-DARK GREENISH GRAY TO 1 0Y4/2-GRAYISH OLIVE, VERY FAINT MOTTLING, NONE,,,, C OMPACTED BURROWS, HARD, 00000000,1d7afaeae3899c1125283cbb75e88d44,42-372-42-4
42,372,,42,5,0.0,150.0,786.50,792.86,794.36,, VOLCANIC MUDSTONE, 5GY4/1-DARK GREENISH GRAY TO 1 0Y4/2-GRAYISH OLIVE, FAINT MOTTLING FROM BURROWS, BRECCIATED 9-14 CM AND NONE 81.5-83.5 CM,,,," BURROWS C OMPACTED,GEOCHEMICAL SAMPLE 135-150 CM", HARD, 00000000,9c17b52d1a91048439988f0986c631e0,42-372-42-5
42,372,,42,6,0.0,150.0,786.50,794.36,795.86,, VOLCANIC MUDSTONE, 5GY4/1-DARK GREENISH GRAY TO 1 0Y4/2-GRAYISH OLIVE, VERY FAINT MOTTLING, NONE EXC EPT BRECCIATED BY DRILLING 119-125 CM, DARK MN STAI N 78 CM,,," DARK SPECKS 19 CM,COMPACTED BURROWS", HARD, 00000000,998c998340a5664012cedd154a1c5e2e,42-372-42-6
42,372,,43,1,144.0,150.0,796.00,797.44,797.50,, VOLCANIC MUDSTONE, 5GY4/1-DARK GREENISH GRAY,, NO NE,,,,, HARD, 00000000,71bf1dd0f17d15073083692349189862,42-372-43-1
42,372,,43,2,0.0,150.0,796.00,797.50,799.00,, VOLCANIC MUDSTONE, 5GY4/1-DARK GREENISH GRAY, VE RY FAINT MOTTLING," NONE,BROKEN BY DRILLING 107-117 CM",,,, COMPACTED BURROWS, HARD, 00000000,6766f64119601220a213a86caf2bf292,42-372-43-2
42,372,,43,3,0.0,150.0,796.00,799.00,800.50,, VOLCANIC MUDSTONE, 10Y4/2-GRAYISH OLIVE TO 5GY4/1 -DARK GREENISH GRAY, OBIQUE FRACTURE 30 DEGR EES INCLINED AT 120-135 CM, NONE,,,,, HARD, 00000000,6145d801135d87754eaf0d9146eedd92,42-372-43-3
42,372,,43,4,0.0,150.0,796.00,800.50,802.00,, VOLCANIC MUDSTONE," 5GY4/1-DARK GREENISH GRAY,10Y4 /2-GRAYISH OLIVE"," OBLIQUE FRACTURING ABOUT 30-60 DE GREE INCLINED,VERY FAINTLY MOTTLED BY BURROWS", NONE,,,, BURROWS COMPACTED, HARD, 00000000,c09c02e14d55a105d506598577f28d13,42-372-43-4
42,372,,43,5,0.0,150.0,796.00,802.00,803.50,, VOLCANIC MUDSTONE, 5GY3/2-GRAYISH OLIVE GREEN TO 10Y4/2-GRAYISH OLIVE, VERY FAINTLY MOTTLED, NONE,,,," BURROWS COMPACTED,GEOCHEMICAL SAMPLE 141-150 CM", H ARD, 00000000,d4e890e4df31a5dc128d131a612de188,42-372-43-5
42,372,,43,6,0.0,150.0,796.00,803.50,805.00,, VOLCANIC MUDSTONE, 5GY4/1-DARK GREENISH GRAY TO 1 0Y4/2-GRAYISH OLIVE, VERY FAINTLY MOTTLED, BRECCIA TED 14-45 CM AND 119-150 CM,,,,, HARD, 33233000.3450.1110,21d37057c84fe390e1c1fee0da4ebec8,42-372-43-6
42,372,,44,0,0.0,39.0,834.00,834.00,834.39,, VOLCANIC MUDSTONE, 5GY4/1-DARK GREEN GRAY TO 10Y5 /4-GRAYISH OLIVE," FAINT MOTTLING BY CHONDRITE BURRO WS 25-29.5 CM,GRADED SILTY INTERCALATION MARL PEBBLE S AT BASE VOLCANIC SILTSTONE", NONE,,,, BURROWS COMPAC TED, HARD, 00000000,9c383a5e2e4fc323a2c61fe15356b76c,42-372-44-0
42,372,,44,1,0.0,150.0,834.00,834.40,835.90,, VOLCANIC MUDSTONE, 5GY4/1-DARK GREENISH GRAY TO 1 0Y4/2-GRAYISH OLIVE, DARKER LAMINAE SILTY LAYER 90- 91 CM, NONE,,,,, HARD, 00000000,aef5015fc8e4ce3670b4e760341277d9,42-372-44-1
42,372,,44,2,0.0,150.0,834.00,835.90,837.40,, VOLCANIC MUDSTONE," 5GY4/1-DARK GREENISH GRAY,10Y4 /2-GRAYISH OLIVE", VERY FAINTLY MOTTLED, NONE,,,, COM PACTED BURROWS, HARD, 00000000,d44343befc7d3b315f5f55203baa62e8,42-372-44-2
42,372,,44,3,0.0,150.0,834.00,837.40,838.90,, VOLCANIC MUDSTONE, 5GY4/1-DARK GREENISH GRAY TO 1 0Y4/2-GRAYISH OLIVE," FINE PARALLEL LAMINATION 45-49 CM,NURROW 50 CM,FAINTLY MOTTLED"," NONE 0-141 CM,SLI GHT 141-147 CM,BRECCIATED 147-150 CM",,,, COMPACTED BUR ROWS, HARD, 00000000,c8afea594aaff3f798e4b3777ef08488,42-372-44-3
42,372,,44,4,0.0,150.0,834.00,838.90,840.40,, VOLCANIC MUDSTONE, 10Y4/2-GRAYISH OLIVE TO 5GY4/1 -GREENISH GRAY," INTERCALATION OF GRADED AND LAMINAT ED SILTSTONE 45-60 CM,PLANOLTTE BURROWS FILLED WITH SILTY SEDIMENTS 64 CM 100-115 CM", NONE,,,,, HARD, 00000000,9805a9e3751e2be14b54615c0842029c,42-372-44-4
42,372,,44,5,0.0,150.0,834.00,840.40,841.90,, VOLCANIC MUDSTONE," 5G4/1-DARK GREENISH GRAY,10Y4/ 2-GRAYISH OLIVE"," FAINTLY MOTTLED BY BURROWING,BURRO WS FILLED WITH FINE SAND TO SILT 11-30 CM,INTERCALAT ION OF GRADED AND LAMINATED FINE SANDSTONE TO SILTST ONE 34-40 CM,PLANOLITE BURROW 42 CM,INTERCALATION OF GRADED AND LAMINATED FINE VOLCANIC SANDSTONE TO SIL TSTONE 75-87 CM", NONE,,,, GRADATIONAL CONTACT 34 CM, HARD, 00000000,5c4fb9154a24bb8af0b595246abcc33f,42-372-44-5
42,372,,44,6,0.0,150.0,834.00,841.90,843.40,, VOLCANIC MUDSTONE, 5GY4/1-DARK GREENISH GRAY TO 1 0Y4/2-GRAYISH OLIVE, VERY FAINTLY MOTTLED BY BURROW S, BRECCIATED 0-31 CM 52-95 CM 130-131 CM AND 148-1 50 CM,,,,, HARD, 00000000,a5eaf972b6fd80ad0acf6184ebf0530e,42-372-44-6
42,372,,45,0,0.0,42.0,872.00,872.00,872.42,, VOLCANIC MUDSTONE, 5GY4/1-GREENISH GRAY," VERY FA INT MOTTLING,SANDY LAYER 1 CM THICK LAMINATED VOLCAN IC SILTSTONE POSSIBLE SMALL SCALE RIPPLES IN LOWER P ART 32 CM", NONE,,,, COMPACTED BURROWS, HARD, 00000000,4db99c4268c3e556ab406a2b1d1f24b5,42-372-45-0
42,372,,45,1,0.0,150.0,872.00,872.42,873.92,, VOLCANIC MUDSTONE, 5GY4/1-DARK GREENISH GRAY TO 1 0Y4/2-GRAYISH OLIVE," VERY FAINT MOTTLING FROM BURRO WS,GRADED INTERCALATION OF PARALLEL LAMINATED FINE S ANDSTONE TO SILTSTONE 85-88 CM", NONE,,,, UPPER CONTAC T WITH INTERCALATED AREA GRADUAL 85 CM, HARD, 12231110.3450,f6ebdf321d130b824f618e07909634a8,42-372-45-1
42,372,,45,2,0.0,150.0,872.00,873.92,875.42,, VOLCANIC MUDSTONE, 10Y4/2-GRAYISH OLIVE GREEN," M OTTLED BY BURROWS,SILTY LENSE AT 117 CM", NONE EXCEP T BRECCIATED 45-65 CM,,,,, HARD, 00000000,15427974be71e60e74e62fc7e2856e50,42-372-45-2
42,372,,45,3,0.0,150.0,872.00,875.42,876.92,, VOLCANIC MUDSTONE, 10Y4/2-GRAYISH OLIVE," FAINTLY MOTTLED BY BURROWS 0-65 CM,MASSIVE HOMOGENOUS 65-15 0 CM", NONE,,,,, HARD, 00000000,ee7b5aee932678ead1b9f51f737a24e0,42-372-45-3
42,372,,45,4,0.0,150.0,872.00,876.92,878.42,, VOLCANIC SILTSTONE, 5GY4/1-DARK GREENISH GRAY TO 5Y4/1-OLIVE GRAY, HOMOGENOUS MASSIVE, BRECCIATED 9 1-107 CM,,,, GEOCHEMICAL SAMPLE 130-150 CM, HARD, 00000000,bbcea16e7f8255b5d6af9cd0f386ca4d,42-372-45-4
42,372,,45,5,0.0,150.0,872.00,878.42,879.92,, VOLCANIC MUDSTONE, 5GY4/1-DARK GREENISH GRAY TO 1 0Y4/2-GRAYISH OLIVE, MASSIVE, NONE,,,,, HARD, 00000000,af98f45127742c7710e63e99ca4c8b44,42-372-45-5
42,372,,45,6,0.0,150.0,872.00,879.92,881.42,, VOLCANIC MUDSTONE, 5GY4/1-DARK GREENISH GRAY TO 1 0Y4/2-GRAYISH OLIVE," HOMOGENOUS 0-63 CM,VERY FAINT MOTTLING FROM BURROWING 63-150 CM", BRECCIATED 110-1 15 CM,,,, BURROWS COMPACTED, HARD, 00000000,88cefa9c7623c9eff60c3c4fe95431a7,42-372-45-6
42,372,,46,1,133.0,150.0,881.50,882.83,883.00,, VOLCANIC MUDSTONE," 5GY4/1-DARK GREENISH GRAY TO 1 0Y4/2-GRAYISH OLIVE,N2-GRAYISH BLACK"," LENS OF COARS E SAND 4 MM 135 CM,GRADED COARSE SAND LAYER WITH MUD FILLED PLANOLITE BURROWS 136-140.5 CM,PLANOLITE BUR ROW FILLED WITH COARSE SAND 142 CM", NONE,,,, SAND LAY ERS ARE GRAYISH BLACK, HARD, 00000000,4dbf7746bb44438b802d1d4d8b13423a,42-372-46-1
42,372,,46,2,0.0,150.0,881.50,883.00,884.50,, VOLCANIC MUDSTONE," 5GY4/1-DARK GREENISH GRAY,10Y4 /2-GRAYISH OLIVE"," MOTTLED BY BURROWS 0-35 CM,HOMOGE NOUS MASSIVE 35-150 CM,BURROW FILLED WITH SAND 29 CM ,GRADED SANDY TO SILTY LAYER VOLCANIC SILTSTONE 33-3 5 CM", NONE,,,,, HARD, 00000000,fcff065aa923e1d11e4b5536e1f82724,42-372-46-2
42,372,,46,3,0.0,150.0,881.50,884.50,886.00,, VOLCANIC MUDSTONE, 10Y4/2-GRAYISH OLIVE TO 5GY4/1 -DARK GREENISH GRAY, HOMOGENOUS MASSIVE, FRAGMENTA TION BY INCLINED PLANES 30 DEGREES AT 38-53 CM,,,,, HAR D, 00000000,d6d0c355a6907019796a41ce6f5ad2d3,42-372-46-3
