leg,site,hole,core,section,top interval depth (cm),bottom interval depth (cm),top of core depth(m),top of layer depth (m),bottom of layer depth (m), describer,lithology,color,structures,deformations due to drilling,unusual occurrences,minerals,paleontology,other observations,hardness or induration,z-coding,eodp_id,sample
42,372,,1,1,122.0,150.0,112.00,113.22,113.50,, MARLY NANNO OOZE FORAM BEARING, N7-LIGHT GRAY," I NTERCALATED COARSE LAYER RICH IN PLANKTONIC FORAMS 1 30-132 CM AND 146.5-148 CM,FAINT INVERTED GRADING GR AIN SIZE OF FORAMS INCREASING UPWARDS IN THE COARSER LAYERS FORAM BEARING NANNO MUD 136.5-138 CM",,,, COARS E LAYER RICH IN PLANKTONIC FORAMS,, SOFT TO STIFF, 00000000,5232cdf881e6eec73fd12d59df3abfaa,42-372-1-1
42,372,,1,2,0.0,150.0,112.00,113.50,115.00,, NANNO MARL," 5GY6/1-GREENISH GRAY,N5-MEDIUM GRAY,1 0Y6/2-PALE OLIVE,5Y6/1-LIGHT OLIVE GRAY"," SLIGHTLY C OARSE FORAM BEARING NANNO MARL 16-19 CM,FAINT REVERS E GRADING 120-125 CM"," SEVERE DEFORMATION 33-77 CM A ND 105-115 CM,STRONG DEFORMATION 80-105 CM,MODERATE 16-30CM AND 115-150CM",,, COARSE LAYER RICH IN FORAMS," GREENISH GREY 0-15 CM,MEDIUM GRAY BAND 15-20 CM,P ALE OLIVE TO GREENISH GRAY 20-105 CM,OLIVE GRAY 105- 150 CM", SOFT TO STIFF, 00000000,60f96ff72be9d1607799362c58ebd202,42-372-1-2
42,372,,1,3,0.0,150.0,112.00,115.00,116.50,, NANNO MARL," 5Y6/4-DUSKY YELLOW,5Y6/1-OLIVE GRAY,1 0YR6/2-PALE YELLOWISH BROWN,N7-LIGHT GRAY,N6-MEDIUM GRAY,5Y8/4-GRAYISH YELLOW,N4-MEDIUM DARK GRAY,5Y5/2- LIGHT OLIVE GRAY,10Y8/2-PALE GREENISH YELLOW,10Y4/2- GRAYISH OLIVE",, INTENSE DEFORMATIONS FROM DRILLING,, SANDY CALC MUD QTZ BEARING,," COLOR SINEWED BY DRILL 46CM GREY AND GRAYISH YELLOW,100-120CM GREY AND OLI VE GREY, GEOCHEMICAL SAMPLE 145-150CM", SOFT, 00000000,035d518e94852e42ae8a9fef56dd7ade,42-372-1-3
42,372,,1,4,0.0,70.0,112.00,116.50,117.20,, CALC NANNO CLAY," N5-MEDIUM GRAY,N7-LIGHT GRAY,5Y6 /1-LIGHT OLIVE GRAY,5Y8/1-LIGHT YELLOWISH GRAY,N4-ME DIUM DARK GRAY,N6-MEDIUM LIGHT GRAY", SANDY FORAM LA YERS 23-30 CM," SLIGHT DEFORMATION 0-23 CM,HEAVY DEF ORMATION 23-70",,, FORAM RICH LAYER AT BASE," BAND OF LIGHT OLIVE GRAY 11-13 CM,BANDING OF MEDIUM GRAY LIG HT OLIVE GRAY MEDIUM DARK GRAY", FIRM, 00000000,e7476297e80c23f8d69e81799552ed2d,42-372-1-4
42,372,,2,1,105.0,150.0,131.00,132.05,132.50,, FORAM BEARING CALC NANNO MUD," 5GY6/1-GREENISH GRA Y,5Y7/2-YELLOWISH GRAY",, SLIGHT DEFORMATION,,, VARIAB LE CONTENT OF PLANKTONIC FORAMS,, FIRM, 00000000,d082fc81ddc652b85b0f395370115762,42-372-2-1
42,372,,2,2,6.0,150.0,131.00,132.56,134.00,, NANNO MARL," 5Y6/4-DUSKY YELLOW,N6-MEDIUM LIGHT GR AY", ONE SMALL SUBROUNDED GRAVEL AT 48 CM," MODERATE DEFORMATION 6-53CM AND 107-150 CM, EXTREME DEFORMAT ION 53-107CM SOUPY",,, FORAM SAND,, SOFT TO STIFF EXCE PT 53-92 CM SOUPY, 00000000,80f48d777af19629189e80be5cc61698,42-372-2-2
42,372,,2,3,0.0,145.0,131.00,134.00,135.45,, CALC NANNO MUD," N7-LIGHT GRAY,5Y6/1-LIGHT OLIVE G RAY,5Y6/4-DUSKY YELLOW", INTERCALATED FORAM BEARING SANDY SILT 80 CM 85-87 CM 94-101 CM AND 143 CM, MIL D DEFORMATION,,, FORAM RICH LAYERS," LIGHT GRAY 0-80 CM,LIGHT GRAY TO DUSKY YELLOW GRADING 80-145 CM", FI RM, 00000000,c7bf86cb0208837fe5f3ba663c70874c,42-372-2-3
42,372,,2,4,0.0,150.0,131.00,135.50,137.00,, FORAM BEARING NANNO MARL," 5Y6/2-YELLOW OLIVE GRAY ,5GY5/1-,5Y6/1-",," SLIGHT DEFORMATION 0-45 CM,NO DEFO RMATION 45-150 CM",, SLIGHTLY DOLOMITIC 0-45 CM,, HOM OGENEOUS COLOR, STIFF, 00000000,2456eb3c730ddba09bde24aab5d04d56,42-372-2-4
42,372,,3,1,40.0,150.0,140.50,140.90,142.00,, CALC NANNO MUD," 5Y6/4-DUSKY YELLOW,N6-MEDIUM LIGH T GRAY,10YR5/4-MODERATE YELLOWISH BROWN,N7-LIGHT GRA Y,10Y6/2-PALE OLIVE", LAYER OF FORAM BEARING NANNO M UD 47-54 CM AND 125-144 CM," MODERATE DEFORMATION 40 -80 CM,INTENSE DEFORMATION 80-120 CM,NOT DISTURBED 1 22-150 CM",,, FORAM BEARING LAYERS," MEDIUM LIGHT GRAY 40-46 CM,DUSKY YELLOW 46-125 CM,MEDIUM LIGHT GRAY 6 3-75 CM STREAK,COLOR GRADING DOWNWARD TO LIGHT GRAY 125-150 CM", FIRM, 00000000,965c80747081b8111d5831710fcb6831,42-372-3-1
42,372,,3,2,0.0,150.0,140.50,142.00,143.50,, NANNO MARL FORAM BEARING TO FORAM RICH," N6-MEDIUM LIGHT GRAY,5Y7/2-YELLOWISH GRAY,5GY6/1-GREENISH GRA Y,5Y6/4 DUSKY YELLOW,5Y4/1-OLIVE GRAY,N5-MEDIUM GRAY ,5Y7/2-YELLOWISH GRAY,10YR6/2-PALE YELLOWISH BROWN", LAYER OF SANDY QUARTZOSE SILT FAINT REVERSE GRADING GRADUAL CONTACT 56-60 CM SHARP CONTACT 60 AND 65 CM, MINOR, WELL ROUNDED PEBBLE LITHIC FRAGMENT 132 CM, QTZ, FORAM RICH LAYERS," MEDIUM LIGHT GRAY 0-6 CM,YELLOWISH GRAY 6-11 CM,ME DIUM GRAY 11-30 CM,DUSKY YELLOW 30-35 CM 46-60 CM AN D 80-140 CM,GREENISH GRAY 35-46 CM,OLIVE GRAY TO MED IUM GRAY SILT 60-80 CM,MINOR MEDIUM GRAY MOTTLES 96- 110 CM,PALE YELLOWISH BROWN 142-146 CM,GEOCHEMICAL S AMPLE 146-150 CM", SOFT, 00000000,c072880a912d017607528f86bb7ac9f7,42-372-3-2
42,372,,3,3,0.0,150.0,140.50,143.50,145.00,, NANNO MARL TO FORAM BEARING NANNO MARL," N6-MEDIUM LIGHT GRAY,5Y7/2-YELLOWISH GRAY,10Y6/2-PALE OLIVE,1 0YR6/6-DARK YELLOWISH ORANGE,5YR6/4-LIGHT BROWN,5YR5 /2-PALE BROWN,5Y6/1-LIGHT OLIVE GRAY,5Y6/4-DUSKY YEL LOW,5YR6-LIGHT BROWNISH GRAY,5YR4/1-BROWNISH GRAY,N7 -LIGHT GRAY,10YR6/2-PALE YELLOWISH BROWN,5YR6/1 LIGH T BROWN,N4-MEDIUM GRAY"," LAYERS SHOWING REVERSE GRAD ING COARSENING UPWARD WINNOWED LAG 123-124 CM AND 13 9-140 CM,LENSE OF FORAM NANNO MARL 129 CM,FORAM RICH LAYERS 18-70 CM AND 94-118 CM"," NONE 0-98CM,SLIGHT 98-150 CM",,,," MEDIUM LIGHT GRAY T O YELLOWISH GRAY 0-18 CM,PALE OLIVE 18-70 CM,DARK YE LLOWISH GRAY 0-18 CM,PALE OLIVE 18-70 CM,DARK YELLOW ISH ORANGE 70-75 CM,LIGHT BROWN AND PALE BROWN 75-94 CM,LIGHT OLIVE GRAY 94-118 CM,DUSKY YELLOW 118-128 C M,LIGHT BROWNISH GRAY 128-129 CM,LIGHT GRAY 129-136 CM,LIGHT BROWN 139-144 CM,MEDIUM GRAY 144-150 CM", F IRM TO STIFF, 00000000,6fc5c53761c0eacfcdd69a3f8d002628,42-372-3-3
42,372,,4,1,60.0,150.0,150.00,150.60,151.50,, NANNO MARL," 5G6/1-GREENISH GRAY,5R4/2-GRAYISH RED ,5YR5/2-PALE BROWN,5YR6/1-LIGHT BROWNISH GRAY,5Y8/4- GRAYISH YELLOW,10YR6/6-DARK YELLOW ORANGE",," INTENSE 60-65 CM,NONE 65-125 CM,MODERATE 125-150 CM",,, FORAM RICH LAYERS, COLORS VARYING ON A CM SCALE, STIFF, 00000000,8c87f82ecb81c2d35eee06cf6382a764,42-372-4-1
42,372,,4,2,0.0,150.0,150.00,151.50,153.00,, NANNO MARL," N6-MEDIUM LIGHT GRAY,N4-MEDIUM GRAY,5 YR6/1-LIGHT BROWNISH GRAY,5Y6/1-LIGHT OLIVE GRAY,5Y4 /1-OLIVE GRAY", SAND LAYERS GENERALLY COARSENING UPW ARDS WINNOWED LAG A FEW MM TO A CM THICK, UNDISTURB ED TO SLIGHT DEFORMATION,,,,, STIFF, 00000000,eb4cf7551815cb96189382aced35e9f0,42-372-4-2
42,372,,5,1,107.0,130.0,159.50,160.57,160.80,, GYPSUM," 5YR8/1-PINKISH GRAY,N9-WHITE,5R8/2-GRAYIS H PINK,5G6/1-GREENISH GRAY,5YR6/1-LIGHT BROWNISH GRA Y", BROKEN FRAGMENTS OF LAMINATED GYPSUM, BROKEN UP INTO FRAGMENTS,, GYPSUM,, SANDY TO SILTY CRYSTALS O F SECONDARY GYPSUM, HARD, 00000000,d2fa1cd6677745df7f7ffcfc5e0827cc,42-372-5-1
42,372,,5,1,130.0,142.0,159.50,160.80,160.92,, GYPSIFEROUS NANNO MARL," 5R5/4-MODERATE RED,10R6/2 -PALE RED,10R3/4-MODERATE REDDISH BROWN,5YR6/4-LIGHT BROWN", LAMINATED, SLIGHT,, GYPSUM, NANNOS,, SOFT, 00000000,1f5bd9c22bba06e6ae9e2f4a9f74e955,42-372-5-1
42,372,,5,1,142.0,150.0,159.50,160.92,161.00,, GYPSUM, -COLORLESS,,,,,, COARSELY CRYSTALLINE, HARD, 00000000,9be83b2ef606a645331ca65f50c1ef52,42-372-5-1
42,372,,6,1,125.0,133.0,169.00,170.25,170.33,, LAMINATED GYPSUM," N9-WHITE,5YR6/1-LIGHT BROWNISH GRAY,5R3/4-MODERATE RED",, BROKEN UP BY DRILLING,,,,, HARD, 00000000,f703d12049929f8940b120fa010c6ec1,42-372-6-1
42,372,,6,1,133.0,150.0,169.00,170.33,170.50,, MARL WITH SOME GYPSUM," N7-LIGHT GRAY,5R3/4-MODERA TE RED,5R6/2-PALE RED",, INTENSE DEFORMATION, NODULE S OF GYPSUM 133-139 CM, GYPSUM,, GYPSUM DECREASES W ITH DEPTH IN CORE, SOFT, 00000000,9800ce9fb5cdd24814aa4618ae1a975a,42-372-6-1
42,372,,7,CC,0.0,10.0,178.50,178.60,178.60,, SACCHARIOD GYPSUM, -WHITE TO LIGHT GRAY,,,,,,, HARD, 00000000,09991f99df01a1622648aefd1a013f27,42-372-7-CC
42,372,,7,CC,10.0,20.0,178.50,178.60,178.70,, DOLOMITIC MARL, -LIGHT REDDISH GRAY,,,, GYPSUM,,, SOFT, 12211130,47259c0de211663fa464bc606493e3e9,42-372-7-CC
42,372,,8,1,50.0,150.0,188.00,188.50,189.50,, GYPSUM," 5GY5/2-DUSKY YELLOW GREEN,-WHITE,5B7/1-LI GHT BLUISH GRAY TRANSPARENT", HARD LAMINATED SOME CR OSSLAMINATED, BROKEN UP BY DRILLING,,,, MOSTLY PARALL EL SUBORDINATE LAMINATION SCALE A FEW MM TO 1 CM, H ARD, 33233000.3152,86679947e0ce89b6989e0175828809fb,42-372-8-1
42,372,,8,2,0.0,150.0,188.00,189.50,191.00,, GYPSUM," -WHITE,5GY5/2-DUSKY YELLOW GREEN"," CONTOR TED THICKER LAMINAE UP TO SEVERAL MM ACROSS 70-80CM, BRECCIATED GYPSUM 100-145 CM", BROKEN UP BY DRILLING INTO H ARD FRAGMENTS,, SOME TYPE OF SULPHATE OR CARBONATE LAMINAE,, LATTER LAYERS ARE COARSE GRAINED TRA NSPARENT CRYSTALLINE GYPSUM UP TO 4 MM ACROSS, HARD, 00000000,e6f7642af4dd86ea40d94804db677a48,42-372-8-2
42,372,,9,1,66.0,76.0,197.50,198.16,198.26,, GYPSUM," -WHITE,5GY7/2-GRAYISH YELLOW GREEN,5GY6/1 -GREENISH GRAY,N4-MEDIUM GRAY", LAMINATED, BROKEN U P INTO PIECES BY DRILLING,,,, LAMINAE 1 TO A FEW MM TH ICK, HARD, 33233000.3152,d845fbd5ac5ef702f440158bfaadd53a,42-372-9-1
42,372,,9,1,76.0,150.0,197.50,198.26,199.00,, NANNO OOZE," 5B9/1-BLUISH WHITE,5B/1-MEDIUM BLUISH GRAY,5B7/1-LIGHT BLUISH GRAY,5G6/1-GREENISH GRAY", LAMINATED 98-150 CM," INTENSE 76-98 CM,SLIGHT 98-150 CM",,,," CONTORTED BLUISH WHITE TO MEDIUM BLUISH GRAY 7 6-98 CM,THICK LAMINAE LIGHT BLUISH GRAY WITH THIN LA MINAE OF GREENISH GRAY 98-150 CM", FIRM, 11111210,ab46a835e430bfe9d1d95c748c732713,42-372-9-1
42,372,,9,2,0.0,150.0,197.50,199.00,200.50,, NANNO MARL," 5G8/1-LIGHT GREENISH GRAY,5G6/1-GREEN ISH GRAY,5B5/1-MEDIUM BLUSIH GRAY,5G4/1-DARK GREENIS H GRAY,N5-MEDIUM GRAY,5GY7/2-GRAYISH YELLOW GREEN", CLOSELY LAMINATED 0-60 CM, SLIGHT,," PYRITE AT 100 C M AND 149 CM,LIMONITE PROBABLY FROM OXIDATION OF PYR ITE 100-150 CM",," LAMINATED ON MM SCALE LIGHT GREENIS H GRAY GREENISH GRAY MEDIUM BLUISH GRAY 0-47 CM,SOME DARK GREENISH GRAY AT 43 CM,LAMINATED MEDIUM GRAY A ND GRAYISH YELLOW GREEN 47-62 CM,MEDIUM GRAY WITH PA RTICLES OF GRAYISH YELLOW GREEN 75-80 CM", STIFF TO FIRM, 00000000,764de4ae3d896b2ac3f78936560e16a3,42-372-9-2
42,372,,9,3,0.0,150.0,197.50,200.50,202.00,, NANNO MARL," N7-LIGHT GRAY,5GY6/1-GREENISH GRAY,10 Y802-PALE GREENISH YELLOW,N6-MEDIUM LIGHT GRAY,5Y6/4 -DUSKY YELLOW",, SLIGHT,,,," GREENISH GRAY 0-33 CM,LIGHT GRAY 33-119 CM,PALE GREENISH YELLOW BANDS 91-96 CM, MEDIUM LIGHT GRAY 119-130 CM,LIGHT GRAY 130-140 CM,G EOCHEMICAL SAMPLE 140-150 CM", STIFF, 00000000,1e795307f29825f44c9072429169623b,42-372-9-3
42,372,,9,4,0.0,150.0,197.50,202.00,203.50,, NANNO OOZE AND MARL, 5GY6/1-GREENISH GRAY, SANDY LAYERS 45-47 CM AND 80-83 CM, SLIGHT NOT VISIBLE,," PYRITE 40 AND 125 CM,YELLOW ORANGE SPECKS OF LIMONI TE FROM WEATHERING OF PYRITE",, SANDY LAYERS NEED DET AILED X-RAY STUDY, STIFF, 00000000,7de5f46c9c3ac99f5f92518111d9c8c6,42-372-9-4
42,372,,10,1,90.0,150.0,207.00,207.90,208.50,, NANNO MARL, N7-LIGHT GRAY,, BRECCIATED BY DRILLIN G 90-140 CM,,,,, STIFF HOMOGENEOUS, 00000000,c27a089b359aa51be1f64a04f25984e3,42-372-10-1
42,372,,10,2,0.0,150.0,207.00,208.50,210.00,, NANNO MARL," 5B7/1-LIGHT BLUISH GRAY,10YR6/6-DARK YELLOW ORANGE",, NONE VISIBLE,, LIMONITE,, LIMONITIC SPECKS FROM THE WEATHERING OF PYRITE, STIFF HOMOGEN OUS, 00000000,f069b04899932bc76ddfede75b2b6054,42-372-10-2
42,372,,11,1,80.0,150.0,216.50,217.30,218.00,, NANNO MARL, N6-MEDIUM LIGHT GRAY, STRUCTURELESS, NONE TO SLIGHT,,,,, STIFF HOMOGENOUS, 00000000,7eeb166409d7dd2d417496e0601bb5f3,42-372-11-1
42,372,,11,2,0.0,150.0,216.50,218.00,219.50,, NANNO MARL, N6-MEDIUM LIGHT GRAY, NONE, NONE VI SIBLE,, PYRITE 115 CM,, MM SIZED GRAYISH GREEN SPECK S, STIFF HOMOGENOUS, 00000000,73d67fc75587fa773bbc7491990bc3d1,42-372-11-2
42,372,,11,3,0.0,150.0,216.50,219.50,221.00,, NANNO OOZE, 5B5/1-MEDIUM BLUISH GRAY TO 5B7/1-LIG HT BLUISH GRAY, BURROWING 0-40 CM, DEFORMED BY SLU MPING 40-150 CM,, PYRITE 61 CM,,," FIRM TO STIFF 0-40 CM,SOFT 40-150 CM", 00000000,f7b12508715076c72e69c4f7fe21c572,42-372-11-3
42,372,,12,1,0.0,36.0,226.00,226.00,226.36,, NANNO MARL," N6-MEDIUM LIGHT GRAY,N7-LIGHT GRAY",, NOT VISIBLE,,,," MEDIUM LIGHT GRAY 0-15 CM,LIGHT GRAY 1 5-36 CM", HOMOGENOUS STIFF, 00000000,27561f2fb01cbf3bbee951a7aa21d315,42-372-12-1
42,372,,12,3,0.0,150.0,226.00,229.00,230.50,, NANNO MARL," N6-MEDIUM LIGHT GRAY,N7-LIGHT GRAY", NONE, SLIGHT,,,, LAYERING 1-3 MM THICK OF GRAYISH GRE EN AT 40 CM, STIFF HOMOGENOUS, 00000000,6395307f5abf208d28dc4de5ca1e7f50,42-372-12-3
42,372,,12,4,0.0,150.0,226.00,230.50,232.00,, NANNO MARL," 5B7/1-LIGHT BLUISH GRAY,5B5/1-MEDIUM BLUISH GRAY", BURROWING INTENSE, SLIGHT,, PYRITIZED BURROWS 136 CM, ZOOPHYCUS LAYER 88 CM, SMALL INTE RCALATIONS OF DARKER MEDIUM BLUISH GRAY LITHOLOGY SP ACED BETWEEN 1 AND 4 CM FROM EACH OTHER, STIFF, 00000000,91bc289b688404e3870938998080f305,42-372-12-4
42,372,,12,5,0.0,150.0,226.00,232.00,233.50,, NANNO MARLY OOZE, 5B7/1-LIGHT BLUISH GRAY," FAINT LY MOTTLED BY SOME BURROWING,CM THIN INTERLAYERS OF DARKER MATERIAL SPACED AT SOME CM INTERVALS", SLIGHT,,,,, FIRM TO STIFF, 00000000,8ab9fe027102fa5eb31b524dbf80503a,42-372-12-5
42,372,,12,6,0.0,150.0,226.00,233.50,235.00,, NANNO MARL," 5B7/1-LIGHT BLUISH GRAY,5B5/1-MEDIUM BLUISH GRAY"," BURROWING 0-45 CM,INTERSPACED LAYERS O F MEDIUM BLUISH GREY AT 5 CM INTERVALS"," SLIGHT 0-45 CM,CONTORTED BY SLUMPING 45-75 CM"," ANGULAR FRAGMEN T OF HARD BROCKEN ROCK 1CM AT 88 CM,ROCK FRAGMENTS 1 44-146 CM", PYRITE 45-75 CM AND 150 CM,,, SOFT TO FIR M, 00000000,91483e76f83c6abb8d2c56c9b90bbe44,42-372-12-6
42,372,,13,0,0.0,9.0,235.50,235.50,235.59,, NANNO MARL," 5G6/1-GREENISH GRAY,5B7/1-BLUISH GRAY", FAINT MOTTLING, NONE,,,,, HARD, 00000000,288e2d9ccaea51d836bdfe705334f79e,42-372-13-0
42,372,,13,1,0.0,150.0,235.50,235.59,237.09,, NANNO MARL," 5B7/1-LIGHT BLUISH GRAY,5B5/1-MEDIUM BLUISH GRAY"," MOTTLED BY BURROWS,INTERBEDDING",,, PYRI TE,, SMALL INTERBED UP TO 2 MM OF MEDIUM BLUISH GRAY MORE MARLY LAYERS SPACED GENERALLY A FEW CM FROM EA CH OTHER, SOFT, 00000000,c3949163c7038f9ae37b72f6f13403f9,42-372-13-1
42,372,,13,2,0.0,150.0,235.50,237.09,238.59,, NANNO MARL, 5B7/1-LIGHT BLUISH GRAY," FAINTLY MOT TLED BY BURROWS,FAINT LAMINATION", SLIGHT,, PYRITE 1 44 CM,, FINE DARK LAMINAE 1 MM SPACED AT INTERVALS O F A FEW CM MAY ALSO REPRESENT COMPACTED BURROWS, FI RM TO STIFF, 00000000,d159f175555578be03bb18cb430c1d05,42-372-13-2
42,372,,13,3,0.0,150.0,235.50,238.59,240.09,, NANNO MARL," 5B7/1-LIGHT BLUISH GRAY,5B5/1-MEDIUM BLUISH GRAY"," MOTTLED BY BURROWS,FINE DARKE R LAMINAE SOME CM APART MAY BE COMPACTED BURROWS", SLIGHT,,,,, S OFT TO FIRM, 00000000,039c6414aa5b580e0dd10fef9a899bc7,42-372-13-3
42,372,,13,4,0.0,150.0,235.50,240.09,241.59,, NANNO MARL, 5B7/1-LIGHT BLUISH GRAY," FAINT MOTTL ING BY BURROWS,FAINT MM DARKER LAMINAE", SLIGHT,,,,, FI RM, 00000000,8022e11c1d01dfae28ab0985dbd3e419,42-372-13-4
42,372,,13,5,0.0,150.0,235.50,241.59,243.09,, NANNO MARL," 5B7/1-LIGHT BLUISH GREY,5B5/1-MEDIUM BLUSIH GRAY"," MOTTLED BY BURROWS,MM INTERCALATED DAR KER MARLY STREAKS SOME CM APART", SLIGHT, NODULE OF GYPSUM 2 CM AT 22 CM, GYPSUM NODULE,,, STIFF, 00000000,e60ba6f240a35015f14ad92fa5542e1c,42-372-13-5
42,372,,13,6,0.0,150.0,235.50,243.09,244.59,, NANNO MARL, 5BM01-LIGHT BLUISH GRAY, SLIGHTLY MO TTLED BY BURROWING SMALL MM STREAKS OF DARKER FINE M ARL SOME CM APART, SLIGHT,,,,, STIFF, 00000000,d9d919f3de01c9502c1ba0fed7ed5366,42-372-13-6
42,372,,14,0,0.0,27.0,245.00,245.00,245.27,, NANNO MARL TO MARLSTONE," 5B7/1-LIGHT BLUISH GRAY, 5G6/1-GREENISH GRAY,5G4/1-DARK GREENISH GRAY",," INTEN SE 0-9 CM,NONE 9-27 CM",,,,," SOFT 0-4 CM,HARD 4-27 CM", 00000000,3fef11926df60a967a3a66fcc67c10cb,42-372-14-0
42,372,,14,1,0.0,150.0,245.00,245.27,246.77,, NANNO MARL, 5B7/1-LIGHT BLUISH GRAY," MOTTLED BY BURROWING,FINE MM DARKER LAMINAE SOME CM APART", SLI GHT,, PYRITE,,, FIRM TO STIFF, 00000000,5c6c2f29ebdb10f3cd5d1175b98195ff,42-372-14-1
42,372,,14,2,0.0,150.0,245.00,246.77,248.27,, NANNO OOZE, 5B7/1-LIGHT BLUISH GRAY," MOTTLED BY BURROWS,FINE DARKER LAMINAE SOME CM APART FROM ONE A NOTHER", SLIGHT,, PYRITE,,, FIRM TO STIFF, 00000000,13e2847106394402a2091fc5eec18b21,42-372-14-2
42,372,,14,3,0.0,150.0,245.00,248.27,249.77,, NANNO MARL DOLOMITE BEARING, 5B7/1-LIGHT BLUISH G RAY," MOTTLED BY BURROWS,FINE MM DARKER LAMINAE SOME CM APART FROM EACH OTHER", SLIGHT,,,,, FIRM, 00000000,65387cc9796eb47590888b06db47ce87,42-372-14-3
42,372,,14,4,0.0,150.0,245.00,249.77,251.27,, NANNO MARL, 5B7/1-LIGHT BLUISH GRAY," MOTTLED BY BURROWS,FINE MM DARK LAMINAE SOME CM APART", SLIGHT,,,, GEOCHEMICAL SAMPLE 141-150 CM, FIRM, 00000000,e6cb69b4ea6170781a735a7f71f75a46,42-372-14-4
42,372,,14,5,0.0,109.0,245.00,251.27,252.36,, NANNO MARLY OOZE, 5B7/1-LIGHT BLUISH GRAY," MOTTL ED BY BURROWS,FINE MM DARK LAMINAE SOME CM APART", S LIGHT,,,,, FIRM, 00000000,98a4ade635e17e59fe770b31d24c0c8b,42-372-14-5
42,372,,14,6,38.0,150.0,245.00,253.15,254.27,, NANNO MARL, 5B7/1-LIGHT BLUISH GRAY,, MODERATE TO NONE VISIBLE," GYPSUM NODULES 81,82-83,99 AND 121 C M", GYPSUM,,, SOFT HOMOGENOUS, 00000000,b855a94779a43b8faa756871c5612d0f,42-372-14-6
42,372,,15,1,124.0,150.0,254.50,255.74,256.00,, NANNO OOZE, 5B7/1-LIGHT BLUISH GRAY," FAINTLY MOT TLED BY BURROWS,SMALL DARKER MM STREAKS SOME CM APAR T FROM EACH OTHER", SLIGHT,,,,, FIRM, 00000000,11f412b8dcaa4d3e322f9a05d1b148ce,42-372-15-1
42,372,,15,2,0.0,150.0,254.50,256.00,257.50,, NANNO OOZE, 5B7/1-LIGHT BLUISH GRAY, INTENSELY M OTTLED BY BURROWING IN UPPER 30 CM ONLY DARKER MM LA MINAE SEPARATED FROM EACH OTHER BY SOME CM, SLIGHT,,,,, FIRM TO STIFF, 00000000,9d10972deb5996388ba00e4d809fc209,42-372-15-2
42,372,,15,3,0.0,150.0,254.50,257.50,259.00,, NANNO MARLY OOZE," 5B7/1-LIGHT BLUISH GRAY,5B5/1-M EDIUM BLUISH GRAY", MOTTLED BY INTENSE BURROWING, S LIGHT,,,, SLIGHTLY OXIDIZED ZONE 9-10 CM, SOFT TO FIR M, 00000000,220c0ff93848a96d48b2c614dc2d095d,42-372-15-3
42,372,,15,4,0.0,150.0,254.50,259.00,260.50,, NANNO MARLY OOZE, 5B7/1-LIGHT BLUISH GRAY, MOTTL ED BY BURROWS IN UPPER 60 CM SOME DARK LAMINAE INTER BEDDED, SLIGHT,,,,, FIRM, 00000000,1f3b83dd787cc4148cebf2588fcf9acc,42-372-15-4
42,372,,15,5,0.0,150.0,254.50,260.50,262.00,, NANNO MARLY OOZE," 5B7/1-LIGHT BLUISH GRAY,5B5/1-M EDIUM BLUISH GRAY", MOTTLED BY BURROWS, SLIGHT, NO DULE OF GYPSUM 120 CM, GYPSUM,,, FIRM, 00000000,bb4c582217525f368a92713cd4dfd003,42-372-15-5
42,372,,15,6,0.0,150.0,254.50,262.00,263.50,, NANNO MARLY OOZE, 5B7/1-LIGHT BLUISH GRAY," MOTTL ED BY BURROWS,SOME DARK LAMINAE", SLIGHT,,,,, SOFT TO F IRM, 00000000,231711f44a07f3a5afbd26980f105274,42-372-15-6
42,372,,16,1,45.0,150.0,264.00,264.45,265.50,, NANNO MARL, 5B7/1-LIGHT BLUISH GRAY," MOTTLED BY BURROWS,FROM 50-80 CM A FEW DARKER LAMINAE", SLIGHT,,,,, FIRM TO STIFF, 00000000,d40da0b5ac77ac35ee82a4782fc87ca9,42-372-16-1
42,372,,16,2,0.0,150.0,264.00,265.50,267.00,, NANNO MARL, 5B7/1-LIGHT BLUISH GRAY," MOTTLED BY BURROWS,A FEW DARK LAMINAE IN UPPER HALF", SLIGHT,,,,, FIRM TO STIFF, 00000000,17e7027170607df22cd715bb3b58ee55,42-372-16-2
42,372,,16,3,0.0,150.0,264.00,267.00,268.50,, NANNO MARL, 5B7/1-LIGHT BLUISH GRAY," MOTTLED BY BURROWING,A FEW DARK LAMINAE IN MIDDLE", SLIGHT,,,,, FI RM, 00000000,c10f3e25bc4213b7267cfec9ae6eb9a6,42-372-16-3
42,372,,16,4,0.0,150.0,264.00,268.50,270.00,, NANNO MARL, 5B7/1-LIGHT BLUISH GRAY, MOTTLED BY BURROWS UPPER 75 CM, SLIGHT,,,,, FIRM*,,e4c5a92d10eb0b6284d403dd6e34704f,42-372-16-4
42,372,,16,5,0.0,150.0,264.00,270.00,271.50,, NANNO MARL," 5B7/1-LIGHT BLUISH GRAY,5B5/1-MEDIUM BLUISH GRAY", MOTTLED BY BURROWS, SLIGHT,,,,, FIRM TO STIFF, 00000000,b3893f5736068c5d4585404020dd997e,42-372-16-5
42,372,,16,6,0.0,150.0,264.00,271.50,273.00,, NANNO MARL, 5B7/1-LIGHT BLUISH GRAY, MOTTLED BY BURROWING, SLIGHT,,,,, SOFT TO FIRM, 00000000,c364dad9230786fc49e69ac8524a4abd,42-372-16-6
42,372,,17,1,53.0,150.0,273.50,274.03,275.00,, NANNO MARL, 5B7/1-LIGHT BLUISH GRAY, MOTTLED BY BURROWS FROM 50-80 AND 115-135 CM SOME MM DARKER LAM INAE SPACED SOME CM APART,,,,,, FIRM TO STIFF, 00000000,3713b04a1bfa5dcfaf67b09292216d01,42-372-17-1
42,372,,17,2,0.0,150.0,273.50,275.00,276.50,, NANNO MARL, 5B7/1-LIGHT BLUISH GRAY, MM THICK DA RKER LAMINAE IN UPPER PART SOME CM APART FROM EACH O THER, SLIGHT,,,,, SOFT TO FIRM, 00000000,cf88f728865d74fcfb5d7f893286cb56,42-372-17-2
42,372,,17,3,0.0,150.0,273.50,276.50,278.00,, NANNO MARL, 5B7/1-LIGHT BLUISH GRAY, MOTTLED BY INTENSE BURROWING A FEW DARKER LAMINAE, SLIGHT," GY PSUM NODULES 38,45,69,71 CM", GYPSUM,,, FIRM, 00000000,b872061108fac7f03393d0e2e5385851,42-372-17-3
42,372,,17,4,0.0,150.0,273.50,278.00,279.50,, NANNO MARL," 5B7/1-LIGHT BLUISH GRAY,5B5/1-BLUISH GRAY"," MOTTLED BY BURROWS,NO DARK LAMINAE", NONE,,,,, S TIFF TO FIRM, 00000000,525918431e375cac7b6d487b821a32e7,42-372-17-4
42,372,,17,5,0.0,150.0,273.50,279.50,281.00,, NANNO MARL, 5B7/1-LIGHT BLUISH GRAY, FAINTLY MOT TLED BY INTENSE BURROWING, SLIGHT,,,,, FIRM TO STIFF, 00000000,114f6b88f99e3babfe254f6f4d4677e0,42-372-17-5
42,372,,17,6,0.0,150.0,273.50,281.00,282.50,, NANNO MARL," 5B7/1-LIGHT BLUISH GRAY,5B5/1-MEDIUM BLUISH GRAY", MOTTLED BY INTENSE BURROWING ZOOPHYCUS, NONE,,,,, FIRM, 00000000,e09480b26d1598b9fa41cfac3ae74b1d,42-372-17-6
42,372,,18,1,48.0,150.0,283.00,283.48,284.50,, NANNO MARL," 5B7/1-LIGHT BLUISH GRAY,5B5/1-MEDIUM BLUISH GRAY"," MOTTLED BY BURROWING,A FEW DARK MM LAM INAE 50-110 CM", SLIGHT,,,,, FIRM TO SOFT, 00000000,de0d82f770f0d8941c097df06d155ff8,42-372-18-1
42,372,,18,2,0.0,150.0,283.00,284.50,286.00,, NANNO MARL," 5B7/1-LIGHT BLUISH GRAY,5B5/1-MEDIUM BLUISH GRAY", MOTTLED BY INTENSE BURROWING, SLIGHT TO NONE,," PYRITE 20,34,47 AND 86 CM",,, FIRM, 00000000,906a45a87f528db519dffc3c38d73d9a,42-372-18-2
42,372,,18,3,0.0,150.0,283.00,286.00,287.50,, NANNO MARL," 5B7/1-LIGHT BLUISH GRAY,5B5/1-MEDIUM BLUISH GRAY", MOTTLED BY MODERATE TO INTENSE BURROWI NG, SLIGHT,,,,, FIRM TO STIFF, 00000000,c32074b0ba76fb253ae7102676fcecf9,42-372-18-3
42,372,,18,4,0.0,150.0,283.00,287.50,289.00,, NANNO MARL," 5B7/1-LIGHT BLUISH GRAY,5B5/1-MEDIUM BLUISH GRAY"," MOTTLED BY INTENSE BURROWING,FEW DARKE R LAMINAE", SLIGHT, PYRITE NODULES 80-95 CM, PYRIT E,,, FIRM, 00000000,1cabe9c0c3e6cfb8f9b31953a63d84bf,42-372-18-4
42,372,,18,5,0.0,150.0,283.00,289.00,290.50,, NANNO MARL," 5B7/1-LIGHT BLUISH GRAY,5G6/1-GREENIS H GRAY", MOTTLED BY BURROWING, NONE, GYPSUM NODULE 57 CM, GYPSUM,,, STIFF TO FIRM, 00000000,ce3d89b31f4d6682cc0eb3cbdcf471f0,42-372-18-5
42,372,,18,6,0.0,150.0,283.00,290.50,292.00,, NANNO MARL," 5B7/1-LIGHT BLUISH GRAY,5B5/1-MEDIUM BLUISH GRAY", MOTTLED BY INTENSE BURROWING,,,,,, FIRM TO STIFF, 00000000,6a7e122d73ded29abf51705dfba6a525,42-372-18-6
42,372,,19,1,28.0,150.0,292.50,292.78,294.00,, NANNO MARL," 5B7/1-LIGHT BLUISH GRAY,5B5/1-MEDIUM BLUISH GRAY"," MOTTLED BY INTENSE BURROWING,A FEW DAR KER LAMINAE", SLIGHT,, PYRITE AT 137 CM,,, STIFF TO F IRM, 00000000,a3660282c5cedda2e0d1b2d16c34b736,42-372-19-1
42,372,,19,2,0.0,150.0,292.50,294.00,295.50,, NANNO MARL, 5B7/1-LIGHT BLUISH GRAY, MOTTLED BY INTENSE BURROWING A FEW DARK LAMINAE, SLIGHT,,,,, FIRM TO STIFF, 00000000,23504ad7637657a3d0fc60e365fef8a5,42-372-19-2
42,372,,19,3,0.0,150.0,292.50,295.50,297.00,, NANNO MARL," 5B7/1-LIGHT BLUISH GRAY,5B5/1-MEDIUM BLUISH GRAY"," MOTTLED BY INTENSE BURROWING,A FEW DAR K LAMINAE", SLIGHT,,,,, STIFF TO FIRM, 00000000,7c8c79c617a8111ad4ecf64d12c379a0,42-372-19-3
42,372,,19,4,0.0,150.0,292.50,297.00,298.50,, NANNO MARL," 5B7/1-LIGHT BLUISH GRAY,5B5/2-MEDIUM BLUISH GRAY", MOTTLED BY INTENSE BURROWING ZOOPHYCUS ZOOPHYCUS 6-13 CM, SLIGHT,,,, GEOCHEMICAL SAMPLE 1 41-150 CM, FIRM TO STIFF, 00000000,477c82e1eb570e5c6561075e61e3379d,42-372-19-4
42,372,,19,5,0.0,150.0,292.50,298.50,300.00,, NANNO MARL," 5B7/1-LIGHT BLUISH GRAY,5B5/1-MEDIUM BLUISH GRAY", MOTTLED BY INTENSE BURROWING, SLIGHT,, PYRITE 61-66 CM,,, STIFF TO FIRM, 00000000,08d8a692557082fe44856dcd235d6f9f,42-372-19-5
42,372,,19,6,0.0,150.0,292.50,300.00,301.50,, NANNO MARL," 5B7/1-LIGHT BLUISH GRAY,5B5/1-MEDIUM BLUISH GRAY", MOTTLED BY INTENSE BURROWING, SLIGHT,,,,, FIRM TO STIFF, 00000000,d921aa82fcaf0cec208beae4e203c5c7,42-372-19-6
42,372,,20,0,0.0,41.0,302.00,302.00,302.41,, NANNO MARL TO MARLSTONE," 5B7/1-LIGHT BLUISH GRAY, 5G6/1-GREENISH GRAY", MOTTLED BY INTENSE BURROWING, NONE,,,,, FIRM TO HARD, 00000000,ca064259b2713fb7c770fd99af053027,42-372-20-0
42,372,,20,1,0.0,150.0,302.00,302.41,303.91,, NANNO MARL," 5B7/1-LIGHT BLUISH GRAY,5B5/1-MEDIUM BLUISH GRAY"," MOTTLED BY INTENSE BURROWING,DARK MM L AMINAE SPACED A FEW CM APART 0-50 CM", SLIGHT,,,, LARG E BURROW AT BOTTOM, FIRM TO STIFF, 00000000,71e726250f9012cf8dfead79ff4245ab,42-372-20-1
42,372,,20,2,0.0,150.0,302.00,303.91,305.41,, NANNO MARL," 5B7/1-LIGHT BLUISH GRAY,5B5/1-MEDIUM BLUISH GRAY"," STRONGLY MOTTLED BY BURROWING,A FEW DA RK LAMINAE IN LOWER PART", SLIGHT,, PYRITE 141 CM,,, STIFF TO FIRM, 00000000,a3dd5915c0b8bd9ad21b2de6fb4f7c52,42-372-20-2
42,372,,20,3,0.0,150.0,302.00,305.41,306.91,, NANNO MARL," 5B7/1-LIGHT BLUISH GRAY,5B5/1-MEDIUM BLUISH GRAY", STRONG MOTTLING BY INTENSE BURROWING, SLIGHT,,,,, FIRM TO STIFF, 00000000,f8171da587bb549b2c78c02077593fd7,42-372-20-3
42,372,,20,4,0.0,150.0,302.00,306.91,308.41,, NANNO MARL," 5B7/1-LIGHT BLUISH GRAY,5B5/1-MEDIUM BLUISH GRAY", MOTTLED BY INTENSE LARGE BURROWS, SLI GHT,,,,, FIRM TO STIFF, 00000000,a71419d5fa08e5b85f9af4aa074465ae,42-372-20-4
42,372,,20,5,0.0,150.0,302.00,308.41,309.91,, NANNO MARL, 5B7/1-LIGHT BLUISH GRAY, MOTTLED BY INTENSE BURROWING A FEW DARKER LAMINAE, SLIGHT,,,,, FI RM, 00000000,b0d2bb1109bf654d4f2bb61b44b7ec7a,42-372-20-5
42,372,,20,6,0.0,150.0,302.00,309.91,311.41,, NANNO MARL," 5B7/1-LIGHT BLUISH GRAY,5G6/1-GREENIS H GRAY"," MOTTLED BY BURROWS,SMALL DARKER LAMINAE", S LIGHT, GYPSUM NODULE 40 CM, GYPSUM,,, FIRM, 00000000,9695c9ccef4fea1817d86f62cadc55fb,42-372-20-6
42,372,,21,1,120.0,150.0,311.50,312.70,313.00,, NANNO MARL, 5B7/1-LIGHT BLUISH GRAY, FAINT BURRO WING 138-150 CM, SLIGHT TO INTENSE,,,," BROKEN UP BY D RILLING 120-128 CM,DEFORMATION PROBABLY SLUMPING", SOFT, 00000000,3cb1e758935aaeabd78d6a570f919508,42-372-21-1
