42,372,,21,2,0.0,150.0,311.50,313.00,314.50,, NANNO MARL," 5B7/1-LIGHT BLUISH GRAY,5B5/1-MEDIUM BLUISH GRAY", MOTTLING BY BURROWS A FEW DAR K LAMINAE, SLIGHT,,,,, FIRM TO STIFF, 00000000,6c813d1de4cdea329f64ebe0426922fb,42-372-21-2
42,372,,22,1,0.0,150.0,321.00,321.00,322.50,, NANNO MARL," 5B7/1-LIGHT BLUISH GRAY,5G6/1-GREENIS H GRAY", MOTTLED BY BURROWS, SLIGHT, GYPSUM NODULE S 88-92 CM," GYPSUM,PYRITE 26-36 CM",,, FIRM TO HARD, 00000000,af2bab3782ad4a463bac7956ca3e6015,42-372-22-1
42,372,,22,2,0.0,150.0,321.00,322.50,324.00,, NANNO MARL," 5B7/1-LIGHT BLUISH GRAY,5G6/1-GREENIS H GRAY", MOTTLED BY BURROWING, SLIGHT,,,,, STIFF TO FI RM, 00000000,0c493dedf836e0fba8d6c6eecc549569,42-372-22-2
42,372,,22,3,0.0,150.0,321.00,324.00,325.50,, NANNO MARL," 5B7/1-LIGHT BLUISH GRAY,5G6/1-GREENIS H GRAY",, SLIGHT," MARCASITE NODULES 30-35 CM,GYPSUM NODULES 60-70 CM"," GYPSUM,MARCASITE",, GREENISH GRAY ABOVE 90 CM LIGHT BLUISH GRAY BELOW 90 CM, STIFF TO FIRM, 00000000,b07a12d0a317b21557448b12d8c53fab,42-372-22-3
42,372,,23,4,0.0,150.0,330.50,335.00,336.50,, NANNO MARL, 5G6/1-GREENISH GRAY, MOTTLED BY BURR OWING, SLIGHT TO NONE,,,,, STIFF, 00000000,3faff4e2fc15b0207703b1374e92cb56,42-372-23-4
42,372,,23,5,0.0,150.0,330.50,336.50,338.00,, NANNO MARL, 5G6/1-GREENISH GRAY, MOTTLED BY BURR OWS, NONE TO SLIGHT,,,,, FIRM, 00000000,4d0a1f060c72e3aaf195980e9c9e63a4,42-372-23-5
42,372,,23,6,0.0,150.0,330.50,338.00,339.50,, NANNO MARL, 5G6/1-GREENISH GRAY, MOTTLED BY BURR OWS, SLIGHT,,,,, STIFF TO FIRM, 00000000,80af903a8a48b02d9455edec26d78416,42-372-23-6
42,372,,24,0,0.0,42.0,340.00,340.00,340.42,, NANNO MARL," 5B7/1-LIGHT BLUISH GRAY,5B5/1-MEDIUM BLUISH GRAY,5GY6/1-GREENISH GRAY",, INTENSE BY DRILLI NG OR SLUMPING,,,,, SOFT, 00000000,1ffd16ca75e3ec82d729e65b24e602e9,42-372-24-0
42,372,,24,1,0.0,150.0,340.00,340.42,341.92,, NANNO MARL, 5B7/1-LIGHT BLUISH GRAY, NO SEDIMENT ARY STRUCTURE, INTENSE BY DRILLING,,,,, SOFT, 00000000,ffd515cabe9bd8b3b78390beabe7d8df,42-372-24-1
42,372,,24,2,0.0,150.0,340.00,341.92,343.42,, NANNO MARL, 5B7/1-LIGHT BLUISH GRAY,, INTENSE BY SLUMPING,,,,, FIRM TO SOFT, 00000000,068d8b0c1bad57ab0a63796fe334ba36,42-372-24-2
42,372,,24,3,0.0,150.0,340.00,343.42,344.92,, NANNO FORAM MARL, 5G6/1-GREENISH GRAY, MOTTLED B Y BURROWS BELOW 74 CM," SLUMP,SLIGHT IN WORMALLY DEP OSITED ROCK BELOW 74 CM",,, ZOOPHYCUS 119 CM,," SOFT AB OVE 74 CM,FIRM BELOW 74 CM", 00000000,7a2ca88184e9e07d8ef5724348d89e77,42-372-24-3
42,372,,24,4,0.0,150.0,340.00,344.92,346.42,, NANNO MARL, 5G6/1-GREENISH GRAY," MOTTLED BY BURR OWS,SMALL SANDY INTERCALATIONS 26-27 CM", SLIGHT,, P YRITE 27 CM,,, FIRM TO STIFF, 00000000,eb0a31aff3f412ea4683455afe59c866,42-372-24-4
42,372,,24,5,0.0,150.0,340.00,346.42,347.92,, FORAM NANNO MARL, 5G6/1-GREENISH GRAY," MOTTLED B Y BURROWS,A FEW DARK MM LAMINAE", SLIGHT,,,, GEOCHEMIC AL SAMPLE 141.5-150 CM, SOFT, 00000000,9ff16a9bdffc28ae8250fa54a26c8d2b,42-372-24-5
42,372,,24,6,0.0,150.0,340.00,347.92,349.42,, FORAM NANNO MARL, 5G6/1-GREENISH GRAY," FEW DARKE R LAMINAE,MOTTLED BY BURROWING", SLIGHT,,,,, STIFF, 00000000,d78516fcf8fecb2ce1ad6534feb27db1,42-372-24-6
42,372,,25,0,0.0,41.0,349.50,349.50,349.91,, FORAM NANNO MARL," 5B7/1-LIGHT BLUISH GRAY,5G6/1-G REENISH GRAY,N5-MEDIUM GRAY", MOTTLED BY BURROWS 12- 41 CM," INTENSE 0-12 CM,NONE 12-41 CM",,,," LIGHT BLUISH GRAY 0-12 CM,GREENISH GRAY 12-41 CM,BURROWS ARE MED IUM GRAY"," SOFT 0-12 CM,FIRM TO HARD 12-41 CM", 00000000,9940b3632e596beab6b264310378e126,42-372-25-0
42,372,,25,1,0.0,150.0,349.50,349.91,351.41,, FORAM NANNO MARL," 5B7/1-LIGHT BLUISH GRAY,5G6/1-G REENISH GRAY"," MOTTLED BY BURROWS,A FEW INTERCALATED DARKER MM LAMINAE FROM 85-130 CM", SLIGHT,,,,, FIRM TO HARD, 00000000,f4e1f2f67f260fae83edd73c4345b812,42-372-25-1
42,372,,25,2,0.0,150.0,349.50,351.41,352.91,, FORAM NANNO MARL," 5B7/1-LIGHT BLUISH GRAY,5G6/1-G REENISH GRAY"," MOTTLED BY INTENSE BURROWING,A FEW DA RKER MM LAMINAE", SLIGHT,,,,, FIRM, 00000000,b9996da5d14c7f1f0316a13c865e5a88,42-372-25-2
42,372,,25,3,0.0,150.0,349.50,352.91,354.41,, FORAM NANNO MARL," 5B7/1-LIGHT BLUISH GRAY,5GY6/1- GREENISH GRAY"," MOTTLED BY INTENSE BURROWING,A FEW D ARK LAMINAE", SLIGHT,,,,, FIRM TO STIFF, 00000000,75187c427ab4625b11221711a681b5bf,42-372-25-3
42,372,,25,4,0.0,150.0,349.50,354.41,355.91,, NANNO MARL, 5G6/1-GREENISH GRAY," MOTTLED BY BURR OWS,SMALL DARKER MM LAMINAE", SLIGHT,,,,, FIRM, 00000000,ad68fd5a9eaf094148bcf429d5368d9d,42-372-25-4
42,372,,25,5,0.0,150.0,349.50,355.91,357.41,, FORAM NANNO MARL," 5B7/1-LIGHT BLUISH GRAY,5B5/1-M EDIUM BLUISH GRAY",," SLIGHT 0-73 CM,INTENSE BY SLUMPI NG OR DRILLING BELOW 95 CM",,,, VOID 73-80 CM," FIRM 0- 95 CM,SOFT BELOW 95 CM", 00000000,f13f2f574a4b29f88a3c8c6ce01b0840,42-372-25-5
42,372,,25,6,0.0,150.0,349.50,357.41,358.91,, FORAM NANNO MARL, 5B7/1-LIGHT BLUISH GRAY,, DISTU RBED BY DRILLING,,,,, SOFT, 00000000,759c4accbe9e05f8720db06528c21d31,42-372-25-6
42,372,,26,1,0.0,150.0,359.00,359.00,360.50,, FORAM NANNO MARL, 5B7/1-LIGHT BLUISH GRAY," MOTTL ED BY BURROWING,FEW DARKER MM LAMINAE", SLIGHT,,,,, STI FF, 00000000,90a92bcec338b38ac5847e6b917b21cc,42-372-26-1
42,372,,26,2,0.0,150.0,359.00,360.50,362.00,, FORAM NANNO MARL TO MARLSTONE, 5G6/1-GREENISH GRA Y," MOTTLED BY BURROWS,SMALLER DARK MM LAMINAE AT PL ACES", SLIGHT,,,,, STIFF TO HARD, 00000000,4611926fe54b39ff44dca46da152cbbe,42-372-26-2
42,372,,26,3,0.0,150.0,359.00,362.00,363.50,, NANNO MARL, 5G6/1-GREENISH GRAY," MOTTLED BY BURR OWING,DARKER MM LAMINAE AT SOME CM INTERSPACES,LAYER OF GYPSUM PYRITE BEARING SILT 72CM", SLIGHT,, GYPSU M PYRITE BEARING SILT 72 CM,,, FIRM, 00000000,1ed30e369b4900bfc5a3392c2a70647e,42-372-26-3
42,372,,26,4,0.0,150.0,359.00,363.50,365.00,, NANNO MARL, 5G6/1-GREENISH GRAY," MOTTLED BY BURR OWING,SOME DARKER LAMINAE 107-108CM", SLIGHT,,,,, FIRM, 00000000,9705faf3c5d92fac00449e1da198b072,42-372-26-4
42,372,,26,5,0.0,150.0,359.00,365.00,366.50,, NANNO MARL, 5B7/1-LIGHT BLUISH GRAY, MOTTLED BY BURROWS ABOVE 33 CM," SLIGHT ABOVE 33 CM,INTENSE BY DRILLING OR SLUMPING BELOW 33 CM",,,,," FIRM ABOVE 33 CM, SOFT BELOW 33 CM", 00000000,eeb75d01bbd382dbff381265f6f57237,42-372-26-5
42,372,,27,1,109.0,150.0,368.50,369.59,370.00,, NANNO MARLSTONE," 5B7/1-LIGHT BLUISH GRAY,5G6/1-GR EENISH GRAY", MOTTLED BY BURROWING, SLIGHT,,,,, STIFF TO HARD, 00000000,02115c70439e4ca59e42f89b46e5d3e0,42-372-27-1
42,372,,27,2,0.0,150.0,368.50,370.00,371.50,, FORAM NANNO MARLSTONE, 5G6/1-GREENISH GRAY," MOTT LED BY INTENSE BURROWING,SOME SMALL DEFORMED DARK LA MINAE", SLIGHT,,, ZOOPHYCUS,, STIFF TO HARD, 00000000,7e4c594c0e5d9ce07f2358954f9d8733,42-372-27-2
42,372,,27,3,0.0,150.0,368.50,371.50,373.00,, NANNO MARL TO MARLSTONE," 5B7/1-LIGHT BLUISH GRAY, 5G6/1-GREENISH GRAY"," MOTTLED BY BURROWING,SOME DARK ER MM LAMINAE IN MIDDLE PART OF CORE", SLIGHT,,,, LARG E BURROW 141 CM, FIRM SOME HARDER LAYERS, 00000000,de98f77f8e66752ff44f2e9c3d07f3a2,42-372-27-3
42,372,,27,4,0.0,150.0,368.50,373.00,374.50,, FORAM NANNO MARL," 5G6/1-GREENISH GRAY,5G8/1-LIGHT GREENISH GRAY", MOTTLED BY BURROWING, NONE TO SLIG HT,,,,, FIRM, 00000000,a9f116d57476323a34178f297e97d20b,42-372-27-4
42,372,,27,5,0.0,150.0,368.50,374.50,376.00,, FORAM NANNO MARL, 5G6/1-GREENISH GRAY," MOTTLED B Y BURROWING,SOME DARKER MM LAMINAE"," SLIGHT,SLIGHTLY BRECCIATED IN PLACES",,,,, FIRM, 00000000,8a86657d2894b87cb5329f9444b2381b,42-372-27-5
42,372,,28,1,61.0,150.0,378.00,378.61,379.50,, FORAM NANNO MARL," 5B7/1-LIGHT BLUISH GRAY,5G6/1-G REENISH GRAY", MOTTLED BY BURROWING BELOW 87 CM," BR ECCIATED BY DRILLING 62-80 CM,INTENSE 80-87 CM,SLIGH T TO NONE 87-150 CM",,,," LIGHT BLUISH GRAY 80-87 CM,GRE ENISH GRAY BELOW 87 CM", SOFT*,,38c6607a675a180c1a4b4132d0cbd59a,42-372-28-1
42,372,,28,2,0.0,150.0,378.00,379.50,381.00,, NANNO MARL, 5G6/1-GREENISH GRAY, MOTTLED BY BURR OWS, NONE,,,, VOID 55-70 CM," SOFT 30-35 CM BROKEN UP BY DRILLING,STIFF TO HARD", 00000000,6b9c823fc1da4bc78088fdf2e6a76c2a,42-372-28-2
42,372,,28,3,0.0,150.0,378.00,381.00,382.50,, NANNO MARL, 5G6/1-GREENISH GRAY, MOTTLED BY INTE NSE BURROWING, NONE,,,,, FIRM, 00000000,585b8738a659545d5ae4e5d815ca4f78,42-372-28-3
42,372,,28,4,0.0,150.0,378.00,382.50,384.00,, FORAM NANNO MARL, 5G6/1-GREENISH GRAY, MOTTLED B Y INTENSE BURROWING, NONE,,,,, STIFF, 00000000,dd3790cb9d0fd30079d28848790d5dd4,42-372-28-4
42,372,,28,5,0.0,150.0,378.00,384.00,385.50,, FORAM NANNO MARL, 5G6/1-GREENISH GRAY, MOTTLED B Y INTENSE BURROWING, SLIGHT,,, ZOOPHYCUS,, FIRM TO S TIFF, 00000000,c4a49b48211523bc149222f97fa6a991,42-372-28-5
42,372,,28,6,0.0,150.0,378.00,385.50,387.00,, FORAM NANNO MARLSTONE, 5G6/1-GREENISH GRAY, MOTT LED BY INTENSE BURROWING ZOOPHYCUS, NONE,,,,, STIFF TO HARD, 00000000,f0cf2e37a81d74b270b6829fce6f3571,42-372-28-6
42,372,,29,1,52.0,150.0,387.50,388.02,389.00,, FORAM NANNO MARL TO MARLSTONE, 5G6/1-GREENISH GRA Y, MOTTLED BY BURROWING, NONE,,,,, FIRM, 00000000,7c99642021995b0a3b4e1af94c290014,42-372-29-1
42,372,,29,2,0.0,150.0,387.50,389.00,390.50,, FORAM NANNO MARL TO MARLSTONE, 5G6/1-GREENISH GRA Y, MOTTLED BY INTENSE BURROWING, NONE,,, LOCALLY SCATTERED FINE MOLLUSK SH ELLS, SMALL MOLL USK SHELLS 94 CM, FIRM TO HARD, 00000000,3cb0c75aa6d176d33043f4f08e70b495,42-372-29-2
42,372,,29,3,0.0,150.0,387.50,390.50,392.00,, FORAM NANNO MARL TO MARLSTONE, 5G6/1-GREENISH GRA Y, MOTTLED, NONE,,, MOLLUSK SHELLS, LAYER OF MOLLU SK SHELLS AT 23 CM, STIFF TO HARD, 00000000,aaecc544a0f16eb1cd3bf7b98d0873ff,42-372-29-3
42,372,,29,4,0.0,150.0,387.50,392.00,393.50,, NANNO MARL TO MARLSTONE," 5G6/1-GREENISH GRAY,5G4/ 1-DARK GREENISH GRAY", MOTTLED BY BURROWING, NONE,,,, PASSING FROM GREENISH GRAY AT TOP OF CORE GRADUALLY INTO DARK GREENISH GRAY," HARD,STIFF", 00000000,7a92327e18f5d0e898ebfb585da9ffd4,42-372-29-4
42,372,,29,5,0.0,150.0,387.50,393.50,395.00,, NANNO MARLSTONE, 5G6/1-GREENISH GRAY," MOTTLED BY INTENSE BURROWING,VERY FEW DARKER LAMINAE", SLIGHT TO MINIMAL,,,,, HARD, 00000000,d8c4cfa4eaec1ab4a95f48a8fd8686ce,42-372-29-5
42,372,,30,1,135.0,150.0,397.00,398.35,398.50,, NANNO MARLSTONE, 5G6/1-GREENISH GRAY, MOTTLED BY BURROWS, NONE,,,,, HARD, 00000000,cf3305decece63d286f1c95009dc7a49,42-372-30-1
42,372,,30,2,0.0,150.0,397.00,398.50,400.00,, FORAM NANNO MARL, -GREENISH," MOTTLE BY INTENSE B URROWING,INTERBEDDED FAINT DARKER LAMINAE", SLIGHT,,,,, FIRM, 00000000,cc70cfb44d253f30cc3b32febfd80ea5,42-372-30-2
42,372,,30,3,0.0,150.0,397.00,400.00,401.50,, FORAM NANNO MARL TO MARLSTONE, 5G6/1-GREENISH GRA Y, MOTTLED BY INTENSE BURROWING, NONE,,,,, FIRM TO HA RD, 00000000,4f1161c90a7a259ff66ec1c8c9d4f610,42-372-30-3
42,372,,30,4,0.0,150.0,397.00,401.50,403.00,, FORAM NANNO MARL TO MARLSTONE," 5G6/1-GREENISH GRA Y,5Y5/2-LIGHT OLIVE GRAY", MOTTLED BY BURROWS, SLIG HT TO NONE,,,, LIGHT OLIVE GRAY IN SOME BURROWS, FIRM TO HARD, 00000000,42f8ae1b3985715ffa0623d3ae01a03a,42-372-30-4
42,372,,30,5,0.0,150.0,397.00,403.00,404.50,, FORAM NANNO MARLSTONE, 5G6/1-GREENISH GRAY, MOTT LED BY INTENSE BURROWING, NONE,,,,, HARD, 00000000,5550f123f46d0e0fbcf470f910b26535,42-372-30-5
42,372,,30,6,0.0,150.0,397.00,404.50,406.00,, FORAM NANNO MARL, 5G6/1-GREENISH GRAY," MOTTLED B Y BURROWS,SOME DARK MM LAMINAE", SLIGHT,,,,, FIRM, 00000000,d011477333132c15e397641927c156d3,42-372-30-6
42,372,,31,1,76.0,150.0,416.00,416.76,417.50,, FORAM NANNO MARLSTONE," 5G6/1-GREENISH GRAY,N5-MED IUM GRAY", MOTTLED BY BURROWS, NONE,,,, BURROWS ARE M EDIUM GRAY, HARD, 00000000,65120c6b0456633b1e6d335153b5013a,42-372-31-1
42,372,,31,2,0.0,150.0,416.00,417.50,419.00,, FORAM NANNO MARL, 5G6/1-GREENISH GRAY, MOTTLED B Y BURROWING, NONE TO SLIGHT 23-50 CM,,,,, STIFF, 00000000,0e41b1b43392d7a83d03c701ebac90fc,42-372-31-2
42,372,,31,3,0.0,150.0,416.00,419.00,420.50,, FORAM NANNO MARL TO MARLSTONE, 5G6/1-GREENISH GRA Y, MOTTLED BY BURROWS, NONE,,,,, STIFF, 00000000,773618411e2d482b4747e4ff72248acd,42-372-31-3
42,372,,31,4,0.0,150.0,416.00,420.50,422.00,, FORAM NANNO MARLSTONE," 5G6/1-GREENISH GRAY,5GY5/2 -DUSKY YELLOW GREEN,-GRAYISH RED PURPLE", INTENSELY BURROWED ZOOPHYCUS, NONE,,,, SOME BURROWS ARE GRAYISH RED PURPLE, HARD, 00000000,c8a86369385a1d46519358757d3b1a3c,42-372-31-4
42,372,,31,5,0.0,150.0,416.00,422.00,423.50,, NANNO FORAM MARLSTONE, 5G6/1-GREENISH GRAY, MOTT LED BY INTENSE BURROWING, NONE,, PYRITIZED BURROWS,,, HARD, 00000000,af64c24e2bf37c24bb4fb658a019f86f,42-372-31-5
42,372,,31,6,0.0,150.0,416.00,423.50,425.00,, NANNO FORAM MARLSTONE," 5G6/1-GREENISH GRAY,5GY5/2 -DUSKY YELLOW,5Y5/2-LIGHT OLIVE GRAY", MOTTLED BURROWS 0- 70 AND 96-150 CM," NONE 0-108 CM ,SLIGHTLY BRECCIATED 108-150 CM",,, ZOOPHYCUS," GREENISH GRAY 0-70 CM ,GREENISH GRAY MOTTLED WITH DUSKY YELLOW GREEN AND L IGHT OLIVE GRAY 70-96 CM,GREENISH GRAY 96-150 CM,WEL L PRESERVED ZOOPHYCUS IN SOFT MARL"," HARD,SOFT LAYER FROM 93-96 CM,SOME SOFT LAYERS FROM 108-150 CM", 00000000,13f07adca2f290c43b2c516da127dd69,42-372-31-6
42,372,,32,0,0.0,43.0,435.00,435.00,435.43,, NANNO FORAM MARLSTONE," 5G6/1-GREENISH GRAY,5G/21- GREENISH BLACK", MOTTLED BY BURROWS," BRECCIATED 0-1 6 CM,NONE 16-43 CM",,,,, HARD, 00000000,694c30537c5901648324378b827e6c10,42-372-32-0
42,372,,32,1,0.0,150.0,435.00,435.43,436.93,, NANNO FORAM MARLSTONE," 5G6/1-GREENISH GRAY,5Y6/4- DUSKY YELLOW,5Y5/6-LIGHT OLIVE BROWN,N4-MEDIUM GRAY", MOTTLED BY BURROWS ZOOPHYCUS, NONE,,,, BURROWS AR E DUSKY YELLOW LIGHT OLIVE BROWN AND MEDIUM GRAY, H ARD, 00000000,e28662f8b0d928dd31a85c8a9ab6156e,42-372-32-1
42,372,,32,2,0.0,150.0,435.00,436.93,438.43,, NANNO FORAM MARLSTONE," 5G6/1-GREENISH GRAY,5Y5/6- LIGHT OLIVE BROWN", MOTTLED WITH BURROWS, NONE,,,, BU RROWS ARE LIGHT OLIVE BROWN, HARD, 00000000,be64933d34cb60eb72eb7e6f50957026,42-372-32-2
42,372,,32,3,0.0,150.0,435.00,438.43,439.93,, NANNO FORAM MARLSTONE, 5G6/1-GREENISH GRAY, MOTT LED BY BURROWING ZOOPHYC US 96 CM," NONE,LOCALLY BRECCIATED",,,,, FIRM TO HARD, 00000000,dceb721df498e774dcccc6175f3e936d,42-372-32-3
42,372,,32,4,0.0,150.0,435.00,439.93,441.43,, FORAM NANNO MARLSTONE," 5G6/1-GREENISH GRAY,5GY5/2 -DUSKY YELLOW GREEN,5B7/1-LIGHT BLUISH GRAY", STRONG LY MOTTLED BY INTENSE BURROWING, NONE,,,, BURROWS ARE DUSKY YELLOW GREEN AND LIGHT BLUISH GRAY, HARD, 00000000,23e18a63b3814344fcdafdaec19a1ba4,42-372-32-4
42,372,,32,5,0.0,150.0,435.00,441.43,442.93,, NANNO MARLSTONE," 5G6/1-GREENISH GRAY,5GY5/2-DUSKY YELLOW GREEN,5GY7/2-GRAYISH YELLOW GREEN,5Y5/2-LIG HT OLIVE GRAY", ABUNDANT BURROWS, NONE,,," ZOOPHYCUS, PLANOLITES", BURROWS ARE DUSKY YELLOW GREEN GRAYISH YELLOW GREEN AND LIGHT OLIVE GRAY, HARD, 00000000,48482520ab1b1a1da8dfe3233d4eaa2e,42-372-32-5
42,372,,32,6,0.0,150.0,435.00,442.93,444.43,, FORAM NANNO MARL, 5G6/1-GREENISH GRAY, MOTTLED B Y BURROWING," NONE,SLIGHTLY 98-110 CM,BRECCIATED 45- 60 CM",,,,, HARD, 00000000,3161ae3149238af0dd3ca4d97f3dbb53,42-372-32-6
42,372,,33,0,0.0,40.0,463.50,463.50,463.90,, NANNO MARLSTONE, 5G6/1-GREENISH GRAY, MOTTLED BY BURROWS, NONE,,,,, HARD, 00000000,349137f046480579f2ed6ad62a25c570,42-372-33-0
42,372,,33,1,0.0,150.0,463.50,463.90,465.40,, NANNO MARLSTONE, 5GY6/1-GREENISH GRAY, MOTTLED B Y BURROWS, NONE,,,,, HARD, 00000000,8395d8b9dca8e6a0614c23fff2101011,42-372-33-1
42,372,,33,2,0.0,150.0,463.50,465.40,466.90,, FORAM NANNO MARLSTONE," 5G6/1-GREENISH GRAY,5B7/1- LIGHT BLUISH GRAY,5B5/1-MEDIUM BLUISH GRAY", MOTTLED WITH BURROWS ZOOPHYCUS, NONE,,,," SOME BURROWS MEDIUM BLUISH GR AY,BURROWS INCLUDE ZOOPHYCUS,SOME LARGE BURROWS 1 CM", HARD, 00000000,79cd93286416c1af559cfc5b628e96de,42-372-33-2
42,372,,33,3,0.0,150.0,463.50,466.90,468.40,, NANNO MARLSTONE," 5G6/1-GREENISH GRAY,5GY7/2-GRAYI SH YELLOW GREEN,N5-MEDIUM GRAY,5B5/1-MEDIUM BLUISH G RAY", MOTTLING FROM GREAT VARIETY OF BURROWS," NONE, BROKEN IN FRAGMENTS 30-40 AND 60-70 CM",,,,, HARD, 00000000,bab7065d2b611ef4d8d1f813501863d5,42-372-33-3
42,372,,33,4,0.0,150.0,463.50,468.40,469.90,, NANNO MARLSTONE," 5B5/1-MEDIUM BLUISH GREEN,5G6/1- GREENISH GRAY,5GY7/2-GRAYISH YELLOW GREEN", MOTTLED BY BURROWS ZOOPHYCUS, NONE,,, PLANOLITES, BURROWS ARE SOMEWHAT COMPACTED, HARD, 00000000,22c377dcac899785960f3e789b179a14,42-372-33-4
42,372,,33,5,0.0,150.0,463.50,469.90,471.40,, NANNO MARLSTONE," 5B5/1-MEDIUM BLUISH GRAY,5G6/1-G REENISH GRAY,10Y4/2-GRAYISH OLIVE", FAINT MOTTLING B Y INTENSE BURROWING," NONE,SOME BREAKING BY DRILLING 38-72 CM",,,, GEOCHEMICAL SAMPLE 140-150 CM, HARD, 00000000,de66666bf94638b4d7dbf847c5eeb854,42-372-33-5
42,372,,33,6,0.0,150.0,463.50,471.40,472.90,, NANNO BEARING VOLCANIC CLAYSTONE, 5G4/1-DARK GREE NISH GRAY, FEW FAINT BURROWS, SOME BREAKING BY DRI LLING,,,,, HARD, 00000000,c49d731deb3f8b9e61dac55f39f62ba0,42-372-33-6
42,372,,34,1,93.0,150.0,492.00,492.93,493.50,, NANNO BEARING VOLCANIC CLAYSTONE," 5GY2/1-DARK GRE ENISH GRAY,5G2/1-GREENISH BLACK",, NONE,,,, GREENISH BL ACK MOTTLING IS SMALL FINE COMPACTED BURROWS, HARD, 00000000,57a76228dd99f40b359b250f1659df16,42-372-34-1
42,372,,34,2,3.0,150.0,492.00,493.53,495.00,, NANNO BEARING VOLCANIC CLAYSTONE," 5GY4/1-DARK GRE ENISH GRAY,5GY2/1-GREENISH BLACK",, NONE,,,, GREENISH B LACK MOTTLING FROM ABUNDANT COMPACTED BURROWS, HARD, 00000000,48822cf361617df50f8baa8803f45735,42-372-34-2
42,372,,34,3,0.0,150.0,492.00,495.00,496.50,, VOLCANIC CLAYSTONE," 5GY4/1-DARK GREENISH GRAY,5GY 4/1-GRAYISH OLIVE GREEN",, NONE,,,, MOTTLED BY FLATTENE D BURROWS," HARD 0-112 AND 139-150 CM,STIFF TO HARD 112-139 CM", 00000000,1340c68c7b9f97111dd4fd5dd97a6ff4,42-372-34-3
42,372,,34,4,0.0,150.0,492.00,496.50,498.00,, NANNO BEARING VOLCANIC CLAYSTONE," 5GY4/1-DARK GRE ENISH GRAY,5GY5/2-DUSKY YELLOW GREEN", MOTTLED BY BU RROWING," GENERALLY NON E,A FEW ZONES OF INTENSE DEFORMATION",,,,, HARD, 00000000,af6d9b7ddafabfc9ff0179b4d8c32b8a,42-372-34-4
42,372,,34,5,0.0,150.0,492.00,498.00,499.50,, NANNO BEARING VOLCANIC CLAYSTONE, 5GY4/1-DARK GRE ENISH GRAY, FAINT MOTTLING BY BURROWING, GENERALLY NONE LOCALLY INTENSE,,,, SOFT IN DISTURBED ZONES," FIRM TO HARD 0-32 CM,HARD 32 -150 CM", 00000000,1c48596a53a033dd20058c30bb3c6f0e,42-372-34-5
42,372,,35,1,74.0,150.0,529.00,529.74,530.50,, MARLSTONE," 5G4/1-DARK GREENISH GRAY,10Y4/2-GRAYIS H OLIVE,5GY3/2-GRAYISH OLIVE GREEN", MOTTLED BY BURROWS, NONE,,,, BURROWS ARE GRAYISH OLIVE GREEN, HARD, 00000000,20226c5adcfb5facb88a64f9976d9713,42-372-35-1
42,372,,35,2,0.0,150.0,529.00,530.50,532.00,, NANNO BEARING VOLCANIC CLAYSTONE," 5G4/1-DARK GREE NISH GRAY,5B5/1-MEDIUM BLUISH GRAY", FAINT MOTTLING BY INTENSE BURROWING, BROKEN INTO FRAGMENTS OF DRIL LING,,,, GEOCHEMICAL SAMPLE 141-150 CM, HARD, 00000000,1b878fbe0bd67c426b5862905f151bd4,42-372-35-2
42,372,,35,3,0.0,150.0,529.00,532.00,533.50,, NANNO BEARING VOLCANIC CLAYSTONE, 5GY4/1-DARK GRE ENISH GRAY, FAINT MOTTLING BY BURROWING, BRECCIATE D FROM 0-48 83-86 AND 149-150 CM,,,, BURROWS COMPACT, HARD, 00000000,c5e25a9fc9c439bbf33972e080d42452,42-372-35-3
42,372,,36,0,0.0,42.0,568.00,568.00,568.42,, NANNO BEARING VOLCANIC CLAYSTONE, 5GY4/1-DARK GRE ENISH GRAY, FAINTLY MOTTLED BY INTENSE BIOTURBATION," NONE 0-34 CM,BRECCIATED 34-42 CM",,,,, HARD, 12231210.3450,b68e29a9d5482c2f4ceb05bef3e31099,42-372-36-0
42,372,,36,1,0.0,150.0,568.00,568.42,569.92,, NANNO BEARING VOLCANIC CLAYSTONE," 5G4/1-DARK GREE NISH GRAY,5GY3/2-GRAYISH OLIVE GREEN", MOTTLING FROM INTENSE BURROWING," NONE 0-31 46-78 AND 90-150 CM,B RECCIATED 31-46 AND 78-90 CM",,,,, HARD, 00000000,e1314672ddbafd12705f9769d9311639,42-372-36-1
42,372,,36,2,0.0,150.0,568.00,569.92,571.42,, NANNO BEARING VOLCANIC CLAYSTONE, 5GY4/1-DARK GRE ENISH GRAY, FAINT MOTTLING FROM BURROWING, NONE EX CEPT SLIGHT BRECCIATION 12-37 CM,,,,, HARD, 00000000,09d951692896d953b16703af3fd1546c,42-372-36-2
42,372,,36,3,0.0,150.0,568.00,571.42,572.92,, NANNO BEARING VOLCANIC MUDSTONE," 5GY4/1-DARK GREE NISH GRAY,5Y3/2-OLIVE GRAY", FAINT MOTTLING BY COMPA CTED BURROWS, NONE,,,,, HARD, 00000000,8e49ce8eb20b0185e4547e15f4b61f24,42-372-36-3
42,372,,36,4,0.0,150.0,568.00,572.92,574.42,, NANNO BEARING VOLCANIC MUDSTONE," 5GY4/1-DARK GREE NISH GRAY,10Y4/2-GRAYISH OLIVE", FAINT MOTTLING FROM BURROWING, NONE,,,, BURROWS COMPACTED, HARD, 00000000,24ff5798fafad3f8743905cb4ef6fc93,42-372-36-4
42,372,,36,5,0.0,150.0,568.00,574.42,575.92,, NANNO BEARING VOLCANIC MUDSTONE, 5GY4/1-DARK GREE NISH GRAY, FAINT MOTTLING FROM INTENSE BIOTURBATION, NONE EXCEPT BRECCIATED 22-32 CM,,,, GEOCHEMICAL SAM PLE 142-150 CM, HARD, 33233000.3450,c0d24b765f1a266d0f6e066ca262dc92,42-372-36-5
42,372,,36,6,0.0,150.0,568.00,575.92,577.42,, NANNO BEARING VOLCANIC MUDSTONE, 5GY4/1-DARK GREE NISH GRAY, VERY FAINT MOTTLING BY BURROWS, NONE EX CEPT BRECCIATION 53-64 80-90 AND 105-111 CM,,,,, HARD, 00000000,49688bb180aa5bfd72c430572b241595,42-372-36-6
42,372,,37,1,80.0,150.,606.00,606.80,607.50,, NANNO BEARING VOLCANIC MUDSTONE," 5GY4/1-DARK GREE NISH GRAY,10Y4/2-GRAYISH OLIVE", FAINTLY MOTTLED BY ABUNDANT COMPACTED BURROWS, NONE,,,,, HARD, 00000000,faf57af705b2b095e7454513d052c161,42-372-37-1
42,372,,37,2,0.0,150.0,606.00,607.50,609.00,, NANNO BEARING VOLCANIC MUDSTONE, 5GY4/1-DARK GREE NISH GRAY, FAINTLY MOTTLED FROM INTENSE BURROWING, NONE,,,, BURROWS COMPACTED, HARD, 00000000,150c20b33dff55e0e1260ecd5323c7a0,42-372-37-2
42,372,,37,3,0.0,150.0,606.00,609.00,610.50,, NANNO BEARING VOLCANIC MUDSTONE, 5GY4/1-DARK GREE NISH GRAY, MOTTLED BY BURROWS, NONE EXCEPT FOR BRE AKING UP OF PARALLEL BEDS 70-95 CM,,,," FAINT BUT CLEAR MOTTLING WITH RECOGNIZABLE BURROWS 0-60,VERY FAINT MOTTLING BY COMPACTED BURROWS,SOME SOFT INTERVALS OF MARL BETWEEN BROKEN UP FRAGMENTS", HARD, 00000000,02778c36aab8693cc8ad8041360a343a,42-372-37-3
42,372,,37,4,0.0,150.0,606.00,610.50,612.00,, MARLSTONE," 5GY4/1-DARK GREENISH GRAY,5GY2/1-GREEN ISH BLACK",," NONE 0-30 CM,BROKEN INTO FRAGMENTS PARAL LEL BEDDING NO INTERNAL DEFORMATION 30-85 CM,DRILLIN G BRECCIA HARD FRAGMENTS INTERNALLY NOT DEFORMED 85- 100 CM,BROKEN FRAGMENTS SET IN MATRIX OF SOFT MARL",,,,, HARD, 00000000,d2ff0a569c3deb4be285a47d7ac3fa01,42-372-37-4
42,372,,38,0,0.0,37.0,644.00,644.00,644.37,, VOLCANIC MUDSTONE, 10Y4/2-GRAYISH OLIVE, FAINTLY MOTTLED BY INTENSE BURROWING, NONE,,,, BURROWS COMPA CTED, HARD, 12231110.3450,b2dad0f8a7cafd09232f4c962e47cbb6,42-372-38-0
42,372,,38,1,0.0,150.0,644.00,644.37,645.87,, VOLCANIC MUDSTONE," 5GY4/1-DARK GREENISH GRAY,10Y4 /2-GRAYISH OLIVE", MOTTLED BY COMPACTED BURROWS, NO NE,,,,, HARD, 00000000,be17161c3719405f6fb2b0af27a454fd,42-372-38-1
42,372,,38,2,0.0,150.0,644.00,645.87,647.37,, VOLCANIC MUDSTONE," 5GY3/2-GRAYISH OLIVE GREEN,10Y 4/2-GRAYISH OLIVE", MOTTLED BY INTENSE BURROWING, N ONE,,,,, HARD, 00000000,f2737a67e0e6aba61373d08c8cd59ae2,42-372-38-2
42,372,,38,3,0.0,150.0,644.00,647.37,648.87,, VOLCANIC MUDSTONE, -DARK GREENISH GRAY, MOTTLED BY BURROWS," NONE,BRECCIATED 87-105 CM",,,, GEOCHEMICAL SAMPLE 140-150 CM, HARD, 00000000,d2b1c8c8196add66dcc48728d336e2ae,42-372-38-3
42,372,,38,4,0.0,150.0,644.00,648.87,650.37,, VOLCANIC MUDSTONE," 5GY3/2-GRAYISH OLIVE GREEN,10Y 4/2-GRAYISH OLIVE", MOTTLED BY INTENSE BURROWING, N ONE,,,,, HARD, 00000000,6a72193df6f17540341e1e047f6ca0b7,42-372-38-4
42,372,,38,5,0.0,150.0,644.00,650.37,651.87,, VOLCANIC MUDSTONE," 5GY4/1-DARK GREENISH GRAY,10Y4 /2-GRAYISH OLIVE", FAINTLY MOTTLED BY BURROWS, NONE,,,, BURROWS COMPACTED, HARD, 00000000,e05bdcc4878f0f2cb7c12a99f0bf1e89,42-372-38-5
42,372,,38,6,0.0,150.0,644.00,651.87,653.37,, VOLCANIC MUDSTONE, 5GY4/1-DARK GREENISH GRAY, FI NELY MOTTLED BY BURROWING, NONE EXCEPT BRECCIATION 71-77 CM AND AT BASE,, PYRITE,, BURROWS COMPACTED, HARD, 00000000,193c4f14a98511b4b46871d5ac95fcea,42-372-38-6
42,372,,39,0,0.0,40.0,682.00,682.00,682.40,, VOLCANIC MUDSTONE," 10Y4/2-GRAYISH OLIVE,5Y3/2-OLI VE GRAY", FAINT MOTTLING BY INTENSE BURROWING, NONE,,,, BURROWS COMPACTED, HARD, 00000000,c2b733916160a9819f436172c7115142,42-372-39-0
42,372,,39,1,0.0,150.0,682.00,682.40,683.90,, VOLCANIC MUDSTONE," 5GY4/1-DARK GREENISH GRAY,10Y4 /2-GRAYISH OLIVE", FAINTLY MOTTLED WITH BURROWS 0-10 3 CM," NONE 0-103 CM,SLIGHT 103-123.5 CM AND 125.5-1 50 CM,BRECCIATED 123.5-125.5",,,," BURROWS COMPACTED,MOR E MARLY 103-150 CM DARK GREENISH GRAY,DARK GREENISH GRAY TO GRAYISH OLIVE 0-103 CM"," HARD MARLSTONE 0-10 3 CM,STIFF TO HARD MARL TO MARLSTONE 103-150 CM", 00000000,26a751f5c512f92add8b4d57b1fa26d6,42-372-39-1
42,372,,39,2,0.0,150.0,682.00,683.90,685.40,, VOLCANIC MUDSTONE, 5GY4/1-DARK GREENISH GRAY TO 1 0Y4/2-GRAYISH OLIVE, FAINT MOTTLING FROM MODERATE B URROWING, NONE EXCEPT FOR BRECCIATED AREAS 3-10.5 C M 19-25 CM 74-77 CM AND 92-150 CM,,,, BURROWS COMPACTE D, HARD, 00000000,6043c752ad4d2e1888699fbc45a54cde,42-372-39-2
42,372,,39,3,0.0,150.0,682.00,685.40,686.90,, VOLCANIC MUDSTONE," 5GY4/1-DARK GREENISH GRAY,10Y4 /2-GRAYISH OLIVE", FAINT MOTTLING FROM INTENSE BURRO WING," BRECCIATED 0-13 CM,NONE 13-150 CM",,,, BURROWS C OMPACTED, HARD, 00000000,81e64a5ae04749d3d477972e14fd54f6,42-372-39-3
42,372,,39,4,0.0,150.0,682.00,686.90,688.40,, VOLCANIC MUDSTONE," 5GY4/1-DARK GREENISH GRAY,5GY3 /2-GRAYISH OLIVE GREEN", FAINTLY MOTTLED BY INTENSE BURROWING," NONE 0-83 CM,BRECCIATED BY DRILLING 83-1 50 CM",,,, BURROWS COMPACTED, HARD, 00000000,e0d1f01239e55b722c6f0540a59a59c1,42-372-39-4
42,372,,39,5,0.0,150.0,682.00,688.40,689.90,, VOLCANIC MUDSTONE," 5GY4/1-DARK GREENISH GRAY,10Y4 /2-GRAYISH OLIVE",," NONE,BRECCIATED BY DRILLING 105-1 19 CM",,,,, HARD, 00000000,6e4a234324c95f1ed39edc5a6c2edecc,42-372-39-5
42,372,,39,6,0.0,150.0,682.00,689.90,691.40,, VOLCANIC MUDSTONE, 5GY4/1-DARK GREENISH GRAY TO 5 GY3/2-GRAYISH OLIVE GREEN, FAINT MOTTLING FROM BURR OWING, NONE EXCEPT BRECCIATION FROM 96.5-101 CM 112 -113 CM AND 147-150 CM,,,, BURROWS COMPACTED, HARD, 00000000,5635dfc6fdde0ef10b0d1af1940476f3,42-372-39-6
42,372,,40,1,94.0,150.0,720.00,720.94,721.50,, VOLCANIC MUDSTONE, 10Y4/2-GRAYISH OLIVE, FAINT M OTTLING BY BURROWING, NONE,,,, BURROWS COMPACTED, HA RD, 00000000,c22153c2ba6e0bad01e280aaef9d0337,42-372-40-1
42,372,,40,2,1.0,150.0,720.00,721.51,723.00,, VOLCANIC MUDSTONE, 10Y4/2-GRAYISH OLIVE, FAINTLY MOTTLED BY INTENSE BURROWING, NONE,,,, BURROWS COMPA CTED, HARD, 00000000,5a5dc439765acd9d093361a4765b3306,42-372-40-2
