60,453,,41,3,0.0,15.0,379.50,382.50,382.65,PK, MUDSTONE, GREENISH GREY, LAMINAE, UNDEFORMED*,,,,, HARD, 33233000
60,453,,41,3,15.0,35.0,379.50,382.65,382.85,PK, SILTY MUDSTONE, GREENISH GREY, LAMINAE, UNDEFORMED*,,,,, HARD, 33233000
60,453,,41,3,35.0,53.0,379.50,382.85,383.03,PK, VERY FINE SAND, GREENISH GREY," LAMINAE,CROSS BEDDING", UNDEFORMED*,, VOLCANIC GLASS,,, SOFT TO FIRM, 33214000
60,453,,41,3,53.0,150.0,379.50,383.03,384.00,PK, MUDSTONE, DUSKY GREEN," BURROWS,LAMINAE", UNDEFORMED*,,,,, HARD, 33233000
60,453,,41,4,0.0,150.0,379.50,384.00,385.50,PK," MUDSTONE,SILTY MUDSTONE", GREENISH GREY," BURROWS,BANDING,LAMINAE", UNDEFORMED*,,,,, HARD, 33233000
60,453,,41,5,0.0,150.0,379.50,385.50,387.00,PK," MUDSTONE,SILTY MUDSTONE", GREENISH GREY," LAMINAE,BURROWS,BEDDING", UNDEFORMED*,,,,, HARD, 33233000
60,453,,41,CC,9.0,14.0,379.50,387.09,387.14,PK, MUDSTONE, GREENISH GREY*,,,,,,, HARD, 33233000
60,453,,42,1,0.0,108.0,389.00,389.00,390.08,PK, ZEOLITIC VITRIC MUDSTONE, GREENISH GREY," LAMINAE,CROSS BEDDING", UNDEFORMED*,, ZEOLITES,,, HARD,
60,453,,42,1,108.0,129.0,389.00,390.08,390.29,PK, VERY FINE SANDSTONE, OLIVE GREY TO GREENISH GREY, CROSS BEDDING, UNDEFORMED*,,,,, HARD, 33234000
60,453,,42,1,129.0,150.0,389.00,390.29,390.50,PK, VERY FINE TO FINE SAND, GREENISH GREY, LAMINAE, UNDEFORMED*,, ZEOLITES,,, SOFT TO FIRM,
60,453,,42,2,0.0,25.0,389.00,390.50,390.75,PK, FINE TO MEDIUM SAND, DARK GREY, LAMINAE, UNDEFORMED*,, ZEOLITES,,, SOFT TO FIRM,
60,453,,42,2,25.0,65.0,389.00,390.75,391.15,PK, MUDSTONE, DARK GREY, LAMINAE, UNDEFORMED*,,,,, HARD, 33233000
60,453,,42,2,65.0,79.0,389.00,391.15,391.29,PK, GRADED SILT TO FINE SAND, DARK GREY,, UNDEFORMED*,,,,, HARD, 33214000
60,453,,42,2,79.0,105.0,389.00,391.29,391.55,PK, SILTY MUD TO SILTSTONE, DARK GREY," LAMINAE,BANDING", UNDEFORMED*,,,,, HARD, 33213000
60,453,,42,2,105.0,128.0,389.00,391.55,391.78,PK, SILTY TO VERY FINE SAND, DARK GREY,, UNDEFORMED*,,,,, SOFT TO FIRM, 33214000
60,453,,42,2,128.0,132.0,389.00,391.78,391.82,PK, MUDSTONE, GRAYISH GREEN, BURROWS, UNDEFORMED*,,,,, HARD,
60,453,,42,CC,0.0,25.0,389.00,391.92,392.07,PK, MUDSTONE, GRAYISH GREEN, BURROWS, UNDEFORMED*,, ZEOLITES,,, HARD,
60,453,,43,1,0.0,150.0,398.50,398.50,400.00,PK," MUDSTONE,SILTSTONE,VERY FINE SANDSTONE",,, GREATLY DEFORMED*,,,,, HARD, 33233000
60,453,,43,2,0.0,150.0,398.50,400.00,401.50,PK," MUDSTONE,SILTSTONE,SANDSTONE",,, GREATLY DEFORMED*,,,,, HARD, 33233000
60,453,,43,3,0.0,15.0,398.50,401.50,401.65,PK," MUDSTONE,SILTSTONE,SANDSTONE",,, GREATLY DEFORMED*,,,,, HARD, 33233000
60,453,,43,3,15.0,28.0,398.50,401.65,401.78,PK, SILT TO VERY FIRM SAND, GREENISH GREY, BURROWS*,,,,,, SOFT TO FIRM, 33214000
60,453,,43,3,28.0,37.0,398.50,401.78,401.87,PK, MUDSTONE, DARK GREENISH GREY*,,,,,,, HARD, 33233000
60,453,,43,CC,0.0,75.0,398.50,402.20,402.85,PK, MUDSTONE,,, GREATLY DEFORMED*,,,,, HARD, 33233000
60,453,,44,1,0.0,140.0,408.00,408.00,409.40,PK, MUDSTONE, GREENISH GREY," LAMINAE,CROSS BEDDING", UNDEFORMED*, NODULES," PYRITE,ZEOLITE",,, HARD, 33233000
60,453,,44,2,0.0,114.0,408.00,409.50,410.64,PK, MUDSTONE, GREENISH GREY," CROSS BEDDING,BURROWS", UNDEFORMED*,,,,, HARD,
60,453,,44,CC,0.0,35.0,408.00,410.74,410.99,PK, MUDSTONE, GREENISH GREY,, UNDEFORMED*,,,,, HARD, 33233000
60,453,,45,1,0.0,150.0,417.50,417.50,419.00,PK, SILTY MUDSTONE, GREENISH GREY," LAMINAE,CROSS BEDDING", UNDEFORMED*,,,,, HARD, 33233000
60,453,,45,2,0.0,85.0,417.50,419.00,419.85,PK, SILTY MUDSTONE, GREENISH GREY," LAMINAE,CROSS BEDDING", UNDEFORMED*,,,,, HARD, 33233000
60,453,,45,2,85.0,150.0,417.50,419.85,420.50,PK, SILT DOWN TO VERY FINE SAND, GREENISH GREY, CROSS BEDDING, UNDEFORMED*,,,,, SOFT TO FIRM, 33214000
60,453,,45,3,0.0,60.0,417.50,420.50,421.10,PK, VERY FINE SAND INTO FINE SAND, GREENISH GREY, CROSS BEDDING, UNDEFORMED*,,,,, SOFT TO FIRM, 33214000
60,453,,45,3,60.0,68.0,417.50,421.10,421.18,PK, MUDSTONE, DUSKY GREEN, BURROWS, UNDEFORMED*,,,,, HARD, 33233000
60,453,,45,3,68.0,100.0,417.50,421.18,421.50,PK, SILTY MUDSTONE, GREENISH GREY," LAMINAE,CROSS BEDDING", UNDEFORMED*,,,,, HARD, 33233000
60,453,,45,3,100.0,150.0,417.50,421.50,422.00,PK," MUDSTONE,SILTY MUDSTONE", DUSKY GREEN," BURROWS,LAMINAE, CROSS BEDDING", UNDEFORMED*, PEBBLES,,,, HARD, 33233000
60,453,,45,4,0.0,4.0,417.50,422.00,422.04,PK, VERY FINE SAND,," BEDDING,BURROWS", UNDEFORMED*,,,,, SOFT TO FIRM, 33214000
60,453,,45,4,4.0,102.0,417.50,422.04,423.02,PK," MUDSTONE,SILT",," CROSS BEDDING,FLASER BEDDING", UNDEFORMED*,,,,, HARD, 33233000
60,453,,45,CC,0.0,20.0,417.50,423.12,423.22,PK, MUDSTONE WITH SILT,, LAMINAE*,,,,,, HARD, 33233000
60,453,,46,1,0.0,105.0,427.00,427.00,428.05,PK," MUDSTONE,SILTSTONE", GREENISH GREY*," CROSS BEDDING,LAMINAE", UNDEFORMED, PEBBLES,,,, HARD,
60,453,,46,1,105.0,150.0,427.00,428.05,428.50,PK, SILTSTONE TO VERY FINE SANDSTONE, GREENISH GREY*, CROSS BEDDING,, PEBBLES,,,, HARD,
60,453,,46,CC,0.0,20.0,427.00,428.60,428.70,PK, SILTSTONE TO VERY FINE SANDSTONE, GREENISH GREY, CROSS BEDDING*,,,,,, HARD,
60,453,,47,1,0.0,50.0,436.50,436.50,437.00,PK, SILTY MUDSTONE, GREYISH GREEN, BURROWS, UNDEFORMED*,,,,, HARD,
60,453,,47,1,50.0,76.0,436.50,437.00,437.26,PK, SILTSTONE, GREYISH GREEN," BURROWS,LAMINAE, CROSS BEDDING", UNDEFORMED*,,,,, HARD, 33235000
60,453,,47,1,76.0,130.0,436.50,437.26,437.80,PK, SILTY MUDSTONE, DUSKY GREEN, BURROWS, UNDEFORMED*,,,,, HARD, 33233000
60,453,,47,1,130.0,150.0,436.50,437.80,438.00,PK, SILTSTONE, GREYISH GREEN, CROSS BEDDING, UNDEFORMED*,,,,, HARD, 33235000
60,453,,47,2,36.0,128.0,436.50,438.36,439.28,PK," MUDSTONE,SILTY MUDSTONE", GREYISH GREEN, LAMINAE, UNDEFORMED*,,,,, HARD, 33233000
60,453,,47,2,128.0,150.0,436.50,439.28,439.50,PK, SILTSTONE, GREYISH GREEN," BEDDING,LAMINAE", UNDEFORMED*,,,,, HARD,
60,453,,47,3,0.0,13.0,436.50,439.50,439.63,PK, SILT, GREYISH GREEN," LAMINAE,BEDDING", UNDEFORMED*,,,,, FIRM, 33215000
60,453,,47,3,13.0,40.0,436.50,439.63,439.90,PK, SILT GRADING TO VERY FINE SAND, GREYISH GREEN, CROSS BEDDING, UNDEFORMED*,,,,, FIRM, 33215000
60,453,,47,3,40.0,69.0,436.50,439.90,440.19,PK, VERY FINE SAND TO FINE SANDSTONE, GREYISH GREEN, LAMINAE*,,,,,, FIRM TO HARD, 33214000
60,453,,47,CC,0.0,50.0,436.50,440.30,440.70,PK, SANDSTONE, GREYISH GREEN*,,,,,,, HARD, 33234000
60,453,,48,1,0.0,55.0,446.00,446.00,446.55,PK, VERY FINE SANDSTONE, GREYISH GREEN," BANDING,CROSS BEDDING", UNDEFORMED*,, VOLCANIC GLASS,,, HARD, 33234000
60,453,,48,CC,0.0,20.0,446.00,446.65,446.75,PK, VERY FINE SANDSTONE, GREYISH GREEN," BANDING,CROSS BEDDING", UNDEFORMED*,,,,, HARD, 33234000
