leg,site,hole,core,section,top interval depth (cm),bottom interval depth (cm),top of core depth(m),top of layer depth (m),bottom of layer depth (m), describer,lithology,color,structures,deformations due to drilling,unusual occurrences,minerals,paleontology,other observations,hardness or induration,z-coding
60,453,,1,1,0.0,150.0,0.00,0.00,1.50,BLT, SILICEOUS OOZE, BROWN,, GREATLY DEFORMED*,,,,, SOFT,
60,453,,1,2,0.0,150.0,0.00,1.50,3.00,PK," SILICEOUS MUD,DIATOMACEOUS OOZE", OLIVE GREY, BEDDING, MODERATELY DEFORMED*,,,,, SOFT, 22210000
60,453,,1,3,0.0,150.0,0.00,3.00,4.50,PK," SILICEOUS OOZE,MUD", YELLOWISH BROWN,, MODERATELY DEFORMED*,,,,, SOFT, 21110000
60,453,,1,4,0.0,150.0,0.00,4.50,6.00,," SILICEOUS OOZE,MUD", YELLOWISH BROWN,, GREATLY DEFORMED*,, PUMICE,,, SOFT, 21110000
60,453,,1,5,0.0,143.0,0.00,6.00,7.43,PK," SILICEOUS PELAGIC MUD,DIATOMACEOUS VITRIC MUD", OLIVE GREY TO DARK YELLOWISH BROWN,, GREATLY DEFORMED*,,,,, SOFT, 22210000
60,453,,1,6,0.0,139.0,0.00,7.50,8.89,PK," SILICEOUS OOZE,VITRIC MUD", OLIVE GREY,, MODERATELY DEFORMED*,,,,, SOFT,
60,453,,1,7,0.0,20.0,0.00,9.00,9.20,PK, SILICEOUS OOZE, DARK YELLOWISH BROWN*,,,,,,, SOFT, 21110000
60,453,,1,CC,0.0,15.0,0.00,9.30,9.35,PK, SILICEOUS OOZE, DARK YELLOWISH BRN*,,,,,,, SOFT,
60,453,,2,1,0.0,150.0,9.00,9.00,10.50,PK," SILICEOUS OOZE,MUD", YELLOWISH BROWN TO DUSKY GREY,, MODERATELY DEFORMED*,,,,, SOFT, 21110000
60,453,,2,2,0.0,150.0,9.00,10.50,12.00,PK, PELAGIC SILICEOUS MUD, DUSKY BROWN TO OLIVE GREY,, MODERATELY DEFORMED*,,,,, SOFT,
60,453,,2,3,0.0,100.0,9.00,12.00,13.00,PK, SILICEOUS MUD, OLIVE GREY TO YELLOWISH BROWN, BEDDING, MODERATELY DEFORMED*,,,,, SOFT,
60,453,,2,4,0.0,148.0,9.00,13.50,14.98,PK, SILICEOUS VITRIC-LITHIC MUD, OLIVE GREY TO YELLOWISH BROWN,, MODERATELY DEFORMED*,,,,, SOFT,
60,453,,2,CC,0.0,15.0,9.00,15.08,15.13,PK, CRYSTAL VITRIC MUD, DARK YELLOWISH BROWN,, MODERATELY DEFORMED*,,,,, SOFT,
60,453,,3,1,0.0,120.0,18.50,18.50,19.70,PK, CRYSTAL LITHIC MUD, DARK YELLOWISH BROWN,, MODERATELY DEFORMED*,,,,, SOFT,
60,453,,3,1,120.0,150.0,18.50,19.70,20.00,PK, SILICEOUS LITHIC-MUD, DARK YELLOWISH BROWN, BEDDING, MODERATELY DEFORMED*,,,,, SOFT,
60,453,,3,2,0.0,150.0,18.50,20.00,21.50,PK, CRYSTAL VITRIC LITHIC MUD, DARK YELLOWISH BRN TO OLIVE GREY, BEDDING, MODERATELY DEFORMED*,,,,, SOFT,
60,453,,3,3,0.0,15.0,18.50,21.50,21.65,PK, MUD, OLIVE GREY,, MODERATELY DEFORMED*,,,,, SOFT, 33213000
60,453,,3,CC,2.0,20.0,18.50,21.70,21.88,PK, CLAY, OLIVE GREY,, MODERATELY DEFORMED*,,,,, SOFT, 33213000
60,453,,4,1,0.0,150.0,28.00,28.00,29.50,PK, ZEOLITIC CLAY, BROWN,, MODERATELY DEFORMED*,,,,, SOFT,
60,453,,4,2,0.0,150.0,28.00,29.50,31.00,PK, ZEOLITIC CLAY," MODERATE BROWN,DUSKY YELLOW BROWN,LIGHT OLIVE BROWN"," BEDDING,BANDING", MODERATELY DEFORMED*,,,,, SOFT,
60,453,,4,3,0.0,150.0,28.00,31.00,32.50,PK, ZEOLITIC CLAY, LIGHT OLIVE BROWN, GRADED BEDDING, MODERATELY DEFORMED*,, PUMICE,,, SOFT,
60,453,,4,4,0.0,150.0,28.00,32.50,34.00,PK," ZEOLITIC PELAGIC CLAY,MUD", OLIVE BROWN,, MODERATELY DEFORMED*,,,,, SOFT,
60,453,,4,5,0.0,150.0,28.00,34.00,35.50,PK, ZEOLITIC PELAGIC CLAY, GRAYISH OLIVE TO OLIVE BROWN, GRADED BEDDING, MODERATELY DEFORMED*,,,,, SOFT,
60,453,,4,6,0.0,94.0,28.00,35.50,36.44,PK, ZEOLITIC PELAGIC CLAY, OLIVE BROWN,, MODERATELY DEFORMED*,,,,, SOFT,
60,453,,4,CC,0.0,11.0,28.00,36.54,36.55,PK, ZEOLITIC PELAGIC CLAY, OLIVE BROWN*,,,,,,, SOFT, 31210000.3450
60,453,,5,1,0.0,150.0,37.50,37.50,39.00,PK," PELAGIC CLAY,MUD", OLIVE BROWN,, GREATLY DEFORMED*,,,,, SOFT,
60,453,,5,2,0.0,80.0,37.50,39.00,39.80,PK, PELAGIC CLAY, OLIVE BROWN,, GREATLY DEFORMED*,,,,, SOFT,
60,453,,5,CC,0.0,10.0,37.50,39.90,39.90,PK, PELAGIC CLAY, OLIVE BROWN*,,,,,,, SOFT, 31210000
60,453,,6,1,0.0,150.0,47.00,47.00,48.50,PK, LITHIC-CRYSTAL MUD, GRAYISH OLIVE,, MODERATELY DEFORMED*,,,,, SOFT,
60,453,,6,CC,0.0,25.0,47.00,48.60,48.75,PK, LITHIC-CRYSTAL MUD, GREENISH OLIVE,, MODERATELY DEFORMED*,,,,, SOFT, 33213000
60,453,,7,CC,0.0,25.0,56.50,56.60,56.75,PK, PELAGIC CLAY, GREYISH OLIVE GREEN, BEDDING, MODERATELY DEFORMED, PEBBLES*,,,, SOFT,
60,453,,8,1,0.0,150.0,66.00,66.00,67.50,PK, ZEOLITIC PELAGIC CLAY, GREENISH BLACK TO OLIVE BLACK,, MODERATELY DEFORMED*,,,,, SOFT,
60,453,,8,2,0.0,150.0,66.00,67.50,69.00,PK, PELAGIC CLAY, GREYISH OLIVE GREEN,, MODERATELY DEFORMED*,,,,, SOFT,
60,453,,8,3,0.0,140.0,66.00,69.00,70.40,PK," CRYSTAL VITRIC MUD,PELAGIC CLAY", MODERATE OLIVE GREY TO DUSKY YELLOW GREEN,, SLIGHTLY DEFORMED*,,,,, SOFT, 33213000.3651
60,453,,8,4,0.0,38.0,66.00,70.50,70.88,PK, PELAGIC CLAY, GREYISH OLIVE GREEN,, SLIGHTLY DEFORMED*, VOLCANOGENIC DEPOSITS, VOLCANIC ASH,,, SOFT, 31210000
60,453,,8,4,38.0,50.0,66.00,70.88,71.00,PK, SILTY VITRIC ASH, GREYISH OLIVE GREEN,, SLIGHTLY DEFORMED*,,,,, SOFT,
60,453,,8,4,50.0,110.0,66.00,71.00,71.60,PK, PELAGIC CLAY, OLIVE GREY,, SLGHTLY DEFORMED*,,,,, SOFT,
60,453,,8,4,110.0,124.0,66.00,71.60,71.74,PK, LITHIC VITRIC CRYSTAL MUD, OLIVE BLACK,, SLIGHTLY DEFORMED*,,,,, SOFT,
60,453,,8,4,124.0,150.0,66.00,71.74,72.00,PK, CRYSTAL VITRIC MUD, OLIVE GREY,, SLIGHTLY DEFORMED*,,,,, SOFT,
60,453,,8,CC,0.0,20.0,66.00,72.10,72.20,PK, VITRIC MUD, OLIVE GREY*,,,,,,, SOFT,
60,453,,9,1,6.0,36.0,75.50,75.56,75.86,PK," PELAGIC CLAY,LITHIC MUD,VITRIC MUD", OLIVE GREY TO DUSKY YELLOW GREEN TO OLIVE GREY, BEDDING, SLIGHTLY DEFORMED*,,,,, SOFT,
60,453,,10,1,0.0,100.0,85.00,85.00,86.00,PK, CLAY, GREEN TO BROWN*,,,,,,, SOFT,
60,453,,10,2,0.0,150.0,85.00,86.50,88.00,PK," PELAGIC CLAY,VITRIC MUD", GRAYISH OLIVE GREEN,, SLIGHTLY DEFORMED*,,,,, SOFT,
60,453,,10,3,0.0,80.0,85.00,88.00,88.80,PK," CLAY,SILTY VITRIC ASH", GREYISH OLIVE GREEN TO DUSKY YELLOW GREEN, BEDDING, SLIGHTLY DEFORMED*,,,,, SOFT, 33213000
60,453,,10,CC,0.0,17.0,85.00,88.90,88.97,PK, PELAGIC CLAY, GREYISH OLIVE GREEN*,,,,,,, SOFT,
60,453,,11,1,5.0,150.0,94.50,94.55,96.00,PK," CLAY,VITRIC MUDSTONE", GREYISH OLIVE GREEN,,, PEBBLES*,,,, SOFT TO FIRM, 33213000
60,453,,11,2,0.0,150.0,94.50,96.00,97.50,PK," PELAGIC CLAY,VITRIC MUD", GREYISH OLIVE GREEN,,, PEBBLES*,,,, SOFT, 31210000
60,453,,11,3,0.0,150.0,94.50,97.50,99.00,PK, CRYSTAL MUD, GREYISH OLIVE GREEN*,,,,,,, FIRM,
60,453,,11,4,0.0,150.0,94.50,99.00,100.50,PK, CRYSTAL MUD, GREYISH OLIVE GREEN*,,,,,,, FIRM,
60,453,,11,5,0.0,150.0,94.50,100.50,102.00,PK, MUDSTONE, GREYISH OLIVE GREEN*,,,,,,, HARD,
60,453,,11,6,0.0,150.0,94.50,102.00,103.50,PK," MUDSTONE,CLAYSTONE", GREYISH OLIVE GREEN*,,,,,,, HARD, 33233000
60,453,,11,7,0.0,44.0,94.50,103.50,103.94,PK," MUDSTONE,CLAYSTONE", GREYISH OLIVE GREEN*,,,,,,, HARD, 33233000
60,453,,11,CC,0.0,15.0,94.50,104.05,104.10,PK," MUDSTONE,CLAYSTONE", GREYISH OLIVE GREEN*,,,,,,, HARD, 33233000
60,453,,12,1,0.0,150.0,104.00,104.00,105.50,PK, CRYSTAL MUD, GREYISH OLIVE GREEN,, GREATLY DEFORMED*,,,,, SOFT,
60,453,,12,2,0.0,150.0,104.00,105.50,107.00,PK, CRYSTAL MUD, GREYISH OLIVE GREEN,, GREATLY DEFORMED*,,,,, SOFT, 33213000
60,453,,12,3,0.0,150.0,104.00,107.00,108.50,PK, CRYSTAL MUD, GREYISH OLIVE GREEN,, GREATLY DEFORMED*,,,,, SOFT, 33213000
60,453,,12,4,0.0,150.0,104.00,108.50,110.00,PK, CRYSTAL MUD, GREYISH OLIVE GREEN,, GREATLY DEFORMED*,,,,, SOFT, 33213000
60,453,,12,5,0.0,150.0,104.00,110.00,111.50,PK, CRYSTAL MUD, GREYISH OLIVE GREEN,, GREATLY DEFORMED*,,,,, SOFT, 33213000
60,453,,12,6,0.0,95.0,104.00,111.50,112.45,PK, CRYSTAL MUD, GREYISH OLIVE GREEN,,, VOLCANOGENIC DEPOSITS, VOLCANIC ASH*, RADIOLARIANS,, SOFT, 33213000
60,453,,12,CC,0.0,25.0,104.00,112.56,112.71,PK," CRYSTAL MUD,MUDSTONE", GREENISH GREY*,,,,,,, FIRM TO HARD, 33213000
60,453,,13,1,0.0,130.0,113.50,113.50,114.80,PK, VITRIC-CRYSTAL MUD, GREYISH OLIVE GREEN,, MODERATELY DEFORMED*, VOLCANOGENIC DEPOSITS, VOLCANIC ASH,,, FIRM, 33213000.3651
60,453,,13,CC,0.0,25.0,113.50,114.90,115.05,PK, PELAGIC CLAY, GREYISH OLIVE GREEN*,,,,,,, FIRM,
60,453,,14,1,0.0,140.0,123.00,123.00,124.40,PK, MUDSTONE, GREENISH GREY, BURROWS*,,,,,, HARD, 33233000
60,453,,14,2,0.0,131.0,123.00,124.50,125.81,PK," CLAYSTONE,MUDSTONE", GREENISH GREY*,,,,,,, HARD,
60,453,,14,CC,0.0,25.0,123.00,125.93,126.08,PK, MUDSTONE, GREENISH GREY, BEDDING*,,,,,, HARD,
60,453,,15,1,0.0,150.0,132.50,132.50,134.00,PK, CLAYSTONE, GREENISH GREY, BURROWS*,,,,,, HARD,
60,453,,15,2,0.0,150.0,132.50,134.00,135.50,PK, CLAYSTONE, GREENISH BLACK TO GREENISH GREY*,,,,,,, HARD,
60,453,,15,3,0.0,80.0,132.50,135.50,136.30,PK," CLAYSTONE,MUDSTONE,VITRIC MUDSTONE", GREENISH GREY TO GREENISH BLACK*,,,,,,, HARD, 33233000
60,453,,15,CC,0.0,15.0,132.50,136.40,136.45,PK, CLAYSTONE,,,,,,,, HARD*,
60,453,,17,1,0.0,60.0,151.50,151.50,152.10,PK, MUDSTONE W/MICRONODULES, GREENISH BLACK*,,,, MICRONODULES,,, HARD,
60,453,,17,CC,0.0,20.0,151.50,152.20,152.30,PK, VITRIC MUDSTONE, GREENISH BLACK,,,,, RADIOLARIANS*,, HARD,
60,453,,18,1,0.0,150.0,161.00,161.00,162.50,PK," CLAYSTONE,CALCAREOUS MUDSTONE", GREENISH GREY," BURROWS,BEDDING*",,,,,, HARD,
60,453,,18,2,0.0,130.0,161.00,162.50,163.80,PK," MUDSTONE,DOLOMITE", GREENISH GREY, BEDDING, GREATLY DEFORMED*, DOLOMITE CRYSTALS,,,, HARD,
60,453,,18,2,130.0,150.0,161.00,163.80,164.00,PK, MUDSTONE, GREENISH GREY, BEDDING*,,,,,, HARD,
60,453,,18,3,0.0,150.0,161.00,164.00,165.50,PK," CLAYSTONE,MUDSTONE", GREENISH GREY, BURROWS, MODERATELY DEFORMED*,,,,, HARD,
60,453,,18,4,0.0,102.0,161.00,165.50,166.52,PK, MUDSTONE, GREENISH GREY*,,,,,,, HARD, 33233000
60,453,,18,5,0.0,140.0,161.00,167.00,168.40,PK, MUDSTONE, GREENISH GREY, BURROWS*,,,,,, HARD, 33233000
60,453,,18,6,0.0,10.0,161.00,168.50,168.60,PK, MUDSTONE, GREENISH BLACK, BANDING, SLIGHTLY DEFORMED*,, ZEOLITES,,, HARD,
60,453,,18,6,10.0,150.0,161.00,168.60,170.00,PK, MUDSTONE W/MICRONODULES, GREENISH GREY,,,, MICRONODULES*,,, HARD,
60,453,,18,7,0.0,40.0,161.00,170.00,170.40,PK, VITRIC MUDSTONE W/CARBONATES, GREENISH GREY*,,,,,,, HARD,
60,453,,18,CC,0.0,25.0,161.00,170.57,170.72,PK, VITRIC MUDSTONE, GREENISH GREY*, LAMINAE,,, GLASS,,, HARD,
60,453,,19,1,0.0,69.0,170.50,170.50,171.19,PK, VITRIC MUDSTONE, GREENISH GREY*,,,,,,, HARD,
60,453,,19,CC,0.0,12.0,170.50,171.29,171.31,PK, VITRIC MUDSTONE, GREENISH GREY*,,,,,,, HARD, 33233000.3651
60,453,,20,1,0.0,150.0,180.00,180.00,181.50,PK, MUDSTONE, GREENISH GREY,, GREATLY DEFORMED*,,,,, HARD, 33233000
60,453,,20,2,0.0,8.0,180.00,181.50,181.58,PK, MUDSTONE, GREENISH GREY*,,,,,,, HARD, 33233000
60,453,,20,2,8.0,25.0,180.00,181.58,181.75,PK, SILTY CHALK, GREENISH GREY," TURBIDITE,GRADED BEDDING,BURROWS*",,,,,, FIRM,
60,453,,20,2,25.0,150.0,180.00,181.75,183.00,PK, MICRONODULAR MUDSTONE, GREENISH GREY*, BURROWS,,, MICRONODULES,,, HARD,
60,453,,20,3,0.0,70.0,180.00,183.00,183.70,PK, MICRONODULAR MUDSTONE, GREENISH GREY,,,, MICRONODULES*,,, HARD,
60,453,,20,3,70.0,81.0,180.00,183.70,183.81,PK, ZEOLITIC MUDSTONE, GREENISH GREY,,,, ZEOLITES*,,, HARD,
60,453,,20,3,81.0,150.0,180.00,183.81,184.50,PK, MICRONODULAR MUDSTONE, GREENISH GREY,,,, MICRONODULES*,,, HARD, 33233000
60,453,,21,1,0.0,150.0,189.50,189.50,191.00,PK," MICRONODULAR MUDSTONE,CLAYSTONE", GREENISH GREY," BURROWS,LAMINAE", MODERATELY DEFORMED*,, MICRONODULES,,, HARD, 33233000
60,453,,21,2,0.0,50.0,189.50,191.00,191.50,PK," SILTY VITRIC TUFF,VITRIC MUDSTONE", GREENISH GREY, LAMINAE, MODERATELY DEFORMED*,,,,, HARD,
60,453,,21,CC,0.0,15.0,189.50,191.60,191.65,PK, VITRIC MUDSTONE, GREENISH GREY*,,,,,,, HARD,
60,453,,22,1,0.0,150.0,199.00,199.00,200.50,PK," CLAYSTONE,VITRIC AND SILTY VITRIC MUDSTONE", GREENISH GREY," BEDDING, BURROWS,ASH LAYER",, VOLCANOGENIC DEPOSITS*,,,, HARD,
60,453,,22,2,0.0,150.0,199.00,200.50,202.00,PK," CLAYSTONE,VITRIC MUDSTONE", GREENISH GREY," BURROWS,LAMINAE", SLIGHTLY DEFORMED*,,,,, HARD,
60,453,,22,3,0.0,40.0,199.00,202.00,202.40,PK, SILT SIZE ASH, GREENISH GREY," BEDDING,ASH LAYERS", SLIGHTLY DEFORMED, VOLCANOGENIC DEPOSITS*, VOLCANIC ASH,,, FIRM, 33213000.3651
60,453,,22,CC,0.0,15.0,199.00,202.50,202.55,PK, SILTY VITRIC ASH, GREENISH GREY," BEDDING,ASH LAYERS",, VOLCANOGENIC DEPOSITS*, VOLCANIC ASH VOLCANIC ASH,,, FIRM,
60,453,,23,1,0.0,150.0,208.50,208.50,210.00,PK," VITRIC MUDSTONE,CLAYSTONE", DUSKY GREEN TO GREENISH GREY," BURROWS,BEDDING,LAMINAE,ASH LAYERS", SLIGHTLY DEFORMED, VOLCANOGENIC DEPOSITS*, VOLCANIC ASH,,, HARD,
60,453,,23,2,0.0,54.0,208.50,210.00,210.54,PK," VITRIC MUDSTONE,CLAYSTONE", GREENISH GREY," BEDDING,BURROWS", SLIGHTLY DEFORMED*,,,,, HARD TO FIRM, 33233000.3651
60,453,,23,CC,0.0,20.0,208.50,210.64,210.74,PK," VITRIC MUDSTONE,CLAYSTONE", GREENISH GREY*,,,,,,, HARD, 33233000.3651
60,453,,24,1,0.0,150.0,218.00,218.00,219.50,PK, CRYSTAL VITRIC MUDSTONE, GREENISH GREY," BURROWS,LAMINAE*",,,,,, HARD,
60,453,,24,2,0.0,140.0,218.00,219.50,220.90,PK, VITRIC CRYSTAL MUDSTONE, GREENISH GREY," BEDDING,LAMINAE", SLIGHTLY DEFORMED*,,, NANNOFOSSILS,, HARD,
60,453,,24,3,0.0,25.0,218.00,221.00,221.25,PK, VITRIC MUDSTONE, GREENISH GREY, ASH LAYERS,, VOLCANOGENIC DEPOSITS*, VOLCANIC ASH,,, HARD, 33233000.3651
60,453,,24,CC,0.0,10.0,218.00,221.36,221.36,PK, MUDSTONE W/VOLC. ASH, GREENISH GREY, ASH LAYERS,, VOLCANOGENIC DEPOSITS*, VOLCANIC ASH,,, HARD, 33233000.3651
60,453,,25,1,0.0,150.0,227.50,227.50,229.00,PK," MUDSTONE, SILTY VITRIC TUFF", GREENISH GREY," MOTTLING,LAMINAE", SLIGHTLY DEFORMED*,,,,, HARD,
60,453,,25,2,0.0,36.0,227.50,229.00,229.36,PK, MUDSTONE, GREENISH GREY," MOTTLING,LAMINAE", SLIGHTLY DEFORMED*,,,,, HARD, 33233000
60,453,,25,CC,5.0,15.0,227.50,229.41,229.51,PK, MUDSTONE, GREENISH GREY," MOTTLING,LAMINAE*",,,,,, HARD, 33233000
60,453,,26,1,0.0,150.0,237.00,237.00,238.50,PK, MUDSTONE, GREYISH GREEN," BURROWS,BEDDING,LAMINAE", SLIGHTLY DEFORMED*,,,,, HARD, 33233000
60,453,,26,2,0.0,150.0,237.00,238.50,240.00,PK," MUDSTONE, VITRIC CLAYSTONE", GREENISH GREY," BURROWS,BEDDING,LAMINAE*",,,,,, HARD, 33233000
60,453,,26,3,0.0,150.0,237.00,240.00,241.50,PK," MUDSTONE,CLAYSTONE", GREENISH GREY," BURROWS,BEDDING,ASH LAYERS",, VOLCANOGENIC DEPOSITS*, VOLCANIC ASH,,, HARD, 33233000
60,453,,26,4,0.0,95.0,237.00,241.50,242.45,PK, MUDSTONE, GREENISH GREY,, GREATLY DEFORMED, PEBBLES*,,,, HARD, 33233000
60,453,,26,CC,0.0,20.0,237.00,242.55,242.65,PK, MUDSTONE, GREENISH GREY,, GREATLY DEFORMED*,,,,, HARD, 33233000
60,453,,27,1,0.0,150.0,246.50,246.50,248.00,PK," VITRIC CLAYSTONE,CRYSTAL VITRIC MUDSTONE", GREENISH GREY," LAMINAE, ASH LAYER", UNDEFORMED, VOLCANOGENIC DEPOSITS*, VOLCANIC ASH,,, HARD,
60,453,,27,2,0.0,60.0,246.50,248.00,248.60,PK," VITRIC CLAYSTONE,CRYSTAL VITRIC MUDSTONE", GREENISH GREY, ASH LAYERS,, VOLCANOGENIC DEPOSITS*, VOLCANIC ASH,,, HARD,
60,453,,27,2,60.0,80.0,246.50,248.60,248.80,PK," VITRIC MUDSTONE,VITRIC CLAYSTONE", GREENISH BLACK, BURROWS*,,,,,, HARD,
60,453,,27,2,80.0,150.0,246.50,248.80,249.50,PK," CLAYSTONE,ASH", GREENISH GREY, ASH LAYERS,, VOLCANOGENIC DEPOSITS*, VOLCANIC ASH,,, HARD,
60,453,,27,3,0.0,85.0,246.50,249.50,250.35,PK," MUDSTONE,CLAYSTONE", GREENISH GREY," LAMINAE,ASH LAYERS",, VOLCANOGENIC DEPOSITS*, VOLCANIC ASH,,, HARD,
60,453,,28,1,0.0,150.0,256.00,256.00,257.50,PK," CLAYSTONE,VITRIC MUDSTONE", GREENISH GREY," LAMINAE,BURROWS,BANDING",, PEBBLES*,,,, HARD,
60,453,,28,2,0.0,50.0,256.00,257.50,258.00,PK," CLAYSTONE,VITRIC MUDSTONE", GREENISH GREY," ASH LAYERS,LAMINAE",, VOLCANOGENIC DEPOSITS, VOLCANIC ASH, NANNOS*,, HARD,
60,453,,28,CC,0.0,10.0,256.00,258.13,258.13,PK," CLAYSTONE,VITRIC MUDSTONE", GREENISH GREY,,,, VOLCANIC GLASS*,,, HARD, 33231000
60,453,,29,1,0.0,150.0,265.50,265.50,267.00,PK," CLAYSTONE,CRYSTAL VITRIC MUDSTONE", GREENISH GREY," BURROWS, LAMINAE",,, VOLCANIC GLASS*,,, HARD, 33231000
60,453,,29,2,0.0,100.0,265.50,267.00,268.00,PK," CLAYSTONE,CRYSTAL VITRIC MUDSTONE", GREENISH GREY, CROSS BEDDING,,, VOLCANIC GLASS*,,, HARD,
60,453,,29,3,0.0,150.0,265.50,268.50,270.00,PK, MUDSTONE, GREENISH GREY," LAMINAE,BURROWS*",,,,,, HARD,
60,453,,29,4,0.0,150.0,265.50,270.00,271.50,PK," MUDSTONE,SILTY VITRIC TUFF", GREENISH GREY," LAMINAE,BURROWS",,, VOLCANIC GLASS*,,, HARD,
60,453,,29,5,0.0,15.0,265.50,271.50,271.65,PK, MUDSTONE, GREENISH GREY," LAMINAE,BURROWS*",,,,,, HARD, 33233000
60,453,,29,CC,0.0,20.0,265.50,271.76,271.86,PK, VITRIC MUDSTONE, GREENISH GREY, LAMINAE*,,,,,, HARD,
60,453,,30,1,0.0,125.0,275.00,275.00,276.25,PK, CLAYSTONE, GREYISH GREEN, BURROWS, SLIGHTLY DEFORMED*, PEBBLES,,,, HARD,
60,453,,31,1,0.0,150.0,284.50,284.50,286.00,PK," CLAYSTONE,MUDSTONE", GREENISH GREY, BURROWS, MODERATELY DEFORMED*,,,,, HARD,
60,453,,31,2,0.0,150.0,284.50,286.00,287.50,PK," CLAYSTONE,MUDSTONE", GREENISH GREY, BURROWS, MODERATELY DEFORMED*,,,,, HARD,
60,453,,31,3,0.0,140.0,284.50,287.50,288.90,PK," CLAYSTONE,MUDSTONE",," LAMINAE,BURROWS*",,,,,, HARD, 33231000
60,453,,31,CC,0.0,22.0,284.50,289.00,289.12,PK," CLAYSTONE,MUDSTONE",,,,,,,, HARD*,
60,453,,32,1,0.0,150.0,294.00,294.00,295.50,PK, MUDSTONE, GREENISH GRAY, LAMINAE, UNDEFORMED*,,,,, HARD, 33233000
60,453,,32,2,0.0,150.0,294.00,295.50,297.00,PK, MICRONODULAR MUDSTONE, GREENISH GRAY," LAMINAE,BURROWS", SLIGHTLY DEFORMED*, NODULES," OPAQUE MINERALS, MICRONODULES",,, HARD, 33233000.3910
60,453,,32,3,0.0,108.0,294.00,297.00,298.08,PK, MICRONODULAR MUDSTONE, GREENISH GRAY, BURROWS, SLIGHTLY DEFORMED*, NODULES," OPAQUE MINERALS,MICRONODULES",,, HARD,
60,453,,32,CC,0.0,15.0,294.00,298.18,298.23,PK, MICRONODULE MUDSTONE, GREENISH GRAY,,, NODULES*, MICRONODULES,,, HARD,
60,453,,33,1,0.0,150.0,303.50,303.50,305.00,PK, VITRIC MUDSTONE, GREENISH GRAY, LAMINAE*,,,,,, HARD,
60,453,,33,2,0.0,150.0,303.50,305.00,306.50,PK," VITRIC MUDSTONE,SANDY VITRIC TUFF", DUSKY GREEN," LAMINAE,CROSS BEDDING, BURROWS", UNDEFORMED*,,,,, HARD,
60,453,,33,3,0.0,150.0,303.50,306.50,308.00,PK," VITRIC MUDSTONE,CLAYSTONE", GRAYISH GREEN," BURROWS,LAMINAE", SLIGHTLY DEFORMED*,,,,, HARD, 33233000.3651
60,453,,33,4,0.0,58.0,303.50,308.00,308.58,PK, CRYSTAL VITRIC MUDSTONE, GREENISH GRAY, LAMINAE, UNDEFORMED*,,,,, HARD,
60,453,,33,CC,0.0,20.0,303.50,308.68,308.78,PK, VITRIC MUDSTONE, GREENISH GRAY, LAMINAE, UNDEFORMED*,,,,, HARD,
60,453,,34,1,0.0,150.0,313.00,313.00,314.50,PK, MUDSTONE, GREENISH GRAY," LAMINAE,CROSS BEDDING", UNDEFORMED*,,,,, HARD,
60,453,,34,2,0.0,45.0,313.00,314.50,314.95,PK, GRADED SILT TO SANDY, GREENISH GRAY," LAMINAE,CROSS BEDDING", UNDEFORMED*,,,,, FIRM,
60,453,,34,2,45.0,150.0,313.00,314.95,316.00,PK, MUDSTONE, GREENISH GRAY, LAMINAE, UNDEFORMED, PEBBLES*,,,, HARD, 33233000
60,453,,34,3,0.0,150.0,313.00,316.00,317.50,PK, MUDSTONE, GREENISH GREY," LAMINAE,CROSS BEDDING, BURROWS", UNDEFORMED*, PEBBLES,,,, HARD, 33233000
60,453,,34,4,0.0,27.0,313.00,317.50,317.77,PK, MUDSTONE, GREENISH GREY,,, PEBBLES*,,,, HARD, 33233000
60,453,,34,CC,0.0,20.0,313.00,317.88,317.98,PK, CLAYSTONE, GREENISH GREY,,, PEBBLES*,,,, HARD,
60,453,,35,1,0.0,150.0,322.50,322.50,324.00,PK, MUDSTONE, BLUE GREEN TO GREENISH GREY," LAMINAE,CROSS BEDDING,BANDING", UNDEFORMED*,,,,, HARD, 33233000
60,453,,35,2,0.0,150.0,322.50,324.00,325.50,PK," MUDSTONE,MUDDY AND SANDY VITRIC TUFF", GREENISH GREY," LAMINAE, CROSS BEDDING,BURROWS", UNDEFORMED*,,,,, HARD, 33233000
60,453,,35,3,0.0,101.0,322.50,325.50,326.51,PK, MUDSTONE, GREENISH BLACK," BURROWS,LAMINAE", UNDEFORMED*,,,,, HARD, 33233000
60,453,,35,4,0.0,80.0,322.50,327.00,327.80,PK, MUDSTONE, GREENISH BLACK, LAMINAE, UNDEFORMED*,,,,, HARD,
60,453,,35,4,80.0,123.0,322.50,327.80,328.23,PK, MUDSTONE, GREENISH BLACK TO GREENISH GREY," LAMINAE,CROSS BEDDING,BURROWS", UNDEFORMED*, PEBBLES,,,, HARD, 33233000
60,453,,35,CC,0.0,20.0,322.50,328.33,328.43,PK, MUDSTONE,,,, PEBBLES*,,,, HARD, 33233000
60,453,,36,1,0.0,150.0,332.00,332.00,333.50,PK, MUDSTONE, GREENISH GREY," BURROWS,LAMINAE,BEDDING", UNDEFORMED*, PEBBLES,,,, HARD, 33233000
60,453,,36,2,0.0,150.0,332.00,333.50,335.00,PK, MUDSTONE, GREENISH GREY, BURROWS, UNDEFORMED*,,,,, HARD, 33233000
60,453,,36,3,0.0,150.0,332.00,335.00,336.50,PK," MUDSTONE,CLAYSTONE", GREENISH GREY," BANDING,BURROWS,LAMINAE", UNDEFORMED*,,,,, HARD, 33233000
60,453,,36,4,0.0,150.0,332.00,336.50,338.00,PK," MUDSTONE,SILTSTONE", GREENISH GREY," LAMINAE,CROSS BEDDING, BURROWS", SLIGHTLY DEFORMED*,,,,, HARD, 33233000
60,453,,36,5,0.0,40.0,332.00,338.00,338.40,PK, CRYSTAL CLAYSTONE, DARK GREY, LAMINAE, UNDEFORMED*,,,,, HARD,
60,453,,36,5,40.0,80.0,332.00,338.40,338.80,PK, SILTSTONE, DARK GREY, LAMINAE, UNDEFORMED*,,,,, HARD,
60,453,,36,5,80.0,86.0,332.00,338.80,338.86,PK, SILT--CLAY OR MUDSTONE, DARK GREY," GRADED BEDDING,LAMINAE", UNDEFORMED*,,,,, HARD,
60,453,,36,5,86.0,105.0,332.00,338.86,339.05,PK, CLAYSTONE, DARK GREY," LAMINAE, GRADED BEDDING", UNDEFORMED*,,,,, HARD,
60,453,,36,5,105.0,150.0,332.00,339.05,339.50,PK, SILTY MUDSTONE OR SILTSTONE, DARK GREY, LAMINAE, UNDEFORMED*,,,,, HARD,
60,453,,36,CC,0.0,16.0,332.00,339.60,339.66,PK, SILTSTONE, DARK GREY, BEDDING, UNDEFORMED*,,,,, HARD,
60,453,,37,1,0.0,150.0,341.50,341.50,343.00,PK, MUDSTONE, DARK GREY," BURROWS,LAMINAE", UNDEFORMED*,,,,, HARD,
60,453,,37,2,0.0,44.0,341.50,343.00,343.44,PK, MUDSTONE, DARK GREY,, UNDEFORMED*,,,,, HARD,
60,453,,37,2,44.0,75.0,341.50,343.44,343.75,PK, SILT, LIGHT GREY, CROSS BEDDING, UNDEFORMED*,,,,, FIRM,
60,453,,37,2,75.0,145.0,341.50,343.75,344.45,PK, MUDSTONE, DARK GREY, CROSS BEDDING, UNDEFORMED*,, VOLCANIC GLASS,,, HARD,
60,453,,37,2,145.0,150.0,341.50,344.45,344.50,PK, CLAYSTONE, DARK GREY, CROSS BEDDING, UNDEFORMED*,,,,, HARD,
60,453,,37,3,0.0,150.0,341.50,344.50,346.00,PK, CLAYSTONE, GREY, LAMINAE, UNDEFORMED*,,,,, HARD,
60,453,,37,4,0.0,50.0,341.50,346.00,346.50,PK, CLAYSTONE, GREY, LAMINAE, UNDEFORMED*,,,,, HARD,
60,453,,37,4,50.0,93.0,341.50,346.50,346.93,PK, SILTY MUDSTONE, GREENISH GREY, LAMINAE, UNDEFORMED*,,,,, HARD,
60,453,,37,4,93.0,150.0,341.50,346.93,347.50,PK, SILTSTONE, GREENISH GREY,, UNDEFORMED*,,,,, HARD, 33235000
60,453,,37,5,0.0,43.0,341.50,347.50,347.93,PK, SANDSTONE, GREENISH GREY," BURROWS,LAMINAE", UNDEFORMED*,,,,, HARD,
60,453,,37,5,43.0,89.0,341.50,347.93,348.39,PK, MUDSTONE, GREENISH GREY, LAMINAE, UNDEFORMED*,,,,, HARD, 33233000
60,453,,37,CC,0.0,20.0,341.50,348.49,348.59,PK, SILTY MUDSTONE, GREENISH GREY, LAMINAE, UNDEFORMED*,,,,, HARD, 33233000
60,453,,38,1,0.0,20.0,351.00,351.00,351.20,PK, MUDSTONE, GREENISH GREY,, UNDEFORMED*,,,,, HARD, 33233000
60,453,,38,1,20.0,25.0,351.00,351.20,351.25,PK, SILTSTONE, GREENISH GREY, CROSS BEDDING, UNDEFORMED*,,,,, HARD, 33235000
60,453,,38,1,25.0,48.0,351.00,351.25,351.48,PK, MUDSTONE, GREENISH GREY, CROSS BEDDING, UNDEFORMED*,,,,, HARD, 33233000
60,453,,38,1,48.0,51.0,351.00,351.48,351.51,PK, SILTSTONE, GREENISH GREY, LAMINAE, UNDEFORMED*,,,,, HARD, 33235000
60,453,,38,1,51.0,142.0,351.00,351.51,352.42,PK, MUDSTONE, GREENISH BLACK,, UNDEFORMED*,,,,, HARD, 33233000
60,453,,38,1,142.0,150.0,351.00,352.42,352.50,PK," SILTY MUDSTONE,SILTSTONE", GREENISH BLACK, LAMINAE, UNDEFORMED*,,,,, HARD, 33233000
60,453,,38,2,0.0,150.0,351.00,352.50,354.00,PK, MUDSTONE, DARK GREY,, SLIGHTLY DEFORMED*,,,,, HARD, 33233000
60,453,,38,CC,0.0,30.0,351.00,354.10,354.30,PK," MUDSTONE,SILTSTONE", DARK GREY,, SLIGHTLY DEFORMED*,,,,, HARD, 33233000
60,453,,39,1,0.0,20.0,360.50,360.50,360.70,PK, SILTY MUDSTONE, GREENISH GREY," LAMINAE,CROSS BEDDING", UNDEFORMED*,,,,, HARD, 33233000
60,453,,39,1,20.0,35.0,360.50,360.70,360.85,PK, SILTSTONE, GREENISH GREY," LAMINAE,CROSS BEDDING", UNDEFORMED*,,,,, HARD, 33235000
60,453,,39,1,35.0,41.0,360.50,360.85,360.91,PK, GRADED SILT TO FINE SAND, OLIVE GREY, CROSS BEDDING, UNDEFORMED*,,,,, SOFT,
60,453,,39,1,41.0,70.0,360.50,360.91,361.20,PK, MUDSTONE, GREENISH GREY, BURROWS, UNDEFORMED*,,,,, HARD,
60,453,,39,1,70.0,105.0,360.50,361.20,361.55,PK," MUDSTONE,CLAYSTONE", GREENISH GREY, LAMINAE, UNDEFORMED*,,,,, HARD,
60,453,,39,1,105.0,150.0,360.50,361.55,362.00,PK, MUDSTONE, GREENISH GREY," LAMINAE,BURROWS", UNDEFORMED*,,,,, HARD, 33233000
60,453,,39,2,0.0,23.0,360.50,362.00,362.23,PK, MUDSTONE, GREENISH GREY, BURROWS, UNDEFORMED*,,,,, HARD, 33233000
60,453,,39,2,23.0,150.0,360.50,362.23,363.50,PK, CLAYSTONE, GREENISH GREY," LAMINAE,BURROWS", UNDEFORMED*,,,,, HARD,
60,453,,39,3,0.0,51.0,360.50,363.50,364.01,PK, CLAYSTONE, GREENISH GREY," LAMINAE,BURROWS", UNDEFORMED*,,,,, HARD,
60,453,,39,3,51.0,83.0,360.50,364.01,364.33,PK, SILTSTONE, OLIVE GREY," LAMINAE,BURROWS", UNDEFORMED*,,,,, HARD, 33235000
60,453,,39,3,83.0,105.0,360.50,364.33,364.55,PK, VERY FINE SAND, OLIVE GREY," LAMINAE,CROSS BEDDING", UNDEFORMED*,,,,, SOFT,
60,453,,39,3,105.0,110.0,360.50,364.55,364.60,PK, FINE SAND, OLIVE GREY,, UNDEFORMED*,, ZEOLITE,,, SOFT, 33214000
60,453,,39,3,110.0,150.0,360.50,364.60,365.00,PK, MUDSTONE, GREENISH GREY, BEDDING, UNDEFORMED*,,,,, HARD,
60,453,,39,4,0.0,93.0,360.50,365.00,365.93,PK, MUDSTONE, GREENISH GREY," BEDDING,BURROWS", SLIGHTLY DEFORMED*,,,,, HARD, 33233000
60,453,,39,4,93.0,98.0,360.50,365.93,365.98,PK, SILTSTONE,,, SLIGHTLY DEFORMED*,, VOLCANIC GLASS,,, HARD,
60,453,,39,4,98.0,142.0,360.50,365.98,366.42,PK, MUDSTONE, GREENISH GREY, LAMINAE, SLIGHTLY DEFORMED*,,,,, HARD, 33233000
60,453,,39,5,0.0,75.0,360.50,366.50,367.25,PK, SILTY MUDSTONE, GREENISH GREY," LAMINAE,BANDING", UNDEFORMED*,,,,, HARD, 33233000
60,453,,39,CC,0.0,22.0,360.50,367.35,367.47,PK, SILTY MUDSTONE, GREENISH GREY, LAMINAE, UNDEFORMED*,,,,, HARD, 33233000
60,453,,40,1,0.0,150.0,370.00,370.00,371.50,PK, MUDSTONE, GREENISH GREY," LAMINAE,BURROWS,BANDING", UNDEFORMED*,,,,, HARD, 33233000
60,453,,40,2,0.0,150.0,370.00,371.50,373.00,PK, MUDSTONE, GREENISH GREY," LAMINAE,BURROWS", UNDEFORMED*,,,,, HARD, 33233000
60,453,,40,3,0.0,146.0,370.00,373.00,374.46,PK, MUDSTONE TO SILTY MUDSTONE, GREENISH GREY," LAMINAE,BURROWS", SLIGHTLY DEFORMED*,, VOLCANIC GLASS,,, HARD, 33233000
60,453,,40,4,0.0,82.0,370.00,374.50,375.32,PK, SILTY MUDSTONE TO SILTSTONE, GREENISH GREY," LAMINAE,BURROWS", SLIGHTLY DEFORMED*,,,,, HARD, 33233000
60,453,,40,CC,0.0,25.0,370.00,375.42,375.57,PK, MUDSTONE TO SILTSTONE, GREENISH GREY," LAMINAE,BURROWS", SLIGHTLY DEFORMED*,,,,, HARD, 33233000
60,453,,41,1,10.0,150.0,379.50,379.60,381.00,PK, ZEOLITIC MUDSTONE, GREENISH GREY," BURROWS,LAMINAE,BEDDING", UNDEFORMED*,, ZEOLITES,,, HARD,
60,453,,41,2,0.0,150.0,379.50,381.00,382.50,PK, MUDSTONE, GREENISH GREY," BURROWS,LAMINAE,BEDDING", UNDEFORMED*,, ZEOLITES,,, HARD, 33233000
